status_id,status_message,link_name,status_type,status_link,status_published,num_reactions,num_comments,num_shares,num_likes,num_loves,num_wows,num_hahas,num_sads,num_angrys
1146656498733605_1338247836241136,"""But wait, there's more! It seems that someone also got Milo's bus! In one hilarious tweet, someone outed the location of Milo's tacky ass vehicle where he looks like Marilyn Manson from 10 years ago and said, ""People, he's not that cool. He's staying at the Courtyard Marriot in Fremont. This is in the parking lot.""","Fremont, CA: Milo's Bus Vandalized As Alt-Right Troll Laughed Out of Bay Area - IT'S GOING DOWN",link,https://itsgoingdown.org/fremont-ca-milos-bus-vandalized-alt-right-troll-laughed-bay-area/,2017-02-03 02:02:06,316,14,54,232,33,1,50,0,0
1146656498733605_1338116849587568,"""People have talked a lot about the normalization of bigotry these last few weeks. We must counter any tolerance for white supremacist ideologies by normalizing a militant response: if you try to come to our communities openly advocating harm to us, our neighbors, family, friends or others in our community, then you will be driven out. The broken windows in Berkeley were an act of self-defense. More than that, the shattered glass and canceled speech sends a clear message of solidarity to those targeted by Milo's bigotry. We will not sit idly by as you are dehumanized and targeted. Above all, we will not tolerate white supremacy in our communities.""",Community Defense In The Age of Trump: Berkeley Shut Down Milo - IT'S GOING DOWN,link,https://itsgoingdown.org/community-defense-age-trump-berkeley-shut-milo/,2017-02-02 22:25:47,148,12,50,129,19,0,0,0,0
1146656498733605_1338045286261391,#Olympia banner drop in solidarity with #NoDAPL,No DAPL and GJ Resistance Banner Drop Olympia WA - IT'S GOING DOWN,link,https://itsgoingdown.org/no-dapl-gj-resistance-banner-drop-olympia-wa/,2017-02-02 21:01:53,20,1,2,17,3,0,0,0,0
1146656498733605_1338039776261942,"#Oakland, police shut down 'The Promised Land,' a DIY homeless sober community village in the middle of winter and during burgeoning homeless and housing crisis.",Oakland: Police Destroy 'The Promised Land' Community Village - IT'S GOING DOWN,link,https://itsgoingdown.org/oakland-police-destroy-promised-land-community-village/,2017-02-02 20:52:14,67,2,30,18,0,0,0,6,43
1146656498733605_1338023332930253,Report back of encounters between anti-fascists and Alt-Right 'Proud Boys.',No Tolerance in the Bay: A Few Less Proud Boys - IT'S GOING DOWN,link,https://itsgoingdown.org/no-tolerance-bay-less-proud-boys/,2017-02-02 20:26:11,116,2,37,99,14,1,2,0,0
1146656498733605_1336920066373913,"Riots, fires, and clashes have broken out against Alt-Right speaker, Milo at UC Berkeley. Thousands have converged against the far-Right speaker, who came to Berkeley to target immigrant students. Includes livestream and social media round up.",Berkeley: Clashes Break Out Against Alt-Right and Milo - IT'S GOING DOWN,link,https://itsgoingdown.org/berkeley-clashes-break-alt-right-milo/,2017-02-01 21:34:43,385,28,408,303,68,4,4,0,6
1146656498733605_1336847699714483,"""Below are two PDFs for decentralized printing and distribution during the ongoing struggle against the ban and the wall. On the one hand, these are a little late, relative to last weekend's major clashes. On the other hand, it's obvious that this conflict will continue for many years; indeed, until the destruction of borders and nations. Til then, let's do more than just tag along for liberal illusions of ""the inclusive national community"" and instead share more radical analyses.""",Poster and Flyer for Distribution in No Wall/No Ban Struggle - IT'S GOING DOWN,link,https://itsgoingdown.org/poster-flyer-distribution-no-wallno-ban-struggle/,2017-02-01 19:42:13,28,1,12,27,1,0,0,0,0
1146656498733605_1336846596381260,"Call for emergency solidarity with anarchist prisoner, Sean Swain.",Call for Emergency Solidarity with Sean Swain - IT'S GOING DOWN,link,https://itsgoingdown.org/call-emergency-solidarity-sean-swain/,2017-02-01 19:39:41,15,0,3,13,2,0,0,0,0
1146656498733605_1336808029718450,"""Earlier today, inmates demanding better living conditions took over a wing of the James T. Vaughn Correctional Center in Delaware along with several hostages, as the State responded with a massive police mobilization. Vaughn is a maximum security prison holding more than 2,500 people, including people on death row. The wing that prisoners have taken over holds at least 150 people. Somewhere between 3 and 5 guards have been taken hostage, and there are reports that both guards and prisoners have been injured. All of Delaware's prisons have been placed on lockdown as a result of the uprising, although Vaughn is currently the only site of resistance.""",#VaughnRebellion: Prisoners Take Control of James T. Vaughn Correctional Center in Delaware - IT'S GOING DOWN,link,https://itsgoingdown.org/vaughnrebellion-prisoners-take-control-james-t-vaughn-correctional-center-delaware/,2017-02-01 18:26:56,75,2,69,65,8,2,0,0,0
1146656498733605_1336787139720539,"""What could have been a successful overnight occupation ended with many of us being arrested, almost all of us being pepper sprayed and everyone left being brutalized, pushed down the escalators while being pepper sprayed and many of them being blocked from their cars. The worst part is, is that what we were doing was WORKING. Our occupation was being used as leverage by the lawyers of the detained people and it was much more likely to be successful with more people that could have secured the place longer.""",Accounts of Police Brutality and Socialist Alternative Co-option at SeaTac #MuslimBan Protest - IT'S GOING DOWN,link,https://itsgoingdown.org/collected-accounts-seatac-muslimban-protest/,2017-02-01 17:48:02,49,5,53,28,0,1,0,3,17
1146656498733605_1336740136391906,"""In the first few hours of February 1st, individuals in Hamilton, Ontario answered the call to be ungovernable in resistance to the Dakota Access Pipeline and the secretive Grand Jury deliberating on the fate of Water Protectors south of us. It is imperative that we continue to show solidarity inside and outside of the legal system as the State's strategy will always be divide and conquer. As those who seek to poison the Earth and profit from her exploitation attempt to secure their place in power, those of us with capacity to resist must seize the opportunity. We need not (& must not) choose one avenue for action, but pursue all of them in all ways. Today, we resist the Dakota Access Pipeline and ALL pipelines by hitting the banks who fund them – specifically TD Canada Trust – where it hurts. Which we interpreted to mean literally hitting their ATMs with hammers… and jamming up the card slot with spray foam. Tomorrow, we make our voices heard that Muslim refugees are welcome here. Friday, we go Nazi punching.""
#NoDAPL #StandingRock",Hamilton Hammers Back: Solidarity with #NODAPL - IT'S GOING DOWN,link,https://itsgoingdown.org/hamilton-hammers-back-solidarity-nodapl/,2017-02-01 16:36:30,14,0,8,12,2,0,0,0,0
1146656498733605_1336734156392504,DAPL and police forces appear to be gearing up for raid. Supporters needed. #NoDAPL #StandingRock,DAPL and Police Forces Amass In Potential Raid of Standing Rock; Water Protectors Needed - IT'S GOING DOWN,link,https://itsgoingdown.org/raid-standing-rock-support-needed/,2017-02-01 16:28:07,15,0,46,11,0,0,0,2,2
1146656498733605_1336198319779421,"On Wednesday, thousands of people will converge to shut down Milo Yiannopoulos, one of the biggest mainstreamers of both the Alt-Right, Islamophobia, and anti-feminism. Milo is also choosing #Berkeley as the launch pad for his campaign against sanctuary campuses and intends to drum up support for deporting undocumented students. As this article shows, Milo's ""Dangerous Faggot"" tour has also highlighted the deep crossover between College Republican groups and the white supremacist Alt-Right, and in Seattle, an Alt-Right Milo supporter even shot an anti-fascist protester. Meanwhile in Berkeley, the #BerkeleyCollegeRepublicans even invited a Neo-Nazi organizer from Identity Evropa to livestream from their booth on January 20th at UC Berkeley. Clearly, the far-Right is forming alliances and drawing lines. Which ones will you draw? #Antifa",Everything You Need to Know About Milo and the Alt-Right in Berkeley - IT'S GOING DOWN,link,https://itsgoingdown.org/everything-need-know-about-milo-alt-right-berkeley/,2017-02-01 02:24:37,108,16,99,76,1,1,1,0,29
1146656498733605_1335951183137468,"""Many people forget that fascism, particularly when looking early on in Italy and Spain, was not this monolithic thing with complete ideological conformity and free of political factions that had their own ideas and, sometimes, their own base. Early Italian fascism included artistic intellectuals, former syndicalists and socialists who rejected internationalism, demobilized soldier groups and rural business interests. In the case of Spain, the actual fascists were a junior partner in the nationalist uprising, out-muscled and out-influenced by the anti-Left military brass, Catholic establishment, authoritarian conservatives and capitalists. All of these different factions maneuvered for power within this broader coalition, with their fortunes rising and falling at different times. In German National Socialism, most of these factions were violently liquidated as the party reached the heights of power.

With this in mind, I think we should start looking at the Trump administration as a popular front of nearly every segment of the right-wing.""",A Popular Front of the Right? - IT'S GOING DOWN,link,https://itsgoingdown.org/popular-front-right/,2017-01-31 19:50:16,41,4,29,36,0,0,0,1,4
1146656498733605_1335948393137747,"""A first step to collective liberation in this sense would be to stop believing that we are incapable of governing ourselves. We have to use our historical memory to understand that the greatest threat to this white supremacist, global, military-political economy has never been communism, terrorism, or narcotics, but rather the greatest threat to all forms of capitalist imperialism has always been grassroots community-based organizing for self-determination, self-defense, and autonomy. This was the threat posed by Native Americans during the occupation of the Americas by Europeans. This is the threat that was posed by slave rebellions. This is the threat posed by the Black Panthers, the American Indian Movement, the Young Lords, the Latin Kings, the Chicano movement, Puerto Rican Independentistas, women's liberation groups, anti-fascists, anti-racists or any organized group of people of color, farm workers, women, territorial defenders, workers, or any community or neighborhood struggling for their own self-determination.""",Self Defense Against White Supremacy: Finding a Path Towards Community-Based Self- Determination - IT'S GOING DOWN,link,https://itsgoingdown.org/self-defense-white-supremacy-finding-path-towards-community-based-self-determination/,2017-01-31 19:47:25,26,0,16,23,3,0,0,0,0
1146656498733605_1335943876471532,"""Those present included several known white nationalists, a rifle toting libertarian, middle-aged, confederate flag waving bigots and a number of students. Our unwillingness to tolerate the presence of or to provide a platform for the racist, sexist, xenophobic, body shaming dribble of the fascists and their sympathizers was quickly made known. The burning of an expropriated nazi flag by members of the bloc shortly after sundown started a chain reaction of resistance to the presence of any fascists within the demo that extended beyond the bloc. One of the major victories of the night was helping questioning liberals off of the fence and into the fight.""",Report Back: Milo Resistance at CU Boulder - IT'S GOING DOWN,link,https://itsgoingdown.org/report-back-milo-resistance-cu-boulder/,2017-01-31 19:43:16,96,7,65,83,13,0,0,0,0
1146656498733605_1335930283139558,"""If the above doesn't make it abundantly clear WHY you should leave it at home, imagine the terror you feel when you hand someone your phone to show them a picture and they start swiping left or right. Now imagine The State swiping through your pictures. Hopefully we've convinced you! Information security (abbreviated to InfoSec because it sounds cooler) can seem intimidating, but it's as easy as trading away some of your own convenience in exchange for obstructing the Panopticon of State/LEO/reactionary forces that seek to undermine your project. This document is not a deep dive into any of the topics covered. Devices and software exist in a state of flux, and what is considered secure now will likely be obsolete within months, weeks, or days of writing this. It is up to you to stay vigilant and informed.""",YOUR PHONE IS A COP: An OpSec/InfoSec Primer for the Dystopian Present - IT'S GOING DOWN,link,https://itsgoingdown.org/phone-cop-opsecinfosec-primer-dystopian-present/,2017-01-31 19:33:27,62,4,76,62,0,0,0,0,0
1146656498733605_1334729189926334,"""By the time we made it to Depot Park, the news that we were an assembly against a Nazi run on Whitefish had spread through the town and we received honks of approval, thumbs up and raised fists from drivers and pedestrians alike as we set up on the corner in front of the Parks and Recreation office. There were several residents who approached IWW/GDC members expressing their appreciation that our union, which is a prominent fixture in the history of Montana, was standing with them against the fascist outsiders. One older gentleman even mentioned that his father had been a Wobbly and now he was considering joining up. Another approached us slowly in his truck, mean-mugging out the window and yelled out to us ""yeah, they're all a bunch of cowards, didn't even show! Good to see you out here. My old special forces buddies and I have been out all morning looking for them!""

#RichardSpencer #Antifa #Montana #Whitefish",Knocking on Richard Spencer's Door: Montana Antifa Out Organizes Nazis - IT'S GOING DOWN,link,https://itsgoingdown.org/knocking-richard-spencers-door-montana-antifa-organizes-nazis/,2017-01-30 13:17:01,197,1,159,165,32,0,0,0,0
1146656498733605_1334681789931074,Prisoners are Holman prison have been gassed by a CertTeam after organizing a protest against poor conditions and a crackdown on basic rights. Please call in order get the guards to open up the vents and allow prison rebels to breathe!,"CertTeam Gasses Protest at Holman Against Horrific Conditions, Calls Needed! - IT'S GOING DOWN",link,https://itsgoingdown.org/holman-gasses-protest-holman-prison-calls-needed/,2017-01-30 12:20:16,14,0,33,9,0,0,0,1,4
1146656498733605_1334334633299123,#Vancouver #Antifa anti-nazi demo report back.,Vancouver Antifa Report Back New Westminster Antifascist Rally - IT'S GOING DOWN,link,https://itsgoingdown.org/vancouver-antifa-report-back-new-westminster-antifascist-rally/,2017-01-30 01:46:53,22,0,5,19,3,0,0,0,0
1146656498733605_1334323266633593,#NoDAPL means no surrender!,#NoDAPL Means NO SURRENDER - IT'S GOING DOWN,link,https://itsgoingdown.org/nodapl-means-no-surrender/,2017-01-30 01:06:44,40,0,23,34,6,0,0,0,0
1146656498733605_1334216976644222,"""In true proto-fascist fashion, Trump is also hoping to play up the reality that with racist repression (as with massive resource extraction projects), also comes jobs; 'good jobs' that are part of police associations which are also loyal to Trump himself. In this way, Trump can to a small degree, begin to make ""a new deal"" for at least part of the working-class that is willing to take part in his attempt to redefine who is included, and who excluded.

There is no going back to normal. Either they win, or we do."" 

#MuslimBan #MuslimBanProtests #RefugeesWelcome #NoWallNoBan",Bannon and Trump's 'Muslim Ban' Part of Wider Strategy for Mass Crackdown - IT'S GOING DOWN,link,https://itsgoingdown.org/bannon-trump-mass-crackdown/,2017-01-29 21:55:14,259,15,202,187,4,2,0,3,63
1146656498733605_1334136556652264,"Social media roundup of 2nd day of #Muslimban protests that are taking place across the US, shutting down airports, and facing repression from the police. #Muslimbanprotest",IGD: Shutdowns of Airports Continue Against Draconian Anti-Immigrant Ban - IT'S GOING DOWN,link,https://itsgoingdown.org/igd-shutdowns-airports-continue-draconian-anti-immigrant-ban/,2017-01-29 19:48:28,37,0,15,30,7,0,0,0,0
1146656498733605_1334135639985689,Report back from #Chicago on the 1st night of protests against #Muslimban.,#NoBanNoWall: A Report Back From Chicago's Protest of Trump's #MuslimBan - IT'S GOING DOWN,link,https://itsgoingdown.org/nobannowall-report-back-chicagos-protest-trumps-muslimban/,2017-01-29 19:47:32,13,1,5,9,4,0,0,0,0
1146656498733605_1333589980040255,#Seattle police have now begun violently arresting and pepper spraying the crowd at SeaTac airport. #SeaTacProtest. Check out a livestream and updated social media roundup.,IGD: Protests Breakout at Airports Against Trump's Immigration Ban - IT'S GOING DOWN,link,https://itsgoingdown.org/igd-protests-breakout-airports-trumps-immigration-ban/,2017-01-29 02:50:33,66,2,69,32,0,7,1,0,26
1146656498733605_1333423413390245,Protests are breaking out at airports across the US against Trump's #MuslimBan. Check out our roundup here!,IGD: Protests Breakout at Airports Against Trump's Immigration Ban - IT'S GOING DOWN,link,https://itsgoingdown.org/igd-protests-breakout-airports-trumps-immigration-ban/,2017-01-28 21:17:54,110,2,51,93,14,3,0,0,0
1146656498733605_1330673766998543,"""Over a hundred supporters turned out tonight to stand with Jordan, to stand for worker justice, and to stand with the Burgerville Workers Union. We marched to the Convention Center Burgerville and formed a picket line around the store demanding justice for Jordan. Almost every potential customer respected our picket line, and to quote a worker who attended, ""it was fucking lit AF!""""","Portland, OR: ""Lit AF!"" Over 100 Turn Out to Support Fired IWW Organizer - IT'S GOING DOWN",link,https://itsgoingdown.org/portland-lit-af-100-turn-support-fired-iww-organizer/,2017-01-26 05:20:08,27,0,9,27,0,0,0,0,0
1146656498733605_1329936553738931,Report back from autonomous assembly in #HamptonRoads #Virginia.,"Reportback: An Autonomous Assembly to Organize Resistance in Hampton Roads, VA - IT'S GOING DOWN",link,https://itsgoingdown.org/reportback-autonomous-assembly-organize-resistance-hampton-roads-va/,2017-01-25 13:38:58,7,0,1,7,0,0,0,0,0
1146656498733605_1329934743739112,"Upcoming bay area conference in #Oakland and #SanFrancisco. Revolutionary Organizing Against Racism (ROAR) Conference. Submit a proposal now! 

https://itsgoingdown.org/revolutionary-organizing-racism-conference-roar-march-11th-12th-bay-area/",Revolutionary Organizing Against Racism Conference March 11th & 12th in Bay Area! - IT'S GOING DOWN,link,https://itsgoingdown.org/revolutionary-organizing-racism-conference-roar-march-11th-12th-bay-area/,2017-01-25 13:37:33,14,1,7,14,0,0,0,0,0
1146656498733605_1329932210406032,"""Reflecting on the march and the police response, it was clear that the OPD was not ready for a combative black bloc to persistently take the streets and disregard their orders. Even though the police had prepared snipers on a roof adjacent to the announced route, individual cops seemed timid and scared. Over and over again, officers would approach the march and ask ""Please, move to the sidewalk,"" and over and over again they were met with insults and chants of ACAB. Some officers looked visible shook, while others were obviously not willing to confront the march until backup arrived.""","Omaha, NB: March Report Back - IT'S GOING DOWN",link,https://itsgoingdown.org/omaha-nb-march-report-back/,2017-01-25 13:35:57,24,0,5,19,5,0,0,0,0
1146656498733605_1329047247161195,Uncovering the aftermath of the #PrisonStrike in #Florida,Uncovering the Aftermath of Florida's 2016 Fall Prisoner Uprisings - IT'S GOING DOWN,link,https://itsgoingdown.org/uncovering-aftermath-floridas-2016-fall-prisoner-uprisings/,2017-01-24 20:21:08,7,0,2,7,0,0,0,0,0
1146656498733605_1329042360495017,"ASH Antifa Seven Hills doing a fundraiser for comrades that were attacked and detained in a mass kettle on J20: ""The cowardly pigs simultaneously used motorcycles and bicycles to separate and trap groups of people. Over 200 comrades were detained in a kettle at L & 12th for hours and arrested, whereby female-bodied arrestees were held on school buses, and male-bodied folks in squad cars or vans. Reports from a trans comrade after release indicated she was held in a squad car for SEVEN HOURS with wrists bound behind her back, due to ignorant police and bureaucrats ""not sure what to do."" Shout out to L12 and P.S.L12 for keeping each other strong through the night. Death to baloney sandwiches, fire to the prisons.""

https://itsgoingdown.org/antifa-seven-hills-richmond-va-disruptj20-legal-fund/","Antifa Seven Hills: Richmond, VA #DisruptJ20 Legal Fund - IT'S GOING DOWN",link,https://itsgoingdown.org/antifa-seven-hills-richmond-va-disruptj20-legal-fund/,2017-01-24 20:13:49,19,0,11,15,3,0,0,1,0
1146656498733605_1328736533858933,"""The smashy-smash was on full throttle. I darted back and forth from behind the ""V"" banner to keep checking on my partner, alternating between marching and random acts of mischief. I felt the need to look out for my partner who is smaller in stature and more vulnerable to police punishment. In this moment, I had never felt more free. I was completely lucid. My mouth full of acid. Acute internal rage manifested from years of living under a repressive system (I had no say in creating) and now I felt like it was mine to destroy. Two things had never resonated as clearly with me than in that moment: that destruction can be a creative force and if we want to live in a world that is worth living in then we will have to physically dismantle the structures that casually imprison us moment to moment. The sound of breaking glass had never rang so sonorous. Physically taking up the street brick by brick and hurling them into capitalist infrastructure gives us meaning.""",#DISRUPTJ20 Report Back: The Logan Circle Black Bloc - IT'S GOING DOWN,link,https://itsgoingdown.org/disruptj20-report-back-logan-circle-black-bloc/,2017-01-24 14:44:32,63,1,20,51,11,1,0,0,0
1146656498733605_1328716170527636,#Vancouver #Antifa and Sikh community stand united against KKK. Vancouver Antifa,Vancouver Antifa and Sikh Community Stand United Against KKK - IT'S GOING DOWN,link,https://itsgoingdown.org/vancouver-antifa-sikh-community-stand-united-kkk/,2017-01-24 14:20:43,84,3,26,78,6,0,0,0,0
1146656498733605_1328221243910462,"""No, this breakaway action was remarkable because it exemplified the increasing capabilities that social antagonists have been slowing rebuilding in the past years. This growth has been in quality as well as quantity; the January 20th breakaway certainly outnumbered any other autonomous action in recent memory. Various crews came prepared with their own material contributions, all equally important in the shaping the day's events. Participants both familiar and unfamiliar were able to cooperate quickly and effectively in the street, moving between targets while avoiding police, unprepared as the cops were for any trouble. After the short excursion, everyone was able to safely disperse into the larger rally without incident.""","Minneapolis, MN: Communique from a Breakaway - IT'S GOING DOWN",link,https://itsgoingdown.org/minneapolis-mn-communique-breakaway/,2017-01-24 04:45:24,36,1,5,35,1,0,0,0,0
1146656498733605_1328090643923522,"""We blocked the road as an act of resistance against the violent systems in power, systems that use the police to enforce their unjust laws and inhumane policies. We stood there and did not back down when demanded by the police to demonstrate the potential of people power. The response by the organizers of the women's march was polarizing, to continue creating false dichotomies is to continue supporting a system of tone policing people who are in the right to be angry. Together, we can disrupt the status quo, we can shatter the air of invulnerability that pervades business as usual. Getting arrested was not only a statement of our seriousness and commitment to the struggle against state violence and fascism, but also to show that many effective methods of resisting the brutalities of this world, from white supremacy to patriarchy to the destruction of the earth, fall outside the boundaries of acceptable protest as defined by cops, politicians, and ""respectable citizens"". Ultimately, the road block and arrests don't matter. What truly matters are the conversations that are now happening and the perceptions that are changing. None of us are free until we are all free.""","Power to the People, Not the System: Four Arrested in Rural Eureka - IT'S GOING DOWN",link,https://itsgoingdown.org/power-people-not-system-four-arrested-rural-eureka/,2017-01-24 01:41:33,24,1,24,22,2,0,0,0,0
