status_id,status_message,link_name,status_type,status_link,status_published,num_reactions,num_comments,num_shares,num_likes,num_loves,num_wows,num_hahas,num_sads,num_angrys
1146656498733605_1193628140703107,"Great new podcast from 'Kite Line,' a Midwest podcast on the #PrisonStrike.",Kite Line: National Prison Strike Updates - IT'S GOING DOWN,link,https://itsgoingdown.org/kite-line-national-prison-strike-updates/,2016-09-19 17:52:01,5,0,4,5,0,0,0,0,0
1146656498733605_1193627097369878,Report back from #Philly demonstration in solidarity with #PrisonStrike.,Philadelphia: Analysis of September 9th Prison Strike Noise Demo - IT'S GOING DOWN,link,https://itsgoingdown.org/philadelphia-analysis-september-9th-prison-strike-noise-demo/,2016-09-19 17:50:27,3,0,2,3,0,0,0,0,0
1146656498733605_1193626927369895,"New podcast from Final Straw from Greg Curry, who is still locked up for his participation in the Lucasville Uprising.",Final Straw: Greg Curry of the '93 Lucasville Uprising on the #PrisonStrike - IT'S GOING DOWN,link,https://itsgoingdown.org/final-straw-greg-curry-93-lucasville-uprising-prisonstrike/,2016-09-19 17:49:54,2,0,1,2,0,0,0,0,0
1146656498733605_1193626567369931,IGD is growing all the time! Kick down a donation to help us expand! http://tinyurl.com/zzf3kt4,,status,,2016-09-19 17:48:51,0,0,0,0,0,0,0,0,0
1146656498733605_1193514787381109,"""I write to you knowing that I have more to learn from your centuries of resistance to colonization than I could ever offer you myself. When I talk about land defense, it's on the scale of four thousand acres, not the scale of continents. Yet I see many similarities to a struggle I've been involved in and want to share my reflections in the hope that you can sidestep our mistakes without having to make them yourselves. I don't intend to propose a model, only some thoughts and an invitation to share the questions they provoke with the people around you.""","Open Letter to NoDAPL Struggle, from the ZAD - IT'S GOING DOWN",link,https://itsgoingdown.org/open-letter-nodapl-struggle-zad/,2016-09-19 14:33:58,10,0,16,10,0,0,0,0,0
1146656498733605_1193479460717975,"New amazing video from Submedia about how 'the Left' has by and large abandoned the Syrian Revolution, and how anarchists like Omar Aziz helped to push for the formation of population councils when the state collapsed during the civil war in some areas. Well worth a watch!",Requiem for Syria - IT'S GOING DOWN,link,https://itsgoingdown.org/requiem-for-syria/,2016-09-19 13:59:07,5,1,3,5,0,0,0,0,0
1146656498733605_1193417884057466,"""On September 18, in solidarity with the national prison strike now in its second week, a group of anarchists and others blockaded the road leading to the Correctional Officers Training Academy in Tucson, Arizona, occupied Tohono O'Odham land."" #PrisonStrike",Tucson Blockade of Correctional Officer Training Academny - IT'S GOING DOWN,link,https://itsgoingdown.org/tucson-blockade-correctional-officer-training-academny/,2016-09-19 12:35:50,19,0,16,19,0,0,0,0,0
1146656498733605_1192959930769928,"""As of tonight, the prison strike has entered into its second week. All of the news is pouring in like a tidal wave. The amount of solidarity actions across the world has been a goddamn inspiration to say the least. From graffiti to banner drops, noise demos to nighttime actions, marches to letter writing, the momentum is incredible.""

https://itsgoingdown.org/bloc-party-from-all-sides/",Bloc Party: From All Sides - IT'S GOING DOWN,link,https://itsgoingdown.org/bloc-party-from-all-sides/,2016-09-18 22:59:34,14,0,0,14,0,0,0,0,0
1146656498733605_1192828284116426,"Amazing interview with former political prisoner Luke O'Donovan, who was just released after spending two years in prison. In 2013, Luke was locked up for defending himself against a group of homophobic attackers, and has since been banished from returning to his home in Atlanta, GA. In the interview, Luke discusses his time in prison, navigating the racial politics inside, his thoughts on the current #PrisonStrike and much more. We also present a special interview with several inmates inside Merced County Jail, who discuss the unfolding hunger strike against horrific conditions and brutal guards. Listen and share!",IGDCAST: Ex-Political Prisoner Luke O'Donovan and Merced Hunger-Strikers Speak - IT'S GOING DOWN,link,https://itsgoingdown.org/igdcast-luke-odonavan-merced-hunger-strikers/,2016-09-18 19:49:25,10,0,8,10,0,0,0,0,0
1146656498733605_1192606084138646,More acts of solidarity from #Athens with the #PrisonStrike,Athens: Banner Drops and Protest at Starbucks in Support of Prison Strike - IT'S GOING DOWN,link,https://itsgoingdown.org/athens-banner-drops-protest-starbucks-support-prison-strike/,2016-09-18 13:47:32,14,0,5,14,0,0,0,0,0
1146656498733605_1192600574139197,The drug was was never meant to be ended.,Careerists and Corporate Interest: Despite Endless failure the Drug War will Continue Indefinitely - IT'S GOING DOWN,link,https://itsgoingdown.org/careerists-corporate-interest-despite-endless-failure-drug-war-will-continue-indefinitely/,2016-09-18 13:35:56,5,0,2,5,0,0,0,0,0
1146656498733605_1192600130805908,Resistance against #NoDAPL spreads as construction in part halts.,Federal Appeals Court Halts Dakota Access Segment as Solidarity Protests Spread Nationwide - IT'S GOING DOWN,link,https://itsgoingdown.org/federal-appeals-court-halts-dakota-access-segment-solidarity-protests-spread-nationwide/,2016-09-18 13:34:35,1,0,1,1,0,0,0,0,0
1146656498733605_1192555980810323,Bash Back! book now free: http://libcom.org/library/queer-ultraviolence-bash-back-anthology,Queer ultraviolence: Bash Back! anthology,link,http://libcom.org/library/queer-ultraviolence-bash-back-anthology,2016-09-18 12:47:04,9,0,13,9,0,0,0,0,0
1146656498733605_1192520864147168,https://itsgoingdown.org/utah-land-defenders-support-standing-rock-red-warrior-camp/,Utah Land Defenders Support Standing Rock and Red Warrior Camp! - IT'S GOING DOWN,link,https://itsgoingdown.org/utah-land-defenders-support-standing-rock-red-warrior-camp/,2016-09-18 12:07:51,3,0,2,3,0,0,0,0,0
1146656498733605_1192014140864507,Donate to IGD today! Help sustain us and keep us going. http://tinyurl.com/hv6o6j4,"Online Payment, Merchant Account - PayPal",link,http://tinyurl.com/hv6o6j4,2016-09-17 22:05:44,2,0,0,2,0,0,0,0,0
1146656498733605_1192003604198894,New address for Janye Waller and a new flyer to hand out about how to support him.,Janye Waller: An Update and a New Support Flyer! - IT'S GOING DOWN,link,https://itsgoingdown.org/janye-waller-update-new-support-flyer/,2016-09-17 21:50:18,6,0,10,6,0,0,0,0,0
1146656498733605_1191982377534350,"""Before dawn on September 13, at 3:30am, two explosive-incendiary devices were placed on two police vehicles at a police substation located in the Rio de Luz neighborhood in Ecatepec de Morelos, State of Mexico.""",Mexico: Explosive-Incendiary Sabotage of Police Vehicles in Ecatepec - IT'S GOING DOWN,link,https://itsgoingdown.org/mexico-explosive-police-ecatepec/,2016-09-17 21:07:46,7,1,3,6,1,0,0,0,0
1146656498733605_1191900917542496,#Portland city officials played up fears of #PrisonStrike.,Portland: Multnomah County Cry Baby Campaign Against Sept. 9th Demo - IT'S GOING DOWN,link,https://itsgoingdown.org/portland-multnomah-county-cry-baby-campaign-sept-9th-demo/,2016-09-17 18:09:35,1,0,0,1,0,0,0,0,0
1146656498733605_1191900327542555,"#BoycottDriscolls still on, say strikers in Mexico.",We Clarify and Reiterate the Driscoll's Boycott is in Full Force - IT'S GOING DOWN,link,https://itsgoingdown.org/clarify-reiterate-driscolls-boycott-full-force/,2016-09-17 18:08:55,12,0,8,12,0,0,0,0,0
1146656498733605_1191770120888909,"Free Alabama Movement (FAM) speaks to ongoing tension at Holman Prison, as prison guard dies and guards are quitting left and right. #PrisonStrike",EMERGENCY ALERT: Free Alabama Movement Press Release for Holman Prison - IT'S GOING DOWN,link,https://itsgoingdown.org/emergency-alert-free-alabama-movement-press-release-holman-prison/,2016-09-17 13:51:27,26,0,76,26,0,0,0,0,0
1146656498733605_1191765077556080,#Denver banner drops and noise demonstrations continue into second week of #PrisonStrike,Denver: Banner Drops and Noise Demos as Strike Enters Second Week - IT'S GOING DOWN,link,https://itsgoingdown.org/denver-banner-drops-noise-demos-strike-enters-second-week/,2016-09-17 13:41:39,4,0,1,4,0,0,0,0,0
1146656498733605_1191764807556107,#RhodeIsland noise demonstration in solidarity with #PrisonStrike,Rhode Island: IWW Prison Strike Solidarity Demo at ACI - IT'S GOING DOWN,link,https://itsgoingdown.org/rhode-island-iww-prison-strike-solidarity-demo-aci/,2016-09-17 13:41:07,10,0,2,10,0,0,0,0,0
1146656498733605_1191199590945962,Podcast and Video version of 'Bern Notice.',Bern Notice: Podcast and Video from Resonance - IT'S GOING DOWN,link,https://itsgoingdown.org/bern-notice-podcast-video-resonance/,2016-09-16 21:34:55,4,2,7,4,0,0,0,0,0
1146656498733605_1191133384285916,#PrisonStrike resistance updated daily!,#PrisonStrike Resistance to Slavery Across the World - IT'S GOING DOWN,link,https://itsgoingdown.org/prisonstrike-resistance-to-slavery-across-the-world/,2016-09-16 19:51:55,2,0,0,2,0,0,0,0,0
1146656498733605_1191132657619322,"Please donate to keep IGD alive and thrashing!

https://itsgoingdown.org/donate/",Donate - IT'S GOING DOWN,link,https://itsgoingdown.org/donate/,2016-09-16 19:50:25,0,0,0,0,0,0,0,0,0
1146656498733605_1191119410953980,"""The more recent national White Lives Matter (WLM) movement is starting to make these lines much clearer for us, while also clarifying that the left is not prepared to deal with them. WLM is a response to the BLM movement and became emboldened after the Dallas and New Orleans shootings of police officers. Unlike these open carry and anti-immigrant groupings, the WLM movement's aim is to create an organized ""self-defense"" group against BLM activists who they see as violent and dangerous. They are trying to intimidate black activists while developing a white separatist and ""self-defense"" group against these black movements. The WLM movement shows us that the right is becoming more politically developed and more organized.""",'White Lives Matter' Building Armed Force in Texas - IT'S GOING DOWN,link,https://itsgoingdown.org/white-lives-matter-building-armed-force-texas/,2016-09-16 19:23:46,5,0,9,3,0,0,0,0,2
1146656498733605_1191110097621578,Neo-Nazi posters put to the torch in #Oakland by #Antifa.,Oakland: Identity Evropa Posters Put to the Torch - IT'S GOING DOWN,link,https://itsgoingdown.org/oakland-identity-evropa-posters-put-torch/,2016-09-16 19:03:04,12,2,0,11,1,0,0,0,0
1146656498733605_1190930657639522,#Greece #PrisonStrike,Athens: Banner in Solidarity with the #PrisonStrike in the US - IT'S GOING DOWN,link,https://itsgoingdown.org/athens-banner-solidarity-prisonstrike-us/,2016-09-16 14:00:39,7,0,2,7,0,0,0,0,0
1146656498733605_1190929680972953,#PrisonStrike,Bristol: Vandalism of Various Prison Workers Property - IT'S GOING DOWN,link,https://itsgoingdown.org/bristol-vandalism-various-prison-workers-property/,2016-09-16 13:59:55,12,0,5,12,0,0,0,0,0
1146656498733605_1190929320972989,#Seattle #PrisonStrike,Seattle: DOC office attacked - IT'S GOING DOWN,link,https://itsgoingdown.org/seattle-doc-office-attacked/,2016-09-16 13:59:25,6,3,17,6,0,0,0,0,0
1146656498733605_1190312307701357,"Over 100 prisoners have gone on hunger-strike starting September 9th, demanding the firing of a brutal guard, access to basic food, and an end to solitary confinement at two county jail facilities in Merced, CA. At these jails, guards make violent raids, injure inmates with projectile weapons, and suicide is common. In response to the strike, jail officials have threatend to shoot inmates and locked the facility down, shutting off phone access to the outside. We need you to get this story out! #PrisonStrike",IGDCAST: Prisoners Launch Hunger-Strike Inside Merced's Concrete Hell - IT'S GOING DOWN,link,https://itsgoingdown.org/igdcast-prisoners-launch-hunger-strike-inside-merceds-concrete-hell/,2016-09-15 19:51:02,40,1,129,35,0,2,0,0,3
1146656498733605_1190232624375992,#Philadelphia action in solidarity with #PrisonStrike,Philadelphia: UPS Box Vandalized in Solidarity with Strike - IT'S GOING DOWN,link,https://itsgoingdown.org/philadelphia-ups-box-vandalized-solidarity-strike/,2016-09-15 17:06:21,2,0,3,2,0,0,0,0,0
1146656498733605_1190073244391930,Help IGD meet our fundraising goal for the end of the month! Please donate. https://itsgoingdown.org/donate/,Donate - IT'S GOING DOWN,link,https://itsgoingdown.org/donate/,2016-09-15 12:34:20,0,0,1,0,0,0,0,0,0
1146656498733605_1190067311059190,Treesits begin in California to stop clearcutting.,Strawberry Rock Forest Defenders Set Up Treesit to Fight Clearcutting in California's Forests - IT'S GOING DOWN,link,https://itsgoingdown.org/strawberry-rock-forest-defenders-set-treesit-fight-clearcutting-californias-forests/,2016-09-15 12:25:59,5,0,6,5,0,0,0,0,0
1146656498733605_1189670181098903,"""We made noise, we chanted, and we successfully ruined a business day at TCI. We can speculate from their taped off entrances and closed warehouse door that nothing was distributed yesterday. In the end, our work has only begun. We are aware of 4 units on lockdown, and information will start to become more available in the oncoming days and weeks. This is a huge moment in prisoner resistance. We hope everyone can get plugged in to the best of their capabilities, and we will continue to do our part to help facilitate that in Austin.""",Austin: ABC shuts down the TCI Showroom - IT'S GOING DOWN,link,https://itsgoingdown.org/austin-abc-shuts-tci-showroom/,2016-09-14 23:09:42,6,0,1,5,1,0,0,0,0
1146656498733605_1189593924439862,"""How did this happen in a city notorious for it's standing army of 40,000 police and its wealthy, stultified leftist liberals? On the one hand, over the last few years multiple anarchist and other militant groups have been building deliberately and concertedly: some cutting their teeth in the streets, others in discussions and organizing projects. Regardless of the strategy, the important point is that these groups are all coming up under the banner of revolution: their purpose is to act on whatever front is available and most efficacious in the moment, towards the final goal of total annihilation of the status quo. On the other, the state itself is digging its own grave. With every egregious act of violence and every dismissed conviction of a killer cop, they affirm to those watching that their sole purpose is the maintenance of oppressive relations and institutions. The wider acknowledgement of the irredeemable nature of the contemporary plantation was evidenced in the recent occupation of City Hall Park, which was held under the banner of police abolition, rather than the typical liberal promotion of reformation.""",NYC Anarchist Action Communique: A Fire The Cannot Be Contained - IT'S GOING DOWN,link,https://itsgoingdown.org/nyc-anarchist-action-communique-fire-cannot-contained/,2016-09-14 20:26:45,15,0,8,14,1,0,0,0,0
1146656498733605_1189560681109853,"Native resistance camps, IWWs on singing strike, riots in Tampa, #antifa news and updates, armed marches for #DarrenSeals and much more!",All The News You Didn't Even Know Was Going Down - IT'S GOING DOWN,link,https://itsgoingdown.org/news-didnt-even-know-going-septmid/,2016-09-14 19:27:14,9,0,5,9,0,0,0,0,0
1146656498733605_1189448561121065,"Support revolutionary autonomous media! Keep IGD alive and thriving. Make a donation today as a one time donation or better yet, a monthly sustainer. Every bit helps!

https://itsgoingdown.org/donate/",Donate - IT'S GOING DOWN,link,https://itsgoingdown.org/donate/,2016-09-14 16:04:22,0,0,1,0,0,0,0,0,0
1146656498733605_1189407897791798,"At least 29 facilities affected, tens of thousands of prisoners did not work, thousands of people in the streets, solidarity actions happening across the world. This is just the start. #PrisonStrike",#PrisonStrike Was Huge and It Is Continuing - IT'S GOING DOWN,link,https://itsgoingdown.org/prisonstrike-huge-continuing/,2016-09-14 14:55:13,38,1,26,34,4,0,0,0,0
1146656498733605_1188703147862273,"Updated roundup of #PrisonStrike actions and news from the inside, outside, and around the world!",#PrisonStrike Resistance to Slavery Across the World - IT'S GOING DOWN,link,https://itsgoingdown.org/prisonstrike-resistance-to-slavery-across-the-world/,2016-09-13 17:30:22,2,0,5,2,0,0,0,0,0
1146656498733605_1188685287864059,Unicorn Riot journalists arrested today covering #NoDAPL resistance.,20 Arrested During #NoDAPL Lockdown; Including 2 Unicorn Riot Journalists - IT'S GOING DOWN,link,https://itsgoingdown.org/20-arrested-nodapl-lockdown-including-2-unicorn-riot-journalists/,2016-09-13 16:50:28,6,0,0,5,1,0,0,0,0
1146656498733605_1188599511205970,#Vermont throws down for #NoDAPL.,BREAKING: Standoff at Vermont Rising Tide #NoDAP Blockade - IT'S GOING DOWN,link,https://itsgoingdown.org/breaking-standoff-vermont-rising-tide-nodap-blockade/,2016-09-13 14:23:08,4,0,4,4,0,0,0,0,0
1146656498733605_1188087007923887,"""We yelled out other chants that we heard back in full, like ""Our passion, for freedom, is stronger than their prisons!""  The prisoners also lead some of the chants, which is always divine and inspiring.""","When the Storm Comes, Don't Run for Cover: A Noise Demo at Menard Correctional - IT'S GOING DOWN",link,https://itsgoingdown.org/storm-comes-dont-run-cover-noise-demo-menard-correctional/,2016-09-12 23:27:53,6,0,1,6,0,0,0,0,0
1146656498733605_1187978864601368,#NOLA: Noise demo is solidarity with #PrisonStrike.,New Orleans: Noise Demo in Solidarity with Prison Strike - IT'S GOING DOWN,link,https://itsgoingdown.org/new-orleans-noise-demo-solidarity-prison-strike/,2016-09-12 20:33:34,5,0,2,5,0,0,0,0,0
1146656498733605_1187941607938427,"Please consider making a one time or monthly donation to IGD to help us continue our work!

https://itsgoingdown.org/donate/",Donate - IT'S GOING DOWN,link,https://itsgoingdown.org/donate/,2016-09-12 19:23:07,3,0,7,3,0,0,0,0,0
1146656498733605_1187939327938655,Blow by blow account of #Olympia #PrisonStrike solidarity event.,Olympia: Report Back from September 9th Prison Strike Solidarity Action - IT'S GOING DOWN,link,https://itsgoingdown.org/olympia-report-back-september-9th-prison-strike-solidarity-action/,2016-09-12 19:17:59,6,0,7,6,0,0,0,0,0
1146656498733605_1187933591272562,"""This deep ethical polarization, this struggle between competing ideas of life and happiness, signals the end of the democratic fiction, the end of ""society."" Even the rich agree: there is no one world and there never has been. For at least forty years – since the last great assault on capital was defeated – crisis management has been the preferred technique of governmental control. Islamic terrorism, spree shootings, illegal immigration, and black revolt have all been used to justify a regime of increasing police militarization, preemptive containment in ghettos and jail cells, and the redevelopment of city space in the name of safety, resilience, and economic hyper productivity. Retired drones from the war in Iraq hover over Baltimore while Terra Bella – one of Google's latest fancy purchases – plans to deploy satellite cameras across the entire planet. The existential ruin necessary to organize this much suffering has left no one unscathed. In all of this, prisons function not only as the camps which contain and repress surplus proletarians unable or unwilling to be integrated into the dominant form of life, but also as productive centers constantly churning out passive tolerance and spiritual destitution amidst a civilization in decay.""",Atlanta: Report-back on September 9th Solidarity Demo - IT'S GOING DOWN,link,https://itsgoingdown.org/atlanta-report-back-september-9th-solidarity-demo/,2016-09-12 19:08:08,9,0,2,9,0,0,0,0,0
1146656498733605_1187857054613549,Brand new booklet for printing and handing out!,Solidarity with Prison Rebels: New Booklet/PDF For Distro - IT'S GOING DOWN,link,https://itsgoingdown.org/solidarity-prison-rebels-new-bookletpdf-distro/,2016-09-12 16:43:27,4,0,1,4,0,0,0,0,0
1146656498733605_1187843341281587,Great new video from Submedia.TV about the anarchist concept of mutual aid as a revolutionary attack on profit driven society.,What is Mutual Aid? - IT'S GOING DOWN,link,https://itsgoingdown.org/what-is-mutual-aid/,2016-09-12 16:17:01,7,0,4,7,0,0,0,0,0
1146656498733605_1187827161283205,https://itsgoingdown.org/solidarity-bristol-uk/,"Solidarity from Bristol, UK - IT'S GOING DOWN",link,https://itsgoingdown.org/solidarity-bristol-uk/,2016-09-12 15:58:16,3,0,0,3,0,0,0,0,0
1146656498733605_1187819277950660,"""As the march went on, there were a couple attempts to take the streets again by pushing through police lines, all of which were unsuccessful. But, when police did try to make arrests, the bloc was able to immediately get targeted individuals back through a combination of physically pulling them away from police while simultaneously shoving aggressive officers away. Such actions would probably have been less possible without the anonymity provided by black bloc tactics.

Even in situations where we're clearly being outmaneuvered while outnumbered, we will not let them take anyone from us without a fight. These de-arrests were among of the few tactical victories of the night.""",Tucson: Prisoner Strike Solidarity March - IT'S GOING DOWN,link,https://itsgoingdown.org/tucson-prisoner-strike-solidarity-march/,2016-09-12 15:47:10,10,1,6,7,3,0,0,0,0
1146656498733605_1187813141284607,#Oakland walls keep coming alive in solidarity with the #PrisonStrike!,Oakland: Prison Strike Solidarity Graffiti - IT'S GOING DOWN,link,https://itsgoingdown.org/oakland-prison-strike-solidarity-graffiti/,2016-09-12 15:36:30,8,0,5,8,0,0,0,0,0
1146656498733605_1187806147951973,"#Portland threw down for the #PrisonStrike! Reaching across various organizational lines, they helped to organize a massively militant action that shut down an AT&T store, blocked a McDonald's (while also giving out hundreds of free lunches as alternatives), and also dealt with fascist Trump supporters who were attempting to harass the crowd. Much respect!",Despite Racist Attacks & Police Terror Portlander's Take the Streets to End Prison Slavery: A Chronology of Events. - IT'S GOING DOWN,link,https://itsgoingdown.org/despite-racist-attacks-police-terror-portlanders-take-streets-end-prison-slavery-chronology-events/,2016-09-12 15:25:54,5,0,7,5,0,0,0,0,0
1146656498733605_1187804017952186,Audio/podcast roundup of #PrisonStrike from Final Straw.,Final Straw: #PrisonStrike Roundup - IT'S GOING DOWN,link,https://itsgoingdown.org/final-straw-prisonstrike-roundup/,2016-09-12 15:21:01,0,0,0,0,0,0,0,0,0
1146656498733605_1187700814629173,"""The struggle against the neoliberal educational reform and structural reforms in general has lost some of its consistency and coherency as various state sections of the National Coordinator of Education Workers (CNTE) take different approaches following the start of the school year."" #Mexico #Oaxaca #Chiapas",Insumisión: Cracks in the Resistance as the Teachers' Strike Wanes - IT'S GOING DOWN,link,https://itsgoingdown.org/insumision-teachers-strike-wanes/,2016-09-12 12:43:04,2,0,2,2,0,0,0,0,0
1146656498733605_1187166171349304,Report back from #PrisonStrike action in #Houston.,Houston: Speak-Out at Harris County Jail - IT'S GOING DOWN,link,https://itsgoingdown.org/houston-speak-harris-county-jail/,2016-09-11 22:13:56,3,0,0,3,0,0,0,0,0
1146656498733605_1187153734683881,"Ever expanding and growing coverage of the #PrisonStrike on the inside, outside, and around the globe. Updated throughout the day!",#PrisonStrike Resistance to Slavery Across the World - IT'S GOING DOWN,link,https://itsgoingdown.org/prisonstrike-resistance-to-slavery-across-the-world/,2016-09-11 21:56:11,3,0,2,3,0,0,0,0,0
1146656498733605_1187050778027510,"Donate to IGD today and help us continue our work! Every bit helps and we appreciate all of the support that we get. 

http://tinyurl.com/j6nwv7l","Online Payment, Merchant Account - PayPal",link,http://tinyurl.com/j6nwv7l,2016-09-11 19:02:40,6,0,0,6,0,0,0,0,0
1146656498733605_1187049218027666,"""We sat down with Robby and Sylvie in their home in Seattle to get some of the context for the two plays we were planning on recording. The interview turned into a nearly 2 and a half hour conversation where we discussed Rojava, The 5th Estate, 1968, burnout,  and the last 30+ years of anarchy in the United States and much more. It was such a pleasure to hear their stories and perspectives. Though we recorded it almost a year ago we are exited to share it with you now and hope that you find it as interesting as it was for us. The interview is intended to provide some context for Illyria Street Commune by Fredy Perlman and Revolutionary Purity Showdown by Richard Ades which are both well worth a listen.""",Robby and Sylvie Interview - IT'S GOING DOWN,link,https://itsgoingdown.org/robby-sylvie-interview/,2016-09-11 19:00:18,0,0,1,0,0,0,0,0,0
1146656498733605_1187027824696472,"""This is a short report back from a militant who participated in the September 10th Prison Strike solidarity march which took place in Oakland, California. I intend to only speak from my perspective and can not account for oversights or particulars which I may have missed.""",Oakland: Prison Strike Solidarity March Report Back - IT'S GOING DOWN,link,https://itsgoingdown.org/oakland-prison-strike-solidarity-march-report-back/,2016-09-11 18:38:51,16,0,9,16,0,0,0,0,0
