status_id,status_message,link_name,status_type,status_link,status_published,num_reactions,num_comments,num_shares,num_likes,num_loves,num_wows,num_hahas,num_sads,num_angrys
1146656498733605_1395933177139268,"""In an act of political violence, an alt-right supporter of Milo shot Hex in the stomach, sending him in critical condition to the Harborview Hospital in Seattle. Luckily, Hex has recovered and was able to give this inspiring interview about the incident and his desire for restorative justice outside of the judicial and prison systems. Despite turning himself into the Seattle Police Department, the shooter was released from custody and so far has not been charged with any crimes. This contrasts starkly with the mass arrest of 230 protesters at the inauguration, who are now facing sentences of up to ten years. This is the reality of our current moment: those guilty of the ""crime"" of protesting against fascism and capitalism face draconian prison sentences, whereas someone who intends to kill and severely injures an anti-fascist gets away with impunity. This is why we must look outside of the legal system for justice.""","At College Campuses, Antifascists Get Bullets, White Nationalists Podiums - IT'S GOING DOWN",link,https://itsgoingdown.org/solidarity-iww-gdc-member-hex/,2017-03-31 18:22:19,123,4,103,90,0,0,2,0,31
1146656498733605_1395875093811743,"Group in #NewHaven #CT vandalized for their connection to and funding of #FreeSpeechBus, which is on an east coast tour attacking transgendered people. Recently, one of the organizers went on the radio stating that trans people should be 'erased' from society. 

""As an act of solidarity with the transgender community resisting a bus full of transphobic bigots expected to arrive in New Haven, Connecticut today, anti-fascists spray painted ""Trans Lib"" on the highway-facing sign of the anti-LGBTQ Knights of Columbus (KoC) headquarters.""","New Haven, CT: Trans Liberation Message Brought to Hate Bus Funder - IT'S GOING DOWN",link,https://itsgoingdown.org/new-haven-ct-trans-liberation-message-brought-hate-bus-funder/,2017-03-31 17:03:47,75,3,24,59,16,0,0,0,0
1146656498733605_1395841437148442,"While the Right fawns over a billionaire who is attacking the environment, the working-class, the poor, and people of color, anarchists are risking their lives to confront #ISIS and fight for a revolution in #Rojava.

IRPGF",Anarchists Fighting ISIS in Rojava Announce New Formation - IT'S GOING DOWN,link,https://itsgoingdown.org/anarchists-fighting-isis-rojava-announce-irpgf/,2017-03-31 16:16:47,274,6,132,242,32,0,0,0,0
1146656498733605_1395242140541705,"""The police have an intrinsic proclivity to ignore Bikers for Trump, Identity Evropa, Turning Point USA, the NPI, and all forms of Trump-centric vigilante violence, because to oppose it would mean jeopardizing their own dominance within the state apparatus. They will not be on the prowl for the people burning mosques or black churches. They will be infiltrating anarchist organizations, secretly photographing protesters' faces, and collecting the names of antifascist arrestees, assuming the alt-right doesn't do it for them.

Suddenly, the sight of college republicans chanting ""Back the Blue"" loses its innocent husk. When we talk about ""community self defense,"" the conversation should revolve around this question: if the state, the police, the alt-right, and fascist vigilantes all benefit from mutually-discounted behavior, why should we tolerate their existence or presence in our communities at all?""",Collusion Between the Police and Alt-Right Is Inevitable - IT'S GOING DOWN,link,https://itsgoingdown.org/collusion-police-alt-right-inevitable/,2017-03-31 04:35:55,189,6,158,163,0,2,0,0,24
1146656498733605_1395241527208433,More and more events being added for the 'Week of Solidarity Against Repression'!,Events and Resources for the Week Of Solidarity Against Repression - IT'S GOING DOWN,link,https://itsgoingdown.org/events-resources-week-solidarity-repression/,2017-03-31 04:34:54,6,0,3,6,0,0,0,0,0
1146656498733605_1394746993924553,"We told you so! Fake account ""Boston Antifa"" exposed as Alt-Right, pro-Trump trolls.","Eugene, OR Alt-Right Trolls Behind Fake Boston Antifa Exposed - IT'S GOING DOWN",link,https://itsgoingdown.org/eugene-alt-right-trolls-behind-fake-boston-antifa-exposed/,2017-03-30 17:14:09,179,16,169,154,1,6,1,0,17
1146656498733605_1394204120645507,"""Since Trump has come into office, we have seen over 200 people face felony charges in Washington DC after being kettled on J20, over 100 are threatened with charges in Sacramento for taking part in an antifascist demonstration there last June, and over 800 water protectors face charges from a grand jury convened at Standing Rock. Meanwhile, several states have also been trying to push through a set of laws which would further criminalize protest and make it easier for protesters to be fined, face greater charges, and in some cases, even be killed if they block roadways.

This wave of repression cannot also be divorced from the deadly acts of terror being carried out by the far-Right. As Trump supporters attack counter-demonstrators in Huntington Beach while chanting the name of the fascist dictator 'Pinochet,' mosques, black churches, LGBTQI centers, and synagogues are attacked, burned, and shot at, and members of the Alt-Right murder people in the street.

Now is the time to come together, discuss how we can support each other, and continue forward on the path ahead. Now is the time to make our friends across the country know that we have their backs. Now is the time to remember that in the face of everything, we as a movement support each other, we back each other up, and we all know that an injury to one of us, is an injury to all of us.""",Events and Resources for the Week Of Solidarity Against Repression - IT'S GOING DOWN,link,https://itsgoingdown.org/events-resources-week-solidarity-repression/,2017-03-30 04:21:22,35,2,17,30,0,0,0,0,5
1146656498733605_1394202880645631,"""One of the U.S. marshals had made a comment about how many people were waiting outside for us in the most disappointed tone, but I wasn't expecting such a large group of supporters. I was immediately enveloped into a group of people jumping up and down and chanting an antifascist song. I felt like an anarchist quarterback.""","Bloc Party: Learning as We Go, an Interview with a J20 Defendant - IT'S GOING DOWN",link,https://itsgoingdown.org/bloc-party-learning-go-interview-j20-defendant/,2017-03-30 04:19:50,87,3,29,75,12,0,0,0,0
1146656498733605_1393777857354800,"""Resistance to the Mariner East 2 is spreading, with impacted residents and organizers working in communities all along the proposed route. Here in Huntingdon, work has already begun at Raystown Lake, the largest lake entirely within Pennsylvania state borders, where Sunoco intends to use a horizontal directional drill to bore underneath and lay the pipe. Sunoco Logistics and its subcontractors have no regard for the beauty of Appalachia, the preservation of its diverse ecosystems and rich culture. They care not for the people of the Lower Susquehanna. We at Camp White Pine are here to stop the Mariner East 2 pipeline. If you have a passion for fighting energy extraction and infrastructure and believe in preserving the forests and rivers of Appalachia, come and join us in the valley this spring and summer.""",Call to Action: Camp to Resist the Mariner East 2 Pipeline in Pennsylvania - IT'S GOING DOWN,link,https://itsgoingdown.org/call-action-camp-resist-mariner-east-2-pipeline-pennsylvania/,2017-03-29 17:50:38,8,0,23,8,0,0,0,0,0
1146656498733605_1393769440688975,"Brand new Solecast episode from sole and Josh Harper on government repression, the SHAC campaign, and much more.",Solecast #38: Josh Harper on Lessons from SHAC - IT'S GOING DOWN,link,https://itsgoingdown.org/solecast-38-josh-harper-lessons-shac/,2017-03-29 17:38:38,3,0,0,3,0,0,0,0,0
1146656498733605_1393761144023138,"""However, neo-Nazis with the GSS weren't the only fascists wanting to be in the streets of Sacramento for the pro-Trump march on the 25th. Nathan Damigo, a neo-Nazi who became a white supremacist after reading David Duke in prison while serving time for attacking a Middle Eastern man and who went on to become a leader for the National Youth Front, the youth wing of the neo-Nazi group, the American Freedom Party, was also in attendance. In 2016, the NYF evolved into Identity Evropa, which is best known for putting up color posters and stickers at colleges and universities, often using variations of Trump slogans.""","Sacramento, CA: Cleaning Up Damigo's Neo-Nazi Stickers After Trump Rally - IT'S GOING DOWN",link,https://itsgoingdown.org/sacramento-ca-cleaning-damigos-neo-nazi-stickers-trump-rally/,2017-03-29 17:23:25,16,2,3,9,0,0,1,0,6
1146656498733605_1393607324038520,New episode of The Final Straw Radio with the Tilted Scales Collective.,Final Straw: A Tilted Guide to Being a Defendant - IT'S GOING DOWN,link,https://itsgoingdown.org/final-straw-tilted-guide-defendant/,2017-03-29 13:58:47,3,0,0,3,0,0,0,0,0
1146656498733605_1393600670705852,"""Action and solidarity is needed now. Prison rebel siddique Abdullah Hasan's health is in jeopardy. Call prison officials today to demand justice for those on hunger strike inside Ohio's prisons.

Siddique Abdullah Hasan and Jason Robb were a key figures in the Lucasville uprising in 1993, the prison strike of 2016, and numerous acts of solidarity and resistance in the decades between. Each are on death row and have been held in solitary confinement as results of the uprising, in which Lucasville's Southern Ohio Correctional Facility was occupied for 11 days, and during which groups as diverse as Sunni Muslims, Aryan Brotherhood members, and Gangster Disciples collaborated and met daily.""",Phone Zap to Support Hunger Striker and Ohio Prison Rebels: March 29th - 30th - IT'S GOING DOWN,link,https://itsgoingdown.org/phone-zap-support-hunger-striker-ohio-prison-rebels-march-29th-30th/,2017-03-29 13:47:45,9,1,10,9,0,0,0,0,0
1146656498733605_1393015504097702,Neo-Nazis and fascists were out at the #MAGAMARCH in #Philadelphia https://itsgoingdown.org/yes-neo-fash-attended-philly-maga-march/,"Yes, the neo-Fash attended the Philly MAGA March - IT'S GOING DOWN",link,https://itsgoingdown.org/yes-neo-fash-attended-philly-maga-march/,2017-03-28 22:32:34,23,2,7,19,1,0,0,0,3
1146656498733605_1393015067431079,Workers with Burgerville Workers Union hold picket and community carnival.,"Portland, OR: Workers Hold Picket and Community Carnival - IT'S GOING DOWN",link,https://itsgoingdown.org/portland-workers-hold-picket-community-carnival/,2017-03-28 22:31:50,12,0,2,10,2,0,0,0,0
1146656498733605_1392977507434835,"The horrific murder of a 66 year-old African American man Timothy Caughman by a 28 year old member of the Alt-Right, James Harris Jackson with a sword in New York is only the more recent example of people moving from memes to murder. How much longer will we allow this movement to expand?",How Many More Murderers Will We Let the Alt-Right Make? - IT'S GOING DOWN,link,https://itsgoingdown.org/many-murderers-will-allow-alt-right-make/,2017-03-28 21:30:11,78,6,64,43,0,0,0,0,35
1146656498733605_1392876834111569,New issue of Transmetropolitan Review from #Seattle.,The Transmetropolitan Review #6 - IT'S GOING DOWN,link,https://itsgoingdown.org/transmetropolitan-review-6/,2017-03-28 19:00:58,2,0,2,2,0,0,0,0,0
1146656498733605_1392662354133017,"""The John Brown Anti-Klan Committee grew out of the revolutionary movements and struggles of the 1960's and 1970's from largely white radicals who were doing support for black liberation prisoners. After learning through their other organizing work that prison guards and police officers in different institutions and departments were part of the Ku-Klux-Klan, the JBAKC was formed to organize against a new wave of white supremacist organizing. The group also documented the crossover between the KKK and the growing neo-Nazi skinhead subculture in the 1980s, under the direction of white supremacist leaders like Tom Metzger.""",IGDCAST: John Brown Anti-Klan Committee at ROAR Conference - IT'S GOING DOWN,link,https://itsgoingdown.org/igdcast-john-brown-anti-klan-committee-roar-conference/,2017-03-28 13:36:34,34,1,12,33,0,1,0,0,0
1146656498733605_1391885750877344,"""Spencer marked this as a point of entry into the culture, that he and his ideas had ""arrived."" He called 2016 the ""Year of the Alt Right"" and jokingly said ""We're the establishment now."" His assent was actually a free fall, one he could not see amidst the glare of the spotlight. While he believed he was mainstreaming his ideas, he instead was becoming a reality star famous for his own eccentricities and a society's lurid fascination with the trainwrecks of social mood. Spencer's fame provided him nothing tangible, nothing real.""","The World Has Said ""No"" to Richard Spencer - IT'S GOING DOWN",link,https://itsgoingdown.org/world-said-no-richard-spencer/,2017-03-27 18:44:23,35,1,8,33,2,0,0,0,0
1146656498733605_1391880300877889,Support anarchists arrested in #Pittsburgh,Please Support Arrested Anarchists in Pittsburgh - IT'S GOING DOWN,link,https://itsgoingdown.org/please-support-arrested-anarchists-pittsburgh/,2017-03-27 18:36:47,55,0,21,48,7,0,0,0,0
1146656498733605_1391855794213673,Check out this awesome new poster for the week of action April 1st - April 8th!,April 1st - 8th Week of Action Poster - IT'S GOING DOWN,link,https://itsgoingdown.org/april-1st-8th-week-action-poster/,2017-03-27 18:04:19,8,0,2,8,0,0,0,0,0
1146656498733605_1391848637547722,Announcing Wild Roots Feral Futures!,Announcing Wild Roots Feral Futures 2017! - IT'S GOING DOWN,link,https://itsgoingdown.org/announcing-wild-roots-feral-futures-2017/,2017-03-27 17:54:28,13,0,4,11,2,0,0,0,0
1146656498733605_1391846027547983,"""The March 25th MAGA rally in Omaha, Nebraska was forced to operate within a preemptive heavy police perimeter on the City Hall plaza. The pathetic four block sidewalk march to the plaza was outnumbered by their escorts of Omaha police cars, fifteen bicycle cops and four horseback cops. Sad! Marching with their silly yellow snake and blue lives flags they arrived at the plaza where someone began singing the U.S. national anthem on a loudspeaker while gang unit cops sat across the street and riot gear cops were spotted waiting inside the lobby of city hall. A guitarist began playing a Lee Greenwood cover to the MAGA crowd as they breathed a sigh of relief that their march arrived undisturbed. The all-clear call went across the police scanner.

Then, a black bloc appeared.""","Omaha, NE: #DisruptMAGA reportback March 25th - IT'S GOING DOWN",link,https://itsgoingdown.org/omaha-ne-disruptmaga-reportback-march-25th/,2017-03-27 17:53:29,64,7,14,54,5,0,5,0,0
1146656498733605_1391840387548547,"""The Kuwasi Balagoon Liberation School is designed for a new generation of revolutionaries. Named after the Black Liberation Army soldier, we intend to commemorate his life and struggle by making a class that continues his organization's legacy.

This class will focus on revolutionary history and theory, and will be an introductory process to joining an array of resistance projects at The Base. Part educational and part pragmatic, this program will help you orient yourself towards the coming struggle and detail what we are working towards in the future!""","Brooklyn, NY: Kuwasi Balagoon Liberation School Launches - IT'S GOING DOWN",link,https://itsgoingdown.org/brooklyn-ny-kuwasi-balagoon-liberation-school-launches/,2017-03-27 17:51:22,17,0,16,16,1,0,0,0,0
1146656498733605_1391716290894290,"""Local groups aren't the only ones focusing on opposing the event. The website Anti-Fascist News recently posted an article about the event in Pikeville, stating that the rally against the upcoming fascist gathering ""is going to need the support of antifascists around the country.""  And a recent post on It's Going Down from the Louisville, Kentucky, branch of Anti-Racist Action stated, ""We stand in solidarity with the residents of Pikeville, and with anyone else who stands up against fascism. We invite you to do the same. The rising tide of white supremacy must be dismantled…We will be there, and we will not be alone.""""","Opposition Builds Against White Nationalist Conference in Pikeville, Kentucky - IT'S GOING DOWN",link,https://itsgoingdown.org/opposition-builds-white-nationalist-conference-pikeville-kentucky/,2017-03-27 15:29:38,37,0,18,31,0,0,0,0,6
1146656498733605_1391700040895915,"""The first episode of Trouble, looks beyond the mainstream narratives surrounding the Standing Rock encampment to get a better understanding  of some of the camp's overlooked dynamics, including serious disagreements over which tactics to use to best stop the Dakota Access  Pipeline (DAPL).""",Trouble #1: Killing the Black Snake - IT'S GOING DOWN,link,https://itsgoingdown.org/trouble-1-killing-black-snake/,2017-03-27 15:14:04,23,0,6,21,2,0,0,0,0
1146656498733605_1391634587569127,"""A dialogue around ""violence"" is not relevant without context. While the only violence that actually occurred was against Marker by the police, the involvement of a rifle in damaging pipeline equipment seems to have left some people with a feeling that the potential for violence existed. While that could be an interesting philosophical debate, it is useless speculation. The most common uses of guns are not for things that fall into a category of violent crime, but for a variety of non-criminal activity including recreational sport, hunting for food and self-defense. STR has argued that Marker's action can be viewed as an act of ""self-defense"" to protect himself and others from the pipeline that has stolen peoples land and damaged the environment that people depend on for life.""",It Takes a Police State to Build an Energy Empire - IT'S GOING DOWN,link,https://itsgoingdown.org/takes-police-state-build-energy-empire/,2017-03-27 13:59:36,14,2,9,12,1,0,0,0,1
1146656498733605_1389538841112035,#Philadelphia: Black Bloc shuts down Trump march being led by neo-Nazis.,IGD Philly: Black Bloc Shuts Down Trump Rally Being Led by Neo-Nazis - IT'S GOING DOWN,link,https://itsgoingdown.org/igd-philly-black-bloc-shuts-trump-rally-led-neo-nazis/,2017-03-25 15:29:06,547,23,888,438,97,5,1,1,5
1146656498733605_1389486967783889,#Chiapas: Town hall burns after water shortage protests.,Ocozocoautla: Town Hall & Vehicles Burn after Water Shortage Protests - IT'S GOING DOWN,link,https://itsgoingdown.org/ocozocoautla-chiapas-town-hall-vehicles-burn-water-shortage-protests/,2017-03-25 14:26:34,33,0,9,26,2,5,0,0,0
1146656498733605_1388422764556976,#Sacramento pro-Trump organizers are openly working with members of the violent neo-Nazi crew that stabbed #Antifa in June of 2016. #MAGAMARCH,"Sacramento, CA: Nazi Crew to Co-Organize Trump March - IT'S GOING DOWN",link,https://itsgoingdown.org/sacramento-nazi-crew-responsible-stabbings-co-organize-trump-march/,2017-03-24 14:40:10,136,33,338,55,1,3,3,2,72
1146656498733605_1387739274625325,#Modesto: Call to action against Ann Coulter.,"Modesto, CA: A Call to Action Against Ann Coulter - IT'S GOING DOWN",link,https://itsgoingdown.org/modesto-ca-call-action-ann-coulter/,2017-03-23 23:28:57,54,5,27,47,5,0,0,0,2
1146656498733605_1387684904630762,"""A bus staffed by paid protesters apart of several non-profits including the National Organization for Marriage, International Organization for the Family, and Citizen Go – all anti-queer and anti-trans groups, was righteously attacked today with a baseball bat, keyed, vandalized with ""Trans Liberation"" graffiti, and in general, laughed out of town for being the disgusting bigots that they are.""","Anti-Queer, Anti-Trans Paid Protester Bus Attacked in NYC - IT'S GOING DOWN",link,https://itsgoingdown.org/anti-queer-anti-trans-paid-protester-bus-attacked-nyc/,2017-03-23 22:19:19,400,21,288,287,79,0,32,0,2
1146656498733605_1387554234643829,"""That night, we smashed out the windows of the T-Mobile store in Morrow and painted ""fuck the police"" on its veneer. We are not willing to wait for results of the GBI investigation. We are pleased to find that others have already painted anti-police slogans all over the area of the shooting, including ""police out of Lakewood,"" ""death to the fascist pigs,"" ""no pig zone,"" ""fuck 12 forever,"" and more.""","Atlanta, GA: T-Mobile Store Vandalized for Connection to Police Shooting - IT'S GOING DOWN",link,https://itsgoingdown.org/atlanta-ga-t-mobile-store-vandalized-connection-police-shooting/,2017-03-23 19:36:58,36,0,8,31,5,0,0,0,0
1146656498733605_1387546361311283,"While people within the Libertarian Party and in the Libertarian Party of Pennsylvania have continued to support fascist Augustus Invictus speaking at the upcoming Mid-Atlantic Liberty Festival, a former friend and journalist is now saying that he brutally assaulted and threatened to kill his 19 year old ex-fiance. How much liberty can you take?",Libertarians Continue Support for Augustus Invictus as Brutal Assault Accusations Emerge - IT'S GOING DOWN,link,https://itsgoingdown.org/libertarians-re-double-support-fascist-augustus-invictus-brutal-accusations-emerge/,2017-03-23 19:29:57,29,2,15,9,1,1,0,0,18
1146656498733605_1387408261325093,"""Standing Rock isn't the only place to have seen a mass struggle around water in recent years. Over in Ireland, attempts to commodify water by introducing a water charge led to the emergence of a huge movement starting in 2014, one which was heavily based in militant community direct action. Memorably, the ""water meter fairies"", who made unwanted water meters magically disappear, were described by one politician as ""a subversive organisation seeking to willingly break the law and destroy public property… attacking the very fabric of the State."" See here for more background on the water charge movement from an anarchist perspective.""",Water is Life: From Standing Rock to Jobstown - IT'S GOING DOWN,link,https://itsgoingdown.org/water-life-standing-rock-jobstown/,2017-03-23 16:14:25,13,0,2,12,1,0,0,0,0
1146656498733605_1387392301326689,"IGDCAST: Getting into #Trouble with Franklin López from subMedia.tv. Talking about anarchist media, everything Montreal, and new show!",IGDCAST: Getting Into Trouble With Franklin Lopez of SubMedia - IT'S GOING DOWN,link,https://itsgoingdown.org/igdcast-getting-trouble-franklin-lopez-submedia/,2017-03-23 15:59:35,10,0,0,9,1,0,0,0,0
1146656498733605_1387378354661417,#Pittsburgh: Call in Campaign for Inmates Denied Medication at Allegheny County Jail,"Pittsburgh, PA: Call-in for Inmates Denied Medication at Allegheny County Jail! - IT'S GOING DOWN",link,https://itsgoingdown.org/pittsburgh-pa-call-inmates-denied-medication-allegheny-county-jail/,2017-03-23 15:40:00,3,0,8,3,0,0,0,0,0
1146656498733605_1387376371328282,Casey Jordan Cooper Exposed as Alt-Right Fascist by #Antifa,"Atlanta, GA: Casey Jordan Cooper Exposed to Community as Alt-Right Fascist by Antifa - IT'S GOING DOWN",link,https://itsgoingdown.org/casey-jordan-cooper-exposed-as-fascist-to-atlanta-community/,2017-03-23 15:37:53,87,3,32,78,0,0,0,0,9
1146656498733605_1387368841329035,Certain Days: Freedom for Political Prisoners Calendar call for submissions!,Certain Days 2018 Calendar Call for Art & Article Submissions: Awakening Resistance - IT'S GOING DOWN,link,https://itsgoingdown.org/certain-days-2018-calendar-call-art-article-submissions-awakening-resistance/,2017-03-23 15:32:09,3,1,1,2,1,0,0,0,0
1146656498733605_1387368084662444,Anti-Cop block party held in #Durham #NorthCarolina,"No Cop Zone! Durham, NC Hosts a Block Party - IT'S GOING DOWN",link,https://itsgoingdown.org/no-cop-zone-durham-nc-hosts-block-party/,2017-03-23 15:30:56,16,0,4,12,4,0,0,0,0
1146656498733605_1386637321402187,"""On March 11th and 12th, hundreds of people converged in Oakland and San Francisco for a two-day festival called the ROAR, or Revolutionary Organizing Against Racism Conference. The conference brought together black liberation, indigenous, anarchist, and anti-fascist groups to discuss and look back not only on past struggles for liberation, but to think and strategize about the path ahead. It's Going Down was lucky enough to be able to record some of the talks that took place. What follows is a presentation from the Black Women's Defense League of Dallas, Texas.

The talk itself discusses the group's overall project of confronting patriarchy, black liberation, training, and community empowerment. It also offers a feminist history of the black liberation movement and presenters argue that without attacking patriarchy, the black liberation movement itself will not be able to confront and destroy white supremacy.""

Black Women's Defense League",IGDCAST: Black Women's Defense League - IT'S GOING DOWN,link,https://itsgoingdown.org/igdcast-black-womens-defense-league/,2017-03-22 23:15:14,61,0,20,55,5,0,1,0,0
