status_id,status_message,link_name,status_type,status_link,status_published,num_reactions,num_comments,num_shares,num_likes,num_loves,num_wows,num_hahas,num_sads,num_angrys
1146656498733605_1285973848135202,"""The failure of any form of international solidarity with the Syrian revolution is utterly devastating. The only group that received consistent anarchist support was the PYD and its armed formations, the YPG/YPJ, which have done a lot of work in building a social revolution in Kurdish-majority areas of Syria. However, the open collaboration of the PYD/YPG with the Assad regime as it crushed free Aleppo barely caused a ripple. The YPG helped to cut supply lines, prevent retreats, and attack positions. The relations between Sheikh Maqsoud and Efrid Canton with non-PYD armed groups around Aleppo has been complicated, but even if we can accept some of these maneuvers, how can we accept that a revolutionary project has been content to watch another be crushed right in front of it? How can we explain that a movement based on the spread of directly democratic assemblies fought to opportunistically seize territory that had been held by other popular decision-making structures, the dozens of local councils that existed in Aleppo? Wouldn't a truly revolutionary position involve encouraging the autonomy of other areas, not monopolizing power and striking alliances of convenience with authoritarians? Really, it is two revolutionary dreams that died with Aleppo, as it seems pretty clear now that at least the armed and political structures of the PYD are not pursuing popular, liberatory goals (4)""",Hommage to Aleppo: What it means to Me Here - IT'S GOING DOWN,link,https://itsgoingdown.org/hommage-aleppo-means/,2016-12-16 16:18:26,14,3,5,12,0,0,0,1,1
1146656498733605_1285333514865902,"""In short, the Alt-Right, speaking on terms of race, gender, and class – is an elitist movement. Moreover, they attempt to appeal to white men who react negatively to social movements that challenge systems of white supremacy and patriarchy within society. For the Alt-Right, the threat isn't to white workers but instead to whiteness as a social position and caste within the American system.""","The Rich Kids of Fascism: Why the Alt-Right Didn't Start with Trump, and Won't End With Him Either - IT'S GOING DOWN",link,https://itsgoingdown.org/rich-kids-fascism-alt-right-didnt-start-trump-wont-end-either/,2016-12-16 06:18:42,72,4,95,60,1,0,0,0,11
1146656498733605_1285022028230384,"""The Industrial Workers of the World is much larger and more prominent than the General Defense Committee, which is a committee of the IWW, but maintains separate membership. People can be members of both groups; officers in both organizations must be members of the IWW, but one may join the GDC without joining in the IWW. The spike of interest in both organizations after the 2016 Presidential election caught a lot of us by surprise. The Twin Cities GDC has roughly quadrupled in membership in the last twelve months;  one quarter of them joined after the election.""",Community Self Defense: Organizing Through The Diversity of the Working Class - IT'S GOING DOWN,link,https://itsgoingdown.org/community-self-defense-organizing-diversity-working-class/,2016-12-16 00:04:46,15,0,9,14,1,0,0,0,0
1146656498733605_1285007371565183,Bad day to be a Nazi in #Chicago #Antifa,Chicago: Neo-Nazi Keith Kowal Exposed and Vehicle Redecorated - IT'S GOING DOWN,link,https://itsgoingdown.org/neo-nazi-keith-kowal-exposed-vehicle-redecorated/,2016-12-15 23:55:23,68,4,23,62,5,1,0,0,0
1146656498733605_1284662471599673,"#PhiladnoCastile, Police Murder, and Legal Farce #BlackLivesMatter","Philando Castile, Police Murder, and Legal Farce - IT'S GOING DOWN",link,https://itsgoingdown.org/philando-castile-police-murder-legal-farce/,2016-12-15 17:46:05,5,0,3,5,0,0,0,0,0
1146656498733605_1284655888266998,Fighting the Alt-Right: Report and Analysis from Michigan State University #MSU #ShutDownMilo #Antifa,Fighting the Alt-Right: Report and Analysis of Michigan State University protest - IT'S GOING DOWN,link,https://itsgoingdown.org/fighting-alt-right-report-analysis-michigan-state-university-protest/,2016-12-15 17:35:23,14,0,13,14,0,0,0,0,0
1146656498733605_1284591941606726,"Evicted squat in #Mexico, the Okupa Chanti Ollin Calls for Solidarity!",Evicted Okupa Chanti Ollin Calls for Solidarity - IT'S GOING DOWN,link,https://itsgoingdown.org/evicted-okupa-chanti-ollin-calls-solidarity/,2016-12-15 16:41:01,3,0,2,3,0,0,0,0,0
1146656498733605_1283518428380744,Neo-Nazi stickers and posters starting to pop up on your campus! Want to do more than just tear them down? Here's your chance! Resources for countering 'Identity Evropa' and the 'Alt-Right.' #Antifa,Resources For Countering Identity Evropa and the 'Alt-Right' - IT'S GOING DOWN,link,https://itsgoingdown.org/resources-countering-identity-evropa-alt-right/,2016-12-14 19:22:58,53,1,18,52,1,0,0,0,0
1146656498733605_1282294841836436,"""Today we decided to attack with explosive devices; a Santander bank branch and the Taxpayer Legal Defense Office (part of the Ministry of Finance) in #Oaxaca."" #Mexico",Mexico: Explosives Attack Against Bank and Government Office in Oaxaca - IT'S GOING DOWN,link,https://itsgoingdown.org/attack-bank-oaxaca/,2016-12-13 19:43:56,13,0,3,12,1,0,0,0,0
1146656498733605_1282145655184688,"""The problems that Trump makes terrifyingly visible were already there. We need to abandon any identification or illusion of shared interests with the dominant system, attack oppression and exploitation at their very foundations, and start building the world we want, making no compromises with the system that never saw us as anything more than resources or means to an end.""",Trump: Fascism or White Supremacy? - IT'S GOING DOWN,link,https://itsgoingdown.org/trump-fascism-white-supremacy/,2016-12-13 16:38:03,11,2,3,11,0,0,0,0,0
1146656498733605_1282029951862925,"Across North America, people are blockading trains to right resource extraction.",Solidarity with #NODAPL: How to Block Trains - IT'S GOING DOWN,link,https://itsgoingdown.org/solidarity-nodapl-block-trains/,2016-12-13 14:28:40,49,0,35,45,3,1,0,0,0
1146656498733605_1281953188537268,"We're behind on our fundraising goal by about $400. Help IGD catch up! We want to be around for the long haul but we need your help to do so! 

https://itsgoingdown.org/donate/",Timeline Photos,photo,https://www.facebook.com/IGDnews/photos/a.1149430018456253.1073741828.1146656498733605/1281953188537268/?type=3,2016-12-13 13:16:55,117,3,36,111,3,0,3,0,0
1146656498733605_1280975021968418,"#Michigan members of the white nationalist group 'Identity Evropa' have served in leadership positions of DKE (Delta Kappa Epsillon), a prestigious frat for wealthy and well connected rich kids that has been home to 5 former presidents. Their networks also include a lawyer and appear to be growing. #Antifa",Michigan Identity Evropa: Fraternity of Fascists - IT'S GOING DOWN,link,https://itsgoingdown.org/michigan-identity-evropa-fraternity-fascists/,2016-12-12 19:28:10,18,0,11,11,0,0,0,1,6
1146656498733605_1280896785309575,Brand new podcast interview with Pacific Northwest Anti-Fascist Workers Collective on #Antifa organizing in prisons and in labor unions. Not to be missed!,IGDCAST: Building An Anti-Fascist Force in Prisons and in Labor - IT'S GOING DOWN,link,https://itsgoingdown.org/igdcast-building-anti-fascist-force-prisons-labor/,2016-12-12 17:47:06,24,0,22,24,0,0,0,0,0
1146656498733605_1280121068720480,"Brand new IGDCAST out now! Interview with Morgantown Ultra Left Network (MULN) on organizing in #WestViriginia, Trump, their upcoming conference, and much more!",IGDCAST: Straight Outta West Virginia - IT'S GOING DOWN,link,https://itsgoingdown.org/igdcast-straight-outta-west-virginia/,2016-12-12 00:03:10,20,0,5,19,1,0,0,0,0
1146656498733605_1280042005395053,"""We have outlined the history of the Wolves of Vinland; their use of Operation Werewolf as a recruiting tool; the nature of their worldview, and the role of their leaders Paul Waggener and Jack Donovan as well as some of their allies in the growing far-Right creep in the Pacific Northwest. The Trump campaign has certainly galvanized white nationalists and overt fascists alike; however another threat is the growing normalization of far-Right themes and discourse in subcultural spaces, which also contributes to radicalization. Jack Donovan and the Wolves of Vinland are emblematic of this growing infiltration. The need for antifascists to reclaim these spaces is greater than ever.""","The Wolves of Vinland: a Fascist Countercultural ""Tribe"" in the Pacific Northwest - IT'S GOING DOWN",link,https://itsgoingdown.org/wolves-vinland-fascist-countercultural-tribe-pacific-northwest/,2016-12-11 22:31:41,22,2,48,16,0,2,0,0,4
1146656498733605_1279981242067796,"Report back from Texas A & M, where #Antifa went up against police, fascists, and liberals. 

https://itsgoingdown.org/college-station-tx-clashes-police-fascists-liberals-texas/","College Station, TX: Clashes with Police, Fascists, and Liberals at Texas A&M - IT'S GOING DOWN",link,https://itsgoingdown.org/college-station-tx-clashes-police-fascists-liberals-texas/,2016-12-11 21:38:38,26,2,8,26,0,0,0,0,0
1146656498733605_1279670672098853,"""As the shiny facade of neoliberal tolerance gives way to the threat of overt fascism, affirming our love for ourselves and each other becomes more apparently important and subversive. For a brief and joyous moment, the dance party was a chance to reclaim the streets from the bar bros, the business owners, the cops and the condo residents. To those who push us further and further into the margins whether in the name of ""community & livability"" or overt white supremacy and hatred of queer people: We're here, we're queer, we're anarchists and we'll fucking wreck your shit.

All out for J20!
Make dance parties riots again!""",Queers get rowdy in Olympia - IT'S GOING DOWN,link,https://itsgoingdown.org/queers-get-rowdy-olympia/,2016-12-11 15:53:49,60,0,17,51,8,1,0,0,0
1146656498733605_1279669952098925,Red Warrior Camp leaves #StandingRock,Red Warrior Camp Communique - IT'S GOING DOWN,link,https://itsgoingdown.org/red-warrior-camp-communique-2/,2016-12-11 15:53:09,25,0,7,19,0,1,0,5,0
1146656498733605_1278694215529832,We want IGD around for the long haul. Please donate to help make sure we can. Donate $20 or more and get a shirt! https://itsgoingdown.org/donate/,Timeline Photos,photo,https://www.facebook.com/IGDnews/photos/a.1149430018456253.1073741828.1146656498733605/1278694215529832/?type=3,2016-12-10 19:54:23,9,0,1,9,0,0,0,0,0
1146656498733605_1278681102197810,Kinetik Justice beaten up by guards in #Alabama. Call in to demand that they relocate him! #PrisonStrike,Kinetik Justice of Free Alabama Movement Brutally Attacked; Call in to Relocate Him - IT'S GOING DOWN,link,https://itsgoingdown.org/kinetik-justice-free-alabama-movement-brutally-attacked-call-relocate/,2016-12-10 19:35:26,10,0,37,5,0,0,0,1,4
1146656498733605_1278642965534957,#Oakland #GhostShip #Gentrification,"Oakland, CA: Stop Eviction Speakout, Rally, and March! - IT'S GOING DOWN",link,https://itsgoingdown.org/oakland-ca-stop-eviction-speakout-rally-march/,2016-12-10 18:46:31,9,0,9,9,0,0,0,0,0
1146656498733605_1277881368944450,"#Antifa self-defense groups popping up all the time! 

https://itsgoingdown.org/trumptheregime-resources-ongoing-resistance-trump-far-right/",#TrumpTheRegime: Resources and Ongoing Resistance to Trump and the Far-Right - IT'S GOING DOWN,link,https://itsgoingdown.org/trumptheregime-resources-ongoing-resistance-trump-far-right/,2016-12-10 02:59:53,34,0,16,33,1,0,0,0,0
1146656498733605_1277450005654253,#GhostShip,"Bloomington, IN: Rainbow Bakery Sabotaged for Feral Pines - IT'S GOING DOWN",link,https://itsgoingdown.org/bloomington-rainbow-bakery-sabotaged-feral-pines/,2016-12-09 19:01:14,58,2,55,48,9,1,0,0,0
1146656498733605_1277449772320943,2 Months in Solitary Later: Report on Repression in #Oregon Prisons Following #PrisonStrike https://itsgoingdown.org/2-months-solitary-later-post-september-9th-repression-oregon/,2 Months in Solitary Later: Post-September 9th Repression in Oregon - IT'S GOING DOWN,link,https://itsgoingdown.org/2-months-solitary-later-post-september-9th-repression-oregon/,2016-12-09 19:00:40,5,0,3,2,0,0,0,0,3
1146656498733605_1277449392320981,Support Manteen!: Notes on the After Math of the #Portland Riots https://itsgoingdown.org/support-mateen-notes-aftermath-portland-riots/,Support Mateen!: Notes on the Aftermath of the Portland Riots - IT'S GOING DOWN,link,https://itsgoingdown.org/support-mateen-notes-aftermath-portland-riots/,2016-12-09 18:59:55,9,0,4,9,0,0,0,0,0
1146656498733605_1277448325654421,"""It was quite evident how anarchist outreach from organizations like Submedia, Crimethinc, and It's Going Down, post-Bernie and post-Trump, have reached people outside of the anarchist bubble. For instance, the hashtag #DisruptJ20 was well-known among non-anarchists. There was no liberal bullshit and no shouting matches. Everyone came expecting a radical gathering that would respect autonomy and not force decisions on each other.""","Denver, After the Election - IT'S GOING DOWN",link,https://itsgoingdown.org/denver-after-the-election/,2016-12-09 18:59:08,18,0,6,18,0,0,0,0,0
1146656498733605_1277408325658421,"""On or around December 3rd, 2016 a water protector at Oceti Sakowin received a summons to appear before a federal grand jury that has been convened in relation to the resistance of water protectors. What we know about grand juries is that they have a long history of being used to target those in resistance to the state and engaged in political or revolutionary movements. The purpose of this grand jury and all grand juries that target revolutionary people and communities is to cause division, manufacture prisoners of war, create paranoia and suspicion amongst comrades. We will not be intimidated and resistance to this is only strengthening our resolve to kill this black snake and all the others.""

#NoDAPL #StandingRock #DakotaAccessPipeline #DAPL",Grand Jury Resistance at Standing Rock - IT'S GOING DOWN,link,https://itsgoingdown.org/grand-jury-resistance-at-standing-rock/,2016-12-09 18:06:00,58,1,75,50,8,0,0,0,0
1146656498733605_1277268765672377,Help IGD grow and expand! We depend on donations to stay afloat and grow. Donate $20 or more and get a t-shirt!,Donate /// Shirts - IT'S GOING DOWN,link,https://itsgoingdown.org/donate/,2016-12-09 15:56:28,2,0,0,2,0,0,0,0,0
1146656498733605_1276737705725483,"""Several weeks ago, the National Policy Institute (NPI) held its annual conference in Washington DC, which ended with NPI head Richard Spencer declaring, ""Hail Trump! Hail our people! Hail Victory!"" as people in the audience threw up their arms in fascist salutes. While images of white supremacists Sieg-Heiling went viral online, it did nothing to stem the tide of media spotlight that the mainstream bestowed upon Spencer. After the conference, white supremacists on the podcast, ""Intersectional Alt-Right"" with Andrew Anglin (of The Daily Stormer) and Jazzhands McFeels discussed the event and talked about how a gap was widening between the ""older vanguard"" (like Jared Taylor of American Renaissance and Peter Brimelow of V-DARE) and the ""new generation,"" (headed by Richard Spencer and many others who grew out of the Alt-Right subculture of Neo-Nazi podcasts and memes). But another key player was emerging: Identity Evropa.""",Identity Evropa: Mapping the Alt-Right Cadre - IT'S GOING DOWN,link,https://itsgoingdown.org/identity-evropa-mapping-alt-right-cadre/,2016-12-09 07:07:41,10,1,35,8,0,1,0,0,1
1146656498733605_1275287692537151,"""We live in a time that is marked by not only increasing crisis and growing reaction, but also in explosive and insurrectionary mass resistance and refusal. At the same time, as it has never been so clear to so many, the institutional and electoral Left is utterly and completely, useless.

The crisis we face is not only one of capital or industrial civilization, but that of its oh-so loyal opposition, the Left. 

Perhaps now, you'll finally start listening.""","What Anarchists Have Been Saying For Years, and What Liberals Need to Start Hearing - IT'S GOING DOWN",link,https://itsgoingdown.org/what-anarchists-have-been-saying-for-years-and-what-liberals-should-start-hearing/,2016-12-08 05:22:49,91,4,112,81,9,1,0,0,0
1146656498733605_1274810032584917,"""The first message that we give is of peace, and not a message of war. However, in spite of the aggressions that you have carried out, we will not disarm and we will continue in struggle…""",Mexico: Community Police Hold Armed March in Guerrero - IT'S GOING DOWN,link,https://itsgoingdown.org/community-police-march-guerrero/,2016-12-08 01:48:06,8,1,8,8,0,0,0,0,0
1146656498733605_1274659215933332,"Help IGD grow, build, and stay afloat in their crucial time! Donate $20 a get a shirt. 

https://itsgoingdown.org/donate/",Donate /// Shirts - IT'S GOING DOWN,link,https://itsgoingdown.org/donate/,2016-12-07 22:46:59,4,0,1,4,0,0,0,0,0
1146656498733605_1274486062617314,"Complaints launched by prisoners moved since #PrisonStrike on poor health and environmental conditions in #Texas

https://itsgoingdown.org/complaints-launched-toxic-conditions-texas-eastham-unit-prison/",Complaints Launched Over Toxic Conditions at Texas' Eastham Unit Prison - IT'S GOING DOWN,link,https://itsgoingdown.org/complaints-launched-toxic-conditions-texas-eastham-unit-prison/,2016-12-07 19:46:56,7,0,2,7,0,0,0,0,0
1146656498733605_1274406195958634,"On behalf of a property developer, 300 riot police carried out a pre-dawn raid on Dec 5 against an encampment protecting green space and a water aquifer in Mexico City. #Mexico #CDMX #Pedregales",Mexico City Water and Land Defense Encampment Attacked - IT'S GOING DOWN,link,https://itsgoingdown.org/pedregales-coyoacan/,2016-12-07 18:19:59,10,0,14,6,0,0,0,2,2
1146656498733605_1274384509294136,Support #Antifa comrades arrested at Texas A & M last night!,Bail Fund for A&M Anti-Fascist Protesters - IT'S GOING DOWN,link,https://itsgoingdown.org/bail-fund-anti-fascist-protesters/,2016-12-07 17:54:32,29,0,20,29,0,0,0,0,0
1146656498733605_1274351089297478,"""His commander in the YPG said of him, ""He was one of the rare people who really came here to work. You could count people like that on the fingers of one hand.""'","Sacramento, CA: People Take to the Streets To Remember Anarchist Michael Israel, Killed in Rojava Fighting ISIS - IT'S GOING DOWN",link,https://itsgoingdown.org/sacramento-ca-people-take-streets-remember-anarchist-michael-israel-killed-rojava-fighting-isis/,2016-12-07 17:21:46,52,3,39,45,3,0,0,4,0
1146656498733605_1273115962754324,"Across the world, people are blockading and stopping flows of capital, energy, and infrastructure and creating new forms of life in the process. See what is going doing against #DakotaAccessPipeline and it's world. #NoDAPL",Disrupt the Flows: War Against the DAPL and Planetary Annihilation - IT'S GOING DOWN,link,https://itsgoingdown.org/disrupt-flows-war-dapl-planetary-annihilation/,2016-12-06 18:46:04,19,0,12,17,2,0,0,0,0
1146656498733605_1273084639424123,"A look at communities around #Mexico creating and defending autonomy, taking matters into their own hands to provide for their security from the state, organized crime and corporations. There are also updates on prisoners, community media and #Ayotzinapa.",Insumisión: Community Self-Defense Against Narcos and the State - IT'S GOING DOWN,link,https://itsgoingdown.org/insumision-community-self-defense/,2016-12-06 17:50:46,29,0,16,27,2,0,0,0,0
1146656498733605_1271920549540532,Milo is Not Welcome in Appalachia: A Report Back from WVU #Antifa #ShutDownMilo,Milo is Not Welcome in Appalachia: A Report Back from WVU - IT'S GOING DOWN,link,https://itsgoingdown.org/milo-not-welcome-appalachia-report-back-wvu/,2016-12-05 20:11:55,75,3,58,70,5,0,0,0,0
1146656498733605_1270969656302288,"""But something I found to be very compelling and inspiring was the amount of group cohesion and general DOWN AS FUCK-NESS of all of the people involved. We did not lose numbers or energy with each changing destination. The roughly 100 folks stayed together for over six hours, and that is notable. The absence of ""march marshals"" and ""peace police"" added to success and built trust between all involved. While the last-minute information of the White Knights' plan had been shared amongst all who were organizing across the state, only those who were ready and willing to confront white supremacy mobilized to the epicenter of conflict. Meanwhile, liberal-progressive types stayed in Raleigh and other cities and 'held space' and chanted ""#LoveTrumpsHate"" in a vacuum rather than aiming for some show of solidarity.""",Anti-Fascist Response to the Klan Victory Parade in North Carolina - IT'S GOING DOWN,link,https://itsgoingdown.org/anti-fascist-response-klan-victory-parade-north-carolina/,2016-12-05 03:15:14,42,1,18,36,6,0,0,0,0
1146656498733605_1270920496307204,"""With less than twenty-four hours notice, the Loyal White Knights of the KKK announced to The Times News that their ""car-parade"", a victory rally in honor of Trump's election, would be happening in Pelham, NC around 9:00AM. We had been anticipating this kind of action – the Klan are cowards, and even after the political farce that is the US President Election, they were not willing to meet a direct confrontation from militant anti-fascists.""","""AN UNLAWFUL ASEMBLY"" – REPORTBACK FROM NC BLACK BLOC - IT'S GOING DOWN",link,https://itsgoingdown.org/unlawful-asembly-reportback-nc-black-bloc/,2016-12-05 02:04:48,67,2,22,67,0,0,0,0,0
1146656498733605_1269185786480675,"""For starters, we have to reject the ridiculous notion that migrants and refugees from Mexico or Syria are our enemy, that they are somehow stealing our jobs or are somehow really ""terrorists"". Let's get real: who's really stealing our jobs? Who is really harming us? Well, let's see, a generous estimate of the number of illegal immigrants working in the US is 6 million (notice I said working, not living). This stands in stark contrast to the conservative estimate that nearly 5 million jobs have been outsourced thanks to ""free trade"" agreements pushed by both political parties. Well, let's ask ourselves, who's really stealing our jobs? Poor Mexicans? Or Rich White CEOs?""",To Other Working Americans - IT'S GOING DOWN,link,https://itsgoingdown.org/to-other-working-americans/,2016-12-03 21:42:27,17,0,5,16,1,0,0,0,0
1146656498733605_1269122769820310,"In attack on indigenous community radio station in #Puebla, #Mexico, two were beaten while on the air and a third shot in the chest when he came to help.",Mexico: Attack on Tlayole Community Radio Station - IT'S GOING DOWN,link,https://itsgoingdown.org/mexico-attack-tlayole-community-radio/,2016-12-03 20:42:00,10,1,34,5,0,1,0,1,3
1146656498733605_1269108073155113,"""The relationships built there have the potential to continue and grow. The anti-police movements of the past several years have set a new bar for resistance in this country; highway blockades, burning barricades, and looting are now on the table. And the protests that erupted after Trump's election were unprecedented; no president has faced so much resistance before even taking office. People's willingness to go toe-to-toe with the police, to eschew the politics of respectability in favor of confrontation and conviction, reveals their deeper understanding of the situation: there is no democratic remedy to Trump's fascism, there is only the power we build, together.""",Autopsy of an Election - IT'S GOING DOWN,link,http://tinyurl.com/hsvwtuw,2016-12-03 20:18:27,21,0,17,21,0,0,0,0,0
1146656498733605_1268070203258900,"New edition of our column 'Bloc Party,' which covers insurgency, repression, and political prisoners.",Bloc Party: Out in the Cold - IT'S GOING DOWN,link,https://itsgoingdown.org/bloc-party-out-in-the-cold/,2016-12-03 02:07:44,11,0,7,11,0,0,0,0,0
1146656498733605_1267583353307585,"Irineo Salmerón Dircio, teacher and coordinator of the Regional Coordinator of Community Authorities (CRAC-PC) in #Guerrero, was found dead on November 25 after being kidnapped by an armed group on November 23. #Mexico",Mexico: Teacher and Community Police Leader Disappeared and Murdered - IT'S GOING DOWN,link,https://itsgoingdown.org/mexico-teacher-community-police-leader-disappeared-murdered/,2016-12-02 16:46:37,3,0,0,3,0,0,0,0,0
1146656498733605_1267517936647460,#Portland: Fight Against #DakotaAccessPipeline Comes to the Front Doors of Rich Scum Responsible #NoDAPL,Your Neighbor Profits From Stolen Land and Genocide: #NoDAPL Solidarity Home Protests in Portland - IT'S GOING DOWN,link,https://itsgoingdown.org/neighbor-profits-stolen-land-genocide-nodapl-solidarity-home-protests-portland/,2016-12-02 15:21:44,11,0,6,11,0,0,0,0,0
