status_id,status_message,link_name,status_type,status_link,status_published,num_reactions,num_comments,num_shares,num_likes,num_loves,num_wows,num_hahas,num_sads,num_angrys
1170562502965493_1340114496010292,"Madonna Says To America: ""The World Is Laughing At Us Right Now!""","Madonna Says To America: ""The World Is Laughing At Us Right Now!"" - USA News Home",link,http://rusharea.com/world-news/madonna-says-america-world-laughing-us-right-now/,2016-12-05 16:54:03,11,31,3,5,0,0,5,1,0
1170562502965493_1338809846140757,"Trump: 'Saturday Night Live' Spoof Is 'Unwatchable,' Baldwin 'Cant Get Any Worse'","Trump: 'Saturday Night Live' Spoof is 'Unwatchable,' Baldwin 'Cant Get Any Worse' - USA News Home",link,http://rusharea.com/world-news/trump-saturday-night-live-spoof-unwatchable-baldwin-cant-get-worse/,2016-12-04 16:38:10,1,3,0,1,0,0,0,0,0
1170562502965493_1337646262923782,Trump: 'Mad Dog' Mattis 'Closest Thing We Have To Gen. George Patton',Trump: 'Mad Dog' Mattis 'Closest Thing We Have to Gen. George Patton' - USA News Home,link,http://rusharea.com/world-news/trump-mad-dog-mattis-closest-thing-gen-george-patton/,2016-12-03 19:30:00,1,0,0,1,0,0,0,0,0
1170562502965493_1337641066257635,BREAKING – Trump Just Set Washington ON FIRE With New Ruling That Has Lobbyists Terrified!,BREAKING – Trump Just Set Washington ON FIRE With New Ruling that Has Lobbyists Terrified! - USA News Home,link,http://rusharea.com/world-news/breaking-trump-just-set-washington-fire-new-ruling-lobbyists-terrified/,2016-12-03 17:59:00,4,4,0,3,0,0,1,0,0
1170562502965493_1337558962932512,ALERT: Feds Build Chilling 500 Bed Facility In Rural Texas To Accommodate Unstoppable Flow Of Illegals,ALERT: Feds Build Chilling 500 Bed Facility in Rural Texas to Accommodate Unstoppable Flow of Illegals - USA News Home,link,http://rusharea.com/world-news/alert-feds-build-chilling-500-bed-facility-rural-texas-accommodate-unstoppable-flow-illegals/,2016-12-03 16:30:00,0,0,0,0,0,0,0,0,0
1170562502965493_1337554559599619,"OUTRAGE: Before Leaving, Obama Enacts Rules To Take $3,000 From EVERY American","OUTRAGE: Before Leaving, Obama Enacts Rules to Take $3,000 From EVERY American - USA News Home",link,http://rusharea.com/world-news/outrage-leaving-obama-enacts-rules-take-3000-every-american/,2016-12-03 15:00:00,0,0,1,0,0,0,0,0,0
1170562502965493_1337548282933580,Carrier Deal Gets Worse As Trump Spent 7 Million Taxpayer Dollars To Keep 800 Jobs In US,Carrier Deal Gets Worse As Trump Spent 7 Million Taxpayer Dollars To Keep 800 Jobs In US - USA News Home,link,http://rusharea.com/world-news/carrier-deal-gets-worse-trump-spent-7-million-taxpayer-dollars-keep-800-jobs-us/,2016-12-03 14:00:00,3,9,0,0,0,0,0,1,2
1170562502965493_1337542376267504,WILL SMITH HOPES U.S. CAN 'CLEANSE' SELF OF TRUMP FANS,WILL SMITH HOPES U.S. CAN 'CLEANSE' SELF OF TRUMP FANS - USA News Home,link,http://rusharea.com/world-news/will-smith-hopes-u-s-can-cleanse-self-trump-fans/,2016-12-03 12:00:00,16,19,6,8,0,0,1,0,7
1170562502965493_1337525546269187,CNN Calls Sheriff Clarke A 'Terrorist' After Trump Considers Giving Him An Incredible New Job,CNN Calls Sheriff Clarke A 'Terrorist' After Trump Considers Giving Him An Incredible New Job - USA News Home,link,http://rusharea.com/world-news/cnn-calls-sheriff-clarke-terrorist-trump-considers-giving-incredible-new-job/,2016-12-03 08:56:27,4,2,0,3,0,0,0,1,0
1170562502965493_1337363619618713,'I Will Give You Everything.' Here Are 282 Of Donald Trump's Campaign Promises.,'I will give you everything.' Here are 282 of Donald Trump's campaign promises. - USA News Home,link,http://rusharea.com/world-news/will-give-everything-282-donald-trumps-campaign-promises/,2016-12-03 04:44:37,1,0,0,0,1,0,0,0,0
1170562502965493_1337006429654432,"Donald Trump Announced Rudy Giuliani's Position In His New Cabinet, Obama Is Pissed.","Donald Trump Announced Rudy Giuliani's Position In His New Cabinet, Obama Is Pissed. - USA News Home",link,http://rusharea.com/world-news/donald-trump-announced-rudy-giulianis-position-new-cabinet-obama-pissed/,2016-12-02 20:37:00,9,0,1,8,1,0,0,0,0
1170562502965493_1337003259654749,IT IS OFFICIAL: Trump WILL Go Through With Hillary's Prosecution After The Election Recount!,IT IS OFFICIAL: Trump WILL Go Through With Hillary's Prosecution After The Election Recount! - USA News Home,link,http://rusharea.com/world-news/official-trump-will-go-hillarys-prosecution-election-recount/,2016-12-02 19:21:07,11,3,2,9,0,0,2,0,0
1170562502965493_1336969616324780,Illinois Lawmaker Vows To Boycott Inauguration Over Trump's 'Bigotry',Illinois lawmaker vows to boycott inauguration over Trump's 'bigotry' - USA News Home,link,http://rusharea.com/world-news/illinois-lawmaker-vows-boycott-inauguration-trumps-bigotry/,2016-12-02 18:27:31,14,21,1,10,0,0,1,0,3
1170562502965493_1336876426334099,It's Official: Donald Trump Has Chosen Gen. James Mattis For Defense Secretary,It's official: Donald Trump has chosen Gen. James Mattis for defense secretary - USA News Home,link,http://rusharea.com/world-news/official-donald-trump-chosen-gen-james-mattis-defense-secretary/,2016-12-02 16:16:24,0,0,0,0,0,0,0,0,0
1170562502965493_1336735809681494,Michelle Obama Breaks Down In Tears After Melania Trump Destroys Her 'Legacy',Michelle Obama Breaks Down In Tears After Melania Trump Destroys Her 'Legacy' - USA News Home,link,http://rusharea.com/world-news/michelle-obama-breaks-tears-melania-trump-destroys-legacy/,2016-12-02 12:53:22,1,0,0,1,0,0,0,0,0
1170562502965493_1336095513078857,The House Science Committee Just Tweeted A Breitbart Article. Bernie Sanders' Response Is HILARIOUS.,The House Science Committee just tweeted a Breitbart article. Bernie Sanders' response is HILARIOUS. - USA News Home,link,http://rusharea.com/world-news/house-science-committee-just-tweeted-breitbart-article-bernie-sanders-response-hilarious/,2016-12-01 21:42:00,1,0,0,1,0,0,0,0,0
1170562502965493_1336093036412438,BREAKING REPORT: Romney Will NOT Get Secretary Of State Position,BREAKING REPORT: Romney Will NOT Get Secretary Of State Position - USA News Home,link,http://rusharea.com/world-news/breaking-report-romney-will-not-get-secretary-state-position/,2016-12-01 20:27:45,1,0,0,1,0,0,0,0,0
1170562502965493_1336030293085379,THE QUIET TRAGEDY OF MELANIA TRUMP,THE QUIET TRAGEDY OF MELANIA TRUMP - USA News Home,link,http://rusharea.com/world-news/quiet-tragedy-melania-trump/,2016-12-01 19:07:40,0,0,0,0,0,0,0,0,0
1170562502965493_1335959786425763,Obama Said America Wants Him Back For A Third Term… Here's How America Replied,Obama Said America Wants Him Back For A Third Term… Here's How America Replied - USA News Home,link,http://rusharea.com/world-news/obama-said-america-wants-back-third-term-heres-america-replied-2/,2016-12-01 17:21:02,2,3,0,0,0,0,2,0,0
1170562502965493_1335892033099205,Michelle Obama Breaks Down In Tears After Melania Trump Destroys Her 'Legacy',Michelle Obama Breaks Down In Tears After Melania Trump Destroys Her 'Legacy' - USA News Home,link,http://rusharea.com/world-news/michelle-obama-breaks-tears-melania-trump-destroys-legacy/,2016-12-01 15:31:27,11,6,1,8,0,0,3,0,0
1170562502965493_1335819183106490,MUST WATCH VIDEO! MSNBC ANCHOR CAN'T CONTROL HIMSELF WHILE WATCHING HILLARY EAT HER OWN WORDS!,MUST WATCH VIDEO! MSNBC ANCHOR CAN'T CONTROL HIMSELF WHILE WATCHING HILLARY EAT HER OWN WORDS! - USA News Home,link,http://rusharea.com/world-news/must-watch-video-msnbc-anchor-cant-control-watching-hillary-eat-words/,2016-12-01 13:33:26,1,0,3,1,0,0,0,0,0
1170562502965493_1335765163111892,"LISTEN: Audio Of ""Trump Pilot"" Talking To Celebs On Board Plane Goes Viral","LISTEN: Audio of ""Trump Pilot"" Talking to Celebs on Board Plane Goes Viral - USA News Home",link,http://rusharea.com/world-news/listen-audio-trump-pilot-talking-celebs-board-plane-goes-viral/,2016-12-01 12:11:34,1,0,0,1,0,0,0,0,0
1170562502965493_1335153003173108,"Trump's Attorney General: ""Irritating"" Disabled Kids Ruin Public Schools","Trump's Attorney General: ""Irritating"" Disabled Kids Ruin Public Schools - USA News Home",link,http://rusharea.com/world-news/trumps-attorney-general-irritating-disabled-kids-ruin-public-schools/,2016-11-30 19:01:09,0,2,0,0,0,0,0,0,0
1170562502965493_1335022746519467,"Mr. Trump, Meet The Constitution","Mr. Trump, Meet the Constitution - USA News Home",link,http://rusharea.com/world-news/mr-trump-meet-constitution/,2016-11-30 16:29:06,0,0,0,0,0,0,0,0,0
1170562502965493_1334956853192723,Trump To Announce Carrier Plant Will Keep Jobs In U.S.,Trump to Announce Carrier Plant Will Keep Jobs in U.S. - USA News Home,link,http://rusharea.com/world-news/trump-announce-carrier-plant-will-keep-jobs-u-s/,2016-11-30 14:48:05,1,1,0,1,0,0,0,0,0
1170562502965493_1333294283358980,Donald Trump Is Making A Strong Case For A Recount Of His Own 2016 Election Win,Donald Trump is making a strong case for a recount of his own 2016 election win - USA News Home,link,http://rusharea.com/world-news/donald-trump-making-strong-case-recount-2016-election-win/,2016-11-28 16:38:59,1,0,0,1,0,0,0,0,0
1170562502965493_1333238826697859,Trump Falsely Claims 'Millions Of People Who Voted Illegally' Cost Him Popular Vote,Trump falsely claims 'millions of people who voted illegally' cost him popular vote - USA News Home,link,http://rusharea.com/world-news/trump-falsely-claims-millions-people-voted-illegally-cost-popular-vote/,2016-11-28 14:57:48,0,2,0,0,0,0,0,0,0
1170562502965493_1332555826766159,Obama's Top Lawyer Just Called For The Electoral College To Reject Trump,Obama's Top Lawyer Just Called For The Electoral College To Reject Trump - USA News Home,link,http://rusharea.com/world-news/obamas-top-lawyer-just-called-electoral-college-reject-trump/,2016-11-27 20:03:04,10,3,5,6,1,0,0,0,3
1170562502965493_1332323426789399,Trump Fails His First Diplomatic Test,Trump fails his first diplomatic test - USA News Home,link,http://rusharea.com/world-news/trump-fails-first-diplomatic-test/,2016-11-27 16:25:00,2,4,0,2,0,0,0,0,0
1170562502965493_1332275426794199,Hillary Clinton's Campaign Says It Will Participate In Wisconsin Recount,Hillary Clinton's Campaign Says It Will Participate In Wisconsin Recount - USA News Home,link,http://rusharea.com/world-news/hillary-clintons-campaign-says-will-participate-wisconsin-recount/,2016-11-27 14:30:00,1,0,0,0,0,0,0,0,1
1170562502965493_1332207233467685,"Green Party Files For Wisconsin Recount, Audit","Green Party files for Wisconsin recount, audit - USA News Home",link,http://rusharea.com/world-news/green-party-files-wisconsin-recount-audit/,2016-11-27 13:00:00,1,0,0,1,0,0,0,0,0
1170562502965493_1332202120134863,Trump Condemns Castro As 'Brutal Dictator',Trump condemns Castro as 'brutal dictator' - USA News Home,link,http://rusharea.com/world-news/trump-condemns-castro-brutal-dictator/,2016-11-27 11:20:45,2,0,0,2,0,0,0,0,0
1170562502965493_1331535613534847,Clinton Campaign Agrees To Back Jill Stein's Election Recount Effort: Lawyer,Clinton Campaign Agrees to Back Jill Stein's Election Recount Effort: Lawyer - USA News Home,link,http://rusharea.com/world-news/clinton-campaign-agrees-back-jill-steins-election-recount-effort-lawyer/,2016-11-26 16:28:42,1,2,0,0,0,0,0,0,1
1170562502965493_1329885213699887,Hillary Clinton's Lead In Popular Vote Nears 2 Million,Hillary Clinton's lead in popular vote nears 2 million - USA News Home,link,http://rusharea.com/world-news/hillary-clintons-lead-popular-vote-nears-2-million/,2016-11-24 19:19:51,7,10,1,4,0,0,0,0,3
1170562502965493_1329839360371139,"Ivanka Trump In '06: 'If He Wasn't My Father, I Would Spray Him With Mace'","Ivanka Trump in '06: 'If he wasn't my father, I would spray him with Mace' - USA News Home",link,http://rusharea.com/world-news/ivanka-trump-06-wasnt-father-spray-mace/,2016-11-24 17:59:56,1,1,0,1,0,0,0,0,0
1170562502965493_1328925877129154,Samuel L. Jackson P*SSED When Asked If His Bags Are Packed Over TRUMP Win On LIVE TV,Samuel L. Jackson P*SSED When Asked If His Bags Are Packed Over TRUMP Win On LIVE TV,link,http://rusharea.com/world-news/samuel-l-jackson-pssed-asked-bags-packed-trump-win-live-tv/,2016-11-23 17:15:52,9,0,1,6,0,0,3,0,0
1170562502965493_1327988953889513,CEO WHO THREATENED TO KILL TRUMP WITH SNIPER RIFLE SAYS LIFE HAS BEEN TURNED UPSIDE DOWN [VIDEO],CEO WHO THREATENED TO KILL TRUMP WITH SNIPER RIFLE SAYS LIFE HAS BEEN TURNED UPSIDE DOWN [VIDEO] - USA News Home,link,http://rusharea.com/world-news/ceo-threatened-kill-trump-sniper-rifle-says-life-turned-upside-video/,2016-11-22 15:54:57,1,0,0,1,0,0,0,0,0
1170562502965493_1327170593971349,Rev. Al Sharpton IS GOING TO PRISON!?!,Rev. Al Sharpton IS GOING TO PRISON!?! - USA News Home,link,http://rusharea.com/world-news/rev-al-sharpton-going-prison/,2016-11-21 18:02:24,3,2,1,3,0,0,0,0,0
1170562502965493_1327167207305021,Rev. Al Sharpton IS GOING TO PRISON!?!,Rev. Al Sharpton IS GOING TO PRISON!?! - USA News Home,link,http://rusharea.com/world-news/rev-al-sharpton-going-prison/,2016-11-21 17:56:41,0,0,0,0,0,0,0,0,0
1170562502965493_1325249247496817,"OBAMA TRIES TO PASS LAST SECOND EXECUTIVE ORDER, FURIOUS AFTER CONGRESS BLOCKS HIS ATTEMPT","OBAMA TRIES TO PASS LAST SECOND EXECUTIVE ORDER, FURIOUS AFTER CONGRESS BLOCKS HIS ATTEMPT - USA News Home",link,http://rusharea.com/world-news/obama-tries-pass-last-second-executive-order-furious-congress-blocks-attempt/,2016-11-19 13:47:11,8,2,2,3,1,0,4,0,0
1170562502965493_1325174227504319,Miley Cyrus Is BRUTALLY CRUSHED After Trying To Challenge Donald Trump,"Miley Cyrus Is BRUTALLY CRUSHED After Trying To Challenge Donald Trump, Says She Is Leaving America For Good",link,http://rusharea.com/world-news/miley-cyrus-brutally-crushed-trying-challenge-donald-trump-says-leaving-america-good/,2016-11-19 12:43:04,4,2,0,2,1,0,1,0,0
1170562502965493_1321790861175989,Clinton's Career Buried As Leaked Picture Exposes Dirty Bedroom Deed,Clinton's Career Buried As Leaked Picture Exposes Dirty Bedroom Deed - USA News Home,link,http://usanewshome.com/world-news/clintons-career-buried-leaked-picture-exposes-dirty-bedroom-deed/,2016-11-15 15:53:06,6,4,3,3,0,1,1,1,0
1170562502965493_1321147411240334,Kim Kardashian Leaving The U.S. For Good With Kanye After Trump Hits A Nerve,Kim Kardashian Leaving The U.S. For Good With Kanye After Trump Hits A Nerve - USA News Home,link,http://usanewshome.com/world-news/kim-kardashian-leaving-u-s-good-kanye-trump-hits-nerve/,2016-11-14 19:04:47,12,5,0,7,2,0,3,0,0
1170562502965493_1320928957928846,Donald Trump Tells Colin Kaepernick To Leave The Country,Donald Trump Tells Colin Kaepernick To Leave The Country - USA News Home,link,http://usanewshome.com/world-news/donald-trump-tells-colin-kaepernick-leave-country/,2016-11-14 15:14:20,5,4,1,4,0,0,0,1,0
1170562502965493_1319829924705416,"VOTE NOW !!
http://usanewshome.com/world-news/live-poll-will-melania-trump-better-first-lady-michelle-obama-vote-now/",LIVE POLL – Will Melania Trump Be a Better First Lady Than Michelle Obama? VOTE NOW - USA News Home,link,http://usanewshome.com/world-news/live-poll-will-melania-trump-better-first-lady-michelle-obama-vote-now/,2016-11-13 18:45:57,0,3,0,0,0,0,0,0,0
1170562502965493_1319674181387657,"Obama Recognized Ellen DeGeneres For 'Changing Hearts And Minds,' Empowering LGBT Americans","Obama Recognized Ellen DeGeneres For 'Changing Hearts And Minds,' Empowering LGBT Americans - USA News Home",link,http://usanewshome.com/world-news/obama-recognized-ellen-degeneres-changing-hearts-minds-empowering-lgbt-americans/,2016-11-13 17:44:10,1,0,0,1,0,0,0,0,0
1170562502965493_1318346218187120,"Million Women March Being Planned For January 21, 2017 In D.C.","Million Women March being planned for January 21, 2017 in D.C. - USA News Home",link,http://usanewshome.com/world-news/million-women-march-planned-january-21-2017-d-c/,2016-11-12 23:00:00,7,3,6,1,0,0,3,1,2
1170562502965493_1318328758188866,Trump Just Announced He Will Not Repeal Obamacare,Trump just announced he will not repeal Obamacare - USA News Home,link,http://usanewshome.com/world-news/trump-just-announced-will-not-repeal-obamacare/,2016-11-12 21:00:00,4,0,1,4,0,0,0,0,0
1170562502965493_1318322161522859,Bernie Sanders: Where The Democrats Go From Here,Bernie Sanders: Where the Democrats Go From Here - USA News Home,link,http://usanewshome.com/world-news/bernie-sanders-democrats-go/,2016-11-12 19:00:00,0,0,0,0,0,0,0,0,0
1170562502965493_1318318661523209,Trump's FIRST Order: Anyone Burning An American Flag To Be Charged With TREASON,Trump's FIRST Order: Anyone Burning An American Flag To Be Charged With TREASON - USA News Home,link,http://usanewshome.com/world-news/trumps-first-order-anyone-burning-american-flag-charged-treason/,2016-11-12 17:44:00,7,8,6,6,0,0,1,0,0
1170562502965493_1318315131523562,History Tells Us What Will Happen Next With Brexit And Trump,History Tells Us What Will Happen Next With Brexit And Trump - USA News Home,link,http://usanewshome.com/world-news/history-tells-us-will-happen-next-brexit-trump/,2016-11-12 16:00:00,0,0,0,0,0,0,0,0,0
1170562502965493_1318309754857433,Don't Let Obama's Conciliatory Tone Fool You; Here's What's REALLY Going On…,Don't let Obama's conciliatory tone fool you; here's what's REALLY going on… - USA News Home,link,http://usanewshome.com/world-news/dont-let-obamas-conciliatory-tone-fool-heres-whats-really-going/,2016-11-12 14:29:00,2,1,0,2,0,0,0,0,0
1170562502965493_1316912298330512,YES! Talking about a perfect fit ..,"Trump Makes YUGE Announcement On Ben Carson…'In My White House, He Will…' - Life And About",link,http://lifeandabout.com/2016/10/trump-carson-announcement-white-house/,2016-11-10 21:48:00,1,1,0,1,0,0,0,0,0
1170562502965493_1316908351664240,Actor Ron Perlman Says He's Running For President In 2020,Actor Ron Perlman says he's running for president in 2020 - USA News Home,link,http://usanewshome.com/world-news/actor-ron-perlman-says-hes-running-president-2020/,2016-11-10 20:40:00,0,1,0,0,0,0,0,0,0
1170562502965493_1316896751665400,Trump's Running Mate ADMITS Election Is RIGGED – Reveals TRAGIC Evidence,BREAKING: Mike Pence Makes Heartbreaking Announcement… IT'S HAPPENING!,link,http://usanewshome.com/us-news/trumps-running-mate-admits-election-rigged-reveals-tragic-evidence/,2016-11-10 19:11:39,0,1,0,0,0,0,0,0,0
1170562502965493_1316841985004210,"Here's How The Electoral College Could Prevent A Donald Trump Presidency, Even If He Wins The Popular Vote","Here's how the Electoral College could prevent a Donald Trump presidency, even if he wins the popular vote - USA News Home",link,http://usanewshome.com/world-news/heres-electoral-college-prevent-donald-trump-presidency-even-wins-popular-vote/,2016-11-10 17:53:50,0,0,0,0,0,0,0,0,0
1170562502965493_1316723371682738,Sharpton: 'We Are Not Going Down Without A Fight And Donald Needs To Know That',Sharpton: 'We Are Not Going Down Without a Fight and Donald Needs to Know That' - USA News Home,link,http://usanewshome.com/world-news/sharpton-not-going-without-fight-donald-needs-know/,2016-11-10 15:00:11,3,10,3,2,0,0,1,0,0
1170562502965493_1316668698354872,LANDSLIDE: Trump 306 Electoral Votes Vs 232 Clinton Electoral Votes,LANDSLIDE: Trump 306 Electoral Votes vs 232 Clinton Electoral Votes - USA News Home,link,http://usanewshome.com/world-news/landslide-trump-306-electoral-votes-vs-232-clinton-electoral-votes/,2016-11-10 13:48:16,1,0,3,1,0,0,0,0,0
1170562502965493_1316578725030536,Is Donald Trump's Life Really In Danger?,Is Donald Trump's Life Really In Danger?,link,http://usanewshome.com/world-news/donald-trumps-life-really-danger/,2016-11-10 11:59:06,0,0,0,0,0,0,0,0,0
1170562502965493_1315997998421942,Rand Paul: We'll Spend President Trump's First Month Repealing Regulations – Including ObamaCare,Rand Paul: We'll spend President Trump's first month repealing regulations - including ObamaCare - USA News Home,link,http://usanewshome.com/world-news/rand-paul-well-spend-president-trumps-first-month-repealing-regulations-including-obamacare/,2016-11-09 18:28:03,8,0,1,7,1,0,0,0,0
1170562502965493_1315956601759415,Thousands Of High School Students Walk Out To Protest Trump Win,Thousands Of High School Students Walk Out To Protest Trump Win - USA News Home,link,http://usanewshome.com/world-news/thousands-high-school-students-walk-protest-trump-win/,2016-11-09 17:06:04,9,12,1,5,0,0,3,0,1
1170562502965493_1315908811764194,"Moments After Winning, Trump Got A Phone Call That'll CHANGE The World Forever…","Moments After Winning, Trump Got A Phone Call That'll CHANGE The World Forever… - USA News Home",link,http://usanewshome.com/world-news/moments-winning-trump-got-phone-call-thatll-change-world-forever/,2016-11-09 16:03:31,3,0,0,3,0,0,0,0,0
1170562502965493_1315258201829255,World Reacts To Shock Election Result: Donald Trump Is America's Next President,World reacts to shock election result: Donald Trump is America's next president - USA News Home,link,http://usanewshome.com/world-news/world-reacts-shock-election-result-donald-trump-americas-next-president/,2016-11-09 02:19:20,5,0,2,5,0,0,0,0,0
1170562502965493_1315048121850263,"Election Day 2016: Trump, Clinton Score First Wins On Historic Night","Election Day 2016: Trump, Clinton score first wins on historic night - USA News Home",link,http://usanewshome.com/world-news/election-day-2016-trump-clinton-score-first-wins-historic-night/,2016-11-08 20:17:51,1,1,0,1,0,0,0,0,0
1170562502965493_1315028385185570,YES !,CNN MAKES MASSIVE ELECTION ANNOUNCEMENT – Hillary Panicking… - Life And About,link,http://lifeandabout.com/2016/11/cnn-makes-massive-election-announcement-hillary-panicking/,2016-11-08 19:39:36,0,1,0,0,0,0,0,0,0
1170562502965493_1315021968519545,Donald Trump Caught Looking Over Wife Melania's Shoulder As She Casts Vote — Son Eric Does Same Exact Thing,Donald Trump caught looking over wife Melania's shoulder as she casts vote — son Eric does same exact thing - USA News Home,link,http://usanewshome.com/world-news/donald-trump-caught-looking-wife-melanias-shoulder-casts-vote-son-eric-exact-thing/,2016-11-08 19:28:09,0,1,0,0,0,0,0,0,0
1170562502965493_1314994575188951,Breaking! Early Voting Results Show Shocking Landslide In NC,Breaking! Early voting results show shocking landslide in NC - USA News Home,link,http://usanewshome.com/world-news/breaking-early-voting-results-show-shocking-landslide-nc/,2016-11-08 18:37:54,3,0,0,3,0,0,0,0,0
1170562502965493_1314923145196094,Trump Wins Florida In Unprecedented Landslide,Trump Wins Florida In Unprecedented Landslide - USA News Home,link,http://usanewshome.com/world-news/trump-wins-florida-unprecedented-landslide/,2016-11-08 16:27:28,21,11,3,17,1,0,3,0,0
1170562502965493_1314692901885785,BREAKING: ISIS Calls On Supporters To 'Slaughter' US Voters On Election Day,BREAKING: ISIS Calls On Supporters To 'Slaughter' US Voters On Election Day - USA News Home,link,http://usanewshome.com/world-news/breaking-isis-calls-supporters-slaughter-us-voters-election-day/,2016-11-08 10:55:38,2,4,1,0,0,0,0,0,2
1170562502965493_1313956145292794,Newt Gingrich Just Exposed The Real Reason Why James Comey Let Hillary Go. Oh My.,Newt Gingrich Just Exposed The Real Reason Why James Comey Let Hillary Go. Oh My. - USA News Home,link,http://usanewshome.com/world-news/newt-gingrich-just-exposed-real-reason-james-comey-let-hillary-go-oh/,2016-11-07 13:27:53,2,1,1,2,0,0,0,0,0
1170562502965493_1313212815367127,The Electoral Map Is Definitely Moving In Donald Trump's Direction,The Electoral Map is Definitely Moving in Donald Trump's Direction - USA News Home,link,http://usanewshome.com/world-news/electoral-map-definitely-moving-donald-trumps-direction/,2016-11-06 17:57:02,3,1,0,2,0,0,1,0,0
1170562502965493_1313149202040155,Julian Assange: Isis And Clinton Foundation Are Both Funded By Saudi Arabia And Qatar,Julian Assange: Isis and Clinton Foundation are both funded by Saudi Arabia and Qatar - USA News Home,link,http://usanewshome.com/world-news/julian-assange-isis-clinton-foundation-funded-saudi-arabia-qatar/,2016-11-06 16:08:58,7,1,3,5,0,0,0,1,1
1170562502965493_1312926748729067,BREAKING: Donald Trump Just Announced His Pick For Attorney General – Hillary's Worst Nightmare!,BREAKING: Donald Trump Just Announced His Pick for Attorney General – Hillary's Worst Nightmare! - USA News Home,link,http://usanewshome.com/world-news/breaking-donald-trump-just-announced-pick-attorney-general-hillarys-worst-nightmare-2/,2016-11-06 11:08:57,4,1,0,3,0,0,1,0,0
1170562502965493_1309544195733989,THE LAST MAN TO HOLD THE TITLE OF REPUBLICAN PRESIDENTIAL NOMINEE WARNING HIS PARTY ABOUT DONALD TRUMP.,THE LAST MAN TO HOLD THE TITLE OF REPUBLICAN PRESIDENTIAL NOMINEE WARNING HIS PARTY ABOUT DONALD TRUMP. - USA News Home,link,http://usanewshome.com/world-news/last-man-hold-title-republican-presidential-nominee-warning-party-donald-trump/,2016-11-02 19:43:23,2,1,0,2,0,0,0,0,0
1170562502965493_1309369885751420,"JULIAN ASSANGE: ""THE WORLD WILL NOW SEE HILLARY'S TIES TO SAUDI ISIS. HERE ARE THE EMAILS!""","JULIAN ASSANGE: ""THE WORLD WILL NOW SEE HILLARY'S TIES TO SAUDI ISIS. HERE ARE THE EMAILS!"" - USA News Home",link,http://usanewshome.com/world-news/julian-assange-world-will-now-see-hillarys-ties-saudi-isis-emails-2/,2016-11-02 15:09:48,21,2,6,15,4,2,0,0,0
1170562502965493_1308427525845656,Do you want Judge Jeanine Pirro to replace Megyn Kelly on Fox News ?,HOT POLL : Do you want Judge Jeanine Pirro to replace Megyn Kelly on Fox News ? - USA News Home,link,http://usanewshome.com/world-news/hot-poll-want-judge-jeanine-pirro-replace-megyn-kelly-fox-news/,2016-11-01 14:24:05,10,9,2,10,0,0,0,0,0
1170562502965493_1308405562514519,SHOULD TRUMP AND PENCE CHALLENGE THE ELECTION IF HILLARY IS CAUGHT CHEATING?,SHOULD TRUMP AND PENCE CHALLENGE THE ELECTION IF HILLARY IS CAUGHT CHEATING? - USA News Home,link,http://usanewshome.com/world-news/trump-pence-challenge-election-hillary-caught-cheating/,2016-11-01 13:44:37,10,14,1,10,0,0,0,0,0
