status_id,status_message,link_name,status_type,status_link,status_published,num_reactions,num_comments,num_shares,num_likes,num_loves,num_wows,num_hahas,num_sads,num_angrys
1170562502965493_1379347685420306,Hillary's Delusion: 'I'm Going To Run Again In 2020',Hillary's Delusion: 'I'm Going to Run Again in 2020' - USA News Home,link,http://rusharea.com/world-news/hillarys-delusion-im-going-run-2020/,2016-12-30 01:00:00,4,1,2,1,0,0,2,1,0
1170562502965493_1379341982087543,BREAKING: DONALD TRUMP JUST PUT HIS FIRST EXECUTIVE ORDER IN WRITING AND OBAMA IS FURIOUS!,BREAKING: DONALD TRUMP JUST PUT HIS FIRST EXECUTIVE ORDER IN WRITING AND OBAMA IS FURIOUS! - USA News Home,link,http://rusharea.com/world-news/breaking-donald-trump-just-put-first-executive-order-writing-obama-furious/,2016-12-29 23:00:00,11,0,5,9,1,0,1,0,0
1170562502965493_1379320775422997,"Trump Accuser Was Paid $500,000 TO LIE FOR HILLARY","Trump Accuser Was Paid $500,000 TO LIE FOR HILLARY - USA News Home",link,http://rusharea.com/world-news/trump-accuser-paid-500000-lie-hillary/,2016-12-29 21:00:00,3,0,3,3,0,0,0,0,0
1170562502965493_1379310402090701,Trump Accuses Obama Of Putting Up 'Roadblocks' To A Smooth Transition,Trump accuses Obama of putting up 'roadblocks' to a smooth transition - USA News Home,link,http://rusharea.com/world-news/trump-accuses-obama-putting-roadblocks-smooth-transition/,2016-12-29 19:00:00,0,1,0,0,0,0,0,0,0
1170562502965493_1379297375425337,Economists Say Trump Delivered Hope,Economists say Trump delivered hope - USA News Home,link,http://rusharea.com/world-news/economists-say-trump-delivered-hope/,2016-12-29 17:25:04,0,0,0,0,0,0,0,0,0
1170562502965493_1379062592115482,Trump Accuses Obama Of Putting Up 'Roadblocks' To A Smooth Transition,Trump accuses Obama of putting up 'roadblocks' to a smooth transition - USA News Home,link,http://rusharea.com/world-news/trump-accuses-obama-putting-roadblocks-smooth-transition/,2016-12-29 15:00:00,0,0,0,0,0,0,0,0,0
1170562502965493_1379015708786837,Economists Say Trump Delivered Hope,Economists say Trump delivered hope - USA News Home,link,http://rusharea.com/world-news/economists-say-trump-delivered-hope/,2016-12-29 13:33:41,2,1,0,2,0,0,0,0,0
1170562502965493_1377570652264676,Michelle Obama Breaks Down In Tears After Melania Trump Destroys Her 'Legacy',Michelle Obama Breaks Down In Tears After Melania Trump Destroys Her 'Legacy',link,http://rusharea.com/world-news/michelle-obama-breaks-tears-melania-trump-destroys-legacy/,2016-12-29 11:00:00,11,3,1,5,1,1,4,0,0
1170562502965493_1377560708932337,Trump Fails His First Diplomatic Test,Trump fails his first diplomatic test,link,http://rusharea.com/world-news/trump-fails-first-diplomatic-test/,2016-12-29 09:06:01,0,2,0,0,0,0,0,0,0
1170562502965493_1377551278933280,Obama's Top Lawyer Just Called For The Electoral College To Reject Trump,Obama's Top Lawyer Just Called For The Electoral College To Reject Trump,link,http://rusharea.com/world-news/obamas-top-lawyer-just-called-electoral-college-reject-trump/,2016-12-29 07:00:00,0,3,0,0,0,0,0,0,0
1170562502965493_1377534478934960,"BREAKING – Trump DEFIES Obama, Tells Americans What Obama Is Doing Behind The Scenes","BREAKING – Trump DEFIES Obama, Tells Americans What Obama is Doing Behind the Scenes - USA News Home",link,http://rusharea.com/world-news/breaking-trump-defies-obama-tells-americans-obama-behind-scenes/,2016-12-29 05:00:00,4,0,2,3,0,1,0,0,0
1170562502965493_1377520875602987,"BREAKING – Congress DEFIES Obama, Issues MASSIVE Response To Attacks On Israel","BREAKING – Congress DEFIES Obama, Issues MASSIVE Response to Attacks on Israel - USA News Home",link,http://rusharea.com/world-news/breaking-congress-defies-obama-issues-massive-response-attacks-israel/,2016-12-29 03:00:00,4,2,0,3,0,1,0,0,0
1170562502965493_1377510802270661,She Used Me! Megyn Kelly Lashes Out Against Hillary Clinton In Unexpected Way,She Used Me! Megyn Kelly Lashes Out Against Hillary Clinton In Unexpected Way - USA News Home,link,http://rusharea.com/world-news/used-megyn-kelly-lashes-hillary-clinton-unexpected-way/,2016-12-29 01:00:00,5,4,0,3,0,0,2,0,0
1170562502965493_1377488418939566,Jackie Evancho Just Got Life-Changing News After Agreeing To Perform At Inauguration [Details],Jackie Evancho Just Got Life-Changing News After Agreeing To Perform At Inauguration [Details] - USA News Home,link,http://rusharea.com/world-news/jackie-evancho-just-got-life-changing-news-agreeing-perform-inauguration-details/,2016-12-28 23:00:00,4,1,1,3,0,1,0,0,0
1170562502965493_1377465055608569,"House Financial Service Member Has On Air Hissy Fit Over Trump, I Will Not Work With Him!","House Financial Service Member Has On Air Hissy Fit Over Trump, I Will Not Work With Him! - USA News Home",link,http://rusharea.com/world-news/house-financial-service-member-air-hissy-fit-trump-will-not-work/,2016-12-28 21:00:00,3,8,0,1,0,0,0,0,2
1170562502965493_1377434802278261,Unexpected Twist In President Obama's Vacation Cost Scandal,Unexpected Twist In President Obama's Vacation Cost Scandal - USA News Home,link,http://rusharea.com/world-news/unexpected-twist-president-obamas-vacation-cost-scandal/,2016-12-28 19:00:00,4,1,3,1,0,0,0,0,3
1170562502965493_1377327405622334,Clinton's Career Buried As Leaked Picture Exposes Dirty Bedroom Deed,Do You Recognize Who is in The Photo?,link,http://rusharea.com/world-news/clintons-career-buried-leaked-picture-exposes-dirty-bedroom-deed/,2016-12-28 17:25:17,4,5,0,3,0,0,0,0,1
1170562502965493_1376759782345763,Shocking! John Bolton Reveals The Terrible Truth Behind Obama's Abstention!,Shocking! John Bolton Reveals The Terrible Truth Behind Obama's Abstention! - USA News Home,link,http://rusharea.com/world-news/shocking-john-bolton-reveals-terrible-truth-behind-obamas-abstention/,2016-12-28 15:00:00,1,2,1,1,0,0,0,0,0
1170562502965493_1376779862343755,WATCH – Krauthammer Says Trump Should Do THIS With The UN Building – Do You Agree?,WATCH – Krauthammer Says Trump Should Do THIS With The UN Building – Do You Agree? - USA News Home,link,http://rusharea.com/world-news/watch-krauthammer-says-trump-un-building-agree/,2016-12-28 14:00:00,3,0,0,3,0,0,0,0,0
1170562502965493_1376751959013212,U.S. Navy Takes Massive Stand Against Obama… They've Had Enough,U.S. Navy Takes Massive Stand Against Obama… They've Had Enough - USA News Home,link,http://rusharea.com/world-news/u-s-navy-takes-massive-stand-obama-theyve-enough/,2016-12-28 12:00:00,6,3,2,6,0,0,0,0,0
1170562502965493_1374961139192294,Samuel L. Jackson P*SSED When Asked If His Bags Are Packed Over TRUMP Win On LIVE TV,Samuel L. Jackson P*SSED When Asked If His Bags Are Packed Over TRUMP Win On LIVE TV,link,http://rusharea.com/world-news/samuel-l-jackson-pssed-asked-bags-packed-trump-win-live-tv/,2016-12-28 10:00:00,2,2,2,1,0,1,0,0,0
1170562502965493_1374951555859919,Rev. Al Sharpton IS GOING TO PRISON!?!,Rev. Al Sharpton IS GOING TO PRISON!?!,link,http://rusharea.com/world-news/rev-al-sharpton-going-prison/,2016-12-28 08:00:00,4,1,1,3,1,0,0,0,0
1170562502965493_1374943272527414,"OBAMA TRIES TO PASS LAST SECOND EXECUTIVE ORDER, FURIOUS AFTER CONGRESS BLOCKS HIS ATTEMPT","OBAMA TRIES TO PASS LAST SECOND EXECUTIVE ORDER, FURIOUS AFTER CONGRESS BLOCKS HIS ATTEMPT",link,http://rusharea.com/world-news/obama-tries-pass-last-second-executive-order-furious-congress-blocks-attempt/,2016-12-28 06:00:00,6,4,0,5,0,1,0,0,0
1170562502965493_1374926612529080,"Miley Cyrus Is BRUTALLY CRUSHED After Trying To Challenge Donald Trump, Says She Is Leaving America For Good","Miley Cyrus Is BRUTALLY CRUSHED After Trying To Challenge Donald Trump, Says She Is Leaving America For Good",link,http://rusharea.com/world-news/miley-cyrus-brutally-crushed-trying-challenge-donald-trump-says-leaving-america-good/,2016-12-28 04:00:00,14,15,2,13,0,0,1,0,0
1170562502965493_1374910212530720,Donald Trump Tells Colin Kaepernick To Leave The Country,Donald Trump Tells Colin Kaepernick To Leave The Country,link,http://rusharea.com/world-news/donald-trump-tells-colin-kaepernick-leave-country/,2016-12-28 02:00:00,9,11,3,8,0,0,0,0,1
1170562502965493_1374902755864799,Julian Assange Mocks Hillary Clinton In New Interview: She 'Destroyed Herself',Julian Assange mocks Hillary Clinton in new interview: She 'destroyed herself' - USA News Home,link,http://rusharea.com/world-news/julian-assange-mocks-hillary-clinton-new-interview-destroyed/,2016-12-28 00:00:00,4,0,0,4,0,0,0,0,0
1170562502965493_1374895292532212,Ted Cruz Gives Inspiring Call To Action To Stop The UN Once And For All,Ted Cruz Gives Inspiring Call To Action To Stop The UN Once And For All - USA News Home,link,http://rusharea.com/world-news/ted-cruz-gives-inspiring-call-action-stop-un/,2016-12-27 22:00:00,6,0,1,6,0,0,0,0,0
1170562502965493_1374882019200206,Deport HIM ! !,BOMBSHELL – Hawaii Just Confirmed THIS Sick Truth About Obama's Birth Certificate - USA News Home,link,http://rusharea.com/world-news/bombshell-hawaii-just-confirmed-sick-truth-obamas-birth-certificate/,2016-12-27 20:00:00,5,10,1,4,0,0,1,0,0
1170562502965493_1374872852534456,Sources: Russia Could Veto UN Settlements Resolution To Embarrass Obama,Sources: Russia Could Veto UN Settlements Resolution To Embarrass Obama - USA News Home,link,http://rusharea.com/world-news/sources-russia-veto-un-settlements-resolution-embarrass-obama/,2016-12-27 17:59:00,4,0,0,4,0,0,0,0,0
1170562502965493_1374752955879779,Hillary's Delusion: 'I'm Going To Run Again In 2020',Hillary's Delusion: 'I'm Going to Run Again in 2020' - USA News Home,link,http://rusharea.com/world-news/hillarys-delusion-im-going-run-2020/,2016-12-27 16:00:00,14,28,5,4,0,0,7,0,3
1170562502965493_1374625889225819,DEPORT HIM !,Obama's Birth Certificate Now Reveals THIS Huge Truth! - Life And About,link,http://lifeandabout.com/2016/12/obamas-birth-certificate-now-reveals-huge-truth/,2016-12-27 14:33:02,15,18,6,8,0,0,4,0,3
1170562502965493_1370332289655179,"BREAKING: Israel Pleads For Trump's Help After Obama Ambush, Trump Call Egyptian President And Changes EVERYTHING","BREAKING: Israel Pleads for Trump's Help After Obama Ambush, Trump Call Egyptian President and Changes EVERYTHING - USA News Home",link,http://rusharea.com/world-news/breaking-israel-pleads-trumps-help-obama-ambush-trump-call-egyptian-president-changes-everything/,2016-12-25 23:00:00,5,3,1,4,0,0,0,1,0
1170562502965493_1370302029658205,Propane Dealer Who Refused To Deliver To Trump Supporters Busted For Not Being Licensed,Propane Dealer Who Refused To Deliver to Trump Supporters Busted for Not Being Licensed - USA News Home,link,http://rusharea.com/world-news/propane-dealer-refused-deliver-trump-supporters-busted-not-licensed/,2016-12-25 21:00:00,5,4,0,3,0,0,2,0,0
1170562502965493_1370285672993174,Shocking! Liberals Go After Trump's Children!,Shocking! Liberals Go After Trump's Children! - USA News Home,link,http://rusharea.com/world-news/shocking-liberals-go-trumps-children/,2016-12-25 19:00:00,0,1,0,0,0,0,0,0,0
1170562502965493_1370246146330460,Pence Did The Unthinkable! He Revealed The Truth About Hillary!,Pence Did The Unthinkable! He Revealed The Truth About Hillary! - USA News Home,link,http://rusharea.com/world-news/pence-unthinkable-revealed-truth-hillary/,2016-12-25 17:00:00,2,1,0,2,0,0,0,0,0
1170562502965493_1370164529671955,BREAKING: Trump Just Revealed Who Will Perform During His Inauguration – This Is Just Too Much!,BREAKING: Trump Just Revealed Who Will Perform During His Inauguration – This Is Just Too Much! - USA News Home,link,http://rusharea.com/world-news/breaking-trump-just-revealed-will-perform-inauguration-just-much/,2016-12-25 15:00:00,4,3,0,4,0,0,0,0,0
1170562502965493_1370147283007013,BREAKING – Obama Outed By Congress On Largest Money Laundering SCHEME!,BREAKING – Obama Outed By Congress On Largest Money Laundering SCHEME! - USA News Home,link,http://rusharea.com/world-news/breaking-obama-outed-congress-largest-money-laundering-scheme/,2016-12-25 13:00:00,5,8,0,3,0,0,2,0,0
1170562502965493_1368656549822753,Don't Let Obama's Conciliatory Tone Fool You; Here's What's REALLY Going On…,Don't let Obama's conciliatory tone fool you; here's what's REALLY going on…,link,http://rusharea.com/world-news/dont-let-obamas-conciliatory-tone-fool-heres-whats-really-going/,2016-12-25 04:00:00,2,3,0,0,0,0,0,0,2
1170562502965493_1368636483158093,Trump's FIRST Order: Anyone Burning An American Flag To Be Charged With TREASON,Trump's FIRST Order: Anyone Burning An American Flag To Be Charged With TREASON,link,http://rusharea.com/world-news/trumps-first-order-anyone-burning-american-flag-charged-treason/,2016-12-25 02:00:00,11,2,0,7,2,2,0,0,0
1170562502965493_1368626909825717,"Million Women March Being Planned For January 21, 2017 In D.C.","Million Women March being planned for January 21, 2017 in D.C.",link,http://rusharea.com/world-news/million-women-march-planned-january-21-2017-d-c/,2016-12-25 00:00:01,9,10,1,4,1,0,0,1,3
1170562502965493_1368614656493609,Steven Seagal: Obama Would Be Impeached If The Truth About Benghazi Came Out,Steven Seagal: Obama would be impeached if the truth about Benghazi came out,link,http://rusharea.com/world-news/steven-seagal-obama-impeached-truth-benghazi-came/,2016-12-24 22:00:00,8,1,1,7,0,1,0,0,0
1170562502965493_1368605886494486,BREAKING: ISRAEL JUST EXPOSED WHO OBAMA REALLY IS! THIS DOEST NOT LOOK GOOD FOR HIM…,BREAKING: ISRAEL JUST EXPOSED WHO OBAMA REALLY IS! THIS DOEST NOT LOOK GOOD FOR HIM… - USA News Home,link,http://rusharea.com/world-news/breaking-israel-just-exposed-obama-really-doest-not-look-good/,2016-12-24 20:00:00,0,3,4,0,0,0,0,0,0
1170562502965493_1368542123167529,"Edward Snowden, Julian Assange And Chelsea Manning Statues Unveiled In Berlin","Edward Snowden, Julian Assange and Chelsea Manning statues unveiled in Berlin - USA News Home",link,http://rusharea.com/world-news/edward-snowden-julian-assange-chelsea-manning-statues-unveiled-berlin/,2016-12-24 17:59:00,2,0,0,2,0,0,0,0,0
1170562502965493_1368204549867953,THE QUEEN USES CHRISTMAS SPEECH TO ANNOUNCE THAT SHE IS BLOCKING BREXIT,THE QUEEN USES CHRISTMAS SPEECH TO ANNOUNCE THAT SHE IS BLOCKING BREXIT - USA News Home,link,http://rusharea.com/world-news/queen-uses-christmas-speech-announce-blocking-brexit/,2016-12-24 16:00:00,1,1,0,0,0,0,0,0,1
1170562502965493_1368196023202139,Trump Threatens To Upend U.S. Nuclear Weapons Policy,Trump threatens to upend U.S. nuclear weapons policy - USA News Home,link,http://rusharea.com/world-news/trump-threatens-upend-u-s-nuclear-weapons-policy/,2016-12-24 13:53:32,0,0,0,0,0,0,0,0,0
1170562502965493_1366638623357879,"Democrats Are Gonna SABOTAGE Trump's Inauguration! Look At Their SICK Plan…

http://rusharea.com/world-news/democrats-gonna-sabotage-trumps-inauguration-look-sick-plan/",Democrats Are Gonna SABOTAGE Trump's Inauguration! Look at Their SICK Plan… - USA News Home,link,http://rusharea.com/world-news/democrats-gonna-sabotage-trumps-inauguration-look-sick-plan/,2016-12-24 01:02:00,2,6,0,1,0,0,0,0,1
1170562502965493_1366624720025936,"Alleged CNN Report On Hillary On Election Night A Shocking Portrait Of A Woman Gone Berserk

http://rusharea.com/world-news/alleged-cnn-report-hillary-election-night-shocking-portrait-woman-gone-berserk/",Alleged CNN Report On Hillary On Election Night A Shocking Portrait Of A Woman Gone Berserk - USA News Home,link,http://rusharea.com/world-news/alleged-cnn-report-hillary-election-night-shocking-portrait-woman-gone-berserk/,2016-12-23 23:00:01,18,7,2,9,0,3,6,0,0
1170562502965493_1366613000027108,"Donald Trump And Vladimir Putin Agree: Let's Revive The Nuclear Arms Race
 
http://rusharea.com/world-news/donald-trump-vladimir-putin-agree-lets-revive-nuclear-arms-race/",Donald Trump and Vladimir Putin agree: Let's revive the nuclear arms race - USA News Home,link,http://rusharea.com/world-news/donald-trump-vladimir-putin-agree-lets-revive-nuclear-arms-race/,2016-12-23 21:00:00,0,0,0,0,0,0,0,0,0
1170562502965493_1366576743364067,"The Last 24 Hours Of Trump

http://rusharea.com/world-news/last-24-hours-trump/",The last 24 hours of Trump - USA News Home,link,http://rusharea.com/world-news/last-24-hours-trump/,2016-12-23 18:39:43,0,0,0,0,0,0,0,0,0
1170562502965493_1366447970043611,Breaking News: Justice Ruth Bader Ginsburg Is RESIGNING From The Post Of Associate Justice Of The Supreme Court!!!! http://rusharea.com/world-news/breaking-news-justice-ruth-bader-ginsburg-resigning-post-associate-justice-supreme-court/,Breaking News: Justice Ruth Bader Ginsburg is RESIGNING From The Post of Associate Justice of the Supreme Court!!!! - USA News Home,link,http://rusharea.com/world-news/breaking-news-justice-ruth-bader-ginsburg-resigning-post-associate-justice-supreme-court/,2016-12-23 16:38:11,24,10,4,20,1,0,1,2,0
1170562502965493_1366129423408799,IT'S OVER! Wikileaks Just Revealed Who Leaked Hillary's Emails! This Is TERRIBLE News For Her!,IT'S OVER! Wikileaks Just Revealed Who Leaked Hillary's Emails! This Is TERRIBLE News For Her! - USA News Home,link,http://rusharea.com/world-news/wikileaks-just-revealed-leaked-hillarys-emails-terrible-news/,2016-12-23 12:01:54,10,3,4,9,0,0,0,1,0
1170562502965493_1365146740173734,OPRAH WINFREY IS MOVING TO CANADA AS SHE PROMISED BECAUSE TRUMP HAS WON?,OPRAH WINFREY IS MOVING TO CANADA AS SHE PROMISED BECAUSE TRUMP HAS WON? - USA News Home,link,http://rusharea.com/world-news/oprah-winfrey-moving-canada-promised-trump-won/,2016-12-23 01:00:00,10,6,3,7,0,0,0,2,1
1170562502965493_1365143143507427,"Prince Charles Urges Brits To Think Of Muhammad This Christmas, Speaks Out Against 'Aggressive Populism'","Prince Charles Urges Brits To Think Of Muhammad This Christmas, Speaks Out Against 'Aggressive Populism' - USA News Home",link,http://rusharea.com/world-news/prince-charles-urges-brits-think-muhammad-christmas-speaks-aggressive-populism/,2016-12-22 23:30:01,5,4,0,2,0,0,0,0,3
1170562502965493_1365140586841016,Bitter Liberals Post Selfies Of Themselves Flipping Off Trump Tower,Bitter Liberals Post Selfies of Themselves Flipping Off Trump Tower - USA News Home,link,http://rusharea.com/world-news/bitter-liberals-post-selfies-flipping-off-trump-tower/,2016-12-22 22:00:00,21,57,4,9,1,0,6,3,2
1170562502965493_1365137420174666,Newt: Obama Legacy 'Is Going To Disappear Within A Year',Newt: Obama Legacy 'Is Going to Disappear Within a Year' - USA News Home,link,http://rusharea.com/world-news/newt-obama-legacy-going-disappear-within-year/,2016-12-22 20:30:00,1,3,1,1,0,0,0,0,0
1170562502965493_1365135140174894,Trump Just Did More For Israel Than Obama Did In 8 Years,Trump Just Did More For Israel Than Obama Did In 8 Years - USA News Home,link,http://rusharea.com/world-news/trump-just-israel-obama-8-years/,2016-12-22 18:54:04,6,5,2,6,0,0,0,0,0
1170562502965493_1365088580179550,It's Official: Clinton Swamps Trump In Popular Vote,It's official: Clinton swamps Trump in popular vote - USA News Home,link,http://rusharea.com/world-news/official-clinton-swamps-trump-popular-vote/,2016-12-22 17:46:53,7,25,1,4,0,0,3,0,0
1170562502965493_1364954450192963,HE'S NEVER SOLD AN ORIGINAL PAINTING UNTIL NOW…And This One's Going In The White House,HE'S NEVER SOLD AN ORIGINAL PAINTING UNTIL NOW…And This One's Going In The White House - USA News Home,link,http://rusharea.com/world-news/hes-never-sold-original-painting-nowand-ones-going-white-house/,2016-12-22 15:55:14,3,1,4,2,1,0,0,0,0
1170562502965493_1361536253868116,BREAKING! HILLARY JUST LOST 7 ELECTORAL VOTES!,BREAKING! HILLARY JUST LOST 7 ELECTORAL VOTES! - USA News Home,link,http://rusharea.com/world-news/breaking-hillary-just-lost-7-electoral-votes/,2016-12-20 20:00:00,12,1,0,3,0,0,9,0,0
1170562502965493_1361502470538161,"Electoral College Deals Hillary Clinton, Big Media Final Embarrassment","Electoral College Deals Hillary Clinton, Big Media Final Embarrassment - USA News Home",link,http://rusharea.com/world-news/electoral-college-deals-hillary-clinton-big-media-final-embarrassment/,2016-12-20 17:52:00,8,1,1,4,0,0,4,0,0
1170562502965493_1361365237218551,OPRAH WINFREY IS MOVING TO CANADA AS SHE PROMISED BECAUSE TRUMP HAS WON?,OPRAH WINFREY IS MOVING TO CANADA AS SHE PROMISED BECAUSE TRUMP HAS WON? - USA News Home,link,http://rusharea.com/world-news/oprah-winfrey-moving-canada-promised-trump-won/,2016-12-20 15:37:25,36,30,7,25,0,1,10,0,0
1170562502965493_1361135053908236,"Donald Trump Drops The Hammer, Cuts Ties With Surprising Memebr Of His Team","Donald Trump Drops The Hammer, Cuts Ties With Surprising Memebr Of His Team",link,http://rusharea.com/world-news/donald-trump-drops-hammer-cuts-ties-surprising-memebr-team/,2016-12-20 13:49:31,1,0,0,0,0,1,0,0,0
1170562502965493_1358555680832840,Calls Grow For A New Presidential Election To Be Held After Russia Meddled To Help Trump,Calls Grow For A New Presidential Election To Be Held After Russia Meddled To Help Trump,link,http://rusharea.com/world-news/calls-grow-new-presidential-election-held-russia-meddled-help-trump/,2016-12-19 16:38:33,18,30,2,5,0,0,11,0,2
1170562502965493_1358435870844821,War With Russia Isn't The Issue. Treason Is.,War With Russia Isn't The Issue. Treason Is.,link,http://rusharea.com/world-news/war-russia-isnt-issue-treason/,2016-12-19 15:19:26,2,0,0,2,0,0,0,0,0
1170562502965493_1358336034188138,Russian Ambassador Andrey Karlov Shot Dead,Russian ambassador Andrey Karlov shot dead - USA News Home,link,http://rusharea.com/world-news/russian-ambassador-andrey-karlov-shot-dead/,2016-12-19 13:53:25,2,0,0,0,0,0,0,1,1
1170562502965493_1356769067678168,IT'S OVER! Wikileaks Just Revealed Who Leaked Hillary's Emails! This Is TERRIBLE News For Her!,IT'S OVER! Wikileaks Just Revealed Who Leaked Hillary's Emails! This Is TERRIBLE News For Her! - USA News Home,link,http://rusharea.com/world-news/wikileaks-just-revealed-leaked-hillarys-emails-terrible-news/,2016-12-18 17:35:02,27,5,10,21,2,0,4,0,0
1170562502965493_1347990611889347,"Rex Tillerson, Exxon Chief, Is Expected To Be Pick For Secretary Of State","Rex Tillerson, Exxon Chief, Is Expected to Be Pick for Secretary of State - USA News Home",link,http://rusharea.com/world-news/rex-tillerson-exxon-chief-expected-pick-secretary-state/,2016-12-11 18:32:43,4,0,0,2,1,0,0,1,0
1170562502965493_1347886758566399,Activists Want To Add Obama's Face To Mt.Rushmore To Commemorate His Achievements,Activists Want To Add Obama's Face To Mt.Rushmore To Commemorate His Achievements - USA News Home,link,http://rusharea.com/world-news/activists-want-add-obamas-face-mt-rushmore-commemorate-achievements/,2016-12-11 16:09:30,25,39,4,7,0,0,16,0,2
1170562502965493_1347833918571683,Donald Trump Als Ice Bucket Challenge,Donald Trump Als Ice Bucket Challenge - USA News Home,link,http://rusharea.com/world-news/donald-trump-als-ice-bucket-challenge/,2016-12-11 14:57:18,2,0,0,1,1,0,0,0,0
1170562502965493_1341104665911275,Bernie Sanders Challenges Trump Over Jobs Boast: 'What Are You Going To Do?',Bernie Sanders challenges Trump over jobs boast: 'What are you going to do?' - USA News Home,link,http://rusharea.com/world-news/bernie-sanders-challenges-trump-jobs-boast-going/,2016-12-07 00:00:00,2,0,1,1,0,0,0,0,1
1170562502965493_1341099495911792,Then Vs. Now: A Statistical Look At Obama's Presidency,Then vs. Now: A Statistical Look at Obama's Presidency - USA News Home,link,http://rusharea.com/world-news/vs-now-statistical-look-obamas-presidency/,2016-12-06 23:00:00,1,1,0,0,0,0,0,0,1
1170562502965493_1341086329246442,Biden Raises Possibility Of 2020 Presidential Bid,Biden raises possibility of 2020 presidential bid - USA News Home,link,http://rusharea.com/world-news/biden-raises-possibility-2020-presidential-bid/,2016-12-06 22:00:00,1,1,0,0,0,0,0,0,1
1170562502965493_1341071259247949,LeBron Won't Stay At Trump Hotel With Team,LeBron won't stay at Trump hotel with team - USA News Home,link,http://rusharea.com/world-news/lebron-wont-stay-trump-hotel-team/,2016-12-06 21:00:00,13,18,3,7,0,0,4,0,2
1170562502965493_1341061049248970,Trump Chooses Ben Carson To Lead HUD,Trump Chooses Ben Carson to Lead HUD - USA News Home,link,http://rusharea.com/world-news/trump-chooses-ben-carson-lead-hud/,2016-12-06 20:00:00,1,0,0,0,1,0,0,0,0
1170562502965493_1341050705916671,JUST IN: Michigan Drops The HAMMER On Stein Recount…,JUST IN: Michigan drops the HAMMER on Stein recount… - USA News Home,link,http://rusharea.com/world-news/just-michigan-drops-hammer-stein-recount/,2016-12-06 19:00:00,4,3,0,3,1,0,0,0,0
1170562502965493_1341042059250869,New York Asks U.S. To Pay Trump Security Costs; Puts First Bill At $35 Million,New York Asks U.S. to Pay Trump Security Costs; Puts First Bill at $35 Million - USA News Home,link,http://rusharea.com/world-news/new-york-asks-u-s-pay-trump-security-costs-puts-first-bill-35-million/,2016-12-06 17:59:00,2,2,0,1,0,0,1,0,0
1170562502965493_1341030735918668,Trump Breaks With Obama On Controversial Pipeline,Trump breaks with Obama on controversial pipeline - USA News Home,link,http://rusharea.com/world-news/trump-breaks-obama-controversial-pipeline/,2016-12-06 16:00:01,0,0,0,0,0,0,0,0,0
1170562502965493_1341019872586421,Donald Trump Names Ben Carson For Housing And Urban Development Secretary,Donald Trump names Ben Carson for housing and urban development secretary - USA News Home,link,http://rusharea.com/world-news/donald-trump-names-ben-carson-housing-urban-development-secretary/,2016-12-06 14:30:00,2,1,0,1,1,0,0,0,0
1170562502965493_1341001749254900,"Trey Gowdy Just Announced What He Plans To Do To Hillary On January 21, It's Incredible","Trey Gowdy Just Announced What He Plans To Do To Hillary On January 21, It's Incredible - USA News Home",link,http://rusharea.com/world-news/trey-gowdy-just-announced-plans-hillary-january-21-incredible/,2016-12-06 13:00:01,11,0,2,6,3,0,1,0,1
