status_id,status_message,link_name,status_type,status_link,status_published,num_reactions,num_comments,num_shares,num_likes,num_loves,num_wows,num_hahas,num_sads,num_angrys
1170562502965493_1483396085015465,BREAKING: Trump Just FIRED WH Deputy Chief Of Staff After Discovering She STABBED Him In The Back,BREAKING: Trump Just FIRED WH Deputy Chief Of Staff After Discovering She STABBED Him In The Back - USA News Home,link,http://rusharea.com/world-news/breaking-trump-just-fired-wh-deputy-chief-staff-discovering-stabbed-back/,2017-03-31 16:59:00,156,16,1,145,5,1,3,1,1
1170562502965493_1483327671688973,Ivanka Trump Takes On Federal Job At White House,JUST IN: Trump Assigns Ivanka With JAW-DROPPING Role In White House! WHAT A MOVE!,link,https://lifeandabout.com/2017/03/ivanka-trump-takes-federal-job-white-house/,2017-03-31 15:00:00,163,8,11,155,7,0,0,0,1
1170562502965493_1483265665028507,"VP Pence Just Made Shock Announcement About Him & His Wife, He Needs Our Support Now","VP Pence Just Made Shock Announcement About Him & His Wife, He Needs Our Support Now - USA News Home",link,http://rusharea.com/world-news/vp-pence-just-made-shock-announcement-wife-needs-support-now/,2017-03-31 13:00:00,51,13,2,45,5,0,0,0,1
1170562502965493_1483203718368035,BREAKING: President Trump Announces Comey's Replacement,BREAKING: President Trump Announces Comey's Replacement - USA News Home,link,http://rusharea.com/world-news/breaking-president-trump-announces-comeys-replacement/,2017-03-31 11:02:51,191,36,15,171,16,0,3,1,0
1170562502965493_1482495391772201,New Report EXPOSES 6 Top REPUBLICANS On GEORGE SOROS' PAYROLL! Guess Who's Being Paid To Stop Trump?,New Report EXPOSES 6 Top REPUBLICANS on GEORGE SOROS' PAYROLL! Guess Who's Being Paid to Stop Trump? - USA News Home,link,http://rusharea.com/world-news/new-report-exposes-6-top-republicans-george-soros-payroll-guess-whos-paid-stop-trump-2/,2017-03-30 21:00:00,41,15,10,13,0,2,2,0,24
1170562502965493_1482494608438946,"Obama Deputy Asst. Defense Secretary Accidentally Slips On The Air, Admits It DID Happen","Obama Deputy Asst. Defense Secretary Accidentally Slips On The Air, Admits It DID Happen - USA News Home",link,http://rusharea.com/world-news/obama-deputy-asst-defense-secretary-accidentally-slips-air-admits-happen/,2017-03-30 19:00:00,49,8,6,41,0,6,1,0,1
1170562502965493_1482492875105786,Massachusetts Sheriff Issues Boisterous Order: Arrest Leaders Of Sanctuary Cities Opposing Trump,Massachusetts Sheriff Issues Boisterous Order: Arrest Leaders Of Sanctuary Cities Opposing Trump - USA News Home,link,http://rusharea.com/world-news/massachusetts-sheriff-issues-boisterous-order-arrest-leaders-sanctuary-cities-opposing-trump/,2017-03-30 17:06:11,137,14,8,128,9,0,0,0,0
1170562502965493_1482307421790998,BREAKING: President Trump Just Tweeted Something That Could End The Clintons!,BREAKING: President Trump Just Tweeted Something That Could End The Clintons! - 24NEWSWorld,link,http://www.24newsworld.info/breaking-president-trump-just-tweeted-something-end-clintons/,2017-03-30 13:00:00,184,31,12,167,8,0,9,0,0
1170562502965493_1481603961861344,CANCEL HER WELFARE FOR LIFE!,Watch What Obama Welfare Leech Does After Trump Cancel Her Food Stamps - USA News Home,link,http://rusharea.com/world-news/watch-obama-welfare-leech-trump-cancel-food-stamps/,2017-03-29 21:00:00,42,28,12,26,2,2,4,0,8
1170562502965493_1481604895194584,"If anyone ever tells you that Barack Obama was a great President, read them this heartfelt letter from a marine. This is going viral, with good reason. Share this with everyone you know.","Obama Will NOT Like What This Brave Marine Said About His ""Legacy"" - USA News Home",link,http://rusharea.com/world-news/obama-will-not-like-what-this-brave-marine/,2017-03-29 19:03:04,192,16,42,174,11,2,0,1,4
1170562502965493_1481501621871578,Father Of 18-Year-Old Rockville Rapist Arrested!,Father Of 18-Year-Old Rockville Rapist Arrested! - USA News Home,link,http://rusharea.com/world-news/father-18-year-old-rockville-rapist-arrested/,2017-03-29 17:07:08,11,0,0,11,0,0,0,0,0
1170562502965493_1481499858538421,Trump Demands Full Investigation On Clinton's Ties To Russia,Trump Demands Full Investigation on Clinton's Ties to Russia - USA News Home,link,http://rusharea.com/world-news/trump-demands-full-investigation-clintons-ties-russia/,2017-03-29 15:00:07,154,7,8,143,10,0,1,0,0
1170562502965493_1480833145271759,"If CNN's New Russia Report Is True, We May Be Seeing The Beginning Of The End Of Donald Trump's Presidency","If CNN's New Russia Report Is True, We May Be Seeing the Beginning of the End of Donald Trump's Presidency",link,http://rusharea.com/world-news/cnns-new-russia-report-true-may-seeing-beginning-end-donald-trumps-presidency/,2017-03-28 22:00:00,26,75,3,8,1,0,5,0,12
1170562502965493_1480830445272029,Angry Citizen Sees What Muslim Welfare Queens Do After Leaving Walmart,Angry Citizen Sees What Muslim Welfare Queens Do After Leaving Walmart - USA News Home,link,http://rusharea.com/world-news/angry-citizen-sees-muslim-welfare-queens-leaving-walmart/,2017-03-28 20:32:24,8,3,4,6,0,0,0,0,2
1170562502965493_1480721745282899,Reporters Everywhere Are FREAKING Out About What Bill O' Reilly Said On TV Last Night… THIS IS BAD!,Reporters Everywhere Are FREAKING Out About What Bill O' Reilly Said On TV Last Night… THIS IS BAD! - USA News Home,link,http://rusharea.com/world-news/reporters-everywhere-freaking-bill-o-reilly-said-tv-last-night-bad/,2017-03-28 17:39:15,32,11,6,25,7,0,0,0,0
1170562502965493_1480650408623366,"BREAKING: NSA Whistle-Blower Says Trump, Congress, Supreme Court Were All Spied On","BREAKING: NSA Whistle-Blower Says Trump, Congress, Supreme Court Were All Spied On - USA News Home",link,http://rusharea.com/world-news/breaking-nsa-whistle-blower-says-trump-congress-supreme-court-spied/,2017-03-28 15:23:51,29,1,0,23,0,0,0,1,5
1170562502965493_1480566695298404,Tomi Lahren Has Been Permanently Banned From The Blaze,Tomi Lahren has been permanently banned from The Blaze - USA News Home,link,http://rusharea.com/world-news/tomi-lahren-permanently-banned-blaze/,2017-03-28 13:35:25,2,0,0,1,0,0,0,0,1
1170562502965493_1479819205373153,Tomi Lahren Has Been Permanently Banned From The Blaze,Tomi Lahren has been permanently banned from The Blaze - USA News Home,link,http://rusharea.com/world-news/tomi-lahren-permanently-banned-blaze/,2017-03-27 21:00:00,14,4,0,5,0,0,2,0,7
1170562502965493_1479817715373302,Trump Handed Merkel $374B NATO Bill During Talks — Report,Trump handed Merkel $374B NATO bill during talks - report - USA News Home,link,http://rusharea.com/world-news/trump-handed-merkel-374b-nato-bill-talks-report/,2017-03-27 19:00:00,28,4,4,22,1,0,5,0,0
1170562502965493_1479808682040872,Ted Poe Resigns From Freedom Caucus Due To Catastrophic Healthcare Bill Fail,Ted Poe Resigns From Freedom Caucus Due To Catastrophic Healthcare Bill Fail - USA News Home,link,http://rusharea.com/world-news/ted-poe-resigns-freedom-caucus-due-catastrophic-healthcare-bill-fail/,2017-03-27 17:00:00,6,0,1,3,0,2,0,1,0
1170562502965493_1479769678711439,Federal Judge Backs Trump! Refuses To Halt Travel Ban!,Federal Judge Backs Trump! Refuses To Halt Travel Ban! - USA News Home,link,http://rusharea.com/world-news/federal-judge-backs-trump-refuses-halt-travel-ban/,2017-03-27 15:03:33,82,4,4,75,6,0,0,0,1
1170562502965493_1479688628719544,CNN Analyst: Sources Say Mike Flynn May Have Turned On Trump And Become A Witness For The FBI,CNN analyst: Sources say Mike Flynn may have turned on Trump and become a witness for the FBI - USA News Home,link,http://rusharea.com/world-news/cnn-analyst-sources-say-mike-flynn-may-turned-trump-become-witness-fbi/,2017-03-27 13:02:59,19,7,1,5,0,1,5,1,7
1170562502965493_1478960545459019,School Board Member Posts 1 Question About Certain Muslims… All Hell Breaks Loose,School Board Member Posts 1 Question About Certain Muslims… All Hell Breaks Loose - USA News Home,link,http://rusharea.com/world-news/school-board-member-posts-1-question-certain-muslims-hell-breaks-loose/,2017-03-26 20:30:00,67,12,22,54,1,0,11,0,1
1170562502965493_1478960102125730,"BREAKING: NSA Whistle-Blower Says Trump, Congress, Supreme Court Were All Spied On","BREAKING: NSA Whistle-Blower Says Trump, Congress, Supreme Court Were All Spied On - USA News Home",link,http://rusharea.com/world-news/breaking-nsa-whistle-blower-says-trump-congress-supreme-court-spied/,2017-03-26 19:00:00,57,4,10,38,3,2,2,0,12
1170562502965493_1478956068792800,DONALD TRUMP JUST DECLARED WAR ON THESE REPUBLICANS!,Donald Trump Just Declared WAR On These Republicans! - 24NEWSWorld,link,http://www.24newsworld.info/donald-trump-just-declared-war-republicans/,2017-03-26 16:59:22,55,6,0,45,6,1,1,0,2
1170562502965493_1478920942129646,Democrats To Cease Neil Gorsuch's Confirmation,Democrats to Cease Neil Gorsuch's Confirmation - USA News Home,link,http://rusharea.com/world-news/democrats-cease-neil-gorsuchs-confirmation/,2017-03-26 16:02:02,30,13,4,8,0,1,0,5,16
1170562502965493_1478755628812844,CAREER OVER: Kaepernick ANGRY That Nobody Wants Him. What's Your Response?,CAREER OVER: Kaepernick ANGRY That Nobody Wants Him. What's Your Response? - 24NEWSWorld,link,http://www.24newsworld.info/career-kaepernick-angry-nobody-wants-whats-response/,2017-03-26 13:00:50,140,164,4,81,5,1,51,1,1
1170562502965493_1477979908890416,Angry Citizen Sees What Muslim Welfare Queens Do After Leaving Walmart,Angry Citizen Sees What Muslim Welfare Queens Do After Leaving Walmart - USA News Home,link,http://rusharea.com/world-news/angry-citizen-sees-muslim-welfare-queens-leaving-walmart/,2017-03-26 11:00:00,34,11,12,20,1,0,1,0,12
1170562502965493_1477977915557282,TREY GOWDY FIGHTS TEARS AS HE VOWS TO DESTROY ELITE PEDOPHILE RING,TREY GOWDY FIGHTS TEARS AS HE VOWS TO DESTROY ELITE PEDOPHILE RING,link,http://rusharea.com/world-news/trey-gowdy-fights-tears-vows-destroy-elite-pedophile-ring/,2017-03-26 09:00:00,122,2,21,106,12,1,0,3,0
1170562502965493_1477973305557743,FBI Chief Comey Spotted Entering White House,FBI chief Comey spotted entering White House - USA News Home,link,http://rusharea.com/world-news/fbi-chief-comey-spotted-entering-white-house/,2017-03-25 21:00:00,7,6,0,3,0,1,1,0,2
1170562502965493_1477971322224608,Major Department Cleanse By Trump For A Better America,Major Department Cleanse By Trump For A Better America - USA News Home,link,http://rusharea.com/world-news/major-department-cleanse-trump-better-america/,2017-03-25 18:58:00,65,5,1,64,0,0,0,0,1
1170562502965493_1477968085558265,Democrats Introduce The 'MAR-A-LAGO Act',Democrats introduce the 'MAR-A-LAGO Act' - USA News Home,link,http://rusharea.com/world-news/democrats-introduce-mar-lago-act/,2017-03-25 17:01:00,7,2,0,5,0,0,1,0,1
1170562502965493_1477474732274267,Reporters Everywhere Are FREAKING Out About What Bill O' Reilly Said On TV Last Night… THIS IS BAD!,Reporters Everywhere Are FREAKING Out About What Bill O' Reilly Said On TV Last Night… THIS IS BAD! - USA News Home,link,http://rusharea.com/world-news/reporters-everywhere-freaking-bill-o-reilly-said-tv-last-night-bad/,2017-03-25 15:00:00,132,26,24,122,6,2,0,0,2
1170562502965493_1477471315607942,Loony Liberal Actress Claims London Terror 'May Be' A 'Set Up' By Trump,Loony Liberal Actress Claims London Terror 'May Be' a 'Set Up' by Trump - USA News Home,link,http://rusharea.com/world-news/loony-liberal-actress-claims-london-terror-may-set-trump/,2017-03-25 13:00:00,22,24,2,4,0,0,2,1,15
1170562502965493_1477467388941668,"No ""Buyer's Remorse"" Among Trump Voters In New Poll","No ""Buyer's Remorse"" Among Trump Voters in New Poll - USA News Home",link,http://rusharea.com/world-news/no-buyers-remorse-among-trump-voters-new-poll/,2017-03-25 11:00:02,38,3,2,33,3,0,1,0,1
1170562502965493_1477009902320750,TREY GOWDY FIGHTS TEARS AS HE VOWS TO DESTROY ELITE PEDOPHILE RING,TREY GOWDY FIGHTS TEARS AS HE VOWS TO DESTROY ELITE PEDOPHILE RING,link,http://rusharea.com/world-news/trey-gowdy-fights-tears-vows-destroy-elite-pedophile-ring/,2017-03-24 22:00:00,135,8,18,126,5,4,0,0,0
1170562502965493_1477008282320912,"FBI HAVE UNCOVERED 'EVIDENCE OF TREASON' AMONG ALT-RIGHT WEBSITES, SAYS GEORGE W BUSH'S ETHICS LAWYER","FBI HAVE UNCOVERED 'EVIDENCE OF TREASON' AMONG ALT-RIGHT WEBSITES, SAYS GEORGE W BUSH'S ETHICS LAWYER - USA News Home",link,http://rusharea.com/world-news/fbi-uncovered-evidence-treason-among-alt-right-websites-says-george-w-bushs-ethics-lawyer/,2017-03-24 20:00:00,43,15,1,33,1,1,5,0,3
1170562502965493_1476998652321875,Durbin Won't Make Eye Contact After Gorsuch Utterly Annihilates Dem's False Claim,Durbin Won't Make Eye Contact After Gorsuch Utterly Annihilates Dem's False Claim - USA News Home,link,http://rusharea.com/world-news/durbin-wont-make-eye-contact-gorsuch-utterly-annihilates-dems-false-claim/,2017-03-24 18:04:39,10,0,0,9,1,0,0,0,0
1170562502965493_1476594945695579,Trump's EPA Issues $100 Million Grant To Flint Michigan To Fix Water System,Trump's EPA Issues $100 Million Grant to Flint Michigan To Fix Water System - USA News Home,link,http://rusharea.com/world-news/trumps-epa-issues-100-million-grant-flint-michigan-fix-water-system/,2017-03-24 16:00:00,58,8,3,53,5,0,0,0,0
1170562502965493_1476593542362386,BOOM! Judicial Watch Files Lawsuit In Connection To Hillary Clinton's Email Scandal!,BOOM! Judicial Watch Files Lawsuit in Connection To Hillary Clinton's Email Scandal! - USA News Home,link,http://rusharea.com/world-news/boom-judicial-watch-files-lawsuit-connection-hillary-clintons-email-scandal/,2017-03-24 14:00:00,84,13,1,78,3,1,1,1,0
1170562502965493_1476753055679768,Trump Was Right About Wiretapping And It's Been Confirmed!,Trump Was Right About Wiretapping And It's Been Confirmed! - 24NEWSWorld,link,http://www.24newsworld.info/trump-right-wiretapping-confirmed/,2017-03-24 13:10:31,50,7,6,50,0,0,0,0,0
1170562502965493_1476648205690253,Durbin Won't Make Eye Contact After Gorsuch Utterly Annihilates Dem's False Claim,Durbin Won't Make Eye Contact After Gorsuch Utterly Annihilates Dem's False Claim - USA News Home,link,http://rusharea.com/world-news/durbin-wont-make-eye-contact-gorsuch-utterly-annihilates-dems-false-claim/,2017-03-24 12:00:00,39,3,3,35,2,0,2,0,0
1170562502965493_1475991792422561,Angry Citizen Sees What Muslim Welfare Queens Do After Leaving Walmart,Angry Citizen Sees What Muslim Welfare Queens Do After Leaving Walmart - USA News Home,link,http://rusharea.com/world-news/angry-citizen-sees-muslim-welfare-queens-leaving-walmart/,2017-03-23 22:00:00,52,20,29,24,0,0,0,0,28
1170562502965493_1475990342422706,"Psychiatrist Keith Ablow Calls Trump ""Crazy Like A Fox,"" In A Good Sense!","Psychiatrist Keith Ablow Calls Trump ""Crazy Like A Fox,"" In a Good Sense! - USA News Home",link,http://rusharea.com/uncategorized/psychiatrist-keith-ablow-calls-trump-crazy-like-fox-good-sense/,2017-03-23 20:00:00,56,2,4,51,2,0,2,0,1
1170562502965493_1475984995756574,Should Fox Reinstate Judge Napolitano After He Blew The Lid Off Obama's Wiretapping?,Should Fox Reinstate Judge Napolitano After He Blew The Lid Off Obama's Wiretapping? - USA News Home,link,http://rusharea.com/world-news/fox-reinstate-judge-napolitano-blew-lid-off-obamas-wiretapping/,2017-03-23 18:05:39,461,242,23,437,18,1,3,1,1
1170562502965493_1475898062431934,"If CNN's New Russia Report Is True, We May Be Seeing The Beginning Of The End Of Donald Trump's Presidency","If CNN's New Russia Report Is True, We May Be Seeing the Beginning of the End of Donald Trump's Presidency - USA News Home",link,http://rusharea.com/world-news/cnns-new-russia-report-true-may-seeing-beginning-end-donald-trumps-presidency/,2017-03-23 16:17:35,72,185,3,23,1,0,34,1,13
1170562502965493_1475771375777936,Pat Robertson: Opposition To Trump Is Revolt Against God,Pat Robertson: Opposition To Trump Is Revolt Against God - USA News Home,link,http://rusharea.com/world-news/pat-robertson-opposition-trump-revolt-god/,2017-03-23 13:56:15,40,14,4,34,3,0,1,1,1
1170562502965493_1475653349123072,Roseanne Barr Bashes Those Working Against Trump And America!,Roseanne Barr Bashes Those Working Against Trump And America! - USA News Home,link,http://rusharea.com/world-news/roseanne-barr-bashes-working-trump-america/,2017-03-23 11:53:42,65,10,4,54,8,0,3,0,0
1170562502965493_1474873645867709,Liar!! Wikileaks Showed Proof That Comey Lied To Congress About The Republican Emails!!,Liar!! Wikileaks Showed Proof That Comey Lied To Congress About The Republican Emails!! - USA News Home,link,http://rusharea.com/world-news/liar-wikileaks-showed-proof-comey-lied-congress-republican-emails/,2017-03-22 22:00:00,71,17,9,52,0,2,1,2,14
1170562502965493_1474872252534515,Gowdy Names 6 Obama Officials As Possible Flynn Unmaskers,Gowdy Names 6 Obama Officials As Possible Flynn Unmaskers - USA News Home,link,http://rusharea.com/world-news/gowdy-names-6-obama-officials-possible-flynn-unmaskers/,2017-03-22 20:00:00,50,7,6,48,2,0,0,0,0
1170562502965493_1474871302534610,Mel Gibson Has Been Quietly Helping Holocaust Survivors For Years,Mel Gibson Has Been Quietly Helping Holocaust Survivors for Years - USA News Home,link,http://rusharea.com/world-news/mel-gibson-quietly-helping-holocaust-survivors-years/,2017-03-22 18:00:00,9,0,0,8,0,0,0,0,1
1170562502965493_1474888142532926,Nailed It!!! Roseanne Barr Rises Up And Reveals The Truth!!,Nailed it!!! Roseanne Barr Rises Up And Reveals The Truth!! - USA News Home,link,http://rusharea.com/world-news/nailed-roseanne-barr-rises-reveals-truth/,2017-03-22 16:50:42,21,2,2,20,1,0,0,0,0
1170562502965493_1474856139202793,WATCH: Gorsuch Gives Detailed Answer On Workers' Rights Cases He Ruled On,WATCH: Gorsuch Gives Detailed Answer on Workers' Rights Cases He Ruled On - USA News Home,link,http://rusharea.com/world-news/watch-gorsuch-gives-detailed-answer-workers-rights-cases-ruled/,2017-03-22 16:03:55,12,1,0,12,0,0,0,0,0
1170562502965493_1474785139209893,"Democrats Hoped To Hurt Trump, But Raised Suspicions Of Obama","Democrats Hoped to Hurt Trump, but Raised Suspicions of Obama - USA News Home",link,http://rusharea.com/world-news/democrats-hoped-hurt-trump-raised-suspicions-obama/,2017-03-22 14:26:42,61,6,9,50,0,0,9,0,2
1170562502965493_1473833055971768,Donald Trump Jr. Blasts Chelsea Handler's 'Sick Tweet Targeted At Our Family',Donald Trump Jr. Blasts Chelsea Handler's 'Sick Tweet Targeted at Our Family' - USA News Home,link,http://rusharea.com/uncategorized/donald-trump-jr-blasts-chelsea-handlers-sick-tweet-targeted-family/,2017-03-21 22:00:00,21,25,0,20,0,0,1,0,0
1170562502965493_1473831745971899,Actress Mayim Bialik Blasts Feminists For 'Disgusting' Silence On Muslim Countries' Treatment Of Women,Actress Mayim Bialik Blasts Feminists for 'Disgusting' Silence on Muslim Countries' Treatment of Women - USA News Home,link,http://rusharea.com/world-news/actress-mayim-bialik-blasts-feminists-disgusting-silence-muslim-countries-treatment-women/,2017-03-21 20:00:00,55,7,5,49,5,1,0,0,0
1170562502965493_1473830775971996,"First Daughter Ivanka Trump Gets Own Office In White House
http://rusharea.com/world-news/first-daughter-ivanka-trump-gets-office-white-house/",First Daughter Ivanka Trump Gets Own Office In White House - USA News Home,link,http://rusharea.com/world-news/first-daughter-ivanka-trump-gets-office-white-house/,2017-03-21 17:57:01,37,8,0,33,2,1,0,0,1
1170562502965493_1473730292648711,"Dem. Senator Calls Gorsuch 'Illegitimate,' Claims SCOTUS Seat 'Stolen'","Dem. Senator calls Gorsuch 'illegitimate,' claims SCOTUS seat 'stolen'",link,http://rusharea.com/world-news/dem-senator-calls-gorsuch-illegitimate-claims-scotus-seat-stolen/,2017-03-21 16:06:32,13,24,2,6,0,0,0,1,6
1170562502965493_1473643372657403,Norwegian Stylist Merete Hodne RefusE To Cut The Hair Of A Muslim Woman After Making Shariah Demand,Norwegian Stylist Merete Hodne RefusE To Cut The Hair Of A Muslim Woman After Making Shariah Demand - USA News Home,link,http://rusharea.com/world-news/norwegian-stylist-merete-hodne-refuse-cut-hair-muslim-woman-making-shariah-demand/,2017-03-21 14:06:28,51,13,0,50,0,0,0,0,1
1170562502965493_1473537936001280,Immigrant Attacks Police – Then Gets What He Deserves!!!,Immigrant Attacks Police – Then Gets What He Deserves!!! - USA News Home,link,http://rusharea.com/world-news/immigrant-attacks-police-gets-deserves/,2017-03-21 11:26:17,21,2,2,19,2,0,0,0,0
1170562502965493_1472953879393019,Indiana Student Makes American Flag Of Soldier Figures,Indiana Student Makes American Flag of Soldier Figures,link,http://rusharea.com/world-news/indiana-student-makes-american-flag-soldier-figures/,2017-03-20 22:00:00,17,3,1,17,0,0,0,0,0
1170562502965493_1472952742726466,TREY GOWDY FIGHTS TEARS AS HE VOWS TO DESTROY ELITE PEDOPHILE RING,TREY GOWDY FIGHTS TEARS AS HE VOWS TO DESTROY ELITE PEDOPHILE RING - USA News Home,link,http://rusharea.com/world-news/trey-gowdy-fights-tears-vows-destroy-elite-pedophile-ring/,2017-03-20 20:00:00,215,16,31,192,15,5,0,1,2
1170562502965493_1472932366061837,BREAKING: Trump Makes Move To CUT Research Funding For Cancer,BREAKING: Trump Makes Move to CUT Research Funding for Cancer - USA News Home,link,http://rusharea.com/world-news/breaking-trump-makes-move-cut-research-funding-cancer/,2017-03-20 18:06:27,6,12,0,4,0,0,0,0,2
1170562502965493_1472813212740419,The SENATE Just CONFIRMED TRUMP WAS VICTIM Of ILLEGAL SPYING By OBAMA ADMIN [VIDEO],The SENATE Just CONFIRMED TRUMP WAS VICTIM Of ILLEGAL SPYING By OBAMA ADMIN [VIDEO] - USA News Home,link,http://rusharea.com/world-news/senate-just-confirmed-trump-victim-illegal-spying-obama-admin-video/,2017-03-20 16:02:00,27,6,12,20,1,5,1,0,0
1170562502965493_1472784462743294,"Steve Harvey Warns Snoop, Bow Wow, And T.I. To Show That Good White Man Donald Trump Some Respect","Steve Harvey Warns Snoop, Bow Wow, and T.I. To Show That Good White Man Donald Trump Some Respect",link,http://rusharea.com/world-news/steve-harvey-warns-snoop-bow-wow-t-show-good-white-man-donald-trump-respect/,2017-03-20 14:05:15,36,4,0,35,0,0,1,0,0
1170562502965493_1472058149482592,"IT'S HAPPENING! IF JASON CHAFFETZ IS RIGHT, OBAMA WILL BE BEHIND BARS BY TOMORROW!","IT'S HAPPENING! IF JASON CHAFFETZ IS RIGHT, OBAMA WILL BE BEHIND BARS BY TOMORROW!",link,http://rusharea.com/world-news/happening-jason-chaffetz-right-obama-will-behind-bars-tomorrow/,2017-03-19 22:00:00,61,11,7,54,4,1,1,0,1
1170562502965493_1472056629482744,Trump Calls Fiancé Of Woman Killed By Illegal Immigrant,Trump Calls Fiancé of Woman Killed by Illegal Immigrant - USA News Home,link,http://rusharea.com/world-news/trump-calls-fiance-woman-killed-illegal-immigrant/,2017-03-19 20:00:01,16,1,1,11,3,1,1,0,0
1170562502965493_1472054576149616,After Being KICKED TO THE CURB By The 49ers KAEPERNICK Hears 3 BRUTAL WORDS From EVERY OTHER NFL TEAM … OOOPS!,After Being KICKED TO THE CURB By The 49ers KAEPERNICK Hears 3 BRUTAL WORDS From EVERY OTHER NFL TEAM … OOOPS! - USA News Home,link,http://rusharea.com/world-news/kicked-curb-49ers-kaepernick-hears-3-brutal-words-every-nfl-team-ooops/,2017-03-19 18:09:04,53,18,2,32,2,0,19,0,0
1170562502965493_1471975352824205,"VICTORY COMING: Trump Repeatedly Asked Afghan Amb ""What Do You Need To Win"" Against Terror","VICTORY COMING: Trump Repeatedly Asked Afghan Amb ""What Do You Need to Win"" Against Terror - USA News Home",link,http://rusharea.com/world-news/victory-coming-trump-repeatedly-asked-afghan-amb-need-win-terror/,2017-03-19 15:58:49,7,2,0,7,0,0,0,0,0
1170562502965493_1471810686174005,CEO Who Threatened To Kill Trump Get What He Deserved,CEO Who Threatened To Kill Trump Get What He Deserved - USA News Home,link,http://rusharea.com/world-news/ceo-threatened-kill-trump-get-deserved/,2017-03-19 14:00:01,12,4,0,10,2,0,0,0,0
1170562502965493_1471809656174108,CAREER OVER: Kaepernick ANGRY That Nobody Wants Him. What's Your Response?,CAREER OVER: Kaepernick ANGRY That Nobody Wants Him. What's Your Response? - USA News Home,link,http://rusharea.com/world-news/career-kaepernick-angry-nobody-wants-whats-response/,2017-03-19 11:47:59,403,259,62,194,17,1,188,2,1
1170562502965493_1471167276238346,Tomi Lahren Went On The View And Defended Trump's Travel Ban,Tomi Lahren Went On The View And Defended Trump's Travel Ban - USA News Home,link,http://rusharea.com/world-news/tomi-lahren-went-view-defended-trumps-travel-ban/,2017-03-18 22:30:01,34,0,0,30,3,0,0,0,1
1170562502965493_1471192366235837,This Must Be Stopped NOW! Supreme Court Makes Move To Invalidate 2016 Election!,This Must Be Stopped NOW! Supreme Court Makes Move to Invalidate 2016 Election! - USA News Home,link,http://rusharea.com/world-news/must-stopped-now-supreme-court-makes-move-invalidate-2016-election/,2017-03-18 21:03:00,28,30,4,13,0,1,3,0,11
1170562502965493_1471166316238442,"Trump Flanked By Mushroom Clouds, Nazi Symbols On Phoenix Billboard","Trump flanked by mushroom clouds, Nazi symbols on Phoenix billboard - USA News Home",link,http://rusharea.com/world-news/trump-flanked-mushroom-clouds-nazi-symbols-phoenix-billboard/,2017-03-18 20:30:00,20,21,3,5,1,1,1,0,12
1170562502965493_1471166542905086,Gingrich Reveals Clinton's Corruption Link To The DOJ,Gingrich Reveals Clinton's Corruption Link To The DOJ - USA News Home,link,http://rusharea.com/world-news/gingrich-reveals-clintons-corruption-link-doj-2/,2017-03-18 19:00:00,38,5,8,34,0,1,1,2,0
1170562502965493_1471164536238620,"Obama Helped Save Terror Org, Turned Down Help In Fighting ISIS","Obama Helped Save Terror Org, Turned Down Help in Fighting ISIS - USA News Home",link,http://rusharea.com/world-news/obama-helped-save-terror-org-turned-help-fighting-isis/,2017-03-18 18:39:47,12,2,1,8,0,0,0,0,4
