status_id,status_message,link_name,status_type,status_link,status_published,num_reactions,num_comments,num_shares,num_likes,num_loves,num_wows,num_hahas,num_sads,num_angrys
1170562502965493_1453526541335753,Ex-NSA Analyst Rips Trump For Exploiting 'Trapped' Widow: 'She Didn't Want To Stand Up — We Know Why',Ex-NSA analyst rips Trump for exploiting 'trapped' widow: 'She didn't want to stand up — we know why' - USA News Home,link,http://rusharea.com/world-news/ex-nsa-analyst-rips-trump-exploiting-trapped-widow-didnt-want-stand-know/,2017-03-01 20:18:43,2,4,0,2,0,0,0,0,0
1170562502965493_1453332111355196,Barack And Michelle Obama Reportedly Getting A Record-Setting $60 Million For Their Memoirs,Barack and Michelle Obama Reportedly Getting a Record-Setting $60 Million for Their Memoirs - USA News Home,link,http://rusharea.com/world-news/barack-michelle-obama-reportedly-getting-record-setting-60-million-memoirs/,2017-03-01 14:04:55,1,1,0,0,0,0,1,0,0
1170562502965493_1451467271541680,SHOCKING: THESE ARE THE LEAKED HILLARY`S EXECUTIVE ORDERS TO DESTROY AMERICA!,SHOCKING: THESE ARE THE LEAKED HILLARY`S EXECUTIVE ORDERS TO DESTROY AMERICA! - USA News Home,link,http://rusharea.com/world-news/shocking-leaked-hillarys-executive-orders-destroy-america/,2017-02-27 20:01:00,2,0,2,0,0,2,0,0,0
1170562502965493_1451423108212763,Cruz Announces 50% Decrease In Illegals Crossing The Texas Border,Cruz Announces 50% Decrease In Illegals Crossing The Texas Border - USA News Home,link,http://rusharea.com/world-news/cruz-announces-50-decrease-illegals-crossing-texas-border/,2017-02-27 18:03:59,3,2,0,3,0,0,0,0,0
1170562502965493_1451241381564269,Donald Trump Says He Will Not Attend The White House Correspondents' Dinner,Donald Trump Says He Will Not Attend the White House Correspondents' Dinner - USA News Home,link,http://rusharea.com/world-news/donald-trump-says-will-not-attend-white-house-correspondents-dinner/,2017-02-27 14:04:12,4,0,0,4,0,0,0,0,0
1170562502965493_1450417741646633,Watch: 'Offended' Muslims Try To Force Texan To Take Down American Flag – Texas' Response … PRICELESS!,Watch: 'offended' Muslims try to force Texan to take down American Flag – Texas' Response … PRICELESS! - USA News Home,link,http://rusharea.com/world-news/watch-offended-muslims-try-force-texan-take-american-flag-texas-response-priceless/,2017-02-26 22:00:01,8,0,1,7,1,0,0,0,0
1170562502965493_1450414278313646,"Chelsea Clinton, $10M Apartment, $3M Wedding, $600K Job: I Just Don't Care About Money","Chelsea Clinton, $10M Apartment, $3M Wedding, $600K Job: I Just Don't Care About Money - USA News Home",link,http://rusharea.com/world-news/chelsea-clinton-10m-apartment-3m-wedding-600k-job-just-dont-care-money-2/,2017-02-26 20:00:00,20,13,0,4,0,1,5,0,10
1170562502965493_1450394111648996,"Pat Boone Wants The Government To Punish Saturday Night Live ""If They Laugh At God Again""","Pat Boone Wants The Government To Punish Saturday Night Live ""If They Laugh At God Again"" - USA News Home",link,http://rusharea.com/world-news/pat-boone-wants-government-punish-saturday-night-live-laugh-god/,2017-02-26 17:58:56,15,10,2,11,1,1,1,1,0
1170562502965493_1450275981660809,CLINT EASTWOOD BLACKBALLED From Hollywood For Saying THlS… DO YOU STILL HAVE HIS BACK?,CLINT EASTWOOD BLACKBALLED from Hollywood for Saying THlS… DO YOU STILL HAVE HIS BACK? - USA News Home,link,http://rusharea.com/world-news/clint-eastwood-blackballed-hollywood-saying-thls-still-back/,2017-02-26 15:53:23,78,21,6,64,12,0,1,0,1
1170562502965493_1450106795011061,HOLY CRAP! TED CRUZ JUST WRECKED THE LIVES OF MILLIONS OF MUSLIMS AFTER TAKING ONE HUGE THING FROM THEM!,HOLY CRAP! TED CRUZ JUST WRECKED THE LIVES OF MILLIONS OF MUSLIMS AFTER TAKING ONE HUGE THING FROM THEM! - USA News Home,link,http://rusharea.com/world-news/holy-crap-ted-cruz-just-wrecked-lives-millions-muslims-taking-one-huge-thing/,2017-02-26 14:00:01,22,9,4,18,2,2,0,0,0
1170562502965493_1449412168413857,Trump Intensifies His Attacks On Journalists And Condemns F.B.I. 'Leakers',Trump Intensifies His Attacks on Journalists and Condemns F.B.I. 'Leakers' - USA News Home,link,http://rusharea.com/world-news/trump-intensifies-attacks-journalists-condemns-f-b-leakers/,2017-02-25 22:01:01,1,1,0,1,0,0,0,0,0
1170562502965493_1449410921747315,TRUMP OFFICAILLY BLOCKS CNN FROM WHITE HOUSE – Watch Their Live Reaction…,TRUMP OFFICAILLY BLOCKS CNN FROM WHITE HOUSE – Watch Their Live Reaction… - USA News Home,link,http://rusharea.com/world-news/trump-officailly-blocks-cnn-white-house-watch-live-reaction/,2017-02-25 20:01:03,33,20,3,22,2,0,9,0,0
1170562502965493_1449259471762460,The New Democrat National Committee Chairman Seals The Destiny Of All Democrats,The New Democrat National Committee Chairman Seals The Destiny Of All Democrats - USA News Home,link,http://rusharea.com/world-news/new-democrat-national-committee-chairman-seals-destiny-democrats/,2017-02-25 17:59:01,1,1,0,1,0,0,0,0,0
1170562502965493_1449256725096068,First Lady Melania And President Trump Will Skip The Oscars,First Lady Melania And President Trump Will Skip The Oscars - USA News Home,link,http://rusharea.com/world-news/first-lady-melania-president-trump-will-skip-oscars/,2017-02-25 16:00:01,13,3,0,12,1,0,0,0,0
1170562502965493_1449253051763102,White House Hand-Picks Select Media Outlets For Briefing,White House hand-picks select media outlets for briefing - USA News Home,link,http://rusharea.com/world-news/white-house-hand-picks-select-media-outlets-briefing/,2017-02-25 13:59:47,3,1,0,3,0,0,0,0,0
1170562502965493_1449218445099896,"Does Donald Trump Make You  Feel Proud to be American ? 

To create something like this - check GoUpLive.com",,video,https://www.facebook.com/USANewsHome/videos/1449218445099896/,2017-02-25 13:08:30,41,26,34,32,1,0,0,6,2
1170562502965493_1448483881840019,Muslim Woman Whines: I Don't Feel Safe In US Wearing A Headscarf With Trump As President,Muslim Woman Whines: I Don't Feel Safe In US Wearing A Headscarf With Trump As President - USA News Home,link,http://rusharea.com/world-news/muslim-woman-whines-dont-feel-safe-us-wearing-headscarf-trump-president/,2017-02-24 18:27:57,20,53,4,6,0,1,9,0,4
1170562502965493_1448286651859742,She is done !!!,SHOCKING: These Are The Leaked Hillary`s Executive Orders To Destroy America! - Life And About,link,http://lifeandabout.com/2017/02/shocking-leaked-hillarys-executive-orders-destroy-america/,2017-02-24 14:30:50,0,3,3,0,0,0,0,0,0
1170562502965493_1447475775274163,"U.S. Debt Was $19,947,304,555,212 On Jan. 20th… You'll Be Stunned At Where It Is Now","U.S. Debt Was $19,947,304,555,212 On Jan. 20th… You'll Be Stunned At Where It Is Now - USA News Home",link,http://rusharea.com/world-news/u-s-debt-19947304555212-jan-20th-youll-stunned-now/,2017-02-23 20:46:54,29,6,11,23,6,0,0,0,0
1170562502965493_1447469528608121,"Mexico Agrees To Pay For The Wall Only If U.S. ""Returns Texas To Mexico""","Mexico Agrees To Pay For The Wall Only If U.S. ""Returns Texas To Mexico"" - USA News Home",link,http://rusharea.com/world-news/mexico-agrees-pay-wall-u-s-returns-texas-mexico/,2017-02-23 18:24:15,39,32,10,13,1,0,25,0,0
1170562502965493_1446520308703043,Pat Robertson Speaks His Mind About Liberals' Attacks On President Trump,Pat Robertson Speaks His Mind About Liberals' Attacks On President Trump,link,http://rusharea.com/world-news/pat-robertson-speaks-mind-liberals-attacks-president-trump/,2017-02-22 19:06:49,5,4,1,5,0,0,0,0,0
1170562502965493_1446387528716321,Whoopi Goldberg Gets CRUSHED After Comparing Trump To A Terrorist!,Whoopi Goldberg Gets CRUSHED After Comparing Trump To A Terrorist! - USA News Home,link,http://rusharea.com/world-news/whoopi-goldberg-gets-crushed-comparing-trump-terrorist/,2017-02-22 17:16:00,5,7,0,2,0,0,2,0,1
1170562502965493_1446380018717072,FBI Forced To Release Anthony Weiner Warrant; Proves Election Was Stolen From Hillary,FBI Forced to Release Anthony Weiner Warrant; Proves Election Was Stolen from Hillary - USA News Home,link,http://rusharea.com/world-news/fbi-forced-release-anthony-weiner-warrant-proves-election-stolen-hillary/,2017-02-22 14:51:55,17,44,3,6,0,1,9,0,1
1170562502965493_1445146592173748,Rex Tillerson Just Fired All Hillary And Obama People At State Department!,Rex Tillerson Just Fired All Hillary And Obama People At State Department! - USA News Home,link,http://rusharea.com/world-news/rex-tillerson-just-fired-hillary-obama-people-state-department/,2017-02-21 14:07:00,42,6,174,34,5,0,0,1,2
1170562502965493_1440644479290626,Michael Moore Calls For Trump's Arrest,Michael Moore Calls For Trump's Arrest - USA News Home,link,http://rusharea.com/world-news/michael-moore-calls-trumps-arrest/,2017-02-17 18:43:22,7,17,2,3,0,0,0,0,4
1170562502965493_1440385862649821,"Rush Limbaugh Has Questions About Michael Flynn's Russia Ties: ""When Did Barack Obama Know?""","Rush Limbaugh has questions about Michael Flynn's Russia ties: ""When did Barack Obama know?"" - USA News Home",link,http://rusharea.com/world-news/rush-limbaugh-questions-michael-flynns-russia-ties-barack-obama-know/,2017-02-17 13:58:42,3,1,1,3,0,0,0,0,0
1170562502965493_1439155286106212,"BREAKING: NY Post BOMBSHELL… Obama ""Shadow Gov't"" Targeting Trump","BREAKING: NY Post BOMBSHELL… Obama ""Shadow Gov't"" Targeting Trump - USA News Home",link,http://rusharea.com/world-news/breaking-ny-post-bombshell-obama-shadow-govt-targeting-trump/,2017-02-16 17:14:24,2,2,1,2,0,0,0,0,0
1170562502965493_1438105576211183,GOP Senator Calls For Exhaustive Investigation Into Trump-Russia Connections,GOP senator calls for exhaustive investigation into Trump-Russia connections,link,http://rusharea.com/world-news/gop-senator-calls-exhaustive-investigation-trump-russia-connections/,2017-02-15 18:27:44,1,1,0,1,0,0,0,0,0
1170562502965493_1437221822966225,Rob Reiner: We Cannot Allow Trump's 'Cancerous Presidency' To 'Spread',Rob Reiner: We Cannot Allow Trump's 'Cancerous Presidency' to 'Spread' - USA News Home,link,http://rusharea.com/world-news/rob-reiner-cannot-allow-trumps-cancerous-presidency-spread/,2017-02-14 18:53:16,4,4,1,1,1,0,0,0,2
1170562502965493_1437116232976784,BREAKING: Trump HUMILIATES Obama After White House Cleaning Staff Finds Secret Stash Of THIS,BREAKING: Trump HUMILIATES Obama After White House Cleaning Staff Finds Secret Stash Of THIS - USA News Home,link,http://rusharea.com/world-news/breaking-trump-humiliates-obama-white-house-cleaning-staff-finds-secret-stash/,2017-02-14 16:42:01,19,15,5,8,0,0,10,0,1
1170562502965493_1437066682981739,"Joy Villa's Album Sales Rise 54,350,100%!","Joy Villa's Album Sales Rise 54,350,100%! - USA News Home",link,http://rusharea.com/world-news/joy-villas-album-sales-rise-54350100/,2017-02-14 14:28:51,17,2,4,13,4,0,0,0,0
1170562502965493_1436888759666198,"Like If Yes 
#Share

To create something like this - check GoUpLive.com",Poll: Will You Boycott George Clooney's New Movie?,video,https://www.facebook.com/USANewsHome/videos/1436888759666198/,2017-02-14 10:16:32,1189,953,122,1081,17,2,9,0,80
1170562502965493_1436260876395653,"Melania Trump Mindful Of Taxpayers' Money, Won't Employ Staffers She Doesn't Need!","Melania Trump Mindful Of Taxpayers' Money, Won't Employ Staffers She Doesn't Need! - USA News Home",link,http://rusharea.com/world-news/melania-trump-mindful-taxpayers-money-wont-employ-staffers-doesnt-need/,2017-02-13 16:11:28,25,8,8,19,5,1,0,0,0
1170562502965493_1436052596416481,"LIVE: Oroville Dam in Northern California
Nearly 200,000 residents near one of the nation's biggest dams have been ordered to evacuate the area due to a ""hazardous situation developing"" after an emergency spillway severely eroded.
#SHARE

To create something like this - check GoUpLive.com",LIVE: Oroville Dam in Northern California,video,https://www.facebook.com/USANewsHome/videos/1436052596416481/,2017-02-13 11:44:15,72,81,38,26,2,30,3,9,2
1170562502965493_1435471926474548,"Black Rifle Coffee Company Vows To Hire Vets, Build New Stores, And Donate To Police Officers","Black Rifle Coffee Company Vows to Hire Vets, Build New Stores, and Donate to Police Officers - USA News Home",link,http://rusharea.com/world-news/black-rifle-coffee-company-vows-hire-vets-build-new-stores-donate-police-officers/,2017-02-12 22:00:00,19,1,2,17,2,0,0,0,0
1170562502965493_1435468213141586,"Trump To Reign In ""Obamaphone"" Program
http://rusharea.com/world-news/trump-reign-obamaphone-program/","Trump to Reign in ""Obamaphone"" Program - USA News Home",link,http://rusharea.com/world-news/trump-reign-obamaphone-program/,2017-02-12 20:00:02,11,6,0,10,1,0,0,0,0
1170562502965493_1435460659809008,Poll: Will You Boycott George Clooney's New Movie?,Poll: Will You Boycott George Clooney's New Movie? - USA News Home,link,http://rusharea.com/world-news/poll-will-boycott-george-clooneys-new-movie/,2017-02-12 17:51:11,22,19,3,18,1,0,3,0,0
1170562502965493_1434429669912107,"Jared Kushner May Be The ""Shadow Secretary Of State""","Jared Kushner May Be The ""Shadow Secretary Of State"" - USA News Home",link,http://rusharea.com/world-news/jared-kushner-may-shadow-secretary-state/,2017-02-11 15:25:49,2,4,0,2,0,0,0,0,0
1170562502965493_1434319736589767,True Patriot !!!,VIDEO: DR. PHIL Defends Trump On National TV & Attacks Liberal Host! ! - Life And About,link,http://lifeandabout.com/2017/02/video-dr-phil-defends-trump-national-tv-attacks-liberal-host/,2017-02-11 12:36:59,9,4,3,8,1,0,0,0,0
1170562502965493_1431983606823380,"One By One, Black New England Patriots Players Are Refusing To Visit Donald Trump's White House  
     
   http://rusharea.com/world-news/one-one-black-new-england-patriots-players-refusing-visit-donald-trumps-white-house/","One by one, black New England Patriots players are refusing to visit Donald Trump's White House - USA News Home",link,http://rusharea.com/world-news/one-one-black-new-england-patriots-players-refusing-visit-donald-trumps-white-house/,2017-02-08 17:25:28,19,30,3,10,0,1,1,2,5
1170562502965493_1431909353497472,WATCH: Video Of Trump Listening To Clinton And Obama Speak Is About To Go Viral,WATCH: Video of Trump Listening to Clinton and Obama Speak Is About to Go Viral - USA News Home,link,http://rusharea.com/world-news/watch-video-trump-listening-clinton-obama-speak-go-viral/,2017-02-08 15:11:29,2,5,0,2,0,0,0,0,0
1170562502965493_1431083543580053,Police Officers Intervened After Protesters Decided To Block A Roadway,Police Officers Intervened After Protesters Decided To Block A Roadway - USA News Home,link,http://rusharea.com/world-news/police-officers-intervened-protesters-decided-block-roadway/,2017-02-07 23:00:02,2,9,0,1,0,0,0,0,1
1170562502965493_1431077350247339,Whoopi Goldberg Uses Super Bowl To Insult Trump- Faces Severe Consequences!,Whoopi Goldberg Uses Super Bowl To Insult Trump- Faces Severe Consequences! - USA News Home,link,http://rusharea.com/world-news/whoopi-goldberg-uses-super-bowl-insult-trump-faces-severe-consequences/,2017-02-07 21:00:02,0,4,0,0,0,0,0,0,0
1170562502965493_1431071053581302,President Trump Is Free To Bring Decisions About Muslim Immigrants,President Trump Is Free To Bring Decisions About Muslim Immigrants - USA News Home,link,http://rusharea.com/world-news/president-trump-free-bring-decisions-muslim-immigrants/,2017-02-07 19:00:02,2,5,0,2,0,0,0,0,0
1170562502965493_1431067040248370,Mike Pence Invites 2 Wounded Service Members To Super Bowl,Mike Pence Invites 2 Wounded Service Members to Super Bowl - USA News Home,link,http://rusharea.com/world-news/mike-pence-invites-2-wounded-service-members-super-bowl/,2017-02-07 16:56:40,1,3,0,1,0,0,0,0,0
1170562502965493_1430847700270304,Mainstream Media Panic After Mexican Pres. DEFENDS Trump,Mainstream Media Panic After Mexican Pres. DEFENDS Trump - USA News Home,link,http://rusharea.com/world-news/mainstream-media-panic-mexican-pres-defends-trump/,2017-02-07 15:00:00,1,3,0,1,0,0,0,0,0
1170562502965493_1430003060354768,Gen. Mattis Cleaning Up Obama's Mess… Starts By Putting Kim Jong Un In His Place,Gen. Mattis Cleaning Up Obama's Mess… Starts by Putting Kim Jong Un in His Place - USA News Home,link,http://rusharea.com/world-news/gen-mattis-cleaning-obamas-mess-starts-putting-kim-jong-un-place/,2017-02-06 22:00:00,4,2,0,3,1,0,0,0,0
1170562502965493_1429999010355173,BREAKING: Navy SEALs Wave Trump's Flag In Appreciation- Trump Stunned!,BREAKING: Navy SEALs Wave Trump's Flag In Appreciation- Trump Stunned! - USA News Home,link,http://rusharea.com/world-news/breaking-navy-seals-wave-trumps-flag-appreciation-trump-stunned/,2017-02-06 20:00:00,16,5,0,15,1,0,0,0,0
1170562502965493_1429995157022225,MIGRANTS GIVE GEORGE CLOONEY A RUDE AWAKING AT HIS BEAUTIFUL VACATION HOME,MIGRANTS GIVE GEORGE CLOONEY A RUDE AWAKING AT HIS BEAUTIFUL VACATION HOME - USA News Home,link,http://rusharea.com/world-news/migrants-give-george-clooney-rude-awaking-beautiful-vacation-home/,2017-02-06 17:55:00,3,2,0,1,0,0,2,0,0
1170562502965493_1429993067022434,"Kurt Russell Slams Fellow Liberals… ""I Think My Liberalness Goes Far Beyond Theirs""","Kurt Russell Slams Fellow Liberals… ""I think my liberalness goes far beyond theirs"" - USA News Home",link,http://rusharea.com/world-news/kurt-russell-slams-fellow-liberals-think-liberalness-goes-far-beyond/,2017-02-06 17:51:11,5,0,0,5,0,0,0,0,0
1170562502965493_1429006653787742,WATCH: Tucker Carlson Challenges Black Professor On White Privilege,WATCH: Tucker Carlson Challenges Black Professor on White Privilege - USA News Home,link,http://rusharea.com/world-news/watch-tucker-carlson-challenges-black-professor-white-privilege/,2017-02-05 23:00:00,1,1,1,1,0,0,0,0,0
1170562502965493_1429003730454701,Thousands Of Comments Demanding Miley To Stay True To Her Word And Leave The Country,Thousands Of Comments Demanding Miley To Stay True To Her Word And Leave The Country,link,http://rusharea.com/world-news/thousands-comments-demanding-miley-stay-true-word-leave-country/,2017-02-05 21:00:00,1,1,0,1,0,0,0,0,0
1170562502965493_1428996163788791,Celebrities Call For 'Total Hollywood Strike' Until Trump Resigns,Celebrities Call For 'Total Hollywood Strike' Until Trump Resigns,link,http://rusharea.com/world-news/celebrities-call-total-hollywood-strike-trump-resigns/,2017-02-05 19:00:00,5,6,2,2,0,0,3,0,0
1170562502965493_1429007777120963,http://rusharea.com/world-news/new-report-exposes-6-top-republicans-george-soros-payroll-guess-whos-paid-stop-trump/,New Report EXPOSES 6 Top REPUBLICANS on GEORGE SOROS' PAYROLL! Guess Who's Being Paid to Stop Trump? - USA News Home,link,http://rusharea.com/world-news/new-report-exposes-6-top-republicans-george-soros-payroll-guess-whos-paid-stop-trump/,2017-02-05 17:31:18,1,1,3,1,0,0,0,0,0
1170562502965493_1428923127129428,Trump Just Crippled George Soros And His Organizations With A Stroke Of His Pen!,Trump Just Crippled George Soros And His Organizations With A Stroke Of His Pen!,link,http://rusharea.com/world-news/trump-just-crippled-george-soros-organizations-stroke-pen/,2017-02-05 15:02:06,15,0,0,15,0,0,0,0,0
1170562502965493_1428101640544910,Trump To Declare George Soros 'National Security Threat',Trump To Declare George Soros 'National Security Threat' - USA News Home,link,http://rusharea.com/world-news/trump-declare-george-soros-national-security-threat/,2017-02-04 21:31:00,22,4,0,22,0,0,0,0,0
1170562502965493_1428098033878604,NYPD SOURCES ANNOUNCES They Are PREPARING TO ARREST HILLARY CLINTON On PEDOPHILIA & TREASON CHARGES Says Report …,NYPD SOURCES ANNOUNCES They Are PREPARING TO ARREST HILLARY CLINTON on PEDOPHILIA & TREASON CHARGES Says Report … - USA News Home,link,http://rusharea.com/world-news/nypd-sources-announces-preparing-arrest-hillary-clinton-pedophilia-treason-charges-says-report/,2017-02-04 19:30:00,12,6,1,10,1,1,0,0,0
1170562502965493_1427983053890102,"Nordstrom, Neiman Marcus Drop Ivanka Trump's Fashion Collection, Citing Brand's Performance","Nordstrom, Neiman Marcus Drop Ivanka Trump's Fashion Collection, Citing Brand's Performance - USA News Home",link,http://rusharea.com/world-news/nordstrom-neiman-marcus-drop-ivanka-trumps-fashion-collection-citing-brands-performance/,2017-02-04 17:30:00,1,4,0,1,0,0,0,0,0
1170562502965493_1427969757224765,BOOM: Miley Cyrus To Leave America For Good After Challenging Donald Trump And Losing Big Time,BOOM: Miley Cyrus To Leave America For Good After Challenging Donald Trump And Losing Big Time - USA News Home,link,http://rusharea.com/world-news/boom-miley-cyrus-leave-america-good-challenging-donald-trump-losing-big-time/,2017-02-04 15:36:59,12,5,0,12,0,0,0,0,0
1170562502965493_1427028820652192,Poll: 4 In 10 Support Impeaching Trump,Poll: 4 in 10 support impeaching Trump - USA News Home,link,http://rusharea.com/world-news/poll-4-10-support-impeaching-trump/,2017-02-03 15:07:58,9,6,2,5,0,0,1,1,2
1170562502965493_1426032470751827,BREAKING: NYC MAYOR HEADED TO JAIL FOR SUPPLYING FAKE IDS TO ILLEGALS ! VIDEO,BREAKING: NYC MAYOR HEADED TO JAIL FOR SUPPLYING FAKE IDS TO ILLEGALS ! VIDEO - USA News Home,link,http://rusharea.com/world-news/breaking-nyc-mayor-headed-jail-supplying-fake-ids-illegals-video/,2017-02-02 21:00:00,10,5,3,8,0,0,2,0,0
1170562502965493_1425757927445948,"""WE MUST START KILLING PEOPLE""- SAYS TEACHER AT BLM TRUMP PROTEST (VIDEO)","""WE MUST START KILLING PEOPLE""- SAYS TEACHER AT BLM TRUMP PROTEST (VIDEO) - USA News Home",link,http://rusharea.com/world-news/must-start-killing-people-says-teacher-blm-trump-protest-video/,2017-02-02 19:00:00,0,4,0,0,0,0,0,0,0
1170562502965493_1425743660780708,WATCH: Normally Quiet Orrin Hatch Finally Loses It… Goes OFF On Senate Dems,WATCH: Normally Quiet Orrin Hatch Finally Loses It… Goes OFF on Senate Dems - USA News Home,link,http://rusharea.com/world-news/watch-normally-quiet-orrin-hatch-finally-loses-goes-off-senate-dems/,2017-02-02 17:00:00,1,0,0,1,0,0,0,0,0
1170562502965493_1425730094115398,"California Considers Becoming Sanctuary STATE… Would Trump Withhold Fed Funds, Push Secession?","California Considers Becoming Sanctuary STATE… Would Trump Withhold Fed Funds, Push Secession? - USA News Home",link,http://rusharea.com/world-news/california-considers-becoming-sanctuary-state-trump-withhold-fed-funds-push-secession/,2017-02-02 15:00:00,0,3,0,0,0,0,0,0,0
1170562502965493_1424931980861876,Dems Use This Photo To Attack Trump's Ban… Then Internet Reveals It Has ZERO To Do With Trump,Dems Use This Photo to Attack Trump's Ban… Then Internet Reveals It Has ZERO to Do with Trump - USA News Home,link,http://rusharea.com/world-news/dems-use-photo-attack-trumps-ban-internet-reveals-zero-trump/,2017-02-01 23:00:00,3,4,0,1,0,0,0,0,2
1170562502965493_1424926484195759,"Morgan Freeman Claims He's ""Holding Out Hope"" For Trump's Presidency","Morgan Freeman Claims He's ""Holding out Hope"" for Trump's Presidency - USA News Home",link,http://rusharea.com/world-news/morgan-freeman-claims-hes-holding-hope-trumps-presidency/,2017-02-01 21:00:00,7,3,0,7,0,0,0,0,0
1170562502965493_1424922310862843,Corrupt Chuck Schumer Cries Over Trump's Decision To Bar Immigrants,Corrupt Chuck Schumer Cries Over Trump's Decision To Bar Immigrants - USA News Home,link,http://rusharea.com/world-news/corrupt-chuck-schumer-cries-trumps-decision-bar-immigrants/,2017-02-01 19:00:00,0,3,0,0,0,0,0,0,0
1170562502965493_1424911200863954,"Prince Charles Recalls The Dangers Of WWII, Speaks About The Rise Of Populism","Prince Charles Recalls The Dangers Of WWII, Speaks About The Rise Of Populism - USA News Home",link,http://rusharea.com/world-news/prince-charles-recalls-dangers-wwii-speaks-rise-populism/,2017-02-01 17:25:05,0,1,0,0,0,0,0,0,0
1170562502965493_1424897224198685,,,status,,2017-02-01 16:59:53,0,0,0,0,0,0,0,0,0
1170562502965493_1424825127539228,Obama Should Mind His Own Business | Do You Agree?,Obama Should Mind His Own Business | Do You Agree?,link,http://rusharea.com/world-news/obama-mind-business-agree/,2017-02-01 15:06:49,19,14,1,19,0,0,0,0,0
1170562502965493_1424657684222639,"THE TRUMP ADMINISTRATION IS EXPLORING HOW TO CUT FEDERAL FUNDING FROM SO-CALLED ""SANCTUARY CITIES"" — INCLUDING NEW YORK — THAT OFFER SAFE HARBORS FOR ILLEGAL IMMIGRANTS",Trump wants to strip federal funding from 'sanctuary cities' - USA Daily data,link,http://usdailydata.com/world-news/trump-wants-strip-federal-funding-sanctuary-cities/,2017-02-01 11:06:02,13,3,0,10,3,0,0,0,0
1170562502965493_1423564064332001,RIHANNA: PRESIDENT TRUMP IS AN 'IMMORAL PIG',RIHANNA: PRESIDENT TRUMP IS AN 'IMMORAL PIG' - USA News Home,link,http://rusharea.com/world-news/rihanna-president-trump-immoral-pig/,2017-01-31 15:52:12,5,7,0,2,1,0,2,0,0
1170562502965493_1422731864415221,Trey Gowdy Supports President Trump In His Vetting Policy,Trey Gowdy Supports President Trump In His Vetting Policy - USA News Home,link,http://rusharea.com/world-news/trey-gowdy-supports-president-trump-vetting-policy/,2017-01-30 23:00:00,8,2,1,7,0,0,0,0,1
1170562502965493_1422728927748848,"Ashton Kutcher Corners Trump In SAG Awards Speech, But America Fights Back!","Ashton Kutcher Corners Trump In SAG Awards Speech, But America Fights Back! - USA News Home",link,http://rusharea.com/world-news/ashton-kutcher-corners-trump-sag-awards-speech-america-fights-back/,2017-01-30 21:00:00,1,1,0,1,0,0,0,0,0
1170562502965493_1422526137769127,"MADONNA LEFT THE US, NEVER TO RETURN AGAIN! WHAT IS YOUR RESPONSE?","MADONNA LEFT THE US, NEVER TO RETURN AGAIN! WHAT IS YOUR RESPONSE? - USA News Home",link,http://rusharea.com/world-news/madonna-left-us-never-return-response/,2017-01-30 19:00:00,32,24,1,21,4,0,7,0,0
