status_id,status_message,link_name,status_type,status_link,status_published,num_reactions,num_comments,num_shares,num_likes,num_loves,num_wows,num_hahas,num_sads,num_angrys
1237168256301866_1500739469944742,"As the minimum wage goes up in California, businesses and workers are looking elsewhere.",Businesses Flee California as Minimum Wage Goes Up | Refined Right,link,https://rrght.io/2nMc4IX,2017-03-29 12:08:21,0,0,0,0,0,0,0,0,0
1237168256301866_1500697529948936,Is HB2 good for North Carolina? The media hasn't made up its mind.,rrght.io,link,https://rrght.io/2nIAjYe,2017-03-29 11:18:06,0,0,0,0,0,0,0,0,0
1237168256301866_1499860350032654,"Political activism since Trump's election has shot through the roof, and this is a good thing for the country.",Make America Smart Again: A Rebirth of Intellectualism During the Trump Presidency | Refined Right,link,https://rrght.io/2nfzVNT,2017-03-28 18:49:00,0,0,0,0,0,0,0,0,0
1237168256301866_1499617076723648,"""People (or at least the individuals that I observe) are actually so terrified of Trump and what he might do that they are taking the time to learn about his powers, learn about his policies, learn about government in general.""",Make America Smart Again: A Rebirth of Intellectualism During the Trump Presidency | Refined Right,link,https://rrght.io/2nfchRI,2017-03-28 13:18:04,0,0,0,0,0,0,0,0,0
1237168256301866_1499563686728987,The controversy surrounding a rape at a Rockville high school continues to make headlines.,Maryland Continues to Make Headlines over Alleged Rape | Refined Right,link,https://rrght.io/2neCL5N,2017-03-28 12:08:03,0,0,1,0,0,0,0,0,0
1237168256301866_1499524376732918,"""Get Out"" is a film that provides a cultural enlightenment during a divided time like today.",Get Out: The Social Horror Movie Everyone Needs To See | Refined Right,link,https://rrght.io/2nwgVNv,2017-03-28 11:18:00,0,1,0,0,0,0,0,0,0
1237168256301866_1498384226846933,A SpaceX launch scheduled for Thursday promises to be the first reuse of a previously-flown orbital booster.,SpaceX to Launch First Reused Rocket This Week | Refined Right,link,https://rrght.io/2mJnVI9,2017-03-27 13:18:07,0,0,0,0,0,0,0,0,0
1237168256301866_1498339126851443,"According to new GOP bill, ISP (internet service providers) will no longer have to inform consumers when sensitive data is shared or sold.",Republicans Pass Anti-Privacy Resolution in the Senate | Refined Right,link,https://rrght.io/2opE69X,2017-03-27 12:08:01,0,0,0,0,0,0,0,0,0
1237168256301866_1498295686855787,"""The sad and real issue behind these attacks is a failing mental health system, & a robotic education system that turns students into numbers.""",The Deadly Consequences of Ignoring the Real Problem Behind Mass Shootings | Refined Right,link,https://rrght.io/2opl0ks,2017-03-27 11:18:00,0,0,0,0,0,0,0,0,0
1237168256301866_1494573927227963,Paul Ryan helped whip and said nay nay.https://rrght.io/2o0nhD9,The American Health Care Act Is Dead | Refined Right,link,http://rrght.io/2o0nhD9,2017-03-24 16:29:33,2,0,0,2,0,0,0,0,0
1237168256301866_1493019184050104,The internet trolls won yet another victory against Shia LaBeouf today.,"Oops, They Did It Again! Internet Trolls Win Another Round Against Shia | Refined Right",link,https://rrght.io/2mwnJw5,2017-03-23 11:18:00,2,0,0,1,0,0,1,0,0
1237168256301866_1491453797539976,President Trump will deliver the commencement address at Liberty University this year.,President Trump to Speak at Liberty University Commencement | Refined Right,link,https://rrght.io/2nB5chN,2017-03-22 06:54:24,6,0,6,6,0,0,0,0,0
1237168256301866_1489183774433645,"The first day of confirmation hearings for Judge Neil Gorsuch were uneventful, but insightful into the traditions behind the Supreme Court itself.",Symbolism and Tradition on First Day of Gorsuch Hearings | Refined Right,link,https://rrght.io/2nLSee6,2017-03-20 18:07:00,1,0,0,1,0,0,0,0,0
1237168256301866_1488945031124186,Ongoing coverage of the HPSCI hearings on Trump and Russia:,"Comey Confirms Investigation into Russia, Shoots Down Wiretap Claims | Refined Right",link,https://rrght.io/2nDztN5,2017-03-20 12:01:56,2,0,0,2,0,0,0,0,0
1237168256301866_1488175021201187,"Outside the Supreme Court this afternoon, a small group gathered for a brief service of worship and prayer before Judge Neil Gorsuch's confirmation hearing tomorrow.","Before Gorsuch's Confirmation, Prayer Outside the Supreme Court | Refined Right",link,https://rrght.io/2mYhaPz,2017-03-19 18:58:06,4,0,0,2,1,0,1,0,0
1237168256301866_1485626301456059,Opinion: The decision by a Hawaii judge to strike down the second executive order on immigration is a dangerous example of judicial overreach and supremacy which sets bad precedent.,Commentary: Judge Watson's Damaging Judicial Overreach | Refined Right,link,https://rrght.io/2ngZ9ij,2017-03-17 11:18:07,2,0,2,2,0,0,0,0,0
1237168256301866_1483682181650471,"Threatening to ""pimp"" the First Lady might have consequences for Bow Wow.",Bow Wow Threatens To 'Pimp' Melania Trump | Refined Right,link,https://rrght.io/2ntN4n6,2017-03-15 18:49:07,1,0,1,1,0,0,0,0,0
1237168256301866_1483404275011595,Two members of the FSB were indicted on Wednesday for their connection to the 2014 Yahoo hack of over 500 accounts.,undefined,link,https://rrght.io/2naAFqZ,2017-03-15 12:08:10,0,0,0,0,0,0,0,0,0
1237168256301866_1483359078349448,"Trump's communications could have been intercepted, ""if he was speaking with individuals under surveillance.""",Nunes: No Evidence of Trump Tower Wiretapping | Refined Right,link,https://rrght.io/2msEIKA,2017-03-15 11:18:06,0,0,0,0,0,0,0,0,0
1237168256301866_1481312368554119,Kellyanne Conway said on Sunday night that microwaves can be used for surveillance. (they can't),"Conway: Microwaves With Cameras Are a ""Fact of Modern Life"" | Refined Right",link,https://rrght.io/2ng9f3p,2017-03-13 12:08:08,0,0,0,0,0,0,0,0,0
1237168256301866_1481275401891149,Sean Spicer tried to quietly buy an Apple Watch over the weekend. It didn't quite go as he planned.,"Woman Harasses Spicer at Apple Store, Calls His Response ""Bigotry"" | Refined Right",link,https://rrght.io/2nwAdj6,2017-03-13 11:18:11,0,0,0,0,0,0,0,0,0
1237168256301866_1478759192142770,"Shia LaBeouf tried to hide his flag from the internet, but he underestimated the collective power of 4chan trolls.",4Chan Trolls Shia LaBeouf in Epic Capture the Flag Game | Refined Right,link,https://rrght.io/2mMQ1RJ,2017-03-11 12:18:03,0,0,0,0,0,0,0,0,0
1237168256301866_1474279025924120,"Despite the hype over this morning's Wikileaks dump, the actual information in the CIA documents is not new.",Leaked CIA Hacking Documents Offer Few Surprises | Refined Right,link,https://rrght.io/2mylcjH,2017-03-07 19:49:34,0,0,0,0,0,0,0,0,0
1237168256301866_1474033415948681,"Carolyn Bryant, who claimed Emmett Till had wolf whistled and grabbed her admitted to making up those details, in a 2007 interview. She never felt scared to death.","""I'm Going to Make an Example of You...so Everybody can Know How Me and My Folks Stand"" | Refined Right",link,https://rrght.io/2mBrgZf,2017-03-07 14:18:03,0,0,0,0,0,0,0,0,0
1237168256301866_1473987229286633,"The kidnapping, execution, trial, and aftermath of Emmett Till.","""I'm Going to Make an Example of You...so Everybody can Know How Me and My Folks Stand"" | Refined Right",link,https://rrght.io/2mihZ79,2017-03-07 13:08:09,0,0,0,0,0,0,0,0,0
1237168256301866_1473953789289977,"Look at the age difference of MSM's viewers and the real problem with them becomes clear. They have a branding problem, not a fake news problem. https://rrght.io/2mxjjn9",,status,,2017-03-07 12:18:00,0,0,0,0,0,0,0,0,0
1237168256301866_1473245022694187,"After weeks of speculation, the Republican-written replacement to the Affordable Care Act is finally available for the public to read.",House Republicans Unveil Obamacare Replacement | Refined Right,link,https://rrght.io/2myx2um,2017-03-06 19:48:16,0,0,0,0,0,0,0,0,0
1237168256301866_1473244852694204,"Trump's new immigration order is here, and it's significantly different than the prior attempt.",Trump Signs Immigration Order Round Two | Refined Right,link,https://rrght.io/2myzK39,2017-03-06 19:47:51,1,0,0,1,0,0,0,0,0
1237168256301866_1473017996050223,"Japanese Prime Minister: ""The launches are clearly in violation of Security Council resolutions.""",North Korea Fires Missiles into Sea of Japan | Refined Right,link,https://rrght.io/2mwt5pY,2017-03-06 14:18:05,0,0,0,0,0,0,0,0,0
1237168256301866_1472974409387915,We spoke with Antonia Okafor after her CPAC panel about promoting the Second Amendment to young conservative women.,How One Woman is Changing the Face of the 2A Movement | Refined Right,link,https://rrght.io/2n6jnYk,2017-03-06 13:08:02,1,0,0,1,0,0,0,0,0
1237168256301866_1472933746058648,"A push for ""death with dignity"" has begun in several state legislatures, as well as the District of Columbia.",Death With Dignity Wins and Loses in Several States | Refined Right,link,https://rrght.io/2mMl0y9,2017-03-06 12:18:11,0,0,1,0,0,0,0,0,0
1237168256301866_1472281306123892,"The modern conservative movement has no modern-day Buckley to guide it forward, argues Troy Worden. https://rrght.io/2msbMDG",Timeline Photos,photo,https://www.facebook.com/refinedright/photos/a.1246091752076183.1073741828.1237168256301866/1472281306123892/?type=3,2017-03-05 20:19:40,0,0,0,0,0,0,0,0,0
1237168256301866_1462999523718737,Trump said there were lines six blocks long to attend his speech (there weren't).,Trump: The Era of Empty Talk is Over | Refined Right,link,https://rrght.io/2lB2abi,2017-02-24 20:15:05,1,1,0,1,0,0,0,0,0
1237168256301866_1462680073750682,"""If you've been called deplorable, you might have had a few months of being abused. I've had 25 years of it!""",Farage: This Is Your Celebration | Refined Right,link,https://rrght.io/2mllmrZ,2017-02-24 12:39:14,2,0,0,2,0,0,0,0,0
1237168256301866_1462471230438233,"Day Three of CPAC coverage starts soon with President Trump, Nigel Farage, and many more speakers!",Timeline Photos,photo,https://www.facebook.com/refinedright/photos/a.1246091752076183.1073741828.1237168256301866/1462471230438233/?type=3,2017-02-24 08:16:34,1,0,0,1,0,0,0,0,0
1237168256301866_1461905303828159,"We will need everyone's help to make America great again, VP Pence said tonight at CPAC.",Pence: The Best Days Are Yet To Come | Refined Right,link,https://rrght.io/2lQenty,2017-02-23 20:19:45,1,1,0,1,0,0,0,0,0
1237168256301866_1461905233828166,Steve Bannon and Reince Priebus discussed the early days of the Trump administration at CPAC this afternoon. https://rrght.io/2lvTxPk,Timeline Photos,photo,https://www.facebook.com/refinedright/photos/a.1246091752076183.1073741828.1237168256301866/1461905233828166/?type=3,2017-02-23 20:19:43,0,0,0,0,0,0,0,0,0
1237168256301866_1461905223828167,"Richard Spencer called Milo ""a blazer pleated Khakis, bow tie wearing, conservative doofus"" at #CPAC2017 today.",Richard Spencer: CPAC was Right in Uninviting Milo | Refined Right,link,https://rrght.io/2lzujOj,2017-02-23 20:19:41,0,0,0,0,0,0,0,0,0
1237168256301866_1461900790495277,"The alt-right ""ain't all right,"" argued ACU board member Dan Schneider at CPAC this morning. https://rrght.io/2lzuOIq",Timeline Photos,photo,https://www.facebook.com/refinedright/photos/a.1246091752076183.1073741828.1237168256301866/1461900790495277/?type=3,2017-02-23 20:15:11,0,0,0,0,0,0,0,0,0
1237168256301866_1461429660542390,"""I look at myself as a product of my choices, not a victim of my circumstances."" -Kellyanne Conway https://rrght.io/2luInKN",Timeline Photos,photo,https://www.facebook.com/refinedright/photos/a.1246091752076183.1073741828.1237168256301866/1461429660542390/?type=3,2017-02-23 10:10:38,0,0,0,0,0,0,0,0,0
1237168256301866_1461421737209849,"""No one knows you better than you"" -Kellyanne Conway",Timeline Photos,photo,https://www.facebook.com/refinedright/photos/a.1246091752076183.1073741828.1237168256301866/1461421737209849/?type=3,2017-02-23 09:58:58,0,0,0,0,0,0,0,0,0
1237168256301866_1460923977259625,Sean Hannity interviewed Kellyanne Conway and more at CPAC today. https://rrght.io/2lazuU3,Timeline Photos,photo,https://www.facebook.com/refinedright/photos/a.1246091752076183.1073741828.1237168256301866/1460923977259625/?type=3,2017-02-22 22:07:43,1,0,0,1,0,0,0,0,0
1237168256301866_1459558300729526,"MORE: Yiannopoulos says his decision was ""his alone,"" following rumors of internal dissent and advertiser pressure.",BREAKING: Milo Announces Departure From Breitbart | Refined Right,link,https://rrght.io/2miYg4z,2017-02-21 14:45:13,4,0,0,1,0,0,0,3,0
1237168256301866_1459547344063955,BYE FELICIA: Milo just announced he and Breitbart have parted ways in the wake of an ongoing scandal. https://rrght.io/2ljK3Xb,Timeline Photos,photo,https://www.facebook.com/refinedright/photos/a.1246091752076183.1073741828.1237168256301866/1459547344063955/?type=3,2017-02-21 14:37:44,1,0,0,0,0,0,0,1,0
1237168256301866_1458789934139696,"Trump will be speaking at CPAC, but Milo will not.",ACU: No Milo at CPAC | Refined Right,link,https://rrght.io/2lEcU9X,2017-02-20 22:06:03,7,1,0,3,0,0,0,1,3
1237168256301866_1458710567480966,President Trump will be among the speakers this week at CPAC. We'll be there starting Thursday.,"Amid Controversy, Donald Trump to Speak at CPAC | Refined Right",link,https://rrght.io/2kQQugZ,2017-02-20 20:15:11,1,0,0,1,0,0,0,0,0
1237168256301866_1455396951145661,"The Trump administration is obsessed with ""fake news."" In the long run, this has serious implications for both the administration's image and a free press. https://rrght.io/2m2wut4",,status,,2017-02-17 22:06:01,0,1,0,0,0,0,0,0,0
1237168256301866_1455293894489300,Another story of campus vandalism: the U of Texas Young Republicans found their posters covered in graffiti.,Young Republicans on Campus Group Has Their Poster Vandalized with Anti-Trump Slogans | Refined Right,link,https://rrght.io/2lq3AGk,2017-02-17 20:15:19,2,0,0,0,0,0,0,0,2
1237168256301866_1449579271727429,A study comes out highlighting how much Republicans think of Australia right as Trump has a less than stellar phone call with Australia's prime minister,"Australia Considered Biggest Ally by Republicans, Amid Trump's Recent Phone Call with Australia | Refined Right",link,https://rrght.io/2lxYgRT,2017-02-12 18:06:06,0,0,0,0,0,0,0,0,0
1237168256301866_1449493925069297,Romanian politicians' efforts to curtail corruption laws didn't go unpunished,Romanians Protest Law That Would Have Eased Corruption Penalties | Refined Right,link,https://rrght.io/2lCYtzl,2017-02-12 15:46:02,0,0,0,0,0,0,0,0,0
1237168256301866_1449351798416843,The US is furthering a regional war in Yemen,"The War in Yemen: Worse Than Syria, Backed by the US | Refined Right",link,https://rrght.io/2kWAiMO,2017-02-12 12:37:06,0,0,0,0,0,0,0,0,0
1237168256301866_1449245725094117,"""Perhaps it is the final display of political tragedy that the most significant campaign (thus far) of the 21st century is one that likely will not get the recognition it deserves.""",The Most Important Presidential Campaign of the 21st Century | Refined Right,link,https://rrght.io/2lxWn7J,2017-02-12 10:27:05,0,0,0,0,0,0,0,0,0
1237168256301866_1435137576504932,"The New York Times, in its effort to cover southern segregation ran afoul of Alabama officials bent on silencing them.",Segregationists Once Used Libel Laws Against The Mainstream Media Too | Refined Right,link,https://rrght.io/2jv6zZ1,2017-01-30 12:37:11,0,0,0,0,0,0,0,0,0
1237168256301866_1435044306514259,"Should public officials have the power to silence the press? Should individuals in general be given easier access to punish publications for writing they cannot prove has maligned them?

If segregationists had gotten their way, they would've silenced publications for covering the reality of southern segregation. https://rrght.io/2jmtjPY",Segregationists Once Used Libel Laws Against The Mainstream Media Too | Refined Right,link,https://refinedright.com/2017/01/30/the-new-york-times-and-segregationist-libel-suits/,2017-01-30 10:27:04,0,0,0,0,0,0,0,0,0
1237168256301866_1428875637131126,The first person to refuse to give up her seat on a segregated bus was a 15 year-old named Claudette Colvin...,Youth In Action | Refined Right,link,https://rrght.io/2kppzgx,2017-01-24 18:06:08,0,0,0,0,0,0,0,0,0
1237168256301866_1427453537273336,"""Burke remarks that because the English view their rights as inherited from their forefathers, they treat those rights with a familial care and vigilance. He provides a moving description of how this conception of rights is abundantly beneficial...""",Towards a Burkean Conception of Rights | Refined Right,link,https://rrght.io/2jKk09a,2017-01-23 15:46:06,3,0,0,3,0,0,0,0,0
1237168256301866_1420258174659539,"Without informative & constructive coverage of the Alt-Right, we risk republicans getting drug into the movement",A Strategy For Covering The Alt-Right | Refined Right,link,https://rrght.io/2jpT2X3,2017-01-16 18:06:04,0,0,0,0,0,0,0,0,0
1237168256301866_1419961094689247,"The FBI, under Hoover, was no friend of #MLK.",Timeline Photos,photo,https://www.facebook.com/refinedright/photos/a.1246091752076183.1073741828.1237168256301866/1419961094689247/?type=3,2017-01-16 11:50:08,0,0,0,0,0,0,0,0,0
1237168256301866_1419948091357214,John F. Kennedy on preaching freedom domestically and nationally...,Timeline Photos,photo,https://www.facebook.com/refinedright/photos/a.1246091752076183.1073741828.1237168256301866/1419948091357214/?type=3,2017-01-16 11:30:35,0,0,0,0,0,0,0,0,0
1237168256301866_1419939364691420,The House Un-American Activities Committee married the Red Scare with anti-desegregation efforts.,Timeline Photos,photo,https://www.facebook.com/refinedright/photos/a.1246091752076183.1073741828.1237168256301866/1419939364691420/?type=3,2017-01-16 11:15:05,0,0,0,0,0,0,0,0,0
1237168256301866_1419925618026128,"""J. Edgar Hoover, made no secret of his desire to see King discredited""",What an Uncensored Letter to M.L.K. Reveals,link,https://rrght.io/2jjjfGH,2017-01-16 10:55:14,0,0,0,0,0,0,0,0,0
1237168256301866_1419908231361200,The founder of the White Citizen's Council on the delusional fear of segregationists #MLKDay,Timeline Photos,photo,https://www.facebook.com/refinedright/photos/a.1246091752076183.1073741828.1237168256301866/1419908231361200/?type=3,2017-01-16 10:34:53,0,0,0,0,0,0,0,0,0
1237168256301866_1419891614696195,A smile hurts the most... #MLKDay,Timeline Photos,photo,https://www.facebook.com/refinedright/photos/a.1246091752076183.1073741828.1237168256301866/1419891614696195/?type=3,2017-01-16 10:15:01,0,0,0,0,0,0,0,0,0
1237168256301866_1419873118031378,Investigations like the one into MLK were a part of the melding of Red Scare and segregationist efforts.,The FBI and Martin Luther King,link,https://rrght.io/2ioF9bN,2017-01-16 09:50:02,0,0,0,0,0,0,0,0,0
1237168256301866_1419858024699554,The FBI wiretapping of MLK was part of a larger investigation into flimsy allegations that Civil Rights activists were harboring communist ties.,,status,,2017-01-16 09:30:04,0,0,0,0,0,0,0,0,0
1237168256301866_1419842978034392,"On Oct. 10, 1963, U.S. Attorney General Robert F. Kennedy authorized the FBI to wiretap MLK. #MLKDay",,status,,2017-01-16 09:15:00,0,0,0,0,0,0,0,0,0
1237168256301866_1419829728035717,"""I think it's going to take a hundred big funerals"" #MLKDay",Timeline Photos,photo,https://www.facebook.com/refinedright/photos/a.1246091752076183.1073741828.1237168256301866/1419829728035717/?type=3,2017-01-16 09:00:38,0,0,0,0,0,0,0,0,0
1237168256301866_1419809178037772,George Wallace in his inauguration speech for Alabama governor. #MLKDay,Timeline Photos,photo,https://www.facebook.com/refinedright/photos/a.1246091752076183.1073741828.1237168256301866/1419809178037772/?type=3,2017-01-16 08:30:33,0,0,0,0,0,0,0,0,0
1237168256301866_1419798281372195,"Today, in honor of #MLKDay, we'll be sharing quotes from the villains and heroes of the Civil Rights movement.",,status,,2017-01-16 08:15:13,0,0,0,0,0,0,0,0,0
1237168256301866_1419789084706448,"Martin Luther King Jr. was killed on April 4, 1968, in Memphis, Tennessee. He would've been 88 years old.",Timeline Photos,photo,https://www.facebook.com/refinedright/photos/a.1246091752076183.1073741828.1237168256301866/1419789084706448/?type=3,2017-01-16 08:00:28,0,0,0,0,0,0,0,0,0
1237168256301866_1410581978960492,The transition from student athletics to campaigns is easy – which explains why many become politically engaged.,"Today the Team Roster, Tomorrow the Ballot | Refined Right",link,https://rrght.io/2jciw6n,2017-01-06 12:36:57,0,0,0,0,0,0,0,0,0
1237168256301866_1406842966001060,"Yes, we did our own take of the MTV ""resolutions for white guys"" ad.",MTV's Trump/Pence 2020 Campaign Ad | Refined Right,link,https://rrght.io/2iBrzRJ,2017-01-02 15:46:02,5,0,1,4,1,0,0,0,0
1237168256301866_1381120751906615,"The most important presidential campaign in recent history is one you might not think of, writes Eric Lendrum:",The Most Important Presidential Campaign of the 21st Century | Refined Right,link,https://rrght.io/2hNwaw2,2016-12-14 12:37:04,1,0,0,1,0,0,0,0,0
1237168256301866_1380990791919611,"With an upcoming 24-hour lineup of original programming, RSBN TV plans to take on mainstream television head on.",How Right Side Broadcasting Plans to Take On the Media | Refined Right,link,https://rrght.io/2hwqhVe,2016-12-14 10:27:04,0,0,0,0,0,0,0,0,0
1237168256301866_1378417798843577,The story of Abu Sin and Christina Crockett reflects deep-rooted fundamentalist ideology in Saudi Arabia.,The Tale of Abu Sin and Saudi Oppression | Refined Right,link,https://rrght.io/2hpobWZ,2016-12-12 15:46:06,2,0,0,2,0,0,0,0,0
1237168256301866_1378260928859264,"The US reconstruction efforts in Afghanistan tell a story of waste and cost overruns, writes Michael D McGrady Jr:",Uncle Sam: A Fool And His Money | Refined Right,link,https://rrght.io/2hEUvnQ,2016-12-12 12:37:06,1,0,1,1,0,0,0,0,0
1237168256301866_1378143895537634,"Implementing a draft for women and treating them the same as men does everyone a disservice, writes Sarah Scherer ❄️:",Equal at Their Own Detriment: Why Drafting Women is Dangerous | Refined Right,link,https://rrght.io/2hpdDXZ,2016-12-12 10:27:08,2,0,0,2,0,0,0,0,0
1237168256301866_1372000476151976,"With Trump's election, conservatives need to come together on common issues, writes Alex Haney.",On Conservative Infighting | Refined Right,link,https://rrght.io/2h4fGQs,2016-12-07 18:06:03,1,0,0,1,0,0,0,0,0
1237168256301866_1365320603486630,"""Just telling the facts are no longer enough,"" Milo said in a recent Channel 4 News interview, ""You now have to be persuasive, charismatic, and interesting, and funny. Just telling people things isn't enough anymore.""","Milo Says He Doesn't Care About Your Feelings, But His Recent Interview Says Otherwise | Refined Right",link,https://rrght.io/2fWpgmU,2016-12-03 10:27:04,2,2,0,2,0,0,0,0,0
1237168256301866_1360044354014255,"Few Americans know what's happening over in Yemen, much less that the US is involved there.","The War in Yemen: Worse Than Syria, Backed by the US | Refined Right",link,https://rrght.io/2fKbpDa,2016-11-29 10:27:08,0,0,0,0,0,0,0,0,0
1237168256301866_1359923094026381,The US's proxy war in Yemen is a point in a long line of missions with nations with less than stellar records.,"The War in Yemen: Worse Than Syria, Backed by the US | Refined Right",link,https://rrght.io/2gpZtox,2016-11-29 08:41:05,1,0,1,1,0,0,0,0,0
1237168256301866_1354668474551843,'Member when Thanksgiving was just about giving thanks? 🍇,Whatever Happened to Giving Thanks? | Refined Right,link,https://rrght.io/2gm5g11,2016-11-24 15:46:04,4,0,0,4,0,0,0,0,0
1237168256301866_1335932616425429,Arguing that evangelicals are wrong for supporting Trump is counterproductive and only reinforces existing biases.,VIDEO: Slamming Evangelicals for Supporting Trump is Shallow and Myopic | Refined Right,link,https://rrght.io/2f7wZ4T,2016-11-06 15:46:11,1,0,1,1,0,0,0,0,0
1237168256301866_1329746207044070,"A great Monday morning read by @JohnPierreMaeli: Debunking the Myth That ""Facts Don't Care About Your Feelings""","Debunking the Myth That ""Facts Don't Care About Your Feelings""",link,https://rrght.io/2eTLqXs,2016-10-31 08:35:52,1,0,0,1,0,0,0,0,0
1237168256301866_1327099520642072,"Dangerous speech is the only speech that matters, Milo said in response to UCI's ""affirmation"" of free speech.","UCI Administration Affirms Free Speech, With Exceptions | Refined Right",link,https://rrght.io/2eNPzw8,2016-10-28 18:20:21,2,0,0,2,0,0,0,0,0
1237168256301866_1327097587308932,"UCI Administration Affirms Free Speech, With Exceptions","UCI Administration Affirms Free Speech, With Exceptions | Refined Right",link,https://rrght.io/2eWiHlI,2016-10-28 18:19:17,0,0,0,0,0,0,0,0,0
1237168256301866_1326717457346945,How Feminism Threatens Our Society,How Feminism Threatens Our Society | Refined Right,link,https://rrght.io/2eXp9Zh,2016-10-28 09:26:43,0,0,0,0,0,0,0,0,0
1237168256301866_1326080147410676,Florida Courthouse Allows Campaign Material Inside Voting Area,Florida Courthouse Allows Campaign Material Inside Voting Area | Refined Right,link,https://rrght.io/2eAGGbA,2016-10-27 16:39:59,1,0,0,0,0,1,0,0,0
1237168256301866_1325690390782985,From the archive: How the Classics Made Me a Conservative,How the Classics Made Me a Conservative | Refined Right,link,https://rrght.io/2e0mZt6,2016-10-27 08:47:24,1,0,0,1,0,0,0,0,0
1237168256301866_1324716930880331,"America has the highest incarceration rate and a majority of the world's prison population, writes John-Pierre Maeli",Modern Day Slavery In America's Prisons | Refined Right,link,https://rrght.io/2eQUN9J,2016-10-26 09:27:01,2,0,1,1,0,0,0,0,1
