status_id,status_message,link_name,status_type,status_link,status_published,num_reactions,num_comments,num_shares,num_likes,num_loves,num_wows,num_hahas,num_sads,num_angrys
1237168256301866_1277762922242399,NEWS: The context behind Georgetown's recent announcement offers a look at mistakes of the past.,Refined Right | Context Behind Georgetown's Reparations Policy Tells a Different Story,link,https://refinedright.com/2016/09/05/context-behind-georgetowns-reparations-policy-tells-a-different-story/,2016-09-05 15:20:01,0,0,0,0,0,0,0,0,0
1237168256301866_1277760385575986,HISTORY: A look back at the dark roots of hero worship and the man who made it great,Refined Right | Great Men Shape the Future of Fascism,link,https://refinedright.com/feature/great-men-shape-the-future-of-fascism/,2016-09-05 14:00:01,0,0,0,0,0,0,0,0,0
1237168256301866_1277757138909644,"IN CONTEXT: An overview of political activism throughout American history, from 1620 to today:",Refined Right | An Overview of American Political Activism,link,https://refinedright.com/feature/an-overview-of-american-political-activism/,2016-09-05 13:00:00,0,0,0,0,0,0,0,0,0
1237168256301866_1277756208909737,ACTIVISM: A look at why movements within college campuses matter,Refined Right | Why Campus Activism Matters,link,https://refinedright.com/feature/why-campus-activism-matters/,2016-09-05 11:30:00,0,0,0,0,0,0,0,0,0
1237168256301866_1277768302241861,"COMMENTARY: Thoughts on the classic broken window fallacy of economics, with the story of a literal broken window.",Refined Right | That Which is Unseen: Thoughts on the Broken Window Fallacy,link,https://refinedright.com/commentary/that-which-is-unseen-thoughts-on-the-broken-window-fallacy/,2016-09-05 10:17:32,0,0,0,0,0,0,0,0,0
1237168256301866_1277767125575312,"REVIEW: Haleigh Shackleton convinces us all to watch ""Kubo and the Two Strings""","Refined Right | Review: ""Kubo and the Two Strings"" Brings Warmth to Darkness",link,https://refinedright.com/2016/09/05/review-kubo-and-the-two-strings-brings-warmth-to-darkness/,2016-09-05 10:15:10,0,0,0,0,0,0,0,0,0
1237168256301866_1277753555576669,"FEATURE: A guide to campus activism done right, by Robert Petrosyan",Refined Right | A Guide To Campus Activism Done Right,link,https://refinedright.com/feature/a-guide-to-campus-activism-done-right/,2016-09-05 10:01:48,0,0,0,0,0,0,0,0,0
1237168256301866_1274943982524293,COMMENTARY: Georgetown's Reparations Policy Helps Promote Inequality and Discrimination by Ariana Rowlands,Refined Right | Georgetown's Reparations Policy Helps Promote Inequality and Discrimination,link,https://refinedright.com/commentary/georgetowns-reparations-policy-helps-promote-inequality-and-discrimination/,2016-09-02 14:36:16,0,0,0,0,0,0,0,0,0
1237168256301866_1274277359257622,"COMMENTARY: Colin Kaepernick Reminds Us It's Always a Good Time To Talk About ""Kafkatrapping""","Refined Right | Colin Kaepernick Reminds Us It's Always a Good Time To Talk About ""Kafkatrapping""",link,https://refinedright.com/commentary/colin-kaepernick-reminds-us-its-always-a-good-time-to-talk-about-kafkatrapping/,2016-09-02 06:12:01,0,0,0,0,0,0,0,0,0
1237168256301866_1271710999514258,NEWS: Liberty University's conceal carry policy goes into effect this semester,Refined Right | New Liberty Campus Carry Policy Go Into Effect This Semester,link,https://refinedright.com/2016/08/30/new-liberty-campus-carry-policy-go-into-effect-this-semester/,2016-08-30 12:32:41,0,0,0,0,0,0,0,0,0
1237168256301866_1270761809609177,READ: Robert Petrosyan explores the counterproductive nature of Black Lives Matter.,Refined Right | The Counterproductive Nature of Black Lives Matter,link,https://refinedright.com/feature/the-counterproductive-nature-of-black-lives-matter/,2016-08-30 09:00:01,0,0,0,0,0,0,0,0,0
1237168256301866_1270761149609243,"REVIEW: ""Imperium"" offers a critical look at homegrown terrorism and neo-nazism.","Refined Right | Review: ""Imperium"" Explores How Close Hatred Can Be",link,https://refinedright.com/2016/08/29/review-imperium-explores-how-close-hatred-can-be/,2016-08-29 14:02:00,1,0,0,1,0,0,0,0,0
1237168256301866_1264384183580273,"""I am a journalist because I want to help restore truth and integrity into a distrusted field.""",Refined Right | Truth in Journalism Starts With Integrity,link,https://refinedright.com/commentary/truth-in-journalism-starts-with-integrity/,2016-08-23 11:00:00,2,0,0,2,0,0,0,0,0
1237168256301866_1264382626913762,"COMMENTARY: Conservative beliefs should be rooted in the classics, argues Troy Worden.",Refined Right | How the Classics Made Me a Conservative,link,https://refinedright.com/commentary/how-the-classics-made-me-a-conservative/,2016-08-23 08:00:01,1,0,0,1,0,0,0,0,0
1237168256301866_1264380786913946,"NEWS: Wolf Trap Park in Vienna, Va should lose federal funding, argue many. Autumn Price investigates.",Refined Right | Funding for Wolf Trap Called Into Question,link,https://refinedright.com/2016/08/22/funding-for-wolf-trap-called-into-question/,2016-08-23 05:30:00,2,0,0,2,0,0,0,0,0
1237168256301866_1264379633580728,READ: How FFL captured the hearts of young conservatives.,Refined Right | How FFL Captured the Hearts of Young Conservatives,link,https://refinedright.com/2016/08/22/how-ffl-captured-the-hearts-of-young-conservatives/,2016-08-22 18:00:00,3,0,0,3,0,0,0,0,0
1237168256301866_1264378563580835,"READ: ""We are a nation of immigrants!"" Cooper McCall looks at the historical context of American immigration.",Refined Right | Why America is More Than a Nation of Immigrants,link,https://refinedright.com/feature/why-america-is-more-than-a-nation-of-immigrants/,2016-08-22 16:00:00,3,0,0,2,1,0,0,0,0
1237168256301866_1264377540247604,"CENSORSHIP: When Reddit was pressured to change its freedom of expression stance, it caved.",Refined Right | How Reddit Caved to Cries for Censorship,link,https://refinedright.com/feature/how-reddit-caved-to-cries-for-censorship/,2016-08-22 13:00:00,4,0,0,4,0,0,0,0,0
1237168256301866_1264376723581019,"FEATURE: The VA pledges a commitment to excellence, but is this really the case?",Refined Right | Why The VA Needs Change: A Personal Experience,link,https://refinedright.com/feature/why-the-va-needs-change-a-personal-experience/,2016-08-22 10:00:01,4,0,0,4,0,0,0,0,0
1237168256301866_1264398833578808,Issue 2 is HERE! https://refinedright.com,"Refined Right | Style, opinion, and quality long-form journalism for the discerning conservative.",link,https://refinedright.com/,2016-08-22 08:06:47,5,0,1,5,0,0,0,0,0
1237168256301866_1264376120247746,"READ: When a Purdue student was summoned to the dean's office, was expulsion threatened?",Refined Right | The Boy Who Cried Expulsion,link,https://refinedright.com/feature/the-boy-who-cried-expulsion/,2016-08-22 07:44:46,3,0,6,3,0,0,0,0,0
1237168256301866_1264375896914435,"COMMENTARY: Integrity in journalism is an important trait missing today, argues Ariana Rowlands",Refined Right | Truth in Journalism Starts With Integrity,link,https://refinedright.com/commentary/truth-in-journalism-starts-with-integrity/,2016-08-22 07:44:11,3,0,0,3,0,0,0,0,0
1237168256301866_1264374886914536,FEATURE: The internet was intended to be open and free. Has Twitter lost sight of this?,Refined Right | Banning Milo Was Hardly Act One,link,https://refinedright.com/feature/banning-milo-was-hardly-act-one/,2016-08-22 07:42:44,2,0,0,2,0,0,0,0,0
1237168256301866_1261208987231126,THESE GUYS AGAIN?: UC Irvine Sanctions Students for Justice in Palestine (SJP) After May Protest,Refined Right | UC Irvine Sanctions SJP After May Protest,link,https://refinedright.com/2016/08/18/uc-irvine-sanctions-sjp-after-may-protest/,2016-08-18 19:39:29,4,0,3,4,0,0,0,0,0
1237168256301866_1260894373929254,"NEWS: After controversy surrounding restrooms, and facing pressure from online retailers, Target's stock drops.",Refined Right | Target Sales Drop Following Controversy,link,https://refinedright.com/2016/08/18/target-sales-drop-following-controversy/,2016-08-18 10:07:05,0,0,3,0,0,0,0,0,0
1237168256301866_1259471664071525,NEWS: Pro-Palestinian Activist Group Collects Data on Jewish Students,Refined Right | Pro-Palestinian Activist Group Collects Data on Jewish Students,link,https://refinedright.com/2016/08/16/pro-palestinian-activist-group-collects-data-on-jewish-students/,2016-08-16 17:52:31,7,0,3,5,0,2,0,0,0
1237168256301866_1258590907492934,"We love some of the articles we have coming in Issue 2 (next Monday).

They're huge.
Amazing.
The very best.

No, we're not being sarcastic.",,status,,2016-08-16 16:19:00,2,0,0,2,0,0,0,0,0
1237168256301866_1258591117492913,FEATURE: American schools are failing their brightest students. What can we do to fix this?,Refined Right | How the American Public Education System Fails to Foster Genius,link,https://refinedright.com/feature/how-the-american-public-education-system-fails-to-foster-genius/,2016-08-15 16:12:40,2,0,2,2,0,0,0,0,0
1237168256301866_1256310571054301,"ELECTION 2016: With his name on the Colorado ballot, does Evan McMullin have a chance?",Refined Right | McMullin Overcomes Ballot Hurdles as First Step to Election,link,https://refinedright.com/2016/08/12/mcmullin-overcomes-ballot-hurdles-as-first-step-to-election/,2016-08-13 11:30:00,0,1,0,0,0,0,0,0,0
1237168256301866_1256308667721158,"NEWS: Milo to Return to UC Irvine, Receives Protest Threats","Refined Right | Milo to Return to UC Irvine, Receives Protest Threats",link,https://refinedright.com/2016/08/11/milo-to-return-to-uc-irvine-receives-protest-threats/,2016-08-13 07:00:00,3,1,0,3,0,0,0,0,0
1237168256301866_1256308944387797,NEWS: Louisiana Moves to Ban David Duke From Running,Refined Right | Louisiana Moves to Ban David Duke from Running,link,https://refinedright.com/2016/08/12/louisiana-moves-to-ban-david-duke-from-running/,2016-08-12 18:16:20,1,1,1,0,0,0,0,0,1
1237168256301866_1254373977914627,Lets forget about the election for an evening https://youtu.be/Wvt_K4LW29c,Corgi Puppies,video,https://youtu.be/Wvt_K4LW29c,2016-08-10 18:42:00,0,0,0,0,0,0,0,0,0
1237168256301866_1254375781247780,Make your twitter feed classy with Refine Right :https://twitter.com/refinedright,Refined Right (@refinedright) | Twitter,link,https://twitter.com/refinedright,2016-08-10 09:05:01,1,0,0,1,0,0,0,0,0
1237168256301866_1254372491248109,,Refined Right,link,https://refinedright.com/2016/08/08/university-of-houston-student-sanctioned-for-alllivesmatter-post/,2016-08-10 06:29:24,1,0,0,1,0,0,0,0,0
1237168256301866_1253955957956429,ICYMI: Learn how Ohio State University's president fought back against social justice:,Refined Right | How Ohio State University Fought Back Against Social Justice,link,https://refinedright.com/feature/how-ohio-state-university-fought-back-against-social-justice/,2016-08-09 18:34:01,1,0,0,1,0,0,0,0,0
1237168256301866_1253955611289797,"A fantastic article from our friends at OUTSET on ""playground conservatism.""",Thomas Conerty: Playground Conservatism,link,http://outsetmagazine.com/2016/08/09/playground-conservatism/,2016-08-09 16:47:27,0,0,0,0,0,0,0,0,0
1237168256301866_1253095764709115,Lara is ready for a nap after helping get the site off the ground. Thank you everyone!,Timeline Photos,photo,https://www.facebook.com/refinedright/photos/a.1246091752076183.1073741828.1237168256301866/1253095764709115/?type=3,2016-08-08 17:41:00,4,0,0,4,0,0,0,0,0
1237168256301866_1253094664709225,Sweden: a laboratory of multiculturalism.,Refined Right | Sweden's Laboratory of Multiculturalism,link,https://refinedright.com/2016/08/08/swedens-laboratory-of-multiculturalism/,2016-08-08 16:39:00,2,0,3,2,0,0,0,0,0
1237168256301866_1253094181375940,The DNC leaks exposed numerous vulnerabilities in political cybersecurity – and more leaks could be soon coming.,Refined Right | DNC Email Leaks Offer Dangerous Look at Political Cybersecurity,link,https://refinedright.com/2016/08/08/dnc-email-leaks-offer-dangerous-look-at-political-cybersecurity/,2016-08-08 15:38:00,1,0,0,1,0,0,0,0,0
1237168256301866_1253091554709536,"UC Irvine's been in the news a lot lately. Now, they're in it again, and Ariana Rowlands is again to blame.","Refined Right | UC Irvine Fines College Republicans, Halts Rally",link,https://refinedright.com/2016/08/08/uc-irvine-fines-college-republicans-orders-rally-off-campus/,2016-08-08 14:36:01,3,0,0,3,0,0,0,0,0
1237168256301866_1253090398042985,"When people felt that Twitter's censorship had gone too far, they took to the streets – literally.",Refined Right | 'The Chalkening' Returns to Protest Twitter,link,https://refinedright.com/2016/08/08/the-chalkening-returns-to-protest-twitter/,2016-08-08 13:27:00,1,0,0,1,0,0,0,0,0
1237168256301866_1253073061378052,NEWS: University of Houston tried to sanction a student over a social media post. https://refinedright.com/2016/08/08/university-of-houston-student-sanctioned-for-alllivesmatter-post/,"Refined Right | University of Houston Student Sanctioned for ""#AllLivesMatter"" Post",link,https://refinedright.com/2016/08/08/university-of-houston-student-sanctioned-for-alllivesmatter-post/,2016-08-08 12:00:00,2,1,2,2,0,0,0,0,0
1237168256301866_1253096194709072,"So many emails to go through. If you've applied (and you still can!) we'll get back to you at some point soon, we promise!",,status,,2016-08-08 11:31:09,1,0,0,1,0,0,0,0,0
1237168256301866_1253084448043580,COMMENTARY: The Abandonment of Critical Thinking in the Modern Era,Refined Right | The Abandonment of Critical Thinking in the Modern Era,link,https://refinedright.com/commentary/the-abandonment-of-critical-thinking-in-the-modern-era/,2016-08-08 11:16:31,2,0,0,2,0,0,0,0,0
1237168256301866_1253083994710292,Join Robert Petrosyan and Abby Brookshire in an incredible world of urban exploration!,Refined Right | Urban Exploration: A Peek at Abandoned History Stuck in Time,link,https://refinedright.com/feature/urban-exploration-a-peek-at-abandoned-history-stuck-in-time/,2016-08-08 11:15:31,2,1,1,2,0,0,0,0,0
1237168256301866_1253083594710332,"BOOKS: Learn how ""The Old Man and the Sea"" is relevant even to this year's election.","Refined Right | ""The Old Man and the Sea"" for Refined Conservatives",link,https://refinedright.com/feature/the-old-man-and-the-sea-for-refined-conservatives/,2016-08-08 11:14:45,1,0,2,1,0,0,0,0,0
1237168256301866_1253072504711441,MORE COMMENTARY: A defense of one our favorite things. (hint: starts with a C) https://refinedright.com/commentary/in-defense-of-capitalism/,Refined Right | In Defense of Capitalism,link,https://refinedright.com/commentary/in-defense-of-capitalism/,2016-08-08 10:54:50,1,0,0,1,0,0,0,0,0
1237168256301866_1253063738045651,READ: How Ohio State University's president stood up against social justice crybabies. https://refinedright.com/feature/how-ohio-state-university-fought-back-against-social-justice/,Refined Right | How Ohio State University Fought Back Against Social Justice,link,https://refinedright.com/feature/how-ohio-state-university-fought-back-against-social-justice/,2016-08-08 10:47:17,1,0,0,1,0,0,0,0,0
1237168256301866_1253062598045765,"READ: We talked with the amazing Justice Don Willett about law, family, social media, and more! https://refinedright.com/feature/justice-don-willett-in-his-own-words/",Refined Right | Justice Don Willett: In His Own Words,link,https://refinedright.com/feature/justice-don-willett-in-his-own-words/,2016-08-08 10:44:25,1,0,0,1,0,0,0,0,0
1237168256301866_1253062081379150,"FEATURE: The Left misunderstood American ethos, but did the religious right do so as well? https://refinedright.com/feature/how-both-the-marxist-left-and-the-religious-right-fundamentally-misunderstand-american-ethos/",Refined Right | How Both the Marxist Left and the Religious Right Fundamentally Misunderstand American Ethos,link,https://refinedright.com/feature/how-both-the-marxist-left-and-the-religious-right-fundamentally-misunderstand-american-ethos/,2016-08-08 10:43:30,1,0,0,1,0,0,0,0,0
1237168256301866_1252670131418345,waiting,Timeline Photos,photo,https://www.facebook.com/refinedright/photos/a.1246091752076183.1073741828.1237168256301866/1252670131418345/?type=3,2016-08-07 21:30:28,3,0,4,3,0,0,0,0,0
1237168256301866_1249038195114872,"But guys, it's 2016!",Campus Reform,link,http://giphy.com/gifs/J4Eg2D3TBPiM/html5,2016-08-02 18:58:32,1,0,0,0,0,0,1,0,0
1237168256301866_1248960378455987,"The Two Minutes It Takes To Read This Will Improve Your Writing Forever, by @jspector (and we agree!)",The Two Minutes It Takes To Read This Will Improve Your Writing Forever — An Idea For You,link,https://medium.com/an-idea-for-you/the-two-minutes-it-takes-to-read-this-will-improve-your-writing-forever-82a7d01441d1#.x6r6v72do,2016-08-02 18:00:00,0,0,0,0,0,0,0,0,0
1237168256301866_1248959618456063,"Do you follow us on twitter? if not, you should https://twitter.com/refinedright",Refined Right (@refinedright) | Twitter,link,https://twitter.com/refinedright,2016-08-02 15:43:43,1,0,2,1,0,0,0,0,0
1237168256301866_1248200981865260,"The ultimate road trip across America. Might be a bit late this summer, but who cares?",Scientists have figured out the ultimate United States road trip. Here it is,link,https://trekthehorizon.com/2016/07/06/scientists-have-figured-out-the-ultimate-united-states-road-trip-here-it-is/,2016-08-01 15:56:14,0,0,7,0,0,0,0,0,0
1237168256301866_1248200148532010,We've just sent out our first email sneak peek to our subscribers! Haven't signed up yet? It's not too late! https://refinedright.com,Refined Right,link,http://refinedright.com/,2016-08-01 13:55:19,1,0,3,1,0,0,0,0,0
1237168256301866_1246091592076199,,Timeline Photos,photo,https://www.facebook.com/refinedright/photos/a.1246091752076183.1073741828.1237168256301866/1246091592076199/?type=3,2016-07-29 12:29:05,0,0,0,0,0,0,0,0,0
1237168256301866_1240509765967715,https://medium.com/@IamQueenAri/statement-by-ariana-rowlands-president-of-college-republicans-at-uc-irvine-on-the-suspension-of-11dbf9033947#.c5j2uq8hu,"Statement by Ariana Rowlands, President of College Republicans at UC Irvine, on the Suspension of…",link,https://medium.com/@IamQueenAri/statement-by-ariana-rowlands-president-of-college-republicans-at-uc-irvine-on-the-suspension-of-11dbf9033947#.c5j2uq8hu,2016-07-20 22:25:01,2,1,1,2,0,0,0,0,0
1237168256301866_1237516229600402,,Refined Right's cover photo,photo,https://www.facebook.com/refinedright/photos/a.1237516276267064.1073741827.1237168256301866/1237516229600402/?type=3,2016-07-16 11:47:46,1,0,0,1,0,0,0,0,0
1237168256301866_1237169286301763,,Refined Right,photo,https://www.facebook.com/refinedright/photos/a.1237169276301764.1073741825.1237168256301866/1237169286301763/?type=3,2016-07-15 23:32:19,3,0,0,3,0,0,0,0,0
