status_id,status_message,link_name,status_type,status_link,status_published,num_reactions,num_comments,num_shares,num_likes,num_loves,num_wows,num_hahas,num_sads,num_angrys
1237168256301866_1322764307742260,"Dedicated to apolitical accountability, Wikileaks transformed into an opaque conspiracy its founder once opposed.",The Wikileaks Endgame | Refined Right,link,https://rrght.io/2exRdpX,2016-10-24 09:27:04,0,0,0,0,0,0,0,0,0
1237168256301866_1319805238038167,"If you've been having trouble getting on Twitter, Reddit, Spotify, or many other websites, this is why:",Attacks on DNS Infrastructure Show the Fragility of the Internet | Refined Right,link,https://rrght.io/2etIMbE,2016-10-21 13:29:50,1,0,0,1,0,0,0,0,0
1237168256301866_1318841734801184,"A California 8th grade English class studied ""privilege and oppression"" to satisfy a Common Core requirement.",California Middle School Holds Class On Privilege and Oppression | Refined Right,link,https://rrght.io/2eyqENb,2016-10-20 15:01:11,2,0,0,1,0,0,0,0,1
1237168256301866_1318811171470907,"According to a bill passed by the UC Irvine student senate, the school could give preference to Syrian refugees.",UCI Student Senate Passes Resolution to Give Preference to Syrian Refugees | Refined Right,link,https://rrght.io/2eyiswI,2016-10-20 14:09:37,4,1,0,3,0,0,0,0,1
1237168256301866_1317253914959966,"(UPDATE) Liberty issued a statement in response to the censorship allegations, included at the end of the article:",Liberty Student Accuses President of Censorship | Refined Right,link,https://rrght.io/2eDpGTV,2016-10-18 21:38:14,1,0,0,1,0,0,0,0,0
1237168256301866_1317218561630168,"When a student's column about Trump was cut from Liberty's student newspaper, he ran to the media crying censorship.",Liberty Student Accuses President of Censorship | Refined Right,link,https://rrght.io/2ej3CJV,2016-10-18 20:50:35,1,0,0,1,0,0,0,0,0
1237168256301866_1315757195109638,What do Deus Ex and the trolley problem share in common? Jacob Santillan compares the moral dilemmas of gaming. https://rrght.io/2dZ0B3z,Timeline Photos,photo,https://www.facebook.com/refinedright/photos/a.1246091752076183.1073741828.1237168256301866/1315757195109638/?type=3,2016-10-17 11:37:05,0,0,0,0,0,0,0,0,0
1237168256301866_1315643421787682,Ever wonder why people don't trust online fact-checkers? This video explains why:,VIDEO: Why You Can't Trust Fact-Checkers | Refined Right,link,https://rrght.io/2dmpm5K,2016-10-17 09:27:10,2,0,5,1,1,0,0,0,0
1237168256301866_1313824195302938,"We rounded up the best of Twitter this past week. It was a strange week, to put it lightly.","This Week on Twitter: Trump's Mic, Accusations Galore, and the Red Sweater | Refined Right",link,https://rrght.io/2drfv1R,2016-10-15 11:37:04,0,0,0,0,0,0,0,0,0
1237168256301866_1313725695312788,"A WSU student senator has called for the suspension of College Republicans, writes Ariana Rowlands♛",WSU Student Senator Calls for Suspension of College Republicans | Refined Right,link,https://rrght.io/2dVwZqp,2016-10-15 09:27:01,3,0,0,3,0,0,0,0,0
1237168256301866_1311996718819019,"""We deserve more from our politicians. We should demand more. Those we designate to represent us should actually represent us. Instead, we have collectively accepted that we are doomed to choose between the lesser of two evils each election."" https://rrght.io/2d9DioG",Timeline Photos,photo,https://www.facebook.com/refinedright/photos/a.1246091752076183.1073741828.1237168256301866/1311996718819019/?type=3,2016-10-13 17:06:02,0,0,0,0,0,0,0,0,0
1237168256301866_1311873432164681,"""The right actions of today will likely not be the right actions of tomorrow. Actions borne of principle will at least stand strong in the face of scrutiny. Demanding excellence from our politicians is true patriotism."" - J. Alexander Haney https://rrght.io/2ekj78w",Timeline Photos,photo,https://www.facebook.com/refinedright/photos/a.1246091752076183.1073741828.1237168256301866/1311873432164681/?type=3,2016-10-13 14:46:11,0,0,0,0,0,0,0,0,0
1237168256301866_1311719515513406,"""Things must change. We have to demand that those who represent us be better."" Alex Haney","This Election, Let Us Demand More | Refined Right",link,https://rrght.io/2ekgRy0,2016-10-13 11:37:03,0,0,0,0,0,0,0,0,0
1237168256301866_1311620725523285,"There was much more to Nixon's presidency than Watergate, writes Eric Lendrum:",A Critical Re-Evaluation of Richard Nixon | Refined Right,link,https://rrght.io/2dmSiOv,2016-10-13 09:28:33,3,0,0,3,0,0,0,0,0
1237168256301866_1311047835580574,"Before you catch up on the latest South Park, be sure to read Alex Haney's take on the show's satirical value.","Refined Right | Eat the Babies: South Park, Satire, and the 2016 Election",link,https://rrght.io/2dSlJaK,2016-10-12 19:55:07,0,0,0,0,0,0,0,0,0
1237168256301866_1310875518931139,"In light of the controversy this week over sexual assault, it's important to remember that not all cases receive the proper form of justice.",Refined Right | College Rape Tribunals: An Embarrassment to Justice,link,https://rrght.io/2d7S2UV,2016-10-12 14:46:06,0,0,0,0,0,0,0,0,0
1237168256301866_1310744435610914,"""Apparently common courtesy is a crime if someone can find a way to be offended by it."" Cooper McCall",Refined Right | An Ode to Free Speech,link,https://rrght.io/2dM9uQe,2016-10-12 11:37:04,2,0,4,2,0,0,0,0,0
1237168256301866_1310573332294691,"Just as vandals destroyed a 9/11 memorial a month ago, Saddleback YAF found posters repeatedly torn down - on video.",Refined Right | Saddleback YAF Faced With Repeated Vandalism,link,https://rrght.io/2e6SQXv,2016-10-12 07:41:04,1,0,0,1,0,0,0,0,0
1237168256301866_1310118265673531,"""South Park is nothing if not the most flexible and modest of proposals, satirizing every sacred cow known to our collective culture, reminding us that nothing is so serious as to be untouchable.""","Refined Right | Eat the Babies: South Park, Satire, and the 2016 Election",link,https://rrght.io/2e3OhvL,2016-10-11 17:06:10,0,0,0,0,0,0,0,0,0
1237168256301866_1310036999014991,"""Apparently common courtesy is a crime if someone can find a way to be offended by it.""",Refined Right | An Ode to Free Speech,link,https://rrght.io/2d9WqOc,2016-10-11 14:46:03,2,0,4,2,0,0,0,0,0
1237168256301866_1309967349021956,Saddleback YAF Faced With Repeated Vandalism,Refined Right | Saddleback YAF Faced With Repeated Vandalism,link,https://rrght.io/2dJevJs,2016-10-11 12:52:18,1,0,0,1,0,0,0,0,0
1237168256301866_1309886735696684,"""Why are we doing this again? Why are we back to giant douche and turd sandwich?"" https://rrght.io/2dGsDRp",Timeline Photos,photo,https://www.facebook.com/refinedright/photos/a.1246091752076183.1073741828.1237168256301866/1309886735696684/?type=3,2016-10-11 11:37:12,0,0,0,0,0,0,0,0,0
1237168256301866_1309787529039938,"Eat the Babies: South Park, Satire, and the 2016 Election","Refined Right | Eat the Babies: South Park, Satire, and the 2016 Election",link,https://rrght.io/2dYCdwr,2016-10-11 09:32:16,0,0,0,0,0,0,0,0,0
1237168256301866_1309775345707823,An Ode to Free Speech,Refined Right | An Ode to Free Speech,link,https://rrght.io/2dStLQf,2016-10-11 09:11:16,2,0,4,2,0,0,0,0,0
1237168256301866_1308005262551498,"Evangelicals, many of whom endorsed Trump as a strong Christian, are now forced to defend his comments about women.","Refined Right | For Evangelicals, Support for Trump Becomes Difficult",link,https://rrght.io/2dTUrzc,2016-10-09 09:27:06,0,0,0,0,0,0,0,0,0
1237168256301866_1307942589224432,Obama Administration Blames Russia For DNC Hacks,Refined Right | Obama Administration Blames Russia For DNC Hacks,link,https://rrght.io/2d4qlYo,2016-10-09 08:05:24,1,0,4,1,0,0,0,0,0
1237168256301866_1307287242623300,"""The Party of Lincoln is not a locker room."" -Alex Smith",Refined Right | College Republican Chairman Denounces Trump,link,https://rrght.io/2dJ7sMM,2016-10-08 14:46:03,4,1,2,4,0,0,0,0,0
1237168256301866_1299145376770820,"When James Gray died due to medical negligence, a 17-year legal case shed light on inadequate punitive compensation. https://rrght.io/2cYxJVJ",Timeline Photos,photo,https://www.facebook.com/refinedright/photos/a.1246091752076183.1073741828.1237168256301866/1299145376770820/?type=3,2016-09-29 11:37:05,0,0,0,0,0,0,0,0,0
1237168256301866_1299049193447105,The No Veterans Crisis Line Call Should Go Unanswered Act intends to bring reform to an oft-criticzed VA service.,Refined Right | House Passes No Veterans Crisis Line Call Should Go Unanswered Act,link,https://rrght.io/2dGODfN,2016-09-29 09:27:09,1,0,0,1,0,0,0,0,0
1237168256301866_1297627050255986,Today's presentation by Elon Musk is the culmination of everything SpaceX has worked toward thus far. https://rrght.io/2czN4uR,Timeline Photos,photo,https://www.facebook.com/refinedright/photos/a.1246091752076183.1073741828.1237168256301866/1297627050255986/?type=3,2016-09-27 17:13:19,0,0,0,0,0,0,0,0,0
1237168256301866_1297621153589909,The SpaceX Interplanetary Transport System plans to send people to Mars as early as 2024. https://rrght.io/2di8r8G,Timeline Photos,photo,https://www.facebook.com/refinedright/photos/a.1246091752076183.1073741828.1237168256301866/1297621153589909/?type=3,2016-09-27 17:06:01,0,0,0,0,0,0,0,0,0
1237168256301866_1297534366931921,"""Hillary opened up on a strong note, but quickly cut the legs out from under her own high horse.""",Refined Right | Trump vs. Clinton: Round One,link,https://rrght.io/2dp4pN9,2016-09-27 14:46:02,0,0,0,0,0,0,0,0,0
1237168256301866_1297416990276992,"""Trump kept hitting home the message that Clinton is incompetent, but neglected the issue of her trustworthiness.""",Refined Right | The First Debate: Feel vs. Form,link,https://rrght.io/2dwwdeI,2016-09-27 11:37:04,1,0,2,1,0,0,0,0,0
1237168256301866_1296369953715029,The first presidential debate is TONIGHT! Are you ready? https://rrght.io/2d3h6vb,Timeline Photos,photo,https://www.facebook.com/refinedright/photos/a.1246091752076183.1073741828.1237168256301866/1296369953715029/?type=3,2016-09-26 08:03:06,2,0,0,2,0,0,0,0,0
1237168256301866_1293833380635353,Our first presidential debate bingo is here! Play alone or with friends; preferably with a shot glass either way. https://rrght.io/2dfBA1k,Timeline Photos,photo,https://www.facebook.com/refinedright/photos/a.1246091752076183.1073741828.1237168256301866/1293833380635353/?type=3,2016-09-23 11:37:05,2,0,1,2,0,0,0,0,0
1237168256301866_1293627337322624,"ICYMI yesterday: If you have a Yahoo account, change your password. Better yet, delete your account. (It's 2016, who still uses Yahoo?)",Timeline Photos,photo,https://www.facebook.com/refinedright/photos/a.1246091752076183.1073741828.1237168256301866/1293627337322624/?type=3,2016-09-23 07:19:03,0,0,0,0,0,0,0,0,0
1237168256301866_1293146270704064,"A new class-action lawsuit against Bayer over IUDs is gaining traction, writes Alex Haney: https://rrght.io/2dmpCGx",Timeline Photos,photo,https://www.facebook.com/refinedright/photos/a.1246091752076183.1073741828.1237168256301866/1293146270704064/?type=3,2016-09-22 17:06:14,0,0,0,0,0,0,0,0,0
1237168256301866_1293105427374815,"If you have a Yahoo account, and haven't changed the password since 2014, you should change it now.",Refined Right | Yahoo Confirms Hack of 500 Million Accounts,link,https://rrght.io/2dkWEDW,2016-09-22 15:45:31,1,0,0,1,0,0,0,0,0
1237168256301866_1293053770713314,"Oliver Stone's ""Snowden"" is biased and cursory, but sheds new light on the story behind the 2013 leaks: https://rrght.io/2cozoD5",Timeline Photos,photo,https://www.facebook.com/refinedright/photos/a.1246091752076183.1073741828.1237168256301866/1293053770713314/?type=3,2016-09-22 14:46:01,1,0,0,1,0,0,0,0,0
1237168256301866_1292942204057804,"Another questionable Twitter suspension, another reason to be suspicious of Twitter's moderation practices.","Refined Right | Twitter Suspends, Reinstates Account of @Instapundit",link,https://rrght.io/2dcukDz,2016-09-22 11:48:03,1,0,0,1,0,0,0,0,0
1237168256301866_1292935914058433,Did a recent CBS investigation bring resolution to a 1996 murder? https://rrght.io/2cUoszj,Timeline Photos,photo,https://www.facebook.com/refinedright/photos/a.1246091752076183.1073741828.1237168256301866/1292935914058433/?type=3,2016-09-22 11:37:05,1,0,0,1,0,0,0,0,0
1237168256301866_1291978804154144,"""By differing from the 'conventional activism of the recent past' do we mean a romanticized and airbrushed view of the Civil Rights Movement, or do we look at the actual historical facts of the past?"" https://rrght.io/2crt5lD","Refined Right | Is Black Lives Matter Counterproductive, Or Are We Just Confusing the Issue?",link,https://refinedright.com/commentary/is-black-lives-matter-counterproductive-or-are-we-just-confusing-the-issue/,2016-09-21 07:27:10,0,0,0,0,0,0,0,0,0
1237168256301866_1291789264173098,Americans have favorite time periods to look back on fondly. But is this contributing to our polarized political culture? https://rrght.io/2crtq7A,,status,,2016-09-21 00:41:01,1,0,0,1,0,0,0,0,0
1237168256301866_1291704864181538,Does the Right truly understand the issues behind BLM? John-Pierre Maeli says no. https://rrght.io/2crt5lD,,status,,2016-09-20 22:06:01,0,0,0,0,0,0,0,0,0
1237168256301866_1291664694185555,.Troy Worden looks at the comparisons – good and bad – between Milo and Oscar Wilde. https://rrght.io/2crsAIf,Timeline Photos,photo,https://www.facebook.com/refinedright/photos/a.1246091752076183.1073741828.1237168256301866/1291664694185555/?type=3,2016-09-20 20:46:05,1,0,0,1,0,0,0,0,0
1237168256301866_1291544100864281,"Campus rape culture, and its ensuing administrative tribunals, are a complete affront to justice, argues Alex Haney. https://rrght.io/2cEHqL5",Refined Right | College Rape Tribunals: An Embarrassment to Justice,link,https://refinedright.com/feature/college-rape-tribunals-an-embarrassment-to-justice/,2016-09-20 17:37:12,0,0,0,0,0,0,0,0,0
1237168256301866_1288070854544939,When it's #ConstitutionDay2016 and you feel like you're the only one celebrating.,Timeline Photos,photo,https://www.facebook.com/refinedright/photos/a.1246091752076183.1073741828.1237168256301866/1288070854544939/?type=3,2016-09-16 17:37:05,2,0,0,2,0,0,0,0,0
1237168256301866_1288040834547941,Just in time for your new iPhone 7: Refined Right is now available on Apple News! https://rrght.io/2cDb0zw,Timeline Photos,photo,https://www.facebook.com/refinedright/photos/a.1246091752076183.1073741828.1237168256301866/1288040834547941/?type=3,2016-09-16 16:36:40,0,0,0,0,0,0,0,0,0
1237168256301866_1287873561231335,It's #ConstitutionDay2016! Celebrate with our interview with Constitution (and Twitter) expert @JusticeWillett: https://rrght.io/2cweTXQ,Refined Right | Justice Don Willett: In His Own Words,link,https://refinedright.com/feature/justice-don-willett-in-his-own-words/,2016-09-16 12:46:01,0,0,0,0,0,0,0,0,0
1237168256301866_1287848301233861,"""Ours was the first revolution in the history of mankind that truly reversed the course of government, and with three little words: 'We the people.' 'We the people' tell the government what to do, it doesn't tell us. 'We the people' are the driver, the government is the car. And we decide where it should go, and by what route, and how fast. Almost all the world's constitutions are documents in which governments tell the people what their privileges are. Our Constitution is a document in which 'We the people' tell the government what it is allowed to do. 'We the people' are free."" 

–Ronald Reagan",Timeline Photos,photo,https://www.facebook.com/refinedright/photos/a.1246091752076183.1073741828.1237168256301866/1287848301233861/?type=3,2016-09-16 12:04:21,0,0,0,0,0,0,0,0,0
1237168256301866_1287749204577104,"The FBI Didn't Violate Procedure Impersonating Journalist, At the Time.","Refined Right | FBI Didn't Violate Procedure Impersonating Journalist, At the Time",link,https://rrght.io/2ceMEPt,2016-09-16 09:31:36,1,0,0,1,0,0,0,0,0
1237168256301866_1287745677910790,"Review: ""XOXO"" Entertains, But Falls Short","Refined Right | Review: ""XOXO"" Entertains, But Falls Short",link,https://rrght.io/2cC1DjT,2016-09-16 09:25:30,0,0,0,0,0,0,0,0,0
1237168256301866_1286895117995846,Should a jury by peers account for race? Judge Stevens of Kentucky believes so. https://rrght.io/2cLwjlZ,Timeline Photos,photo,https://www.facebook.com/refinedright/photos/a.1246091752076183.1073741828.1237168256301866/1286895117995846/?type=3,2016-09-15 09:49:03,0,0,0,0,0,0,0,0,0
1237168256301866_1286888364663188,Should you wish ill health upon Hillary Clinton if you don't support her?,Refined Right | Christians: Wishing Ill Health Upon Hillary Clinton is Immoral and Unbiblical,link,https://rrght.io/2cLvfPb,2016-09-15 09:37:06,3,0,6,3,0,0,0,0,0
1237168256301866_1285387051479986,"ICYMI yesterday: We interviewed Mike Munzing of Aliso Viejo, CA, the man known as ""America's Coolest Mayor.""",Refined Right | Mayor Mike Munzing: A Chat with America's Coolest Mayor,link,https://rrght.io/2c8AlUU,2016-09-13 13:10:30,0,0,0,0,0,0,0,0,0
1237168256301866_1284673911551300,"""Heck, they're called Barbies for guys."" – Mike Munzing, on the AR-15 https://rrght.io/2claAhm",Timeline Photos,photo,https://www.facebook.com/refinedright/photos/a.1246091752076183.1073741828.1237168256301866/1284673911551300/?type=3,2016-09-12 17:37:02,2,0,0,2,0,0,0,0,0
1237168256301866_1284360118249346,"""Conservatism is the real counterculture, and College Republicans are the real rebels and dissidents on campus.

My goal is to teach you guys to fight the fight and represent the our philosophy on campus while still having fun and keeping our spirits up... It is tragic that American freedom is seen as a negative by many on the campus left."" https://rrght.io/2claRAM",Timeline Photos,photo,https://www.facebook.com/refinedright/photos/a.1246091752076183.1073741828.1237168256301866/1284360118249346/?type=3,2016-09-12 09:50:18,8,0,2,7,1,0,0,0,0
1237168256301866_1284241894927835,ICYMI last night: vandals at Occidental College threw flags from a 9/11 memorial into garbage cans. A group of students came together to save them and put them back as they were. https://rrght.io/2cwF1En,Timeline Photos,photo,https://www.facebook.com/refinedright/photos/a.1246091752076183.1073741828.1237168256301866/1284241894927835/?type=3,2016-09-12 07:01:34,5,0,0,4,0,0,0,0,1
1237168256301866_1284047171613974,"Have you signed up for the Refined Right email newsletter yet? It's the only place to catch the Refined Roundup, our collection of the best content our team has read online in the past week. Plus, we'll keep you up to date with exclusive and behind-the-scenes content! https://rrght.io/2cvPOyU",Refined Right | Newsletter,link,https://refinedright.com/newsletter,2016-09-12 00:41:02,6,0,1,5,1,0,0,0,0
1237168256301866_1283964161622275,"""I thought it was an accident, because I could not fathom anybody invading such an impregnable country."" https://rrght.io/2cgR2JC","Refined Right | Remembering 9/11, Fifteen Years Later",link,https://refinedright.com/feature/remembering-911-fifteen-years-later/,2016-09-11 22:06:00,0,0,0,0,0,0,0,0,0
1237168256301866_1283916238293734,"""'From the moment the first tower fell, there was a clock ticking,' he said. 'It was ticking in my head. It was ticking in the heads of hundreds of millions of people in America and a billion people around the world who were watching it.'""

9/11 was Aaron Brown's first day on the job at CNN. Even though he had years of newscasting experience under his belt, what took place that day was unlike anything he had seen before. ""Good lord,"" he said on air, as the second tower fell. ""There are no words.""","On the 15th anniversary of 9/11, remembering what it was like to anchor as the towers fell",link,http://buff.ly/2cgLHSP,2016-09-11 20:46:01,4,0,0,4,0,0,0,0,0
1237168256301866_1283782284973796,"""Those who destroyed the memorial represent the intolerance that has pockmarked universities across the entire nation. This isn't a political message, this is a message to remember all who died that day.""","Refined Right | College Republicans 9/11 Memorial Vandalized, Rebuilt",link,https://rrght.io/2cheMNY,2016-09-11 17:37:02,6,0,2,6,0,0,0,0,0
1237168256301866_1283758711642820,"After an evening 9/11 memorial, College Republicans at Occidental College found their display of American flags repeatedly vandalized, with flags thrown into nearby garbage cans.","Refined Right | College Republicans 9/11 Memorial Vandalized, Rebuilt",link,https://refinedright.com/2016/09/11/college-republicans-911-memorial-vandalized-rebuilt/,2016-09-11 16:52:56,0,0,0,0,0,0,0,0,0
1237168256301866_1283748004977224,Vandals at Occidental College took flags from a 9/11 memorial and threw them into garbage cans. https://rrght.io/2ccmIVM,Timeline Photos,photo,https://www.facebook.com/refinedright/photos/a.1246091752076183.1073741828.1237168256301866/1283748004977224/?type=3,2016-09-11 16:38:41,9,1,2,3,0,0,0,0,6
1237168256301866_1283520468333311,"""I had no concept of how profound this was. Regardless, 9/11 affected my entire life and sense of reality.""","Refined Right | Remembering 9/11, Fifteen Years Later",link,https://refinedright.com/feature/remembering-911-fifteen-years-later/,2016-09-11 16:00:01,0,0,0,0,0,0,0,0,0
1237168256301866_1283553421663349,"""This is a day when all Americans from every walk of life unite in our resolve for justice and peace. America has stood down enemies before, and we will do so this time. None of us will ever forget this day, yet we go forward to defend freedom and all that is good and just in our world.""

President George W. Bush
September 11, 2001

http://buff.ly/2cBem6K",Timeline Photos,photo,https://www.facebook.com/refinedright/photos/a.1246091752076183.1073741828.1237168256301866/1283553421663349/?type=3,2016-09-11 11:31:45,3,0,1,3,0,0,0,0,0
1237168256301866_1283519955000029,"Remembering 9/11, Fifteen Years Later","Refined Right | Remembering 9/11, Fifteen Years Later",link,https://refinedright.com/feature/remembering-911-fifteen-years-later/,2016-09-11 10:45:45,0,0,0,0,0,0,0,0,0
1237168256301866_1281741148511243,NEWS: Saddleback YAF Holds 9/11 Memorial Event Despite Administration Refusal,Refined Right | Saddleback YAF Holds 9/11 Memorial Event Despite Administration Refusal,link,https://refinedright.com/2016/09/08/saddleback-yaf-holds-911-memorial-event-despite-administration-refusal/,2016-09-10 10:00:00,0,0,0,0,0,0,0,0,0
1237168256301866_1281739821844709,Refined Right was just the beginning.,Locally Sourced Pixels - Powering the Next Generation of Conservative Media,link,https://locallysourced.digital/,2016-09-10 06:00:00,1,0,0,1,0,0,0,0,0
1237168256301866_1281740718511286,Berkley protestors destroy College Republican's Trump cutout,"Berkeley protesters assault CRs, destroy Trump cutout",link,http://www.campusreform.org/?ID=8111,2016-09-09 20:00:00,3,1,0,3,0,0,0,0,0
1237168256301866_1281742191844472,,Freedom Crossroads,link,http://bit.ly/2clrmjy,2016-09-09 17:53:02,1,0,0,1,0,0,0,0,0
1237168256301866_1281739438511414,"ANNOUNCEMENTS: Refined Right, one month later:","Refined Right | Refined Right, One Month In",link,https://refinedright.com/update/refined-right-one-month-in/,2016-09-09 17:47:47,2,0,0,2,0,0,0,0,0
1237168256301866_1280648368620521,"""There is absolutely a bias in terms of treatment rendered toward UC Berkeley's CRs.""","Refined Right | Students at Berkeley Vandalize Trump Cutout, Assault College Republicans",link,https://refinedright.com/2016/09/08/students-at-berkeley-vandalize-trump-cutout-assault-college-republicans/,2016-09-08 19:00:00,0,0,0,0,0,0,0,0,0
1237168256301866_1280646218620736,"NEWS: Students at Berkeley Vandalize Trump Cutout, Assault College Republicans","Refined Right | Students at Berkeley Vandalize Trump Cutout, Assault College Republicans",link,https://refinedright.com/2016/09/08/students-at-berkeley-vandalize-trump-cutout-assault-college-republicans/,2016-09-08 12:45:04,0,0,0,0,0,0,0,0,0
1237168256301866_1279850772033614,"Read our guide to activism, and the stories of activism in action, in one place:",Refined Right | College,link,https://refinedright.com/category/college/,2016-09-07 20:00:00,2,0,0,2,0,0,0,0,0
1237168256301866_1279850332033658,Jokes about Harambe are Racist according to UMass,"Harambe Jokes are Racist, Says UMass-Amherst RAs",link,http://outsetmagazine.com/2016/09/07/harambe-jokes-racist/,2016-09-07 16:07:55,1,0,0,1,0,0,0,0,0
1237168256301866_1278791305472894,"Remembering Phyllis Schlafly (1924-2016), by Autumn Price",Refined Right | Remembering Phyllis Schlafly,link,https://refinedright.com/2016/09/06/remembering-phyllis-schlafly/,2016-09-06 18:00:00,0,0,0,0,0,0,0,0,0
1237168256301866_1278790478806310,FOOD: Hannah Carlson shares a secret family recipe for the classic apple pie:,Refined Right | Grandma Marianne's Apple Pie,link,https://refinedright.com/2016/09/06/grandma-mariannes-apple-pie/,2016-09-06 13:00:26,0,0,0,0,0,0,0,0,0
1237168256301866_1277764615575563,"FOOD: Hannah Carlson begins a new series on food and the stories behind it, with her own personal experiences.",Refined Right | Cooking Traditions Start as Family,link,https://refinedright.com/2016/09/05/cooking-traditions-start-as-family/,2016-09-05 17:00:01,0,0,0,0,0,0,0,0,0
1237168256301866_1277769352241756,MORE COMMENTARY: Alexander Haney on the importance of the context of a story in reporting.,Refined Right | Why Context Matters,link,https://refinedright.com/commentary/why-context-matters/,2016-09-05 17:00:00,0,0,0,0,0,0,0,0,0
1237168256301866_1277763895575635,"NEWS: As Brock Turner continues to make headlines, CA lawmakers attempt to close sentencing loopholes.",Refined Right | California Lawmakers Respond to Brock Turner Case,link,https://refinedright.com/2016/09/05/california-lawmakers-respond-to-brock-turner-case/,2016-09-05 16:00:01,0,0,0,0,0,0,0,0,0
