status_id,status_message,link_name,status_type,status_link,status_published,num_reactions,num_comments,num_shares,num_likes,num_loves,num_wows,num_hahas,num_sads,num_angrys
1624162894502220_1697418183843357,"#TamirRice is dead and it looks like police will get away with it -- even though he was holding a toy gun in an open carry state. Do Black Lives Matter in America?

via Counter Current News

#Police #Ohio",Judge Finds Probable Cause To Charge Cop With Murder In Tamir Rice Killing… So Why Is He Free?,link,http://bit.ly/1YEIbY6,2015-12-26 17:44:00,18,3,6,18,0,0,0,0,0
1624162894502220_1697416637176845,"Will #Obama free the other prisoners from #Guantanamo before he leaves office, or will others continue to sufer like Shaker Aamer?

#HumanRights","Shaker Aamer Befriended Ants, Stray Cats To Survive Guantanamo Torture",link,http://shadowproof.com/2015/12/15/shaker-aamer-befriended-ants-stray-cats-to-survive-guantanamo-torture/,2015-12-26 15:20:50,5,0,0,5,0,0,0,0,0
1624162894502220_1697386743846501,England seems to be learning from the U.S. when it comes to spying and #surveillance of #Muslims.,British Spies Offer Muslims Incentives for Snooping on Their Communities,link,https://shadowproof.com/2015/12/26/british-spies-offer-muslims-incentives-for-snooping-on-their-communities/,2015-12-26 12:53:32,15,1,3,15,0,0,0,0,0
1624162894502220_1697242110527631,"More and more evidence points toward #SaudIArabia's involvement in funding, or at least inspiring, #Daesh.

#MiddleEast #SocialMedia",UK Blames Saudi Arabia After Hackers Trace ISIS Accounts To UK Gov't,link,https://shadowproof.com/2015/12/25/uk-blames-saudi-arabia-after-hackers-trace-isis-accounts-to-uk-govt/,2015-12-26 10:05:01,28,0,18,28,0,0,0,0,0
1624162894502220_1696889507229558,"Seeing George W. Bush's pals face lawsuits for abuse of #humanrights makes for a Merry Christmas to all, indeed ...

#Islamophobia",Appeals Court Refuses to Shield Top Bush Officials From Lawsuit Against Post-9/11 Abuses,link,http://shadowproof.com/2015/12/11/appeals-court-refuses-to-protect-former-high-ranking-bush-officials-from-lawsuit-for-post-911-abuses/,2015-12-25 20:00:02,34,0,13,34,0,0,0,0,0
1624162894502220_1696889067229602,"Do you think Chicago Police Department killings are getting blamed on gangs?

via Counter Current News #RahmResign #BlackLivesMatter",Are Cops In Chicago Behind Many Of The Shootings That Are Blamed On Gang Violence?,link,http://countercurrentnews.com/2015/12/are-cops-in-chicago-behind/,2015-12-25 18:00:01,9,0,2,9,0,0,0,0,0
1624162894502220_1696888147229694,"Well, it's been quite a year. Unauthorized Disclosure looks back at 2015, from the rise of #Daesh to the rise of #DonaldTrump (and the ties between the two).

Read more ---> http://bit.ly/1QG8WXq

#Islamophobia",Timeline Photos,photo,https://www.facebook.com/shadowproofcom/photos/a.1657738554477987.1073741828.1624162894502220/1696888147229694/?type=3,2015-12-25 16:00:01,9,0,3,9,0,0,0,0,0
1624162894502220_1696885787229930,"Holidays are hard in prison for any inmate, but even harder for sexual minorities.

#PrisonReform #LGBTQIA","Chicago LGBTQ Inmates Speak Out Against Solitary Confinement, Homophobia",link,https://shadowproof.com/2015/08/25/chicago-lgbtq-inmates-speak-out-against-solitary-confinement-homophobia/,2015-12-25 14:00:00,10,0,0,10,0,0,0,0,0
1624162894502220_1696884717230037,"Is this kind of catastrophe becoming business as usual in the USA?

#ClimateChange #California",Unstoppable California Gas Leak Being Called Worst Catastrophe Since BP Spill,link,http://theantimedia.org/unstoppable-california-gas-leak-being-called-worst-catastrophe-since-bp-spill/,2015-12-25 12:19:01,18,3,6,18,0,0,0,0,0
1624162894502220_1696884070563435,"#MerryChristmas from all of us.

#HoHoHo #Meow",Timeline Photos,photo,https://www.facebook.com/shadowproofcom/photos/a.1657738554477987.1073741828.1624162894502220/1696884070563435/?type=3,2015-12-25 10:00:00,10,0,15,10,0,0,0,0,0
1624162894502220_1696882397230269,"This #Christmas remember the thousands who can't be at home with their families, and what they're going through.

#Prison #HumanRights",Advanced Correctional Healthcare's Brutal Brand Of Jailhouse Medicine,link,https://shadowproof.com/2015/08/03/advanced-correctional-healthcares-brutal-brand-of-jailhouse-medicine/,2015-12-24 22:00:01,5,0,0,5,0,0,0,0,0
1624162894502220_1696890323896143,"After years of legal battles, this advocate for online freedom was able to reveal a key government #surveillance tool.

#Tech",Former ISP Owner Wins Battle to Discuss FBI Spy Tool After Court Lifts Gag Order,link,https://shadowproof.com/2015/11/30/former-isp-owner-wins-battle-to-discuss-fbi-spy-tool-after-court-lifts-gag-order/,2015-12-24 22:00:00,13,0,5,13,0,0,0,0,0
1624162894502220_1696881190563723,"Heard about Purvi Patel? What's gone wrong in America when this is possible?

via Counter Current News.

#Feminism #GOP",Woman Sentenced To TWENTY YEARS In Prison For Having a Miscarriage,link,http://countercurrentnews.com/2015/12/woman-sentenced-to-twenty-years-in-prison-for-having-a-miscarriage/,2015-12-24 20:00:02,17,1,4,17,0,0,0,0,0
1624162894502220_1696880320563810,"The most transparent administration in history is continuing a 10-year legal battle to hide thousands of torture photos.

Read more ---> http://bit.ly/1ThMZMl

#HumanRights #Transparency",Timeline Photos,photo,https://www.facebook.com/shadowproofcom/photos/a.1657738554477987.1073741828.1624162894502220/1696880320563810/?type=3,2015-12-24 18:00:01,19,2,2,19,0,0,0,0,0
1624162894502220_1696879803897195,"Make sure #Santa visits Shadowproof this season.

DONATE: https://shadowproof.com/donate/
Shadowproof Membership: http://bit.ly/1KFxhEx

#Christmas #HoHoHo",Timeline Photos,photo,https://www.facebook.com/shadowproofcom/photos/a.1657738554477987.1073741828.1624162894502220/1696879803897195/?type=3,2015-12-24 16:00:01,11,0,3,11,0,0,0,0,0
1624162894502220_1696874123897763,"#Muslims in America are getting an increasing amount of support and #solidarity from their neighbors of all faiths.

#Islamophobia #Texas","Despite Increasing Threats And Violence, Americans Show Support For Muslim Neighbors",link,https://shadowproof.com/2015/12/24/despite-increasing-threats-and-violence-americans-show-support-for-muslim-neighbors/,2015-12-24 14:01:19,33,0,7,33,0,0,0,0,0
1624162894502220_1696834227235086,"The latest: JPMorgan will pay over $450 million in fines for screwing over investors and other customers.

Read more ---> http://bit.ly/1NHR6O5

#Banking #WallStreet",Timeline Photos,photo,https://www.facebook.com/shadowproofcom/photos/a.1657738554477987.1073741828.1624162894502220/1696834227235086/?type=3,2015-12-24 11:58:28,5,0,1,5,0,0,0,0,0
1624162894502220_1696625903922585,"What ways did you take action for #peace and justice in 2015? What are you planning to do next year?

via ProMosaik and the Mint Press News blog.

#FreePalestine #HumanRights",Mazin Qumsiyeh: 68 Ways To Support Peace And Palestine,link,http://www.mintpressnews.com/MyMPN/4804-2/,2015-12-23 20:07:42,8,0,0,8,0,0,0,0,0
1624162894502220_1696612247257284,"#SeymourHersh keeps uncovering uncomfortable truths about U.S. empire, and the #media keeps dismissing them as conspiracies. The latest is on the Joint Chiefs and #Syria.

WATCH on Democracy Now!: http://bit.ly/1khVHxV
Read our rebuttal of Vox: http://bit.ly/1NAQ7Bd",Timeline Photos,photo,https://www.facebook.com/shadowproofcom/photos/a.1657738554477987.1073741828.1624162894502220/1696612247257284/?type=3,2015-12-23 18:45:59,7,0,1,7,0,0,0,0,0
1624162894502220_1696601450591697,"#ICYMI: Add #cosplay to the list of activities that are unsafe while black.

Read more ---> http://bit.ly/1Mx2uuk

#BlackXmas #BlackLivesMatter",Darrien Hunt: Killed By Utah Cops For Anime Cosplay While Black,link,https://shadowproof.com/2015/08/22/darrien-hunt-killed-by-utah-cops-for-anime-cosplay-while-black/,2015-12-23 17:23:12,14,0,11,14,0,0,0,0,0
1624162894502220_1696589953926180,"This isn't from the fringe but work by Pew Research Center. Do you believe the U.S. government is your enemy?

via Counter Current News.

#BlackXmas #Election2016",More Than 1 In 4 Americans Now Believe the U.S. Government is the Enemy of the People,link,http://countercurrentnews.com/2015/12/1-4-americans-now-believe-u-s-government-enemy-people/,2015-12-23 16:25:11,41,2,19,41,0,0,0,0,0
1624162894502220_1696577823927393,"What do you think of Bernie Sanders plan to reform the #Federal Reserve?

#Banking #Election2016",Bernie Sanders Proposes Major Federal Reserve Reform,link,https://shadowproof.com/2015/12/23/bernie-sanders-proposes-major-federal-reserve-reform/,2015-12-23 14:58:56,43,4,171,43,0,0,0,0,0
1624162894502220_1696556727262836,"The #Pentagon is fighting a legal battle with ACLU Nationwide that's lasted over a decade, and they still aren't giving up the fight to hide their #warcrimes.

#HumanRights #Iraq","The Pentagon's Latest Scheme to Keep Nearly 2,000 Detainee Abuse Photos Secret",link,http://bit.ly/1ThMZMl,2015-12-23 13:03:33,19,0,11,19,0,0,0,0,0
1624162894502220_1696194060632436,"It's possible the Assad government is guilty of torture ... but should we hold #Syria accountable before holding our own leaders accountable?

From the Mint Press News blog.

#CaesarPhotos #Israel","Caesar Photos: Torture & Impunity In Syria, Israel & The US",link,http://www.mintpressnews.com/MyMPN/4979-2/,2015-12-23 10:09:02,14,0,4,14,0,0,0,0,0
1624162894502220_1696196773965498,"#ICYMI: Lifted Voices, with support from other activist groups like We Charge Genocide, performed a beautiful ""Memorial Blockade"" for #LaquanMcDonald and other victims of Chicago Police Department brutality.

Read more ---> http://bit.ly/1NTyka2",Timeline Photos,photo,https://www.facebook.com/shadowproofcom/photos/a.1657738554477987.1073741828.1624162894502220/1696196773965498/?type=3,2015-12-22 22:00:02,8,0,1,8,0,0,0,0,0
1624162894502220_1696159693969206,"Last minute shopping for a truth lover on your list? Give the gift of independent #journalism. Gift memberships to Shadowproof start at $30.

More info: https://donate.shadowproof.com/page/contribute/membership…
#Holidayshopping #Media",Timeline Photos,photo,https://www.facebook.com/shadowproofcom/photos/a.1657738554477987.1073741828.1624162894502220/1696159693969206/?type=3,2015-12-22 20:19:10,6,0,1,6,0,0,0,0,0
1624162894502220_1696150340636808,"United States Border Patrol is responsible for the latest report of brutality.

via Counter Current News.

#PoliceState",Border Patrol Officer Viciously Beats Elderly Couple for Helping an Injured Woman,link,http://countercurrentnews.com/2015/12/border-patrol-officer-elderly-couple-for-helping-an-injured-woman/,2015-12-22 19:05:47,18,0,9,18,0,0,0,0,0
1624162894502220_1696117143973461,"The NSA - National Security Agency might have stopped collecting bulk phone data on all of us, but corporations like Facebook and Twitter are picking up where they left off.

#Tech #Surveillance","Beyond Government Spying, Corporate Surveillance Is A Fact Of Modern Life",link,https://shadowproof.com/2015/12/22/beyond-government-spying-corporate-surveillance-is-a-fact-of-modern-life/,2015-12-22 17:45:36,12,0,18,12,0,0,0,0,0
1624162894502220_1696053883979787,"So about those ""moderate"" rebels in #Syria ...

#NextColdWar #MiddleEast",Report: 60 Percent Of Syrian Rebels Are Sympathetic To ISIS,link,https://shadowproof.com/2015/12/22/report-60-percent-of-syrian-rebels-are-sympathetic-to-isis/,2015-12-22 15:11:48,10,0,2,10,0,0,0,0,0
1624162894502220_1696001220651720,"Vox purports to explain the news, but in this article Kevin Gosztola explains everything Vox got wrong about Seymour Hersh.

#Syria","Vox's Max Fisher is Wrong About Seymour Hersh, Explained",link,https://shadowproof.com/2015/12/22/voxs-max-fisher-is-wrong-about-seymour-hersh-explained/,2015-12-22 13:10:47,10,0,2,10,0,0,0,0,0
1624162894502220_1695812460670596,"Do you think the sale of war #toys helps contribute to the success of the military-industrial complex?

#Christmas #MusicMonday",Protest Song of the Week: 'M-16' by Jefferson Pepper,link,https://shadowproof.com/2015/12/21/protest-song-of-the-week-m-16-by-jefferson-pepper/,2015-12-21 21:33:48,2,0,0,2,0,0,0,0,0
1624162894502220_1695779627340546,"What's your favorite #holiday protest music?

Do They Know It's Christmas? is the absolute worst, as far as we're concerned.

#MusicMonday",Timeline Photos,photo,https://www.facebook.com/shadowproofcom/photos/a.1657738554477987.1073741828.1624162894502220/1695779627340546/?type=3,2015-12-21 19:47:39,2,0,0,2,0,0,0,0,0
1624162894502220_1695767204008455,"Today's protest movements and push for freedom depend on journalism that demands #transparency and exposes injustice.

#PoliceBrutality #FreedomOfThePress",Promoting Adversarial Journalism Over Access Journalism,link,https://shadowproof.com/2015/12/21/promoting-adversarial-journalism-over-access-journalism/,2015-12-21 18:55:06,10,0,2,10,0,0,0,0,0
1624162894502220_1695737650678077,"A #whistleblower just revealed all the ways the government can spy on your cell phone!

#Surveillance #Tech",A Whistleblower Just Exposed How the Government Spies on Your Cell Phone,link,http://theantimedia.org/a-whistleblower-just-exposed-how-the-government-spies-on-your-cell-phone/,2015-12-21 17:09:16,13,0,5,13,0,0,0,0,0
1624162894502220_1695699187348590,"More bad behavior from #WallStreet, defrauding customers and the public, with more multi-million dollar fines paid that won't put a dent in their bottom line.

Chase #Banks",JPMorgan To Pay Over $450 Million For Screwing Clients And Investors,link,https://shadowproof.com/2015/12/21/jpmorgan-to-pay-over-450-million-for-screwing-clients-and-investors/,2015-12-21 16:04:52,33,4,22,33,0,0,0,0,0
1624162894502220_1695686214016554,"From the #environment to the rise of American #Islamophobia, a look back at 2015 with Unauthorized Disclosure.

#ISIS #GOPDebate",Year-End Episode of 'Unauthorized Disclosure': A Look Back at 2015,link,https://shadowproof.com/2015/12/20/year-end-episode-of-unauthorized-disclosure-a-look-back-at-2015/,2015-12-21 14:40:33,9,0,5,9,0,0,0,0,0
1624162894502220_1695660204019155,"New work by Seymour Hersh provides more evidence of the ways U.S. policy armed #AlQaeda.

#MilitaryMonday #NextColdWar",Joint Chiefs Worked To Undermine 'Special Relationship' with Al Qaeda in Syria,link,https://shadowproof.com/2015/12/21/joint-chiefs-worked-to-undermine-special-relationship-with-al-qaeda-in-syria/,2015-12-21 13:35:33,10,0,6,10,0,0,0,0,0
1624162894502220_1694961720755670,"Free speech depends on a free press. Support independent journalism.

DONATE: https://shadowproof.com/donate/
Give the gift of Shadowproof: http://bit.ly/Shadowgift

#FreedomOfThePress #FreeSpeech",Timeline Photos,photo,https://www.facebook.com/shadowproofcom/photos/a.1657738554477987.1073741828.1624162894502220/1694961720755670/?type=3,2015-12-21 10:13:01,15,0,3,15,0,0,0,0,0
1624162894502220_1694960324089143,"What's really behind #SaudiArabia's new ""counterterrorism coalition""?

Read more ---> http://bit.ly/1OwxnAt

#ISIS #MiddleEast",Timeline Photos,photo,https://www.facebook.com/shadowproofcom/photos/a.1657738554477987.1073741828.1624162894502220/1694960324089143/?type=3,2015-12-20 22:00:01,11,0,1,11,0,0,0,0,0
1624162894502220_1694959354089240,"Are England's #police becoming more violent?

#London",Metropolitan Police Officer Arrested After Fatal London Shooting,link,http://theantimedia.org/metropolitan-police-officer-arrested-after-fatal-london-shooting/,2015-12-20 20:00:01,3,0,0,3,0,0,0,0,0
1624162894502220_1694956940756148,"The U.S. is still struggling to prop up the opponents of Assad in #Syria.

Read more ---> http://bit.ly/1SXB5XP

#MiddleEast",Timeline Photos,photo,https://www.facebook.com/shadowproofcom/photos/a.1657738554477987.1073741828.1624162894502220/1694956940756148/?type=3,2015-12-20 16:00:00,21,0,9,21,0,0,0,0,0
1624162894502220_1694945804090595,"The NYPD sets the standard for American policing.

#PoliceBrutality #NewYorkCity",NYPD Cop Arrested for Raping 10-Year-Old Girl Walks Free Without Bail,link,http://usuncut.com/news/nypd-cop-arrested-raping-10-year-old-girl-walks-free-without-bail/,2015-12-20 14:00:00,14,2,5,14,0,0,0,0,0
1624162894502220_1694945330757309,"This analysis of suicide bombings proves how the Global War On Terror created more terrorism throughout the #MiddleEast.

Read more ---> http://bit.ly/1k5bekF

#Iraq #Syria",Timeline Photos,photo,https://www.facebook.com/shadowproofcom/photos/a.1657738554477987.1073741828.1624162894502220/1694945330757309/?type=3,2015-12-20 12:00:03,10,0,3,10,0,0,0,0,0
1624162894502220_1694941420757700,"In the #prison-industrial complex, #transgender and other #LGBTQ inmates often suffer the most.

#HumanRights",Lawsuit: Rikers Island Officer Unpunished After Raping Transgender Inmate In Corizon Health Clinic,link,https://shadowproof.com/2015/08/28/lawsuit-rikers-island-officer-unpunished-after-raping-transgender-inmate-in-corizon-health-clinic/,2015-12-20 10:00:01,10,0,4,10,0,0,0,0,0
1624162894502220_1694940780757764,"Your tax dollars fund the School of the Americas is where some of #SouthAmerica's worst dictators train their secret police to #torture.

Read more ---> http://bit.ly/1NQoKog

SOA Watch #Military",Timeline Photos,photo,https://www.facebook.com/shadowproofcom/photos/a.1657738554477987.1073741828.1624162894502220/1694940780757764/?type=3,2015-12-19 22:00:00,11,0,0,11,0,0,0,0,0
1624162894502220_1694939684091207,"Why is America fighting so had to hide the torture photos from a past administration?

American Civil Liberties Union #HumanRights",US Stalling Release Of Thousands Of Torture Photos Worse Than Abu Ghraib,link,http://www.mintpressnews.com/us-stalling-release-of-thousands-of-torture-photos-worse-than-abu-ghraib/212099/,2015-12-19 20:00:01,10,0,2,10,0,0,0,0,0
1624162894502220_1694938717424637,"In the name of fighting terrorism, the U.S. is turning #Africa into a giant laboratory of war.

Read more ---> http://bit.ly/1J2GpUj

#NextColdWar #MENA",Timeline Photos,photo,https://www.facebook.com/shadowproofcom/photos/a.1657738554477987.1073741828.1624162894502220/1694938717424637/?type=3,2015-12-19 18:30:01,9,0,0,9,0,0,0,0,0
1624162894502220_1694958624089313,"#ICYMI: A sting by Greenpeace International showed how U.S. academics are for sale to #climatechange deniers.

Read more ---> http://bit.ly/1XWS9Un

#Environment #ParisAgreement",Timeline Photos,photo,https://www.facebook.com/shadowproofcom/photos/a.1657738554477987.1073741828.1624162894502220/1694958624089313/?type=3,2015-12-19 18:00:01,7,0,3,7,0,0,0,0,0
1624162894502220_1694934790758363,"Top George W. Bush-era officials will face a historic lawsuit for violating the #HumanRights of Arabs after 9/11.

Read more ---> http://bit.ly/1NnSNA1",Timeline Photos,photo,https://www.facebook.com/shadowproofcom/photos/a.1657738554477987.1073741828.1624162894502220/1694934790758363/?type=3,2015-12-19 17:00:00,37,2,8,37,0,0,0,0,0
1624162894502220_1694933057425203,"Do you think American #police have been infiltrated by the #KKK?

via Counter Current News. #Racism #BlackLivesMatter",Police Depts in the US Have a KKK Problem – They've Long Been Infiltrated – Denying it Won't Help,link,http://countercurrentnews.com/2015/12/police-depts-in-the-us-have/,2015-12-19 15:00:00,20,1,10,20,0,0,0,0,0
1624162894502220_1694924684092707,"After buying the Las Vegas Review-Journal, the next property on Adelson's bucket list is The White House.

#Election2016 #Israel","Sheldon Adelson Buys Las Vegas Review-Journal, Wants To Buy Election Next",link,https://shadowproof.com/2015/12/19/sheldon-adelson-buys-las-vegas-review-journal-wants-to-buy-election-next/,2015-12-19 13:14:55,15,1,2,15,0,0,0,0,0
1624162894502220_1694726384112537,"#Congress is already planning to block the #ParisAgreement on climate. Can we force our leaders to protect the earth?

Read more ---> http://bit.ly/222eTSq

#ClimateChange",Timeline Photos,photo,https://www.facebook.com/shadowproofcom/photos/a.1657738554477987.1073741828.1624162894502220/1694726384112537/?type=3,2015-12-19 10:20:00,6,0,3,6,0,0,0,0,0
1624162894502220_1694725804112595,"Know someone who loves great journalism?

You can now give the gift of Shadowproof membership for as little as $30.

GIVE NOW ---> http://bit.ly/Shadowgift",Timeline Photos,photo,https://www.facebook.com/shadowproofcom/photos/a.1657738554477987.1073741828.1624162894502220/1694725804112595/?type=3,2015-12-18 22:00:01,6,0,2,6,0,0,0,0,0
1624162894502220_1694715957446913,"Did #COP21Paris accomplish ANYTHING? The Paris Agreement may lead to India DOUBLING it's #coal output: http://bit.ly/1lQU8IZ

#FossilFuels #Environment",Timeline Photos,photo,https://www.facebook.com/shadowproofcom/photos/a.1657738554477987.1073741828.1624162894502220/1694715957446913/?type=3,2015-12-18 20:30:01,6,0,1,6,0,0,0,0,0
1624162894502220_1694705017448007,How can the media hold Obama accountable for his promise to close #Guantanamo if they can't report what happens there?,"US Military Tired of Questions From Media, Restricts Access to Guantanamo",link,https://shadowproof.com/2015/12/18/us-military-tired-of-questions-from-media-restricts-access-to-guantanamo/,2015-12-18 19:08:23,29,0,16,29,0,0,0,0,0
1624162894502220_1694684604116715,"It's tempting to blame Texas, but American #Islamophobia is becoming all too widespread, and Sikhs are frequently the victims.

via Counter Current News. #Racism",Police Lock Up 12-Year-Old Sikh Student Because Racist Classmates Said He 'Had a Bomb',link,http://countercurrentnews.com/2015/12/police-lock-up-12-year-old/,2015-12-18 17:07:13,22,0,8,22,0,0,0,0,0
1624162894502220_1694655657452943,"Bernie Sanders campaign is under attack from the Democratic Party establishment just after receiving 2 key endorsements, and right before a major debate with Hillary Clinton.

Did Sanders campaign cross the line, or is this an attempt to undermine his credibility?

#BernieGate #DemDebate",Bernie Sanders Wins Endorsements From CWA And DFA; DNC Attacks,link,https://shadowproof.com/2015/12/18/bernie-sanders-wins-endorsements-from-cwa-and-dfa-dnc-attacks/,2015-12-18 14:18:47,48,5,19,48,0,0,0,0,0
1624162894502220_1694638977454611,"Can John Kerry and Vladimir Putin settle their differences of #Syria?

#NextColdWar #Russia",Negotiations On Syria Continue Today In New York,link,https://shadowproof.com/2015/12/18/negotiations-on-syria-continue-today-in-new-york/,2015-12-18 13:10:29,8,0,1,8,0,0,0,0,0
1624162894502220_1694437260808116,"Do you think we'll see increasingly intense #ClimateChange activism after the #ParisAgreement?

From Kate Lanier on the Mint Press News blog.

#Fracking #Mining","After Paris, 'The Age Of Fossil Fuels Is Over'",link,http://www.mintpressnews.com/MyMPN/earth-whirl-17-dec-2015/,2015-12-18 10:02:02,7,0,0,7,0,0,0,0,0
1624162894502220_1694440457474463,"Are #AlQaeda our friends or our enemies? Right now, our allies in the Middle East are supplying them with weapons.

Read more ---> http://bit.ly/1P5BVTe

#Iraq #NextColdWar",Timeline Photos,photo,https://www.facebook.com/shadowproofcom/photos/a.1657738554477987.1073741828.1624162894502220/1694440457474463/?type=3,2015-12-17 22:00:02,6,1,2,6,0,0,0,0,0
1624162894502220_1694439547474554,"What if we spent all these resources HELPING the #homeless instead of policing them?

#Denver #OpSafeWinter",Denver Cops Break Up Homeless Camp in the Middle of a Snowstorm,link,http://theantimedia.org/denver-cops-break-up-homeless-camp-in-the-middle-of-a-snowstorm/,2015-12-17 20:00:01,13,1,9,13,0,0,0,0,0
1624162894502220_1694438920807950,"To survive the tortures of #Guantanamo Bay, Shaker Aamer befriended stray #cats, birds, and even ants.

Read more ---> http://bit.ly/1P6aJDJ

#HumanRights",Timeline Photos,photo,https://www.facebook.com/shadowproofcom/photos/a.1657738554477987.1073741828.1624162894502220/1694438920807950/?type=3,2015-12-17 18:35:48,10,1,4,10,0,0,0,0,0
1624162894502220_1694424127476096,"Another cop who claimed he ""feared for his life.""

via Counter Current News.",Video Shows San Diego Cop Trying to Beat Up Two Paramedics Inside 7-Eleven,link,http://countercurrentnews.com/2015/12/video-shows-san-diego-cop-trying-up-two-paramedics-inside-7-eleven/,2015-12-17 16:43:29,14,1,3,14,0,0,0,0,0
1624162894502220_1694411770810665,"Are we stopping #terrorism in the Middle East, or just making things worse? The numbers look very bad.

#ISIS #Afghanistan #Libya",War On Terror Has Created More Terrorism,link,https://shadowproof.com/2015/12/17/war-on-terrorism-has-created-more-terrorism/,2015-12-17 15:09:18,40,3,27,40,0,0,0,0,0
1624162894502220_1694397680812074,"The reason the media loves Donald J. Trump is because Trump's xenophobia is profitable for the corporations that own the #media.

#Islamophobia",Media Fomenting Fear About Muslims To Expand US Corporate Empire,link,https://shadowproof.com/2015/12/17/media-fomenting-fear-about-muslims-to-expand-us-corporate-empire/,2015-12-17 13:30:44,14,1,1,14,0,0,0,0,0
1624162894502220_1694197727498736,"What can we learn about poverty and #inequality from #India's love of Ayn Rand?

From the Mint Press News blog and FDL's David Seaton.",Ayn Rand's India A Disturbing Mirror For The American Right To See Itself,link,http://www.mintpressnews.com/MyMPN/ayn-rands-india-a-disturbing-mirror-for-the-american-right-to-see-itself/,2015-12-17 10:06:00,13,2,1,13,0,0,0,0,0
1624162894502220_1694200217498487,"REVIEW: The Big Short turns the 2008 financial crash into a #film that's simultaneously insightful and hilarious.

Read more ---> http://bit.ly/1TGvx46

#Comedy Steve Carrell",Timeline Photos,photo,https://www.facebook.com/shadowproofcom/photos/a.1657738554477987.1073741828.1624162894502220/1694200217498487/?type=3,2015-12-16 22:00:04,3,0,0,3,0,0,0,0,0
