status_id,status_message,link_name,status_type,status_link,status_published,num_reactions,num_comments,num_shares,num_likes,num_loves,num_wows,num_hahas,num_sads,num_angrys
1624162894502220_1680194095565766,"#ICYMI, a new #whistleblower shined a light onto Obama's targeted killing program, and how many innocent lives it's claimed.

Read more ---> http://bit.ly/1Rhqk1r",Timeline Photos,photo,https://www.facebook.com/shadowproofcom/photos/a.1657738554477987.1073741828.1624162894502220/1680194095565766/?type=3,2015-10-17 16:40:37,39,2,17,39,0,0,0,0,0
1624162894502220_1680175952234247,"How much do you think this is happening? #FreePalestine

From Counter Current News.",Israeli Soldier Caught On Video Planting Knife On Palestinian Teen Shot by Illegal Settler,link,http://countercurrentnews.com/2015/10/israeli-soldier-caught-on-video/,2015-10-17 14:05:26,36,2,17,36,0,0,0,0,0
1624162894502220_1680158122236030,"Look deeper than the mainstream media and you'll see Israel is deliberately provoking Palestine, again, with excessive and deadly force!

#FreePalestine #MiddleEast",Third Intifada Or Zionist Jihad: Israel Escalates Tensions With Execution Style Force,link,https://shadowproof.com/2015/10/17/third-intifada-or-zionist-jihad-israel-escalates-tensions-with-execution-style-force/,2015-10-17 12:04:15,26,4,9,26,0,0,0,0,0
1624162894502220_1680001212251721,Our friends at Mint Press News shared this fascinating #drone footage inside the abandoned zone around #Fukushima nuclear power plant in Japan.,Fukushima Wasteland: Drone Footage Shows Terrifying Abandoned Nuclear Zone,link,http://www.mintpressnews.com/fukushima-wasteland-drone-footage-shows-terrifying-abandoned-nuclear-zone/210354/,2015-10-17 09:26:01,18,1,9,18,0,0,0,0,0
1624162894502220_1680000158918493,Tim Wise appeared on The Laura Flanders Show to explain how #racism leads to #poverty and cuts to the social safety net for all Americans.,Racism And The Cruelty Of Affluence With Tim Wise (VIDEO),link,https://shadowproof.com/2015/10/16/racism-and-the-cruelty-of-affluence-with-tim-wise-video/,2015-10-16 20:18:00,17,0,3,17,0,0,0,0,0
1624162894502220_1680006985584477,"Moody's downgraded Corizon's parent company for the FOURTH TIME in two years, citing contract losses.","Moody's Downgrades Corizon's Parent Company, Citing Contract Losses",link,https://shadowproof.com/2015/10/16/moodys-downgrades-corizons-parent-company-citing-contract-losses/#.ViGFATEVYQ8.facebook,2015-10-16 18:17:07,8,0,1,8,0,0,0,0,0
1624162894502220_1679999738918535,"#ICYMI: Tiny wage increase comes with strings attached ---> http://bit.ly/1X9UaZq

#WallStreet dumps Walmart after wage increase ---> http://bit.ly/1X9U7gn

#Poverty #Wages",Timeline Photos,photo,https://www.facebook.com/shadowproofcom/photos/a.1657738554477987.1073741828.1624162894502220/1679999738918535/?type=3,2015-10-16 18:13:00,17,1,6,17,0,0,0,0,0
1624162894502220_1679998052252037,"Do you think the growing movement toward legalization will result in more cases like this one?

via Counter Current News. #WarOnDrugs #LegalizeIt","Jury Sends Message to Cops, Go Find REAL CRIMINALS, Acquits Man on Felony Pot Charges",link,http://countercurrentnews.com/2015/10/jury-sends-message-to-cops/,2015-10-16 16:47:03,23,0,8,23,0,0,0,0,0
1624162894502220_1679990412252801,"What do #Palestine and #Ferguson have in common? Their security forces stink. Literally.

via the The Laura Flanders Show.",Gaza and Ferguson: Security Forces that Stink - Literally,link,https://soundcloud.com/lauraflanders/gaza-and-ferguson-security-forces-that-stink-literally,2015-10-16 15:35:06,9,0,2,9,0,0,0,0,0
1624162894502220_1679984172253425,"Which warmonger will you vote for next November?

From our friends at Mint Press News.",Timeline Photos,photo,https://www.facebook.com/shadowproofcom/photos/a.1657738554477987.1073741828.1624162894502220/1679984172253425/?type=3,2015-10-16 14:35:21,11,1,1,11,0,0,0,0,0
1624162894502220_1679973365587839,"Central Intelligence Agency #whistleblower Jeffrey Sterling is supported by other whistleblowers like Thomas Drake and Jesselyn Radack.

#JeffreySterling",CIA Whistleblower Jeffrey Sterling Seeks Presidential Pardon,link,https://shadowproof.com/2015/10/16/cia-whistleblower-jeffrey-sterling-seeks-presidential-pardon/,2015-10-16 13:12:57,23,1,9,23,0,0,0,0,0
1624162894502220_1679962668922242,The global top wealth percentile now owns half of all household assets in the world.,"Global 1% Own Half Of World's Wealth, Social Security And Worker Pay Frozen",link,https://shadowproof.com/2015/10/16/global-1-own-half-of-worlds-wealth-social-security-and-worker-pay-frozen/#.ViEssOXE0dw.facebook,2015-10-16 11:58:51,18,0,11,18,0,0,0,0,0
1624162894502220_1679811552270687,"Californians voted overwhelmingly to reduce inmate populations with Prop 47, but a new report card by Californians United for a Responsible Budget (CURB) shows that one year later, nearly every county is investing in incarceration.","Despite Prop 47, California Continues to Invest In Incarceration",link,http://shadowproof.com/2015/10/15/despite-prop-47-california-continues-to-invest-in-incarceration/#,2015-10-15 18:41:53,10,3,7,10,0,0,0,0,0
1624162894502220_1679789432272899,"Do you think Evo Morales is right about #capitalism?

From FDL's Kate Lanier on the Mint Press News blog.

#ClimateChange","'Capitalism Is The Cancer Of Mother Earth,' & Other Climate News",link,http://www.mintpressnews.com/MyMPN/capitalism-is-the-cancer-of-mother-earth-other-climate-news/,2015-10-15 17:29:00,14,0,4,14,0,0,0,0,0
1624162894502220_1679787518939757,"In Afghanistan, a stunning number of individuals killed and then labeled ""enemies killed in action"" so U.S. can forget about them.",Documents from Whistleblower Show 'Targeted Killing' Operations Killed Hundreds Who Weren't Targets,link,http://shadowproof.com/2015/10/15/documents-from-whistleblower-show-targeted-killing-operations-killed-hundreds-who-werent-targets/,2015-10-15 15:05:34,24,0,14,24,0,0,0,0,0
1624162894502220_1679749942276848,Did you need more proof that Walmart's business model is based on screwing their workers?,Walmart Stock Crashes After Company Pays Workers Slightly More,link,http://shadowproof.com/2015/10/15/walmart-stock-crashes-after-company-pays-workers-slightly-more/#.Vh_Xs7jMbmk.facebook,2015-10-15 11:43:39,18,2,12,18,0,0,0,0,0
1624162894502220_1679743512277491,"Former AZ Republican Party chair tweets guns should be taken away from African Americans because ""they are the main killers.""

From our friends at Counter Current News",Arizona Republican Chairman Calls For 'Taking Guns Away From Blacks',link,http://countercurrentnews.com/2015/10/arizona-republican-chairman-calls-for-disarming/,2015-10-15 11:03:07,9,2,9,9,0,0,0,0,0
1624162894502220_1679725392279303,Our friends at Mint Press News report on big contradictions in Israel's origins and its current treatment of refugees.,The World's Largest Detention Center Is For Black Jews Seeking Asylum In Israel,link,http://shadowproof.com/2015/10/15/the-worlds-largest-detention-center-is-for-black-jews-seeking-asylum-in-israel/#.Vh-4eq2D7UQ.facebook,2015-10-15 09:31:47,9,0,4,9,0,0,0,0,0
1624162894502220_1679609102290932,"The bombing of a Médecins Sans Frontières hospital in #Afghanistan reflects the suffering U.S. foreign policy creates every day, worldwide.

From the Mint Press News blog.",An Open Letter To Barack Obama About The Kunduz Bombing,link,http://www.mintpressnews.com/MyMPN/an-open-letter-to-barack-obama-about-the-kunduz-hospital-bombing/,2015-10-14 19:20:33,19,0,4,19,0,0,0,0,0
1624162894502220_1679587048959804,Debate over Edward Snowden misses the fact that the real issue is need for more whistleblower protection.,"Democratic Presidential Candidates Debate Snowden, Ignore Whistleblower Protection Issues",link,http://shadowproof.com/2015/10/14/democratic-presidential-candidates-debate-snowden-ignore-whistleblower-protection-issues/,2015-10-14 16:13:39,19,2,8,19,0,0,0,0,0
1624162894502220_1679579698960539,Mint Press News investigates Israel's racist detention policies.,The World's Largest Detention Center Is for Black Jews Seeking Asylum in Israel,link,http://www.mintpressnews.com/the-worlds-largest-detention-center-is-for-black-jews-seeking-asylum-in-israel/210331/,2015-10-14 15:10:40,29,1,14,29,0,0,0,0,0
1624162894502220_1679565098961999,Is America finally ready for this debate?,Virtues Of Capitalism Become Issue At 2016 Democratic Debate,link,http://shadowproof.com/2015/10/14/virtues-of-capitalism-become-issue-at-2016-democratic-debate/,2015-10-14 13:28:22,9,3,1,9,0,0,0,0,0
1624162894502220_1679551295630046,"Third Circuit Court of Appeals: ""What occurs here in one guise is not new. We have been down similar roads before.""","Appeals Court Opposes Religious Profiling, Reinstates Lawsuit Against NYPD Spying",link,http://shadowproof.com/2015/10/14/appeals-court-opposes-religious-profiling-reinstates-lawsuit-against-nypd-spying/,2015-10-14 12:09:31,16,0,3,16,0,0,0,0,0
1624162894502220_1679380198980489,"Mint Press News' Mnar A. Muhawesh interviews the father of Ali Al-Nimr, a juvenile offender sentenced to death in Saudi Arabia",Ali Al-Nimr's Father Pleads For Son's Release & Online Activism Ahead Of Crucifixion,link,http://www.mintpressnews.com/ali-al-nimrs-father-pleads-for-sons-release-online-activism-ahead-of-crucifixion/210245/,2015-10-13 15:42:18,6,1,2,6,0,0,0,0,0
1624162894502220_1679360068982502,Less Than 400 Families Contributed Most Of 2016 Presidential Funds,Less Than 400 Families Contribute Most Of 2016 Presidential Funds,link,http://shadowproof.com/2015/10/13/less-than-400-families-contribute-most-of-2016-presidential-funds/,2015-10-13 14:05:32,12,2,7,12,0,0,0,0,0
1624162894502220_1679359058982603,"Ray Barrera of A&H Equipment Repair said his customers were charged $60,000 in fines and fees over the past six years while parked on his private property awaiting inspection for the things they were being ticketed for. (via Counter Current News)",Police Charge Mechanic With 'Felony Assault' For Calling Them Out On Ticket Scheme,link,http://countercurrentnews.com/2015/10/owner-charged-repair-shop/#,2015-10-13 13:56:53,13,1,6,13,0,0,0,0,0
1624162894502220_1679345725650603,"Suleiman Abdullah Salim was subject to water torture, prolonged standing sleep deprivation, and kept naked for weeks. This was torture developed by James Mitchell & Bruce Jessen.",CIA Torture Architects Sued by Former Detainees for Water Dousing & Other Methods,link,http://shadowproof.com/2015/10/13/cia-torture-architects-sued-by-former-detainee-for-water-dousing-other-methods/,2015-10-13 12:22:10,27,2,10,27,0,0,0,0,0
1624162894502220_1679320415653134,From our friends at Mint Press News: Is Israel using the discord in Syria to expand its illegal settlements in the Golan Heights?,Israel Takes Advantage Of Syrian Civil War To Expand Illegal Golan Heights Settlements,link,http://shadowproof.com/2015/10/13/israel-takes-advantage-of-syrian-civil-war-to-expand-illegal-golan-heights-settlements/,2015-10-13 09:47:42,12,0,7,12,0,0,0,0,0
1624162894502220_1679302735654902,"In the past 14 years, the U.S. military has proven just about any institution that should be protected in war can be transformed into a target.",Podcast: Journalist Anand Gopal on MSF Hospital Attack & Next Phase of Afghanistan War,link,http://shadowproof.com/2015/10/11/podcast-journalist-anand-gopal-on-msf-hospital-attack-next-phase-of-afghanistan-war/,2015-10-13 08:06:39,10,0,2,10,0,0,0,0,0
1624162894502220_1679208185664357,"The mainstream media isn't going to show you this, but #Germany came out by the millions to oppose TTIP, the European cousin of the #TPP trade deal!

From the Mint Press News blog.",A Quarter Million In Berlin Say No To The TTIP!,link,http://www.mintpressnews.com/MyMPN/a-quarter-million-in-berlin-say-no-to-the-ttip/,2015-10-12 19:58:37,24,0,24,24,0,0,0,0,0
1624162894502220_1679155425669633,"Regardless of whether or not Sharkey is conclusively stymied in court, the question is whether or not JPMorgan pulled another Madoff and once again looked the other way when one of its clients used the bank's services to break the law.

Will we ever know?",Former JPMorgan Vice President Alleges Money Laundering Cover-Up,link,http://shadowproof.com/2015/10/12/former-jpmorgan-vice-president-alleges-money-laundering-cover-up/#.Vhv5DwhPK3E.facebook,2015-10-12 13:17:05,18,0,9,18,0,0,0,0,0
1624162894502220_1679133585671817,"The ""day-to-day mechanics of Washington's political intervention in Latin America"" are unveiled.",WikiLeaks: US Government Plotted To Kill Bolivian President Evo Morales,link,http://bit.ly/1OwZbsb,2015-10-12 11:27:57,25,1,29,25,0,0,0,0,0
1624162894502220_1679116865673489,"Check out this track by Ryan Harvey, a ""riot folk"" singer and songwriter who wrote a song about the refugee crisis called ""Omar.""",Protest Song of the Week: 'Omar',link,http://shadowproof.com/2015/10/12/protest-song-of-the-week-omar/#.VhvH3g4n4EA.facebook,2015-10-12 09:47:31,5,0,0,5,0,0,0,0,0
1624162894502220_1678236202428222,"""I am told that Purdue briefly considered, among other things, whether to destroy the projector I borrowed, lest contaminants remain."" -- Washington Post journalist Barton Gellman",'Classified Speech': Purdue Destroys Video of Presentation on Snowden Documents,link,http://shadowproof.com/2015/10/09/classified-speech-purdue-destroys-video-of-presentation-on-snowden-documents/,2015-10-09 11:44:56,12,1,3,12,0,0,0,0,0
1624162894502220_1678052402446602,"Another embarrassment for #Texas cops, although at least this one didn't cost any lives.

via Counter Current News.",SWAT Team In Six Hour Standoff With EMPTY House,link,http://countercurrentnews.com/2015/10/swat-team-in-six-hour-standoff-with-empty-house/#,2015-10-09 09:09:00,17,3,4,17,0,0,0,0,0
1624162894502220_1678059955779180,"From #flooding to drought to #pollution, earth's water is in danger.

The latest Fracked Earth News from FDL's Kate Lanier and the Mint Press News blog.

#Mining","Flooding, Drought, & Pollution On A Fracked Earth",link,http://www.mintpressnews.com/MyMPN/flooding-drought-pollution-on-a-fracked-earth/,2015-10-08 20:45:00,6,0,0,6,0,0,0,0,0
1624162894502220_1678052195779956,"Wikileaks cables reveal that the #TPP isn't just about increasing the reach of global corporations, but also the reach of the U.S. military in its cold war with #China.

#StopTPP",How TPP Stands To Significantly Boost U.S. Military Power In Asia-Pacific Region,link,http://shadowproof.com/2015/10/08/how-tpp-stands-to-significantly-boost-u-s-military-power-in-asia-pacific-region/,2015-10-08 19:07:00,16,2,9,16,0,0,0,0,0
1624162894502220_1678046235780552,Have you seen Sicario? What did you think of its take on the #WarOnDrugs?,"Film Review: In 'Sicario,' What Happens When FBI Agent Threatens to Expose True War on Drugs",link,http://shadowproof.com/2015/10/07/film-review-in-sicario-what-happens-when-fbi-agent-threatens-to-expose-true-war-on-drugs/,2015-10-08 17:36:01,5,1,1,5,0,0,0,0,0
1624162894502220_1678043552447487,"From endless war to Hillary Clinton, the shadow of Henry Kissinger is still cast across modern American #politics.

From The Laura Flanders Show.",Empire And Resistance In Henry Kissinger's Shadow (VIDEO),link,http://shadowproof.com/2015/10/08/empire-and-resistance-in-henry-kissingers-shadow-video/,2015-10-08 16:35:00,9,1,3,9,0,0,0,0,0
1624162894502220_1678039402447902,"The #TPP would extend #patent law and the reach of #copyrights, threatening #FreedomOfSpeech, pushing up drug prices, and endangering the Internet.

Read more ---> http://bit.ly/1hr2ofw

#StopTPP",Timeline Photos,photo,https://www.facebook.com/shadowproofcom/photos/a.1657738554477987.1073741828.1624162894502220/1678039402447902/?type=3,2015-10-08 15:01:00,6,0,4,6,0,0,0,0,0
1624162894502220_1678023155782860,#Kunduz wasn't the first U.S. atrocity of its kind.,A Short History of U.S. Bombing of Civilian Facilities,link,https://theintercept.com/2015/10/07/a-short-history-of-u-s-bombing-of-civilian-facilities/,2015-10-08 13:36:00,7,0,2,7,0,0,0,0,0
1624162894502220_1678014399117069,"After spending $11k and an undisclosed amount administering the program, only 0.19% of welfare applicants in Tennessee tested positive for illegal drug use.",Drug Testing Welfare Applicants Was Waste Of Time And Money,link,http://shadowproof.com/2015/10/08/drug-testing-welfare-applicants-was-waste-of-time-and-money/#.VhahgkwAWb0.facebook,2015-10-08 12:03:12,23,3,28,23,0,0,0,0,0
1624162894502220_1677998765785299,"From the widespread die-offs of #bees to the lie of #austerity, here are some of the most important overlooked stories of 2015 from Project Censored and Mint Press News.",Top Censored Stories Of 2015 (VIDEO),link,http://shadowproof.com/2015/10/08/top-censored-stories-of-2015-video/,2015-10-08 10:36:19,14,1,4,14,0,0,0,0,0
1624162894502220_1677835462468296,"Can we ever count how many lives the #DrugWar has destroyed?

Via Counter Current News. #EndTheDrugWar",Honor Student Bullied by Police For 'Smelling Like Marijuana' Leads To His Suicide,link,http://countercurrentnews.com/2015/10/honor-student-bullied-by-police-leads-to/,2015-10-08 09:05:03,6,1,0,6,0,0,0,0,0
1624162894502220_1677859299132579,"""If I can make one recommendation to people: never just repeat something you saw in the news on TV, read in a newspaper or heard on radio without thinking critically about it first.""

From ProMosaik and the Mint Press News blog. #Media #Activism","David Andersson: For A Dynamic, Peaceful, Changing Society",link,http://www.mintpressnews.com/MyMPN/david-andersson-how-to-create-a-dynamic-peaceful-changing-society/,2015-10-07 20:37:17,9,0,0,9,0,0,0,0,0
1624162894502220_1677831812468661,"Sorry for the inconvenience, but we're trying to save a few shreds of #democracy.

#TPP: The Battle Moves To #Congress ---> http://bit.ly/1M7JEPe
""Free"" #Trade Deal Extends #Copyright & Patents: http://bit.ly/1hr2ofw

#StopTPP",Timeline Photos,photo,https://www.facebook.com/shadowproofcom/photos/a.1657738554477987.1073741828.1624162894502220/1677831812468661/?type=3,2015-10-07 19:18:00,14,1,2,14,0,0,0,0,0
1624162894502220_1677825895802586,Did Harvard University's debate team lose because they assumed only stupid people end up in #prison?,Harvard Debate Team Loses To Prison Inmates (VIDEO),link,http://shadowproof.com/2015/10/07/harvard-debate-team-loses-to-prison-inmates-video/,2015-10-07 17:40:00,16,3,4,16,0,0,0,0,0
1624162894502220_1677824069136102,"Which country is a bigger threat to world peace? The USA or Putin's #Russia?

via Mint Press News.",Vladimir Putin Explains How To Tell The Difference Between The U.S.A. and Russia,link,http://www.mintpressnews.com/putin-publish-a-world-map-and-mark-al-the-u-s-military-bases-on-it-you-will-see-the-difference-between-russia-and-the-us/206343/,2015-10-07 16:14:22,13,3,10,13,0,0,0,0,0
1624162894502220_1677812455803930,"Are you on Shadowproof's weekly newsletter yet? It comes out tomorrow!

SUBSCRIBE: http://bit.ly/shadowproofsignup

Get our top stories in your inbox every Thursday morning.",Timeline Photos,photo,https://www.facebook.com/shadowproofcom/photos/a.1657738554477987.1073741828.1624162894502220/1677812455803930/?type=3,2015-10-07 14:47:54,4,0,1,4,0,0,0,0,0
1624162894502220_1677789695806206,"How is expanding #copyright and #patent law ""free trade""?

#StopTPP #Trade",TPP: Supposed Free Trade Agreement To Expand Copyrights And Patents,link,http://shadowproof.com/2015/10/07/tpp-supposed-free-trade-agreement-to-expand-copyrights-and-patents/,2015-10-07 13:38:00,9,1,6,9,0,0,0,0,0
1624162894502220_1677784502473392,"This bigot #police chief is herself an immigrant.

via Counter Current News.

#SyriaCrisis #immigration",Bigot Police Chief Says Muslim Refugees Are Bad Because They Don't Act European,link,http://countercurrentnews.com/2015/10/police-chief-says-muslim-refugees-are-bad-because-they-dont-act-european/,2015-10-07 12:13:34,10,3,2,10,0,0,0,0,0
1624162894502220_1677768842474958,"Britain's insincere boasting about being a strong promoter of human rights sounds more hollow than ever.

From our friends at The Anti-Media",Wikileaks Exposes Secret Deal To Get Saudi Arabia On UN Human Rights Council,link,http://shadowproof.com/2015/10/07/wikileaks-exposes-secret-deal-to-get-saudi-arabia-on-un-human-rights-council/,2015-10-07 10:50:57,17,0,5,17,0,0,0,0,0
1624162894502220_1677755569142952,Two inmates died in one week at Henderson County Jail and Advanced Correctional Healthcare has been given the boot. Now the county is looking for a new provider.,Tennessee County Seeks New Jail Medical Contract After Inmate Deaths,link,http://shadowproof.com/2015/10/07/tennessee-county-seeks-new-jail-medical-contract-after-inmate-deaths/,2015-10-07 09:34:28,11,2,2,11,0,0,0,0,0
1624162894502220_1677527242499118,From our friends at Mint Press News: Doctors Without Borders calls the US' bombing of its hospital in Afghanistan a war crime. What do you think?,Mint Press News,photo,https://www.facebook.com/MintpressNewsMPN/photos/a.427073724002835.96035.277613075615568/990037277706474/?type=3,2015-10-06 16:38:14,28,2,0,28,0,0,0,0,0
1624162894502220_1677525092499333,"Filming the death of Eric Garner was almost deadly for #RamseyOrta!

via Counter Current News. #ICantBreathe",Man Who Filmed Eric Garner's Death Files Lawsuit After Being Served Poisoned Meatloaf In Jail,link,http://countercurrentnews.com/2015/10/filmed-eric-garners-death-files-lawsuit-after-being-arrested-served-poisoned-meatloaf-in-jail/,2015-10-06 16:22:24,27,0,21,27,0,0,0,0,0
1624162894502220_1677516815833494,"""It felt like somebody cut my face up and poured hot sauce in,"" testified one tenth grader who was five months pregnant when officers pepper sprayed her in school.",School Officers' Pepper Spray Policy Declared Unconstitutional In Alabama,link,http://shadowproof.com/2015/10/06/school-officers-pepper-spray-policy-declared-unconstitutional-in-alabama/,2015-10-06 15:16:32,17,0,14,17,0,0,0,0,0
1624162894502220_1677493039169205,"General Campbell said it as 'mistakenly struck,' but all evidence points to a calculated decision to bomb a hospital.",U.S. Commander Claims Forces 'Would Never Intentionally Target Protected Medical Facility',link,http://shadowproof.com/2015/10/06/u-s-commander-claims-forces-would-never-intentionally-target-protected-medical-facility/,2015-10-06 12:22:15,21,1,9,21,0,0,0,0,0
1624162894502220_1677327069185802,"It takes more than just understanding #encryption to beat #surveillance.

An interesting entry from the Mint Press News blog.",Beating Surveillance: Typing Is The First Mistake,link,http://www.mintpressnews.com/MyMPN/beating-surveillance-typing-is-the-first-mistake/,2015-10-06 11:22:02,11,0,5,11,0,0,0,0,0
1624162894502220_1677476825837493,"Given we are now in the stage of writing the history of the 2008 financial crisis, it might be time for Bernanke and other former government officials to justify their self-serving narratives.",Former Fed Chair Bernanke Says Bankers Should Have Been Jailed For '08 Crash,link,http://shadowproof.com/2015/10/06/former-fed-chair-bernanke-says-bankers-should-have-been-jailed-for-08-crash/,2015-10-06 11:00:21,19,0,12,19,0,0,0,0,0
1624162894502220_1677326912519151,"Bernie Sanders really cares about #inequality, ESPECIALLY at lunch time!

From After Dark with Julian Clark. #Election2016",Bernie Sanders On Pizza Inequality (VIDEO),link,http://shadowproof.com/2015/10/05/bernie-sanders-on-pizza-inequality-video/,2015-10-06 10:20:01,3,0,0,3,0,0,0,0,0
1624162894502220_1677309749187534,"""Post-racial America"" still seems to have an awful lot of #racism, doesn't it?

via Counter Current News. #education",Ohio Court Upholds School Suspension of 12-Year-Old Black Student Who 'Stared' at a White Girl,link,http://countercurrentnews.com/2015/10/ohio-court-upholds-school-suspension-of-12-year-old-black-student-who-stared-at-a-white-girl/,2015-10-06 09:06:01,11,0,1,11,0,0,0,0,0
1624162894502220_1677308975854278,"If #Congress passes this important criminal justice bill, it would reform the use of #solitary confinement against juvenile inmates, as well as open new avenues to parole for juvenile offenders and the elderly or ill.

#Prison
http://shadowproof.com/2015/10/05/long-awaited-criminal-justice-reform-introduced-in-senate/",Long-Awaited Criminal Justice Reform Introduced In Senate,link,http://shadowproof.com/2015/10/05/long-awaited-criminal-justice-reform-introduced-in-senate/,2015-10-05 20:44:00,15,4,1,15,0,0,0,0,0
1624162894502220_1677308812520961,Black Lives Matter protesters and other activists against #PoliceBrutality just racked up another win in #California.,This State Just Passed a Brilliant New Law Aimed at Outing Racist Cops,link,http://usuncut.com/black-lives-matter/california-police-profiling-law/,2015-10-05 19:42:01,14,0,8,14,0,0,0,0,0
1624162894502220_1677308415854334,"#ICYMI, the #Obama administration is arguing that U.S. courts have no jurisdiction over #drone bombing.

Read more ---> http://bit.ly/1WBWA2P",Timeline Photos,photo,https://www.facebook.com/shadowproofcom/photos/a.1657738554477987.1073741828.1624162894502220/1677308415854334/?type=3,2015-10-05 18:08:01,15,1,6,15,0,0,0,0,0
1624162894502220_1677307869187722,"Does #FreedomOfSpeech only apply to some student activists?

In the latest Unauthorized Disclosure, Kevin Gosztola interviews Palestine Legal about the targeted attacks on #FreePalestine activists.",Podcast: Rise of McCarthyist Tactics Against Palestinian Human Rights Activism,link,http://shadowproof.com/2015/10/04/podcast-rise-of-mccarthyist-tactics-against-palestinian-human-rights-activism/,2015-10-05 17:03:01,14,0,1,14,0,0,0,0,0
