status_id,status_message,link_name,status_type,status_link,status_published,num_reactions,num_comments,num_shares,num_likes,num_loves,num_wows,num_hahas,num_sads,num_angrys
1624162894502220_1740844986167343,"This week's ""Unauthorized Disclosure"" podcast features an interview with Keeanga-Yamahtta Taylor.",Unauthorized Disclosure,link,https://shadowproof.com/2016/05/01/keeanga-yamahtta-taylor-black-liberation/,2016-05-03 08:30:51,3,0,0,2,0,0,0,1,0
1624162894502220_1740609842857524,"The groups, ranging from Win Without War to the National Taxpayers Union, have highlighted eight Pentagon programs that could be reduced or eliminated to find the over $38 billion in savings",Right And Left Coalition Propose Over $38 Billion In Cuts For Pentagon,link,https://shadowproof.com/2016/05/02/right-and-left-coalition-propose-cuts-to-pentagon-budget/,2016-05-02 14:21:59,12,0,7,11,1,0,0,0,0
1624162894502220_1740581552860353,The Senate is poised to reform mandatory minimum sentences with... more mandatory minimum sentences.,Senate May Reform Mandatory Minimum Sentences With More Mandatory Minimum Sentences,link,https://shadowproof.com/2016/05/02/senate-may-reform-mandatory-minimum-sentences-mandatory-minimum-sentences/,2016-05-02 11:57:20,10,1,8,7,0,0,0,1,2
1624162894502220_1740566412861867,"Eugene Puryear believes a choice between Clinton and Trump would be a ""sham choice—and completely out of tune with the spirit of the people.""",Revolutionary Vice-Presidential Candidate On Importance of Alternatives To Two Major Parties,link,https://shadowproof.com/2016/05/02/revolutionary-vice-presidential-candidate-on-importance-of-alternatives-to-two-major-parties/,2016-05-02 11:10:47,14,2,8,12,2,0,0,0,0
1624162894502220_1739727232945785,The Clinton campaign has expressed quite a condescending view of millennials throughout the Democratic primary.,Clinton Campaign Has Astounding Record Of Smugness Toward Young Voters,link,https://shadowproof.com/2016/04/29/clinton-campaign-astounding-record-smugness-toward-young-voters/,2016-04-29 19:05:28,32,3,10,22,0,0,0,0,10
1624162894502220_1739666426285199,"On May 5 at 12:00PM East, Kevin Gosztola hosts a livestream interview with journalist Jeremy Scahill about The Assassination Complex.

Read it at The Intercept: https://theintercept.com/drone-papers/the-assassination-complex/",Timeline Photos,photo,https://www.facebook.com/shadowproofcom/photos/a.1657738554477987.1073741828.1624162894502220/1739666426285199/?type=3,2016-04-29 15:03:15,9,1,1,7,1,0,0,0,1
1624162894502220_1739620812956427,Next Cold War news round-up: 150 Marines arrived in Raqqa governate via Qamishli and 100 more are expected soon. The Russian envoy to the UN announced that the Syrian coalition is planning an offensive on Raqqa.,"US Marines Arrive in Northern Raqqa, Lavrov Says ""Big Mistake""",link,https://shadowproof.com/2016/04/29/next-cold-war-roundup-042716/,2016-04-29 11:57:22,15,0,7,11,0,0,0,0,4
1624162894502220_1739322022986306,Ted Cruz's decision to pick Carly Fiorina as his running mate is odd for a number of reasons—particularly her past business deals with Iran.,Carly Fiorina's History Of Illegal Trading With Iran Problem For Ted Cruz,link,https://shadowproof.com/2016/04/28/carly-fiorinas-history-of-illegal-trading-with-iran-problem-for-ted-cruz/,2016-04-28 12:41:17,10,1,4,6,0,4,0,0,0
1624162894502220_1739020466349795,"Though there is much talk of the principle involved in developing Puerto Rico's bailout, it looks as though the real battle lines are  being drawn according to alliances between investment funds and their friendly members of Congress.",Wall Street Funds Battle By Proxy In Congress Over Puerto Rico Bailout,link,https://shadowproof.com/2016/04/27/wall-street-donors-put-gop-congress-in-tough-position-on-puerto-rico-bailout/,2016-04-27 14:59:46,7,0,6,5,0,0,0,0,2
1624162894502220_1739001479685027,It's important for the Sanders campaign to keep giving voters in upcoming primaries a strong alternative to corporate Democratic politics.,Why Sanders Supporters Should Not Let Democratic Primary Demoralize Them,link,https://shadowproof.com/2016/04/27/sanders-supporters-not-let-democratic-primary-demoralize/,2016-04-27 13:25:13,32,1,8,30,2,0,0,0,0
1624162894502220_1738752206376621,Correct The Record has spread some of the most vile attacks and lies about Sanders and his campaign.,Clinton Super PAC Denies Role In Attack On Sanders Facebook Groups—But That Doesn't Resolve Issue,link,https://shadowproof.com/2016/04/26/clinton-super-pac-denies-role-in-attack-on-sanders-facebook-groups-but-that-doesnt-resolve-issue/,2016-04-26 19:07:36,29,3,11,20,0,0,0,2,7
1624162894502220_1738614379723737,"On Thursday, April 28 at 8:00pm Eastern, Shadowproof's Brian Sonenstein will interview Jean Casella, co-director of Solitary Watch and one of the editors of Hell Is A Very Small Place: Voices From Solitary Confinement.",Event Preview: Exploring Dimensions Of Solitary Confinement With Jean Casella,link,https://shadowproof.com/2016/04/26/event-preview-exploring-dimensions-of-solitary-confinement-with-jean-casella/,2016-04-26 11:48:00,8,0,3,8,0,0,0,0,0
1624162894502220_1738614153057093,"The ""no boots on the ground"" pledge has clearly been violated, but if you believe State Department Spokesman John Kirby, the pledge itself was never made.",Obama Sends More Troops To Syria As Spokesman Memoryholes Pledge,link,https://shadowproof.com/2016/04/26/obama-sends-more-troops-to-syria/,2016-04-26 10:36:18,13,2,6,9,0,0,0,0,4
1624162894502220_1738420826409759,We pay tribute to a humanitarian artist by highlighting some of his political songs.,The Protest Songs Of Prince,link,https://shadowproof.com/2016/04/25/the-protest-songs-of-prince/,2016-04-25 19:51:42,18,1,8,18,0,0,0,0,0
1624162894502220_1738317599753415,"The White House may be preparing to release at least some of a secret chapter from a congressional inquiry into 9/11, as Saudi Arabia aggressively lobbies against legislation allowing victims' families to sue the kingdom.",White House May Declassify 9/11 Files As Saudis Ramp Up Lobbying,link,https://shadowproof.com/2016/04/25/white-house-moves-towards-declassifying-911-files-as-saudis-ramp-up-lobbying/,2016-04-25 12:34:47,30,4,11,29,0,1,0,0,0
1624162894502220_1738277259757449,"UAW Local 2865 members voted to endorse a BDS call for divestment in a landslide. There was a backlash, but it seems to have backfired.",Attempts To Stifle BDS Support Within UAW Local Backfires,link,https://shadowproof.com/2016/04/24/attempts-stifle-bds-support-within-uaw-local-backfires/,2016-04-25 10:36:44,16,1,3,14,2,0,0,0,0
1624162894502220_1737981223120386,"The complex issue of risk assessment and eligibility for release from jail places some people at an undeniable disadvantage, despite mitigating factors that could ensure they appear in court and not be re-arrested.","New York City Expands Bail Alternative Program, Funded Primarily By Manhattan Prosecutor",link,https://shadowproof.com/2016/04/24/new-york-city-expands-bail-alternative-program-funded-primarily-manhattan-prosecutor/,2016-04-24 12:11:01,7,2,2,7,0,0,0,0,0
1624162894502220_1737341313184377,The moment has arrived. That moment when the establishment's sniggering apologists tell those damn idealists that it is time to get with the program and settle for the latest shabby party product or risk going home empty-handed.,"No, Jon Favreu: We Will Not Learn To Love Hillary Clinton",link,https://shadowproof.com/2016/04/22/no-jon-favreu-we-will-not-learn-to-love-hillary/,2016-04-22 12:55:21,54,11,23,50,2,0,0,0,2
1624162894502220_1737336913184817,The project celebrates Hillary Clinton's ability to break down barriers. And it's true: Clinton is breaking down barriers for corporations to influence governmental policy.,Clinton's Digital Task Force Breaks Barriers To Defend Her Donors,link,https://shadowproof.com/2016/04/22/clintons-digital-task-force-breaks-barriers-defend-donors/,2016-04-22 12:31:11,19,0,10,16,0,0,0,0,3
1624162894502220_1737142676537574,Did you miss our discussion with Ray Bonner? You can watch a recording here: https://www.youtube.com/watch?v=KVocjB0nEEM,Ray Bonner: Weakness And Deceit,video,https://www.youtube.com/watch?v=KVocjB0nEEM,2016-04-21 20:04:18,4,0,4,4,0,0,0,0,0
1624162894502220_1737127439872431,Click here to watch our live interview with Raymond Bonner about US intervention in El Salvador starts at 8 east / 5 pacific.,LIVE: Journalist Ray Bonner Discusses US Interventions In El Salvador,link,https://shadowproof.com/2016/04/21/live-journalist-ray-bonner-discusses-us-interventions-in-el-salvador/,2016-04-21 18:44:51,2,2,0,2,0,0,0,0,0
1624162894502220_1737063859878789,"While apologists and propagandists for the government in Kiev have tried their best to dismiss concerns about the government's connection to neo-fascist movements, the jig is undeniably up.",Ukraine's New Speaker Of Parliament Is A Neo-Nazi,link,https://shadowproof.com/2016/04/21/ukraines-new-speaker-of-parliament-is-neo-nazi/,2016-04-21 14:18:44,12,0,6,10,0,2,0,0,0
1624162894502220_1736822516569590,"Every day Sanders campaign functions as competitive alternative to Clinton, the more Democratic elites want to crush it.","Sanders Campaign's Commitment To Victory Irritates Media, Offends Clinton Campaign",link,https://shadowproof.com/2016/04/20/sanders-campaigns-commitment-victory-irritates-media-offends-clinton-campaign/,2016-04-20 19:30:19,81,5,42,62,9,1,5,1,3
1624162894502220_1736801453238363,"Toke up today if you wish, but when the haze clears, think about what needs to be done so everyone can chose to celebrate 420 without fear of facing destruction.",420: US Still Spending Millions On Failed War On Pot,link,https://shadowproof.com/2016/04/20/420-us-still-spending-billions-on-failed-war-on-drugs/,2016-04-20 17:12:07,13,0,9,12,0,0,0,1,0
1624162894502220_1736471533271355,"The ""closed primary"" system in states like New York is the two-party system's key mechanism for maintaining control over elections in the face of declining membership.",Closed New York Primary Helps Democratic Party Maintain Status Quo,link,https://shadowproof.com/2016/04/19/closed-new-york-primary-helps-democratic-party-maintain-status-quo/,2016-04-19 19:14:32,6,1,1,5,0,0,0,0,1
1624162894502220_1736388336613008,"Don't miss our video interview this Thursday at 8pm east with journalist Ray Bonner about hi book ""Weakness And Deceit"" about the US intervention in El Salvador, to be broadcast LIVE from Shadowproof.com.",Timeline Photos,photo,https://www.facebook.com/shadowproofcom/photos/a.1657738554477987.1073741828.1624162894502220/1736388336613008/?type=3,2016-04-19 15:34:25,8,0,5,8,0,0,0,0,0
1624162894502220_1736357526616089,"Don't miss our Protest Song Of The Week: ""The Trouble With Normal"" by Bruce Cockburn",Protest Song Of The Week: 'The Trouble With Normal',link,https://shadowproof.com/2016/04/19/protest-song-week-trouble-normal/,2016-04-19 14:52:00,5,1,2,4,1,0,0,0,0
1624162894502220_1736357313282777,It looks like the nuclear arms race is back on.,Next Cold War Brings New Nuclear Arms Race,link,https://shadowproof.com/2016/04/19/next-cold-war-brings-new-nuclear-arms-race/,2016-04-19 13:39:19,8,2,7,5,0,0,0,1,2
1624162894502220_1736018713316637,Will there ever be accountability for states that harbor and enable terrorists? Hillary Clinton better hope not.,Hillary Clinton's Dealings With Saudi Arabia Back In Focus For 9/11 Bill,link,https://shadowproof.com/2016/04/18/hillary-clintons-dealings-with-saudi-arabia-back-in-focus-for-911bill/,2016-04-18 13:07:15,28,1,13,25,0,0,0,0,3
1624162894502220_1735980946653747,"Clinton used Jewish holiday of Pesach, or Passover, to not only advocate for further violence but to also malign Sanders' justified criticisms of Israel",Palestine Activists Warm To Sanders While Clinton Spreads Israeli Propaganda,link,https://shadowproof.com/2016/04/18/palestine-activists-warm-sanders-clinton-spreads-israeli-propaganda/,2016-04-18 10:34:31,23,1,6,16,3,0,0,0,4
1624162894502220_1734960463422462,"Behind the slick computer-generated vision for Fort Wayne's future is a brewing conflict with the downtown community, who endure numerous acts of repression at the hands of law enforcement.",Lawsuits Challenge Fort Wayne's 'Law And Order' Policies Used To Push Out City's Poor,link,https://shadowproof.com/2016/04/15/fort-wayne-black-poor-incarceration/,2016-04-15 14:06:54,12,1,6,10,0,0,0,0,2
1624162894502220_1734954646756377,"Hillary Clinton cannot have it both ways. Either money in politics is corrupting and #CitizensUnited needs to be overturned because it threatens democracy, or a candidate can take all the money they want from special interests because money makes no difference in policymaking.","Hillary Clinton Claims Money Has No Influence, Then Calls For Overturning Citizens United",link,https://shadowproof.com/2016/04/15/hillary-clinton-claims-money-has-no-influence-then-calls-for-overturning-citizens-united/,2016-04-15 13:45:47,48,2,26,44,0,0,3,0,1
1624162894502220_1734688986782943,Clinton's perception of mass incarceration is either terribly informed or she has concocted her own version of American history to suit her political agenda.,Clinton Wrong About Mass Incarceration Being Known Problem For Just A Decade,link,https://shadowproof.com/2016/04/14/clinton-wrong-mass-incarceration-known-problem-just-decade/,2016-04-14 19:40:56,18,0,18,14,0,0,0,0,4
1624162894502220_1734647996787042,"Roqayah Chamseddine profiled six American voters, who will likely vote for a third party presidential candidate or not vote in November.",Voters Share Perspectives On Rejecting Two-Party System In 2016 Election,link,https://shadowproof.com/2016/04/14/voters-share-perspectives-rejecting-two-party-system-2016-election/,2016-04-14 15:53:12,9,0,14,7,2,0,0,0,0
1624162894502220_1734607360124439,"Remember, the US is ""not intervening"" in Syria.",US Plans To Give More Weapons To Al Qaeda-Linked Rebels In Syria,link,https://shadowproof.com/2016/04/14/us-threatens-to-give-more-weapons-to-al-qaeda-in-syria/,2016-04-14 13:15:32,22,1,18,16,0,2,0,0,4
1624162894502220_1734384176813424,"""We arrived at this point in part because of racism. We arrived at this point because of a mentality in CPD that the ends justify the means.""",Task Force Lambasts Chicago Police Department's Decades-Long Record Of Systemic Racism,link,https://shadowproof.com/2016/04/13/task-force-lambasts-chicago-police-departments-decades-long-record-systemic-racism/,2016-04-13 21:18:01,4,0,3,2,0,0,0,0,2
1624162894502220_1734207176831124,Big banks are still Too Big To Fail. Why won't President Obama break them up?,Too Big To Fail Banks Still Failing 'Living Will' Tests,link,https://shadowproof.com/2016/04/13/too-big-to-fail-banks-fail-livingwill-tests/,2016-04-13 10:26:20,8,0,2,6,0,0,0,0,2
1624162894502220_1733939430191232,"Clinton on coup plotters: ""They had a very strong argument that they had followed the constitution and the legal precedence.""",Hillary Clinton Says Honduras Coup Not Illegal In Daily News Editorial Board Interview,link,https://shadowproof.com/2016/04/12/hillary-clinton-says-honduras-coup-not-illegal-daily-news-editorial-board-interview/,2016-04-12 14:05:00,42,12,99,28,0,1,2,0,11
1624162894502220_1733903616861480,Who knew the Brookings Institution had a tinfoil hat division?,#PanamaPapers Truthers Blame Russia For Leak As Ukraine Continues To Implode,link,https://shadowproof.com/2016/04/12/panamapapers-truthers-blame-russia-for-leak-as-ukraine-continues-to-implode/,2016-04-12 11:32:02,9,1,3,8,0,1,0,0,0
1624162894502220_1733589586892883,The Pentagon is not keeping track of whether former employees are complying with revolving door laws designed to prevent corruption in defense contracting.,Report: Pentagon Not Enforcing Revolving Door Corruption Regulations,link,https://shadowproof.com/2016/04/11/report-pentagon-not-enforcing-corruption-regulations/,2016-04-11 13:41:46,28,0,6,22,1,0,0,0,5
1624162894502220_1733583383560170,"Obama claims Justice Department is not influenced by politics, and politics will not determine whether Hillary Clinton is prosecuted.",Obama Claims Outcome Of Investigation Into Clinton Emails Won't Be Political,link,https://shadowproof.com/2016/04/11/obama-claims-outcome-of-investigation-into-clinton-emails-wont-be-political/,2016-04-11 13:24:49,14,6,2,12,0,0,2,0,0
1624162894502220_1733564556895386,"Check out our round up from the Next Cold War, including news that B-52 bombers have arrived in Qatar– the first time these long-range bombers have been based in the Middle East since the 1991 Gulf War.","B-52 Bombers Deployed to Qatar, EU Friendly Minister May Replace Yatsenyuk in Ukraine",link,https://shadowproof.com/2016/04/11/next-cold-war-roundup-041116/,2016-04-11 12:02:15,12,0,2,9,0,0,0,0,3
1624162894502220_1733365686915273,,Fairness & Accuracy In Reporting,link,http://fair.org/home/some-of-globes-predictions-for-trumps-america-have-already-come-true/,2016-04-10 21:46:31,8,0,0,5,0,0,0,1,2
1624162894502220_1733261546925687,"Douglas Williams, a writer for ""The South Lawn,"" joins the Unauthorized Disclosure podcast to discuss Bill Clinton's attacks on Black Lives Matter and more.",The Clintons And The 'Cognitive Dissonance' Election,link,https://shadowproof.com/2016/04/10/clintons-cognitive-dissonance-election/,2016-04-10 13:37:24,18,2,9,17,0,1,0,0,0
1624162894502220_1732530056998836,,Michelle Alexander,link,http://talkingpointsmemo.com/livewire/bill-clinton-addresses-clash-blm-protesters,2016-04-08 15:33:47,18,3,0,15,0,1,1,0,1
1624162894502220_1732527210332454,"The kind of drama, which establishment news media outlets crave, and frankly, the Clinton campaign privately desires this drama too.",Establishment Media Fuels Squabble Between Clinton And Sanders Over Qualifications,link,https://shadowproof.com/2016/04/08/media-perpetuates-squabble-between-clinton-and-sanders-over-qualifications/,2016-04-08 15:14:27,3,2,1,2,0,0,0,0,1
1624162894502220_1732493500335825,"In a recent column primarily concerned with perceived deficiencies of Bernie Sander's campaign messaging, Paul Krugman offered a thoroughly incorrect analysis of the 2008 financial crisis.",Paul Krugman Doesn't Understand The 2008 Financial Crisis,link,https://shadowproof.com/2016/04/08/paul-krugman-doesnt-understand-the-2008-financial-crisis/,2016-04-08 12:40:19,28,0,6,26,0,0,1,0,1
1624162894502220_1732259463692562,"Hillary Clinton has tried to distance herself from some of the very policies, which Bill Clinton justified and defended today.","Bill Clinton Says Black Lives Matter Protesters Defend Gang Leaders, Crack Dealers",link,https://shadowproof.com/2016/04/07/bill-clinton-says-black-lives-matter-protesters-defend-gang-leaders-crack-dealers/,2016-04-07 20:54:40,28,8,10,20,0,1,0,0,7
1624162894502220_1732241590361016,"The shallow language of concessions and ""realism""–while undoubtedly beneficial to the capitalist class–remains a material threat to the world's most vulnerable populations.",The Global Consequences Of Hillary Clinton's Predatory Pragmatism,link,https://shadowproof.com/2016/04/07/global-consequences-hillary-clintons-predatory-pragmatism/,2016-04-07 18:57:05,19,1,18,18,0,1,0,0,0
1624162894502220_1732188777032964,"While the #GOP appears to be increasingly unwelcoming to neoconservatives, they may have found a way back into power through aligning with Hillary Clinton and her related organizations.",CAP-Neocon Partnership Raises Concerns For Hillary Clinton Presidency,link,https://shadowproof.com/2016/04/07/cap-neocon-partnership-raises-concerns-hillary-clinton-presidency/,2016-04-07 14:41:36,23,1,13,19,0,1,0,0,3
1624162894502220_1731890753729433,"Ahead of major New York primary, the once-inevitable nominee, as her campaign argued, reverts to more distortion.",'Disqualify' And 'Defeat': Clinton Campaign Attacks Intensify To Halt Sanders' Win Streak,link,https://shadowproof.com/2016/04/06/disqualify-defeat-clinton-campaign-attacks-intensify-halt-sanders-win-streak/,2016-04-06 19:06:32,29,4,15,25,0,0,0,0,4
1624162894502220_1731824883736020,Was the corporate media too dumb to understand Bernie Sanders bank breakup plan?,Was Corporate Media Too Dumb To Understand Sanders Bank Breakup Plan?,link,https://shadowproof.com/2016/04/06/corporate-media-too-dumb-to-understand-sanders-bank-breakup-plan/,2016-04-06 14:44:39,33,1,13,31,1,0,0,0,1
1624162894502220_1731523670432808,Ralph Nader's candidacy is used to stifle discussion of how to democratize elections and support for alternatives to the establishment's chosen candidate.,Democratic Party Myth That Nader Gave Us Iraq War Haunts 2016 Election,link,https://shadowproof.com/2016/04/05/democratic-party-myth-nader-gave-us-iraq-war-haunts-2016-election/,2016-04-05 18:35:19,16,0,7,12,1,0,0,0,3
1624162894502220_1731452770439898,"What Secretary Pritzker laid out with ""commercial diplomacy"" bares a strong resemblance to the ""Public Diplomacy 2.0"" dynamic between the US government and tech firms detailed by Julian Assange of Wikileaks in his book, ""When Google Met Wikileaks.""",Commerce Secretary Highlights 'Commercial Diplomacy' To Push US Tech,link,https://shadowproof.com/2016/04/05/commerce-secretary-highlights-commercial-diplomacy-to-push-us-tech/,2016-04-05 13:42:46,3,0,1,2,0,0,0,0,1
1624162894502220_1731411427110699,"Secretary Pritzker, a former Council on Foreign Relations board member and one of the richest women in the world, explained that opposition to #TPP was misguided and that free trade was being unfairly scapegoated for larger forces hurting US workers, such as automation.",Commerce Secretary Pritzker Defends Corporate Tribunals In TPP,link,https://shadowproof.com/2016/04/05/commerce-secretary-pritzker-defends-corporate-tribunals-in-tpp/,2016-04-05 11:46:30,7,4,1,4,0,0,0,1,2
1624162894502220_1731361683782340,"As one human rights commissioner said, ""I literally can't imagine the most powerful country in the world having these kind of stories.""",Impacted Communities Testify on US Water Crises At Human Rights Hearing,link,https://shadowproof.com/2016/04/04/impacted-communities-testify-us-water-crises-human-rights-hearing/,2016-04-05 08:48:06,12,0,15,9,0,0,0,1,2
1624162894502220_1731205310464644,"Actor Tim Robbins spoke about the disastrous pragmatism, which led to the Iraq War, and why that still matters now.","At Sanders Rally in Wisconsin, Tim Robbins Delivers Fiery Speech Against Political Pragmatism",link,https://shadowproof.com/2016/04/04/tim-robbins-sanders-rally-wisconsin/,2016-04-04 21:30:14,39,2,15,33,5,1,0,0,0
1624162894502220_1731122743806234,"On this week's episode of the Unauthorized Disclosure podcast, Kevin and Rania talk to Drew Franklin about his candidacy for the D.C. City Council, D.C. statehood, Deray McKesson's campaign for Baltimore mayor and Teach for America, and why Franklin chose to run as an independent instead of a Democrat.",Building A Movement To Fight Political Disenfranchisement In DC,link,https://shadowproof.com/2016/04/03/drew-franklin-at-large-independent-interview/,2016-04-04 14:49:06,7,1,2,6,1,0,0,0,0
1624162894502220_1731113517140490,"The view from the Next Cold War: NY Times calls Ukraine a ""corrupt swamp;"" Rebels and Al Qaeda launch attacks in Syria","Rebels With Al Qaeda Launch Attacks in Syria, New York Times Calls Ukraine 'Corrupt Swamp'",link,https://shadowproof.com/2016/04/04/next-cold-war-roundup-040416/,2016-04-04 14:12:05,5,1,2,4,0,1,0,0,0
1624162894502220_1731085943809914,"The #PanamaPapers, totaling 11.5 million documents, reportedly ""shows how a global industry of law firms and big banks sells financial secrecy to politicians, fraudsters and drug traffickers as well as billionaires, celebrities and sports stars.""",Panama Papers: Document Leak Reveals Details Of Offshore Financial System,link,https://shadowproof.com/2016/04/04/panama-papers-document-leak-reveals-massive-tax-avoidance-system/,2016-04-04 12:02:18,24,1,9,22,0,2,0,0,0
1624162894502220_1730814193837089,We're witnessing a formulaic normalization of anti-Muslim sentiment expressed by leading political personalities and candidates running for president of the United States of America.,Leading US Presidential Candidates Normalize Anti-Muslim Sentiment,link,https://shadowproof.com/2016/04/03/leading-us-presidential-candidates-normalize-anti-muslim-sentiment/,2016-04-03 18:48:23,10,1,5,7,0,0,0,1,2
1624162894502220_1730658937185948,"Clinton, her campaign, and the establishment news media, which covers her so defensively, see her as an extraordinary, altruistic public servant.",Clinton Believes She's Special Kind Of Politician Who Can't Be Influenced By Money,link,https://shadowproof.com/2016/04/02/clinton-special-politician-influence-money/,2016-04-03 09:10:00,31,8,13,22,0,0,6,0,3
1624162894502220_1729930293925479,"Putting aside the misdirected anger at the Greenpeace USA activist, was Hillary Clinton telling the truth about her record regarding fossil fuel money?",Hillary Clinton Lies About Being Lied About On Fossil Fuel Connections,link,https://shadowproof.com/2016/04/01/hillary-clinton-lies-about-being-lied-about-on-fossil-fuel-donations/,2016-04-01 11:51:09,29,4,26,25,0,0,0,0,4
1624162894502220_1729302917321550,Poroshenko's embattled government in Ukraine turns to the U.S. for more help.,US Sends More Forces To Europe As Poroshenko Lobbies In DC,link,https://shadowproof.com/2016/03/31/us-sends-more-forces-to-europe-as-poroshenko-lobbies-in-dc/,2016-03-31 15:01:00,2,1,4,1,0,0,0,1,0
1624162894502220_1729388493979659,"Roqayah Chamseddine introduces her new column, 'Sharp Edges,' beginning next week at Shadowproof",Introducing 'Sharp Edges'—A New Column at Shadowproof,link,https://shadowproof.com/2016/03/31/introducing-sharp-edges-a-new-column-at-shadowproof/,2016-03-31 14:58:56,8,0,1,8,0,0,0,0,0
