status_id,status_message,link_name,status_type,status_link,status_published,num_reactions,num_comments,num_shares,num_likes,num_loves,num_wows,num_hahas,num_sads,num_angrys
1624162894502220_1880805142171326,Let's broaden the conversation beyond merely reforming private health care.,Medicare For All Must Be Part Of Health Care Reform Conversation,link,https://shadowproof.com/2017/03/31/medicare-for-all-must-be-part-of-health-care-reform-conversation/,2017-03-31 13:13:00,15,2,5,13,2,0,0,0,0
1624162894502220_1880789998839507,"The U.S. will focus only on eliminating ISIS and other terror groups—not regime change—as part of its counter-terrorism program in Syria. However, this is not slowing down U.S. military involvement in the region.",Trump Administration Officially Drops Regime Change Objective In Syria,link,https://shadowproof.com/2017/03/31/trump-administration-officially-drops-regime-change-objective-in-syria/,2017-03-31 11:29:08,15,5,7,12,1,1,1,0,0
1624162894502220_1880383808880126,"Kevin Gosztola reviews a book from former Chicago Bulls player Craig Hodges, who was exiled from the NBA in the 1990s because of his activism.",Book Review: 'Long Shot: The Triumphs And Struggles Of An NBA Freedom Fighter',link,https://shadowproof.com/2017/03/30/book-review-long-shot-triumphs-struggles-nba-freedom-fighter/,2017-03-30 17:55:20,4,0,3,3,1,0,0,0,0
1624162894502220_1880188428899664,"Ohio prisoner Siddique Abdullah Hasan entered the infirmary at the Ohio State Penitentiary on March 24, ""presumably due to failing health.""",Ohio Prisoner On Hunger Strike Against Punishment For Netflix Documentary Enters Infirmary,link,https://shadowproof.com/2017/03/29/hasan-enters-infirmary-netflix-documentary-captive/,2017-03-30 09:38:02,7,2,9,5,0,0,0,2,0
1624162894502220_1879899125595261,Report on the climate change denial hearing that Republicans held on Capitol Hill today,The GOP's New Front In Culture War Against Climate Science,link,https://shadowproof.com/2017/03/29/gops-new-front-culture-war-climate-science/,2017-03-29 19:50:19,9,1,3,4,0,0,0,0,5
1624162894502220_1879660045619169,"A student group at Oregon State University, Students United For Palestinian Equal Rights (SUPER), faces calls to disinvite journalists Rania Khalek and Mnar Muhawesh from an event. However, an organizer says ""no outside forces will make [the group] reconsider the event. Their powerful voices are needed more than ever.""",Oregon State Student Group Stands Up For Arab Journalists Amidst Calls To Disinvite Them From Event,link,https://shadowproof.com/2017/03/28/student-group-stands-arab-journalists-calls-cancel-event-escalate/,2017-03-29 08:09:10,53,1,9,47,6,0,0,0,0
1624162894502220_1879425348975972,"Prisoners at Delaware's James T. Vaughn Correctional Center wrote an open letter to the warden and department of corrections, which includes a list of 22 demands.","Following Vaughn Rebellion, Prisoners Issue List Of Demands For Reforms",link,https://shadowproof.com/2017/03/28/vaughn-rebellion-list-of-demands-from-prisoners/,2017-03-28 18:44:24,9,1,1,8,1,0,0,0,0
1624162894502220_1878854442366396,The American Health Care Act has gone down in a blaze of glory. It is time to focus on what Trump has long said would be his plan B.,"Obamacare Is A Failure, But It Will Only 'Explode' If Trump Sabotages It",link,https://shadowproof.com/2017/03/27/obamacare-failure-will-explode-trump-sabotages/,2017-03-27 13:32:00,15,3,5,13,0,0,1,0,1
1624162894502220_1878848159033691,"Flynn was working for Turkey while also working for Donald Trump's presidential campaign, but failed to register at the time as an agent of a foreign power as required by law.",Flynn Scandal Draws Attention To Power Of Turkish Lobby,link,https://shadowproof.com/2017/03/27/flynn-scandal-draws-attention-turkish-lobby/,2017-03-27 12:13:32,9,0,4,7,0,0,1,0,1
1624162894502220_1878806642371176,"We're almost halfway to our $3,000 goal to fund reporting on health care policy & activism!

Can you chip in today to help us cross the finish line?",donate.shadowproof.com | Donate to fund real health care journalism,link,https://donate.shadowproof.com/page/contribute/health-care-journalism,2017-03-27 10:09:27,3,0,0,2,1,0,0,0,0
1624162894502220_1876903219228185,"Lawyer for Rasmea Odeh says she was a scapegoat and victim of an FBI counterintelligence effort against Palestinian solidarity activists, which failed to put together any cases against people raided in 2010.","In Political Prosecution, Palestinian American Organizer Accepts Plea Deal, Will Be Deported",link,https://shadowproof.com/2017/03/24/political-prosecution-palestinian-american-organizer-accepts-plea-deal-will-deported/,2017-03-24 14:22:25,8,0,2,3,0,0,0,2,3
1624162894502220_1876291742622666,Kevin Gosztola spoke to Center for Constitutional Rights attorney Wells Dixon about Supreme Court nominee Neil Gorsuch. Dixon has represented Guantanamo detainees.,Neil Gorsuch And His Past Hostility Against Guantanamo Lawyers,link,https://shadowproof.com/2017/03/23/neil-gorsuch-past-hostility-guantanamo-lawyers/,2017-03-23 20:28:37,13,0,3,8,0,0,0,0,5
1624162894502220_1875779306007243,"Cancellations or disinvitations can amount to easily winnable victories, but they come at the cost of freedom of expression on a college or university campus.",When Small Groups Of People Shut Down Controversial Speakers On Campuses,link,https://shadowproof.com/2017/03/22/small-groups-people-shut-controversial-speakers-campuses/,2017-03-22 20:14:49,16,0,5,15,0,0,0,1,0
1624162894502220_1875674976017676,"A recent report that labeled Israel an ""apartheid regime"" ultimately led to a resignation at the United Nations after it was denounced by Israel and the United States.",Israel's Apartheid Status Puts United States In Tenuous Position,link,https://shadowproof.com/2017/03/22/israels-apartheid-status-puts-united-states-tenuous-position/,2017-03-22 14:33:14,15,1,5,12,0,0,0,2,1
1624162894502220_1875652106019963,"How many more rounds of tinkering with for-profit healthcare will Americans endure before the United States adopts a system that covers everyone, like other countries?","At This Rate, We'll All Be Dead Before Our Country Truly Fixes Health Care",link,https://shadowproof.com/2017/03/22/rate-well-dead-country-truly-fixes-healthcare/,2017-03-22 13:39:58,19,0,5,16,0,0,0,3,0
1624162894502220_1875022949416212,"The Child Safety Coalition assessed Colorado youth detention and found evidence of even more intense brutality, despite investigations into conduct in 2014 and prior efforts at reform.",Culture Of Violence Intensifies In Colorado Youth Detention Facilities Despite Reforms,link,https://shadowproof.com/2017/03/21/culture-of-violence-colorado-youth-detention/,2017-03-21 12:54:38,11,0,3,7,0,0,0,3,1
1624162894502220_1874601059458401,"FBI Director Comey confirmed the bureau was investigating claims that there had been collusion between Donald Trump's presidential campaign and Russian intelligence services, but he would not go into further detail and state whether the FBI had found evidence.",Russia Conspiracy Mongering Hits Wall At Congressional Hearing,link,https://shadowproof.com/2017/03/20/russia-conspiracy-mongering-hits-wall-congressional-hearing/,2017-03-20 16:30:05,17,4,3,14,0,1,2,0,0
1624162894502220_1874452479473259,Jailed activist Marty Gottesfeld pens another letter from prison. This one is a follow-up to a prior letter on punitive mental health treatment at the Plymouth County Correctional Facility.,Multiple Alleged Suicide Attempts At Plymouth County Correctional Facility In Massachusetts,link,https://shadowproof.com/2017/03/20/multiple-alleged-suicide-attempts-at-plymouth-county-correctional-facility-in-massachusetts/,2017-03-20 11:35:07,9,0,4,6,0,0,0,2,1
1624162894502220_1872436129674894,"State legislation expands the definition of ""domestic terrorism"" and uses undefined language that could be turned against communities, which have been mobilizing against President Donald Trump.",Georgia 'Domestic Terrorism' Bill Would Likely Fuel Criminalization Of Muslim And Immigrant Rights Protesters,link,https://shadowproof.com/2017/03/16/georgia-domestic-terrorism-bill-would-likely-fuel-criminalization-of-muslim-and-immigrant-rights-protesters/,2017-03-16 18:10:08,9,1,3,5,0,2,0,0,2
1624162894502220_1872361529682354,"Shadowproof is asking for your help to give a platform to talented and fearless journalists, who will bring a different view and expertise to the issues facing America and beyond.",Sick Of Media Groupthink? Support Independent Media,link,https://shadowproof.com/2017/03/16/sick-media-groupthink-support-independent-media/,2017-03-16 14:32:04,12,1,2,11,1,0,0,0,0
1624162894502220_1871804956404678,The extent to which the Clinton campaign was connected to the Russian government has yet to be fully investigated.,Hillary Clinton Campaign Was Connected To Russian Government,link,https://shadowproof.com/2017/03/15/hillary-clinton-campaign-connected-russian-government/,2017-03-15 13:00:23,55,7,25,42,0,4,8,0,1
1624162894502220_1870921279826379,"Jeremy Gong of the East Bay Democratic Socialists of America describes the fight for single-payer health care as an opportunity for the Left to ""unify and bring millions of people newly politicized in the Trump era into militant organizations and coalitions.""",Activists Mobilize For Universal Health Care As Republicans Propose Limiting Coverage,link,https://shadowproof.com/2017/03/13/single-payer-advocates-demand-universal-health-care-republicans-propose-limiting-coverage-obamacare-trumpcare-ryancare/,2017-03-13 17:13:09,17,1,14,16,1,0,0,0,0
1624162894502220_1870872193164621,"Despite over 15 years of support, the government in Kabul currently controls only 63% of the country.",Perpetual War For Perpetual Peace In Afghanistan,link,https://shadowproof.com/2017/03/13/perpetual-war-afghanistan-no-end-sight/,2017-03-13 14:55:40,9,0,3,5,0,0,0,0,4
1624162894502220_1870816073170233,Want to ensure we can fund important freelance and independent journalism for the next few months? Donate $10 to support our work!,Donate to Shadowproof,link,https://donate.shadowproof.com/page/contribute/sp-donate?source=em,2017-03-13 12:08:20,5,0,1,4,1,0,0,0,0
1624162894502220_1869448283307012,"Despite campaign rhetoric against ""dumb wars,"" President Donald Trump is doubling down on military intervention in the Middle East.","Despite Campaign Promises, Trump Wades Further Into Middle East",link,https://shadowproof.com/2017/03/10/despite-campaign-promises-trump-wades-middle-east/,2017-03-10 15:42:37,15,2,5,9,0,0,0,2,4
1624162894502220_1869439819974525,"It may serve short term political interests to cast the Vaughn prison uprising as an isolated incident, which can be resolved by hiring more officers and increasing security. But in the long run, it is a counterproductive strategy that could make prisoners and staff less safe.",Prisoner Demands Remain Ignored In Weeks After Vaughn Rebellion,link,https://shadowproof.com/2017/03/10/prisoner-demands-remain-ignored-weeks-vaughn-rebellion/,2017-03-10 15:09:34,9,0,0,8,0,1,0,0,0
1624162894502220_1868935733358267,"""Am I optimistic about the long term? No, but that doesn't mean we should stop fighting,"" one activist told Shadowproof. ""If not for ourselves, then for the next generation.""",Activists Describe Efforts To Stop Atlantic Sunrise Gas Pipeline In Pennsylvania,link,https://shadowproof.com/2017/03/09/activists-organizers-share-efforts-stop-atlantic-sunrise-gas-project/,2017-03-09 13:03:17,13,1,1,12,1,0,0,0,0
1624162894502220_1868560870062420,The CIA is once again facing questions about its cyber activities,"Wikileaks: CIA Hacking Phones, TVs, Cars, And Using False Flag Attacks",link,https://shadowproof.com/2017/03/08/wikileaks-reveals-cia-hacking-iphones-tvs-using-false-flag-attacks/,2017-03-08 17:12:44,32,1,10,27,0,1,0,0,4
1624162894502220_1868545336730640,"After having seven years to work on a repeal and replace plan, House Speaker Paul Ryan finally released his bill. For all practical purposes, it is Obamacare, just 35 percent shittier.",Ryancare Is Just A Shittier Version Of Obamacare,link,https://shadowproof.com/2017/03/08/ryancare-just-shittier-version-obamacare/,2017-03-08 16:25:26,46,5,24,35,0,0,6,1,4
1624162894502220_1867727726812401,Journalist Antony Loewenstein explains how multinational corporations exploit disasters for profit on the latest episode of Around The Empire,Around The Empire – Episode 10: Disaster Capitalism And The Empire Feat. Antony Loewenstein,link,https://shadowproof.com/2017/03/07/around-empire-episode-10-disaster-capitalism-empire-feat-antony-lowenstein/,2017-03-07 13:11:49,12,2,5,12,0,0,0,0,0
1624162894502220_1867360723515768,"The statement, signed by Glenn Greenwald, Noam Chomsky, Colonel Ann Wright, Medea Benjamin, and many others, states the cancellation of Khalek's lecture at UNC ""raises important issues of tactics and strategy within movements for social change.""","Writers, Activists Issue Statement Against Blacklisting In Solidarity With Journalist Rania Khalek",link,https://shadowproof.com/2017/03/06/writers-activists-issue-statement-blacklisting-solidarity-journalist-rania-khalek/,2017-03-06 16:07:19,49,4,13,45,4,0,0,0,0
1624162894502220_1867302093521631,New report shows Obama Administration launched cyberweapons at North Korea.,Stuxnet Goes To North Korea,link,https://shadowproof.com/2017/03/06/stuxnet-goes-north-korea/,2017-03-06 13:26:35,9,3,9,7,0,0,0,0,2
1624162894502220_1865827313669109,"After receiving a 90 day punishment for their brief appearance on the Netflix show, ""Captive,"" Ohio prisoners Siddique Abdullah Hasan and Jason Robb have initiated a hunger strike.","Ohio Prisoners Begin Hunger Strike Following Punishment For Appearing On Netflix Show, ""Captive""",link,https://shadowproof.com/2017/03/03/ohio-prisoners-begin-hunger-strike-punishment-participation-netflixs-captive/,2017-03-03 10:51:11,11,4,10,10,0,0,0,0,1
1624162894502220_1865503830368124,"We're funded by our readers—not corporate sponsors, institutions, or mega donors.

For $5/month, you can help keep us online, pay our writers, and be a part of our movement to produce journalism in the public's interest.

Please support this month's fundraiser by becoming a member. We'll send you a tote bag as a thank you gift!",Become A Shadowproof Member,link,https://donate.shadowproof.com/page/contribute/membership,2017-03-02 17:23:24,6,3,2,5,1,0,0,0,0
1624162894502220_1865426337042540,"The Obama Administration began a concerted effort to shovel raw intelligence files about Team Trump's connections with Russia throughout the government, even lowering clearances to see the information.",Obama Administration Worked To Fuel Trump-Russia Conspiracy Theory,link,https://shadowproof.com/2017/03/02/obama-admin-worked-to-fuel-trump-russia-conspiracy-theory/,2017-03-02 14:33:00,21,7,4,15,1,1,1,0,3
1624162894502220_1865406917044482,"The way forward isn't more campaigns drawing on cases of immigrants serving the needs of Americans, but a strategy that demands we recognize people as they come.",Immigrant Solidarity Requires Valuing Life Above Labor,link,https://shadowproof.com/2017/03/02/immigrant-solidarity-requires-valuing-life-labor/,2017-03-02 12:19:47,13,3,6,13,0,0,0,0,0
1624162894502220_1865045570413950,"The relentless focus on the reality TV president's White House misses countless issues facing citizens, particularly those in marginalized communities, which deserve our regular attention.",Making The Best Of A Trump Situation,link,https://shadowproof.com/2017/03/01/making-best-trump-situation/,2017-03-01 12:59:41,5,2,1,4,0,0,0,1,0
1624162894502220_1864664600452047,The increase would bring the annual appropriation for the Department of Defense to $603 billion.,"Trump Calls For $54 Billion More In Defense Spending, Cuts Elsewhere",link,https://shadowproof.com/2017/02/28/trump-calls-54-billion-defense-spending-cuts-elsewhere/,2017-02-28 14:35:38,7,2,2,1,0,0,0,1,5
1624162894502220_1864359073815933,"A faction of individuals employed pressure in the same way that pro-Israel students and groups typically employ pressure to shut down pro-Palestine events, which they perceive to be unjustifiably against Israel. They did this to silence journalist Rania Khalek.",Advocates For Syrian Rebels Convince Student Group To Cancel Event With Journalist Rania Khalek,link,https://shadowproof.com/2017/02/27/advocates-syrian-rebels-convince-student-group-cancel-event-journalist-rania-khalek/,2017-02-27 21:08:18,16,2,5,12,0,0,0,0,4
1624162894502220_1863469680571539,Establishment Democrats elected Tom Perez to chair the DNC and blocked a ban on contributions from corporate lobbyists from coming up for a vote.,"With Perez Elected DNC Chair, Establishment Democrats Stifle Grassroots Pressure To Transform Party",link,https://shadowproof.com/2017/02/25/perez-elected-dnc-chair-clinton-democrats-stifle-grassroots-pressure-transform-party/,2017-02-25 22:11:04,62,10,42,25,0,1,8,1,27
1624162894502220_1863001197285054,"As objectionable as the Trump White House's media attacks are, the culture of journalism in the United States may greatly improve if CNN and other outlets take this opportunity to move away from access journalism.",Let Trump Ban Establishment Media And Strike Deadly Blow Against Access Journalism,link,https://shadowproof.com/2017/02/24/let-trump-ban-establishment-media-outlets-kill-access-journalism/,2017-02-24 19:13:43,31,4,13,26,3,0,0,1,1
1624162894502220_1862889107296263,A new alliance may be giving the CIA and the Trump Administration second thoughts about funneling more arms to the FSA.,Pause In CIA Arms Program Has Syrian Rebels Worried,link,https://shadowproof.com/2017/02/24/pause-cia-arms-program-syrian-rebels-worried/,2017-02-24 13:14:41,11,4,9,9,0,2,0,0,0
1624162894502220_1862518257333348,"Roqayah Chamseddine and Kevin Gosztola examine the Trump administration's treatment of Islam as a ""political ideology"" and consider what it means for millions of American Muslims.","Trump Administration Largely Treats Islam As 'Political Ideology,' Which Carries Profound Implications",link,https://shadowproof.com/2017/02/23/trump-administration-largely-treats-islam-political-ideology-carries-profound-implications/,2017-02-23 15:18:31,11,1,4,7,0,0,0,1,3
1624162894502220_1862236810694826,President Donald Trump's administration informed a federal court that it plans to invoke the state secrets privilege to prevent two CIA witnesses from testifying on the role of psychologists in developing and administering the CIA torture program.,Trump Administration Plans To Invoke State Secrets In Case Against Psychologists Behind CIA Torture Program,link,https://shadowproof.com/2017/02/22/trump-administration-moves-invoke-state-secrets-case-psychologists-behind-cia-torture-program/,2017-02-22 20:06:33,20,2,7,8,0,3,0,0,9
1624162894502220_1862197330698774,"On this episode of Around The Empire, Dan and Joanne interview journalist Kenneth Lipp about the sprawling national security and incarceration state President Donald Trump inherited when he took office.",Around The Empire – Episode 9: The Surveillance State Trump Inherited Feat. Ken Lipp,link,https://shadowproof.com/2017/02/22/around-empire-episode-9-surveillance-state-trump-inherited-feat-ken-lipp/,2017-02-22 18:30:00,13,2,2,12,1,0,0,0,0
1624162894502220_1862193564032484,"There is a very concerning strain of thought among some Republicans, Democrats and even liberals that everything should be means-tested as opposed to universally available.",It's Perfectly Fine If Rich Benefit From Universal Social Programs,link,https://shadowproof.com/2017/02/22/danger-billionaire-strawman-argument/,2017-02-22 16:49:53,10,1,4,6,1,1,0,0,2
1624162894502220_1861868124065028,"As militarized police forces prepare to raid the indigenous encampment at Standing Rock, a memo written by the top lawyer for the Interior Department thoroughly demonstrates how the Dakota Access Pipeline violates treaty rights of the Sioux and Cheyenne River tribes.",Interior Department Produced Memo On Dakota Access Pipeline That Trump Doesn't Want Public To Read,link,https://shadowproof.com/2017/02/21/interior-department-produced-memo-dakota-access-pipeline-trump-doesnt-want-public-read/,2017-02-21 20:59:26,58,1,178,40,0,3,0,5,10
1624162894502220_1861669587418215,"Filmmaker Josh Fox, well-known for his ""Gasland"" documentaries on fracking, says he was ""blacklisted"" by MSNBC in 2016 when he became Bernie Sanders surrogate. He gives a behind-the-scenes story of how Susan Sarandon recently helped him get around this ""blacklist.""",Filmmaker Josh Fox Says He Was 'Blacklisted' By MSNBC After Becoming Bernie Sanders Surrogate,link,https://shadowproof.com/2017/02/20/filmmaker-josh-fox-says-he-was-blacklisted-by-msnbc-after-became-bernie-sanders-surrogate/,2017-02-21 10:10:43,22,0,15,17,0,3,0,0,2
1624162894502220_1861435250774982,"Siddique Abdullah Hasan appeared in Netflix's ""Captive"" and faces disciplinary proceedings.","Ohio Prisoner May Face Punishment For Participating In Netflix Show, 'Captive'",link,https://shadowproof.com/2017/02/20/ohio-prisoner-punishment-netflix-captive/,2017-02-20 19:57:21,6,0,6,3,0,0,0,0,3
1624162894502220_1861366110781896,McCain's most pronounced gripe was that people in the United States and Europe were uninterested in waging aggressive warfare to maintain the neoliberal world order or Pax Americana.,John McCain Struggles To Defend Pax Americana In Munich,link,https://shadowproof.com/2017/02/20/john-mccain-struggles-defend-pax-americana/,2017-02-20 15:05:26,7,1,3,3,2,1,0,0,1
1624162894502220_1861345630783944,Actress Susan Sarandon stuck up for filmmaker Josh Fox and helped him get on MSNBC in a recent segment.,Filmmaker Josh Fox Says He Was 'Blacklisted' By MSNBC After Becoming Bernie Sanders Surrogate,link,https://shadowproof.com/2017/02/20/filmmaker-josh-fox-says-he-was-blacklisted-by-msnbc-after-became-bernie-sanders-surrogate/,2017-02-20 13:49:10,54,2,19,48,1,0,0,0,5
1624162894502220_1860416504210190,"A remixed version of Trump's weekly address, intended to subvert his message show the gap between his words and reality",Trumpspeak: Remixed Weekly Address For February 17,link,https://shadowproof.com/2017/02/18/trumpspeak-remixed-weekly-address-february-17/,2017-02-18 12:11:52,12,0,5,9,1,1,0,1,0
1624162894502220_1860042084247632,"Similar to President Trump, President Obama was pretty peeved and irritated by leaks. However, with Jeff Sessions as Attorney General and Trump's recent statements, it seems like Trump will be even more vindictive toward leakers—or whistleblowers—than his predecessor.",President Donald Trump's Vengeful Pledge To Pursue 'Low-Life Leakers',link,https://shadowproof.com/2017/02/17/president-donald-trumps-vengeful-pledge-to-pursue-low-life-leakers/,2017-02-17 17:07:48,9,1,4,3,0,1,0,1,4
1624162894502220_1859545290963978,"This is plainly unbelievable! These are Trump's plans for the rest of his first 100 days in office. When will the low-life leakers stop undermining the president? (Well, that's obviously not our problem 😃)",We Obtained Leaked Copy Of Trump's Plans For First 100 Days And It's Just Wow!,link,https://shadowproof.com/2017/02/16/obtained-leaked-copy-trumps-plans-first-100-days-just-wow/,2017-02-16 17:43:52,17,1,6,6,0,2,9,0,0
1624162894502220_1859081184343722,Attorneys Adam Crane and David Johnson sued private prison company CoreCivic and the for-profit phone and video visitation service Securus Technologies for recording and storing confidential communications between pretrial detainees and their attorneys.,"Securus And CoreCivic Sued For Recording, Storing, And Providing Attorney-Prisoner Communications To Law Enforcement",link,https://shadowproof.com/2017/02/15/securus-corecivic-sued-for-recording-attorney-prisoner-calls/,2017-02-15 19:51:21,5,1,6,3,0,1,0,0,1
1624162894502220_1858881267697047,"""The United States is still a colony. It's a colony without portfolio,"" Jacqueline Keeler declares, in confronting North Dakota's use of military force against indigenous people fighting the Dakota Access pipeline.",'United States Is Still A Colony': Interview With Jacqueline Keeler On Dakota Access Pipeline,link,https://shadowproof.com/2017/02/12/us-still-colony-dakota-access-pipeline-keeler/,2017-02-15 10:46:29,6,2,4,5,0,0,0,1,0
1624162894502220_1858659024385938,"Roqayah Chamseddine interviewed a special education teacher in California about Betsy DeVos, charter schools, corporate education reform, and more.",'They Deserve So Much': Special Education Teacher On What DeVos Means For Students,link,https://shadowproof.com/2017/02/14/special-education-teacher-devos-students/,2017-02-14 19:37:07,6,3,5,4,0,0,0,1,1
1624162894502220_1858577967727377,"Flynn had many enemies within the deep state, including those in a position to leak information to the press to take him down.",Deep State Leak Campaign Brings Down National Security Advisor Michael Flynn,link,https://shadowproof.com/2017/02/14/deep-state-leak-campaign-brings-down-nsa-flynn/,2017-02-14 14:27:28,9,3,8,7,0,1,1,0,0
1624162894502220_1858224391096068,Subverting the words of President Trump's weekly address with images of reality for people in America,Video: 'Trumpspeak'—Juxtaposing President's Words With Images Of Reality,link,https://shadowproof.com/2017/02/13/video-trumpspeak-series/,2017-02-13 19:54:05,5,1,2,4,0,1,0,0,0
