status_id,status_message,link_name,status_type,status_link,status_published,num_reactions,num_comments,num_shares,num_likes,num_loves,num_wows,num_hahas,num_sads,num_angrys
163201283712008_1490138467684943,"Today's A.F. Branco Cartoon - 3/31/2017
*Statue Of Lunacy*",A.F. Branco Cartoon - Statue Of Lunacy,link,http://comicallyincorrect.com/2017/03/31/statue-of-lunacy/,2017-03-31 09:35:22,483,25,302,380,16,5,40,25,17
163201283712008_1489091207789669,Today's A.F. Branco Cartoon - 3/30/2017,A.F. Branco Cartoon - Saving the Middle Class,link,http://comicallyincorrect.com/2017/03/30/middle-class/,2017-03-30 10:17:24,558,39,400,446,21,5,46,8,32
163201283712008_1488112571220866,Today's A.F. Branco Cartoon - 3/29/2017,A.F.Branco Cartoon - Full Steam Ahead,link,http://comicallyincorrect.com/2017/03/29/full-steam-ahead/,2017-03-29 09:14:23,374,13,221,256,39,2,77,0,0
163201283712008_1487461741285949,Today's A.F. Branco Cartoon 3/28/2017,A.F. Branco Cartoon - Repeal and Repaste,link,http://comicallyincorrect.com/2017/03/28/repeal-and-repaste/,2017-03-28 16:02:52,265,15,125,201,11,5,40,5,3
163201283712008_1486154404750016,Today's A.F. Branco Cartoon - 3/27/2017,A.F. Branco Cartoon - Collateral Damage,link,http://comicallyincorrect.com/2017/03/27/gop-collateral-damage/,2017-03-27 10:50:00,323,39,184,216,6,3,60,31,7
163201283712008_1480294888669301,On a short Vacation - Be back Monday 27th,On a Mini Vacation | A.F. Branco | Political Cartoons,link,http://comicallyincorrect.com/2017/03/22/mini-vacation/,2017-03-22 09:34:36,315,41,25,276,30,2,5,2,0
163201283712008_1479283265437130,Today's A.F. Branco Cartoon - 3/21/2017,A.F. Branco Cartoon - Head Games,link,http://comicallyincorrect.com/2017/03/21/head-games/,2017-03-21 11:40:47,407,20,216,299,17,3,83,3,2
163201283712008_1478252698873520,Today's A.F. Branco Catoon - 3/20/2017,A.F. Branco Cartoon - Whachamacallit,link,http://comicallyincorrect.com/2017/03/20/whatchamacallit/,2017-03-20 09:40:40,206,15,98,140,7,2,53,0,4
163201283712008_1475278265837630,Today's A.F. Branco Cartoon -3/17/2017,A.F. Branco Cartoon - Up In Smoke,link,http://comicallyincorrect.com/2017/03/17/who-dealt-it/,2017-03-17 09:49:50,352,9,223,233,17,4,97,0,1
163201283712008_1474246179274172,Today's A.F. Branco Cartoon - 3/16/2017,A.F. Branco Cartoon - Breaking News,link,http://comicallyincorrect.com/2017/03/16/breaking-news/,2017-03-16 09:34:08,836,38,521,430,27,0,378,0,1
163201283712008_1473308586034598,Today's A.F. branco cartoon 3/15/2017,A.F. Branco Cartoon - Exposed,link,http://comicallyincorrect.com/2017/03/15/exposed/,2017-03-15 09:54:08,344,16,221,243,4,9,35,33,20
163201283712008_1472324706132986,Today's A.F. Branco Cartoon - 3/14/2017,A.F. Branco Cartoon - Beast of Burden,link,http://comicallyincorrect.com/2017/03/14/beast-of-burden/,2017-03-14 10:09:35,699,18,414,517,44,2,132,1,3
163201283712008_1471449532887170,Today's A.F. Branco Cartoon 3/13/2017,A.F. Branco Cartoon - Repair and Extend,link,http://comicallyincorrect.com/2017/03/13/repair-extend-ryancare/,2017-03-13 11:16:51,411,28,279,278,11,5,100,7,10
163201283712008_1467324203299703,"Today's A.F. Branco Cartoon - 3/10/2017
*The Fix Is In* (Ryancare)",A.F. Branco Cartoon - The Fix Is In (Ryancare),link,http://comicallyincorrect.com/2017/03/10/the-fix-is-in/,2017-03-10 11:35:59,414,22,268,297,11,9,70,6,21
163201283712008_1465689453463178,Today's A.F. Branco Cartoon - 3/09/2017,A.F. Branco Cartoon - Welcome Mat,link,http://comicallyincorrect.com/2017/03/09/the-welcome-mat/,2017-03-09 11:28:47,741,49,618,537,18,15,108,41,22
163201283712008_1463486740350116,Today's A.F. Branco Cartoon - 3/08/2017,A.F. Branco Cartoon - The Shadow Knows,link,http://comicallyincorrect.com/2017/03/08/the-shadow-knows/,2017-03-08 10:08:18,496,34,340,344,9,13,48,8,74
163201283712008_1462196563812467,Today's A.F. Branco Cartoon - 3/07/2017,A.F. Branco Cartoon - Open Season,link,http://comicallyincorrect.com/2017/03/07/open-season/,2017-03-07 11:57:28,622,52,491,427,11,7,128,35,14
163201283712008_1460881047277352,Today's A.F. Branco Cartoon 3/06/2017,A.F. Branco Cartoon - Spying vs Spying,link,http://comicallyincorrect.com/2017/03/06/spying-vs-spying/,2017-03-06 10:32:51,415,20,304,297,18,4,92,1,3
163201283712008_1459778754054248,A.F. Branco ((( Weekend Past Blast Cartoon ))) O-Wellian,A.F. Branco Cartoon - O-wellian,link,http://comicallyincorrect.com/2017/03/05/o-wellian/,2017-03-05 12:50:09,556,21,405,441,15,22,57,4,17
163201283712008_1458754307490026,Did Obama wiretap Trump? This 2013 Cartoon my shed some light,A.F. Branco Cartoon - Big Ears On Trump,link,http://comicallyincorrect.com/2017/03/04/big-ears-on-trump/,2017-03-04 15:45:45,547,22,274,398,14,32,93,0,10
163201283712008_1457430587622398,"Today's A.F. Branco Cartoon - 3/03/2017
* Moore Hate From The Left *",A.F. Branco Cartoon - Moore Hate,link,http://comicallyincorrect.com/2017/03/03/moore-hate-left/,2017-03-03 10:36:15,829,78,660,551,10,19,60,41,148
163201283712008_1456383607727096,Today's A.F. Branco Cartoon 3/02/2017,A.F. Branco Cartoon - Sweet Dreams,link,http://comicallyincorrect.com/2017/03/02/sweet-dreams/,2017-03-02 11:38:15,425,22,211,277,37,0,111,0,0
163201283712008_1455347971163993,Today's A.F. Branco Cartoon 3/01/2017,A.F. Branco Cartoon - Fear Itself,link,http://comicallyincorrect.com/2017/03/01/fear-itself/,2017-03-01 10:09:53,549,38,305,409,41,1,92,4,2
163201283712008_1454310727934384,Today's A.F. Branco Cartoon - 2/28/2017,A.F. Branco Cartoon - Trash Talkin',link,http://comicallyincorrect.com/2017/02/28/trash-talkin/,2017-02-28 12:42:52,872,45,957,619,14,12,145,24,58
163201283712008_1453008618064595,Today's A.F. Branco Cartoon -2/27/2017,A.F. Branco Cartoon - Showing Their Ass,link,http://comicallyincorrect.com/2017/02/27/showing-their-ass/,2017-02-27 11:21:59,450,25,213,287,27,2,129,3,2
163201283712008_1452027608162696,A.F. Branco ((( Past Blast ))) Cartoon,A.F. Branco Cartoon - Merger Complete,link,http://comicallyincorrect.com/2017/02/26/merger-complete/,2017-02-26 13:24:21,507,18,281,366,18,7,114,1,1
163201283712008_1449464981752292,"Today's A.F. Branco Cartoon - 2/24/2017
*** Unmanned ***",A.F. Branco Cartoon - Unmanned,link,http://comicallyincorrect.com/2017/02/24/unmanned/,2017-02-24 10:50:27,476,28,321,296,14,7,151,0,8
163201283712008_1448364198529037,Today's A.F. Branco Cartoon 2/23/2017,A.F. Branco Cartoon - Free At Last,link,http://comicallyincorrect.com/2017/02/23/freedom-fighters/,2017-02-23 11:27:54,712,29,437,593,102,4,12,0,1
163201283712008_1447173648648092,"Today's A.F. Branco Cartoon - 2/22/2017
*** Third Rate Romance ***",A.F. Branco Cartoon - Third Rate Romance,link,http://comicallyincorrect.com/2017/02/22/third-rate-romance/,2017-02-22 10:33:46,405,22,277,266,9,6,91,4,29
163201283712008_1446010458764411,Today's A.F. Branco Cartoon - 2/21/2017,A.F. Branco Cartoon - How Does Your Garden Grow,link,http://comicallyincorrect.com/2017/02/21/how-does-you-garden-grow/,2017-02-21 11:20:40,383,18,250,294,39,5,34,1,10
163201283712008_1444757468889710,Today's A.F. Branco Cartoon - 2/20/2017,A.F. Branco Cartoon - What Chaos?,link,http://comicallyincorrect.com/2017/02/20/what-chaos/,2017-02-20 12:44:42,883,38,495,546,69,2,266,0,0
163201283712008_1440540975978026,Today's A.F. Branco Cartoon - 2/17/2017,A.F. Branco Cartoon - The Main Course,link,http://comicallyincorrect.com/2017/02/17/the-main-course/,2017-02-17 11:02:52,1381,71,4723,726,86,5,562,1,1
163201283712008_1439278126104311,Today's A.F. Branco Cartoon - 2/16/2017,A.F. Branco Cartoon - Friends For Real,link,http://comicallyincorrect.com/2017/02/16/trump-and-netanyahu/,2017-02-16 13:06:03,611,21,280,475,129,4,1,1,1
163201283712008_1437772122921578,Today's A.F. Branco Cartoon 2/15/2017,A.F. Branco Cartoon - Does Size matter?,link,http://comicallyincorrect.com/2017/02/15/does-size-matter/,2017-02-15 10:00:38,1055,40,1607,745,78,4,223,1,4
163201283712008_1436881149677342,Today's A.F. Branco Cartoon - 2/17/2017,A.F. Branco Cartoon - Glass Warfare,link,http://comicallyincorrect.com/2017/02/14/glass-warfare/,2017-02-14 11:45:36,744,32,442,433,26,1,283,0,1
163201283712008_1435891316442992,Today's A.F. Branco Cartoon - 2/12/2017,A.F. Branco Cartoon - Enemy Within,link,http://comicallyincorrect.com/2017/02/13/enemy-within/,2017-02-13 11:09:02,644,29,765,513,22,9,16,18,66
163201283712008_1434957643203026,True today as ever,Politics Run-A-Fowl,link,http://comicallyincorrect.com/2015/12/09/homeland-security-politics/,2017-02-12 11:36:39,718,26,843,505,31,6,168,4,4
163201283712008_1433034303395360,Today's A.F. Branco Cartoon - 2/10/2017,A.F. Branco Cartoon - The Nutty 9th,link,http://comicallyincorrect.com/2017/02/10/the-nutty-9th/,2017-02-10 11:31:45,587,52,483,398,14,5,15,31,124
163201283712008_1432099846822139,Today's A.F. Branco Cartoon 2/09/2017,A.F. Branco Cartoon - Aiding and Abetting,link,http://comicallyincorrect.com/2017/02/09/aiding-and-abetting/,2017-02-09 11:25:47,572,20,626,441,15,10,33,10,63
163201283712008_1431017306930393,"Today's A.F. Branco Cartoon - 2/08/2017
((( Oath Keeper )))",A.F. Branco Cartoon - Oath Keeper,link,http://comicallyincorrect.com/2017/02/08/oath-keeper/,2017-02-08 10:18:39,818,26,601,643,77,2,90,4,2
163201283712008_1430141387017985,"Today's A.F. Branco Cartoon - 2/07/2017
 "" Hate Trumps Free Speech """,A.F. Branco Cartoon - Hate Trumps Free Speech,link,http://comicallyincorrect.com/2017/02/07/hate-trumps-free-speech/,2017-02-07 12:21:21,610,26,425,464,10,13,5,47,71
163201283712008_1429015907130533,Today's A.F. Branco Cartoon - 2/06/2017,A.F. Branco Cartoon - American Graffiti,link,http://comicallyincorrect.com/2017/02/06/american-graffiti/,2017-02-06 13:11:51,338,20,200,241,9,3,6,25,54
163201283712008_1425406507491473,"Today's A.F. Branco Cartoon - 2/03/2017
 * The Tears of a Clown *",A.F. Branco Cartoon - The Tears of a Clown,link,http://comicallyincorrect.com/2017/02/03/the-tears-of-a-clown/,2017-02-03 10:37:03,970,46,1026,538,33,2,393,2,2
163201283712008_1424287404270050,Today's A.F. Branco Cartoon - 2/02/2017,A.F. Branco Cartoon - Guardian Angel,link,http://comicallyincorrect.com/2017/02/02/blessings-from-above/,2017-02-02 11:24:43,763,25,424,620,131,3,9,0,0
163201283712008_1422996561065801,Today's A.F. Branco Cartoon - 2/01/2017,A.F.Branco Cartoon - Lie Detector,link,http://comicallyincorrect.com/2017/02/01/lie-detector/,2017-02-01 11:01:37,702,19,564,541,42,4,97,6,12
163201283712008_1421682107863913,Today's A.F. Branco Cartoon - 1/31/2017,A.F. Branco Cartoon - Radical Ban Saw,link,http://comicallyincorrect.com/2017/01/31/radical-muslim-ban/,2017-01-31 13:19:48,447,24,228,368,55,2,21,0,1
163201283712008_1420267668005357,Today's A.F. Branco Cartoon - 1/30/2017,A.F. Branco Cartoon - Fear No Evil,link,http://comicallyincorrect.com/2017/01/30/march-on-washington/,2017-01-30 14:16:25,507,24,299,397,25,4,61,16,4
163201283712008_1415861168446007,"BIG REQUEST!
My friend Joe Dan Gorman, the creator and sole proprietor of Inellectual Froglegs needs your your prayers and monitary support if you can afford it. He is in a lot of pain and is in dire need of medical attention. Please help help him out by sending a donation. He needs about $8,000. THANK YOU!!!.. ~A.F. Branco",Evolution of a Revolution - It's Intellectual Froglegs,link,https://intellectualfroglegs.com/revolution/,2017-01-27 19:11:54,54,5,17,45,2,0,0,7,0
163201283712008_1415320141833443,Today's A.F. branco Cartoon - 1/27/2017,"A.F. Branco Cartoon - The Energizer, Keeps Going",link,http://comicallyincorrect.com/2017/01/27/energizer-keeps-going-going/,2017-01-27 11:18:51,628,32,361,435,78,4,111,0,0
163201283712008_1412336708798453,Today's A.F. Branco Cartoon - 1/25/2017,A.F. Branco Cartoon - Info Wars,link,http://comicallyincorrect.com/2017/01/25/info-war/,2017-01-25 11:08:51,658,25,388,453,62,1,142,0,0
163201283712008_1410875508944573,Today's A.F. Branco Cartoon - 1/24/2017,A.F. Branco Cartoon - Feel The hate,link,http://comicallyincorrect.com/2017/01/24/feel-the-hate/,2017-01-24 12:14:36,600,30,365,444,35,3,100,10,8
163201283712008_1409288815769909,Today's A.F. Branco Cartoon - 1/23/2017,A.F. Branco Cartoon - Blinded By The Dark,link,http://comicallyincorrect.com/2017/01/23/blinded-by-the-dark/,2017-01-23 12:10:10,755,41,417,492,38,2,218,1,4
163201283712008_1406944322671025,Sad Sore Losers,A.F. Branco Cartoon - Sad Sore Losers,link,http://comicallyincorrect.com/2017/01/21/inauguration-protest/,2017-01-21 13:01:25,774,31,492,531,22,9,180,12,20
163201283712008_1406166662748791,Today's A.F. Branco Cartoon - A New Day 1/20/2017,A.F. Branco Cartoon - A New Day!,link,http://comicallyincorrect.com/2017/01/20/inauguration-day-2017/,2017-01-20 19:05:42,515,19,216,407,75,3,29,0,1
163201283712008_1404952682870189,Today's A.F. Branco Cartoon 1/19/2017,A.F. Branco Cartoon - Obexit,link,http://comicallyincorrect.com/2017/01/19/obexit/,2017-01-19 12:10:59,353,17,261,254,4,1,23,7,64
163201283712008_1403572849674839,Today's A.F. Branco Cartoon 1/18/2017,A.F. Branco Cartoon - Show Some R-E-S-P-E-C-T,link,http://comicallyincorrect.com/2017/01/18/show-r-e-s-p-e-c-t/,2017-01-18 10:26:08,707,50,533,531,31,4,121,5,15
163201283712008_1402754143090043,Today's A.F. Branco Cartoon 1/17/2017,A.F. Branco Cartoon - Going Rouge,link,http://comicallyincorrect.com/2017/01/17/undercover/,2017-01-17 13:36:59,243,17,139,178,5,9,41,4,6
163201283712008_1402022353163222,"John Lewis Is A Stain on MLK Day
((( Past Blast cartoon 2014 )))","A.F. Branco Cartoon _ John Lewis, Is A Stain On MLK Day",link,http://comicallyincorrect.com/2017/01/16/john-lewis-stain-mlk-day/,2017-01-16 18:05:23,374,22,171,310,18,15,6,18,7
163201283712008_1401740773191380,Today's A.F. Branco Cartoon 1/16/2017,A.F. Branco Cartoon - Obomber,link,http://comicallyincorrect.com/2017/01/16/obomber/,2017-01-16 11:32:25,476,24,365,328,7,11,96,8,26
163201283712008_1398521370179987,Today's A.F. Branco Cartoon - 1/13/2017,A.F. Branco Cartoon - Whine Country,link,http://comicallyincorrect.com/2017/01/13/whine-country/,2017-01-13 11:51:12,897,37,564,519,51,1,326,0,0
163201283712008_1397467383618719,Today's A.F. Branco Cartoon - 1/12/2017,A.F. Branco Cartoon - Media Schooled,link,http://comicallyincorrect.com/2017/01/12/trump-media-school/,2017-01-12 11:10:06,973,43,986,603,85,4,281,0,0
163201283712008_1396494900382634,Trump just slayed the media today,Trump Blasts The Media | Political Cartoon | A.F.Branco,link,http://comicallyincorrect.com/2016/06/03/trump-blasts-the-media/,2017-01-11 15:05:27,897,85,466,570,124,3,200,0,0
163201283712008_1396296663735791,Today's A.F. Branco Cartoon - 1/11/2017,A.F. Branco Cartoon - Incredible Sinking Feeling,link,http://comicallyincorrect.com/2017/01/11/that-sinking-feeling/,2017-01-11 11:17:25,289,12,153,216,15,0,58,0,0
163201283712008_1395649710467153,Today's Branco Cartoon - Obstructionist - 1/10/2017,A.F. Branco Cartoon - Obstructionist,link,http://comicallyincorrect.com/2017/01/10/obstructionist-2/,2017-01-10 18:33:31,177,9,79,136,6,1,32,1,1
163201283712008_1394286680603456,Today's A.F. Branco Cartoon - 1/09/2017,A.F. Branco Cartoon - Obamacare Doesn't Care,link,http://comicallyincorrect.com/2017/01/09/obamacare-doesnt-care/,2017-01-09 12:05:01,378,22,243,296,8,2,67,1,4
163201283712008_1391192514246206,"Today's Branco Cartoon - Make War, Not Love 1/06/2017","A.F. Branco Cartoon - Make War, Not Love",link,http://comicallyincorrect.com/2017/01/06/make-war-not-love/,2017-01-06 12:39:31,838,33,1213,648,39,8,115,9,19
163201283712008_1390154287683362,Today's A.F. Branco Cartoon - 1/05/2017,A.F. Branco Cartoon - Dog On It,link,http://comicallyincorrect.com/2017/01/05/dog-on-it/,2017-01-05 11:07:16,249,15,143,143,6,1,97,1,1
163201283712008_1389179071114217,Today's A.F. Branco Cartoon 1/04/2017,A.F. Branco Cartoon - Biding His Time,link,http://comicallyincorrect.com/2017/01/04/biding-his-time/,2017-01-04 11:08:42,363,28,223,225,9,1,128,0,0
163201283712008_1388280421204082,Today's A.F. Branco Cartoon - 1/03/2017,A.F. Branco Cartoon - Presidential Trash-sition,link,http://comicallyincorrect.com/2017/01/03/presidential-trash-sition/,2017-01-03 12:26:39,651,30,562,419,11,8,168,9,36
163201283712008_1386820861350038,Please vote!!! No ID required,Best A.F. Branco Cartoon of 2016 (Reader Poll),link,http://legalinsurrection.com/2017/01/best-a-f-branco-cartoons-of-2016-reader-poll/#comments,2017-01-01 23:53:41,130,31,21,117,8,0,5,0,0
163201283712008_1386502488048542,New Years Past Blast!,Obama On New year's | A.F.Branco | Political Cartoon,link,http://comicallyincorrect.com/2015/01/01/obama-on-new-years/,2017-01-01 15:53:59,195,7,75,152,2,3,26,7,5
163201283712008_1384205308278260,"Today's A.F. Branco Cartoon - 12/30/2016
******* HAPPY NEW YEAR! ********",A.F. Branco Cartoon - Angry Duck,link,http://comicallyincorrect.com/2016/12/30/angry-duck/,2016-12-30 13:08:14,450,20,412,334,6,15,31,9,55
163201283712008_1383107571721367,Today's A.F. Branco Cartoon - 12/29/2016,A.F. Branco Cartoon - Incoming Missive,link,http://comicallyincorrect.com/2016/12/29/incoming-missive/,2016-12-29 11:27:10,276,17,175,167,3,2,2,32,70
163201283712008_1382193978479393,Today's A.F. Branco Cartoon - 12/28/2016,A.F. Branco Cartoon - A Near Miss,link,http://comicallyincorrect.com/2016/12/28/near-miss/,2016-12-28 12:01:37,706,26,502,469,56,1,180,0,0
163201283712008_1381351955230262,Today's A.F. Branco Cartoon - 12/27/2016,A.F. Branco Cartoon - Clearance Sale,link,http://comicallyincorrect.com/2016/12/27/clintons-on-sale/,2016-12-27 12:59:14,369,14,241,212,7,0,150,0,0
163201283712008_1378985918800199,,Honoring The Fallen,link,http://comicallyincorrect.com/2014/12/25/christmas-police-memorial/,2016-12-24 19:33:06,182,7,66,141,31,0,0,10,0
163201283712008_1378642568834534,Today's A.F. Branco Cartoon 12/24/2016,A.F. Branco Cartoon - With Friends Like These,link,http://comicallyincorrect.com/2016/12/24/with-friend-like-these/,2016-12-24 10:52:21,392,44,317,220,2,7,6,43,114
163201283712008_1377853755580082,"Today's A.F. Branco Cartoon - 12/23/2016
(((( Merry Christmas Deplorables ))))",A.F. Branco Cartoon - Merry Christmas Deplorables,link,http://comicallyincorrect.com/2016/12/23/merry-deplorable-christmas/,2016-12-23 11:43:51,295,21,163,184,12,0,99,0,0
163201283712008_1377014738997317,Today's A.F. Branco Cartoon - 12/22/2016,A.F. Branco Cartoon - BFF's,link,http://comicallyincorrect.com/2016/12/22/cozy-bffs/,2016-12-22 12:14:14,674,35,1329,451,27,4,173,6,13
163201283712008_1376070235758434,Today's A.F. Branco Cartoon - 12/21/2016,A.F. Branco Cartoon - Outside Influence,link,http://comicallyincorrect.com/2016/12/21/outside-influence/,2016-12-21 11:49:33,815,39,1292,581,66,1,165,0,2
163201283712008_1375099372522187,Today's A.F. Branco Cartoon 12/20/2016,A.F. Branco Cartoon - News They Can Use,link,http://comicallyincorrect.com/2016/12/20/fake-news-they-can-use/,2016-12-20 12:58:19,417,20,292,293,13,3,104,1,3
163201283712008_1374173102614814,Today's A.F. Branco Cartoon - 12/19/2016,A.F. Branco Cartoon - Coexist Myth,link,http://comicallyincorrect.com/2016/12/19/cant-just-get-along/,2016-12-19 13:07:28,475,34,474,366,5,32,9,42,21
163201283712008_1371342452897879,Christmas Past Blast,A.F. Branco Cartoon - Seasons Beatings,link,http://comicallyincorrect.com/2014/12/22/nypd-officers-killed/,2016-12-16 18:28:52,277,18,145,188,14,5,57,5,8
163201283712008_1370113513020773,Today's A.F. Branco Cartoon 12/15/2016,A.F. Branco Cartoon - Buried Treasure,link,http://comicallyincorrect.com/2016/12/15/buried-treasure/,2016-12-15 12:40:43,285,13,210,192,11,1,78,2,1
163201283712008_1369068769791914,Today's A.F. Branco Cartoon - 12/14/2016,A.F. Branco Cartoon - Dog n' Pony Show,link,http://comicallyincorrect.com/2016/12/14/dog-pony-show/,2016-12-14 11:28:54,399,15,274,259,14,1,123,0,2
163201283712008_1368099223222202,Today's a.F. branco Cartoon - 12/13/2016,A.F. Branco Cartoon - Old Man Winter,link,http://comicallyincorrect.com/2016/12/13/under-the-weather/,2016-12-13 14:49:13,426,20,304,235,11,2,178,0,0
163201283712008_1366896460009145,Today's A.F. Branco Cartoon - 12/12/2016,A.F. Branco Cartoon - Stocking Stuffer,link,http://comicallyincorrect.com/2016/12/12/stocking-stuffer/,2016-12-12 11:51:26,489,22,389,273,21,0,195,0,0
163201283712008_1364131680285623,"Stossel showed this cartoon on his show this evening via the Fox Business Chanel - Thanks John, great show BTW.",Venezuela Crisis | Political Cartoon | A.F. Branco,link,http://comicallyincorrect.com/2016/06/01/venezuela-crisis/,2016-12-09 23:36:06,409,18,184,323,25,1,58,2,0
163201283712008_1363547667010691,"Today's A.F. Branco Cartoon - 12/09/2016
I had 2 versions - posted the wrong one earlier.",A.F. Branco Cartoon - Parting Gifts,link,http://comicallyincorrect.com/2016/12/09/parting-gifts/,2016-12-09 11:52:39,223,11,123,138,8,0,77,0,0
163201283712008_1363465693685555,Today's A.F. Branco Cartoon - 12/09/2016,A.F. Branco Cartoon - Parting Gifts,link,http://comicallyincorrect.com/2016/12/09/parting-gifts/,2016-12-09 10:40:40,341,23,232,178,17,2,144,0,0
163201283712008_1362122433819881,Today's A.F. Branco Cartoon 12/08/2016,A.F. Branco Cartoon - Over the Cuckoo's Nest,link,http://comicallyincorrect.com/2016/12/08/twitter-tweaking-the-media/,2016-12-08 11:00:10,454,35,281,262,26,0,166,0,0
163201283712008_1360799080618883,Today's A.F. Branco Cartoon - 12/07/2016,A.F. Branco Cartoon - It Ain't Over,link,http://comicallyincorrect.com/2016/12/07/it-aint-over-till/,2016-12-07 10:33:41,336,12,208,197,12,1,120,0,6
163201283712008_1360089807356477,(((((( Shameless Plug Alert )))))),2017 Comically Incorrect Calendar,link,https://patriotdepot.com/2017-comically-incorrect-calendar/,2016-12-06 18:54:10,107,2,38,84,9,0,13,0,1
163201283712008_1359888984043226,Today's A.F. Branco Cartoon 12/06/2016,A.F. Branco Cartoon - Yuge Difference,link,http://comicallyincorrect.com/2016/12/06/yuge/,2016-12-06 14:16:47,430,18,276,261,27,0,142,0,0
163201283712008_1358706487494809,Today's A.F. Branco Cartoon - 12/05/2016,A.F. Branco Cartoon - Save The children,link,http://comicallyincorrect.com/2016/12/05/parental-burnout/,2016-12-05 11:13:12,563,26,491,435,11,9,58,31,19
163201283712008_1355170204515104,Today's A.F. Branco Cartoon 12/02/2016,A.F. Branco Cartoon - Money for Nothin',link,http://comicallyincorrect.com/2016/12/02/money-for-nothin/,2016-12-02 11:20:32,603,31,428,365,18,1,219,0,0
163201283712008_1353833484648776,Today's A.F. Branco Cartoon 12/01/2016,A.F. Branco Cartoon - Adios El Presidente,link,http://comicallyincorrect.com/2016/12/01/adios-el-presidente/,2016-12-01 12:03:46,528,26,412,348,32,2,146,0,0
163201283712008_1352609404771184,Today's A.F. Branco Cartoon - 11/30/2016,A.F. Branco Cartoon - The Nutcracker,link,http://comicallyincorrect.com/2016/11/30/the-nutcracker/,2016-11-30 10:56:46,539,37,400,371,28,0,136,2,2
163201283712008_1351716138193844,Today's A.F. branco Cartoon 11/29/2016,A.F. Branco Cartoon - Jill and Hill,link,http://comicallyincorrect.com/2016/11/29/hill-and-jill/,2016-11-29 15:30:40,489,20,339,291,9,4,178,2,5
163201283712008_1350467371652054,Today's A.F. Branco Cartoon 11/28/2016,A.F. Branco Cartoon - Mourning in O'merica,link,http://comicallyincorrect.com/2016/11/28/mourning-in-omerica/,2016-11-28 11:48:22,219,14,146,159,3,3,39,1,14
163201283712008_1344475572251234,Today's A.F. Branco Cartoon 11/23/2016,A.F.Branco Cartoon - Hope n' Fear,link,http://comicallyincorrect.com/2016/11/23/hope-n-fear/,2016-11-23 11:32:09,454,18,352,341,34,0,78,1,0
163201283712008_1343134629051995,Today's A.F. Branco Cartoon - 11/22/2016,A.F. Branco Cartoon - Pardon Me,link,http://comicallyincorrect.com/2016/11/22/pardon-me/,2016-11-22 12:30:50,427,15,373,257,16,0,153,0,1
163201283712008_1342130319152426,Today's ((( 2nd ))) A.F. Branco Cartoon - 1121/2016,A.F. Branco Catoon - Cape Tears,link,http://comicallyincorrect.com/2016/11/21/cape-tears/,2016-11-21 19:30:26,375,23,172,221,16,0,138,0,0
163201283712008_1342129552485836,Today's ((( 2nd ))) A.F. Branco Cartoon - 1121/2016,A.F. Branco Catoon - Cape Tears,link,http://comicallyincorrect.com/2016/11/21/cape-tears/,2016-11-21 19:28:29,107,6,256,51,4,0,52,0,0
163201283712008_1341718405860284,Today's A.F. Branco Cartoon - 11/21/2016,A.F. Branco Cartoon - Media Then and Now,link,http://comicallyincorrect.com/2016/11/21/media-then-and-now/,2016-11-21 11:49:49,525,21,414,399,24,5,78,6,13
163201283712008_1338434872855304,Today's A.F. Branco Cartoon - 11/18/2016,A.F. Branco Cartoon - Reawakening,link,http://comicallyincorrect.com/2016/11/18/rewakening/,2016-11-18 11:56:23,470,24,329,369,73,2,25,1,0
163201283712008_1337261422972649,"Today's A.F. Branco Cartoon - 11/17/2016
*** Never let a crisis go to waste ***",A.F. Branco Cartoon - The Chicago Way,link,http://comicallyincorrect.com/2016/11/17/the-chicago-way/,2016-11-17 11:22:18,719,29,1113,412,22,19,247,7,12
163201283712008_1336057626426362,Today's A.F. Branco Cartoon - 11/16/2016,A.F. Branco Cartoon - Love Hate Election,link,http://comicallyincorrect.com/2016/11/16/love-hate-election/,2016-11-16 11:08:01,389,17,283,277,21,4,77,2,8
163201283712008_1335024196529705,Today's A.F. Branco Cartoon 11/15/2016,A.F. Branco Cartoon - Bon Appetit,link,http://comicallyincorrect.com/2016/11/15/bon-appetit/,2016-11-15 15:01:16,414,19,241,275,24,0,115,0,0
163201283712008_1333650680000390,Today's A.F. Branco Cartoon - 11/14/2016,A.F. Branco Cartoon - End of an Error,link,http://comicallyincorrect.com/2016/11/14/end-of-an-error/,2016-11-14 11:20:05,662,36,591,420,54,3,185,0,0
163201283712008_1330167347015390,Today's A.F. Branco Cartoon 11/11/2016,A.F. Branco Cartoon - Drain Baby Drain,link,http://comicallyincorrect.com/2016/11/11/drain-baby-drain/,2016-11-11 12:23:34,674,27,679,493,74,0,107,0,0
163201283712008_1329420647090060,Today's ((( 2nd ))) A.F. Branco Cartoon 11/10/2016,A.F. Branco Cartoon - Angry White Liberals,link,http://comicallyincorrect.com/2016/11/10/angary-white-liberals/,2016-11-10 20:19:30,692,30,921,473,32,5,161,12,9
163201283712008_1328938753804916,Today's A.F. Branco Cartoon 11/10/2016,A.F. Branco Cartoon - GOPe Catch Up,link,http://comicallyincorrect.com/2016/11/10/catching-up/,2016-11-10 12:27:31,500,22,331,335,25,2,133,2,3
163201283712008_1327745900590868,Today's A.F. Branco Cartoon - 11/09/2016,A.F. Branco Cartoon - Give Em' Hell Donald,link,http://comicallyincorrect.com/2016/11/09/give-em-hell-donald/,2016-11-09 11:58:08,373,31,156,243,42,0,87,1,0
163201283712008_1326560787376046,Today's A.F. Branco Cartoon - 11/08/2016,A.F. Branco Cartoon - Closing Argument,link,http://comicallyincorrect.com/2016/11/08/closing-argument/,2016-11-08 14:36:33,254,10,175,181,5,7,3,34,24
163201283712008_1325391994159592,Today's 2nd A.F. Branco Cartoon - 11/07/2016,A.F. Branco Cartoon - Bad Influence,link,http://comicallyincorrect.com/2016/11/07/bad-influence/,2016-11-07 16:17:52,619,30,1566,446,34,5,125,2,7
163201283712008_1325056094193182,Today's A.F. Branco Cartoon - 11/07/2016,A.F> Branco Cartoon - The End is Near!,link,http://comicallyincorrect.com/2016/11/07/the-end-is-near/,2016-11-07 10:17:26,477,19,442,352,33,4,79,3,6
163201283712008_1321276727904452,Today's ((( 2nd ))) A.F. Branco Cartoon 11/04/2016,A.F. Branco Cartoon -  See No Evil,link,http://comicallyincorrect.com/2016/11/04/see-no-evil/,2016-11-04 14:13:57,256,10,202,216,14,1,12,3,10
163201283712008_1321275171237941,Today's ((( 2nd ))) A.F. Branco Cartoon 11/04/2016,A.F. Branco Cartoon -  See No Evil,link,http://comicallyincorrect.com/2016/11/04/see-no-evil/,2016-11-04 14:13:13,792,31,626,658,35,12,12,6,69
163201283712008_1321014331264025,Today's A. F. Branco Cartoon - 11/04/2016,A.F. Branco Cartoon - The Other Half,link,http://comicallyincorrect.com/2016/11/04/the-other-half/,2016-11-04 10:31:40,388,23,307,238,16,1,131,0,2
163201283712008_1319724484726343,Today's ((( 1st ))) Branco cartoon of the day - 11/03/2016,A.F. Branco Cartoon- Lost in Space,link,http://comicallyincorrect.com/2016/11/03/lost-in-space/,2016-11-03 10:32:29,302,16,241,201,12,1,85,2,1
163201283712008_1318496274849164,Today's A.F. Branco Cartoon 11/02/2016,A.F. Branco Cartoon - 30 Year Itch,link,http://comicallyincorrect.com/2016/11/02/like-bad-rash/,2016-11-02 11:11:59,348,18,312,223,19,1,103,0,2
163201283712008_1317165948315530,Today's A.F. Branco Cartoon - 11/01/2016,A.F. Branco Cartoon - Where There's Smoke...,link,http://comicallyincorrect.com/2016/11/01/where-theres-smoke/,2016-11-01 12:18:02,338,14,227,252,26,1,59,0,0
163201283712008_1315889355109856,Today's A.F. Branco Cartoon,A.F. Branco - Danger Surprise!,link,http://comicallyincorrect.com/2016/10/31/danger-surprise/,2016-10-31 10:12:15,368,31,234,229,15,1,120,2,1
163201283712008_1312389455459846,Today's A.F. Branco Cartoon 10/28/2016,A.F. Branco Cartoon - Democratic Decay,link,http://comicallyincorrect.com/2016/10/28/democratic-decay/,2016-10-28 13:50:56,398,14,380,266,20,2,102,3,5
163201283712008_1312389152126543,Today's A.F. Branco Cartoon 10/28/2016,A.F. Branco Cartoon - Democratic Decay,link,http://comicallyincorrect.com/2016/10/28/democratic-decay/,2016-10-28 13:50:28,110,0,463,79,6,2,23,0,0
163201283712008_1311137768918348,Today's A.F. Branco Cartoon - 10/27/2016,A.F. Branco Cartoon - Corruptopus,link,http://comicallyincorrect.com/2016/10/27/it-came-from-beneath-dc/,2016-10-27 10:31:43,417,28,448,329,24,8,39,4,13
163201283712008_1309906299041495,Today's A.F. Branco Cartoon 10/26/2016,A.F. Branco Cartoon - Preparation H,link,http://comicallyincorrect.com/2016/10/26/preparation-h/,2016-10-26 10:22:52,536,24,663,298,24,6,197,6,5
163201283712008_1309049805793811,Today's (( 2nd )) A.F. Branco Cartoon - 10/25/2016,A.F. Branco Cartoon - Duck and Cover-Up,link,http://comicallyincorrect.com/2016/10/25/duck-and-cover-up/,2016-10-25 17:03:08,447,23,315,303,30,0,108,1,5
163201283712008_1308761962489262,Today's A.F. Branco Cartoon - 10/25/2016,A.F. Branco Cartoon - Deplorable Duo,link,http://comicallyincorrect.com/2016/10/25/deplorable-duo/,2016-10-25 10:59:59,464,26,453,347,8,4,70,2,33
163201283712008_1307611765937615,Today's A.F. Branco Cartoon 10/24/2016,"A.F. Branco Cartoon - Wanted, Dead or Alive",link,http://comicallyincorrect.com/2016/10/24/wanted-dead-alive/,2016-10-24 11:41:02,420,16,461,313,17,7,29,2,52
163201283712008_1305698919462233,"Hey Folks! The new 2017 A.F. Branco calendar has some highlights of your favorite cartoons and is ready for purchasing.
Many folks have asked how they can support me and my cartoons; if you are so inclined, here are a few ways that you may support my cartooning habit:
New 2017 Calendar -   https://patriotdepot.com/2017-comically-incorrect-calendar/
My Book - https://patriotdepot.com/comically-incorrect-a-collection-of-politically-incorrect-comics-volume-1/
My Online Store - https://patriotdepot.com/comically-incorrect/ 
Pay Pal donations - https://www.paypal.me/AntonioBranco
Many thanks and God Bless!
A.F. Branco",2017 Comically Incorrect Calendar,link,https://patriotdepot.com/2017-comically-incorrect-calendar/,2016-10-22 13:32:49,107,5,51,93,9,0,5,0,0
163201283712008_1304573766241415,Today's A.F. Branco Cartoon 10/21/2016,A.F. Branco Cartoon - Hillary Super Pac,link,http://comicallyincorrect.com/2016/10/21/hillary-super-pac/,2016-10-21 09:32:48,417,28,301,315,22,4,65,6,5
163201283712008_1303815692983889,Today's ((( 2nd ))) A.F. Branco Cartoon - 10/20/2016,A.F. Branco Cartoon - Yes Master!,link,http://comicallyincorrect.com/2016/10/20/media-propaganda/,2016-10-20 14:08:18,631,28,1295,491,24,8,92,9,7
163201283712008_1303739769658148,Today's A.F. Branco Cartoon 10/20/2016,A.F. Branco Cartoon - Deep Throat?,link,http://comicallyincorrect.com/2016/10/20/lets-blame-russia/,2016-10-20 12:07:30,142,8,91,102,2,0,38,0,0
163201283712008_1302720513093407,"Today's 2nd A.F. Branco Cartoon 10/19/2016
http://comicallyincorrect.com/2016/10/19/aim-game/",A.F. Branco Cartoon - Stuck in The Mud,link,http://comicallyincorrect.com/2016/10/19/aim-game/,2016-10-19 10:41:52,208,7,142,144,10,0,52,1,1
163201283712008_1302719976426794,Today's 2nd A.F. Branco Cartoon 10/19/2016,Hillary Aiming High | Political Cartoon | A.F. Branco,link,http://comicallyincorrect.com/2016/10/19/aim-game/,2016-10-19 10:40:43,54,2,21,44,1,2,7,0,0
163201283712008_1302670566431735,Today's A.F. Branco Cartoon 10/19/2016,A.F. Branco Cartoon - And The Whiner Is,link,http://comicallyincorrect.com/2016/10/19/and-the-whiner-is/,2016-10-19 09:43:32,561,26,543,408,20,1,125,2,5
163201283712008_1301751246523667,Today's A.F. Branco Cartoon - 10/18/2016,A.F. Branco Cartoon - Feel the Scorch,link,http://comicallyincorrect.com/2016/10/18/hillary-scorched-earth/,2016-10-18 11:29:37,186,15,157,147,4,2,12,2,19
163201283712008_1300663863299072,A.F. Branco Cartoon - ***Election Special***,A.F. Branco Cartoon - All in For Hillary,link,http://comicallyincorrect.com/2016/10/17/all-in-for-hillary/,2016-10-17 16:55:43,343,17,403,256,21,1,65,0,0
163201283712008_1300352136663578,"Today's A.F. Branco Cartoon 10/17/2016
*** "" Inappropriate Groping"" ***",A.F. Branco Cartoon - Inappropriate Groping,link,http://comicallyincorrect.com/2016/10/17/inappropriate-groping/,2016-10-17 10:47:55,325,8,317,231,10,7,73,1,3
163201283712008_1299623013403157,"Today's A.F. Branco cartoon - 10/16/2016
*** Weekend Election Special ***",A.F. Branco Cartoon - Making History,link,http://comicallyincorrect.com/2016/10/16/hillary-makes-history/,2016-10-16 16:36:50,262,9,253,211,2,2,20,4,23
163201283712008_1297115320320593,Today's A.F. branco Cartoon - 10/14/2016,A.F. Branco Cartoon - Bait and Switched,link,http://comicallyincorrect.com/2016/10/14/bait-and-switch/,2016-10-14 09:14:00,293,17,284,221,6,7,34,3,22
163201283712008_1295927627106029,Today's A.F. Branco Cartoon - 10/13/2016,A.F. Branco Cartoon - Exposed,link,http://comicallyincorrect.com/2016/10/13/media-and-wikileaks/,2016-10-13 12:09:40,380,28,458,282,24,1,65,3,5
163201283712008_1294757467223045,Today's A.F. Branco Cartoon - 10/12/2016,A.F. Branco Cartoon - Award Whining Performance,link,http://comicallyincorrect.com/2016/10/12/phony-trump-outrage/,2016-10-12 10:52:59,389,34,296,289,19,0,77,0,4
163201283712008_1293746153990843,"Today's A.F. Branco Cartoon - 10/11/20116

None of the rights we have protected by our constitution are going to mean a thing once Hillary is elected (SCOTUS). 
One party rule looks to be the future of this country... Think about it, the big government bureaucracy is pretty much all Democrat (IRS, FBI, EPA, DOJ, BLM, Education system etc), The entire media complex are pretty much all democrat (Hollywood, CBS, ABC, NBC, CNN, Pop Music). 
Even people on the left should be concerned about this much consolidated power resting with just a few, especially with someone as corrupt as Hillary and her group.",A.F. Branco Cartoon - The New Lord of the Flies,link,http://comicallyincorrect.com/2016/10/11/fly-in-the-ointment/,2016-10-11 11:57:47,312,31,271,225,14,2,69,0,2
163201283712008_1292691977429594,Today's A.F. Branco Cartoon 10/10/2016,A.F. Branco Cartoon - Crude vs Corrupt,link,http://comicallyincorrect.com/2016/10/10/crude-or-corrupt/,2016-10-10 12:26:44,364,22,307,291,10,1,57,1,4
163201283712008_1291973694168089,"Today's A.F. Branco Cartoon 10/09/2016
*** Special Debate Edition ***",A.F. Branco Cartoon - Wacky Leaks,link,http://comicallyincorrect.com/2016/10/09/hillary-public-and-private/,2016-10-09 17:07:55,322,18,217,235,9,5,69,2,2
163201283712008_1288111337887658,Today's (( 2nd )) A.F. Branco Cartoon - 10/05/2016,"A.F. Branco Cartoon - The Interruptor, Unhinged",link,http://comicallyincorrect.com/2016/10/05/the-interruptor/,2016-10-05 12:56:17,509,36,479,353,17,2,134,0,3
163201283712008_1287906354574823,Today's ((( 1st ))) A.F. Branco Cartoon 10/05/2016,A.F. Branco Cartoon - On Lockdown,link,http://comicallyincorrect.com/2016/10/05/the-minority-vote/,2016-10-05 09:57:58,359,15,234,298,37,4,18,0,2
163201283712008_1286945474670911,Today's A.F. Branco Cartoon - 10/04/2016,A.F. Branco Cartoon - Marie Clintonette -  Queen of Mean,link,http://comicallyincorrect.com/2016/10/04/hillary-and-nafta/,2016-10-04 12:06:03,253,21,200,198,10,1,41,0,3
163201283712008_1285853258113466,Today's A.F. Branco Cartoon 10/03/2016,A.F. Branco Cartoon - Driving Miss Machado,link,http://comicallyincorrect.com/2016/10/03/hillary-and-machado/,2016-10-03 10:24:27,448,19,457,311,16,5,103,5,8
163201283712008_1285063771525748,Weekend ((( Past Blast ))) Cartoon - 10/02/2016,A.F. Branco Cartoon - Walking Dead Returns,link,http://comicallyincorrect.com/2016/10/02/back-popular-demand-walking-dead-returns/,2016-10-02 13:56:20,431,17,424,282,17,5,115,3,9
163201283712008_1283723734993085,Today A.F. Branco Cartoon 10/01/2016,A.F. Branco Cartoon - Pit Stop,link,http://comicallyincorrect.com/2016/10/01/baiting-trump/,2016-10-01 09:38:53,366,23,294,265,22,3,71,0,5
163201283712008_1282820215083437,"Hillary Hall O' Fame Cartoon
WHICH ONE IS YOUR FAVORITE?",Hillary Hall o' Fame - Which one is your favorite?,link,http://comicallyincorrect.com/2016/09/30/hillary-hall-o-fame/,2016-09-30 11:24:37,361,34,234,288,22,1,45,0,5
163201283712008_1281948555170603,Today's (((2nd))) A.F. Branco Cartoon 9/29/2016,A.F. Branco Cartoon - Obamacare Transparency,link,http://comicallyincorrect.com/2016/09/29/obamacare-failing/,2016-09-29 12:53:18,207,14,166,150,1,2,50,2,2
163201283712008_1281844348514357,Today's (((1st))) A.F. Branco Cartoon - 9/29/2016,A.F. Branco Cartoon - Just the Facts Ma'am,link,http://comicallyincorrect.com/2016/09/29/media-fact-checkers/,2016-09-29 10:06:25,294,13,255,222,7,3,47,1,14
163201283712008_1281062461925879,2017 A.F. Branco Calendar is HERE!!!,2017 A.F. Branco Calendar,link,http://comicallyincorrect.com/2016/09/28/2017-a-f-branco-calendar/,2016-09-28 13:15:24,156,4,92,121,14,3,16,0,2
163201283712008_1280962135269245,Today's A.F. Branco Cartoon - 9/28/2016,A.F. Branco Cartoon - Wingman,link,http://comicallyincorrect.com/2016/09/28/clinton-wingman/,2016-09-28 11:10:58,519,34,716,398,6,2,71,0,42
163201283712008_1280101615355297,"Today's (Revised) A.F. Branco Cartoon - 9/27/2016
***  Your thoughts on the Debate? ***",A.F. Branco Cartoon - A lil' Help!,link,http://comicallyincorrect.com/2016/09/27/little-help-please/,2016-09-27 11:37:18,317,22,294,234,17,1,57,2,6
163201283712008_1279334745431984,A.F. Branco Special Debate Edition 9/26/2016,A.F. Branco - Fact-Check This,link,http://comicallyincorrect.com/2016/09/26/fact-check-this/,2016-09-26 13:24:46,346,24,243,244,9,2,4,41,46
163201283712008_1279245795440879,"Today's A.F. Branco Cartoon 9/26/2016

You watching the Debate?",A.F. Branco Cartoon -  Pre-Programmed,link,http://comicallyincorrect.com/2016/09/26/first-clinton-trump-debate/,2016-09-26 11:24:48,448,22,444,307,13,0,123,3,2
163201283712008_1277397295625729,,Cascade Mall Shooting | Close To Home | A.F. Branco,link,http://comicallyincorrect.com/2016/09/24/cascade-mall-shooting/,2016-09-24 12:12:23,70,19,19,24,0,3,1,29,13
163201283712008_1276759239022868,Today's ))) 2nd ((( A.F.Branco Cartoon 9/23/2016,A.F. Branco Cartoon #2 - Deplorable Cruz,link,http://comicallyincorrect.com/2016/09/23/cruz-endorses-trump/,2016-09-23 18:20:16,150,16,67,97,3,0,47,2,1
163201283712008_1276449772387148,Today's A.F. Branco Cartoon - 9/23/2016,A.F. Branco Cartoon - A Thug's Life,link,http://comicallyincorrect.com/2016/09/23/charlotte-thugs-riot/,2016-09-23 11:02:36,377,27,379,317,10,7,15,7,21
163201283712008_1275500819148710,Today's A.F. Branco Cartoon 9/22/2016,A.F. Branco Cartoon .... Fantasyland,link,http://comicallyincorrect.com/2016/09/22/charlotte-riots/,2016-09-22 11:44:47,372,16,688,270,18,3,74,6,1
163201283712008_1274634072568718,Today's A.F. Branco Cartoon - 9/21/2016,A.F. Branco Cartoon - Candy Roulette,link,http://comicallyincorrect.com/2016/09/21/skittles-controversy/,2016-09-21 10:48:21,384,27,306,290,18,2,69,0,5
163201283712008_1273833402648785,Today's A.F. Branco Cartoon 9/20/2016,A.F. Branco Cartoon - Ready to Blow,link,http://comicallyincorrect.com/2016/09/20/hillary-counter-terrorism/,2016-09-20 12:11:05,274,14,226,220,9,2,23,4,16
163201283712008_1272944149404377,Today's A.F. Branco Cartoon 9/19/2016,A.F. Branco Cartoon - Basket Case,link,http://comicallyincorrect.com/2016/09/19/basket-of-disposables/,2016-09-19 11:49:52,385,30,341,229,4,1,1,89,61
163201283712008_1263879073644218,"Today's 2nd A.F. Branco Cartoon 9/09/2016
I'll be on vacation all next week. Feel free to post from the archives while I'm gone because many are still relevant. Behave yourself, don't make me come back early!...LOL ... See ya when I get back. ~A.F.Branco",A.F. Branco Cartoon #2 - Who Failed Who?,link,http://comicallyincorrect.com/2016/09/09/trump-foreign-policy/,2016-09-09 16:32:12,301,32,177,234,19,1,46,0,1
163201283712008_1263650137000445,Today's 1st A.F. Branco Cartoon 9/09/2016,A.F. Branco Cartoon - Who's Got Your Ear,link,http://comicallyincorrect.com/2016/09/09/hillary-earpiece/,2016-09-09 10:35:48,395,16,348,273,18,2,96,0,6
163201283712008_1262680850430707,Today's A.F. branco Cartoon 9/08/2016,A.F. Branco Cartoon - Trump Ready For Hillary?,link,http://comicallyincorrect.com/2016/09/08/hillary-trump-debate/,2016-09-08 11:48:53,282,13,177,192,10,3,77,0,0
163201283712008_1261664040532388,Today's A.F. Branco Cartoon 9/07/2016,A.F. Branco Cartoon - Hillary Test Results,link,http://comicallyincorrect.com/2016/09/07/hillary-coughing-attack/,2016-09-07 10:05:45,415,16,382,292,20,1,102,0,0
163201283712008_1260830300615762,Today's A.F. Branco Cartoon 9/06/2016,A.F. Branco Cartoon - An Elusive Creature,link,http://comicallyincorrect.com/2016/09/06/hillary-press-conference/,2016-09-06 12:53:19,346,19,247,223,11,0,111,1,0
163201283712008_1259889094043216,Today's A.F. Branco Cartoon - 9/05/2016,A.F. Branco Cartoon - Brain Freeze,link,http://comicallyincorrect.com/2016/09/05/brain-freeze/,2016-09-05 13:31:23,381,23,359,283,13,7,67,3,8
163201283712008_1259098934122232,,Friday Past Blast - GOP Racist,link,http://comicallyincorrect.com/2014/05/02/gop-racist/,2016-09-04 16:12:01,275,6,162,193,9,2,69,1,1
163201283712008_1257009410997851,Today's A.F. Branco Cartoon - 9/02/2016,A.F. Branco Cartoon - Hillary - Warts and All,link,http://comicallyincorrect.com/2016/09/02/hillary-lies-about-lying/,2016-09-02 12:10:16,323,14,256,240,19,3,60,0,1
163201283712008_1256127137752745,"Today's A.F.Branco Cartoon - Sept 01, 2016

The story behine the cartoon
http://comicallyincorrect.com/2016/09/01/paster-burns-tweets-branco-toon/",A.F. Branco Cartoon - Weapon Of Mass Diversion,link,http://comicallyincorrect.com/2016/09/01/blackface-media-diversion/,2016-09-01 12:40:06,220,13,168,162,8,0,49,0,1
163201283712008_1255041064528019,Today's A.F. Branco Cartoon - 8/31/2016,A.F. Branco Cartoon - A Leakly Distraction,link,http://comicallyincorrect.com/2016/08/31/hillary-racist-charge/,2016-08-31 09:26:56,419,15,310,315,14,2,79,2,7
163201283712008_1254242037941255,Today's A.F. Branco Cartoon 8/30/2016,A.F. Branco Cartoon - Nixon; Miss Me Yet?,link,http://comicallyincorrect.com/2016/08/30/nixon-miss-yet/,2016-08-30 12:33:35,334,17,310,256,13,2,57,3,3
163201283712008_1253559151342877,Today's ((( Extra ))) A.F. Branco Cartoon 8/29/2016,A.F. Branco Extra Toon - And the Weiner Is....,link,http://comicallyincorrect.com/2016/08/29/weiner-and-huma/,2016-08-29 17:22:24,255,17,277,151,12,0,91,0,1
163201283712008_1253338428031616,Today's A.F. Branco Cartoon 8/29/2016,A.F. Branco Cartoon - San Francisco Forty-Whiner,link,http://comicallyincorrect.com/2016/08/29/san-francisco-forty-whiner/,2016-08-29 11:27:29,538,37,665,384,16,1,91,5,41
163201283712008_1250760038289455,Today's A.F. Branco Cartoon - 8/26/2016,A.F. Branco Cartoon - For A Whiter Whitewash,link,http://comicallyincorrect.com/2016/08/26/for-a-whiter-whitewash/,2016-08-26 12:28:24,252,14,290,184,2,4,42,1,19
163201283712008_1249801438385315,Today's A.F. Branco Cartoon - 8/25/2016,A.F. Branco Cartoon - Show HER the MONEY!,link,http://comicallyincorrect.com/2016/08/25/show-her-the-money/,2016-08-25 10:35:04,156,8,149,127,4,0,14,1,10
163201283712008_1248870355145090,Today's ((( 2nd ))) A.F. Branco Cartoon  - 8/24/2016,A.F. Branco Cartoon - Cha-Ching Machine,link,http://comicallyincorrect.com/2016/08/24/hillary-pay-to-play/,2016-08-24 13:37:23,557,41,947,389,33,5,115,5,10
163201283712008_1248724818492977,Today's A.F. Branco Cartoon 8/24/2016,A.F. Branco Cartoon - The Right Direction,link,http://comicallyincorrect.com/2016/08/24/different-directions/,2016-08-24 10:13:27,275,16,259,223,11,4,35,0,2
163201283712008_1247810618584397,Today's A.F. Branco Cartoon - 8/23/2016,A.F. Branco Cartoon - Hey Bidder Bidder,link,http://comicallyincorrect.com/2016/08/23/the-highest-bidder/,2016-08-23 11:28:13,342,17,423,251,8,2,15,10,56
163201283712008_1246888708676588,Today's A.F. Branco Cartoon 8/22/2016,A.F. Branco Cartoon - here's To Her Health,link,http://comicallyincorrect.com/2016/08/22/hillary-clintons-health/,2016-08-22 11:14:10,419,22,487,272,10,3,130,0,4
163201283712008_1244335485598577,Oldie from the past - but still relevant today. The Obama economy is just one big lie after another.,Shovel Ready Job Numbers - Comically Incorrect,link,http://comicallyincorrect.com/2013/05/06/shovel-ready-job-numbers/,2016-08-19 18:42:40,273,10,207,229,3,4,13,5,19
163201283712008_1244075605624565,Today's A.F. Branco Cartoon 8/19/2016,"A.F. Branco Cartoon - FOH, Friends Of Hillary",link,http://comicallyincorrect.com/2016/08/19/trump-vetting-refugees/,2016-08-19 11:31:19,450,19,1175,345,8,7,43,5,42
163201283712008_1243234935708632,Today's A.F. Branco Cartoon 8/18/2016,A.F. Branco Cartoon - Who's Your master?,link,http://comicallyincorrect.com/2016/08/18/hillary-and-soros/,2016-08-18 10:53:05,327,24,279,226,11,0,82,2,6
163201283712008_1242360559129403,Today's A.F. Branco Cartoon 8/17/2016,A.F. Branco Cartoon - Reeks of Bias,link,http://comicallyincorrect.com/2016/08/17/media-reeks-of-bias/,2016-08-17 09:53:58,389,33,498,300,21,2,59,0,7
163201283712008_1241589355873190,Today's A.F. Branco Cartoon 8/16/2016,A.F. Branco Cartoon - Too Dangerous?,link,http://comicallyincorrect.com/2016/08/16/trump-is-too-dangerous/,2016-08-16 11:37:23,339,14,394,263,7,1,41,2,25
163201283712008_1240784795953646,Today's A.F. Branco Cartoon 8/15/2016,A.F. Branco Cartoon - Getting Away,link,http://comicallyincorrect.com/2016/08/15/hillary-caught-lying/,2016-08-15 11:04:00,200,11,156,146,4,0,48,0,2
163201283712008_1238386246193501,"Today's ((( 2nd ))) A.F. Branco Cartoon - 8/12/2016
**** Have A Great Weekend ****","A.F. Branco Cartoon - Cover Story ""The Naked Truth""",link,http://comicallyincorrect.com/2016/08/12/hillary-the-naked-truth/,2016-08-12 16:13:49,506,35,446,366,17,5,115,2,1
163201283712008_1238154789549980,Today's A.F. Branco Cartoon 8/12/2016,A.F. Branco Cartoon - It's Getting Scary,link,http://comicallyincorrect.com/2016/08/12/getting-scary-folks/,2016-08-12 10:32:34,103,15,52,70,1,0,24,0,8
163201283712008_1237471399618319,Today's ((( Extra ))) A.F.Branco Cartoon - 8/11/2016,A.F. Branco Cartoon - Anti-Trump Derangement Syndrome,link,http://comicallyincorrect.com/2016/08/11/anti-trump-derangement-syndrome/,2016-08-11 12:25:09,259,21,239,194,2,5,40,13,5
163201283712008_1237422029623256,Today's A.F. Branco Cartoon - 8/11/2016,A.F. Branco Cartoon - They Got Mail!,link,http://comicallyincorrect.com/2016/08/11/theyve-got-mail/,2016-08-11 11:04:08,237,9,235,187,0,13,13,8,16
163201283712008_1236536949711764,Today's A.F. Branco Cartoon 8/10/2016,A.F. Branco Cartoon - Barry's Rubble,link,http://comicallyincorrect.com/2016/08/10/barrys-rubble/,2016-08-10 10:04:15,305,18,401,236,3,4,25,9,28
163201283712008_1235847029780756,Today's A.F. Branco Cartoon - 8/09/2016,A.F. Branco Cartoon - Goin' For Gold,link,http://comicallyincorrect.com/2016/08/09/trump-trouble/,2016-08-09 12:38:05,263,21,219,207,3,0,28,5,20
163201283712008_1235043336527792,,Political Cartoons by cartoonist A.F.Branco,photo,https://www.facebook.com/163201283712008/photos/a.163214493710687.33343.163201283712008/1235043336527792/?type=3,2016-08-08 13:23:20,240,26,10,215,16,0,9,0,0
163201283712008_1235042299861229,,Political Cartoons by cartoonist A.F.Branco's cover photo,photo,https://www.facebook.com/163201283712008/photos/a.357297107635757.85351.163201283712008/1235042299861229/?type=3,2016-08-08 13:22:15,208,20,7,201,7,0,0,0,0
163201283712008_1234955559869903,Today's A.F. Branco Carton 8/08/2016,A.F. Branco Cartoon - Loose Wire,link,http://comicallyincorrect.com/2016/08/08/loose-wires/,2016-08-08 10:53:28,317,19,504,229,4,11,65,2,6
163201283712008_1232605850104874,"Today's A.F. Branco Cartoon 8/05/2016
 ((( Have a great weekend! )))",A.F. Branco Cartoon - Iranian Stimulus Package,link,http://comicallyincorrect.com/2016/08/05/obama-hostage-ransom/,2016-08-05 12:39:02,364,22,552,278,3,1,5,12,65
163201283712008_1231745156857610,Today's A.F. Branco Cartoon - 8/04/2016,A.F. Branco Cartoon - The Price Is Right,link,http://comicallyincorrect.com/2016/08/04/cash-for-hostages/,2016-08-04 10:35:11,201,11,163,147,3,2,19,2,28
163201283712008_1230980493600743,Today's A.F. Branco Cartoon 8/03/2016,A.F.Branco Cartoon - Trash Talker in Chief,link,http://comicallyincorrect.com/2016/08/03/unfit-to-serve-as-president/,2016-08-03 09:51:40,283,25,340,229,7,1,28,4,14
163201283712008_1230400220325437,Today's A.F. Branco Cartoon 8/02/2016,A.F. Branco Cartoon - Together - Yes We Can,link,http://comicallyincorrect.com/2016/08/02/saving-obamacare/,2016-08-02 13:24:28,154,7,139,112,0,3,24,1,14
163201283712008_1229570550408404,Today's A.F. Branco Cartoon 8/01/20116,A.F. Branco Cartoon - Getting to Know Her,link,http://comicallyincorrect.com/2016/08/01/hillary-and-millennials/,2016-08-01 10:17:51,268,15,263,195,4,1,65,0,3
163201283712008_1229138950451564,...And the media is upset about Trump making a joke.,A.F. Branco Cartoon - Crooked Deal,link,http://comicallyincorrect.com/2016/06/10/crooked-deal/,2016-07-31 19:21:37,312,14,289,243,5,1,27,0,36
163201283712008_1227537800611679,Today's A.F. Branco Cartoon 7/29/2016,A.F. Branco Cartoon - Speech In A Nutshell,link,http://comicallyincorrect.com/2016/07/29/hillary-convention-speech-2016/,2016-07-29 14:25:32,459,33,1585,307,14,4,128,1,5
163201283712008_1226788954019897,Today's ((( 2nd ))) A.F. Branco Cartoon 7/28/2016,A.F. Branco 2nd Cartoon - Useful Non-voters,link,http://comicallyincorrect.com/2016/07/28/conservatives-for-hillary/,2016-07-28 13:14:03,199,10,282,155,3,2,4,8,27
163201283712008_1226716780693781,Today's A.F.Branco Cartoon 7/28/2016,A.F. Branco Cartoon - Move Over ISIS,link,http://comicallyincorrect.com/2016/07/28/air-conditioner-terror/,2016-07-28 11:27:35,201,14,165,134,3,3,54,4,3
163201283712008_1226171394081653,"I have a Dream today! That this cartoon will get over 100,000 hits before the end of the DNC Convention. :)  Can you Help?
Please visit my website >>> http://comicallyincorrect.com/",Timeline Photos,photo,https://www.facebook.com/163201283712008/photos/a.186622181369918.42717.163201283712008/1226171394081653/?type=3,2016-07-27 19:18:46,684,14,965,584,14,4,72,1,9
163201283712008_1225813990784060,Today's A.F. Branco Cartoon 7/27/2016,A.F. Branco Cartoon - Overqualified,link,http://comicallyincorrect.com/2016/07/27/dnc-chair-schultz-fired/,2016-07-27 09:32:46,299,11,428,217,8,1,66,2,5
163201283712008_1225193270846132,Today's A.F. Branco Cartoon 7/26/2016,A.F. Branco Cartoon - DNC Soft Sell,link,http://comicallyincorrect.com/2016/07/26/dnc-message/,2016-07-26 11:53:06,335,16,315,263,10,1,56,1,4
163201283712008_1224496190915840,Today's A.F. Branco Cartoon 7/25/2016,A.F. Branco Cartoon - She Built That,link,http://comicallyincorrect.com/2016/07/25/hillary-created-isis/,2016-07-25 11:39:39,229,13,255,183,6,3,23,3,11
163201283712008_1221944651170994,Today's ((( 2nd ))) A. F. Branco  Cartoon 7/21/2016,A.F.Branco Cartoon #2 - Sore Loser,link,http://comicallyincorrect.com/2016/07/21/cruz-refused-to-endorse/,2016-07-21 19:59:08,182,41,149,122,7,2,46,1,4
163201283712008_1221710421194417,Today's A.F. Branco Cartoon 7/21/2016,A.F. Branco Cartoon - 2016 Party Platforms,link,http://comicallyincorrect.com/2016/07/21/choose-your-platform/,2016-07-21 12:07:28,227,13,226,198,25,0,3,0,1
163201283712008_1220911774607615,Today's A.F. Branco Cartoon - 7/20/2016,A.F. Branco Cartoon - Hillary Continues to Nail It,link,http://comicallyincorrect.com/2016/07/20/from-the-heart/,2016-07-20 09:59:01,210,13,198,153,5,0,52,0,0
163201283712008_1220499497982176,Today'd A.F. Branco Cartoon - 7/19/2016,A.F. Branco Cartoon - ISIS Recruiter,link,http://comicallyincorrect.com/2016/07/19/trump-isis-recruiter/,2016-07-19 18:09:50,174,6,132,135,9,0,30,0,0
163201283712008_1219649328067193,Today's A.F. Branco Cartoon 7/18/2016,A.F. Branco Cartoon - The Great Escape,link,http://comicallyincorrect.com/2016/07/18/the-great-escape/,2016-07-18 12:26:08,280,11,247,227,1,3,17,1,31
163201283712008_1217617454937047,Today's ((( 2nd ))) A.F. Branco Cartoon 7/15/2016,A.F. Branco Cartoon #2 - Terror Strikes France... Again.,link,http://comicallyincorrect.com/2016/07/15/terror-strikes-france/,2016-07-15 13:53:48,226,10,173,195,8,1,3,1,18
163201283712008_1217522241613235,Today's A.F. Branco Cartoon 7/15/2016,A.F. Branco Cartoon - Death to Law & Order,link,http://comicallyincorrect.com/2016/07/15/death-to-law-order/,2016-07-15 10:53:42,159,12,130,96,1,0,0,30,32
163201283712008_1216906295008163,"Today's A.F. Branco Cartoon 7/14/2016
((( Reviving Obama-nomics )))",A.F. Branco Cartoon - Reviving Obama-nomics,link,http://comicallyincorrect.com/2016/07/14/hillarys-economic-plan/,2016-07-14 13:11:18,124,5,114,100,2,1,20,1,0
163201283712008_1216058435092949,Today's A.F. Branco Cartoon 7/13/2016,A.F. Branco Cartoon - Obstructionist,link,http://comicallyincorrect.com/2016/07/13/racism-solutions/,2016-07-13 10:40:55,221,15,197,173,4,1,29,3,11
163201283712008_1215676668464459,Today's ((( 2nd ))) A.F. Branco Cartoon,A.F. Branco Cartoon #2 -  The Odd Couple,link,http://comicallyincorrect.com/2016/07/12/bernie-endorses-hillary/,2016-07-12 21:29:50,229,9,203,185,6,2,30,1,5
163201283712008_1215459485152844,Today's A.F. Branco Cartoon 7/12/2016,A.F. Branco Cartoon - Campain Signs,link,http://comicallyincorrect.com/2016/07/12/road-to-prosterity/,2016-07-12 14:03:23,153,8,84,130,6,1,15,0,1
163201283712008_1214662271899232,Today's A.F. Branco Cartoon 7/11/2016,A.F. Branco Cartoon - Fabric Of Our Nation,link,http://comicallyincorrect.com/2016/07/11/obama-race-divider/,2016-07-11 10:46:11,242,14,245,187,2,4,1,17,31
163201283712008_1212782315420561,Branco Cartoon - Talk Stupidly and Carry A Big Mouth,A.F. Branco Cartoon - Talk Stupidly and Cary A Big Mouth,link,http://comicallyincorrect.com/2016/07/08/3490/,2016-07-08 15:42:48,280,15,254,210,3,1,0,20,46
163201283712008_1212542715444521,Today's A.F. Branco Cartoon 7/08/2016,A.F. Branco Cartoon - Ignorance Is Bliss,link,http://comicallyincorrect.com/2016/07/08/hillary-defense-excuse/,2016-07-08 09:07:47,265,12,288,213,9,1,24,2,16
163201283712008_1211936632171796,Thank you everyone for your part in making this cartoon go extremely viral yesterday,Political Cartoons by cartoonist A.F.Branco,link,http://comicallyincorrect.com/2016/07/06/the-verdict/,2016-07-07 12:31:02,88,8,0,69,6,1,4,0,8
163201283712008_1211927545506038,"Today's A.F.Branco Cartoon 7/07/2016
 * Not So Blind Justice *",A.F. Branco Cartoon - Not So Blind Justice,link,http://comicallyincorrect.com/2016/07/07/not-so-blind-justice/,2016-07-07 12:18:06,163,10,133,119,2,1,1,16,24
163201283712008_1211251855573607,Today's 2nd A.F. Branco Cartoon 7/06/2016,A.F. Branco Cartoon #2 - Grandkids and Golf,link,http://comicallyincorrect.com/2016/07/06/lynch-clinton-secret-meeting/,2016-07-06 10:14:16,192,16,257,154,2,8,24,2,2
163201283712008_1211201015578691,Today's 1st A.F. Branco Cartoon 7/06/2016,A.F. Branco Cartoon - The Verdict Is In,link,http://comicallyincorrect.com/2016/07/06/the-verdict/,2016-07-06 08:25:59,337,24,482,280,18,0,7,4,28
163201283712008_1210721722293287,Today's A.F.Branco Cartoon 7/05/2016,A.F.Branco Cartoon - Out On A Limb,link,http://comicallyincorrect.com/2016/07/05/3478/,2016-07-05 12:57:13,259,20,227,196,17,1,43,0,2
163201283712008_1209307162434743,Today's A.F.Branco Cartoon 7/03/2016,A.F.Branco Cartoon  Scratch n' Sniff Corruption,link,http://comicallyincorrect.com/2016/07/03/lynch-clinton-meeting/,2016-07-03 10:04:55,321,21,457,249,2,1,26,2,41
163201283712008_1208748792490580,4th of July ((( Past Blasts ))),4th of July cartoons | A.F.Branco,link,http://comicallyincorrect.com/2013/07/04/4th-of-july-cartoon-favorites/,2016-07-02 12:26:10,138,5,211,113,1,0,6,16,2
163201283712008_1208080489224077,"Today's A.F. Branco Cartoon 7/01/2016
(((Have a Great Independence Day Weekend)))",A.F.Branco Cartoon - Independence Day 2016,link,http://comicallyincorrect.com/2016/07/01/happy-4th-july-2016/,2016-07-01 10:28:00,291,23,299,237,16,0,38,0,0
163201283712008_1207439125954880,Today's A.F. Branco Cartoon 6/30/2016,A.F.Branco Cartoon - Pesty Duo,link,http://comicallyincorrect.com/2016/06/30/warren-and-hillary-attack/,2016-06-30 11:06:19,179,8,183,149,4,0,22,1,3
163201283712008_1206714752693984,Today's A.F.Branco Cartoon 2016,A.F. Branco Cartoon - Foul Movement,link,http://comicallyincorrect.com/2016/06/29/house-democrats-protest/,2016-06-29 10:06:52,132,6,158,111,1,0,3,8,9
163201283712008_1206166172748842,Today's A.F.Branco Cartoon 6/28/2016,A.F. Branco Cartoon - Brexit - Making Great Britain Great Again,link,http://comicallyincorrect.com/2016/06/28/brexit-making-great-britain-great/,2016-06-28 14:06:44,129,6,89,112,8,0,9,0,0
163201283712008_1205476249484501,Today's A.F.Branco Cartoon 6/27/2016,A.F. Branco Cartoon - Warm-Up Act,link,http://comicallyincorrect.com/2016/06/27/democrat-house-sit-in/,2016-06-27 11:46:03,276,18,252,217,10,0,47,2,0
163201283712008_1203715432993916,,Political Cartoons by cartoonist A.F.Branco's cover photo,photo,https://www.facebook.com/163201283712008/photos/a.357297107635757.85351.163201283712008/1203715432993916/?type=3,2016-06-24 17:17:34,48,4,32,40,3,0,4,1,0
163201283712008_1203713566327436,,Political Cartoons by cartoonist A.F.Branco's cover photo,photo,https://www.facebook.com/163201283712008/photos/a.357297107635757.85351.163201283712008/1203713566327436/?type=3,2016-06-24 17:13:48,17,1,12,17,0,0,0,0,0
163201283712008_1203470209685105,Today's A.F.Branco Cartoon 6/24/2016,A.F.Branco Cartoon - Eye to Eye,link,http://comicallyincorrect.com/2016/06/24/eye-to-eye-trump-and-hillary/,2016-06-24 09:55:00,180,10,169,168,9,0,3,0,0
163201283712008_1202870103078449,Today's A.F.Branco cartoon 6/23/2016,A.F.Branco Cartoon - Underwater World,link,http://comicallyincorrect.com/2016/06/23/underwater-world-liberals-built/,2016-06-23 11:08:20,274,16,323,227,10,0,23,7,7
163201283712008_1202202306478562,Today's A.F.Branco Cartoon  6/22/2016,A.F.Branco Cartoon - Rough Road Ahead,link,http://comicallyincorrect.com/2016/06/22/primary-vs-general-election/,2016-06-22 11:47:27,125,13,117,106,3,2,11,0,3
163201283712008_1201508436547949,Today's A.F.Branco Cartoon 6/21/2016,A.F.Branco Cartoon - Disarming America,link,http://comicallyincorrect.com/2016/06/21/disarming-america/,2016-06-21 12:37:19,194,17,215,166,6,1,5,0,16
163201283712008_1200670909965035,Today's A.F.Branco Cartoon 6/20/2016,A.F.Branco Cartoon - Christianophobia,link,http://comicallyincorrect.com/2016/06/20/christian-ophobia/,2016-06-20 11:22:28,206,14,230,175,3,2,3,10,13
163201283712008_1200263533339106,A.F.Branco ((( Weekend Past Blast ))) Cartoon 6/19/2016,A.F.Branco Cartoon - (((Past Blast ))) Waste Not (Revised),link,http://comicallyincorrect.com/2016/06/19/weekend-past-blasts-waste-not-revised/,2016-06-19 19:26:00,242,9,201,200,7,2,1,6,26
163201283712008_1198691270162999,Today's A.F.Branco Cartoon 6/17/2016,A.F.Branco Cartoon - Deflecting,link,http://comicallyincorrect.com/2016/06/17/deflecting-massacre-blame/,2016-06-17 10:54:45,501,25,792,432,19,1,26,6,17
163201283712008_1197987686900024,Today's A.F.Branco Cartoon 6/06/2016,A.F.Branco Cartoon - Sweet Dreams,link,http://comicallyincorrect.com/2016/06/16/obama-hillary-sweet-dreams/,2016-06-16 12:34:49,283,16,303,256,10,1,8,2,6
163201283712008_1197246480307478,Today's A.F. Branco Cartoon 6/15/2016,A.F.Branco Cartoon - Warren Warpath,link,http://comicallyincorrect.com/2016/06/15/warren-attacks-trump/,2016-06-15 09:59:54,226,18,246,173,6,2,45,0,0
163201283712008_1196664950365631,Today's A.F.Branco Cartoon - 6/14/2016,A.F. Branco Cartoon - 1(800) Sore Loser,link,http://comicallyincorrect.com/2016/06/14/romney-never-trump/,2016-06-14 09:51:34,186,20,85,140,7,2,37,0,0
163201283712008_1196102067088586,Today's A.F.Branco Cartoon - 6/13/2016,A.F.Branco Cartoon - Stupid POTUS Tricks,link,http://comicallyincorrect.com/2016/06/13/stupid-pet-tricks-2/,2016-06-13 11:38:05,255,19,244,208,4,0,21,2,20
163201283712008_1195572053808254,Our thoughts and prayers go out to the victims and their loved ones in Orlando Florida,On High Alert,link,http://comicallyincorrect.com/2015/05/27/global-warming-alert/,2016-06-12 15:11:52,239,7,282,180,2,2,6,10,39
163201283712008_1194135250618601,Today's A.F.Branco Cartoon - 6/10/2016,A.F.Branco Cartoon - Art of the Crooked Deal,link,http://comicallyincorrect.com/2016/06/10/crooked-deal/,2016-06-10 10:26:11,140,9,170,109,1,1,11,0,18
163201283712008_1193480060684120,Today's A.F.Branco Cartoon 6/09/2016,A.F.Branco Cartoon - In Your Face Lawlessness,link,http://comicallyincorrect.com/2016/06/09/in-your-face-lawlessness/,2016-06-09 10:16:38,277,16,281,232,4,2,1,6,32
163201283712008_1192801057418687,Today's A.F. Branco Cartoon 6/08/2016,A.F.Branco Cartoon - For Everyone's Eyes Only,link,http://comicallyincorrect.com/2016/06/08/the-nuclear-codes/,2016-06-08 09:43:12,222,8,307,170,4,0,33,2,13
163201283712008_1192240860808040,Today's A.F.Branco Cartoon - 6/07/2016,A.F.Branco Cartoon - Pick Your Poison,link,http://comicallyincorrect.com/2016/06/07/pick-your-poison/,2016-06-07 13:13:18,321,14,410,270,4,2,33,5,7
163201283712008_1191618560870270,A.F. Branco makes top 10 in the world (according to this site),Top 10 Best Cartoonists in the World,link,http://www.topteny.com/top-10-best-cartoonists-world/,2016-06-06 12:52:27,163,25,34,149,7,2,5,0,0
163201283712008_1191582517540541,Today's A.F.Branco Cartoon 6/06/2016,A.F. Branco Cartoon - Pitfalls,link,http://comicallyincorrect.com/2016/06/06/babies-in-danger/,2016-06-06 11:58:27,146,3,127,117,3,3,7,12,4
163201283712008_1189475701084556,Today's A.F.branco Cartoon - 6/03/2016,A.F.Branco Cartoon - Media Well Done,link,http://comicallyincorrect.com/2016/06/03/trump-blasts-the-media/,2016-06-03 10:08:07,213,15,178,147,21,0,45,0,0
163201283712008_1188776814487778,Today's A.F. Branco Cartoon - 6/02/2016,A.F.Branco Cartoon - Hollywood Justice,link,http://comicallyincorrect.com/2016/06/02/hollywood-equal-pay/,2016-06-02 11:01:46,144,12,108,117,2,0,23,0,2
163201283712008_1188117191220407,Today's A.F.Branco Cartoon 6/01/2016,A.F.Branco Cartoon - Already Berned There,link,http://comicallyincorrect.com/2016/06/01/venezuela-crisis/,2016-06-01 09:53:01,341,17,559,292,4,1,38,5,1
163201283712008_1187492134616246,Today's A.F.Branco Cartoon 5/31/2016,A.F. Branco Cartoon - The Dreaded 3am Phone Call,link,http://comicallyincorrect.com/2016/05/31/phone-bill/,2016-05-31 11:17:55,267,15,296,173,6,0,88,0,0
163201283712008_1186864081345718,"Today's A.F.Branco Cartoon - 5/30/2016
HAVE A GREAT MEMORIAL DAY WEEKEND!!!",A.F.Branco Cartoon - Thank you to Our Veterans,link,http://comicallyincorrect.com/2016/05/30/thank-you-veterans/,2016-05-30 10:59:34,162,8,113,147,14,1,0,0,0
163201283712008_1186247088074084,,Veterans Waiting List | A.F.Branco | Political Cartoon,link,http://comicallyincorrect.com/2015/02/20/veterans-waiting-list-2/,2016-05-29 11:24:29,220,13,172,135,1,1,0,27,56
163201283712008_1185722888126504,Remembering the fallen,Memorial Day 2016,link,http://comicallyincorrect.com/2015/05/24/memorial-day-2015/,2016-05-28 15:19:29,204,7,106,171,19,1,0,13,0
163201283712008_1184981511533975,"Today's A.F.Branco Cartoon 5/27/2016
*** Have a great Memorial Day weekend! ***",A.F.Branco Cartoon - Man or Mouse?,link,http://comicallyincorrect.com/2016/05/27/robert-a-mcdonald/,2016-05-27 11:11:34,123,11,116,93,3,1,10,0,16
163201283712008_1184413621590764,Today's ((( 2nd ))) A.F.Branco Cartoon 5/26/2016,A.F. Branco Cartoon #2 - What A Tool,link,http://comicallyincorrect.com/2016/05/26/what-a-tool-2/,2016-05-26 13:43:41,196,21,220,154,2,1,13,2,24
163201283712008_1184325154932944,Today's A.F.Branco Cartoon 5/26/2016,A.F.Branco Cartoon - People Person,link,http://comicallyincorrect.com/2016/05/26/3402/,2016-05-26 10:28:46,184,15,173,153,6,3,20,0,2
163201283712008_1183621365003323,Today's A.F. Branco Cartoon 5/25/2016,A.F. Branco Cartoon - A Giant Leap,link,http://comicallyincorrect.com/2016/05/25/obama-bathroom-legacy/,2016-05-25 09:15:43,202,18,181,152,4,0,29,11,6
163201283712008_1182959791736147,Today's A.F.Branco Cartoon 5/24/2016,A.F. Branco Cartoon - Economic Media Bias,link,http://comicallyincorrect.com/2016/05/24/2-percent-economic-growth/,2016-05-24 10:24:21,234,13,209,190,3,2,27,2,10
163201283712008_1182279701804156,Today's A.F.Branco Cartoon 5/23/2016,A.F.Branco Cartoon - 3rd Term's a Charm,link,http://comicallyincorrect.com/2016/05/23/obamas-3rd-term/,2016-05-23 10:24:09,134,10,88,99,2,3,25,5,0
163201283712008_1181184061913720,A.F. Branco (((Saturday Past Blast Cartoon))),A.F.Branco Cartoon - Bull Feathers,link,http://comicallyincorrect.com/2016/05/21/elizabeth-warren/,2016-05-21 15:45:47,177,19,112,134,5,0,37,0,1
163201283712008_1180309345334525,Today's A.F. Branco Cartoon 5/20/2016,A.F.Branco Cartoon - Hillary's Economic Adviser,link,http://comicallyincorrect.com/2016/05/20/ny-times-attacks-trump/,2016-05-20 08:50:01,241,11,241,180,5,1,52,0,3
163201283712008_1179774675387992,Todsay's A.F. Branco Cartoon 5/19/2016,A.F.Branco Cartoon - Hillary's Safe-Space,link,http://comicallyincorrect.com/2016/05/19/hillarys-safe-space/,2016-05-19 11:53:44,197,9,203,155,5,0,35,0,2
163201283712008_1179068365458623,Today's A.F.Branco Cartoon 5/18/2016,A.F.Branco Cartoon - The Smell Test,link,http://comicallyincorrect.com/2016/05/18/trump-vs-hillary-scotus/,2016-05-18 09:36:11,138,16,169,119,1,2,12,0,4
163201283712008_1178507615514698,Today's A.F.branco Cartoon 5/17/2016,A.F.Branco Cartoon - The Hills Are Alive With The Sound of Scandals,link,http://comicallyincorrect.com/2016/05/17/wa-post-on-trump/,2016-05-17 11:29:31,351,20,300,291,5,2,36,5,12
163201283712008_1177910818907711,Today's A.F.Branco Cartoon - 5/16/2016,A.F.Branco Cartoon - The Family Business,link,http://comicallyincorrect.com/2016/05/16/clinton-crime-foundation/,2016-05-16 10:54:26,169,10,147,136,6,2,21,0,4
163201283712008_1175931262439000,Today's A.F.Branco Cartoon 5/13/2016,A.F.Branco Cartoon - Unity?,link,http://comicallyincorrect.com/2016/05/13/gop-trump-unity/,2016-05-13 11:00:02,76,8,49,61,5,1,8,1,0
163201283712008_1175291509169642,Today's A.F. Branco Cartoon 5/12/2016,A.F. Branco Cartoon - fakebook News,link,http://comicallyincorrect.com/2016/05/12/facebook-news-bias/,2016-05-12 10:59:01,275,20,266,223,11,0,38,1,2
163201283712008_1174703185895141,Today's A.F.Branco Cartoon 5/11/2016,A.F. Branco Cartoon -  All Aboard,link,http://comicallyincorrect.com/2016/05/11/gop-coming-together/,2016-05-11 10:31:31,173,19,144,147,7,0,19,0,0
163201283712008_1174226459276147,Today's A.F.Branco Cartoon 5/10/2016,A.F.Branco Cartoon - Real Conservative,link,http://comicallyincorrect.com/2016/05/10/paul-ryan-conservative/,2016-05-10 14:15:52,142,11,115,108,4,1,17,0,12
163201283712008_1173652882666838,Today's A.F. Branco Cartoon 5/09/2016,A.F.Branco Cartoon - Foul Ball,link,http://comicallyincorrect.com/2016/05/09/no-bush-endorsement/,2016-05-09 15:34:21,123,18,78,99,1,0,20,0,3
163201283712008_1171481946217265,Today's A.F. Branco Cartoon 5/06/2016,A.F. Branco Cartoon - #NeverHillary,link,http://comicallyincorrect.com/2016/05/06/never-hillary/,2016-05-06 10:28:23,220,9,194,163,3,1,0,35,18
163201283712008_1170911506274309,Today's A.F. Branco Cartoon 5/5/2016,A.F. Branco Cartoon - Jaws,link,http://comicallyincorrect.com/2016/05/05/trump-vs-media-bias/,2016-05-05 12:06:44,170,12,124,144,1,1,20,4,0
163201283712008_1170283273003799,Today's A.F.Branco Cartoon 5/04/2016,A.F.Branco Cartoon - Speak Of The Devils,link,http://comicallyincorrect.com/2016/05/04/lucifer-in-the-flesh/,2016-05-04 11:48:28,223,17,182,181,6,2,32,1,1
163201283712008_1169708949727898,Today's A.F. Branco Cartoon 5/03/2016,A.F. Branco Cartoon - Clearing Her Throat,link,http://comicallyincorrect.com/2016/05/03/cruz-fiorina-2016/,2016-05-03 13:19:28,129,9,81,100,3,0,25,1,0
163201283712008_1169056306459829,Today's A.F. Branco Cartoon 5/02/2016,A.F.Branco Cartoon - Hillary's Trump Card,link,http://comicallyincorrect.com/2016/05/02/the-womans-card/,2016-05-02 12:20:32,160,9,146,133,2,0,24,1,0
163201283712008_1167070153325111,"Question -  Shouldn't it be okay to fire someone on the left for speaking out against the N.C. bathroom law? 
I mean if it's okay for ESPN to fire someone with a conservative view (Schilling), shouldn't it be just fine for a Conservative leaning company to fire someone with a liberal perspective?",ESPN Fires Schilling | Political Cartoon | A.F. Branco,link,http://comicallyincorrect.com/2016/04/29/sports-update/,2016-04-29 12:44:36,111,7,100,95,0,0,0,1,15
163201283712008_1167041359994657,Today's A.F.Branco Cartoon 4/29/2016,A.F. Branco Cartoon - Sports Update!!!,link,http://comicallyincorrect.com/2016/04/29/sports-update/,2016-04-29 12:00:32,76,10,100,70,0,0,0,3,3
163201283712008_1166315773400549,Today's A.F.Branco Cartoon - 4/28/2016,A.F. Branco Cartoon - Criminal Minds,link,http://comicallyincorrect.com/2016/04/28/ex-con-voting-rights/,2016-04-28 09:47:34,159,13,134,126,5,0,18,0,10
163201283712008_1165722566793203,"Today's A.F.Branco Cartoon 4/27/2016

Thank you Larry Elder",A.F. Branco Cartoon - Cirque du Hypocrisy,link,http://comicallyincorrect.com/2016/04/27/cirque-du-hypocrisy/,2016-04-27 10:55:47,124,13,142,101,2,0,19,0,2
163201283712008_1165191816846278,Today's A.F.Branco Cartoon 4/26/2016,A.F.Branco Cartoon - Leading Behind,link,http://comicallyincorrect.com/2016/04/26/apology-tour-2-0/,2016-04-26 15:23:35,180,8,138,144,1,0,30,1,4
163201283712008_1164407773591349,Today's A.F.Branco Cartoon 4/25/2016,A.F. Branco Cartoon - Crunch Time,link,http://comicallyincorrect.com/2016/04/25/crunch-time/,2016-04-25 10:52:10,68,2,65,61,0,0,7,0,0
163201283712008_1163830180315775,A.F.Branco Cartoon - That's Going To Leave A Mark.,Fixing Obamacare | A.F.Branco | Political Cartoon,link,http://comicallyincorrect.com/2014/05/12/fixing-obamacare/,2016-04-24 13:35:23,97,6,92,82,1,0,4,1,9
163201283712008_1162395813792545,Guess what day it is?,A.F. Branco Cartoon - Obama Earth Day,link,http://comicallyincorrect.com/2016/04/22/obama-earth-day-2/,2016-04-22 11:33:42,168,9,106,138,2,0,24,1,3
163201283712008_1162317067133753,Today's A.F.Branco Cartoon 4/22/2016,A.F.Branco Cartoon - Hot n' Spicy,link,http://comicallyincorrect.com/2016/04/22/hillary-pandering/,2016-04-22 09:24:01,164,10,322,126,5,1,31,1,0
163201283712008_1161927057172754,Today's ((( 2nd ))) A.F.Branco Cartoon 4/21/2016,A.F.Branco 2nd Cartoon -  PC Gender Offender,link,http://comicallyincorrect.com/2016/04/21/bathroom-rights/,2016-04-21 18:11:57,173,12,347,146,1,5,5,1,15
163201283712008_1161732533858873,Today's A.F.Branco Cartoon 4/21/2016,A.F.Branco Cartoon - Mistaken Identity,link,http://comicallyincorrect.com/2016/04/21/gope-for-hillary/,2016-04-21 11:24:23,102,18,122,85,0,0,9,0,8
163201283712008_1160985813933545,Today's A.F. Branco Cartoon 4/20/2016,A.F. Branco Cartoon - Hillary's Path to Victory,link,http://comicallyincorrect.com/2016/04/20/hillarys-path-to-victory/,2016-04-20 10:23:42,193,20,333,160,2,1,2,14,14
163201283712008_1160384913993635,Today's A.F.Branco Cartoon 4/19/2016,A.F. Branco Cartoon - Bernie Is My Comrade,link,http://comicallyincorrect.com/2016/04/19/bernie-is-my-comrade/,2016-04-19 11:33:02,114,8,117,97,3,0,12,1,1
163201283712008_1159731054059021,Today's A.F. Branco Cartoon 4/18/2016,A.F. Branco Cartoon - Don't Buzz Me Bro!,link,http://comicallyincorrect.com/2016/04/18/russia-sees-us-as-weak/,2016-04-18 10:46:46,162,14,250,136,2,3,3,9,9
163201283712008_1159139260784867,A.F. Branco Sunday ((( Past Blast Cartoon ))),A.F.Branco Cartoon - Deja Vu Politics,link,http://comicallyincorrect.com/2016/04/17/friday-past-blast-o-politics/,2016-04-17 13:21:44,77,4,41,70,0,0,6,0,1
163201283712008_1158475854184541,If you've had issues viewing this page using an iphone It has been fixed.,Happy Tax Day! | Political Cartoon | A.F. Branco,link,http://comicallyincorrect.com/2016/04/15/happy-tax-day/,2016-04-16 12:16:29,51,2,30,46,0,1,4,0,0
163201283712008_1157874967577963,Today's A.F.Branco Cartoons - HAPPY TAX DAY!!!,A.F.Branco Cartoons - HAPPY TAX DAY!!!,link,http://comicallyincorrect.com/2016/04/15/happy-tax-day/,2016-04-15 13:25:39,53,0,74,51,0,0,2,0,0
163201283712008_1157186700980123,"GET YOURS TODAY!!! Follow the link below.
https://patriotdepot.com/comically-incorrect-a-collection-of-politically-incorrect-comics-volume-1/",Timeline Photos,photo,https://www.facebook.com/163201283712008/photos/a.186622181369918.42717.163201283712008/1157186700980123/?type=3,2016-04-14 11:39:02,37,8,18,32,1,0,4,0,0
163201283712008_1157161254316001,Today's A.F.Branco Cartoon 4/14/2016,A.F.Branco Cartoon - How You Finish,link,http://comicallyincorrect.com/2016/04/14/dnc-rigged-game/,2016-04-14 10:47:09,132,11,101,108,0,0,23,0,1
163201283712008_1156515697713890,Today's A.F.Branco Cartoon 4/13/2016,A.F. Branco Cartoon - Ruling Class Rules,link,http://comicallyincorrect.com/2016/04/13/ruling-class-rules/,2016-04-13 09:57:06,158,19,207,127,3,1,25,2,0
163201283712008_1155838114448315,Today's A.F.Branco Cartoon - 4/12/2016,A.F.Branco Cartoon - Do The Math,link,http://comicallyincorrect.com/2016/04/12/rnc-gope-rules/,2016-04-12 11:32:38,135,17,122,100,3,1,16,1,14
163201283712008_1155194564512670,Today's A.F.Branco Cartoon - 4/11/2016,A.F.Branco Cartoon - Not So Sharp Shooter,link,http://comicallyincorrect.com/2016/04/11/not-sharp-shooter/,2016-04-11 11:43:10,118,6,115,96,0,2,18,0,2
163201283712008_1154036194628507,,Iraq Legacy | Political Cartoon | A.F.Branco,link,http://comicallyincorrect.com/2015/05/21/iraq-legacy/,2016-04-09 17:40:33,164,8,113,148,2,1,2,2,9
163201283712008_1153117794720347,Today's A.F.Branco Cartoon - 04/08/2016,A.F.Branco Cartoon - oh Snap,link,http://comicallyincorrect.com/2016/04/08/northeast-record-cold/,2016-04-08 10:03:18,175,9,211,136,7,0,32,0,0
163201283712008_1152510981447695,Today's A.F. Branco Cartoon - 4/07/2016,A.F.Branco Cartoon - Sees No Evil,link,http://comicallyincorrect.com/2016/04/07/iranian-red-flags/,2016-04-07 10:59:32,154,7,165,129,3,1,8,3,10
163201283712008_1151842508181209,Today's A.F.Branco Cartoon - 4/06/2016,A.F.Branco Cartoon - No Womb For Rights,link,http://comicallyincorrect.com/2016/04/06/no-rights-for-unborn/,2016-04-06 10:32:42,125,6,164,96,0,1,0,8,20
163201283712008_1151484334883693,Today's A.F. Branco Cartoon 4/05/2016,A.F.Branco Cartoon - Running Away With It.,link,http://comicallyincorrect.com/2016/04/05/snatching-defeat/,2016-04-05 18:53:27,68,7,45,60,4,0,4,0,0
163201283712008_1150632698302190,Today's A.F. Branco Cartoon 4/04/2016,A.F.Branco Cartoon - The Final Cut,link,http://comicallyincorrect.com/2016/04/04/contested-convention/,2016-04-04 11:31:21,119,10,103,103,2,2,6,2,4
163201283712008_1148544118511048,"Today's A.F. Branco Cartoon - April 1st,2016",A.F.Branco Cartoon - An April Fool Everyday,link,http://comicallyincorrect.com/2016/04/01/isis-keeps-on-killing/,2016-04-01 11:28:37,148,9,196,122,0,0,9,0,17
163201283712008_1147422381956555,,Political Cartoons by cartoonist A.F.Branco's cover photo,photo,https://www.facebook.com/163201283712008/photos/a.357297107635757.85351.163201283712008/1147422381956555/?type=3,2016-03-31 11:34:11,244,17,218,214,12,0,15,0,3
163201283712008_1147408775291249,Today's A.F.Branco Cartoon - 3/31/2016,A.F. Branco Cartoon - Doggone Truth,link,http://comicallyincorrect.com/2016/03/31/clinton-truth-dog/,2016-03-31 11:20:07,122,7,92,105,3,0,13,1,0
163201283712008_1146300022068791,Today's A.F.Branco Cartoon - 3/30/2016,A.F. Branco Cartoon - Political Bull,link,http://comicallyincorrect.com/2016/03/30/political-bull/,2016-03-30 09:34:10,120,5,121,99,6,0,14,0,1
163201283712008_1145255518839908,Today's A.F.Branco Cartoon - 3/29/2016,A.F.Branco Cartoon - Present Arms,link,http://comicallyincorrect.com/2016/03/29/present-arms/,2016-03-29 11:58:52,131,10,95,120,0,1,4,4,2
163201283712008_1141006095931517,Today's A.F.Branco Cartoon - 3/25/2016,A.F. Branco Cartoon - Dancing Fool,link,http://comicallyincorrect.com/2016/03/25/dirty-dancing/,2016-03-25 10:23:45,216,17,234,181,2,0,10,3,20
163201283712008_1140042992694494,Today's A.F.Branco Cartoon - 3/24/2016,A.F. Branco Cartoon - Free Ride,link,http://comicallyincorrect.com/2016/03/24/obama-and-castro/,2016-03-24 11:26:44,164,12,158,145,5,0,13,0,1
163201283712008_1138941586137968,Today's A.F.Branco Cartoon - 3/23/2016,A.F. Branco Cartoon - Hard Choices,link,http://comicallyincorrect.com/2016/03/23/gop-party-nominee/,2016-03-23 09:56:23,119,18,141,100,0,1,2,0,16
163201283712008_1138001876231939,Today's A.F.Branco Cartoon - 3/22/2016,A.F. Branco Cartoon - Dreams From My Fathers,link,http://comicallyincorrect.com/2016/03/22/obama-in-cuba/,2016-03-22 11:19:08,268,17,233,234,8,0,24,1,1
163201283712008_1136987956333331,Today's A.F.Branco Cartoon - 3/21/2016,A.F.Branco Cartoon - Mutual Obsession,link,http://comicallyincorrect.com/2016/03/21/trump-and-megan-kelly/,2016-03-21 11:06:42,154,15,129,133,3,0,18,0,0
163201283712008_1136242706407856,A.F.Branco Cartoon - Black Votes Matter,A.F. Branco Cartoon - Black Votes Matter,link,http://comicallyincorrect.com/2016/03/20/black-votes-matter/,2016-03-20 13:09:00,296,22,621,272,4,1,13,2,4
163201283712008_1134797369885723,Herni and De BIrd - Opposites,Herni and De Bird - Opposites - Comically Incorrect,link,http://comicallyincorrect.com/2016/03/18/herni-de-bird-opposites/,2016-03-18 15:16:27,89,3,112,86,2,0,1,0,0
163201283712008_1134596056572521,Today's A.F. Branco Cartoon - 3/18/2016,A.F.Branco Cartoon - Killing Free Speech,link,http://comicallyincorrect.com/2016/03/18/doj-vs-free-speech/,2016-03-18 09:57:25,159,14,150,144,0,0,0,3,12
163201283712008_1133824103316383,Today's A.F.Branco Cartoon - 3/17/2016,A.F.Branco Cartoon - Benghazi 4 Forgotten,link,http://comicallyincorrect.com/2016/03/17/4-benghazi-dead/,2016-03-17 10:25:03,317,25,522,254,5,2,2,1,53
163201283712008_1132979790067481,Today's A.F.Branco Cartoon - 3/16/2016,A.F. Branco Cartoon - Face-ticuffs,link,http://comicallyincorrect.com/2016/03/16/anti-trump-bias/,2016-03-16 09:30:45,181,10,228,151,7,1,21,0,1
163201283712008_1132307376801389,Today's A.F.Branco Cartoon - 3/15/2016,A.F.Branco Cartoon - Hook Or By Crook,link,http://comicallyincorrect.com/2016/03/15/hillary-on-wall-street-2/,2016-03-15 11:54:57,128,3,103,119,1,0,8,0,0
163201283712008_1131510310214429,Today's A.F.Branco Cartoon - 3/14/2016,A.F.Branco Cartoon - Thug Lives Matter,link,http://comicallyincorrect.com/2016/03/14/bernie-sanders-thugs/,2016-03-14 10:46:14,261,19,216,243,4,2,9,0,3
163201283712008_1130976380267822,A.F.Branco Cartoon - Still relevant,1st Amendment Under Attack | A.F.Branco | Political Cartoon,link,http://comicallyincorrect.com/2014/02/25/first-amendment-under-attack/,2016-03-13 14:34:57,169,12,94,161,4,0,1,0,3
163201283712008_1129715937060533,Today's A.F.Branco Cartoon - 3/11/2016,A.F.Branco Cartoon - Too Big To Fill,link,http://comicallyincorrect.com/2016/03/11/too-big-to-fill/,2016-03-11 19:08:39,119,6,108,110,2,0,7,0,0
163201283712008_1129561480409312,"A.F.Branco - New Weekly Panel ""Herni and De Bird""",Herni and De Bird | Introduction | A.F.Branco,link,http://comicallyincorrect.com/2016/03/11/introducing-herni-and-de-bird/,2016-03-11 13:24:35,81,7,78,78,0,0,2,1,0
163201283712008_1128837353815058,Today's A.F.Branco Cartoon - 3/10/2016,A.F.Branco Cartoon - GOP Family Vacation,link,http://comicallyincorrect.com/2016/03/10/trump-vs-romney/,2016-03-10 11:22:46,147,11,121,120,6,0,21,0,0
163201283712008_1128258337206293,Today's A.F.Branco Cartoon - 3/09/2016,A.F. Branco Cartoon - Who Nose Best,link,http://comicallyincorrect.com/2016/03/09/hold-nose-and-vote/,2016-03-09 09:51:18,170,11,197,153,0,0,13,3,1
163201283712008_1127779647254162,Today's A.F. Branco Cartoon - 3/08/2016,A.F. Branco Cartoon - Empty Nesters,link,http://comicallyincorrect.com/2016/03/08/bernie-the-bum/,2016-03-08 12:17:37,243,18,246,205,8,0,30,0,0
163201283712008_1127470753951718,A.F.Branco Cartoon from 2013 -,A.F.Branco Cartoon - Rubio Delivers,link,http://comicallyincorrect.com/2013/06/29/border-insecurities/,2016-03-08 00:14:36,161,6,80,151,5,0,0,1,4
163201283712008_1127180097314117,Today's A.F.Branco Cartoon - 3/07/2016,A.F. Branco Cartoon - Deadly Game,link,http://comicallyincorrect.com/2016/03/07/political-chicken/,2016-03-07 11:10:51,114,14,120,109,1,0,3,0,1
163201283712008_1126921157340011,Today's A.F.Branco Cartoon - March 6th 2016,A.F.Branco Cartoon - Reunited,link,http://comicallyincorrect.com/2016/03/06/nancy-reagan/,2016-03-07 00:02:51,370,10,231,311,37,0,0,22,0
163201283712008_1126636554035138,A.F. Branco Cartoon from 2013,A.F. Branco Cartoon - The DC Beast,link,http://comicallyincorrect.com/2013/08/01/beast-of-burden-cruz-fights-obama-care/,2016-03-06 12:02:19,151,8,70,143,6,0,0,2,0
163201283712008_1125384117493715,Today's A.F.Branco Cartoon - 3/04/2016,A.F.Branco Cartoon - The Favored Son,link,http://comicallyincorrect.com/2016/03/04/rubio-cruz/,2016-03-04 11:51:09,151,5,111,141,4,1,3,1,1
163201283712008_1124847444214049,Today's A.F. Branco Cartoon - 3/03/2016,A.F.Branco Cartoon - Day of Reckoning,link,http://comicallyincorrect.com/2016/03/03/gop-super-tuesday/,2016-03-03 12:33:39,105,7,73,97,3,1,4,0,0
163201283712008_1124252667606860,Today's A.F. Branco Cartoon - 3/02/2016,A.F. Branco Cartoon - The Finale,link,http://comicallyincorrect.com/2016/03/02/ending-america/,2016-03-02 11:04:42,347,26,835,311,6,1,17,8,4
163201283712008_1123762764322517,"Today's A.F.Branco Cartoon 
Yes, Lindsey Graham actually said this.",A.F.Branco Cartoon - E TU Lindsey?,link,http://comicallyincorrect.com/2016/03/01/e-tu-lindsey/,2016-03-01 14:28:44,82,11,51,76,0,2,2,0,2
163201283712008_1123045927727534,http://patriotdepot.com/comically-incorrect-a-collection-of-politically-incorrect-comics-volume-1/,Political Cartoons by cartoonist A.F.Branco's cover photo,photo,https://www.facebook.com/163201283712008/photos/a.357297107635757.85351.163201283712008/1123045927727534/?type=3,2016-02-29 12:41:50,40,4,5,39,1,0,0,0,0
163201283712008_1123040594394734,Today's A.F.Branco cartoon - 2/29/2016,A.F. Branco Cartoon - Hands Down Winner,link,http://comicallyincorrect.com/2016/02/29/winner-hands-down/,2016-02-29 12:31:46,192,13,193,169,7,1,13,1,1
163201283712008_1122538857778241,A.F.Branco Past Blast Cartoon - Republicide,A.F.Branco Cartoon - Republicide,link,http://comicallyincorrect.com/2016/02/28/branco-past-blast-cartoon-republicide/,2016-02-28 14:59:15,148,7,89,135,7,0,0,0,6
163201283712008_1121221541243306,Today's A.F.Branco Cartoon - Friday 2/26/2016,A.F. Branco Cartoon - Pervert Alert,link,http://comicallyincorrect.com/2016/02/26/transgender-bathrooms/,2016-02-26 10:19:53,238,51,280,198,1,5,11,2,21
163201283712008_1120583494640444,"Today's A.F.Branco Cartoon 2/25/2016
((( Feel the Bern-Moobs)))",A.F.Branco Cartoon - The Fix Is In,link,http://comicallyincorrect.com/2016/02/25/dnc-favors-hillary/,2016-02-25 12:36:45,182,13,171,160,3,0,18,0,1
163201283712008_1119929551372505,Today's A.F.Branco Cartoon - 2/24/2016,A.F.Branco Cartoon - Angry Birds,link,http://comicallyincorrect.com/2016/02/24/voter-outrage/,2016-02-24 11:09:22,176,14,192,153,8,2,9,2,2
163201283712008_1119343008097826,Today's A.F.Branco Cartoon,A.F.Branco Cartoon - Up In Smoke,link,http://comicallyincorrect.com/2016/02/23/up-in-smoke/,2016-02-23 13:47:20,117,7,103,117,0,0,0,0,0
163201283712008_1118603531505107,Today's A.F.Branco Cartoon,A.F.Branco Cartoon - Wall of Fame vs Shame,link,http://comicallyincorrect.com/2016/02/22/building-walls/,2016-02-22 12:56:23,184,9,139,184,0,0,0,0,0
163201283712008_1118076844891109,A. F. Branco Cartoon - Past blast,4 Trillion Stimulus Plan | A.F.Branco | Political Cartoon,link,http://comicallyincorrect.com/2015/02/03/4-trillion-stimulus-plan/,2016-02-21 15:06:06,138,8,128,138,0,0,0,0,0
163201283712008_1117437804955013,A.F.Branco - Saturday Past Blast Cartoon,Obama Syrian Policy | Past Blast Cartoon | A.F. Branco,link,http://comicallyincorrect.com/2016/02/20/obama-syrian-policy/,2016-02-20 12:59:26,85,3,141,85,0,0,0,0,0
163201283712008_1116842091681251,Today's A.F. Branco Cartoon,A.F.Branco Cartoon - Feel The Stache,link,http://comicallyincorrect.com/2016/02/19/feel-the-stache/,2016-02-19 12:39:10,199,7,312,199,0,0,0,0,0
163201283712008_1116225508409576,Today's A.F.Branco Cartoon,A.F. Branco Cartoon - Stacked Deck,link,http://comicallyincorrect.com/2016/02/18/stacked-deck/,2016-02-18 12:03:15,120,13,132,120,0,0,0,0,0
163201283712008_1115633405135453,Today's A.F.Branco Cartoon,A.F.Branco Cartoon - Ruff and Ready,link,http://comicallyincorrect.com/2016/02/17/hillary-barking/,2016-02-17 11:15:05,169,18,315,169,0,0,0,0,0
163201283712008_1115052425193551,Today's A.F.Branco Cartoon,A.F.Branco Cartoon - Guard On Duty,link,http://comicallyincorrect.com/2016/02/16/scalia-the-guardian/,2016-02-16 12:54:57,189,7,228,189,0,0,0,0,0
163201283712008_1114442135254580,Today's A.F. Branco Cartoon,A.F. Branco Cartoon - Deeply Wounded,link,http://comicallyincorrect.com/2016/02/15/deeply-wounded/,2016-02-15 11:30:13,237,12,233,237,0,0,0,0,0
163201283712008_1113909571974503,A.F.Branco - Happy Valentines Day,A.F.Branco Cartoon - Heartfelt,link,http://comicallyincorrect.com/2014/02/11/cbo-obama-care-jobs/,2016-02-14 16:23:49,107,3,90,107,0,0,0,0,0
163201283712008_1113215732043887,,Bridgegate | A.F.Branco | Political Cartoon,link,http://comicallyincorrect.com/2014/01/10/bridgegate-hate/,2016-02-13 13:14:13,69,7,40,69,0,0,0,0,0
163201283712008_1112624528769674,Today's A.F.Branco Cartoon,A.F.Branco Cartoon - Negative Thoughts,link,http://comicallyincorrect.com/2016/02/12/nanny-president/,2016-02-12 11:19:11,99,10,110,99,0,0,0,0,0
163201283712008_1112017082163752,"Today's A.F.Branco Cartoon - 
How could Bernie possibly win in New Hampshire when Hillary is such a great candidate???",A.F.Branco Cartoon - Hillary Loses,link,http://comicallyincorrect.com/2016/02/11/hillary-loses/,2016-02-11 12:06:53,99,9,103,99,0,0,0,0,0
163201283712008_1111456885553105,Today's A.F.Branco Cartoon,A.F. Branco Cartoon - In Her Defense,link,http://comicallyincorrect.com/2016/02/10/hillary-is-dirty/,2016-02-10 11:44:04,132,11,171,132,0,0,0,0,0
163201283712008_1110925252272935,Today's A.F. Branco cartoon,A.F. Branco Cartoon - Dumpster Divers,link,http://comicallyincorrect.com/2016/02/09/dumpster-diving/,2016-02-09 12:17:21,256,13,363,256,0,0,0,0,0
163201283712008_1110321868999940,Today's A.F.Branco Cartoon,A.F.Branco Cartoon - Hillary Does Wall Street,link,http://comicallyincorrect.com/2016/02/08/hillary-on-wall-street/,2016-02-08 12:10:59,150,13,158,150,0,0,0,0,0
163201283712008_1109803659051761,A.F.Branco (((Past Blast ))) Cartoon,A.F.Branco Cartoon - Obama Jobs Plan,link,http://comicallyincorrect.com/2014/01/17/friday-past-blast-obama-jobs-plan/,2016-02-07 15:16:57,109,0,100,109,0,0,0,0,0
163201283712008_1109139732451487,((( Past Blast ))) A.F. Branco Cartoon.,A.F. Branco Cartoon - Gov't Cheese and Baloney,link,http://comicallyincorrect.com/2016/02/06/obama-job-numbers/,2016-02-06 12:09:02,170,6,281,170,0,0,0,0,0
163201283712008_1108612362504224,((( Friday Past Blast Cartoon ))),A.F.Branco ((( Past Blast Cartoons ))) Obamacare Job Killer,link,http://comicallyincorrect.com/2016/02/05/obamacare-job-killer/,2016-02-05 12:20:08,160,3,281,160,0,0,0,0,0
163201283712008_1108040759228051,Today's A.F.Branco Cartoon,A.F. Branco Cartoon - What Are The Odds,link,http://comicallyincorrect.com/2016/02/04/what-are-the-odds/,2016-02-04 12:22:20,189,10,213,189,0,0,0,0,0
163201283712008_1107554142610046,Today's A.F.Branco Cartoon,A.F. Branco Cartoon - Up For Grabs,link,http://comicallyincorrect.com/2016/02/03/gop-candidates/,2016-02-03 12:36:27,126,8,103,126,0,0,0,0,0
163201283712008_1107053245993469,Today's A.F.Branco Cartoon,A.F.Branco Cartoon - Comrades At War,link,http://comicallyincorrect.com/2016/02/02/hillary-and-bernie/,2016-02-02 11:56:15,270,17,257,270,0,0,0,0,0
163201283712008_1106574839374643,Today's A.F.Branco Cartoon,A.F.Branco Cartoon - You've Got Mail-ed,link,http://comicallyincorrect.com/2016/02/01/youve-got-nail-ed/,2016-02-01 13:17:44,120,1,149,120,0,0,0,0,0
163201283712008_1106028246095969,A.F.Branco ((( Past Blast Cartoon ))),A.F.Branco Cartoon - GOP Compromise,link,http://comicallyincorrect.com/2016/01/31/past-blast-cartoon-gop-compromise/,2016-01-31 14:51:59,107,6,145,107,0,0,0,0,0
163201283712008_1104840596214734,A.F.Branco - Feel the Bern,A.F.Branco - Feel The Bern,link,http://comicallyincorrect.com/2016/01/29/feel-the-bern/,2016-01-29 15:00:31,145,9,183,145,0,0,0,0,0
163201283712008_1104799949552132,((( Friday Past Blast Cartoon ))),A.F.Branco Cartoon - About Last Night (Friday Past Bast),link,http://comicallyincorrect.com/2016/01/29/gop-amnesty-3/,2016-01-29 13:36:19,83,5,129,83,0,0,0,0,0
163201283712008_1104265209605606,"A.F. Branco Caption Contest ((( WE HAVE A WINNER! )))
Congratulations Michael Mucci. He wins a personally autographed A.F. Branco book of cartoons.
http://patriotdepot.com/comically-incorrect-a-collection-of-politically-incorrect-comics-volume-1/",Caption Contest Winner | Michael Mucci | A.F. Branco,link,http://comicallyincorrect.com/2016/01/28/caption-contest-winner-michael-mucci/,2016-01-28 14:37:48,95,6,47,95,0,0,0,0,0
163201283712008_1104227089609418,Today's A.F.Branco Cartoon,A.F. Branco Cartoon - Torn,link,http://comicallyincorrect.com/2016/01/28/trump-vs-cruz/,2016-01-28 13:01:46,80,9,79,80,0,0,0,0,0
163201283712008_1103699342995526,Today's A.F.Branco Cartoon,A.F.Branco Cartoon - Hillary BFF,link,http://comicallyincorrect.com/2016/01/27/hillary-bff/,2016-01-27 11:58:20,181,10,278,181,0,0,0,0,0
163201283712008_1103123859719741,Today's A.F.Branco Cartoon,A.F.Branco Cartoon - Who's Counting?,link,http://comicallyincorrect.com/2016/01/26/two-corinthians-trump/,2016-01-26 12:39:54,199,5,236,199,0,0,0,0,0
163201283712008_1102616003103860,Today's A.F. Branco Cartoon,A.F. Branco Cartoon - Cas Cow-ardice,link,http://comicallyincorrect.com/2016/01/25/1-7-billion-to-iran/,2016-01-25 11:50:13,172,7,256,172,0,0,0,0,0
163201283712008_1102170233148437,A.F.Branco ((( Past Blast ))) Cartoon,Branco (((Past Blast))) Cartoon - Record Climate Change,link,http://comicallyincorrect.com/2016/01/24/past-blast-cartoon-record-climate-change/,2016-01-24 14:24:21,182,11,107,182,0,0,0,0,0
163201283712008_1100521479979979,Today's A.F.Branco Cartoon,A.F. Branco Cartoon - The Shadow Knows,link,http://comicallyincorrect.com/2016/01/21/hillarys-shadow/,2016-01-21 13:10:24,129,6,114,129,0,0,0,0,0
163201283712008_1099884640043663,Today's A.F.Branco Cartoon,A.F.Branco Cartoon - Wake Up America,link,http://comicallyincorrect.com/2016/01/20/president-hillary-clinton/,2016-01-20 10:51:48,409,32,2112,409,0,0,0,0,0
163201283712008_1099412990090828,Today's A.F.Branco Cartoon,A.F.Branco Cartoon - Stranger Than Fiction,link,http://comicallyincorrect.com/2016/01/19/bad-obama-economy/,2016-01-19 13:12:11,133,6,127,133,0,0,0,0,0
163201283712008_1099066716792122,Today's ((( 2nd ))) A.F.Branco Cartoon,A.F. Branco Cartoon - He Had A Dream,link,http://comicallyincorrect.com/2016/01/18/mlk-character-matters/,2016-01-18 20:53:00,130,1,107,130,0,0,0,0,0
163201283712008_1098952840136843,Today's A.F.Branco Cartoon,A.F. Branco Cartoon - Mission Accomplished,link,http://comicallyincorrect.com/2016/01/18/u-s-navy-in-iran/,2016-01-18 15:35:57,150,11,201,150,0,0,0,0,0
163201283712008_1097334710298656,Today's A.F.Branco Cartoon,A.F.Branco Cartoon - Obama Regrets,link,http://comicallyincorrect.com/2016/01/15/obama-regrets/,2016-01-15 14:54:49,137,3,129,137,0,0,0,0,0
163201283712008_1096777957020998,Today's A.F.Branco Cartoon,A.F.Branco Cartoon - Front-Runner Problems,link,http://comicallyincorrect.com/2016/01/14/front-runner-problems/,2016-01-14 13:56:39,176,8,139,176,0,0,0,0,0
163201283712008_1096202050411922,Today's A.F.Branco Cartoon,A.F.Branco Cartoon - What's He Smokin'?,link,http://comicallyincorrect.com/2016/01/13/obama-sotu-denial/,2016-01-13 11:56:15,287,18,452,287,0,0,0,0,0
163201283712008_1095746530457474,Today's A.F.Branco Cartoon,A.F.Branco Cartoon - Obama SOTU Rubble,link,http://comicallyincorrect.com/2016/01/12/obamas-sotu-rubble/,2016-01-12 13:30:48,160,10,130,160,0,0,0,0,0
163201283712008_1095242580507869,Today's A.F.Branco Cartoon,A.F.Branco Cartoon -,link,http://comicallyincorrect.com/2016/01/11/sean-penn-interview/,2016-01-11 12:42:32,207,18,230,207,0,0,0,0,0
163201283712008_1093705060661621,Today's A.F.Branco Cartoon,A.F.Branco Cartoon - Obama Promises,link,http://comicallyincorrect.com/2016/01/08/obama-promises/,2016-01-08 19:57:40,156,13,167,156,0,0,0,0,0
163201283712008_1093028310729296,Today's ((( 2nd ))) A.F.Branco Cartoon,A.F.Branco - Socialist vs Democrat,link,http://comicallyincorrect.com/2016/01/07/socialist-vs-democrat/,2016-01-07 14:38:51,264,11,277,264,0,0,0,0,0
163201283712008_1093019160730211,Today's ((( 1st )))  A.F. Branco Cartoon,A.F.Branco Cartoon - But One Life,link,http://comicallyincorrect.com/2016/01/07/but-one-life/,2016-01-07 14:27:10,121,7,97,121,0,0,0,0,0
163201283712008_1092452357453558,Today's A.F.Branco Cartoon,A.F. Branco Cartoon - Where There's A Will,link,http://comicallyincorrect.com/2016/01/06/where-theres-a-will/,2016-01-06 12:52:47,189,13,143,189,0,0,0,0,0
163201283712008_1091940040838123,Today's A.F.Branco Cartoon,A.F.Branco Cartoon - Great Guns!,link,http://comicallyincorrect.com/2016/01/05/great-guns/,2016-01-05 13:22:22,220,15,254,220,0,0,0,0,0
163201283712008_1089180477780746,A.F. Branco Cartoon - Bills of a Feather ( 2014 ),A.F.Branco 2014 Cartoon - Bills of a Feather,link,http://comicallyincorrect.com/2014/12/09/clinton-empathy/,2015-12-31 18:04:31,147,3,115,147,0,0,0,0,0
163201283712008_1089049694460491,"Today's A.F.Branco Cartoon
*** HAPPY NEW YEAR ***",A.F. Branco Cartoon - Party Pooper,link,http://comicallyincorrect.com/2015/12/31/obama-2016-agenda/,2015-12-31 13:27:18,151,12,187,151,0,0,0,0,0
163201283712008_1088381614527299,Today's A.F.Branco Cartoon,A.F. Branco Cartoon - Operation Get-Away,link,http://comicallyincorrect.com/2015/12/30/obama-isis-vacation/,2015-12-30 11:42:35,133,8,157,133,0,0,0,0,0
163201283712008_1087900001242127,Today's A.F.Branco Cartoon,A.F.Branco Cartoon - What's One More Year?,link,http://comicallyincorrect.com/2015/12/29/obamas-last-year/,2015-12-29 13:18:52,215,12,252,215,0,0,0,0,0
163201283712008_1087348407963953,Today's A.F.Branco Cartoon,A.F.Branco Cartoon - Hard Choices,link,http://comicallyincorrect.com/2015/12/28/trump-vs-clinton/,2015-12-28 12:29:30,190,9,280,190,0,0,0,0,0
163201283712008_1085013314864129,"Today's (( 2nd )) A.F.Branco Cartoon 

MERRY CHRISTMAS!",A.F.Branco Cartoon - GOPe Meltdown,link,http://comicallyincorrect.com/2015/12/24/gope-meltdown/,2015-12-24 13:16:28,172,21,126,172,0,0,0,0,0
163201283712008_1085012391530888,A.F.Branco Mentioned on the Five along with Michael Ramirez - what an honor.,A.F.Branco | The Five | Video,link,http://comicallyincorrect.com/2015/12/24/a-f-branco-mentioned-on-the-five/,2015-12-24 13:13:21,78,8,6,78,0,0,0,0,0
163201283712008_1085007934864667,Today's (( 1st )) A.F. Branco Cartoon,A.F. Branco Cartoon - Crybully,link,http://comicallyincorrect.com/2015/12/24/crybaby-hillary/,2015-12-24 13:02:13,103,7,71,103,0,0,0,0,0
163201283712008_1084329078265886,Today's A.F.Branco Cartoon,A.F.Branco Cartoon - Santa's Wish List,link,http://comicallyincorrect.com/2015/12/23/santas-wish-list/,2015-12-23 12:43:44,217,18,213,217,0,0,0,0,0
163201283712008_1083661508332643,Today's A.F.Branco Cartoon,A.F.Branco Cartoon - GOP Finale,link,http://comicallyincorrect.com/2015/12/22/end-of-the-gop/,2015-12-22 16:03:07,140,10,138,140,0,0,0,0,0
163201283712008_1082844795080981,"Today's A.F.Branco Cartoon

A.F.Branco Book - Comically Incorrect ----> 
http://patriotdepot.com/comically-incorrect-a-collection-of-politically-incorrect-comics-volume-1/",A.F.Branco Cartoon - The Farce Is With Us,link,http://comicallyincorrect.com/2015/12/21/universal-disaster/,2015-12-21 12:46:07,151,11,160,151,0,0,0,0,0
163201283712008_1080738095291651,Today's ((( 2nd ))) A.F.Branco Cartoon,A.F.Branco Cartoon - A Little Help,link,http://comicallyincorrect.com/2015/12/17/jebs-in-trouble/,2015-12-17 13:42:38,134,20,93,134,0,0,0,0,0
163201283712008_1080704031961724,Today's ((( 1st ))) A.F.Branco Cartoon,A.F.Branco Cartoon - Security Gap,link,http://comicallyincorrect.com/2015/12/17/security-gap/,2015-12-17 12:10:22,148,8,93,148,0,0,0,0,0
163201283712008_1080302642001863,"A.F.Branco Caption Contest 
((( MUST GO TO LINK TO ENTER)))",Comically Incorrect's Caption This Photo Contest,link,http://comicallyincorrect.com/cartoon-caption-contest/,2015-12-16 14:06:43,27,2,11,27,0,0,0,0,0
163201283712008_1080287568670037,"Today's A.F.Branco Cartoon

A.F.Branco's New Book ----- > http://patriotdepot.com/comically-incorrect-a-collection-of-politically-incorrect-comics-volume-1/",A.F.Branco Cartoon - Liberal's ISIS Strategy,link,http://comicallyincorrect.com/2015/12/16/liberals-isis-strategy/,2015-12-16 13:25:35,136,5,96,136,0,0,0,0,0
163201283712008_1079846588714135,"Today's A.F.Branco Cartoon 

A.F.Branco Online Store ------> http://patriotdepot.com/comically-incorrect/",A.F.Branco Cartoon - Take With Alcohol,link,http://comicallyincorrect.com/2015/12/15/paris-agreement/,2015-12-15 13:49:44,113,3,107,113,0,0,0,0,0
163201283712008_1079278078770986,"Today's A.F.Branco Cartoon

A.F.Branco Book---------> http://patriotdepot.com/comically-incorrect-a-collection-of-politically-incorrect-comics-volume-1/",A.F.Branco Cartoon - Miss Fortune,link,http://comicallyincorrect.com/2015/12/14/miss-fortune/,2015-12-14 13:18:27,139,10,160,139,0,0,0,0,0
163201283712008_1078800755485385,"Thank you to those who have purchased my book Comically Incorrect. If you can find the time, please go to the link below and post a review. I appreciate all the support you have given me for what I do.
http://patriotdepot.com/comically-incorrect-a-collection-of-politically-incorrect-comics-volume-1/",Comically Incorrect: A Collection of Politically-Incorrect Comics  Volume 1,link,http://patriotdepot.com/comically-incorrect-a-collection-of-politically-incorrect-comics-volume-1/,2015-12-13 13:58:09,15,2,3,15,0,0,0,0,0
163201283712008_1077857728913021,,A.F.Branco on the Larry Elder Show,video,https://www.youtube.com/embed/w3vZTwVZGdY,2015-12-11 13:59:00,23,5,5,23,0,0,0,0,0
163201283712008_1077383305627130,Today ((( 2nd ))) A.F.Branco Cartoon,A.F.Branco Cartoon - Leaving His Mark,link,http://comicallyincorrect.com/2015/12/10/obama-legacies/,2015-12-10 15:12:28,169,13,168,169,0,0,0,0,0
163201283712008_1077345088964285,"Today's (((1st)))  A.F.Branco Cartoon

A.F.Branco Comically Incorrect BOOK!!!!
http://patriotdepot.com/comically-incorrect-a-collection-of-politically-incorrect-comics-volume-1/",A.F. Branco Cartoon - The Gambler,link,http://comicallyincorrect.com/2015/12/10/obama-gambles-lives/,2015-12-10 13:43:54,151,15,158,151,0,0,0,0,0
