status_id,status_message,link_name,status_type,status_link,status_published,num_reactions,num_comments,num_shares,num_likes,num_loves,num_wows,num_hahas,num_sads,num_angrys
1641262382839336_1683570531941854,"I could possibly stand to watch Fox News if they're going to humiliate Trump more often.
#LIKE + #SHARE this post if you agree!",Video: Fox Audience Outraged At Conservative Host For Outting Trump For The Fraud That He Is,link,http://leftliberal.com/2017/01/12/video-fox-audience-outraged-at-conservative-host-for-outting-trump-for-the-fraud-that-he-is/,2017-01-12 08:21:45,961,86,183,833,20,6,95,3,4
1641262382839336_1683546358610938,"Somebody's gotta do it, it might as well be her.
How much do you love Jeb Bush for sticking it to Trump?
#SHAREIT",Jeb Bush Just Told Melania To Take Something From Her Husband,link,http://leftliberal.com/2017/01/12/jeb-bush-just-told-melania-to-take-something-from-her-husband/,2017-01-12 07:00:29,360,33,30,281,21,0,56,0,2
1641262382839336_1683438195288421,"And pigs fly right?
SHAMEFUL❗️ Is Donald Trump your president? LIKE = HELL NO WAY!",Mexico's Response To Trump's Wall… Is It Going To Happen?,link,http://leftliberal.com/2017/01/12/mexicos-response-to-trumps-wall-is-it-going-to-happen/,2017-01-12 00:45:55,1449,80,138,1341,16,4,69,3,16
1641262382839336_1683420168623557,"The crooks will just find another to replace him.
Gee, ya think? #BasketOfDeplorables #GOP",Trump's Cabinet UNRAVELING After Trump's Pick Now Under Investigation,link,http://leftliberal.com/2017/01/12/trumps-cabinet-unraveling-after-trumps-pick-now-under-investigation/,2017-01-11 23:46:07,505,21,99,346,10,4,97,9,39
1641262382839336_1683403378625236,"Republicans Don't Want You To Read It!
Let's get 10,000 'Shares' to keep the media from burying this!",(VIDEO) MLK's Wife Wrote THIS About Trump's AG PICK. It Is SHOCKING.,link,http://leftliberal.com/2017/01/12/video-mlks-wife-wrote-this-about-trumps-ag-pick-it-is-shocking/,2017-01-11 22:45:15,1284,23,531,1109,28,24,9,50,64
1641262382839336_1683385375293703,"Watch how she tries to squirm her way out of this one.
Everyone needs to see this! #SHAREIT",Seth Meyers Asks Conway Over Russia's Effort To Blackmail Trump,link,http://leftliberal.com/2017/01/12/seth-meyers-asks-conway-over-russias-effort-to-blackmail-trump/,2017-01-11 21:45:30,241,25,27,173,4,3,43,0,18
1641262382839336_1683366695295571,"Trump the fool still believes Russia is innocent.
The orange buffoon is just a greedy, nasty traitor! He is NOT my president!
SHARE to STOP them!",US Spies Warn Trump. Guess Who Russia Is Hitting Next?,link,http://leftliberal.com/2017/01/12/us-spies-warn-trump-guess-who-russia-is-hitting-next/,2017-01-11 20:46:09,763,49,203,608,4,7,34,9,101
1641262382839336_1683350185297222,"Go BERNIE! We support you.
Let's show Bernie some love and get 5,000 shares to let him know we've got HIS BACK!",(VIDEO) Bernie SHUTS Down Rich Trump Voter Whining About Being Rich,link,http://leftliberal.com/2017/01/12/video-bernie-shuts-down-rich-trump-voter-whining-about-being-rich/,2017-01-11 19:45:19,2477,34,426,2338,114,1,21,1,2
1641262382839336_1683335058632068,"What's new? Trump's a fraud too.
#Share this everywhere to show how badly they lie!",PROOF: Trump's National Sec. Pick Had A INVALID PH. D!,link,http://leftliberal.com/2017/01/12/proof-trumps-national-sec-pick-had-a-invalid-ph-d/,2017-01-11 18:45:44,635,61,258,377,4,29,112,16,97
1641262382839336_1683315155300725,"At least rate Trump is better off singing on stage himself.
#LIKE + #SHARE this if you think Trump should be IMPEACHED!",Trump's Inauguration Rejected AGAIN By ANOTHER Major Singer,link,http://leftliberal.com/2017/01/12/trumps-inauguration-rejected-again-by-another-major-singer/,2017-01-11 17:45:12,755,61,164,626,26,2,97,1,3
1641262382839336_1683297818635792,"Whoa, just whoa.
YOU JUST HAVE TO READ THIS! #SHAREIT",What Is Happening At Jeff Session's Confirmation Hearing Will Blow Your Mind,link,http://leftliberal.com/2017/01/12/what-is-happening-at-jeff-sessions-confirmation-hearing-will-blow-your-mind/,2017-01-11 16:45:40,119,11,23,69,0,16,20,2,12
1641262382839336_1683282991970608,"Does Trump mean he's going to have porn or something❗️❓  ¯_(ツ)_/¯
Is Donald Trump your president? LIKE = NEVER!","Trump Announces Inauguration Will Have ""Soft Sensuality""…",link,http://leftliberal.com/2017/01/12/trump-announces-inauguration-will-have-soft-sensuality/,2017-01-11 15:46:42,1370,367,132,1062,3,22,194,6,83
1641262382839336_1683265855305655,"This is an OUTRAGE we cannot stand for this.
If we get 15,000 Likes, we'll send a Message to the Office of Government Justice!!",Republicans Secretly Pass Rule That Protects Lawmakers From CRIMINAL Investigation,link,http://leftliberal.com/2017/01/12/republicans-secretly-pass-rule-that-protects-lawmakers-from-criminal-investigation/,2017-01-11 14:46:07,3810,259,922,2989,8,36,7,60,710
1641262382839336_1683249948640579,"And the winner is the previous Batman!
Can we get 10,000 Likes for George Clooney publicly trashing The Donald?",George Clooney Jumps In On Streep V Trump,link,http://leftliberal.com/2017/01/12/george-clooney-jumps-in-on-streep-v-trump/,2017-01-11 13:45:50,596,8,19,559,33,0,3,1,0
1641262382839336_1683233011975606,"Look at Jeff sessions SQUIRM!
#Share this everywhere to show how badly he lies!",Watch Jeff Sessions TRAPPED By Al Fraken During Cross Examination,link,http://leftliberal.com/2017/01/12/watch-jeff-sessions-trapped-by-al-fraken-during-cross-examination/,2017-01-11 12:45:57,358,15,43,296,24,0,33,1,4
1641262382839336_1683219561976951,"Brings a new meaning to ""golden showers"". Literally.
What now? Should there be an IMMEDIATE investigation? LIKE = YES!",Russian Sources Have Videos Of Prostitutes Literally PEEING On Trump (NO JOKE),link,http://leftliberal.com/2017/01/12/russian-sources-have-videos-of-prostitutes-literally-peeing-on-trump-no-joke/,2017-01-11 11:45:22,1708,259,369,1367,18,88,190,7,38
1641262382839336_1683204955311745,"Streisand is 100% CORRECT!
Can we get 10,000 Likes for the classy Streisand?",Streisand Backs Streep And SHREDS Trump A New Asshole,link,http://leftliberal.com/2017/01/11/streisand-backs-streep-and-shreds-trump-a-new-asshole/,2017-01-11 10:45:37,2238,23,166,2083,115,2,36,0,2
1641262382839336_1683032761995631,"The world could become a much more dangerous place soon. Read the report!
Do you think Trump will lead us to war? LIKE = SADLY YES!",IT COULD GET WORSE! U.S. Intelligence WARNS of MORE TRUMPS Coming to Power,link,http://leftliberal.com/2017/01/11/it-could-get-worse-u-s-intelligence-warns-of-more-trumps-coming-to-power/,2017-01-11 00:30:44,440,40,39,357,0,11,2,23,47
1641262382839336_1683009931997914,"Trump just can't handle losing! Watch the video!
Donald Trump is such a loser, agree? LIKE = YES!",Obama's Support Sending Trump Into a Tantrum!,link,http://leftliberal.com/2017/01/11/obamas-support-sending-trump-into-a-tantrum/,2017-01-10 23:15:43,1650,41,147,1485,74,0,85,2,4
1641262382839336_1682979312000976,"None of his nominees will be able to answer these questions truthfullly without making themselves look like idiots.
If we get 15,000 Likes, we'll send a Message to the Office of Government Ethics!!",Here Are The Questions Democratic Senators Must Ask Trump's Nominees,link,http://leftliberal.com/2017/01/11/here-are-the-questions-democratic-senators-must-ask-trumps-nominees/,2017-01-10 22:00:22,711,13,73,684,16,1,1,0,9
1641262382839336_1682956758669898,"Obama sends a perfect message to the clueless Trump.
Are you going to miss President Obama like CRAZY? LIKE = YES!!",Obama's Words of Wisdom: Why Ignoring Intelligence is NOT the Solution,link,http://leftliberal.com/2017/01/11/obamas-words-of-wisdom-why-ignoring-intelligence-is-not-the-solution/,2017-01-10 20:46:07,1448,66,96,1368,57,1,4,17,1
1641262382839336_1682939022005005,"The Italian Designer promoted Trump, but the internet was having NONE OF IT. See what was said!
Let us know what you think in the comments!",Dolce & Gabbana RIPPED for Supporting Melania Trump,link,http://leftliberal.com/2017/01/11/dolce-gabbana-ripped-for-supporting-melania-trump/,2017-01-10 19:31:18,168,48,12,103,1,3,41,0,20
1641262382839336_1682917562007151,"After a 12 HOUR RANT he finally fell apart!
Do you think Donald Trump has a personality disorder? LIKE = YES!",Trump's Twitter MELTDOWN: Raising Questions About his Mental Health,link,http://leftliberal.com/2017/01/11/trumps-twitter-meltdown-raising-questions-about-his-mental-health/,2017-01-10 18:15:24,6069,953,949,5455,29,82,294,42,167
1641262382839336_1682898915342349,"Get comfortable, America. We're about to get REAL cozy with Russia.
SHARE if you think Trump should be IMPEACHED!
#NEVERBEMYPOTUS #ORANGEPUPPET",Trump's ONE Consistency: His Love for PUTIN,link,http://leftliberal.com/2017/01/11/trumps-one-consistency-his-love-for-putin/,2017-01-10 17:01:06,438,65,256,296,2,12,13,7,108
1641262382839336_1682881115344129,"Caught again in a narcissistic lie! 
Is there ANYONE who would make a worse president than Trump?",Donald Trump BRAGS and then the Truth is Revealed!,link,http://leftliberal.com/2017/01/11/donald-trump-brags-and-then-the-truth-is-revealed/,2017-01-10 15:45:44,347,56,49,225,0,8,57,5,52
1641262382839336_1682861345346106,"Breaking laws and traditions, Trump is filling his cabinet with family. 
The GOP corruption continues…",The Nepotism of the Trump Presidency: His Sons in Power!,link,http://leftliberal.com/2017/01/11/the-nepotism-of-the-trump-presidency-his-sons-in-power/,2017-01-10 14:30:51,277,58,117,112,0,1,6,11,147
1641262382839336_1682836905348550,"Well, THIS is embarrassing. 
Is Donald Trump a true narcissist? LIKE = THIS PROVES IT!!",Trump's Blatant LIES About His Inauguration,link,http://leftliberal.com/2017/01/11/trumps-blatant-lies-about-his-inauguration/,2017-01-10 13:15:39,695,79,104,561,3,3,91,6,31
1641262382839336_1682810092017898,"Watch the video. You won't believe what she says!
How much do you want Kellyanne Conway to just go away?",UNBELIEVABLE. Kellyanne Conway DEFENDS Trump for Mocking the Disabled,link,http://leftliberal.com/2017/01/11/unbelievable-kellyanne-conway-defends-trump-for-mocking-the-disabled/,2017-01-10 12:00:29,1010,463,239,541,4,26,60,37,342
1641262382839336_1682784278687146,"The Nasty Hypocrisy of the Reality Star President
We need 25,000 #SHARES on this so we can make it go viral and fight Trump tooth and nail!!!",Ron Howard Destroys Trump Fans for Attacking Streep,link,http://leftliberal.com/2017/01/10/ron-howard-destroys-trump-fans-for-attacking-streep/,2017-01-10 10:45:31,535,16,114,489,28,1,13,1,3
1641262382839336_1682755895356651,"You can't touch Meryl. 
Would you trust ANYTHING that comes from Trump's mouth?
LIKE = NO WAY!",Trump's Attack on Meryl Streep is ONE BIG FLOP,link,http://leftliberal.com/2017/01/10/trumps-attack-on-meryl-streep-is-one-big-flop/,2017-01-10 09:30:13,994,77,59,875,10,5,93,2,9
1641262382839336_1682729082025999,"Hollywood's reigning queen continues to give us chills! See what she said!
MUST WATCH. #Share this to spread the news about the spectacular speech!",Meryl Does it Again! Her Speech Against Trump Will Amaze You!,link,http://leftliberal.com/2017/01/10/meryl-does-it-again-her-speech-against-trump-will-amaze-you/,2017-01-10 08:15:16,421,18,39,364,45,1,10,1,0
1641262382839336_1682710202027887,"This goes to show you she's exactly the type of person I would have wanted to be President.
Does Hillary Clinton still have your support?? YES or NO:","Everyone Thinks Hillary Will Run For NYC Mayor, But She Has Other Plans",link,http://leftliberal.com/2017/01/10/everyone-thinks-hillary-will-run-for-nyc-mayor-but-she-has-other-plans/,2017-01-10 07:00:59,578,74,9,536,36,0,0,5,1
1641262382839336_1682606722038235,"Trump cronies can't help but cozy up to Russia. See what Sean Hannity just said! 
Would you trust ANYTHING that comes from Hannity's mouth?
LIKE = NO WAY!","Fox's Hannity Tweets ""MAKE RUSSIA GREAT AGAIN!"" But the Internet Is NOT HAVING IT!",link,http://leftliberal.com/2017/01/10/foxs-hannity-tweets-make-russia-great-again-but-the-internet-is-not-having-it/,2017-01-10 00:30:41,598,142,134,390,1,16,43,5,143
1641262382839336_1682583982040509,"Is this really the kind of man we're supposed to follow? 
This is beyond cold! He has no respect for time honored traditions.
Do you accept it?",WATCH: Trump Happily Crushes an 89-Year-Old National Icon,link,http://leftliberal.com/2017/01/10/watch-trump-happily-crushes-an-89-year-old-national-icon/,2017-01-09 23:16:07,525,113,146,188,1,13,6,77,240
1641262382839336_1682564502042457,"Inauguration workers are telling the depressing truth about plans for the ceremony. 
We've NEVER heard reactions like this before!
#CheckThisOut #SHAREIT",Trump's Inauguration is a Sh!tshow! Check Out The Awful Truth Straight from the Source!,link,http://leftliberal.com/2017/01/10/trumps-inauguration-is-a-shtshow-check-out-the-awful-truth-straight-from-the-source/,2017-01-09 22:00:44,642,74,150,414,3,10,132,72,11
1641262382839336_1682542625377978,"Pence gets humiliated. Clinton gets applauded. You can see it all here! 👏👏👏
This is amazing news! Let's get 5000 SHARES for Hillary!",VIDEO: Hillary Receives a Standing Ovation on Broadway! Just Think How Embarressed Pence is Now!,link,http://leftliberal.com/2017/01/10/video-hillary-receives-a-standing-ovation-on-broadway-just-think-how-embarressed-pence-is-now/,2017-01-09 20:45:26,4141,84,841,3646,437,5,50,1,2
1641262382839336_1682524448713129,"Trump supporters don't want his cabinet picks to have to undergo background checks. What is it that they want to hide?
#SCAM #CON #CONSPIRACY #IDon'tBuyIt #SHAREIT",WASTE OF TIME' to Background Check Trump's Cabinet? What is Reince Priebus Wanting to Hide?,link,http://leftliberal.com/2017/01/10/waste-of-time-to-background-check-trumps-cabinet-what-is-reince-priebus-wanting-to-hide/,2017-01-09 19:30:21,677,218,276,302,2,39,19,16,299
1641262382839336_1682499878715586,"She unleashes hell on lazy journalists, spouting Trump lies and Tweets as headline news!
#LIKE + #SHARE this post if you agree!",Watch Joy Reid TRASH Lazy Reporters Who Just Promote Trump's Lying Tweets!,link,http://leftliberal.com/2017/01/10/watch-joy-reid-trash-lazy-reporters-who-just-promote-trumps-lying-tweets/,2017-01-09 18:15:58,598,15,108,547,42,1,6,0,2
1641262382839336_1682480652050842,"Sure, let's all just lay down and let Trump put his cronies in office. Read the ridiculous things Mitch McConnell just said! 
#SHARE this so it goes VIRAL if you think Mitch McConnell should be fired for his racist opinion!","Mitch McConnell Tells Democrats to GROW UP, Forget Ethics, And Just Support Trump!",link,http://leftliberal.com/2017/01/10/mitch-mcconnell-tells-democrats-to-grow-up-forget-ethics-and-just-support-trump/,2017-01-09 17:01:12,1240,567,665,536,3,19,190,16,476
1641262382839336_1682463025385938,"Is this how our government responds to the demands of the people? Violence and threats??
Paul Ryan is a sick coward! #PaulRyanSoScared #SHAREIT",Paul Ryans Won't Listen to the People! Sends Armed Guards to Block Petitions to Save Planned Parenthood!,link,http://leftliberal.com/2017/01/10/paul-ryans-wont-listen-to-the-people-sends-armed-guards-to-block-petitions-to-save-planned-parenthood/,2017-01-09 15:45:11,1048,243,447,491,1,20,29,22,485
1641262382839336_1682441552054752,"For 8 years the GOP have insisted Obama was a Muslim. Now the tables are turning-- just why is Trump so fond of Putin, anyways?
What do you think?",Could Trump Be a Russian Spy? The Washington Post Investigates!,link,http://leftliberal.com/2017/01/10/could-trump-be-a-russian-spy-the-washington-post-investigates/,2017-01-09 14:30:11,1160,310,461,883,16,78,126,7,50
1641262382839336_1682417748723799,"Welcome to the Age of Trump, where the President ignores Intelligence reports! 
SHARE if you think Trump should be IMPEACHED!",Trump's Anti-Intelligence Tweets Have People P!SSED! See What He Said!,link,http://leftliberal.com/2017/01/10/trumps-anti-intelligence-tweets-have-people-pssed-see-what-he-said/,2017-01-09 13:15:11,898,110,421,708,9,8,27,10,136
1641262382839336_1682393402059567,"His sneaky plans for his inauguration just don't add up! ¯_(ツ)_/¯
#NEVERBEMYPOTUS #ORANGECLOWN #SHAREITv","Trump is Steamrolling Tradition All the Way to the White House, and Something Isn't Right!",link,http://leftliberal.com/2017/01/10/trump-is-steamrolling-tradition-all-the-way-to-the-white-house-and-something-isnt-right/,2017-01-09 12:00:55,200,35,28,102,0,12,5,6,75
1641262382839336_1682369975395243,"GOP Spent 8 Years TRASHING Obama. Now They Want Us to Support TRUMP?
No problem-- we absolutely plan on treating Trump exactly the way they treated Obama. LIKE= AGREE!","Should Democrats ""Grow Up"" and Support TRUMP? Check Out What Mitch McConnell Just Said!",link,http://leftliberal.com/2017/01/09/should-democrats-grow-up-and-support-trump-check-out-what-mitch-mcconnell-just-said/,2017-01-09 10:45:50,7296,1002,1233,6314,90,39,428,15,410
1641262382839336_1682346395397601,"Here's the truth that no one else is saying about Trump!
Can we get 50,000 LIKES in support of Keith Olbermann saying what NEEDS to be said!👍🏻👍🏻👍🏻 #SHAREIT",The UGLY TRUTH About Trump! Keith Olbermann Lays It All Out!,link,http://leftliberal.com/2017/01/09/the-ugly-truth-about-trump-keith-olbermann-lays-it-all-out/,2017-01-09 09:30:23,878,15,108,824,32,4,14,3,1
1641262382839336_1682319348733639,"No one on Washington respects him. In typical fashion, Trump is having a temper tantrum. 
Will you be watching his Inauguration? LIKE = NO WAY!!",Washington Totally Snubs Trump for His Inauguration! Trump Can't Handle It!,link,http://leftliberal.com/2017/01/09/washington-totally-snubs-trump-for-his-inauguration-trump-cant-handle-it/,2017-01-09 08:16:02,5592,926,675,4914,97,12,506,12,51
1641262382839336_1682299605402280,"The Trump family just can't put the country first. Their business is always going to be their first priority!
PLEASE SHARE THIS EVERYWHERE TO SPREAD AWARENESS OF WHAT'S HAPPENING!!",More Trump Corruption! His Son-In-Law Caught in Major Confict of Interest!,link,http://leftliberal.com/2017/01/09/more-trump-corruption-his-son-in-law-caught-in-major-confict-of-interest/,2017-01-09 07:00:07,1243,112,824,763,5,32,53,26,364
1641262382839336_1682215155410725,"If you can't do it yourself, just have your kids do it for you.
You know what to do...
#GrabYourWallet #BoycottTrumps #SHAREIT",Ivanka Trump BUSTED For Breaking Daddy's BIGGEST Campaign Promise,link,http://leftliberal.com/2017/01/09/ivanka-trump-busted-for-breaking-daddys-biggest-campaign-promise/,2017-01-09 01:00:46,558,50,207,312,4,14,55,18,155
1641262382839336_1682196292079278,"Shady business deals with the mob, Russia... who else will be next?
The orange buffoon is just a greedy, nasty traitor! He is NOT my president!
#NEVERBEMYPOTUS #ORANGECLOWN #SHAREIT",VIDEO: MSNBC Uncovers Trump's Shady Business Relationships With The Mob,link,http://leftliberal.com/2017/01/09/video-msnbc-uncovers-trumps-shady-business-relationships-with-the-mob/,2017-01-08 23:45:14,798,45,301,556,9,38,8,12,175
1641262382839336_1682176028747971,"Trump can't stand people telling him what to do and it WILL BE his downfall.
Will Trump end up getting impeached his first year in office? LIKE = YES!",Ethics Watchdog Says Trump Ignoring Repeated Warnings About His Assets,link,http://leftliberal.com/2017/01/09/ethics-watchdog-says-trump-ignoring-repeated-warnings-about-his-assets/,2017-01-08 22:31:04,2225,268,368,1972,20,11,61,11,150
1641262382839336_1682157938749780,"You must read this. This is SHOCKING.
SHARE THIS EVERYWHERE if you're fed up with liberal media bull ONCE AND FOR ALL!",SHOCKING Truth Why Trump Is Taking Russia's Side,link,http://leftliberal.com/2017/01/09/shocking-truth-why-trump-is-taking-russias-side/,2017-01-08 21:15:56,449,59,216,282,5,24,3,6,129
1641262382839336_1682141908751383,"I'm CERTAIN he's not legitimate.
SHARE if you think Trump should be IMPEACHED NOW!",World Leader Unsure If Trump Is The 'Legitimate' President,link,http://leftliberal.com/2017/01/09/world-leader-unsure-if-trump-is-the-legitimate-president/,2017-01-08 20:00:21,1604,101,585,1448,47,7,94,1,7
1641262382839336_1682124742086433,"Trump is certainly welcome to go move to Russia.
Hit 'LIKE' if you stand with Obama no matter what!",Watch Obama As He Had To Remind Trump Which Country He Lives In,link,http://leftliberal.com/2017/01/09/watch-obama-as-he-had-to-remind-trump-which-country-he-lives-in/,2017-01-08 18:45:45,5940,173,929,5599,182,18,99,16,26
1641262382839336_1682105278755046,"People of Wisconsin just need to remember that next time it comes time to vote.
Let's get 5000 SHARES in support of kicking this LUNATIC out of office!",VIDEO: Paul Ryan Locks Constituents Out Of Capitol But Neighboring Democrat Representative Let Them Into Her Office,link,http://leftliberal.com/2017/01/09/video-paul-ryan-locks-constituents-out-of-capitol-but-neighboring-democrat-representative-let-them-into-her-office/,2017-01-08 17:30:24,4021,444,1748,3145,77,55,54,41,649
1641262382839336_1682087725423468,"I wouldn't be surprised if it also had something to do with Russia.
How much lower can GOP go??? SHARE to STOP them!",Ethics Office Discovers Republican Schemes To Get Trump's Nominees Confirmed,link,http://leftliberal.com/2017/01/09/ethics-office-discovers-republican-schemes-to-get-trumps-nominees-confirmed/,2017-01-08 16:15:23,904,92,541,491,3,37,6,24,343
1641262382839336_1682069252091982,"Mike Pence, you wish you were Joe Biden.
Can we get 10,000 Likes for the legendary Joe Biden?💙💙💙",Joe Biden Leaves His Mark On The VP Presidential Desk,link,http://leftliberal.com/2017/01/09/joe-biden-leaves-his-mark-on-the-vp-presidential-desk/,2017-01-08 15:00:31,3605,86,174,3342,237,1,22,2,1
1641262382839336_1682048052094102,"He is SOOO BUSTED!
This is beyond crazy! YOU JUST HAVE TO READ THIS! 😡😡😡",OMG Guess What Trump's National Security Pick Got Caught Doing?,link,http://leftliberal.com/2017/01/09/omg-guess-what-trumps-national-security-pick-got-caught-doing/,2017-01-08 13:45:42,628,53,213,367,3,28,68,17,145
1641262382839336_1682029388762635,"Trump calling us stupid?
Orange sack of $h!t. Stop tweeting, stop talking, stop doing anything. You are going to Make America Suffer Again.😡😡😡 
#SHAREIT",Trump Insults 'Stupid' Americans In Pro-Russia Tweet Marathon. See What Else He Had To Say To Insult His Constituents,link,http://leftliberal.com/2017/01/09/trump-insults-stupid-americans-in-pro-russia-tweet-marathon-see-what-else-he-had-to-say-to-insult-his-constituents/,2017-01-08 12:30:09,1390,272,581,878,11,19,46,25,411
1641262382839336_1682008658764708,"We should all get behind this.
MUST WATCH. He's the man for a reason! Please Share this heartwarming story to ALL of your closest friends and family and comment GOOO CORY BOOKER!",VIDEO: Republicans Try To Defund Planned Parenthood But Cory Booker Tells America How To Fight Back,link,http://leftliberal.com/2017/01/09/video-republicans-try-to-defund-planned-parenthood-but-cory-booker-tells-america-how-to-fight-back/,2017-01-08 11:15:52,417,16,71,383,28,1,3,1,1
1641262382839336_1681986872100220,"I don't care who does it as long as they do it NOW!
Like = AGREE!
#ImpeachTrump #StopTrump #DumpTrump #NOW",GOP Leader Is DONE With Trump! Check Out His Plan To Take Him Down,link,http://leftliberal.com/2017/01/08/gop-leader-is-done-with-trump-check-out-his-plan-to-take-him-down/,2017-01-08 10:05:33,3354,128,738,3138,140,36,23,2,15
1641262382839336_1681957835436457,"The resemblance is uncanny!
If THIS doesn't make you LOL, nothing will!😂😂😂",Want To Troll Mitch McConnell? Send Him This,link,http://leftliberal.com/2017/01/08/want-to-troll-mitch-mcconnell-send-him-this/,2017-01-08 08:15:49,847,129,207,615,13,1,200,1,17
1641262382839336_1681936538771920,"I watched it three times.
He is one of the greatest Presidents ever. Can we get 1,000,000 'LIKES' for Obama?💙💙💙",Celebrities Film A Farewell Video To Obama That Will Bring TEARS To Your Eyes,link,http://leftliberal.com/2017/01/08/celebrities-film-a-farewell-video-to-obama-that-will-bring-tears-to-your-eyes/,2017-01-08 07:00:35,13445,342,2190,11763,1367,10,30,266,9
1641262382839336_1681846295447611,"Elizabeth Warren is a hero and I hope she takes him out.
Let's show Elizabeth Warren some love and get 15,000 SHARES!",Elizabeth Warren Wants To Keep Former Red Sox Pitcher In Retirement… Here's Why,link,http://leftliberal.com/2017/01/08/elizabeth-warren-wants-to-keep-former-red-sox-pitcher-in-retirement-heres-why/,2017-01-08 00:30:45,983,16,105,929,54,0,0,0,0
1641262382839336_1681827312116176,"How anyone can manage to work for Trump is beyond me.
Chris Cuomo doesn't mince words. Can we get 20,000 'LIKES' for Chris Cuomo?",VIDEO: Chris Cuomo Makes Kellyanne Conway Regret She Started Working For That Russian Puppet,link,http://leftliberal.com/2017/01/08/video-chris-cuomo-makes-kellyanne-conway-regret-she-started-working-for-that-russian-puppet/,2017-01-07 23:15:52,2811,119,304,2587,84,10,111,4,15
1641262382839336_1681809188784655,"Trump's lies and racist plans just keep getting worse!
WTF is wrong with this guy? SMH.
#Nevermypresident #SHAREIT","Vincente Fox's Comments To Trump Forced Him To Back Down, Now Americans Are Stuck Paying For Trump's Racist Monument",link,http://leftliberal.com/2017/01/08/vincente-foxs-comments-to-trump-forced-him-to-back-down-now-americans-are-stuck-paying-for-trumps-racist-monument/,2017-01-07 22:00:46,400,50,91,275,1,1,43,3,77
