status_id,status_message,link_name,status_type,status_link,status_published,num_reactions,num_comments,num_shares,num_likes,num_loves,num_wows,num_hahas,num_sads,num_angrys
1641262382839336_1701550516810522,Despicable.,Fake Christians Trash A Gay Friendly Church,link,http://leftliberal.com/2017/02/19/fake-christians-trash-a-gay-friendly-church/,2017-02-19 18:15:16,151,24,25,35,0,6,1,21,88
1641262382839336_1701528703479370,Unfortunately Betsy DeVos will never allow teachers to get another raise.,Would Raising Teacher Salaries Solve School Staffing Issues?,link,http://leftliberal.com/2017/02/19/would-raising-teacher-salaries-solve-school-staffing-issues/,2017-02-19 17:00:20,87,28,24,33,1,4,0,13,36
1641262382839336_1701503396815234,I pity this turd of a human.,Milo's Keynote Speech At Conservative Conference Will Attack Feminists And BLM,link,http://leftliberal.com/2017/02/19/milos-keynote-speech-at-conservative-conference-will-attack-feminists-and-blm/,2017-02-19 15:45:17,113,60,8,33,1,1,1,7,70
1641262382839336_1701482700150637,Don't let them off that easy.,What to Do if Your Member of Congress Isn't Holding a Town Hall,link,http://leftliberal.com/2017/02/19/what-to-do-if-your-member-of-congress-isnt-holding-a-town-hall/,2017-02-19 14:30:12,270,22,83,227,4,6,2,2,29
1641262382839336_1701457266819847,It's nice to know there's at least one Republican willing to say what everyone else already knows.,John McCain Warns Us That Trump's Media Attacks Are The Beginning Of A Dictatorship,link,http://leftliberal.com/2017/02/19/john-mccain-warns-us-that-trumps-media-attacks-are-the-beginning-of-a-dictatorship/,2017-02-19 13:15:10,1353,106,264,1170,42,26,5,21,89
1641262382839336_1701416763490564,,The Best Plan For Surviving The Trump Era Comes From Obama's Top Science Adviser,link,http://leftliberal.com/2017/02/19/the-best-plan-for-surviving-the-trump-era-comes-from-obamas-top-science-adviser/,2017-02-19 12:00:18,122,4,12,110,0,8,1,3,0
1641262382839336_1701378806827693,Burn in hell.,See Milo Get Schooled By All Of Bill Maher's Guests After Repeat Weak Arguments,link,http://leftliberal.com/2017/02/19/see-milo-get-schooled-by-all-of-bill-mahers-guests-after-repeat-weak-arguments/,2017-02-19 10:45:15,173,11,24,143,11,0,16,0,3
1641262382839336_1701352090163698,Actually Trump and all of his friends have business connections to Russia.,"Trump Says He Has No Russian Business Connections, FBI Probes Suggest That's A Lie",link,http://leftliberal.com/2017/02/19/trump-says-he-has-no-russian-business-connections-fbi-probes-suggest-thats-a-lie/,2017-02-19 09:30:14,1101,83,637,732,6,45,61,15,242
1641262382839336_1701322460166661,Can I be President too so I can have taxpayer funded vacations?,"Trump Must Be Working So Hard, Look How Many Vacations He's Taken Already",link,http://leftliberal.com/2017/02/19/trump-must-be-working-so-hard-look-how-many-vacations-hes-taken-already/,2017-02-19 08:15:18,953,126,322,538,4,10,117,18,266
1641262382839336_1701280433504197,Have you noticed Trump has toned down the anti-China rhetoric recently? Funny how that works.,China Pays Up To Play With Trump,link,http://leftliberal.com/2017/02/19/china-pays-up-to-play-with-trump/,2017-02-19 07:00:13,547,44,350,213,2,21,8,29,274
1641262382839336_1701142756851298,I want him locked up by the end of this year.,Judge Has Bad News For Chris Christie And His Bridge,link,http://leftliberal.com/2017/02/18/judge-has-bad-news-for-chris-christie-and-his-bridge/,2017-02-19 00:30:06,1088,140,239,873,48,20,143,2,2
1641262382839336_1701111603521080,Let's deport them instead.,Another Domestic Terrorist Is A White Male Trump Voter,link,http://leftliberal.com/2017/02/18/another-domestic-terrorist-is-a-white-male-trump-voter/,2017-02-18 23:15:04,1799,97,1002,1237,16,114,28,52,352
1641262382839336_1701085673523673,Everything he says is a calculated plot to entrench his authoritarian power.,Trump's Voter Fraud Lies Are Dangerous To Democracy,link,http://leftliberal.com/2017/02/18/trumps-voter-fraud-lies-are-dangerous-to-democracy/,2017-02-18 22:00:06,139,18,32,91,0,1,1,4,42
1641262382839336_1701055880193319,Republicans are claiming the committee shouldn't see his tax returns because it's bad for America to intimidate political enemies...,One Congressman Is Fighting To The End To Get Trump's Tax Returns,link,http://leftliberal.com/2017/02/18/one-congressman-is-fighting-to-the-end-to-get-trumps-tax-returns/,2017-02-18 20:45:04,1054,110,236,853,59,13,15,6,108
1641262382839336_1701025883529652,No doubt CEO's hate this idea.,Tax The 1% By Taxing The Machines That Take Your Jobs,link,http://leftliberal.com/2017/02/18/tax-the-1-by-taxing-the-machines-that-take-your-jobs/,2017-02-18 19:30:04,237,4,72,210,20,4,2,0,1
1641262382839336_1700984946867079,Hallelujah!,A Church In Denver Is The Last Sanctuary For One Immigrant Mother,link,http://leftliberal.com/2017/02/18/a-church-in-denver-is-the-last-sanctuary-for-one-immigrant-mother/,2017-02-18 18:15:18,116,1,2,95,11,0,0,10,0
1641262382839336_1700956010203306,Now all we need is to send them to their own private island and strand them there.,Corrupt Jared Kushner Married Into The Perfect Corrupt Family,link,http://leftliberal.com/2017/02/18/corrupt-jared-kushner-married-into-the-perfect-corrupt-family/,2017-02-18 17:00:17,688,66,146,488,10,12,62,13,103
1641262382839336_1700927396872834,,The NBA Is Messing With Texas Over Bad 'Bathroom Bill',link,http://leftliberal.com/2017/02/18/the-nba-is-messing-with-texas-over-bad-bathroom-bill/,2017-02-18 15:45:16,110,12,11,102,3,3,2,0,0
1641262382839336_1700901150208792,Trump apparently forgot about himself.,Trump Claims The Media Is Speaking For Special Interests,link,http://leftliberal.com/2017/02/18/trump-claims-the-media-is-speaking-for-special-interests/,2017-02-18 14:30:10,261,87,61,100,1,7,80,5,68
1641262382839336_1700861883546052,Why didn't they think of this before?,Firing Ranges Are Getting New Targets To Reduce Black Shootings,link,http://leftliberal.com/2017/02/18/firing-ranges-are-getting-new-targets-to-reduce-black-shootings/,2017-02-18 13:15:11,21,4,3,19,1,0,1,0,0
1641262382839336_1700830373549203,Republicans think it's good business to have a bunch of ill people bringing down the economy.,California Steps In To Do What The Federal Government Should Be Doing For Our Health,link,http://leftliberal.com/2017/02/18/breaking-california-responds-to-gop-repealing-obamacare-introduces-game-changing-law/,2017-02-18 12:00:15,112,0,23,92,13,2,0,0,5
1641262382839336_1700796056885968,"Those poor, poor Republicans can't legislate anymore hate.",Republicans Can't Introduce Any Legislation Because Democrats Have Slowed Them To A Halt,link,http://leftliberal.com/2017/02/18/republicans-cant-introduce-any-legislation-because-democrats-have-slowed-them-to-a-halt/,2017-02-18 10:45:13,2392,230,364,1932,230,12,206,2,10
1641262382839336_1700768996888674,The only time he'll admit he made a mistake is so he can make a bigger one.,Trump Deleted One Bad Tweet So He Could Replace It With A Worse Tweet,link,http://leftliberal.com/2017/02/18/trump-deleted-one-bad-tweet-so-he-could-replace-it-with-a-worse-tweet/,2017-02-18 09:30:14,240,52,45,110,1,11,61,9,48
1641262382839336_1700741266891447,Let's hope this one comes true.,There's A Remarkable Prediction Coming From One Presidential Historian,link,http://leftliberal.com/2017/02/18/theres-a-remarkable-prediction-coming-from-one-presidential-historian/,2017-02-18 08:15:13,477,55,88,406,39,19,8,0,5
1641262382839336_1700715153560725,Trump made his worst enemy when he criticized McCain.,McCain Not Afraid To Criticize Trump In Front Of An International Audience,link,http://leftliberal.com/2017/02/18/mccain-not-afraid-to-criticize-trump-in-front-of-an-international-audience/,2017-02-18 07:00:12,2100,161,306,1905,146,6,32,2,9
1641262382839336_1700541170244790,Trump lost the popular vote.,"Reporter Calls Out Trump For Lying About ""Yuge Election Win""",link,http://leftliberal.com/2017/02/17/reporter-calls-out-trump-for-lying-about-yuge-election-win/,2017-02-17 23:15:04,474,40,55,363,12,5,90,0,4
1641262382839336_1700519206913653,At this guy has basic morals.,Trump's Replacement For Flynn Shot Down Trump's Offer,link,http://leftliberal.com/2017/02/17/trumps-replacement-for-flynn-shot-down-trumps-offer/,2017-02-17 22:00:04,429,38,35,340,33,2,54,0,0
1641262382839336_1700492130249694,Trump is disgusting.,"Watch Trump Squirm As NBC Reporter Asks Him ""Why Should Americans Trust You""",link,http://leftliberal.com/2017/02/17/watch-trump-squirm-as-nbc-reporter-asks-him-why-should-americans-trust-you/,2017-02-17 20:45:04,844,64,195,634,46,11,136,3,14
1641262382839336_1700461656919408,Trump hires traitors,Flynn Caught Lying In FBI Interview About Russia,link,http://leftliberal.com/2017/02/17/flynn-caught-lying-in-fbi-interview-about-russia/,2017-02-17 19:30:04,239,40,62,131,1,15,5,9,78
1641262382839336_1700440246921549,This is kinda true.,Bill Maher Makes Brave Statement As To Why Liberals Lose Elections,link,http://leftliberal.com/2017/02/17/bill-maher-makes-brave-statement-as-to-why-liberals-lose-elections/,2017-02-17 18:15:16,44,2,8,32,0,2,2,5,3
1641262382839336_1700404556925118,Trump must be on drugs.,Trump Stupidly Thinks He Has Biggest Win Since Reagan,link,http://leftliberal.com/2017/02/17/trump-stupidly-thinks-he-has-biggest-win-since-reagan/,2017-02-17 17:00:16,867,211,232,406,3,28,340,14,76
1641262382839336_1700378736927700,Take a look at it.,Trump Just Got Trolled By TIME's New Cover,link,http://leftliberal.com/2017/02/17/trump-just-got-trolled-by-times-new-cover/,2017-02-17 15:45:16,544,32,102,383,36,6,114,2,3
1641262382839336_1700350383597202,Lock him up!,Felony Charges For Michael Flynn After Russian Lies,link,http://leftliberal.com/2017/02/17/felony-charges-for-michael-flynn-after-russian-lies/,2017-02-17 14:30:10,864,73,212,754,34,14,42,1,19
1641262382839336_1700327846932789,He most likely will.,Will Trump Replace Illegal Travel Ban With Another One?,link,http://leftliberal.com/2017/02/17/will-trump-replace-illegal-travel-ban-with-another-one/,2017-02-17 13:15:10,109,47,17,31,0,3,8,4,63
1641262382839336_1700301856935388,Dump Trump now!,Trump Signs Disasterous Bill Undoing Obama's Mining Laws,link,http://leftliberal.com/2017/02/17/trump-signs-disasterous-bill-undoing-obamas-mining-laws/,2017-02-17 12:00:13,709,156,195,229,1,10,1,74,394
1641262382839336_1700277100271197,Impeach him now.,"Trump's ""Impeachable Offense"". Look What He Did.",link,http://leftliberal.com/2017/02/17/trumps-impeachable-offense-look-what-he-did/,2017-02-17 10:45:16,703,55,173,537,17,16,28,1,104
1641262382839336_1700245536941020,This will be interesting.,Whoopi & Tiffany Trump Will Sit Together At NY Fashion Week,link,http://leftliberal.com/2017/02/17/whoopi-tiffany-trump-will-sit-together-at-ny-fashion-week/,2017-02-17 09:30:15,109,14,5,83,4,8,14,0,0
1641262382839336_1700210736944500,Trump is such an embarassment as president.,Trump Declares He Is Not Ranting & Raving While Ranting & Raving At Same Time,link,http://leftliberal.com/2017/02/17/trump-declares-he-is-not-ranting-raving-while-ranting-raving-at-same-time/,2017-02-17 08:15:13,1750,178,462,1100,7,26,471,33,113
1641262382839336_1700181380280769,Need more proof Trump fans?,Trump Is Racist. Here's Proof From Congressional Black Caucus.,link,http://leftliberal.com/2017/02/17/trump-is-racist-heres-proof-from-congressional-black-caucus/,2017-02-17 07:00:14,449,34,152,304,3,12,6,37,87
1641262382839336_1700024170296490,,Michael Moore Has 3 Names For Trump That He's Unable To Counter,link,http://leftliberal.com/2017/02/16/michael-moore-has-3-names-for-trump-that-hes-unable-to-counter/,2017-02-17 00:30:04,164,11,19,144,10,1,8,0,1
1641262382839336_1699997693632471,Hard to feel sorry for them.,Coal Miners Regret Voting For Trump After Finding Out He Lied,link,http://leftliberal.com/2017/02/16/coal-miners-regret-voting-for-trump-after-finding-out-he-lied/,2017-02-16 23:15:04,2600,574,1305,1675,17,97,526,220,65
1641262382839336_1699972530301654,Trump and Pence should be impeached at the same time.,Elizabeth Warren: We Can't Let Flynn Become A Scapegoat For Trump's Treason,link,http://leftliberal.com/2017/02/16/elizabeth-warren-we-cant-let-flynn-become-a-scapegoat-for-trumps-treason/,2017-02-16 22:00:05,4997,214,1864,4570,338,45,10,7,27
1641262382839336_1699950970303810,He's not the only one.,Republican Judge Wants Trump's Head On A Stick,link,http://leftliberal.com/2017/02/16/republican-judge-wants-trumps-head-on-a-stick/,2017-02-16 20:45:04,1488,73,300,1292,110,17,63,3,3
1641262382839336_1699927580306149,Losing the popular vote entitles you to nothing.,"Mr. President, It's Time To Put An End To Your Self-Entitlement",link,http://leftliberal.com/2017/02/16/mr-president-its-time-to-put-an-end-to-your-self-entitlement/,2017-02-16 19:30:05,841,52,166,703,20,4,68,2,44
1641262382839336_1699907973641443,"He has a heart, unlike Papa John",Little Caesars Founder Helped Rosa Parks Until She Died,link,http://leftliberal.com/2017/02/16/little-caesars-founder-helped-rosa-parks-until-she-died/,2017-02-16 18:15:19,1025,28,120,904,107,11,0,3,0
1641262382839336_1699881540310753,I hope so.,Flynn Scandal Will Be The End Of Trump - Dan Rather,link,http://leftliberal.com/2017/02/16/flynn-scandal-will-be-the-end-of-trump-dan-rather/,2017-02-16 17:00:23,933,69,141,848,61,7,13,2,2
1641262382839336_1699845046981069,She needs to join Mike Flynn in the unemployment line.,Kellyanne Conway Banned From Another Media Outlet,link,http://leftliberal.com/2017/02/16/kellyanne-conway-banned-from-another-media-outlet/,2017-02-16 15:45:18,599,22,54,478,38,2,80,0,1
1641262382839336_1699815040317403,It's not good.,Why Are Trump's Russia Talks A Secret? California Democrat Explains,link,http://leftliberal.com/2017/02/16/why-are-trumps-russia-talks-a-secret-california-democrat-explains/,2017-02-16 14:30:21,134,9,18,83,3,12,1,2,33
1641262382839336_1699747520324155,The mentally ill don't deserve what Trump should get.,Saying Donald Trump Has Mental Problems Is An Insult To The Mentally Ill,link,http://leftliberal.com/2017/02/16/saying-donald-trump-has-mental-problems-is-an-insult-to-the-mentally-ill/,2017-02-16 12:00:15,1332,128,339,1067,30,11,215,4,5
1641262382839336_1699715303660710,Lose weight and boycott Trump allies... perfect.,Nestle Is Our Next Boycott Target After Their Trump Relationship Gets Out,link,http://leftliberal.com/2017/02/16/nestle-is-our-next-boycott-target-after-their-trump-relationship-gets-out/,2017-02-16 10:45:14,484,58,125,408,10,7,14,4,41
1641262382839336_1699676373664603,"Hmm, I wonder who thought up this one.",DoD Planning To Help Russia With Syria,link,http://leftliberal.com/2017/02/16/dod-planning-to-help-russia-with-syria/,2017-02-16 09:30:06,161,59,61,25,0,9,2,17,108
1641262382839336_1699644117001162,It's hard to imagine which one of these guys is worse.,GOP Is Helping Pence Maintain Plausible Deniability So He Can Take Over After Trump's Impeachment,link,http://leftliberal.com/2017/02/16/gop-is-helping-pence-maintain-plausible-deniability-so-he-can-take-over-after-trumps-impeachment/,2017-02-16 08:15:12,1373,412,689,555,3,89,51,44,631
1641262382839336_1699614847004089,Amazing how anyone voted for this bigot.,FBI Just Dumped Trump's Housing Discrimination Files,link,http://leftliberal.com/2017/02/16/fbi-just-dumped-trumps-housing-discrimination-files/,2017-02-16 07:00:22,1005,81,317,701,15,63,31,9,186
1641262382839336_1699587657006808,,Timeline Photos,photo,https://www.facebook.com/1641262382839336/photos/a.1663550813943826.1073741828.1641262382839336/1699587657006808/?type=3,2017-02-16 05:55:44,7133,472,9783,4233,34,79,33,580,2174
1641262382839336_1699466827018891,It's not the first time either.,"Spicer's Flynn Story Isn't Just A Lie, It Doesn't Make Any Sense",link,http://leftliberal.com/2017/02/15/spicers-flynn-story-isnt-just-a-lie-it-doesnt-make-any-sense/,2017-02-16 00:30:05,289,22,65,187,5,17,17,2,61
1641262382839336_1699431553689085,Despicable.,9/11 First Responders And NFL Concussion Patients Are The Alleged Victims Of A Scam By NJ Law Firm,link,http://leftliberal.com/2017/02/15/911-first-responders-and-nfl-concussion-patients-are-the-alleged-victims-of-a-scam-by-nj-law-firm/,2017-02-15 23:15:06,59,5,13,7,0,0,0,3,49
1641262382839336_1699399970358910,Traitors.,"Pence Covered For Flynn And The Russians, Why?",link,http://leftliberal.com/2017/02/15/pence-covered-for-flynn-and-the-russians-why/,2017-02-15 22:00:04,1166,208,630,617,7,66,17,25,434
1641262382839336_1699380213694219,Throw her in jail with Trump.,Ethics Office Recommends Action Against Kellyanne For Her Most Recent Violation,link,http://leftliberal.com/2017/02/15/ethics-office-recommends-action-against-kellyanne-for-her-most-recent-violation/,2017-02-15 20:45:10,968,99,130,858,41,3,56,0,10
1641262382839336_1699357330363174,Does he think this will please all those angry constituents from his town hall meeting?,Jason Chaffetz Investigates A Cartoon Character Instead Of Any One Of Trump's Scandals,link,http://leftliberal.com/2017/02/15/jason-chaffetz-investigates-a-cartoon-character-instead-of-any-one-of-trumps-scandals/,2017-02-15 19:30:03,597,140,213,169,2,23,66,17,320
1641262382839336_1699333903698850,Republicans are trying to end all dissent.,Republicans Cracking Down On EPA Encrypted Communication,link,http://leftliberal.com/2017/02/16/republicans-cracking-down-on-epa-encrypted-communication/,2017-02-15 18:15:18,216,41,52,52,0,18,6,9,131
1641262382839336_1699284653703775,,Trump Just Signed A Bill That Made It Easier For His Secretary Of State Do Business In Russia,link,http://leftliberal.com/2017/02/15/trump-just-signed-a-bill-that-made-it-easier-for-his-secretary-of-state-do-business-in-russia/,2017-02-15 17:00:16,246,24,89,38,0,17,3,7,181
1641262382839336_1699241090374798,And these GOP idiots want to repeal Obamacare.,"$1,000 Drug In Canada Will Sell For $89,000 In The US Because Of An FDA Loophole",link,http://leftliberal.com/2017/02/15/1000-drug-in-canada-will-sell-for-89000-in-the-us-because-of-an-fda-loophole/,2017-02-15 15:45:21,403,36,177,102,1,41,4,12,243
1641262382839336_1699211890377718,There's nothing he can't blame Obama for.,"If You Ask Sean Spicer, Obama Is To Blame For Mike Flynn Scandal",link,http://leftliberal.com/2017/02/15/if-you-ask-sean-spicer-obama-is-to-blame-for-mike-flynn-scandal/,2017-02-15 14:30:11,1482,548,380,389,4,54,683,15,337
1641262382839336_1699181107047463,Horrible boss.,"Trump Sold Himself As A No-Nonsense Manager, Why Is His White House So Sloppy?",link,http://leftliberal.com/2017/02/15/trump-sold-himself-as-a-no-nonsense-manager-why-is-his-white-house-so-sloppy/,2017-02-15 13:15:13,532,114,118,302,5,11,144,10,60
1641262382839336_1699157393716501,Lock 'em all up.,Flynn Wasn't The Only Member Of The Trump Team Contacting The Russians,link,http://leftliberal.com/2017/02/16/flynn-wasnt-the-only-member-of-the-trump-team-contacting-the-russians/,2017-02-15 12:00:18,1440,112,514,1003,23,64,16,14,320
1641262382839336_1699130327052541,The Republicans fighting it are probably guilty of something.,GOP Split Over Investigating Flynn,link,http://leftliberal.com/2017/02/15/gop-split-over-investigating-flynn/,2017-02-15 10:45:20,2155,776,863,1238,15,127,71,35,669
1641262382839336_1699101333722107,Poor Mike Flynn... Not really.,Flynn Is A Stooge In A Bigger Situation,link,http://leftliberal.com/2017/02/15/flynn-is-a-stooge-in-a-bigger-situation/,2017-02-15 09:30:13,646,85,156,473,5,12,47,4,105
1641262382839336_1699073930391514,Take a dump on Trump.,Trump Toilets Will Be The Next Piece Of Evidence Against Donald For Violating Emoluments Clause,link,http://leftliberal.com/2017/02/15/trump-toilets-will-be-the-next-piece-of-evidence-against-donald-for-violating-emoluments-clause/,2017-02-15 08:15:12,342,25,77,194,4,12,98,1,33
1641262382839336_1699047543727486,Did any of this trickle down?,In The Trump Era A $20 Million Birthday Party Is The New Normal,link,http://leftliberal.com/2017/02/15/in-the-trump-era-a-20-million-birthday-party-is-the-new-normal/,2017-02-15 07:00:13,181,30,41,45,3,20,6,7,100
1641262382839336_1699030980395809,,Timeline Photos,photo,https://www.facebook.com/1641262382839336/photos/a.1663550813943826.1073741828.1641262382839336/1699030980395809/?type=3,2017-02-15 06:00:46,8269,410,6692,6109,321,30,1758,22,29
1641262382839336_1698952423736998,He needn't Brag for not taking a salary.... he's costing taxpayers more than enough!,"Trump Reportedly Heading to Mar-a-Lago for Third Straight Weekend, Obliterating Campaign Promise",link,http://leftliberal.com/2017/02/14/trump-reportedly-heading-to-mar-a-lago-for-third-straight-weekend-obliterating-campaign-promise/,2017-02-15 00:30:05,1803,293,887,834,10,106,48,39,766
1641262382839336_1698933477072226,Glad to hear a pastor finally spoke out.,"""Stop Calling Trump A Christian"", Pastor Destroys Deluded Trumper Evangelicals, It's Viral",link,http://leftliberal.com/2017/02/14/stop-calling-trump-a-christian-pastor-destroys-deluded-trumper-evangelicals-its-viral/,2017-02-14 23:15:04,1928,102,661,1718,121,17,64,2,6
1641262382839336_1698913967074177,Loved them both and their class act can't be duplicated. No one could fill their shoes.,"Joe Biden Almost Had To Sell His Home To Afford His Son's Cancer Treatment, Guess What The AMAZING Former President Did?",link,http://leftliberal.com/2017/02/14/joe-biden-almost-had-to-sell-his-home-to-afford-his-sons-cancer-treatment-guess-what-the-amazing-former-president-did/,2017-02-14 22:00:05,583,31,65,451,106,1,1,24,0
1641262382839336_1698881623744078,I have never seen an administration with so many STUPID people!!!!,Twitter Just Exploded Over Trump's Embarrassing Press Conference With Justin Trudeau,link,http://leftliberal.com/2017/02/14/twitter-just-exploded-over-trumps-embarrassing-press-conference-with-justin-trudeau/,2017-02-14 20:45:04,1271,92,329,903,26,27,237,21,57
1641262382839336_1698863997079174,BOOM,Trump's Michael Flynn Just Resigned After Being Caught Colluding With Russia,link,http://leftliberal.com/2017/02/14/trumps-michael-flynn-just-resigned-after-being-caught-colluding-with-russia/,2017-02-14 19:30:03,203,49,32,132,6,8,20,2,35
1641262382839336_1698844467081127,This is where a true leader would put the needs of the people before his ego - very sadly we have Trump.,Trump Gives A CHILLING Response To California After They Requested A Federal Disaster Aid,link,http://leftliberal.com/2017/02/14/trump-gives-a-chilling-response-to-california-after-they-requested-a-federal-disaster-aid/,2017-02-14 18:15:18,1105,193,403,392,3,32,2,118,558
1641262382839336_1698814397084134,"And now, our children will pay the price.",BUSTED: Marco Rubio Received A MAJOR Bribe To Confirm Betsy DeVos (Details),link,http://leftliberal.com/2017/02/14/busted-marco-rubio-received-a-major-bribe-to-confirm-betsy-devos-details/,2017-02-14 17:00:16,2740,449,1302,1002,5,186,29,94,1424
1641262382839336_1698789363753304,"Trump is such a liar and evil man.
LIKE if you think Trump is a DISGRACE!!",Trump Caught In YET ANOTHER Giant Lie,link,http://leftliberal.com/2017/02/14/trump-caught-in-yet-another-giant-lie/,2017-02-14 15:45:17,2962,147,726,2550,15,23,94,22,258
1641262382839336_1698765630422344,My question is why is she there?,"Ivanka Trump Posts Photo Of Her Sitting At Oval Office Desk, Twitter Is Letting Her Have It!",link,http://leftliberal.com/2017/02/14/ivanka-trump-posts-photo-of-her-sitting-at-oval-office-desk-twitter-is-letting-her-have-it/,2017-02-14 14:30:10,2280,699,891,981,11,198,85,39,966
1641262382839336_1698742647091309,This is an absolute shameful way to treat human beings!,Immigrants Want You to See These Chilling Photos of US Detention Centers,link,http://leftliberal.com/2017/02/14/immigrants-want-you-to-see-these-chilling-photos-of-us-detention-centers/,2017-02-14 13:15:36,315,39,142,98,1,8,1,104,103
1641262382839336_1698721037093470,What does it say about the state of our nation that we have a president openly breaking the law and a congress that refuses to stop him?,"How Trump can be held accountable for violating the Constitution, even if Congress doesn't care",link,http://leftliberal.com/2017/02/14/how-trump-can-be-held-accountable-for-violating-the-constitution-even-if-congress-doesnt-care/,2017-02-14 12:00:20,1922,221,949,1326,30,68,13,53,432
1641262382839336_1698698067095767,"Well, this is an answer to those questions of ""why would women march when they already have rights?""","Oklahoma Lawmaker Wants Men To Approve Abortion, Calls Women 'Hosts'",link,http://leftliberal.com/2017/02/14/oklahoma-lawmaker-wants-men-to-approve-abortion-calls-women-hosts/,2017-02-14 10:45:12,555,140,235,106,0,46,7,18,378
1641262382839336_1698667653765475,Can someone please get rid of the whole group and start over!!!,"Donald Trump Conducted National Security Meeting In Public During Mar-a-Lago Dinner, One Member Posted Photos To Facebook",link,http://leftliberal.com/2017/02/14/donald-trump-conducted-national-security-meeting-in-public-during-mar-a-lago-dinner-one-member-posted-photos-to-facebook/,2017-02-14 09:30:15,875,167,258,490,7,55,16,15,292
1641262382839336_1698639943768246,WoW!! Trump got some REALLY BAD KARMA Coming HIS WAY!,California Asked Trump For Federal Disaster Aid. His Response Is SHOCKING,link,http://leftliberal.com/2017/02/14/california-asked-trump-for-federal-disaster-aid-his-response-is-shocking/,2017-02-14 08:16:13,995,256,358,358,2,66,10,44,515
1641262382839336_1698604940438413,CON,It's Official: The CIA and DOJ Believe Trump's Team Is Under Russian Blackmail,link,http://leftliberal.com/2017/02/14/its-official-the-cia-and-doj-believe-trumps-team-is-under-russian-blackmail/,2017-02-14 07:04:39,2464,276,1073,1686,25,203,63,40,447
