status_id,status_message,link_name,status_type,status_link,status_published,num_reactions,num_comments,num_shares,num_likes,num_loves,num_wows,num_hahas,num_sads,num_angrys
1641262382839336_1669033136728927,"It's almost like he wants to be guilty of treason here.
Has he gone off the rails (like Giuliani)?
You need to see how he guilty he makes himself look, here.",UPDATE: McConnell BURIED Evidence - Then Threatened Obama If He Released It! Wow!,link,http://goneleft.com/update-mcconnell-buried-evidence-then-threatened-obama-if-he-released-it-wow/,2016-12-11 18:06:36,911,132,383,467,3,79,8,11,343
1641262382839336_1669000336732207,"Was Comey just a misguided Trump stooge?
Or does his corruption go even deeper than we thought?",Democrat Leader Just Implicated FBI Director In Trump/Russia Collusion,link,http://goneleft.com/democrat-leader-just-implicated-fbi-director-in-trumprussia-collusion/,2016-12-11 17:00:35,545,69,134,390,8,34,6,4,103
1641262382839336_1668969886735252,"She was so cute.  I can't believe she grew up to be a homophobic kook with a filthy mouth and a Trump obsession.
You could NOT have seen this coming!",WOW! Fanatical Trumper and Former 'Brady Bunch' Child Star fired for calling listener a 'pathetic little c*nt',link,http://goneleft.com/wow-fanatical-trumper-and-former-brady-bunch-child-star-fired-for-calling-listener-a-pathetic-little-cnt/,2016-12-11 15:45:34,146,46,10,72,2,6,6,16,44
1641262382839336_1668935400072034,"This video from Joy Reid really explains just how played everyone was, this election.
See if you agree with her, come back and tell us if you do","Joy Reid Shows Exactly How Trump 'Played' Everyone, Especially His Own Voters",link,http://goneleft.com/joy-reid-shows-exactly-how-trump-played-everyone-especially-his-own-voters/,2016-12-11 14:30:25,760,61,191,670,37,34,7,5,7
1641262382839336_1668894800076094,"Lock him up!  Mitch needs to go down along with the rest of Trump's Swamp, don't you think?",Mitch McConnell Kept Russia Hacks Secret. Trump Returned the Favor in a BIG Way,link,http://goneleft.com/mitch-mcconnell-kept-russia-hacks-secret-trump-returned-the-favor-in-a-big-way/,2016-12-11 13:15:17,1906,336,539,1410,31,28,9,13,415
1641262382839336_1668862863412621,"After the Russia news, WE MUST STOP TRUMP!
#SHARE&LIKE if you agree!",ELECTORS Working to *OverTurn* Trump's Election Go to Federal Court on Monday,link,http://goneleft.com/electors-working-to-overturn-trumps-election-go-to-federal-court-on-monday/,2016-12-11 12:01:12,2241,112,461,2062,149,21,6,1,2
1641262382839336_1668830166749224,"LET'S GET THIS DONE! We have suffered long enough already!
If you think Trump needs to be Impeached, comment ""IMPEACH"" below!",Senate Dem Calling For IMMEDIATE Investigation of Trump for IMPEACHABLE Ties to Russia!,link,http://goneleft.com/senate-dem-calling-for-immediate-investigation-of-trump-for-impeachable-ties-to-russia/,2016-12-11 10:45:33,2303,1679,414,2038,95,13,17,10,130
1641262382839336_1668801000085474,"Hillary Clinton was right all along, wasn't she?
But will everyone forget her, anyway?",Hillary *Warned* Us About This Threat in Front of 68 Million Viewers (Video),link,http://goneleft.com/hillary-warned-us-about-this-threat-in-front-of-68-million-viewers-video/,2016-12-11 09:32:42,1246,74,226,1101,72,3,1,57,12
1641262382839336_1668769090088665,"Do you think there is ANY thing he can say that will bother his supporters?
Or all they all just *that* racist?",RACIST! Trump Makes SHOCKING Remarks About African-Americans (Video),link,http://goneleft.com/racist-trump-makes-shocking-remarks-about-african-americans-video/,2016-12-11 08:15:23,177,60,37,56,0,3,1,10,107
1641262382839336_1668734290092145,"Dan Rather, the *legend* himself, just Called Out Trump's fake ""patriots"" and the Internet is loving it!
I absolutely 💖 LOVE 💖 DAN!
If you ""LOVE DAN"", tell everyone with a comment!",*Dan Rather* Just Called Out Fake 'Patriots' That Support Trump-Putin Ties,link,http://goneleft.com/dan-rather-just-called-out-fake-patriots-that-support-trump-putin-ties/,2016-12-11 07:01:21,1746,152,303,1544,166,9,6,3,18
1641262382839336_1668525290113045,"She should have just kept her mouth shut.
Agree?  Comment ""SHHHHHHH"" below.",Trumper Gets DESTROYED By Robert Reich For Defending This Stupidity...,link,http://goneleft.com/trumper-gets-destroyed-by-robert-reich-for-defending-this-stupidity/,2016-12-10 23:06:21,535,18,71,473,27,2,30,2,1
1641262382839336_1668489336783307,"Bernie, Calling it Like It Is.
Do You Think Bernie is Still in the Fight, ""YES"" or ""NO""?",Bernie Sanders Just Gave a Big Reality Check To Trump Voters,link,http://goneleft.com/bernie-sanders-just-gave-a-big-reality-check-to-trump-voters/,2016-12-10 22:02:17,1050,74,179,966,62,3,12,2,5
1641262382839336_1668456670119907,"So much for Trump's Promises. (Yeah, we know)
And any hope of Security, Social or otherwise.
We need to put our heads together and come up with some ideas how to stop this.  Any thoughts?",Wave ByeBye to SOCIAL SECURITY! Guess What Republicans Are Doing Now?,link,http://goneleft.com/wave-byebye-to-social-security-guess-what-republicans-are-doing-now/,2016-12-10 21:01:12,168,34,80,62,0,1,1,17,87
1641262382839336_1668434133455494,"He needs to be Held Accountable For This!
#Share and #Like if you Agree!",Trump Attacked an 18 Year Old on twitter. That Was the Start of Her Living Nightmare.,link,http://goneleft.com/trump-attacked-an-18-year-old-on-twitter-that-was-the-start-of-her-living-nightmare/,2016-12-10 20:01:11,337,57,84,154,0,3,1,14,165
1641262382839336_1668412936790947,"BIG money gets you BIG perks!
Will you watch Trump's inauguration?
Comment ""YES"" or ""NO WAY!""","COINCIDENCE? Donald Trump Bullies Boeing, Boeing Now Donating BIG $ For His Inauguration",link,http://goneleft.com/coincidence-donald-trump-bullies-boeing-boeing-now-donating-big-for-his-inauguration/,2016-12-10 19:00:19,434,596,86,121,0,20,40,11,242
1641262382839336_1668386803460227,"Long Overdue!
And they need to hurry!
Think they will Bust him for this?",It's Official! Obama Launches Investigation Into Trump's Illegal Russian Ties,link,http://goneleft.com/its-official-obama-launches-investigation-into-trumps-illegal-russian-ties/,2016-12-10 18:00:53,671,36,88,614,44,6,6,1,0
1641262382839336_1668368550128719,"Seth Meyers Takes Trump Apart in this New Video.
Let's show Seth our appreciation with 20,000 #Likes!",'Big Baby' Trump 'Lied His ASS Off': Seth Meyers Details Crooked Carrier Deal (VIDEO),link,http://goneleft.com/big-baby-trump-lied-his-ass-off-seth-meyers-details-crooked-carrier-deal-video/,2016-12-10 17:00:46,804,18,75,741,30,4,22,2,5
1641262382839336_1668347606797480,"We must join together to condemn these acts!
Do you agree with Robert Reich on this?",Robert Reich *Shows* How Trump is Already a Two-Bit Dictator,link,http://goneleft.com/robert-reich-shows-how-trump-is-already-a-two-bit-dictator/,2016-12-10 16:00:49,763,59,208,620,6,10,5,20,102
1641262382839336_1668326256799615,"Not So Shocking, Trump blows off vital intelligence briefings because they aren't inflating his ego.
Do you think Pence would be a better President, at this point?",Trump Blows Off Crucial Intelligence Briefings,link,http://goneleft.com/trump-blows-off-national-intelligence-briefings/,2016-12-10 15:01:28,211,238,57,75,0,9,11,7,109
1641262382839336_1668299346802306,"If a Foreign Government interfered in the election in some illegal fashion...
Does that make Trump's presidency illegal?!?",BREAKING: CIA *Confirms* Russia Tried To Help Trump Win The Presidency. No Surprise?,link,http://goneleft.com/breaking-cia-confirms-russia-tried-to-help-trump-win-the-presidency-no-surprise/,2016-12-10 14:00:44,648,134,146,455,5,12,1,25,150
1641262382839336_1668266926805548,"Trump Biographer: ""He finished with a disturbing image of Trump as a mindless animal""
Wow, that's CHILLING.  This is our...future president.
How, on earth did we elect a 'mindless animal'?  Any ideas???",CHILLING! Trump Biographer: 'Trump literally CANNOT control himself'. Wow!,link,http://goneleft.com/chilling-trump-biographer-trump-literally-cannot-control-himself-wow/,2016-12-10 13:01:14,1038,104,418,742,6,123,12,39,116
1641262382839336_1668235593475348,"These are good people that worked their whole lives and NEED the security they were promised.
How can we all prosper if we can't even take of our loyal and hard working citizens?",BREAKING: Republicans Trying to BackDoor HUGE Social Security Cuts,link,http://goneleft.com/breaking-republicans-trying-to-backdoor-huge-social-security-cuts/,2016-12-10 12:01:03,872,153,592,375,1,9,0,98,389
1641262382839336_1668202990145275,"Whoa!  I knew he was nuts but who knew he would go this far?
Are you relieved this madman is out of the running?",BREAKING: FURIOUS Giuliani Just Got Dumped By Trump! Here's Why (WATCH),link,http://goneleft.com/breaking-furious-giuliani-just-got-dumped-by-trump-heres-why-watch/,2016-12-10 10:55:26,452,89,52,314,14,3,117,0,4
1641262382839336_1668164086815832,"Woman-haters have taken over the White House.
It looks like our fight isn't over.
We aren't giving up, though, are we?",Here are all of Trump's advisors who have been accused of assaulting women,link,http://goneleft.com/here-are-all-of-trumps-advisors-who-have-been-accused-of-assaulting-women/,2016-12-10 09:43:59,536,43,233,292,5,32,4,17,186
1641262382839336_1668129623485945,"Hint: It's not in America.
Hint 2: They aren't bringing it to America.
What do you think, little bit of Hypocrisy here, ""YES"" or ""NO""?",HYPOCRISY! Inside the Chinese Factory Making Ivanka Trump's Shoes,link,http://goneleft.com/hypocrisy-inside-the-chinese-factory-making-ivanka-trumps-shoes/,2016-12-10 08:36:21,781,120,675,356,1,61,17,26,320
1641262382839336_1667800236852217,"And they are so stupid they cannot see it.

Gee, ya think? #BasketOfIdiots #SHAREIT",Trump Supporters Got BAITED & SWITCHED. How Trump Double-Crossed His Supporters Big Time,link,http://goneleft.com/trump-supporters-got-baited-switched-how-trump-double-crossed-his-supporters-big-time/,2016-12-09 21:00:50,213,31,90,138,2,5,44,4,20
1641262382839336_1667780260187548,"I'd be scared too if I were Trump.

This is amazing news! Let's get 5000 SHARES for Hillary!🇺🇸 💙 💙🇺🇸",Trump SCARED SHITLESS After Lawsuit Filed That Will Lead DIRECTLY To Impeachment (DETAILS),link,http://goneleft.com/trump-scared-shitless-after-lawsuit-filed-that-will-lead-directly-to-impeachment-details/,2016-12-09 20:01:10,2279,74,392,2064,147,9,51,2,6
1641262382839336_1667754616856779,"Trump is a puppet and shill for the rich.

TRUMP WILL MAKE TRUMPS GREAT AGAIN NOT AMERICA! 👎👎  Hit 'LIKE' if you agree!",How Trump's Labor Secretary Pick Is Going To DESTROY The American Working Class,link,http://goneleft.com/how-trumps-labor-secretary-pick-is-going-to-destroy-the-american-working-class/,2016-12-09 19:01:15,310,19,71,235,5,1,0,16,53
1641262382839336_1667733000192274,"The FBI should be held accountable.

Hit 'LIKE' if you agree!",Holocaust Lawyer Sues FBI Over Election Rigging. Guess What's Going To Happen To TRUMP? Impeachment?,link,http://goneleft.com/holocaust-lawyer-sues-fbi-over-election-rigging-guess-whats-going-to-happen-to-trump-impeachment/,2016-12-09 18:02:09,978,61,135,916,45,1,11,1,4
1641262382839336_1667711773527730,"There is still hope.

Does Hillary Clinton still have your support?? YES or NO:",This Is How The Electoral College Will LEGALLY Keep Trump From White House,link,http://goneleft.com/this-is-how-the-electoral-college-will-legally-keep-trump-from-white-house/,2016-12-09 17:01:07,1991,491,147,1853,117,3,16,0,2
1641262382839336_1667688980196676,"Seth tells it as it is.

Can we get 5,000 LIKES in support of Seth saying what NEEDS to be said! #SHAREIT","Watch Seth Meyers Call The Media On Their BS: ""Call Them Nazis, NOT ""Alt-Right!""",link,http://goneleft.com/watch-seth-meyers-call-the-media-on-their-bs-call-them-nazis-not-alt-right/,2016-12-09 16:01:07,93,4,21,83,6,1,0,0,3
1641262382839336_1667667403532167,"This is disgusting.

Apparently the Trump team still thinks it's 1955. Very INAPPROPRIATE! #STOPTRUMP #DUMPTRUMP #SHAREIT",Trump's Campaign Manager Said THIS To Working Mothers Of America,link,http://goneleft.com/trumps-campaign-manager-said-this-to-working-mothers-of-america/,2016-12-09 15:01:29,325,185,118,88,0,18,16,10,193
1641262382839336_1667638866868354,"This is REAL. Trump's OUT!

#Share this everywhere to IMPEACH TRUMP!!!","This AMAZING Lawsuit LEGALLY ""Could Lead To Trump IMPEACHMENT"" [DETAILS]",link,http://goneleft.com/this-amazing-lawsuit-legally-could-lead-to-trump-impeachment-details/,2016-12-09 14:00:33,528,55,100,462,45,7,14,0,0
1641262382839336_1667612356871005,"Tump is not fit to be president.

It doesn't get any more crystal clear than this... Let's get 20,000 SHARES to Trump know we are ANNOYED!",Union Leader Bullied By TRUMP EXPOSES More Trump LIES,link,http://goneleft.com/union-leader-bullied-by-trump-exposes-more-trump-lies/,2016-12-09 13:00:45,807,28,218,694,6,21,13,4,69
1641262382839336_1667583500207224,"Trump DESTROYED American unity.

Nobody has divided this country as much as Trump has. #SHARE it if you agree! #DUMPTRUMP",NY Time's Response To Trump's Claim He Didn't Divide America Is AWESOME,link,http://goneleft.com/ny-times-response-to-trumps-claim-he-didnt-divide-america-is-awesome/,2016-12-09 12:01:14,1238,116,702,1035,33,12,11,26,121
1641262382839336_1667540023544905,"Biden SHREDDED Trump so bad!

Let's get 5000 SHARES for Joe Biden knocking Donald Trump the HELL OUT!",Watch Joe Biden DESTROY Trump LIVE Ripping Him A New Asshole,link,http://goneleft.com/watch-joe-biden-destroy-trump-live-ripping-him-a-new-asshole/,2016-12-09 11:00:47,418,14,46,384,20,1,12,0,1
1641262382839336_1667515196880721,"We need to take a stand against this.

Do you agree with Hillary?
LIKE = YES!",Watch Hillary DENOUNCE Fake News That Elected Trump,link,http://goneleft.com/watch-hillary-denounce-fake-news-that-elected-trump/,2016-12-09 10:00:58,356,19,17,322,26,2,0,5,1
1641262382839336_1667481670217407,"He is dumber than we initially thought.

Let's get 5,000 shares to show this jerk how PISSED we are!",Guess What IDIOTIC Thing Trump's Going To Do While President?,link,http://goneleft.com/guess-what-idiotic-thing-trumps-going-to-do-while-president/,2016-12-09 09:00:33,400,52,185,236,2,5,6,17,134
1641262382839336_1667456280219946,"This is a GAME CHANGER!

This is AMAZING news! Let's get 5000 SHARES for Hillary!",OVERTURN Election Of Donald Trump? Guess What Electors Are Doing On Monday [DETAILS],link,http://goneleft.com/overturn-election-of-donald-trump-guess-what-electors-are-doing-on-monday-details/,2016-12-09 08:01:17,1590,91,351,1450,101,24,9,1,5
1641262382839336_1667359060229668,,Timeline Photos,photo,https://www.facebook.com/1641262382839336/photos/a.1663550813943826.1073741828.1641262382839336/1667359060229668/?type=3,2016-12-09 07:00:01,858,45,496,635,10,8,149,33,23
1641262382839336_1667206603578247,"Awww.... that made me sad.

Is Joe Biden your favorite Vice-President?
LIKE = YES!",VP Biden Just Broke 60 Million Hearts With This Saddening Announcement About The Future,link,http://goneleft.com/vp-biden-just-broke-60-million-hearts-with-this-saddening-announcement-about-the-future/,2016-12-08 22:01:58,607,31,21,543,34,1,0,29,0
1641262382839336_1667182233580684,"LOL that's so epic!

Let's get 10,000 shares to show Michael Moore our support!",Michael Moore Has AWESOME Surprise For Trump's Inauguration. Trump Will Be FURIOUS!,link,http://goneleft.com/michael-moore-has-awesome-surprise-for-trumps-inauguration-trump-will-be-furious/,2016-12-08 21:00:48,710,15,85,652,39,1,18,0,0
1641262382839336_1667136450251929,"This is SHOCKING.

He will just make America suffer again. #STOPTRUMP #ImpeachTrump #SHAREIT",Science Proves Conclusively How Trump Would Ruin America...,link,http://goneleft.com/science-proves-conclusively-how-trump-would-ruin-america/,2016-12-08 19:01:01,232,26,99,144,2,4,1,22,59
1641262382839336_1667069663591941,"This is SCATHING.

BOOM! Reich just opened up a can of whoop ass on Trump and it was beautiful. #SHAREIT",Robert Reich ANNHILATED 'petty and thin-skinned' Trump for attacking union head on Twitter,link,http://goneleft.com/robert-reich-annhilated-petty-and-thin-skinned-trump-for-attacking-union-head-on-twitter/,2016-12-08 16:00:32,209,5,32,182,14,0,12,0,1
1641262382839336_1667053706926870,"Did you read what they found?

This is HUGE! YOU JUST HAVE TO READ THIS! #SHAREIT",TRUMP SCARED Of Results! Democrats New Probe Into Russian Vote Hacking,link,http://goneleft.com/trump-scared-of-results-democrats-new-probe-into-russian-vote-hacking/,2016-12-08 15:01:06,323,24,80,263,17,5,5,2,31
1641262382839336_1667033466928894,"This is the idiot that's going to run USA?

Will you be watching Donald Trump's inauguration?
LIKE = NO!","Trump's Inauguration Will Literally Be Like A ""Reality TV"" Show, Will Include Helicopter Entrance & MORE [DETAILS]",link,http://goneleft.com/trumps-inauguration-will-literally-be-like-a-reality-tv-show-will-include-helicopter-entrance-more-details/,2016-12-08 14:00:51,986,731,144,577,1,8,91,39,270
1641262382839336_1667011240264450,How can he be this stupid?,(VIDEO) Trump DENIES Dividing America With Dumbest Reason Yet,link,http://goneleft.com/video-trump-denies-dividing-america-with-dumbest-reason-yet/,2016-12-08 13:00:15,353,93,103,163,1,21,60,8,100
1641262382839336_1666984446933796,"That's like hiring theives to be the head of security.

Trump will make America suffer again...Hit 'LIKE' if you agree! #SHAREIT",Trump Appoints CLIMATE DENYING Bill Oil SHILL To Head THIS Department,link,http://goneleft.com/trump-appoints-climate-denying-bill-oil-shill-to-head-this-department/,2016-12-08 12:01:02,163,10,48,100,1,4,0,5,53
1641262382839336_1666957643603143,"This is the start of something that reminds me of Hitler's time in power.

WTF, Hitler II is here? This is beyond crazy! #STOPTRUMP #DUMPTRUMP #SHAREIT",Trump Will Have Personal 24/7 PROGANDA Channel For Him Just Like Communist China!,link,http://goneleft.com/trump-will-have-personal-247-proganda-channel-for-him-just-like-communist-china/,2016-12-08 11:01:31,254,115,157,72,0,17,10,10,145
1641262382839336_1666937920271782,"Trump is the biggest sellout in history.

Gee, ya think? #BasketOfDeplorables #STOPTRUMP #SHAREIT",Trump's Cabinet Seats For Sale! Guess How Much This Near-Billionaire Paid For What Seat?,link,http://goneleft.com/trumps-cabinet-seats-for-sale-guess-how-much-this-near-billionaire-paid-for-what-seat/,2016-12-08 10:00:53,116,17,72,50,0,4,1,9,52
1641262382839336_1666917436940497,"Trump is going after your freedom of speech.

He's always mad about something 👎👎  What do you think? #SHAREIT",(VIDEO) Trump Makes This SHOCKING Statement About SNL That Will Make You SCARED,link,http://goneleft.com/video-trump-makes-this-shocking-statement-about-snl-that-will-make-you-scared/,2016-12-08 09:01:17,138,44,43,46,0,6,22,3,61
1641262382839336_1666894676942773,"I wonder why, maybe cos he is an IDIOT?

Make America Suffer Again. We can't just let it happen in front of us! #StopTrump #ImpeachTrump #SHAREIT",TRUMP Guaranteed To Cause MASSIVE Recession Leading Investment Firm Says,link,http://goneleft.com/trump-guaranteed-to-cause-massive-recession-leading-investment-firm-says/,2016-12-08 08:00:37,342,58,160,181,5,13,2,33,108
1641262382839336_1666691366963104,Great idea.,Timeline Photos,photo,https://www.facebook.com/1641262382839336/photos/a.1663550813943826.1073741828.1641262382839336/1666691366963104/?type=3,2016-12-08 05:00:00,3011,190,1595,2795,114,10,12,8,72
1641262382839336_1666591243639783,"This is AMAZING, and good news for Liberals!

Let's do this!!🇺🇸🇺🇸👍🏻👍🏻💙💙Hear Us ROAR!!🇺🇸🇺🇸👍🏻👍🏻💙💙Hillary For President!!🇺🇸🇺🇸👍🏻👍🏻💙💙",EPIC Electoral College Petition To DUMP TRUMP Has GAME CHANGING News,link,http://goneleft.com/epic-electoral-college-petition-to-dump-trump-has-game-changing-news/,2016-12-08 00:00:52,3188,150,555,2903,226,35,17,2,5
1641262382839336_1666573240308250,"Trump is failing already...

Let's do our part...GO! #DUMPTRUMP #ImpeachTrump #STOPTRUMP #SHAREIT","Carrier Makes DISGUSTING Announcement AFTER Trump's ""Deal""",link,http://goneleft.com/carrier-makes-disgusting-announcement-after-trumps-deal/,2016-12-07 23:02:16,188,22,51,134,2,4,19,4,25
1641262382839336_1666546653644242,"Trump is rage tweeting now.

Obama just left Republicans Speechless. Can we get 20,000 'LIKES' for Obama?",(VIDEO) Obama Hilariously HUMILIATED Trump At National Security Speech,link,http://goneleft.com/video-obama-hilariously-humiliated-trump-at-national-security-speech/,2016-12-07 22:00:19,827,20,69,744,64,1,16,1,1
1641262382839336_1666532126979028,"This breaks ALL the records.

Check this out and Hit 'LIKE' if you agree! #SHAREIT",Watch Trump's Lapdog Chris Christie's Career IMPLODES In His Face,link,http://goneleft.com/watch-trumps-lapdog-chris-christies-career-implodes-in-his-face/,2016-12-07 21:01:11,122,21,24,91,5,3,19,1,3
1641262382839336_1666478653651042,"It was RIGGED FOR TRUMP!

This is UNFORGIVABLE! Let's get 5000 SHARES for Hillary!",Recount REVEALS SHOCKER! Guess How Many Voting Machines In USA Tampered With?,link,http://goneleft.com/recount-reveals-shocker-guess-how-many-voting-machines-in-usa-tampered-with/,2016-12-07 18:01:02,1225,70,460,903,6,79,1,12,224
1641262382839336_1666440870321487,"OMG can he help ISIS More?

""...that we know nothing about""???? Go to a security briefing you fool! We know plenty! 😡😡😡  #SHAREIT",ISIS Is CHEERING After Trump Does This DUMBASS Thing...,link,http://goneleft.com/isis-is-cheering-after-trump-does-this-dumbass-thing/,2016-12-07 16:00:49,123,23,49,51,1,1,4,16,50
1641262382839336_1666419726990268,"This is CORRUPTION OPENLY IN YOUR FACE!

Gee, ya think? #BasketOfDeplorables #SHAREIT",Corrupt GOP Gives NYC $7M For INSANELY IDIOTIC Reason...,link,http://goneleft.com/corrupt-gop-gives-nyc-7m-for-insanely-idiotic-reason/,2016-12-07 15:00:58,92,21,47,33,0,8,1,2,48
1641262382839336_1666399373658970,"Trump just LIED HIS ASS OFF!

Serves him right...he's a snake! #CON #SCAM #SHAREIT",Steelworkers Reveal The TRUTH About Trump's Deal With Carrier!,link,http://goneleft.com/steelworkers-reveal-the-truth-about-trumps-deal-with-carrier/,2016-12-07 14:00:25,297,27,142,191,3,8,34,8,53
1641262382839336_1666381986994042,"Finally CNN doing real journalism.

Can we get 5,000 LIKES in support of CNN saying what NEEDS to be said! #SHAREIT",VIDEO: CNN's Tapper Makes Mike Pence SQUIRM For Gen. Flynn's conspiracy-mongering son,link,http://goneleft.com/video-cnns-tapper-makes-mike-pence-squirm-for-gen-flynns-conspiracy-mongering-son/,2016-12-07 13:01:48,243,16,30,205,15,1,19,0,3
1641262382839336_1666361163662791,"OMG I cannot believe that just happened.

The orange one sure knows how to pick the lowest of scum! #STOPTRUMP #SHAREIT",Member Of Trump Staff RESIGNS In Disgrace To Stop Media Doing THIS,link,http://goneleft.com/member-of-trump-staff-resigns-in-disgrace-to-stop-media-doing-this/,2016-12-07 12:01:00,182,38,64,120,1,5,29,1,26
1641262382839336_1666333930332181,"Trump is a such a liar!

Serves him right...he's a snake! #Scam #Conartist #STOPTRUMP #SHAREIT",Carrier Workers Union EXPOSE Trump's MASSIVE Lie.. What They Say Will SHOCK YOU!,link,http://goneleft.com/carrier-workers-union-expose-trumps-massive-lie-what-they-say-will-shock-you/,2016-12-07 11:01:21,223,18,62,170,4,3,19,3,24
1641262382839336_1666319627000278,"This is just like how Hitler did it.

Comment 'STOP TRUMP' if you want to take HIM down!! #SHAREIT",Trump Owned News Letters Publish This SHOCKING Article,link,http://goneleft.com/trump-owned-news-letters-publish-this-shocking-article/,2016-12-07 10:18:34,351,234,162,172,2,7,3,22,145
1641262382839336_1665955997036641,,ABNC News,link,http://leftliberal.com/2016/12/06/liz-warren-makes-bold-legal-move-against-trumps-corruption/,2016-12-06 23:15:00,229,13,0,206,20,0,0,0,3
1641262382839336_1666022063696701,"Oh, you blubbering Hypocrite, you!
How can we believe you will bring jobs back when your own daughter has her biggest business in Asia??
If you agree, comment HYPOCRITE! below!",HYPOCRISY! Trump Says He is Bringing Back Jobs. But Ivanka has a $100 Million Business. In ASIA!,link,http://goneleft.com/hypocrisy-trump-says-he-is-bringing-back-jobs-but-ivanka-has-a-100-million-business-in-asia/,2016-12-06 21:45:18,1084,447,575,644,3,44,28,17,348
1641262382839336_1665998840365690,"Congratulations Red States.  Or...Condolences?
Or, since it affects the whole country, how about, just...EFF YOU RED STATES","Under Trump, Red States Earned the Right to Turn Into Festering Sh!tholes... Yay! Trump America?",link,http://goneleft.com/under-trump-red-states-earned-the-right-to-turn-into-festering-shtholes-yay-trump-america/,2016-12-06 20:16:07,203,8,30,124,3,7,24,2,43
1641262382839336_1665981433700764,"This judge just stood up for democracy.
And stood AGAINST the Big Orange Bully.
If you love seeing it, comment ""JUSTICE"" below!",BOOM! Fed. Judge Just Gave Trump The Middle Finger Over Recount Obstruction,link,http://goneleft.com/boom-fed-judge-just-gave-trump-the-middle-finger-over-recount-obstruction/,2016-12-06 19:01:58,2828,643,436,2422,205,15,178,1,7
1641262382839336_1665962407036000,"Biden for Prez!  What do you think?
Great candidate? ""YES"" or ""NO""?",Joe Biden Just Announced He Will Run For President In 2020,link,http://goneleft.com/joe-biden-just-announced-he-will-run-for-president-in-2020/,2016-12-06 17:45:59,370,57,17,336,32,0,2,0,0
