status_id,status_message,link_name,status_type,status_link,status_published,num_reactions,num_comments,num_shares,num_likes,num_loves,num_wows,num_hahas,num_sads,num_angrys
208799592506432_900082796711438,"""November 20 marks the anniversary of the Mexican Revolution of 1910‐1920. The party created by that event, the Institutional Revolutionary Party (PRI), is in power today. Yet, over the last nine years 60,000 people have been killed and 25,000 forcibly disappeared in the drug wars, while more than half the population lives in poverty. Foreign investment pours into Mexico to take advantage of wages lower than China's, while the country is controlled by a handful of billionaires. One has to wonder: What happened to the Mexican Revolution?""

http://newpol.org/content/what-happened-mexican-revolution","What Happened to the Mexican Revolution?, by Dan La Botz, New Politics",link,http://newpol.org/content/what-happened-mexican-revolution,2015-12-01 11:00:02,1,0,2,1,0,0,0,0,0
208799592506432_900082643378120,"""There has been an inspiring statewide local union response to SEIU's predictably short-sighted headquarters embrace of Hillary Clinton. This Sanders endorsement comes from public workers who know Bernie well because they live and work just across the Connecticut River from Vermont--or, in some cases, are Vermonters themselves.""

http://newpol.org/content/new-hampshire-seiu-breaks-international-endorses-bernie","New Hampshire SEIU Breaks from International--Endorses Bernie, by Steve Early, New Politics",link,http://newpol.org/content/new-hampshire-seiu-breaks-international-endorses-bernie,2015-11-30 11:00:00,1,0,1,1,0,0,0,0,0
208799592506432_900082170044834,"""Immanuel Ness, professor of Political Science at City University of New York and a prolific writer on labor, has written an important new book whose title, Southern Insurgency: The Coming of the Global Working Class, should, I think, have ended in a question mark. Manny, a friend and a colleague—who, when I have seen him lately, has been in a state of jetlag from his travels to centers of worker activism around the globe—argues that those interested in labor should direct their attention from the stagnant and declining labor movement of the Global North to the migrant and contract laborers in places like South Africa, India, and China who are building democratic, militant, rank-and-file movements from below—struggles that, Ness suggests, are laying the foundations of a new global labor movement.""

http://newpol.org/content/can-workers-global-south-change-world-labor-movement","Can Workers of the Global South Change the World Labor Movement?, , New Politics",link,http://newpol.org/content/can-workers-global-south-change-world-labor-movement,2015-11-29 12:00:00,6,0,4,6,0,0,0,0,0
208799592506432_900081776711540,"""Almost a century ago, the socialist journalist John Reed wrote of the Industrial Workers of the World, popularly known as the Wobblies, ""Remember, this is the only American working-class movement which sings.  Tremble then at the IWW, for a singing movement is not to be beaten.""  On the other hand, the sheriff of San Diego complained of his jails filled with Wobblies, ""I do not know what to do.  I cannot punish them.  Listen to them singing all the time, and yelling and hollering, and telling the jailers to quit work and join the union.'""

http://newpol.org/content/alive-you-and-me-songs-joe-hill","""Alive As You And Me"": The Songs of Joe Hill | New Politics",link,http://newpol.org/content/alive-you-and-me-songs-joe-hill,2015-11-28 12:00:15,4,0,2,4,0,0,0,0,0
208799592506432_900080933378291,"""In the wake of the murderous massacres in Paris, the demand for violent retaliation against Islamic State (IS) is gaining momentum. David Cameron now plans a renewed bid to secure parliamentary approval for UK air strikes against IS in Syria.""

http://newpol.org/node/1457","ISIS in Syria: Stop the march to war – There are alternatives, by Peter Tatchell, New Politics",link,http://newpol.org/node/1457,2015-11-27 11:00:05,1,0,0,1,0,0,0,0,0
208799592506432_900080683378316,"""The despicable ISIS attacks on Paris and elsewhere have unleashed intensified war and imperialist machinations over Syria and Iraq, as well as repression of immigrants and renewed Islamophobia. Can the left oppose the carnage on all sides without losing sight of its emancipatory aims?""

http://newpol.org/content/isis-carnage-paris-portends-repression-europe-and-intensified-war-middle-east","ISIS Carnage in Paris Portends Repression in Europe and Intensified War in Middle East , by...",link,http://newpol.org/content/isis-carnage-paris-portends-repression-europe-and-intensified-war-middle-east,2015-11-26 11:00:11,1,0,0,1,0,0,0,0,0
208799592506432_900080426711675,"""The horrific attacks that took place in Paris on Friday night left 129 dead and 352 wounded – including more than a hundred in critical condition. This indiscriminate and reactionary violence, sparked nationwide – but also worldwide – astonishment, indignation and revolt. This weekend spontaneous solidarity rallies took place.

The New Anti-Capitalist Party (NPA) shares this feeling of revolt and solidarity with all those who are affected by this tragedy, the families of the victims and all those close to them. The deadly violence is especially shocking and unbearable that, instead of fighting the (states) governments, which are at war in Syria, Iraq or Africa, it deliberately strikes innocent victims here, members of the public, just as in Iraq and Syria where it imposes dictatorships.  ""

http://newpol.org/content/solidarity-victims-terrorism-no-war-and-racism","Solidarity with the Victims of Terrorism--No to War and Racism, , New Politics",link,http://newpol.org/content/solidarity-victims-terrorism-no-war-and-racism,2015-11-25 11:00:00,0,0,2,0,0,0,0,0,0
208799592506432_900080173378367,"""In the last few weeks, numerous countries suffered lethal ISIS attacks: on November 13, over 130 dead in Paris; on November 12, 45 dead in Beirut; on October 10, close to 100 dead in Ankara; on August 13, close to 80 dead in Baghdad… In all cases the targeted victims were civilians. We condemn these despicable and barbaric attacks and address a message of support to all who have been and continue to be victimized by them throughout the world.""

http://newpol.org/content/solidarity-victims-paris-beirut-ankara-baghdad","In Solidarity with the Victims of Paris, Beirut, Ankara, Baghdad, , New Politics",link,http://newpol.org/content/solidarity-victims-paris-beirut-ankara-baghdad,2015-11-24 11:00:01,0,0,0,0,0,0,0,0,0
208799592506432_897082877011430,"""What will happen now in Portugal?

Here we publish an exchange of views between Stathis Kouvelakis, leading member of the Left Platform in Syriza and now of Popular Unity in Greece, and Catherine Samary leading member of the Fourth International, from France.""

http://newpol.org/content/exchange-views-situation-portugal","An exchange of views on the situation in Portugal, Catherine Samary and Stathis Kouvelakis , New...",link,http://newpol.org/content/exchange-views-situation-portugal,2015-11-16 11:00:00,0,0,0,0,0,0,0,0,0
208799592506432_895597103826674,"""In South Africa students have been protesting for the past couple of weeks. Their immediate concerns are the intended hike of tuition fees, on average about 10%. Starting from the University of the Witwatersrand (Wits) in Johannesburg, they have demonstrated against the planned hikes. Students have occupied buildings on their campuses, held mass meetings, moved around the campus grounds, forced senior university administrators and university councils into negotiations. Campuses across the country have been brought to a stand still; this has happened at a crucial time of the South African academic year, just before the end of the year exams are about to start.""

http://newpol.org/content/south-african-students-win-reforms-build-movement","South African Students Win Reforms, Build a Movement, Heike Becker , New Politics",link,http://newpol.org/content/south-african-students-win-reforms-build-movement,2015-11-12 12:19:36,1,0,2,1,0,0,0,0,0
208799592506432_894773290575722,"""In celebration of the 98th anniversary of the Russian Revolution we are publishing this short extract from John Reed's brilliant eyewitness account, Ten Days That Shook The World. Reed was a socialist journalist from the USA, who described the revolution as: 'Adventure it was, and one of the most marvelous mankind ever embarked upon.'""

http://newpol.org/content/ten-days-shook-world","Ten Days That Shook The World , By John Reed (1887-1920) , New Politics",link,http://newpol.org/content/ten-days-shook-world,2015-11-11 11:00:02,3,0,1,3,0,0,0,0,0
208799592506432_894772957242422,"""In response to the failure of the state to manage and dispose of accumulated trash, a series of protests erupted in Lebanon in August 2015 demanding the toppling of the Lebanese corrupt regime and the basic rights for water, electricity and a clean healthy environment. This article provides an overview of the strategies used by the state to dismantle the protest movements, a class reading of the social movements three months into the protests, and an analysis of the strengths and achievements of the demonstrations.""

http://newpol.org/content/protests-lebanon-three-months-after","The Protests in Lebanon Three Months After, By Moe Ali Nayel and Lamia Moghnieh , New Politics",link,http://newpol.org/content/protests-lebanon-three-months-after,2015-11-10 11:00:01,0,0,0,0,0,0,0,0,0
208799592506432_893331237386594,"""With a climate of polarization surrounding a contest that is to decide on the continuity of neo-populist Kirchnerism and the general rightward shift of the major electoral forces, peronist and non-peronist alike, this election was going to be challenging for the left. But the FIT nevertheless expected to increase its voter appeal and establish itself as a radical pole for left national politics. The Front's aim was to peel off sectors of the working class and progressives who are sympathetic to Kirchnerismo or straddle the fence, skeptical of its reform agenda yet unwilling to support the pro-business fractions of the mainstream opposition.""

http://newpol.org/content/comment-recent-elections-argentina","Comment on Recent Elections in Argentina , by René Rojas, New Politics",link,http://newpol.org/content/comment-recent-elections-argentina,2015-11-08 13:00:01,0,0,2,0,0,0,0,0,0
208799592506432_893330964053288,"""In a virtually unprecedented development, labor protest is widening in the maquiladora industry of Ciudad Juarez, Mexico. While worker dissatisfaction or protest is nothing new in the foreign-owned border factories that produce goods for export to the United States, previous manifestations of discontent in the generally union-free industry have usually been confined to one company at a time.""

http://newpol.org/content/behind-ciudad-juarez%E2%80%99s-new-labor-movement","Behind Ciudad Juarez's New Labor Movement, by Kent Paterson, New Politics",link,http://newpol.org/content/behind-ciudad-juarez's-new-labor-movement,2015-11-07 12:00:00,0,0,0,0,0,0,0,0,0
208799592506432_893330734053311,"""A still undetermined number of supporters, activists, and sympathizers of two Brazilian left-wing political parties, the Socialism and Freedom Party (PSOL, Partido Socialismo e Liberdade) and the Unified Socialist Workers' Party (PSTU, Partido Socialista dos Trabalhadores Unificado), are being charged by the State Prosecutor's offices (Ministérios Públicos) of Rio de Janeiro and São Paulo for having made small donations to these two parties during the 2014 elections.""

http://newpol.org/content/brazilian-activists-prosecuted-giving-small-donations-left-wing-parties","Brazilian Activists Prosecuted for Giving Small Donations to Left-Wing Parties, By Raphael...",link,http://newpol.org/content/brazilian-activists-prosecuted-giving-small-donations-left-wing-parties,2015-11-06 13:26:58,2,0,1,2,0,0,0,0,0
208799592506432_891374967582221,"""I was sitting in a small town Greyhound bus station when I first saw images from Katrina. Happenstance, in retrospect, was so apropos. Bus terminal stations throughout America (so often) being lachrymose warehouses for the poor, the vulnerable, the mentally ill, the psychologically worn down and the just plain penniless –hostels of the many with vagabond destinations. The station held any number of ""the kinds of people"" who knew what it was to go elsewhere, oftentimes meaning anyplace but the places they're at. I sat among America's disenfranchised classes.""

http://newpol.org/content/katrina-10-years-after","Katrina: 10 years after, by Darryl Lorenzo Wellington, New Politics",link,http://newpol.org/content/katrina-10-years-after,2015-11-02 11:00:01,2,0,2,2,0,0,0,0,0
208799592506432_890550257664692,"""This story begins where all good stories do; I hit a bit of a rut with the second to last chapter of my dissertation, a dissertation which looks at the psychological aspects of capitalism that undermine arguments for global justice that are deeply entrenched in the liberal political-philosophical tradition. When I get stuck, I try to motivate myself by reminding myself how necessary this kind of demystifying critical scholarship is. Naturally, I usually turn to Fox News for such motivation. However, for whatever reason, I decided to look on Facebook for something that would piss me off and send me on a writing blitz.""

http://newpol.org/content/my-week-libertarians-accidental-socratic-socialist-vs-capitalism%E2%80%99s-euthyphros","My Week with Libertarians: An Accidental Socratic Socialist vs. Capitalism's Euthyphros, by...",link,http://newpol.org/content/my-week-libertarians-accidental-socratic-socialist-vs-capitalism%E2%80%99s-euthyphros,2015-10-31 11:00:04,2,0,4,2,0,0,0,0,0
208799592506432_890132891039762,"""History has repeated itself in Guatemala following voting in the second round of the country's 2015 presidential election. Despite protests against corruption, Jimmy Morales, a former comedian who is backed by the same military forces that backed disgraced ex-president Otto Pérez Molina, easily won the presidency by a wide margin following the second round of voting October 25.""

http://newpol.org/content/despite-protests-guatemalan-elections-return-military-power","Despite Protests, Guatemalan Elections Return the Military to Power, by Jeff Abbott, New Politics",link,http://newpol.org/content/despite-protests-guatemalan-elections-return-military-power,2015-10-30 12:00:00,0,0,1,0,0,0,0,0,0
208799592506432_890132734373111,"""The pace of climate change is relentless. The projected date for the arrival of a 2°C rise in the global average surface temperature over pre-industrial levels is coming down all the time. It's now estimated to happen by 2038. The earth will warm by at least 4°C by the end of the century, possibly 6°C.

All this makes the Paris COP crucially important. A binding global agreement is an essential component in tackling climate change.""

http://newpol.org/content/building-paris-cop21-climate-protest","Building the Paris COP21 Climate Protest, by Alan Thornett, New Politics",link,http://newpol.org/content/building-paris-cop21-climate-protest,2015-10-29 11:00:01,0,0,1,0,0,0,0,0,0
208799592506432_889448514441533,"""Not all women campaigning for the vote were middle or upper class. Some, like Emmeline's daughter, Sylvia, were socialists. Many trade union and labour militants supported the women's suffrage struggle, albeit warily. They were concerned that the middle-class suffrage fighters would support Tories and Liberals over the nascent Labour Party.""

http://newpol.org/content/film-review-%E2%80%9Csuffragette%E2%80%9D","Film Review: ""Suffragette"", by Barbara Winslow , New Politics",link,http://newpol.org/content/film-review-%E2%80%9Csuffragette%E2%80%9D,2015-10-28 11:00:00,3,0,2,3,0,0,0,0,0
208799592506432_889448261108225,"""The Wretched of the Earth is sweeping in its analysis of both the un/making of the colonial condition, claiming that a system created by violence can only be destroyed through violence. However, you certainly lay out the shortfalls of violence insofar as its destructive impact on those responsible for rebirthing the nation as well as the need to maintain discipline; unfettered or completely spontaneous violence is doomed to lead to a short-lived liberation struggle. Key to this is the necessity for the intellectual to provide a political education to the masses, himself undergoing revitalization during the experience. Perhaps most poignantly, you note the necessity to continue the struggle post-liberation, as white supremacy may take a new shape in an elite-led postcolonial order.""

http://newpol.org/content/endurance-race-postracial-world-letter-fanon","The Endurance of Race in a Postracial World: A Letter to Fanon, by Richard Raber, New Politics",link,http://newpol.org/content/endurance-race-postracial-world-letter-fanon,2015-10-27 11:00:00,3,0,2,3,0,0,0,0,0
208799592506432_888602627859455,"""The devil, of course, is in the details. It is clear that the PS will not assume any anti-capitalist stance, it will not accept defiance of the EU's austerity regime and will have important difficulties in implementing some of the agreements it is making with BE and PCP. The left-wing parties are fighting to ensure a stop to austerity in the short term and some recoverage in labour income — and stopping the ""further than the troika"" coalition from returning to power.""

http://newpol.org/content/portuguese-election-quicksand-center-emboldened-left-and-desperate-president","The Portuguese election: quicksand in the center, an emboldened left and a desperate president,...",link,http://newpol.org/content/portuguese-election-quicksand-center-emboldened-left-and-desperate-president,2015-10-25 10:00:01,1,0,1,1,0,0,0,0,0
208799592506432_887861267933591,"""The question that I consider central is: Why are voices from the Latin American left raised in support of Putin? It's evident that many have hung their hopes for a better world, on the intervention of the big powers like China and Russia, with the hope of stopping or overthrowing the still hegemonic powers. It's understandable in view of the exploits that Washington commits in our region. But it's a strategic error and an ethical deviation.""

http://newpol.org/content/new-colonialisms-and-crises-left-values","New Colonialisms and the Crises of Left Values , Raúl Zibechi , New Politics",link,http://newpol.org/content/new-colonialisms-and-crises-left-values,2015-10-23 10:00:00,0,0,0,0,0,0,0,0,0
208799592506432_886343388085379,"""The last protest of the day of the New York City Climate Protests was at a Broadway theatre where Gov. Cuomo was scheduled to attend.  It was a spirited demonstration complete with a little orchestra and playful costumes focused on persuading Cuomo to veto the Port Ambrose Liquefied Natural Gas  (LNG) plant off the coast of Long Island right near JFK airport. Opponents argue that it is very dangerous security risk, terrible for the environment, and would kill the chance for a 700-megawatt wind farm that would create 17,000 local jobs.""

http://newpol.org/content/nyc-day-climate-protests-step-forward","NYC Day of Climate Protests a Step Forward, by Nancy Holmstrom, New Politics",link,http://newpol.org/content/nyc-day-climate-protests-step-forward,2015-10-20 09:00:00,0,0,1,0,0,0,0,0,0
208799592506432_886342928085425,"""Last year, over 400,000 people marched in the streets of New York City demanding bold action to protect the planet. Now, as world leaders prepare for crucial climate negotiations in Paris this December, we're bringing that momentum to communities across the country with actions demanding leaders take a bold stand to halt climate change before it's too late.""

http://newpol.org/content/national-day-climate-action-nyc","National Day of Climate Action - NYC, by Erik Mc Gregor, New Politics",link,http://newpol.org/content/national-day-climate-action-nyc,2015-10-19 09:00:01,0,0,1,0,0,0,0,0,0
208799592506432_886122751440776,"""The radical left strategy of working within broad left parties has suffered a major setback after SYRIZA´s capitulation. The answer to this crisis lies neither in continuing ""business as usual"", nor in ignoring the question of political power.""

http://newpol.org/content/beyond-broad-left-party","Beyond the Broad Left Party, Leandros Fischer , New Politics",link,http://newpol.org/content/beyond-broad-left-party,2015-10-18 12:19:02,2,0,1,2,0,0,0,0,0
208799592506432_885413661511685,"""One of the tasks Guillaume Long sets himself in his recent interview with Jacobin is to refute the magazine's recent coverage of Ecuador. In particular, the two recent pieces of note are an interview I conducted with Ecuadorian activist and intellectual Alejandra Santillana Ortíz  and an article I wrote separately, reflecting on my most recent visit to the country. I was happy to learn of Long's contribution to Jacobin on the current conjuncture in Ecuador. I expected a lucid articulation of the broad perspective advanced by the government of Rafael Correa for international consumption. Unfortunately, rather than a serious contribution to the ongoing debate, Long's intervention is characterized to different degrees by evasion, caricature, and obfuscation.""

http://newpol.org/content/postmodern-plotting-ecuador-response-guillaume-long","Postmodern Plotting in Ecuador? A Response to Guillaume Long, by Jeffrey R. Webber, New Politics",link,http://newpol.org/content/postmodern-plotting-ecuador-response-guillaume-long,2015-10-17 11:00:02,1,1,0,1,0,0,0,0,0
208799592506432_885324178187300,"""Behind the violence shaking occupied Jerusalem, writes Haneen Naamnih in Al Safir Al Arabi, is a vast colonial enterprise slowly remaking the city.

Jerusalem is (was?) an Arab city. But for Israeli nationalists, it is the capitol of their country, ""eternal and undivided."" The process of remaking a ""foreign"" city into your own is first of all concrete: the inhabitants must be removed. But it is also symbolic; a link must be built to the imagined past when it was yours, and emblems of inconvenient reality expunged. More than just a Potemkin village to disguise the misery of Jerusalem's native inhabitants, the vast construction projects Israel is carrying out in the occupied city are intended to remake the place as Israel's trademarked claim to Palestine, Naamnih writes.""

http://newpol.org/content/global-city-emptied-inconvenient-reality","A Global City, Emptied of Inconvenient Reality, , New Politics",link,http://newpol.org/content/global-city-emptied-inconvenient-reality,2015-10-16 10:00:01,2,0,10,2,0,0,0,0,0
208799592506432_884733694913015,"""Fortunately, though a small minority of far-right nationalists and religious fundamentalists may find solace in such fanciful conspiracies, the notion that multiple suicide bombers would blow themselves up for the sake of gaining some extra votes for a leftist political party simply will not be believed.""

http://newpol.org/content/%E2%80%9Cwe-lost-lot-good-beautiful-people%E2%80%9D-demanding-justice-turkey","""We lost a lot of good, beautiful people"": Demanding Justice in Turkey, by Daniel Johnson, New...",link,http://newpol.org/content/%E2%80%9Cwe-lost-lot-good-beautiful-people%E2%80%9D-demanding-justice-turkey,2015-10-15 09:00:01,0,0,1,0,0,0,0,0,0
208799592506432_884292991623752,"""Just a few months before the 21st Conference of Parties of the United Nations Framework Convention on Climate Change (UNFCCC COP21) in Paris in December 2015, we see with great foreboding that a very bad deal is coalescing. The consequences of the problematic UNFCCC process leading towards the Paris deal are incredibly grave. If the world is locked into another decade of burning the planet, there will be disastrous consequences including the loss of biodiversity, mass extinctions, loss of habitat, the flooding of Small Island States, and the melting of Polar Regions. The predicted negative outcome in Paris will notably have a disproportionate impact on local communities, and indigenous and marginalized peoples.""

http://newpol.org/content/statement-new-climate-space-initiative-about-cop21","Statement from new Climate Space initiative about COP21, Climate Space , New Politics",link,http://newpol.org/content/statement-new-climate-space-initiative-about-cop21,2015-10-14 09:00:01,0,0,0,0,0,0,0,0,0
208799592506432_884293164957068,"""Strikes, boycotts, marches and demonstrations were held throughout Turkey on Oct. 12 in protest against the massacre at the Labor, Peace and Democracy Rally in Ankara on October 10 that killed at least 97 people, with funerals of the victims being held one after another, daily Hürriyet reported.

Turkey's leading labor unions and professional organization--the Confederation of Public Sector Trades' Unions (KESK), the Confederation of Progressive Trade Unions of Turkey (DİSK), the Turkish Medical Association (TTB) and the Union of Chambers of Turkish Engineers and Architects (TMMOB)—called for a nationwide strike and boycott for Oct. 12 and 13 to protest the massacre. The Revolutionary Workers Party has issued this statement.""

http://newpol.org/content/turkey-massacre-culprit-akp","Turkey Massacre: The Culprit is the AKP!, , New Politics",link,http://newpol.org/content/turkey-massacre-culprit-akp,2015-10-13 09:05:00,0,0,1,0,0,0,0,0,0
