status_id,status_message,link_name,status_type,status_link,status_published,num_reactions,num_comments,num_shares,num_likes,num_loves,num_wows,num_hahas,num_sads,num_angrys
208799592506432_983892301663820,"""On March 11, 2016, a Turkish prosecutor dropped a complaint against officials for failing to take adequate security measures both before and after the bombing of a peace rally in Ankara that killed more than 100 on October 10, 2015. Two days later, suicide bombers struck in Turkey's capital city for the third time in five months. A car bomb was exploded in the downtown neighborhood of Kızılay, killing 36 and injuring many more. As with other recent attacks, the government of the Justice and Development Party (AKP) quickly suggested the Kurdistan Workers Party (PKK) was responsible for the attack.""

http://newpol.org/content/tightening-vise-turkey","The Tightening Vise in Turkey, by Joe Kenehan, New Politics",link,http://newpol.org/content/tightening-vise-turkey,2016-05-01 11:00:01,0,0,0,0,0,0,0,0,0
208799592506432_983892048330512,"""Mimi reached out to me about the campaign following my run for County Sheriff in Milwaukee. He said that he'd followed my campaign and really liked the fact that we took a very grassroots, people-centered approach. He felt that I would make a good running mate based on work I was involved in in Milwaukee, and the fact that I ran for sheriff unapologetically as a socialist.""

http://newpol.org/content/q-angela-walker-socialist-party-usa-candidate-vice-president","Q & A with Angela Walker, Socialist Party USA candidate for Vice-President, by Jim Brash , New...",link,http://newpol.org/content/q-angela-walker-socialist-party-usa-candidate-vice-president,2016-04-30 11:00:01,0,0,0,0,0,0,0,0,0
208799592506432_983891874997196,"""This is the third and last of three book reviews that look at what Mexican intellectuals on the left have written in an attempt to understand Ayotzinapa and what it symbolizes and signifies for their country and its future.""

http://newpol.org/content/mexico-plunder-and-violence-new-belle-epoque","Mexico - Plunder and Violence in the New Belle Epoque , by Dan La Botz, New Politics",link,http://newpol.org/content/mexico-plunder-and-violence-new-belle-epoque,2016-04-29 11:00:00,0,0,1,0,0,0,0,0,0
208799592506432_983891711663879,"""The case of Kumar Gunaratnam (KG) is a typical example of justice turning into its opposite. The Kegalle magistrate gave his verdict on March 31 imposing one year imprisonment and Rs. 50,000 fine on Kumar Gunaratnam for violation of immigration law, i.e., overstaying visa.""

http://newpol.org/content/case-kumar-gunaratnam-democracy-stake","The Case of Kumar Gunaratnam: Democracy is at Stake, by Sumanasiri Liyanage, New Politics",link,http://newpol.org/content/case-kumar-gunaratnam-democracy-stake,2016-04-28 11:00:00,0,0,0,0,0,0,0,0,0
208799592506432_983891528330564,"""We're working to see that Sanders wins the Democratic Party nomination, but that's not all we're doing. We're going beyond to build a democracy movement in this country.""

http://newpol.org/content/labor-bernie-and-beyond-plans-primaries-and-future","Labor for Bernie and Beyond Plans for the Primaries and the Future, by Dan La Botz, New Politics",link,http://newpol.org/content/labor-bernie-and-beyond-plans-primaries-and-future,2016-04-27 11:00:00,1,0,0,1,0,0,0,0,0
208799592506432_983891314997252,"""The Chicago Teachers Union (CTU) strike April 1 is not primarily about increased school funding, standardized testing, pensions for teachers, or even just corporate taxation, though the union is fighting for all of these. The strike is about democracy, especially who owns our society's resources...""

http://newpol.org/content/chicago-teachers-again-rewrite-playbook-stacked-against-labor","Chicago teachers (again) rewrite a playbook stacked against labor, by Lois Weiner, New Politics",link,http://newpol.org/content/chicago-teachers-again-rewrite-playbook-stacked-against-labor,2016-04-26 11:40:58,0,0,0,0,0,0,0,0,0
208799592506432_958546137531770,"""I fear that Jason misses the larger institutional context of the DP that helps us understand why, despite it not being a party in the traditional sense, it is still driven by the capitalist state rather than the neutral vessel he describes.""

http://newpol.org/content/sanders-and-democrats-reply-jason-schulman","Sanders and the Democrats: a Reply to Jason Schulman, by Barry Finger, New Politics",link,http://newpol.org/content/sanders-and-democrats-reply-jason-schulman,2016-04-03 11:00:01,0,0,0,0,0,0,0,0,0
208799592506432_958545534198497,"""The American Dream, that fantasy of growth that has long girded the ideology of entrepreneurship and a better future, is in crisis. Many haven't felt the dream for decades, some never having experienced it at all. Robert Putnam, in his latest work, Our Kids, seeks to confront this stagnation in our economic dreams by interrogating the forces that have taken hold of communities across the United States. In some ways a continuation of the issues he grappled with in his now famous work Bowling Alone, Our Kids provides a compelling account of the symptoms of inequality manifested in the behaviors, practices, and habits of increasingly unequal populations within the United States. ""

http://newpol.org/content/social-capital-and-class","Social Capital and Class, by Riad Azar, New Politics",link,http://newpol.org/content/social-capital-and-class,2016-04-02 11:00:00,4,0,1,4,0,0,0,0,0
208799592506432_958544040865313,"""Arthur Henry Young (1866-1943), known to the world as Art, was arguably the most widely recognized and beloved cartoonist in the history of American radicalism. A working cartoonist for sixty years, Art Young drew thousands of simple black-line drawings with biting captions that appeared in big-city newspapers, liberal magazines, and, most importantly, in the socialist, labor, and radical press of the early twentieth century.""

http://newpol.org/content/radical-art-art-young-and-cartoons-american-socialism","Radical Art: Art Young and the Cartoons of American Socialism , by Michael Mark Cohen, New Politics",link,http://newpol.org/content/radical-art-art-young-and-cartoons-american-socialism,2016-03-31 11:00:18,2,0,0,2,0,0,0,0,0
208799592506432_958542947532089,"""After ten years of economic contraction, many of the citizens of Puerto Rico find themselves watching the secular decomposition of a reality that in its heyday was painted by many as one of relative socio-economic welfare. The latest economic downturn of the island, which predated the so-called global ""great recession"" by two years, has confirmed that the current colonial economy could not achieve certain objectives of the economically more advanced economies.""

http://newpol.org/content/wealth-extraction-governmental-servitude-and-social-disintegration-colonial-puerto-rico","Wealth Extraction, Governmental Servitude, and Social Disintegration in Colonial Puerto Rico, by...",link,http://newpol.org/content/wealth-extraction-governmental-servitude-and-social-disintegration-colonial-puerto-rico,2016-03-29 10:00:00,1,0,0,1,0,0,0,0,0
208799592506432_958542417532142,"""The demonstrations, known to many as the ""Oaxaca Commune,"" featured  six months of mass marches, public encampments, and neighborhood barricades. Although they failed to oust the state's then-governor, Ulises Ruíz Ortíz, the protestors proved that the radical democracy of everyday people – and not just union officials or opposition politicians – could challenge the PRI, which had ruled the state for decades.""

http://newpol.org/content/oaxaca-teachers-won%E2%80%99t-give-fight","In Oaxaca, Teachers Won't Give Up the Fight, by Eric Larson, New Politics",link,http://newpol.org/content/oaxaca-teachers-won't-give-fight,2016-03-28 10:00:00,1,0,0,1,0,0,0,0,0
208799592506432_958542017532182,"""We, the undersigned, wish to express our deepest worries about the resolution of the Hungarian Academy of Sciences to close down the Lukács Archives in Budapest.""

http://newpol.org/content/protest-against-closing-down-luk%C3%A1cs-archive","Protest Against Closing Down the Lukács Archive!, by Zsuzsa Hermann , New Politics",link,http://newpol.org/content/protest-against-closing-down-lukács-archive,2016-03-27 11:01:21,4,0,0,4,0,0,0,0,0
208799592506432_958541417532242,"""The billion residents of Africa are amongst the most vulnerable to climate change in coming decades, and of special concern are high-density sites of geopolitical and resource-related conflicts: the copper belt of the Democratic Republic of the Congo and mineral-rich African Great Lakes stretching into northern Uganda, western Ethiopia (bordering the Sudanese war zone), Madagascar and smaller Indian Ocean islands, and the northern-most strip of Africa and West Africa including Liberia and Sierra Leone (recent sites of diamond-related civil war and then Ebola epidemics). In other words, the African terrains hardest hit by war and economic looting are going to be sites of climate stress and socio-political unrest, according to the University of Texas project researching vulnerability for the U.S. Pentagon ""

http://newpol.org/content/who-wins-%E2%80%9Cclimate-apartheid%E2%80%9D","Who Wins From ""Climate Apartheid""?, by Patrick Bond, New Politics",link,"http://newpol.org/content/who-wins-""climate-apartheid""",2016-03-26 11:00:00,1,0,2,1,0,0,0,0,0
208799592506432_958540260865691,"""Reservation is an issue that only affects a small proportion of Dalits, says sociologist Vivek Chibber.

The ferment on campuses across the country following Rohith Vemula's suicide and the recent crackdown on free speech at Jawaharlal Nehru University have drawn international attention, with many academics, students and activists across the world expressing solidarity.

The mobilisation of Dalit students and the increasing awareness of caste oppression were some positive outcomes amid the troubling instances of attack on dissent and democratic rights. Vivek Chibber, Professor of Sociology at New York University and author of Postcolonial Theory and the Specter of Capital spoke about these developments. While appreciating the significance of struggles around identity in India and the United States, Prof. Chibber argues that movements of the oppressed can be sustained and strengthened only if they take up issues of economic justice.""

http://newpol.org/content/%E2%80%98dalit-movement-has-see-itself-part-class-wide-movement%E2%80%99","'Dalit movement has to see itself as part of a class-wide movement', by Vivek Chibber, New Politics",link,http://newpol.org/content/'dalit-movement-has-see-itself-part-class-wide-movement',2016-03-25 10:00:01,0,0,0,0,0,0,0,0,0
208799592506432_958543527532031,"""In this article we will look critically at a selection of key elements of the political discourse of the Spanish radical left with a particular focus on the role of Podemos as the main curator and a key producer of Indignados language from 2014 onwards. Also, the use of language by Podemos, as it strives to become a hegemonic mass movement, and the language's impact on Podemos activists and the orientation of their program, will be discussed.""

http://newpol.org/content/podemos-and-15m-language-community","Podemos and the 15M Language Community, by Antonio Martínez-Arboleda, New Politics",link,http://newpol.org/content/podemos-and-15m-language-community,2016-03-24 11:00:01,1,0,0,1,0,0,0,0,0
208799592506432_958539787532405,"""The siege of Kobani by Islamic State (ISIS) brought worldwide attention to the Syrian Kurdish PYD (Partiya Yekîtiya Demokrat, Democratic Union Party), the leading force in the Kurdish-majority areas in northern Syria. The PYD calls this region Rojava—literally meaning ""land of the sunset"" but also translated as ""West Kurdistan."" 

The discourse of the PYD, revolving around terms like democracy and equality and stressing women's rights, exercises a strong attraction on the worldwide left. Likewise, the struggle of the YPG/YPJ fighters (Yekîneyên Parastina Gel, People's Protection Units/Yekîneyên Parastina Jinê, Women's Protection Units), organized by the PYD against ISIS, receives widespread sympathy. ""

http://newpol.org/content/commune-rojava","A Commune in Rojava?, by Alex de Jong, New Politics",link,http://newpol.org/content/commune-rojava,2016-03-24 10:00:02,0,0,0,0,0,0,0,0,0
208799592506432_961305383922512,"NYC friends, comrades, and colleagues -- Hope to see some of you there. And by all means share with anyone who might be interested.",An Unpublished Lecture of CLR James - New Politics Forum,event,https://www.facebook.com/events/110949285969270/,2016-03-24 06:23:37,0,0,0,0,0,0,0,0,0
208799592506432_960644697321914,,"Every Cook Can Govern: The life, works & impact of C.L.R. James",video,https://www.youtube.com/watch?v=Oe2AD_HCGWM,2016-03-23 13:53:39,1,0,2,1,0,0,0,0,0
208799592506432_958543214198729,"""Like many countries trying to wedge their way into economic prosperity Mexico has affirmed an emphasis on education but in practice has negated its importance. Recently passed constitutional reforms relegate educators to temporary employment controlled by the federal government and private investors who have little or no interest in universal coverage or academic excellence.  A huge portion of federal money designed for education goes to administrative personnel and is not subject to audit.""

http://newpol.org/content/mexican-education-mere-simulation","Mexican Education: A Mere Simulation , by Robert Joe Stout, New Politics",link,http://newpol.org/content/mexican-education-mere-simulation,2016-03-23 11:00:00,0,0,0,0,0,0,0,0,0
208799592506432_958539390865778,"""Will we ever get over this thing called civilization? That's what I wondered as I watched The Embrace of the Serpent, directed by Colombian filmmaker Ciro Guerra, a black-and-white film in several indigenous and European languages that has some of the qualities of a documentary. But this is a truer-than-history fiction, fabricated out of the travel diaries of two botanists, Theodor Koch-Grunberg (Jan Bijvoet) and Richard Evan Schultes (Brionne Davis), both of whom traveled in the Amazon region, the former in 1909 and the latter in 1940.""

http://newpol.org/content/%E2%80%9Cembrace-serpent%E2%80%9D-continuing-conquest","""Embrace of the Serpent"": The Continuing Conquest, , New Politics",link,"http://newpol.org/content/""embrace-serpent""-continuing-conquest",2016-03-23 10:00:00,0,0,0,0,0,0,0,0,0
208799592506432_958537610865956,"""While analysis of post-1980 transformations is essential to understanding current struggles, it is important to recognize that the origins of many conflicts in contemporary Turkey have deep roots in the country and region's past, dating to the demise of the Ottoman Empire and the construction of the Turkish nation-state in the 1920s and 1930s.""

http://newpol.org/content/prospects-turkey","Prospects for Turkey, by Daniel Johnson, New Politics",link,http://newpol.org/content/prospects-turkey,2016-03-22 10:00:00,0,0,1,0,0,0,0,0,0
208799592506432_949825985070452,"""The persons who organized and who propagated and made the caste system, something that was absorbed deeply into the very consciousness as well as into the activity of the society, were not the bourgeoisie but the priesthood and whatever they preached. It was a priestly doctrine! Whereas, in Western society, the priests came after the Romans had formed the empire. And the priests guarded the feudal lords and represented the ideological and political importance of the feudal lords over the rest of society. These things had been preached by the masters, and they educated the people and promulgated the ideas that we know as the caste system today. That is quite different from Western civilization. Quite different. ""

http://newpol.org/content/class-basis-race-question-united-states","The Class Basis of the Race Question in the United States , by C.L.R. James, New Politics",link,http://newpol.org/content/class-basis-race-question-united-states,2016-03-21 11:00:00,1,1,0,1,0,0,0,0,0
208799592506432_949825488403835,"""Dawn Paley's Drug War Capitalism presents an overview of the drug wars in several Latin American countries: Columbia, Mexico, Guatemala, and Honduras. Mexico receives the most attention, and Paley provides a wealth of information from a variety of sources documenting the impact of the war-on-drugs on Mexican society and on the role of the United States.""

http://newpol.org/content/drugs-war-and-capitalism","Drugs, War, and Capitalism, by Dan La Botz, New Politics",link,http://newpol.org/content/drugs-war-and-capitalism,2016-03-20 12:00:00,0,0,1,0,0,0,0,0,0
208799592506432_949825098403874,"""Americans today face a dual crisis: rising rents and increasingly unaffordable housing markets. The housing crisis, far from being over, has metastasized. This new set of problems is confounding economists, who are left to view the situation through the narrow lens of mainstream orthodoxy—one that is highly colored by the ever-present notion of the American (Delusion) Dream. If the country is to deal with this new normal, it must embrace new economic tools and question the veracity of a system that swings from one crisis to the next—a system that is proving incapable of providing individuals and families with affordable housing, a basic need. ""

http://newpol.org/content/roots-modern-housing-crisis","The Roots of the Modern Housing Crisis, by Sean Posey, New Politics",link,http://newpol.org/content/roots-modern-housing-crisis,2016-03-19 12:00:02,1,0,0,1,0,0,0,0,0
208799592506432_949824981737219,"""The effort to issue The Complete Works of Rosa Luxemburg has reached a critical phase, and we appeal for your help in enabling future volumes to be published.""

http://newpol.org/content/help-needed-produce-rosa-luxemburgs-complete-works","Help Needed to Produce Rosa Luxemburg's Complete Works, by the Editorial Board of Rosa...",link,http://newpol.org/content/help-needed-produce-rosa-luxemburgs-complete-works,2016-03-19 11:00:01,0,0,1,0,0,0,0,0,0
208799592506432_949824881737229,"""Systemic contradictions of capitalism have only intensified in the neoliberal era. Structural unemployment, a phenomenon directly related to capitalist modes of production, has continued unabated, creating a massive and ever-growing ""reserve army of labor"" that has been disenfranchised on an unprecedented scale. ""

http://newpol.org/content/debt-underemployment-and-capitalism","Debt, Underemployment, and Capitalism, by Colin Jenkins and Cherise Charleswell, New Politics",link,http://newpol.org/content/debt-underemployment-and-capitalism,2016-03-18 11:06:01,1,0,1,0,0,0,0,0,1
208799592506432_949824748403909,"""SA wants to build a genuine Left political movement and is hoping to use the energy spawned through the Sanders' campaign to help accomplish that.""

http://newpol.org/content/feelthebe%E2%80%A6trayal","#FeelTheBe…trayal?, by Bryant Sculos, New Politics",link,http://newpol.org/content/feelthebe…trayal,2016-03-17 11:00:00,0,0,1,0,0,0,0,0,0
208799592506432_949824615070589,"""We are witnessing a grand shift in the nature of capitalist society. It is not to be found simply in the expanding chasms of economic inequality, nor in the rapid social and cultural transformations shaped by globalization. Of course, economic inequality raises concern among liberals, social democrats, and socialists alike. For all see in it an ethical problem, one of unfairness, of greed, of unequal control and power. But the new explosion of wealth inequality is much larger in scale than in the previous Gilded Age. It poses different questions with respect to the transformation of capitalism and the classical models and assumptions within which left politics typically operate.""

http://newpol.org/content/rise-servant-society","The Rise of the Servant Society, by Michael J. Thompson, New Politics",link,http://newpol.org/content/rise-servant-society,2016-03-16 11:00:00,4,0,6,3,0,0,0,0,1
208799592506432_949824368403947,"""The Sanders campaign has certainly sharpened the contradictions, hasn't it? It's been very clarifying to see Hillary Clinton and her surrogates running against single-payer and free college, with intellectual cover coming from Paul Krugman and Vox. Expectations, having been systematically beaten down for 35 years, must be beaten down further, whether it's Hillary saying that to go to college one needs some ""skin in the game,"" or Rep. John Lewis reminding us that nothing is free in America. A challenge from the left has forced centrist Democrats to reveal themselves as proud capitalist tools.""

http://newpol.org/content/liberal-red-baiting","Liberal Red-Baiting, by Doug Henwood, New Politics",link,http://newpol.org/content/liberal-red-baiting,2016-03-15 11:00:00,3,0,1,3,0,0,0,0,0
208799592506432_949824151737302,"""Today, I see new systemic logics arising from the decaying political economy of the twentieth century ... and these include expulsion logics to a far larger and more extreme extent than the preceding Keynesian period, which also had some of this but not as widespread. This decay began in the 1980s.""

http://newpol.org/content/systemic-edge","The Systemic Edge, by Saskia Sassen and Saulo Colón and Riad Azar, New Politics",link,http://newpol.org/content/systemic-edge,2016-03-14 11:00:00,6,0,4,6,0,0,0,0,0
208799592506432_949823891737328,"""Fernando Cardenal, the revolutionary Jesuit priest who served as Secretary of Education in the Sandinista government of Nicaragua, died in Managua on February 20 following complications arising from heart surgery. He was 82 years old.""

http://newpol.org/content/fernando-cardenal-nicaraguan-christian-revolutionary%E2%80%93-presente","Fernando Cardenal, Nicaraguan Christian Revolutionary– Presente!, by Dan La Botz, New Politics",link,http://newpol.org/content/fernando-cardenal-nicaraguan-christian-revolutionary–-presente,2016-03-13 12:00:00,1,0,0,1,0,0,0,0,0
208799592506432_949823555070695,"""Senator Bernie Sanders' run for the Democratic Party nomination for president has certainly energized thousands. It has also rekindled an old debate on the American left that revolves around the question: Should the left join, endorse, support, or work for campaigns in the Democratic Party?""

http://newpol.org/content/sanders-campaign-and-left","The Sanders Campaign and the Left, by Ashley Smith and Lance Selfa, New Politics",link,http://newpol.org/content/sanders-campaign-and-left,2016-03-12 12:00:01,0,0,1,0,0,0,0,0,0
208799592506432_949823371737380,"""An important historical analogy is poignant here. The Paris Agreement is as if COP President in Paris, Laurence Tumbiana, gleefully yelled at the crowds, ""Laisse-les boire de l'eau salée!""

Our very own 21st Century Marie Antoinette.""

http://newpol.org/content/let-them-drink-salt-water","Let Them Drink Salt Water, by Andrew Smolski and Jason Allen, New Politics",link,http://newpol.org/content/let-them-drink-salt-water,2016-03-11 11:00:01,0,0,0,0,0,0,0,0,0
208799592506432_949822991737418,"""Regardless of their origins, today the Democratic Party and Republican Party are not real, ""European-style"" political parties. They ceased to be so over the course of the twentieth century. The political machines with their party bosses that used to control who could run for office on which party label—particularly in the Democratic Party—are overwhelmingly a thing of the past.""

http://newpol.org/content/bernie-sanders-and-dilemma-%E2%80%A8-democratic-%E2%80%9Cparty%E2%80%9D","Bernie Sanders and the Dilemma of the Democratic ""Party"", by Jason Schulman, New Politics",link,"http://newpol.org/content/bernie-sanders-and-dilemma--democratic-""party""",2016-03-10 12:00:00,2,0,2,2,0,0,0,0,0
208799592506432_949822591737458,"""Antonia Hinojos Hernandez is in a race against time. Known to her friends as ""Tonita,"" the Ciudad Juarez mayoral hopeful has until March 7 to gather nearly 30,000 signatures from eligible voters so her name can appear on the June ballot as an independent candidate.""

http://newpol.org/content/can-woman-worker-become-mayor-juarez-mexico","Can a Woman Worker Become Mayor of Juarez, Mexico?, by Kent Paterson, New Politics",link,http://newpol.org/content/can-woman-worker-become-mayor-juarez-mexico,2016-03-09 11:00:01,0,0,0,0,0,0,0,0,0
208799592506432_949822035070847,"""The Bernie Sanders campaign in the Democratic Party has attracted the support of millions, raised an economic reform program such as we have not seen in decades, and has led to a national discussion about the nature of socialism. At the same time, he has ceased to be an independent, has joined the Democratic Party, and has promised to support its nominee, in all likelihood Hillary Clinton. This has led to much discussion and debate on the left. New Politics has solicited two articles from different points of view on the Sanders campaign, one by our co-editor Jason Schulman and the other by Lance Selfa and Ashley Smith of the International Socialist Organization.""

http://newpol.org/content/discussion-sanders-campaign","A Discussion of the Sanders Campaign, , New Politics",link,http://newpol.org/content/discussion-sanders-campaign,2016-03-08 11:00:01,1,0,3,1,0,0,0,0,0
