status_id,status_message,link_name,status_type,status_link,status_published,num_reactions,num_comments,num_shares,num_likes,num_loves,num_wows,num_hahas,num_sads,num_angrys
208799592506432_1233725773347137,"""Protests against Trump continue even as new ones are being planned for the future, from the recent Not-My-President Day and Day without an Immigrant protests, to the International Women's Strike planned for March 8.""","""Reports on the Resistance: Not-My-President Day, Day without Immigrants, and More Protests Planned""",link,http://newpol.org/content/reports-resistance-notmypresident-day-day-without-immigrants-and-more-protests-planned,2017-03-15 13:38:38,2,0,0,2,0,0,0,0,0
208799592506432_1233723946680653,"""In the halcyon days, the term 'fake news' used to refer to hard-hitting satirical programs, in the vein of The Daily Show, The Colbert Report, Last Week Tonight, and Full Frontal with Samantha Bee. When the distinctions between truth and fiction, reality and absurdity, and authenticity and fakery have become so hopelessly blurred, comedic satire has felt like a last stand against the bottomless unreality of contemporary political media culture. Satire speaks truth to bullshit by usurping the very language of falsehood and nonsense.""","""Fake News: from Satirical Truthiness to Alternative Facts,"" by Maggie Hennefeld",link,http://newpol.org/content/fake-news-satirical-truthiness-alternative-facts,2017-03-15 13:35:51,3,0,1,3,0,0,0,0,0
208799592506432_1214174125302302,"""It's been two weeks since Donald Trump's inauguration sparked some of the largest rallies in American history. Each week since has also seen demonstrations, culminating in those that broke out at airports across the country at the end of January to protest the president's new Muslim ban barring travel from seven predominantly Muslim countries. Mass protests are in large measure a bellwether of popular sentiment. They carry an implicit threat that politicians who defy the will of the people will be voted out, but that threat must be channeled strategically, or it will dissipate.

The Clinton campaign and its most strident defenders continue to point the finger at everyone but themselves for our country's current predicament. On the left, however, a general consensus has emerged: It was the campaign's own elitism, not the bigotry of the white working class, that led to Clinton's loss. Yes, bigotry played a tremendous role, but it was a bigotry driven by desperation and anger at a system that has left so many behind--and that Donald Trump expertly manipulated.

The emerging resistance must reach out not only to liberals but also working-class Trump supporters. We cannot afford to accept that roughly 62 million Trump supporters are irredeemably bigoted because, if we do, there is no hope. Culture and emotion come into the mix but our politics--the politics of the left and of the labor movement--are ultimately predicated on the belief that people are rational actors, that they act in what they believe to be their own best interest and that they can be swayed by rational argument. Therein lies one of our most basic but most important tasks.""","""Fighting Trumpism: where do we go from here?"" by Micah Landau",link,http://newpol.org/content/fighting-trumpism-where-do-we-go-here,2017-02-20 19:17:23,3,0,0,3,0,0,0,0,0
208799592506432_1212904675429247,"Joanne Landy remembers NP editorial board member Sam Bottone, who passed away on Dec. 30.","""Sam Bottone, 1926-2016,"" by Joanne Landy (Winter 2017)",link,http://newpol.org/content/sam-bottone-19262016,2017-02-19 14:31:26,1,0,0,0,1,0,0,0,0
208799592506432_1212903805429334,"Kyle Stanton reviews Jeff Halper's ""War Against the People: Israel, the Palestinians and Global Pacification.""","""Getting Away With It: Israel and Global Occupation,"" by Kyle Stanton (Winter 2017)",link,http://newpol.org/content/getting-away-it-israel-and-global-occupation,2017-02-19 14:29:29,3,0,1,3,0,0,0,0,0
208799592506432_1212901605429554,"Aaron Amaral reviews two books on Greece: Jack Rasmus' ""Looting Greece: A New Financial Imperialism Emerges"" and Helena Sheehan's ""The Syriza Wave: Surging and Crashing with the Greek Left.""","Reflections on Opportunity Lost: Greece and the Syriza Experience,"" by Aaron Amaral (Winter 2017)",link,http://newpol.org/content/reflections-opportunity-lost,2017-02-19 14:24:45,2,0,0,2,0,0,0,0,0
208799592506432_1212899972096384,"Dan LaBotz reviews Samir Amin's ""Russia and the Long Transition from Capitalism to Socialism.""

""For some time now, many of us have wondered how it is that a number of left-wing writers and some political organizations could support Vladimir Putin and the Russian government's role in international affairs. These groups and individuals have backed Putin in the seizure of Crimea, his stealthy intervention in Ukraine, and his support for the Syrian dictator Bashar al-Assad (whom they also support). Is this simply the crude politics of ""the enemy of my enemy is my friend""? Or is there some theoretical justification for their position? And if so, what is it?

Samir Amin, often seen as the leading theoretician of the Global South, has written a short book that answers that question—though the answer he provides is not only unsatisfying but disturbing. Amin's logic places him on the side of undemocratic and aggressive states against ""the people,"" whose uprising, he says, he has always championed.""","""Samir Amin's Russian Campist Anti-Imperialism,"" by Dan LaBotz (Winter 2017)",link,http://newpol.org/content/samir-amin%E2%80%99s-russian-campist-antiimperialism,2017-02-19 14:21:29,7,0,9,7,0,0,0,0,0
208799592506432_1212898692096512,"Herman Benson reviews ""The Two Trotskyisms Confront Stalinism: The Fate of the Russian Revolution, Volume 2,"" edited by Sean Matgamna.","""1939: Soviets Invade Poland. Defensist? Imperialist?,"" by Herman Benson (Winter 2017)",link,http://newpol.org/content/1939-soviets-invade-poland-defensist-imperialist,2017-02-19 14:18:08,5,0,0,5,0,0,0,0,0
208799592506432_1212896925430022,"The material that follows is taken from Seth Tobocman's new graphic biography of the radical lawyer Leonard Weinglass, ""Len: A Lawyer in History.""","""Leonard Weinglass on The Patriot Act,"" by Seth Tobocman, with an introduction by Kent Worcester",link,http://newpol.org/content/leonard-weinglass-patriot-act,2017-02-19 14:14:55,0,0,0,0,0,0,0,0,0
208799592506432_1212895152096866,"Bryant Sculos replies to Michael J. Thompson's essay in the Winter 2016 issue of New Politics, ""The Rise of the Servant Society.""","""The Capitalistic Mentality and the Politics of Radical Reform,"" by Bryant Sculos (Winter 2017)",link,http://newpol.org/content/capitalistic-mentality-and-politics-radical-reform,2017-02-19 14:11:11,1,0,1,1,0,0,0,0,0
208799592506432_1212893042097077,"""Long before sociologist C. Wright Mills paved the way to modern studies of power, a group of writers termed ""muckrakers"" was hard at work digging up the dirt on our American oligarchy. They did it in various literary forms: journalism, book-length nonfiction, cartoons, novels, even poetry. From just before the Progressive Era (about 1904 to 1920) to the mid-1930s, the muckrakers were a critical force in bringing to public light the evils inherent in plutocratic rule. By the time the muckrakers were through, no literate person could doubt the reality that a vast swamp of corruption stemming from the linkages between business and government was a historical fact. Nor could anyone doubt the terrible consequences of this system for human lives in a time of untrammeled corporate greed.""","""The Rise and Fall of the Muckrakers,"" by Martin Oppenheimer, (Winter 2017)",link,http://newpol.org/content/rise-and-fall-muckrakers,2017-02-19 14:06:15,1,0,2,1,0,0,0,0,0
208799592506432_1212892118763836,"Peter Kolozi and James Freeman reflect on King's last book, ""Where Do We Go from Here: Chaos or Community,"" on the 50th anniversary of its publication.","""Remembering Martin Luther King's Last, Most Radical Book,"" by Peter Kolozi and James Freeman",link,http://newpol.org/content/remembering-martin-luther-king%E2%80%99s-last-most-radical-book,2017-02-19 14:03:57,1,0,2,1,0,0,0,0,0
208799592506432_1212889392097442,"The struggle at Standing Rock against the Dakota Access Pipeline (DAPL) was one of the major political mobilizations of 2016, combining the demand for Native rights with the call for environmental justice. New Politics asked Nancy Romer to cover these events for us. She was at Standing Rock from November 10-15.

Her initial report and her article on the meaning of the victory achieved on December 5—and the struggle that still remains—have been previously published at www.newpol.org. Here we print two more of her dispatches from the scene, showing some of the day-to-day dynamics of standing with Standing Rock.","""Solidarity Report from Standing Rock,"" by Nancy Romer (Winter 2017)",link,http://newpol.org/content/solidarity-report-standing-rock,2017-02-19 13:57:48,1,0,1,1,0,0,0,0,0
208799592506432_1212887058764342,Stefanie Prezioso writes on the recent constitutional reform in Italy and its repercussions.,"""Italy: 'Sovereignty Belongs to the People,'"" by Stefanie Prezioso (Winter 2017)",link,http://newpol.org/content/%E2%80%98sovereignty-belongs-people%E2%80%99,2017-02-19 13:52:55,0,0,0,0,0,0,0,0,0
208799592506432_1212884875431227,"""Night had fallen on the Atlanta Stadium in the city of Buenos Aires on November 19, and as ""The Internationale"" began to blare from the loudspeakers, more than twenty thousand people at the Trotskyist Left Front rally stood up, their fists held high, to sing the international workers' anthem with a single voice.

Among them were women who had taken part in recent nationwide actions against gender violence under the slogan #NiUnaMenos, workers fighting against layoffs and pay cuts or operating recovered factories that are now under workers' control, and students and teachers from all over the country. The event took place not as a demonstration of support for an electoral campaign or a response to a specific political event, but as a conscious step toward the construction of a revolutionary political alternative.

Just days after the election of Trump in the United States and after the turn of the ""pink tide"" had brought with it the advance of the right in Latin America, including the ""institutional coup"" in Brazil and the election of Mauricio Macri in Argentina, this was a massive demonstration of strength by an anti-capitalist force that promotes workers' power and self-organization. How was this accomplishment possible?""","The Rise of the Revolutionary Left �in Argentina,"" by Marisela Trevin and Juan Cruz Ferre",link,http://newpol.org/content/rise-revolutionary-left-%E2%80%A8-argentina,2017-02-19 13:48:27,1,0,0,1,0,0,0,0,0
208799592506432_1212883652098016,"""In Poland the law on abortion is one of the most restrictive in the European Union, sex education does not exist, and contraception is both expensive and hard to obtain because a medical prescription is often needed.

According to a 1993 law, abortion is allowed only in three cases: when pregnancy is a threat to a woman's life or health; when there is a high possibility of severe malformation or illness of a fetus, confirmed by a prenatal exam; or when a pregnancy is the result of a crime (rape, incest, or pedophilia).1 In other cases it is criminalized.""","""#czarnyprotest: The Black Protest for Abortion Rights in Poland,"" by Katarzyna Bielińska-Kowalewska",link,http://newpol.org/content/czarnyprotest,2017-02-19 13:46:17,2,0,0,2,0,0,0,0,0
208799592506432_1212881958764852,"""What explains the enthusiasm in certain quarters of the left for Vladimir Putin and Russia?

Why do some cheer on Russian bombing in Syria, dismissing out of hand the evidence from Physicians for Human Rights, Amnesty International, and Human Rights Watch1 that they are criminally targeting hospitals? Why do some try to justify Russia's takeover of Crimea or its blatant intervention in Ukraine?""","""Russia and the Left,"" by Stephen R. Shalom (Winter 2017)",link,http://newpol.org/content/russia-and-left-0,2017-02-19 13:43:17,0,0,0,0,0,0,0,0,0
208799592506432_1212879682098413,Saeed Rahnema reflects on the centennial of Lenin's imperialism thesis.,"""Neoliberal Imperialism, �The Latest Stage of Capitalism,"" by Saeed Rahnema (Winter 2017)",link,http://newpol.org/content/neoliberal-imperialism-%E2%80%A8-latest-stage-capitalism,2017-02-19 13:40:07,1,0,1,1,0,0,0,0,0
208799592506432_1212878082098573,"""During the tumultuous years that followed the horrors of World War I, especially in the period of 1917 to the early 1920s, the Russian working class became an inspiration to workers around the world.

The Russian Revolution of October 1917 did several things that represented a watershed for the socialist movement. First, of course, for the first time in world history working people—the proletariat and the peasantry—overthrew the old order of monarchical, aristocratic, and capitalist government in Russia, took power themselves, and founded a new revolutionary regime aimed at establishing socialism. With the exception of the tragically short-lived Paris Commune of 1871, lasting just seventy days, a successful workers' revolution had never happened before, and never in an entire nation.""","""This Changed Everything—Twice: Russia, Revolution, and Counter-revolution,"" by Dan LaBotz",link,http://newpol.org/content/changed-everything%E2%80%94twice,2017-02-19 13:36:11,1,0,0,1,0,0,0,0,0
208799592506432_1212874575432257,"""One hundred years ago the most democratic revolution in history took place. Led by the Bolshevik Party, the Russian working class, allied with the peasantry and organized into mass democratic institutions—the soviets—took power.

The only precedent for it was the Paris Commune of 1871, in which the working people of Paris seized control of their city but were able to hold onto it for only two-and-a-half months. After the Commune fell, Karl Marx wrote that it ""will be forever celebrated as the glorious harbinger of a new society.""

The workers' democracy created by the Bolshevik Revolution did not survive either, although it took a few years, not months, to bring about its complete demise. For a short time, however, Soviet Russia proved that socialism was a real possibility, not merely a beautiful dream.""","""'Glorious Harbinger of a New Society': The Bolshevik Revolution,"" by Thomas Harrison (Winter 2017)",link,http://newpol.org/content/glorious-harbinger-new-society,2017-02-19 13:30:20,0,0,0,0,0,0,0,0,0
208799592506432_1210192799033768,"""This year's elections are the culmination of the long-standing economic and cultural grievances of America's industrial workers, a subclass largely composed of white men from the Rust Belt whose factories have been asset-stripped and sent abroad and whose unions or small businesses, pensions, and prospects have been decimated. They are not the poorest of the poor—not even the poorest of the white poor. They are not from places where the economic conditions are the worst, but they are from places where uncertainty about the future of industrial jobs is most acute.""","""The Rust Belt in Revolt,"" by Barry Finger (Winter 2017)",link,http://newpol.org/content/rust-belt-revolt,2017-02-16 13:41:39,4,0,0,4,0,0,0,0,0
208799592506432_1210189975700717,"""Donald Trump takes office on January 20, setting up the most right-wing, racist government in modern American history, but he will not go unchallenged. That challenge is already in motion.

Within days of the election, hundreds of thousands took to the streets nationwide, and governments in dozens of cities, including Los Angeles, New York, Chicago, Philadelphia, Minneapolis, and Washington DC, pledged to continue offering sanctuary to immigrants—key targets for the right. Trump's cabinet choices and the reaction to them suggest that we are in for four years of tumultuous political and social battles. We do not shrink from these battles.""","""Trump Takes Office, Resistance Takes to the Streets,"" by Jason Schulman, et. al. (Winter 2017)",link,http://newpol.org/content/trump-takes-office-resistance-takes-streets,2017-02-16 13:38:34,3,0,0,3,0,0,0,0,0
208799592506432_1210182202368161,"""The inauguration of Donald Trump as the president of the United States opens what we fear will be one of the darkest and most dangerous periods in American history since the founding of this journal in 1961.

As many have already commented, Trump's cabinet of right-wing Republicans, billionaires and bankers, and generals resembles a military junta more than it does a civilian government. We face an administration that will be more repressive; that will attack labor and reproductive rights, social welfare programs, and immigrants; and that threatens to lay waste to the environment. We join in solidarity with many others on the left, in the labor and social movements, and in our society at large in pledging to resist Trump, the Republican Party, and the reactionary, racist, sexist, and homophobic forces that they have conjured up. We support the sanctuary cities and campuses, the many Muslim, black, and Latino organizations, the women's and LGBT groups, and all the many others who have pledged to resist Trump.""","""From the Editors (Winter 2017),"" by Julia Wrigley, Dan LaBotz, Nancy Holmstrom and Saulo Colon",link,http://newpol.org/content/editors-10,2017-02-16 13:27:43,4,0,0,4,0,0,0,0,0
208799592506432_1210175822368799,"""The Democratic elite created  a mirror image of the type of astroturf front groups and think tanks long ago invented, funded and promoted by the Reaganites and the Koch brothers.  The liberal elite own the Progressive Movement.  Organizing for Action, the ""non-partisan"" slush fund to train the new leaders of the Progressive Movement is just the latest big money ploy to consolidate their control and keep the feed flowing into the trough.""",Be Wary Of The Democratic Wing Of The Protest Movement,link,https://popularresistance.org/be-wary-of-the-democratic-wing-of-the-protest-movement/,2017-02-16 13:16:44,7,0,5,7,0,0,0,0,0
208799592506432_1208923835827331,"No one wants their retirement to be financed by companies involved in human rights violations and environmental destruction. But that is exactly what is happening to those of us with retirement funds invested in TIAA. You can learn about the campaign to get TIAA to divest from companies involved in land grabs and deforestation throughout the world by reading this power point - and please sign one of the petitions.

http://webiva-downton.s3.amazonaws.com/877/07/5/9776/TIAA-CREF_land_grabbing_webinar_PowerPoint.pdf",webiva-downton.s3.amazonaws.com,link,http://webiva-downton.s3.amazonaws.com/877/07/5/9776/TIAA-CREF_land_grabbing_webinar_PowerPoint.pdf,2017-02-15 10:42:27,0,0,0,0,0,0,0,0,0
208799592506432_1195067203879661,Sinister.,"Greece: Neo-Nazi ""Golden Dawn"" Members Voice Support for Donald Trump",link,https://www.democracynow.org/2017/1/30/headlines/greece_neo_nazi_golden_dawn_members_voice_support_for_donald_trump,2017-01-30 22:21:07,7,1,27,2,0,3,0,0,2
208799592506432_1193151680737880,"Please look for protests in your area against this latest Trump outrage -- but in the meantime, add your name to this petition. Thank you!",Sign the petition: Reject Trump's Muslim Ban,link,http://petitions.moveon.org/sign/reject-trumps-muslim?source=s.fb&r_by=417251,2017-01-28 18:32:13,4,0,0,4,0,0,0,0,0
208799592506432_1190242707695444,"""Labor officials such as AFT President Randi Weingarten — who defends her and her union's endorsement in a recent article called 'Why Hillary Clinton Deserved Labor's Support,' coauthored with Leo Casey, executive director of the Albert Shanker Institute — as well as many others, in refusing to endorse Bernie Sanders while grossly exaggerating Hillary's viability and worthiness for top office, share responsibility for the Trump victory.""

Revised and republished by Jacobin.",A Wasted Opportunity | Jacobin,link,https://www.jacobinmag.com/2017/01/hillary-clinton-bernie-sanders-unions-randi-weingarten-leo-casey-labor-movement-racism/,2017-01-25 13:56:06,7,0,4,6,1,0,0,0,0
208799592506432_1190157071037341,"""These are critical moments for Europe. It is clear that the Economic and Monetary Union has irrevocably failed, the economies of the periphery of Europe remain in severe crisis, and the economies of the core lack any impetus. The single currency has become a tool for Germany to implement mercantilism through wage dumping and — with the support of other core economies of the EMU — to dictate ""structural reforms,"" which create economic stagnation, poverty, and unemployment. The big corporations and promoters of neoliberalism are taking advantage of the crisis to intensify their offensive against the social and democratic conquests of the twentieth century.""",What to do in Europe? Proposals from the Left,link,http://www.versobooks.com/blogs/3064-what-to-do-in-europe-proposals-from-the-left,2017-01-25 11:52:19,2,0,2,2,0,0,0,0,0
208799592506432_1189695621083486,"I will be going to this protest rally on Wednesday at 5pm at Washington Square Park in Manhattan. If people know of events in other cities, or other events in the NYC area, please add them below. Thanks! This is URGENT.
---Joanne Landy",CAIR-New York,photo,https://www.facebook.com/CAIRNewYork/photos/a.105496502879712.11434.103189199777109/1194295873999764/?type=3,2017-01-25 00:25:07,1,0,0,1,0,0,0,0,0
208799592506432_1188243651228683,No pasaran!,Fighting Fascism: Remembering the Abraham Lincoln Brigade,event,https://www.facebook.com/events/406130223062945/,2017-01-23 13:51:26,1,0,0,0,1,0,0,0,0
208799592506432_1187774721275576,"Check out NP editorial board member and Jacobin editor and publisher Bhaskar Sunkara at this event cosponsored by NYC DSA, Solidarity and the ISO.",Building a Socialist Left Under Trump,event,https://www.facebook.com/events/374168549613569/,2017-01-23 02:59:59,2,0,0,2,0,0,0,0,0
208799592506432_1187515794634802,"Also from NP co-editor Dan LaBotz a poem to commemorate yesterday's marches. Enjoy!

http://newpol.org/content/i-see-america-marching-again","I See America Marching Again, by , New Politics",link,http://newpol.org/content/i-see-america-marching-again,2017-01-22 19:19:14,3,0,0,2,1,0,0,0,0
208799592506432_1187512811301767,"""In the United States about four million marched in what was one of the largest national protest demonstrations in the country's history, protests that have reawakened the women's movement,"" reports NP co-editor Dan LaBotz about the Jan. 21 National Women's March. ""While Washington, D.C. was the main march, there were some 700 sister marches—some of hundreds of thousands and many of tens of thousands—in dozens of other cities and towns in the United States and many more on every continent.""

http://newpol.org/content/millions-women-march-against-trump-and-his-policies","Millions of Women March Against Trump and His Policies, , New Politics",link,http://newpol.org/content/millions-women-march-against-trump-and-his-policies,2017-01-22 19:12:57,9,0,2,8,1,0,0,0,0
208799592506432_1187197787999936,"NP editorial board member Lois Wiener rightly praises yesterday's Women's March despite some shortcomings and criticizes the lack of broader participation from labor.

Weiner also offers constructive criticism that ought to be heeded if the nascent movement is to survive: It must do more to reach out to women of color and to represent their concerns.

http://newpol.org/content/labor-and-pussy-power",Labor and,link,http://newpol.org/content/labor-and-pussy-power,2017-01-22 11:41:34,1,0,0,1,0,0,0,0,0
208799592506432_1185628871490161,The New Politics editorial board is greatly saddened by the passing of fellow editorial board member Sam Bottone.,SAM BOTTONE's Obituary on New York Times,link,https://shar.es/1OGJcl,2017-01-20 12:49:19,2,0,0,0,0,0,0,2,0
208799592506432_1185610601491988,"New Politics contributor Steve Early will be discussing his new book ""Refinery Town: Big Oil, Big Money, and the Remaking of an American City"" and how the Left can build grassroots coalitions to win elections, shape left-wing policy, and build living local alternatives to Trump's agenda. Join us!",Socialists in the City: Lessons from the RPA,event,https://www.facebook.com/events/1236065753183268/,2017-01-20 12:18:16,1,0,0,1,0,0,0,0,0
208799592506432_1184783338241381,NP editorial board member and Jacobin publisher and editor Bhaskar Sunkara will participate in a debate about how the left should respond to Trumpism. Hope to see you there!,Trumpism: How Should the Left Respond?,event,https://www.facebook.com/events/372886399749614/,2017-01-19 07:44:59,1,0,0,1,0,0,0,0,0
208799592506432_1183402585046123,"Michael Hirsch, Saulo Colon, Murray Schneider, and Lois Weiner respond to an exchange between  Larry Cohen and Randi Weingarten and Leo Casey in New Labor Forum about what organized labor could and should have done differently so as to avoid Donald Trump's victory.","""What labor should learn from Trump's victory,"" by M. Hirsch, S. Colon, M. Schneider, L. Weiner",link,http://newpol.org/content/what-labor-should-learn-trump%E2%80%99s-victory-0,2017-01-17 20:09:45,75,15,32,74,1,0,0,0,0
208799592506432_1183367481716300,,Free Lee Jin-Young! Stop the repression of Labor Books! International Campaign to Free LJY 2017 | Links International Journal of Socialist Renewal,link,http://links.org.au/free-lee-jin-young-stop-repression-labor-books,2017-01-17 19:13:48,0,0,0,0,0,0,0,0,0
