status_id,status_message,link_name,status_type,status_link,status_published,num_reactions,num_comments,num_shares,num_likes,num_loves,num_wows,num_hahas,num_sads,num_angrys
208799592506432_845197725533279,"""In the Ireland of 1922, a civil war tore through the land and in its path it ripped apart families and friendships. It also created a deeper wedge in an unstable society where the church grappled for top position in an emerging new state.""

http://newpol.org/content/catholic-church-versus-ira-hunger-strikers-1923","The Catholic Church versus the IRA Hunger Strikers of 1923, by Lily Murphy, New Politics",link,http://newpol.org/content/catholic-church-versus-ira-hunger-strikers-1923,2015-07-15 16:00:00,0,0,0,0,0,0,0,0,0
208799592506432_845196948866690,"""Where does this animus toward ""the other"" come from?

In The Bigot: Why Prejudice Persists, Rutgers University political theorist Stephen Eric Bronner displays a keen understanding of the aggrieved if damaging psychology of the subjects of his book.""

http://newpol.org/content/bigotry-101-why-haters-gonna-hate","Bigotry 101: Why Haters Gonna Hate, by Michael Hirsch, New Politics",link,http://newpol.org/content/bigotry-101-why-haters-gonna-hate,2015-07-14 17:32:45,0,0,0,0,0,0,0,0,0
208799592506432_843342312385487,"""In this TeleSur interview with Rafael Bernabe, the spokesperson for the Puerto Rican Working Peoples Party advocates for a moratorium on the debt. Bernabe has written an extensive article in the current Summer 2015 issue of New Politics.""

http://newpol.org/content/crises-colonial-capitalism-video-interview-puerto-ricos-debt","The Crises of Colonial Capitalism: Video Interview on Puerto Rico's Debt, by Saulo Colón, New...",link,http://newpol.org/content/crises-colonial-capitalism-video-interview-puerto-ricos-debt,2015-07-12 15:00:01,1,0,0,1,0,0,0,0,0
208799592506432_843342142385504,"""As bad as that is, capitalism also encourages the poor to hate themselves. It is only through the rejection of capitalism, if not through revolution then through ground-up radical reforms, that both the currently rich and poor can collectively live emancipated lives without this poverty of hatred. We can and should maintain a hatred of poverty, without ever hating the poor. Hate the rich, but hate them productively by viewing them as the product and beneficiaries of an unjust, exploitative system.""

http://newpol.org/content/poverty-hatred-and-hatred-poverty-ideology-american-progressivism","The Poverty of Hatred and the Hatred of Poverty: The Ideology of American Progressivism, by...",link,http://newpol.org/content/poverty-hatred-and-hatred-poverty-ideology-american-progressivism,2015-07-11 15:30:00,2,0,0,2,0,0,0,0,0
208799592506432_843878555665196,,New Politics magazine,photo,https://www.facebook.com/newpoliticsmag/photos/a.208920545827670.55144.208799592506432/843878555665196/?type=3,2015-07-11 08:38:40,5,0,0,5,0,0,0,0,0
208799592506432_843341445718907,"""On Saturday, June 20, a quarter of a million people marched in London from the Bank of England to the Houses of Parliament in order to protest against the Conservative government's planned spending cuts to public services. This was the largest single demonstration against austerity to date and reflected to a degree the revival of a radical political left in Britain after decades in the wilderness.""

http://newpol.org/content/britains-end-austerity-now-revival-radical-political-left",Timeline Photos,photo,https://www.facebook.com/newpoliticsmag/photos/a.837035336349518.1073741826.208799592506432/843341445718907/?type=3,2015-07-10 10:04:12,1,0,1,1,0,0,0,0,0
208799592506432_842478479138537,"""A specter is haunting Europe - the specter of a democratic alternative to austerity.""

http://newpol.org/content/iuf-statement-what-really-stake-greek-crisis","IUF Statement: What Is Really at Stake in the Greek Crisis, , New Politics",link,http://newpol.org/content/iuf-statement-what-really-stake-greek-crisis,2015-07-09 17:00:01,5,0,0,5,0,0,0,0,0
208799592506432_841933752526343,"""The capitalist offensive has met little sustained resistance since the mid-1970s. Clearly, there have been major battles (the British miners' strike of 1984-1985, the PATCO strike in the US in 1980-81), sporadic upsurges of protest like the Occupy movement, and some top-down controlled one-day general strikes in Canada and Europe. Most of these struggles have either been defeated, and have not sparked the massive struggles that those of us on the left have hoped for.""

http://newpol.org/content/explaining-acquiescence",Timeline Photos,photo,https://www.facebook.com/newpoliticsmag/photos/a.837035336349518.1073741826.208799592506432/841933752526343/?type=3,2015-07-08 09:00:01,9,0,1,9,0,0,0,0,0
208799592506432_841981399188245,"""I find it odd that my friend and fellow New Politics board member Riad Azar should center his criticism of Bernie Sanders' foreign policy on Sanders' supposed ""irresponsible"" ""isolationism."" ""

http://newpol.org/content/response-riad-azar-sanders-foreign-policy",Timeline Photos,photo,https://www.facebook.com/newpoliticsmag/photos/a.837035336349518.1073741826.208799592506432/841981399188245/?type=3,2015-07-07 14:00:01,3,0,0,3,0,0,0,0,0
208799592506432_840566729329712,"""Bernie falls woefully short on issues of foreign policy, issues that I believe (contrary to many) will be significant factors in the Democratic primary and the General Election. If Bernie can speak truth to power on the economy, he must speak truthfully about the U.S. government's foreign policy catastrophe.""

http://newpol.org/content/sanders-and-middle-east","Sanders and the Middle East, by Riad Azar, New Politics",link,http://newpol.org/content/sanders-and-middle-east,2015-07-03 15:30:01,4,0,1,4,0,0,0,0,0
208799592506432_839796266073425,The International Union of Food Workers analyzes the actions of Greece's creditors (predators) and calls for global labor solidarity with the Greek people.,What is really at stake in the Greek crisis | IUF UITA IUL,link,http://www.iuf.org/w/?q=node%2F4328,2015-07-02 04:25:09,4,0,1,4,0,0,0,0,0
208799592506432_838798379506547,"""Though there are some who do not rule out the possibility that Sanders could win, I consider that chance to be remote and so for me the question is what the Sanders campaign might accomplish assuming he doesn't win.""

http://newpol.org/content/assessing-sanders-campaign","Assessing the Sanders Campaign, by Stephen R. Shalom, New Politics",link,http://newpol.org/content/assessing-sanders-campaign,2015-06-30 10:00:01,1,1,0,1,0,0,0,0,0
208799592506432_837524509633934,"Grassroots labor initiative urges Democratic primary support for Sanders by AFL-CIO and national unions.

http://newpol.org/content/over-1000-local-union-leaders-and-members-back-bernie-sanders-president",Timeline Photos,photo,https://www.facebook.com/newpoliticsmag/photos/a.837035336349518.1073741826.208799592506432/837524509633934/?type=3,2015-06-28 09:00:01,0,0,1,0,0,0,0,0,0
208799592506432_837025649683820,"""The main obstacle in Erdoğan's quest for dictatorial power was the People's Democracy Party (HDP), a party with roots in the Kurdish movement but that since its creation in 2012 has sought to appeal to a variety of leftist and civil society groups.""

http://newpol.org/content/meaning-election-turkey",Timeline Photos,photo,https://www.facebook.com/newpoliticsmag/photos/a.837035336349518.1073741826.208799592506432/837025649683820/?type=3,2015-06-27 10:00:01,3,0,0,3,0,0,0,0,0
208799592506432_837024919683893,"""This book by one of the main figures associated with the German ""New Reading"" of Marx (neue Marx-Lektüre)—a post-1968 phenomenon much indebted to the early Frankfurt School and Theodor Adorno in particular—is alternately frustrating and enlightening.""

http://newpol.org/content/critical-theory-value-theory-and-so-called-traditional-marxism",Timeline Photos,photo,https://www.facebook.com/newpoliticsmag/photos/a.837035336349518.1073741826.208799592506432/837024919683893/?type=3,2015-06-26 11:30:02,1,0,0,1,0,0,0,0,0
208799592506432_836643216388730,"In the run-up to Argentina's national elections in October, a scramble for power has divided the incumbent Peronista party into warring factions.

http://newpol.org/content/electoral-amnesia-argentina",Timeline Photos,photo,https://www.facebook.com/newpoliticsmag/photos/a.837035336349518.1073741826.208799592506432/836643216388730/?type=3,2015-06-25 10:00:00,0,0,0,0,0,0,0,0,0
208799592506432_835744656478586,"A Marxist critique of Thomas Piketty's Capital in the 21st Century

""But what about the theory behind the data? As much as Piketty claims to go against the grain of his profession, as one labors through the almost 700 pages of this thick tome, it becomes increasingly obvious that his empirical findings are more compelling than his explanation of them. In fact, Piketty tries too hard to distance himself from Marx, whose theories seem to fit better with the data and their social implications than Piketty is willing to admit. An actual theory that penetrates the mechanisms creating inequality—i.e., a true theory of capitalism in the twenty-first century—is precisely what Piketty's book lacks.""

http://newpol.org/content/mapping-new-oligarchy","Mapping the New Oligarchy, by Michael J. Thompson, New Politics",link,http://newpol.org/content/mapping-new-oligarchy,2015-06-24 17:00:01,3,0,4,3,0,0,0,0,0
208799592506432_835744303145288,"Podemos can still change Spain for the better. But it won't do so by chasing the political center.

http://newpol.org/content/future-podemos","The Future of Podemos, Isidro López, Emmanuel Rodríguez, &Pablo Carmona , New Politics",link,http://newpol.org/content/future-podemos,2015-06-23 17:00:01,0,0,1,0,0,0,0,0,0
208799592506432_835580276495024,"""A quarter century has passed since the June Fourth Massacre that took place in Beijing, China's capital, near the end of the last century. But the truth of this tragedy has to this day not been laid bare to the world, and the massacre victims, who have still not received justice, cannot rest in peace. This is a disgrace for the whole Chinese people, and a disgrace for all of civilized humanity!""

http://newpol.org/content/tiananmen-mothers-urge-leaders-take-historical-responsibility-june-fourth","Tiananmen Mothers Urge Leaders to Take Historical Responsibility for June Fourth, by Tienanmien...",link,http://newpol.org/content/tiananmen-mothers-urge-leaders-take-historical-responsibility-june-fourth,2015-06-22 17:00:01,0,0,0,0,0,0,0,0,0
208799592506432_833891946663857,"An interview with Joseph Daher, writer and editor of Syria Freedom Forever, [https://syriafreedomforever.wordpress.com/], a blog dedicated to the struggle of the Syrian people in their uprising to overthrow the Assad authoritarian regime and to build a democratic, secular, socialist, anti-imperialist, and pro-resistance Syria.

""...by saying it is all simply a conflict between ISIS and Assad, one ignores the popular movement that has been ongoing for the past three years despite the fact that the movement was undermined first by the regime and then by Islamic reactionary forces. However, this popular movement is not only still alive but it is still playing an important role. Members of this movement were the original actors of the revolution and are still upholding the objectives of the revolution.""

http://newpol.org/content/revolution-reaction-%E2%80%A8and-intervention-syria",Syria Freedom Forever - سوريا الحرية للأبد,link,https://syriafreedomforever.wordpress.com/,2015-06-21 12:00:01,2,0,1,2,0,0,0,0,0
208799592506432_832063810180004,"Be sure to visit the New Politics blog (www.newpol.org) for a vigorous debate on Bernie Sanders' campaign for president.

""Despite his relatively low poll numbers at the moment, Bernie Sanders' bid for the Democratic presidential nomination is catching fire and will undoubtedly attract a great many more supporters in the months to come. For radicals, and especially for socialists in the ""third camp"" tradition (so called from the time of the Cold War, when our tendency stood for revolutionary opposition to both camps) this poses a challenge. As longtime advocates of independent political action, how should we relate to Sanders and his supporters?""

http://newpol.org/content/sanders-and-independent-politics","Sanders and Independent Politics, by Thomas Harrison, New Politics",link,http://newpol.org/content/sanders-and-independent-politics,2015-06-20 11:00:00,2,0,4,2,0,0,0,0,0
208799592506432_831959220190463,"Be sure to visit the New Politics blog (www.newpol.org) for a vigorous debate on Bernie Sanders' campaign for president.

""When I was there in 1980 I met Bernie, who was just then in the process of disengaging himself from Liberty Union. Bernie was a great fan of Debs and I have a memory of him working on something to do with Debs, perhaps a collection of his speeches.

Bernie was determined to enter the arena of ""serious politics"" (which, even at the most generous, was not where Liberty Union was going). In 1981 he was elected Mayor of Burlington. After several terms he went on to run for Vermont's one Congressional seat. He lost the first time, by a narrow margin, and was chided by In These Times for not having entered the Democratic Party primary.""

http://newpol.org/content/bernie-sanders-ive-known-him","Bernie Sanders as I've Known Him, by David McReynolds, New Politics",link,http://newpol.org/content/bernie-sanders-ive-known-him,2015-06-19 17:00:01,1,0,0,1,0,0,0,0,0
208799592506432_831960173523701,"""The ""Russian question,"" that is, the question of the nature of the Soviet Union, dominated much of Marxist debate throughout the twentieth century as first anarchists and Leninists, and later Trotskyists and Stalinists, and then Maoists argued about the economic, social, and political character of Soviet Russia (and then also of Eastern Europe, China, Cuba, Vietnam, and North Korea). 

...Now Ruslan Dzarasov, a senior research fellow at the Central Institute of Economics and Mathematics of the Russian Academy of Sciences, offers us an important and much-needed Marxist study of contemporary capitalist Russia in which he poses some of those same sorts of big questions.""

http://newpol.org/content/new-%E2%80%9Crussian-question%E2%80%9D-twenty-first-century","The New ""Russian Question"" of the Twenty-First Century, by Dan La Botz, New Politics",link,http://newpol.org/content/new-%E2%80%9Crussian-question%E2%80%9D-twenty-first-century,2015-06-18 20:00:01,1,0,1,1,0,0,0,0,0
208799592506432_831959013523817,"Howie Hawkins, activist and Green Party candidate for Governor of New York in 2014, discusses the Sanders campaign. 

Be sure to visit the New Politics blog (www.newpol.org) for a vigorous debate on Bernie Sanders' campaign for president.

""Bernie Sanders' entry into the Democratic presidential primaries should be seen as his final decisive step away from the democratic socialism he professes to support. He will raise some progressive demands in the primaries and then endorse the corporate Democrat, Hillary Clinton. Nothing changes.""

http://newpol.org/content/bernie-sanders-no-eugene-debs","Bernie Sanders is no Eugene Debs, by Howie Hawkins, New Politics",link,http://newpol.org/content/bernie-sanders-no-eugene-debs,2015-06-18 17:00:01,1,0,1,1,0,0,0,0,0
208799592506432_831959943523724,"""This pivotal moment presents the socialist and social democratic left with possibilities and pitfalls. With a less-fevered crime discussion, now might be the best time to adequately address the harms that crime visits on our communities. Obviously, stopping crime is important, but we must situate it as one harm among many. There are preventative responses to crime that are likely cheaper than our current criminal justice response, that will avoid the human consequences of mass incarceration, and that will bolster a traditional social democratic agenda.""

http://newpol.org/content/crime-incarceration-and-left","Crime, Incarceration, and the Left, by Brenden Beck, New Politics",link,http://newpol.org/content/crime-incarceration-and-left,2015-06-17 17:00:00,0,0,0,0,0,0,0,0,0
208799592506432_831957723523946,"Be sure to visit the New Politics blog (www.newpol.org) for a vigorous debate on Bernie Sanders' campaign for president.

""When I first met Brooklyn-born Bernie Sanders, he was a pretty marginal figure in his adopted state of Vermont. It was 1976 and he was running, unsuccessfully and for the fourth time, as a candidate of the Liberty Union Party (LUP).""

http://newpol.org/content/campaigning-bernie-then-and-now-why-labor-should-give-sanders-strong-primary-election-suppor","Campaigning With Bernie, Then and Now: Why Labor Should Give Sanders Strong Primary Election...",link,http://newpol.org/content/campaigning-bernie-then-and-now-why-labor-should-give-sanders-strong-primary-election-suppor,2015-06-17 10:30:01,0,0,1,0,0,0,0,0,0
208799592506432_831958016857250,"Be sure to visit the New Politics blog (www.newpol.org) for a vigorous debate on Bernie Sanders' campaign for president.

""I appreciate the nonsectarian tone of the piece on Bernie Sanders' presidential campaign by my longtime fellow New Politics editorial board member and friend Barry Finger. I think he has a better, more sophisticated understanding of the peculiarities of the Democratic Party (DP) and the U.S. electoral system than do many on the radical left that refuse to support any DP candidate regardless of that candidate's personal political platform. However, I think that Barry still suffers from certain misunderstandings regarding just how different the big two U.S. political parties are from political parties that exist anywhere else in the world, and this means there are defects in his suggestions as to how left-wing socialists should relate to the Sanders campaign.""

http://newpol.org/content/sanders-campaign-and-democratic-%E2%80%9Cparty%E2%80%9D","The Sanders Campaign and the Democratic ""Party"", by Jason Schulman, New Politics",link,http://newpol.org/content/sanders-campaign-and-democratic-%E2%80%9Cparty%E2%80%9D,2015-06-16 16:00:00,0,1,1,0,0,0,0,0,0
208799592506432_831957270190658,"Be sure to visit the New Politics blog (www.newpol.org) for a vigorous debate on Bernie Sanders' campaign for president.

""As proponents of independent political action, we believe that the Democratic Party is a deathtrap for progressives and that history has demonstrated time and again that progressive movements immersed in the DP are stripped of their potential political power. Nevertheless, we cannot judge the potential of the Sanders' movement solely by our attitude towards the Democratic Party, any more than we can evaluate the Democratic Party by the enormous potential contribution an unshackled Sanders movement may yet contribute to fundamental political change.""

http://newpol.org/content/further-reflections-sanders-campaign","Further Reflections on the Sanders Campaign, by Barry Finger, New Politics",link,http://newpol.org/content/further-reflections-sanders-campaign,2015-06-16 10:30:00,2,0,0,2,0,0,0,0,0
208799592506432_831959760190409,"""For the U.S. left—social democrats and democratic socialists alike—crime could neither be ignored nor treated as a political afterthought. Quite the contrary: Its emotional valence from the 1980s through the present may have been a sine qua non for conservative hegemony taking persistent hold, including through the allegedly progressive but ironically ""tough on crime"" Clinton years, when the 1994 Violent Crime Control and Law Enforcement Act became the largest crime bill in American history, authorizing the hiring of 100,000 police officers and setting aside $9.7 billion for prison building in its name. Crime and the left should have become symbiotically integrated both in theory and activism—but did that happen?""

http://newpol.org/content/rethinking-left%E2%80%99s-approach-%E2%80%A8to-crime","Rethinking the Left's Approach to Crime, by Lynn Chancer, New Politics",link,http://newpol.org/content/rethinking-left%E2%80%99s-approach-%E2%80%A8to-crime,2015-06-15 16:00:01,0,0,1,0,0,0,0,0,0
208799592506432_831956596857392,"""Any discussion of this subject needs to be based on the understanding that, at present, voting is carefully designed to, in Chomsky's words ""reduce the population to apathy and obedience"", putting us in a position where we are forced to demonstrate our fealty to the corporate state by actively endorsing one of its two anointed representatives.

It doesn't have to be that way...""

http://newpol.org/content/electoral-guide-2016","Electoral Guide 2016, by John Halle, New Politics",link,http://newpol.org/content/electoral-guide-2016,2015-06-15 10:30:01,2,0,1,2,0,0,0,0,0
208799592506432_832214096831642,"""Despite widespread dImageisillusionment with the political system, an organized attempt to prevent the election from taking place in a few states, and continuing economic doldrums, President Enrique Peña Nieto and his Institutional Revolutionary Party (PRI) were the big winners in the Mexican election, followed by the conservative National Action Party (PAN). Both parties are committed to continuing the deepening of the country's neoliberal, free market economic reforms.""

http://newpol.org/content/mexican-president-and-his-party-victorious-election-left-divided-and-defeated","Mexican President and his Party Victorious in Election; Left Divided and Defeated, by Dan La...",link,http://newpol.org/content/mexican-president-and-his-party-victorious-election-left-divided-and-defeated,2015-06-15 08:00:00,0,0,1,0,0,0,0,0,0
208799592506432_831959480190437,"""More than 800 migrants died on April 19 this year when their overcrowded boat capsized in the Mediterranean Sea off the Libyan coast. The tragedy sent soaring this year's Mediterranean death toll which was by then around 1,500 – 10 times the deaths during the same period last year.

Things are bound to get worse before getting better...""

http://newpol.org/content/eu%E2%80%99s-military-strategy-deepen-mediterranean-tragedies","EU's Military Strategy to Deepen Mediterranean Tragedies, by Nizar Visram, New Politics",link,http://newpol.org/content/eu%E2%80%99s-military-strategy-deepen-mediterranean-tragedies,2015-06-14 16:00:01,0,0,1,0,0,0,0,0,0
208799592506432_831954726857579,"Yassin Al Haj Saleh is one of Syria's leading political dissidents. He spent from 1980-1996 in Syrian prisons and became one of the key intellectual voices of the 2011 Syrian uprising. He spent 21 months in hiding within Syria, eventually escaping to Istanbul. He was interviewed via email by New Politics co-editor Stephen R. Shalom in early November 2014.

http://newpol.org/content/syria-and-left","Syria and the Left, by Yassin Al-Haq Saleh, New Politics",link,http://newpol.org/content/syria-and-left,2015-06-14 10:30:00,3,1,3,3,0,0,0,0,0
208799592506432_831947176858334,"Dan La Botz takes on David Bromwich's critique of the Obama presidency, from a socialist perspective.

""The problem with Bromwich's article is that it fails to recognize that weakness and lack of courage are also political choices. While it may be true that Obama preferred to talk rather than to lead political fights, organize and administer government, or follow through on his various proposals, still he chose those to whom he deferred. But Obama made the choice to place Larry Summers in charge of his economic program and to make Timothy F. Geithner and then Jacob J. Lew of Citigroup Secretaries of the Treasure. Obama made the choice to keep on Bush's Secretary of Defense Robert M. Gates; his three other appointees Leon Panetta, Chuck Hagel, and Ashton Carter were, of course part of the military-industrial establishment. That is Obama made the choice to turn over government to the banks, the corporations, and the military establishment that have historically formed the Deep State.""

http://newpol.org/content/what-went-wrong-and-why","What Went Wrong--and Why, by Dan La Botz, New Politics",link,http://newpol.org/content/what-went-wrong-and-why,2015-06-13 23:29:51,8,0,5,8,0,0,0,0,0
208799592506432_827446530641732,"I plan to attend this important demonstration of solidarity with Egyptian political prisoners and hope you will too. Let them know that we haven't forgotten them, that we stand with them against Al-Sisi's tyrannical regime.",Solidarity with Egyptian Political Prisoners,event,https://www.facebook.com/events/391294847728516/,2015-06-04 19:12:44,0,0,0,0,0,0,0,0,0
208799592506432_820770894642629,"Coming to a city near you! U.S. tour with Christos Giovanopoulos, founding member of Greece's Solidarity for All Movement: New York, Baltimore, Seattle, Chicago, San Francisco/Oakland.
.http://www.cpdweb.org/events/Greek-solidarity-tour.shtml",Campaign for Peace and Democracy,link,http://www.cpdweb.org/events/Greek-solidarity-tour.shtml,2015-05-21 12:12:15,0,0,1,0,0,0,0,0,0
208799592506432_820226734697045,"The secretary of the Central Committee of SYRIZA, calls for acts of social and political solidarity. From the organisation of rallies and awareness campaigns across Europe, to institutional initiatives in local, regional and national parliaments, and personal or collective statements of support to the efforts of Greece to swift the European paradigm of austerity.","Greece: 'Europe's moment of truth'; SYRIZA needs solidarity, says Tassos Koronakis | Links...",link,http://links.org.au/node/4432,2015-05-20 00:51:36,3,0,1,3,0,0,0,0,0
