status_id,status_message,link_name,status_type,status_link,status_published,num_reactions,num_comments,num_shares,num_likes,num_loves,num_wows,num_hahas,num_sads,num_angrys
217722751695604_837330099734863,It's disturbing that Hillary continues to associate with this war criminal.,Dirty War Files Show How Clinton Ally Kissinger Backed Regime of Terror,link,http://www.commondreams.org/news/2016/08/09/dirty-war-files-show-how-clinton-ally-kissinger-backed-regime-terror,2016-08-15 12:45:00,107,34,52,70,0,4,1,3,29
217722751695604_837329006401639,"""The NRA wants you to believe guns prevent domestic violence — the grim reality is that they make it deadlier.""",An Abuser's Best Weapon: The Murder of a Pa. Family Is a Reminder That Guns Are Too Easy to Get,link,http://www.alternet.org/civil-liberties/abusers-best-weapon-murder-wiped-out-pa-family-reminder-guns-are-too-easy-get,2016-08-15 10:05:00,178,13,63,128,0,1,0,28,21
217722751695604_837325213068685,"Here's a terrifying peek into a Trump operation. This definitely helps explain the chaos and mismanagement of his campaign.

Shudder to imagine this man anywhere near the White House.",I Survived 'Trump' Magazine—Barely,link,http://www.politico.com/magazine/story/2016/08/donald-trump-magazine-employee-confessional-bankrupt-2016-214155,2016-08-15 08:45:00,349,34,219,227,1,55,14,11,41
217722751695604_837333599734513,Yuuuup,Timeline Photos,photo,https://www.facebook.com/dailyprogressive/photos/a.817068685094338.1073741825.217722751695604/837333599734513/?type=3,2016-08-15 06:45:00,2690,132,1354,2278,46,31,271,39,25
217722751695604_837062516428288,"There's a crisis of hateful bullying and harassment in our schools because of Trump's racist, xenophobic, and Islamophobic rhetoric. 

We need to be talking about this more and holding the GOP responsible for the impact this is having on kids across the country.

Sickening.",Donald Trump Is Making America Meaner,link,http://www.nytimes.com/2016/08/14/opinion/sunday/donald-trump-is-making-america-meaner.html,2016-08-14 14:45:00,1090,109,484,758,4,12,2,156,158
217722751695604_836463973154809,"""The Missouri River gives drinking water to 10 million people. We are protecting everyone. We are standing for everyone.""","Lakota Lead Native Americans, Ranchers and Farmers in Fight Against Dakota Access Pipeline",link,http://www.truth-out.org/news/item/37222-lakota-lead-native-americans-ranchers-and-farmers-in-fight-against-dakota-access-pipeline,2016-08-14 12:45:00,732,28,244,644,58,5,0,8,17
217722751695604_836114153189791,"""Feeling like you missed the memo on all the ""new"" terms about transgender identities? This simple guide can help you catch up and learn what gender really means.""",Transgender 101: A Guide to Gender and Identity to Help You Keep Up with the Conversation,link,http://everydayfeminism.com/2016/08/transgender-101/,2016-08-14 10:45:00,34,1,17,33,1,0,0,0,0
217722751695604_836746089793264,"The hatred and Islamophobia stoked by Trump is now spilling over. 

A NY imam and his assistant were shot dead on the street, their murderer apparently feeling empowered to gun them down in broad daylight.

While we don't know all the details yet, the local Muslim community immediately identified Trump's climate of hatred as the context for this brazen killing.

This is why Trump must not only be defeated, but defeated in a landslide, showing a massive repudiation of his message of hatred, racism, and Islamophobia.","Queens imam, assistant fatally shot after leaving mosque",link,http://www.nydailynews.com/new-york/drive-by-shooter-queens-gravely-injures-men-article-1.2749901,2016-08-14 08:45:01,826,126,303,317,1,8,1,272,227
217722751695604_836748269793046,"Everyone knows this has nothing to do with 'election fraud', which has been proven repeatedly to be non-existent.

This is Trump unleashing his white supremacist followers to harass and intimidate voters of color. 

This is Trump again showing which parts of the 1950's he's trying to bring back to make America 'great' again.

This is shameful and should frankly be illegal - inciting voter intimidation and suppression. 

Let's defeat this man in November.","Warning of election fraud, Trump sparks fear that his backers may intimidate minority voters",link,http://www.rawstory.com/2016/08/warning-of-election-fraud-trump-sparks-fear-that-his-backers-may-intimidate-minority-voters/,2016-08-14 06:43:01,1122,348,626,647,5,44,27,30,369
217722751695604_836438176490722,"Here's the media finding new, creative, and patronizing ways to take the credit from a woman and give it to a man.",Timeline Photos,photo,https://www.facebook.com/dailyprogressive/photos/a.817068685094338.1073741825.217722751695604/836438176490722/?type=3,2016-08-13 17:45:01,148,16,19,115,4,6,0,3,20
217722751695604_836449376489602,"Here's why police officers have no place in our schools.

This six year old little girl took some candy off of a teacher's desk. 

Are you a parent? A grandparent? A decent human being with a pulse? What's on the list of appropriate responses to this?

Maybe asking her to put it back. Or sharing some with her. Or having a conversation about asking before taking something.

Not on the list? 

HANDCUFFING A LITTLE GIRL AND PUTTING HER ALONE UNDER SOME DARK STAIRS NEXT TO A BOILER FOR AN HOUR.

That's abuse, pure and simple. 

It's also racialized abuse, because we can be sure this never would have happened to a little white girl.

It's no accident that there are more police in schools with more people of color or that Black children are most likely to be targeted with severe and disproportionate responses.

This is part of America's long history of treating Black children as dangerous, immoral, or over-sexualized. Why else would they require literal policing?

But they're not - they're just kids. They don't need police with guns. They need caring, competent teachers and guidance counselors, like any child.

We need the police out of our schools now.",Outraged Mom Sues Chicago Public Schools Claiming 6-Year-Old Daughter Was Handcuffed for Taking Candy,link,http://www.theroot.com/articles/news/2016/08/outraged-mom-sues-chicago-public-schools-claiming-6-year-old-daughter-was-handcuffed-for-taking-candy/,2016-08-13 14:45:00,342,69,92,165,3,10,1,61,102
217722751695604_836114019856471,"""#8: ""What if you're wrong?"" Here are the answers to questions many people ask atheists – and why so many atheists might get ticked off if you ask them.""",9 Answers to Common Questions for Atheists – So You Don't Insult Us By Asking,link,http://everydayfeminism.com/2016/08/questions-atheists-find-insulting/,2016-08-13 12:45:00,47,7,27,41,2,4,0,0,0
217722751695604_836092203191986,"It's so bad that some of the private prisons are dealing with overcrowding by assigning new inmates to 'isolation units' i.e. solitary confinement. 

This isn't a complex issue. Making money off of locking people in cages should not be legal. The whole damn private prison industry needs to just be shut down now.",A damning federal report just confirmed our worst fears about private prisons,link,http://www.motherjones.com/politics/2016/08/department-justice-report-private-contract-prisons,2016-08-13 10:45:00,560,49,346,372,2,11,0,44,131
217722751695604_836089846525555,"""She is not, she reminded everyone, the next Michael Phelps. She is not the next Usain Bolt. She is the first Simone Biles.""",Simone Biles Also Wins at Media Criticism,link,http://www.theatlantic.com/entertainment/archive/2016/08/the-olympic-quote-that-should-be-heard-round-the-world/495653/?utm_source=feed,2016-08-13 08:45:00,2966,87,440,2613,328,20,3,1,1
217722751695604_836127589855114,"This is the kind of history everyone in America should learn about. 

It's such a perfect example of how white supremacy works in our country. 

We ban Black people from public pools and then spread racist put-downs that 'Black folks can't swim.'

We target Black men with massively disproportionate police harassment, arrests, convictions, and severity of sentencing, and then shake our heads about how 'absent' Black fathers are.

We institute slavery and then an official apartheid system separating white communities from Black communities through segregation, red-lining, white flight, and more. Then we deflect every conversation about racism by talking about 'Black on Black' crime (ignoring the fact that most white crime is 'white on white', b/c our whole damn country is still so segregated).

We subject Black people to daily racism and violence on a continuum from micro-aggressions to police murders, and when there is a simple human response to any of it, we say 'another angry Black woman', 'violence doesn't solve anything', 'are you going to forgive them?', as if there was no blood on our hands.

Thank you to Isabel Wilkerson for putting up a mirror to our ugly past so we can better understand how far we still have to go.",Isabel Wilkerson,photo,https://www.facebook.com/IsabelWilkersonWriter/photos/a.177309328965233.45547.140162739346559/1370940322935455/?type=3,2016-08-12 21:49:58,1556,44,0,1330,153,8,1,53,11
217722751695604_835869026547637,"Simone Manuel just made history. But NBC apparently didn't think anyone cared enough to air it live.

#sinceNBCdidntairit","NBC Ignored Simone Manuel's Historic Medal Ceremony, Fans Clapped Back",link,https://www.colorlines.com/articles/nbc-ignored-simone-manuels-historic-medal-ceremony-fans-clapped-back,2016-08-12 12:45:40,2074,338,681,1394,58,52,2,206,362
217722751695604_835643663236840,"This has got to stop. It's an outrage that this is happening in this administration.

Why do you think Obama has supported these policies? Worried about critiques from the Right?",The Obama administration is still targeting the immigrants it said it wouldn't target,link,http://www.motherjones.com/politics/2016/08/ice-immigration-enforcement-criminals-obama,2016-08-12 10:45:00,33,17,6,17,0,0,0,6,10
217722751695604_835642746570265,"""As Trump has shown, anti-Semitism and anti-Black racism are hardly discrete phenomena, often finding voice in the same rallies, far-right political parties and corners of the internet. Nor can anti-Black racism be fully separated from our violence abroad: police and military have proven themselves capable of a kind of intersectional and wide-ranging oppression, unleashing some of the same tactics in Palestine as they do in the U.S. 

Debates over language aside, it's unlikely that young organizers are going to let being progressive on racial justice and on Palestine stay separate for much longer.""",Black Lives Matter Is Showing Why Progressive Jews Must Support Palestinian Justice,link,http://inthesetimes.com/article/19381/black-activists-support-of-palestine-spurs-controversy-within-the-jewish-co/,2016-08-12 08:44:00,57,7,20,51,2,2,0,1,1
217722751695604_835062316628308,"This is a major disappointment.

It will continue the egregious injustice of some (primarily white) people making millions off pot, while millions of other (primarily Black and Brown) people serve years in prison for doing the *exact same thing*.

What do you think? Should pot be legalized across the board?",Feds To Make Major Announcement On Marijuana Regulation,link,http://www.huffingtonpost.com/entry/marijuana-rescheduling-research_us_57abd010e4b0db3be07d34da?section,2016-08-11 10:45:00,330,88,100,242,1,1,0,28,58
217722751695604_835064589961414,"You know what we could do instead of creating these big reports?

Believe Black people. Value Black life. Hold cops accountable in the same way as if this was happening to white people.

Needing some external authority (often white) to verify and vouch for what people of color have been saying for decades is just another symptom of white supremacy in our country.

Let's hope this at least leads to some real changes. But until some cops are actually convicted of their crimes, we'll know little has changed.",How the Baltimore Police Abuse African Americans,link,http://www.theatlantic.com/news/archive/2016/08/the-horror-of-the-baltimore-police-department/495329/?utm_source=feed,2016-08-11 08:45:00,101,5,35,78,1,1,0,11,10
217722751695604_835067379961135,"""Much of the analysis of Trump's support was based on the fact that he did very well indeed among a particular group of white working-class voters early on: those who planned to vote in the GOP primary...

But one third of white working-class voters planning to vote in a GOP primary is not that many people.""

He's doing worse now among white working class voters than Romney did. And less and less white working class people are voting every year.

While this may bode well for this election, it points to the real danger of the potential rise of a demagogue who *can* energize these voters using the same message of fear and hate as Trump, but far more effectively.","The Great White Hype: No One Is Energizing the White Working Class, Not Even Donald Trump",link,https://theintercept.com/2016/08/10/the-great-white-hype-no-one-is-energizing-the-white-working-class-not-even-donald-trump/,2016-08-11 06:45:00,102,16,33,80,2,1,9,4,6
217722751695604_835045976629942,No lies detected here.,Timeline Photos,photo,https://www.facebook.com/dailyprogressive/photos/a.817068685094338.1073741825.217722751695604/835045976629942/?type=3,2016-08-10 20:21:14,823,12,618,691,13,7,74,13,25
217722751695604_834832046651335,"Here's some feel-good cop videos we would definitely share.

via Ijeoma Oluo",Timeline Photos,photo,https://www.facebook.com/dailyprogressive/photos/a.817068685094338.1073741825.217722751695604/834832046651335/?type=3,2016-08-10 14:45:00,74,3,32,66,8,0,0,0,0
217722751695604_834557256678814,"""""You can't go out like that!"" Do you have to wear a bra? Here are some of the body-shaming reasons people would say so – with some empowering alternative ideas.""",6 Body-Shaming Reasons People Tell You to Wear a Bra – And Why It's None of Their Business,link,http://everydayfeminism.com/2016/08/wearing-a-bra-personal-choice/,2016-08-10 12:47:00,49,7,21,48,0,0,1,0,0
217722751695604_834556113345595,"""In a lot of ways, free-range parenting makes sense to me. I grew up exploring my neighborhood and beyond, and would love to give my daughter that kind of freedom. Having the ability to walk to the grocery store, ride my bike miles away to a friend's house, and spend most of the day unsupervised gave me confidence in myself. 

But I don't give my daughter that same freedom, and I never have, because I fear the possible repercussions.""",Free-Range Parenting Is A Privilege For The White And Affluent - The Establishment,link,http://www.theestablishment.co/2016/08/09/free-range-parenting-is-a-privilege-for-the-white-and-affluent/,2016-08-10 10:42:00,58,15,18,45,0,0,0,13,0
217722751695604_834556436678896,"""This year, an estimated 45 percent of athletes competing in Rio are female—the highest-ever percentage in any Olympic Games. 

So why are we still treating them like odd women out? Here are the five most egregious displays of sexism we've seen in Rio (so far).""",Here's the most sexist shit we've seen at the Olympics so far,link,http://www.motherjones.com/politics/2016/08/sexism-olympics-katie-ledecky-is-amazeballs,2016-08-10 08:43:00,541,28,259,399,12,23,0,21,86
217722751695604_834572526677287,"Now that Trump's numbers are tanking, he's beginning to weave a new narrative about the election being 'rigged'. 

While part of this is his typical whining and finger-pointing when he's failing, there's a far more insidious effect this narrative will have if there's an eventual Clinton Presidency.",Donald Trump Is Already Setting Up His Next Con,link,https://www.thenation.com/article/donald-trump-is-already-setting-up-his-next-con/,2016-08-10 06:45:00,258,68,118,165,4,5,29,9,46
217722751695604_834528760014997,"Just when you thought there wasn't another line Trump would cross. 

We won't call it a joke, because it's not a joke. It was a threat and a dog whistle approval for violence. Like a gaslighting abuser or street harasser, Trump will try to play it off as a joke. But the media should not let him get away with it. 

We shared an article earlier about how Trump is the epitome of toxic masculinity. As almost all the mass shooters have shown, violence against women is one of the first knee-jerk responses of men like this. 

It's long past time for the GOP to utterly repudiate him. If making cloaked calls for the assassination of Clinton isn't enough, where else are they willing to follow him? Shudder to imagine.",Trump Denies Calling For the Assassination of Hillary Clinton,link,http://www.theatlantic.com/politics/archive/2016/08/not-what-the-second-amendment-is-for/495191/?utm_source=feed,2016-08-09 19:55:28,345,115,172,205,1,19,1,5,114
217722751695604_833400526794487,"""I stood silently, in awe. I don't know how to silence the part of me that is shocked every time my humanity is erased, no matter how many times it happens. I know what to expect, and still, I expect to be regarded with respect and decency. The reality I'd experienced seemed entirely possible in this country's climate and completely unfathomable, simultaneously.""",Stop Shaming My Anger About Racism – And Start Condemning the System,link,http://everydayfeminism.com/2016/08/start-condemning-the-system/,2016-08-09 10:45:00,388,11,112,349,15,4,0,6,14
217722751695604_834015723399634,"Yeah, we're about 35 years overdue for a massive tax hike for rich.

Despite what she said at the convention, does anyone believe Hillary will push for this if elected?",Is the U.S. Due for Radically Raising Taxes for the Rich?,link,http://www.theatlantic.com/business/archive/2016/08/is-america-due-for-a-tax-hike/494795/?utm_source=feed,2016-08-09 08:45:00,285,78,77,262,13,1,3,0,6
217722751695604_834006076733932,"He's been called the embodiment of an internet troll for a reason - Trump and his success are the epitome of toxic masculinity in a patriarchal culture.

We see it in the admiration of his bullying behavior by his supporters. We see it also in the incredible level of tolerance and respect afforded him by the media despite his utter incompetence.

It doesn't take much imagination to know how different the response would be if he were a woman or of color.",Trump Is a Climax of America's Masculinity Problem,link,http://www.theatlantic.com/health/archive/2016/08/trump-masculinity-problem/494582/?utm_source=feed,2016-08-09 06:44:01,286,41,115,235,3,3,20,4,21
217722751695604_834000690067804,"And how much death and human suffering? 

This gets to a basic fact that the US has not had a coherent strategy in our involvement in the Middle East since the 1970's. 

Between our wars, our aid to various authoritarian governments, and our massive no-strings-attached grants to Israel, our involvement has only made things worse for both the people in the Middle East as well as for our own strategic interests.",Timeline Photos,photo,https://www.facebook.com/dailyprogressive/photos/a.817068685094338.1073741825.217722751695604/834000690067804/?type=3,2016-08-08 20:38:34,371,55,377,262,0,5,2,36,66
217722751695604_833767316757808,"""This system is not an accident. This system is not broken. It is operating exactly how it was designed and intended to operate and is punishing the very people it was designed and intended to punish. A nation does not go from where we were to where we are, building jails and prisons at a breakneck pace, hiring hundreds of thousands of police officers and prison guards, on accident. We got here on purpose.""",KING: Communities of color are massively over-policed,link,http://www.nydailynews.com/news/national/communities-color-massively-over-policed-article-1.2741945,2016-08-08 14:45:00,46,5,24,33,0,0,0,3,10
217722751695604_832923103508896,"""Those days – 19 and under my parents' roof – I was so, so small.

Those days, the only words I knew how to say were, ""I'm sorry, I'm sorry, I'm sorry.""

They never tell you that being transgender can sometimes feel like a run-on string of apologies – I'm sorry for being here, I'm sorry for being this way, I'm sorry for disappointing you, I'm sorry for your expectations, and I'm sorry for mine.""",What They Don't Tell You About Being Transgender,link,http://everydayfeminism.com/2015/06/things-dont-tell-you-being-transgender/,2016-08-08 12:45:00,18,2,6,14,0,0,0,4,0
217722751695604_833769643424242,"This is why not having Bernie as an alternative is such a damn shame. 

#FalseSavior #WolfinSheepsClothing",How labor's decline opened door to Trump as the false 'savior' of American workers,link,http://www.rawstory.com/2016/08/how-labors-decline-opened-door-to-trump-as-the-false-savior-of-american-workers/,2016-08-08 10:55:00,95,14,32,77,1,1,1,10,5
217722751695604_833504846784055,"Black Lives Matter is calling for a wide range of changes, from greater education funding to the removal of police from schools to the closure of juvenile detention centers. 

In a move some are criticizing as being too cozy with teacher's unions which have sometimes stood in the way of needed reforms, they are also calling for a moratorium on charter schools.

What do you think?",The Ambitious Education Plan of the Black Lives Matter Movement,link,http://www.theatlantic.com/education/archive/2016/08/the-ambitious-education-plan-of-the-black-lives-matter-movement/494711/,2016-08-08 08:45:00,38,3,15,36,2,0,0,0,0
217722751695604_833506046783935,"""Anybody who has been in an abusive relationship will recognize this behavior. It's a raised hand that might be a slap but then lowers for a pat on the shoulder. It's a friendly warning that—this time—they aren't going to get really mad. A reminder that what you are experiencing right now isn't really abuse—you know what real abuse looks like.""",The Abuse Of 'Feel-Good' Cop Videos - The Establishment,link,http://www.theestablishment.co/2016/08/02/the-abuse-of-feel-good-cop-videos/,2016-08-08 06:45:00,39,4,30,33,0,1,0,3,2
217722751695604_833263213474885,"Dylann Roof was beat up and George Zimmerman got punched in the face all in the same week. 

Then the internet went and set up a fund for the guy who beat up Dylann Roof and helped get him out on bond.

Let's just say we've had worse weeks this year.",Man Who Beat Up Charleston Church Shooter Dylann Roof Is Out on Bond,link,http://www.theroot.com/articles/news/2016/08/man-who-beat-up-dylann-roof-is-out-on-bond/,2016-08-07 16:44:00,192,19,63,158,8,5,19,0,2
217722751695604_833257106808829,"Philippine President Duterte has called for any suspected drug users to be summarily killed by civilians or police. Since this horrific pronouncement, over 700 people have been murdered without any due process.

Meanwhile, US Secretary of State Kerry has just met with Duterte and promised $32 million in law enforcement support - without even mentioning the extrajudicial killings.

Though with all the extrajudicial killings by police here at home, maybe it's less of a surprise that the US government has no comment.",America's embarrassing silence: Why has the U.S. remained quiet on massacre of drug users in the Philippines?,link,http://www.salon.com/2016/08/07/americas-embarrassing-silence-why-has-the-u-s-remained-quiet-on-massacre-of-drug-users-in-the-philippines_partner/,2016-08-07 14:45:00,58,8,47,32,0,12,1,3,10
217722751695604_833258856808654,"""Today is Day 17 of occupying Freedom Square, a block party protest in opposition to Homan Square, the Chicago Police Department (CPD) ""black site"" that is internationally infamous for illegal detention and torture...

Freedom Square is overwhelmingly beautiful in its aspirational politics, but it is not perfect. It's messy, it's tiring, and in waves of oppressive heat, it takes a lot of self-awareness and patience to keep moment-to-moment frustrations in check. 

The ideology of imagining a world without police powerfully resounds in media clips, on protest signs, and in the air-conditioned comfort of organizing meetings; but at Freedom Square, activists and North Lawndale neighbors live, sleep, and labor side by side in 24-hour service to a community healing from decades of generational trauma, social divestment, and internalized violence.""","At Freedom Square, the Revolution Lives in Brave Relationships",link,http://www.truth-out.org/opinion/item/37132-at-freedom-square-the-revolution-lives-in-brave-relationships,2016-08-07 12:45:00,22,1,22,20,2,0,0,0,0
217722751695604_832917160176157,"""Standing up for all of these rights does not make you unreasonable, demanding, or too picky – and anyone who tells you differently has probably internalized some pretty crappy messages about what women are worth.

The truth is, you deserve all these things as a bare minimum in your relationship.""",12 Personal Rights Women Have in Intimate Relationships,link,http://everydayfeminism.com/2016/04/womens-rights-relationships/,2016-08-07 10:45:00,83,1,54,73,10,0,0,0,0
217722751695604_832864106848129,"Chomsky offers a 8-point argument for voting for the 'lesser of two evils' this election.

What do you think?",Noam Chomsky's 8-Point Rationale for Voting for the Lesser Evil Presidential Candidate,link,http://www.alternet.org/election-2016/noam-chomskys-8-point-rationale-voting-lesser-evil-presidential-candidate,2016-08-06 19:40:05,185,37,101,169,8,0,1,0,7
217722751695604_832676236866916,Ever had people tell you that the singular use of 'They' is grammatically incorrect? Here's why they're oh-so wrong.,Why Singular 'They' Pronouns Make Perfect Sense – Even If You're a Grammar Purist,link,http://everydayfeminism.com/2016/08/singular-they-grammatically-correct/,2016-08-06 12:41:00,21,1,7,18,0,2,1,0,0
