status_id,status_message,link_name,status_type,status_link,status_published,num_reactions,num_comments,num_shares,num_likes,num_loves,num_wows,num_hahas,num_sads,num_angrys
217722751695604_878701945597678,"Renee Davis is the latest victim of police violence.

A Native woman who was five months pregnant, she was shot by police while on tribal land.

She was twice as likely to be targeted as she was both Native and suffered from mental illness. 

Native people are the only group killed at an even higher rate by police than Black people.

#RestinPower #NativeLivesMatter #ReneeDavis",Pregnant Washington woman shot and killed by deputies during 'wellness check' on tribal land,link,http://buff.ly/2ezfBEL,2016-10-24 06:45:13,2053,132,1389,401,3,40,0,726,883
217722751695604_878220375645835,"SNL's Third Debate Cold Open sketch was really good this week, but this one was even better.

This sketch pointed to something that needs to be a much bigger focus in progressive politics - that poor whites and Black Americans have far more shared political and economic interests than voting patterns would suggest.

The shared political interests of poor whites and Black Americans are of course why wealthy white people have used race to divide them ever since the days of slavery.

That's why while it's easy for progressives to judge many of Trump's supporters as racist and then dismiss them, or mock them as 'white trash' (a classist attack that also alienates them from the left), this is the exact opposite of what we need to be doing.

We need to be following the example of Fred Hampton of the Black Panthers who before his death tried to build bridges to radicalize poor white and rural communities.

Because when we dismiss and don't reach out to Trump supporters, FOXNews and the GOP media apparatus will, with all their racist and misogynist messaging and values.

In the end, the progressive tent needs to be a lot bigger. 

Big enough so that someday the only people left standing on the outside are billionaires and bigots. And hopefully we can work to shrink the latter smaller by the day.","Tom Hanks ""Black Jeopardy"" sketch on 'SNL' has big things to say about race",link,https://mic.com/articles/157438/tom-hanks-black-jeopardy-sketch-on-snl-has-big-things-to-say-about-race,2016-10-23 14:36:39,2391,65,984,1864,160,14,352,1,0
217722751695604_878222232312316,#BernieBurn #GodWeMissYou,Timeline Photos,photo,https://www.facebook.com/dailyprogressive/photos/a.817068685094338.1073741825.217722751695604/878222232312316/?type=3,2016-10-23 12:25:01,14052,554,4037,11867,1129,49,997,1,9
217722751695604_878204568980749,"I mean, who doesn't love a good underdog story?!?",Timeline Photos,photo,https://www.facebook.com/dailyprogressive/photos/a.817068685094338.1073741825.217722751695604/878204568980749/?type=3,2016-10-23 10:58:45,1568,28,840,1088,19,24,381,24,32
217722751695604_878092308991975,"Over 80 Water Protectors were arrested on Saturday while protesting the Dakota Access Pipeline.

The police were mobilized with military gear against the unarmed people and many people were pepper sprayed.

Here are some powerful photos from Rob Wilson Photography from yesterday.

It's sickening that the response of the US government is still to send out the troops when Native peoples are simply asserting their right to live.

#NoDAPL #NoDakotaAccess",Photos from Daily Progressive's post,photo,https://www.facebook.com/dailyprogressive/photos/a.817068685094338.1073741825.217722751695604/878090585658814/?type=3,2016-10-23 07:23:34,2668,208,1640,1467,22,27,0,375,777
217722751695604_877652259035980,"""As black immigrant families increasingly recognize and experience police violence, it's important that racial justice and immigrants' rights advocates begin to address the intersectional impact of mass criminalization. 

To put it simply, mass criminalization is an immigration issue and detention and deportation are black issues.""",What the Shooting of Alfred Olango Says About the State of Black Refugees in the U.S.,link,http://buff.ly/2esFFA2,2016-10-22 14:45:13,64,0,15,32,0,0,0,22,10
217722751695604_877605885707284,"""At least 22 transgender people have been killed so far this year, matching the previous recorded high in all of 2015, according to the National Coalition of Anti-Violence Programs (NCAVP). Eighteen of those killed this year have been black or Latina, up from 13 in all of last year.""",'Walking While Trans' Can Be A Death Sentence In The U.S.,link,http://buff.ly/2eQyRjP,2016-10-22 12:45:02,280,17,101,72,1,7,0,118,82
217722751695604_877536299047576,"Professor Michelle Alexander, author of the bestselling book The New Jim Crow, thinks Americans have grown complacent with systemic injustice through the myths of colorblindness, a bootstraps work ethic, and overly simplistic solutions to reforming the criminal justice system.

In this video with @OfficialSrslyTV, she calls bullsh*t on the ideas that legalizing weed will set us free, Martin Luther King Jr. was a law abiding citizen, protest is ineffective, and more.",Shutting Down Bulls!*t with Michelle Alexander - YouTube,video,http://buff.ly/2eQEWwx,2016-10-22 10:45:12,18,0,6,18,0,0,0,0,0
217722751695604_877469255720947,"A map showing the election breakdown by gender has been getting a lot of traction, mainly because it shows that it's women who are ensuring the election isn't going to the walking dumpster fire that's Trump.

BUT, the reality is that the divide is less about gender and more about what has always been the primary driver of American politics: race.

Yes, if only white men voted, Trump would overwhelmingly win. 

But if only white women voted, then Trump would *also* win.

Let that sink in for a moment - even with all the misogynist and sexually predatory behavior Trump has shown, a majority of white women would vote in alignment with their racial identity over their interests as women.

The same thing is true around college-educated vs. non-college educated white people. 

Despite the comforting image of Trump supporters as poor and uneducated white people, the majority of college-educated white people would also vote in Trump.

So who do we really have to thank from saving us from a precipitous slide into neo-fascism? 

Women of color. 

Another chilling takeaway from this map is the obvious next question, why aren't the votes of men of color off-setting the male vote like with women? Is it because more men of color are voting for Trump? 

Probably not.

While this map doesn't break it down, the reason almost certainly lies more with the widespread disenfranchisement of Black and Brown men, who after being massively disproportionately targeted by the criminal justice system then have their vote taken away from them for life. Just one of the many aspects of race and politics that hasn't changed much in America.

Source: https://www.facebook.com/ste.kinney",Timeline Photos,photo,https://www.facebook.com/dailyprogressive/photos/a.817068685094338.1073741825.217722751695604/877469255720947/?type=3,2016-10-22 09:04:50,147,60,93,90,1,31,4,20,1
217722751695604_877066872427852,"'As Elizabeth Warren said in a speech recently, competition is dying—and the accompanying consolidation in sector after sector is a threat to our democracy.

Beyond the corporate quest for market dominance, there is another reason these mergers keep coming at everyone else's expense: the deals make big money for the powerful banks that wield enormous power over our democracy. One such bank is Credit Suisse.'","Three Massive Mergers—Millions for Credit Suisse and a Disaster for Food, Water, and Climate",link,http://buff.ly/2dEkEnl,2016-10-21 16:45:02,299,17,182,147,2,5,0,38,107
217722751695604_877017482432791,"""If you're anything like me, then you go to your nearest Halloween store and innocently pick out a costume, never with the foul intention of hurting anyone.

But regardless of whether your costume selection was done with innocent intentions or not, your costume can still perpetuate harmful stereotypes and stigmas, which then welcomes more aggressive racist attitudes.

That is: Even if you don't think you're vehemently racist, you can still perpetuate racism.""",Is Your Halloween Costume Racist?,link,http://buff.ly/2dEqrcx,2016-10-21 14:45:08,41,27,30,29,1,2,3,2,4
217722751695604_876967515771121,"""The scaremongering about the debt masks an ideological agenda to stop any federal programs that commit the mortal sin of helping people, because the country sits on the precipice of becoming a Weimar Germany hyperinflation failed state. If rolling back those programs means preventing tax increases on rich people like Pete Peterson and his progeny, all the better.

Back on planet Earth, inflation hasn't hit the Federal Reserve's skinny 2 percent target in four years, and the real scandal is that America is blowing a huge opportunity to borrow at historically low interest rates and fulfill public needs. Experts across the political spectrum agree that the deficit is not a problem right now.""",Debate Moderators Under the Spell of Deficit-Obsessed Billionaire Pete Peterson,link,http://buff.ly/2eyTYmP,2016-10-21 12:45:16,127,5,62,86,4,3,1,0,33
217722751695604_876911489110057,"In the great American tradition of mobilizing federal law enforcement to monitor and harass civil rights movements, the FBI and Homeland Security has been surveilling Black Lives Matters activists back since the Michael Brown protests.

They did it to MLK and other civl rights leadership in the 1950's and 60's, even blackmailing him and threatening to expose his affairs.

They did it to the Black Panther Party, infiltrating them to such an extent that it became almost impossible for them to operate without assuming informants were in their midst.

And now they are doing it to BLM activists. 

If we can make a suggestion - how about they focus instead on all the white supremacist groups actually inciting and committing violence against Americans? 

Scary to think that if this is happening under the Obama administration, what would be happening under a Trump administration?

#secretpolice #disappearances #domesticrenditions","FBI, Homeland Security sued for records on surveillance of Black Lives Matter activists",link,http://buff.ly/2dSFCN4,2016-10-21 10:45:03,374,26,160,253,4,12,0,25,80
217722751695604_876839535783919,"Trump's use of 'the' before African Americans and Latinos is part of the larger arsenal of racist dog-whistles used by the Right.

Some other favorites?

'Entitlements': Always meant to imply 'giveaways' of hard-earned tax dollars (of course from hard-working white Americans) to undeserving and unemployed people of color, despite the fact that most recipients of programs like food stamps and Medicaid are white. This narrative has been central to turning poor and middle-class white Americans against New Deal/Great Society government programs (even though they disproportionately help poor and middle-class white Americans).

'Inner Cities': Always portrayed as violent hellscapes populated by Black and Brown people, with the unspoken implication that this is why we need 'law and order' to control them. The focus on lack of education and violence is a dog-whistle suggestion of savagery in contrast with the implied civilization of white communities.

'Race Relations': This isn't often thought of as a dog-whistle, but it should be. The term 'race relations' implies that the fault for the issue is somehow equally shared. That maybe half of the problem is Black and Brown people needing to get along better with white people. Not to put too fine a point on it, but this is bullshit. We have a problem, but it's not 'race relations'. It's the two hundred year old history and present reality of racism and white supremacy.

What are other dog-whistles used by the Right (and, yes, the Left)?","Why Donald Trump says ""the"" before ""African Americans"" and ""Latinos""",link,http://buff.ly/2eniWtn,2016-10-21 08:45:06,1006,71,809,602,8,70,6,34,286
217722751695604_876765165791356,"'On Friday, the Federal Bureau of Investigation announced that it had arrested three white men, Curtis Allen, Gavin Wright and Patrick Stein, who as part of a militia group called the Crusaders planned to bomb a housing complex and mosque in Garden City, Kansas...

White privilege also deems that certain questions will not be asked about the Crusaders and its nefarious plans to kill Somali immigrants in Garden City, Kansas.

What are people like Allen, Wright and Stein learning in their churches and other places of worship? Are the FBI and the Department of Homeland Security monitoring those sites?

Who radicalized Allen, Wright and Stein?

What role does Fox News, the Republican Party and the right-wing media play in teaching white Christians like Allen, Wright and Stein to hate Muslims?

Where were Allen, Wright and Stein's family members and neighbors? Are they aiding and abetting them? Why didn't they call the police earlier?

Given that 2016 Republican presidential nominee Donald Trump is openly hostile toward Muslims, should he be held responsible for encouraging violence and terrorism against that community?'",White Privilege Wages Jihad: Kansas 'Militia Members' Aren't Considered 'Terrorists' Because They're Not Muslim,link,http://buff.ly/2ex3fKW,2016-10-21 06:54:19,2242,350,1804,973,13,96,2,242,916
217722751695604_876334099167796,"""Letting those who would discriminate do so is an anti-LGBT argument repurposed from the state-by-state marriage equality, and it's one that, by design, ignores the actual harms of discrimination. The whole reason the federal government took a stance is because schools were repeatedly treating trans students like lepers who deserved to be ostracized. 

Allowing that to continue only maintains the status quo of stigma against transgender people.""",The New York Times just provided a massive platform for transphobia,link,http://buff.ly/2elSVuC,2016-10-20 16:45:02,49,4,17,34,0,1,0,14,0
217722751695604_876288645839008,"""But [Avik Roy] also believes the Republican Party has lost its right to govern, because it is driven by white nationalism rather than a true commitment to equality for all Americans.

'Until the conservative movement can stand up and live by that principle, it will not have the moral authority to lead the country,' he told me.""",A Republican intellectual explains why the Republican Party is going to die,link,http://buff.ly/2elU1WY,2016-10-20 14:45:02,3508,220,2013,2948,165,217,103,46,29
217722751695604_876221125845760,"(Content Note: police violence)

An NYPD officer shot and killed a 66-year old Black woman who had a mental illness.

Just this summer she had tweeted that she felt like she had a target on her back just because she is Black.

The officer had a stun gun, but decided to use lethal force instead.

Even city officials are coming out in condemnation of the shooting:

""New York City Mayor Bill de Blasio addressed the shooting at a news conference Wednesday, saying, ""Deborah Danner should be alive right now, period. If the protocols had been followed, she would be alive. It's as simple as that.""

Police Commissioner James O'Neill echoed the mayor's sentiment, saying that it looked as if some of the procedures for handling ""emotionally disturbed people"" were not followed.

""That's not how it's supposed to go,"" he said. ""It's not how we train; our first obligation is to preserve life, not to take a life when it can be avoided.

""We do have policies and procedures for handling emotionally disturbed people, and it looks like that some of those procedures weren't followed,"" O'Neill added. ""What is clear in this one instance is we failed.""

But are these just words or will anybody actually pay the price for this police killing?

#deborahdanner #BlackLivesMatter #NYPD",NYC Police Officer Kills 66-Year-Old Mentally Ill Black Woman,link,http://buff.ly/2euqrtu,2016-10-20 12:45:02,414,47,156,66,1,7,0,150,190
217722751695604_876164955851377,"""Note that Trump didn't simply say, ""that's unfair,"" or maybe even, ""that's nasty."" It was important to label Hillary Clinton, the person, in a gendered way. His opponent is not merely ""nasty;"" his opponent is ""a nasty woman,"" something far more horrifying.

Because, in his estimation, women are supposed to always be nice to Trump. It's their duty, and his right to expect. 

Grab 'em by the pussy, and expect them to be nice. Walk in on the dressing rooms of women-not-your-wife, and expect them to be nice. Tell a radio shock jock that it's O.K. to call your daughter ""a great piece of ass,"" and expect her to be nice. 

It's his birthright, after all, to have all women, everywhere, be nice to him, regardless what he says or does to them. Surely, all of the women in his life are—but they all report to him, in one way or another.""","Call Me a Nasty Woman, Thank You Very Much",link,http://buff.ly/2e9QcSX,2016-10-20 10:45:26,1094,143,401,790,51,21,40,9,183
217722751695604_876120565855816,"When Black athletes like Kaepernick conduct a nonviolent protest, they get death threats for being 'unpatriotic'.

But when white nationalists stockpile arms against the government, conduct an armed takeover of government property, and then run a candidate who hints at domestic insurrection, they're somehow not labeled as traitors to our country.

Here's the reality.

The last time a party refused to accept the results of a US election was in *1860* - and that party went on to form the core of the Confederacy, fighting for the preservation of white supremacy.

Despite fig leaf attempts at having 'conservative ideology', the GOP has devolved today into simply being the party of white nationalism.

And Trump is doing his damnedest to push that to its logical extreme, stoking and harnessing white fear without regard to the consequences.

But consequences there are - from increased violence and harassment against people of color, immigrants and Muslims to a delegitimization of our democracy (and therefore a tacit legitimization of political violence).

Let's make sure there's one more consequence - a historically crushing loss on November 8th that repudiates this last gasp of neo-fascist white nationalism.",Donald Trump Confirms At Third Debate He Is A Domestic Insurrectionist,link,http://nymag.com/daily/intelligencer/2016/10/trump-threat-to-american-democracy.html,2016-10-20 09:20:15,2208,142,1332,1519,30,121,13,55,470
217722751695604_876024279198778,"In the third and final debate, the candidates were finally pressed on the issues they've failed to address in the midst of attacking each other's words and character. 

Their tussle over the question of nominating a new #SCOTUS justice was one of the most important parts of the debate.

Donald Trump attempted to appeal to voters' fear and anger by characterizing late-term abortions as ripping babies out of the womb, an inaccurate and sensationalist way to describe what is a life-saving medical procedure for many.

Clinton, on the other hand, wants to keep reproductive rights in the hands of those whose bodies are actually at stake during pregnancy. 

Given that appointing a new justice will have a massive affect on how constitutional law is upheld and interpreted, voters need to care about these candidates' responses. 

We need to be think about who we'd rather have shaping the course of #SCOTUS for years to come--a man who thinks people should be punished for exercising their medical and reproductive rights or a woman who wants to protect and uphold the right to choose?",Hillary Clinton just eviscerated Trump on abortion during the debate,link,http://www.motherjones.com/politics/2016/10/hillary-clinton-eviscerates-trump-abortion-during-debate,2016-10-20 06:45:31,667,50,124,593,55,9,5,2,3
217722751695604_875721939229012,"With Donald Trump's shackles off and Hillary Clinton dealing with WikiLeaks controversies, the third and final presidential debate is bound to be at worst riddled with intrigue and insults and at best a way to find out what the candidates really plan to do about the issues voters care about.

Watching tonight? So are we! We'll be watching--and livetweeting--the debate, so follow us at twitter.com/dly_progressive for a progressive take on the latest installment of this frankly wild series of debates.",4 Things To Watch In The Last Presidential Debate,link,http://www.npr.org/2016/10/19/498389250/4-things-to-watch-in-the-3rd-presidential-debate,2016-10-19 19:12:46,11,8,4,9,1,0,1,0,0
217722751695604_875656199235586,"""Mohamedou Ould Slahi, 45, got to Guantánamo in August 2002. He was subjected to some of the worst Pentagon-approved interrogation techniques at Guantánamo — beatings, sleep deprivation, being packed in ice, and was threatened with the arrest of his mother.

He spent more than a decade in segregation in a special detention site called Camp Echo, apart from nearly all of the other captives at the Navy base's sprawling prison complex, before he was spirited off the base before dawn in a U.S. military cargo plane.""","14 Years in Guantamano, Tortured, Never Charged, Now Released with No Explanation",link,http://buff.ly/2dm6Zmt,2016-10-19 16:45:02,67,8,18,17,0,8,0,21,21
217722751695604_875601555907717,"""Study…shows poorest countries offer fewest opportunities for girls, but world's richest nation also disappoints.""

""The US came 32nd in the index due to its low representation of women in parliament, high teenage pregnancy rates and its record on maternal deaths. Fourteen women died per 100,000 live births in the US in 2015, a similar number to Uruguay and Lebanon.""",US ranks lower than Kazakhstan and Algeria on gender equality,link,http://buff.ly/2esp4MV,2016-10-19 14:45:08,203,12,123,89,0,11,2,56,45
217722751695604_875544195913453,"(Content Note: police violence)

""When compared to their percentage of the U.S. population, Natives were more likely to be killed by police than any other group, including African Americans. 

By age, Natives 20-24, 25-34 and 35–44 were three of the five groups most likely to be killed by police. (The other two groups were African Americans 20-24 and 25-34.) 

Males' analysis of CDC data from 1999 to 2014 shows that Native Americans are 3.1 times more likely to be killed by police than white Americans.""",Special Investigation: Native Americans Are Being Killed by Police at a Higher Rate Than Any Other Group,link,http://buff.ly/2e4p07O,2016-10-19 12:45:03,1088,38,666,270,2,38,0,375,403
217722751695604_875476905920182,"""It is true that both candidates have, since early in the campaign, vowed to close the loophole, which allows investment managers to have the large sums they receive as compensation for managing other people's money taxed at the lower capital gains rate, as if it was the result of their own investment, rather than at the higher tax rate for ordinary income.

However, Trump's vow to close the loophole is largely canceled out by other provisions in his tax plan, which could reduce the income tax rate for partners at many investment firms to as low as 15 percent. That is what Clinton is correctly referring to when she says that his plan will 'give the wealthy and corporations the biggest tax cuts they have ever had.'""",Fact-Checking Donald Trump and Hillary Clinton on the Billionaires' Tax Break,link,http://buff.ly/2ePiXVU,2016-10-19 10:45:12,51,0,28,42,0,3,0,0,6
