status_id,status_message,link_name,status_type,status_link,status_published,num_reactions,num_comments,num_shares,num_likes,num_loves,num_wows,num_hahas,num_sads,num_angrys
217722751695604_980609488740256,There were 12 oil spills in the first year of Keystone Phase 1 alone. (via Resist),"Keystone XL Pipeline Resumes, And So Does Its Path of Destruction",link,https://resistmedia.org/2017/03/31/keystone-xl-pipeline-resumes-path-destruction/?utm_source=FB-page&utm_campaign=DP-FB-page,2017-03-31 07:00:00,1765,27,835,443,11,21,0,298,992
217722751695604_979912308809974,Not until we ourselves shout to #FindOurGirls (via Unapologetic Feminism),"5 Reasons Why When Black Girls Go Missing, The Media Doesn't Make a Sound",link,https://unapologeticfeminism.com/2017/03/5-reasons-black-girls-go-missing-media-doesnt-make-sound/?utm_source=FB-page&utm_campaign=UF-FB-page,2017-03-30 07:00:00,419,10,83,87,2,9,0,158,163
217722751695604_979244975543374,"""If you're going to critique psychiatry, it's important to consider the impact of your words. Does this critique empower mentally ill people? Or could it harm us in the process?"" (via Unapologetic Feminism)",5 Ways Your Critiques of Psychiatry Might Be Ableist,link,https://unapologeticfeminism.com/2017/03/critiques-psychiatry-ableist/?utm_source=FB-page&utm_campaign=DP-FB-page,2017-03-29 07:00:00,37,0,8,34,0,2,0,1,0
217722751695604_978607272273811,"Can you imagine your doctor purposefully lying to you about your pregnancy? According to Texas lawmakers, it's perfectly fine – and should be legal. Is your state next? (via Unapologetic Feminism)","According to GOP Lawmakers, Lying to Pregnant Patients is A-OK If It Saves a Fetus",link,https://unapologeticfeminism.com/2017/03/lying-to-pregnant-patients-ok/,2017-03-28 07:00:00,1088,146,290,86,0,75,1,36,890
217722751695604_975928452541693,"Because if history tells us anything, it's that we should fear liberals as much as conservatives in the fight against fascism. (via Resist)",Lessons From History: Why Liberals Won't Save Us in the Fight Against Fascism,link,https://resistmedia.org/2017/03/23/lessons-spain-dangers-anti-trump-popular-front/?utm_source=FB-page&utm_campaign=DP-FB-page,2017-03-24 07:00:00,272,44,80,202,2,31,3,13,21
217722751695604_975866019214603,"For queer and trans youth, seeing ourselves reflected back is a powerful experience. (via Unapologetic Feminism)","As a Queer Teenager, This Is Why I Needed LGBTQ+ YouTube Accessible – Not Restricted",link,https://unapologeticfeminism.com/2017/03/lgbtq-youtube-not-restricted/,2017-03-23 12:09:36,54,3,10,49,5,0,0,0,0
217722751695604_973802589420946,"Just like America was for most of our history (and in many ways continues to be), Israel is of course an apartheid state.",Does the term 'apartheid' fit Israel? Of course it does.,link,http://www.latimes.com/opinion/op-ed/la-oe-makdisi-israel-apartheid-20140518-story.html,2017-03-20 11:08:10,831,31,271,597,7,27,1,125,74
217722751695604_972154822919056,"""When will men stand behind their wives and daughters and mothers while they are behind bars? Why do women receive the short end of the stick, when we give so much of our support to the men in our lives? 

My mother gave me the answer to this question early in childhood. Women who end up in the prison system in today's society are expected to suffer alone. We are not seen as individuals anymore, we are seen as mistakes.""

via RaceBaitR",Where Are All the Women When We Talk About Prison?,link,https://unapologeticfeminism.com/2017/03/women-talk-prison/?utm_source=FB&utm_campaign=DP-FB-page,2017-03-18 07:31:00,134,7,21,57,0,0,0,61,16
217722751695604_971304313004107,Because families can be a source of pain and alienation rather than love and support (via Unapologetic Feminism),The Realities of Going No Contact with Abusive Family,link,https://unapologeticfeminism.com/2017/03/realities-going-no-contact-abusive-family/?utm_source=DP-FB-page&utm_campaign=DP-FB-page,2017-03-16 10:25:16,300,20,102,249,16,1,0,33,1
217722751695604_970252063109332,And why we need to be blaming an inadequate and violent system instead (via Unapologetic Feminism),4 Ways Mentally Ill People Are Blamed For Their Struggles,link,https://unapologeticfeminism.com/2017/03/4-ways-mentally-ill-people-blamed-struggles/?utm_source=DP-FB-page&utm_campaign=DP-FB-page,2017-03-15 07:00:00,367,14,124,198,2,4,0,124,39
217722751695604_969497993184739,President Park's impeachment shows that protest can work--if we do it right,Lessons from South Korea on Impeaching a President,link,https://resistmedia.org/2017/03/13/lessons-south-korea-creating-culture-protest-works/?utm_source=DP-FB-page&utm_campaign=DP-FB-page,2017-03-13 12:36:12,1269,18,279,1163,71,32,3,0,0
217722751695604_968174296650442,And why the reaction from too many cis 'allies' has been even more disturbing (via Unapologetic Feminism),Why Chimamanda Ngozi Adichie's Comments on Trans Women are Wrong and Dangerous,link,https://unapologeticfeminism.com/2017/03/why-chimamanda-ngozi-adichies-comments-trans-women-wrong/?utm_source=DP-FB-page&utm_campaign=DP-FB-page,2017-03-11 13:26:14,124,14,17,78,2,9,1,26,8
217722751695604_966777256790146,Because Black folks are not immune to white-centric beauty standards (via Unapologetic Feminism),Meat on Dem Bones: Fat Antagonism and Diet Culture in Black Beauty Politics,link,https://unapologeticfeminism.com/2017/03/meat-dem-bones-fat-antagonism-diet-culture-black-beauty-politics/?utm_source=DP-FB-page&utm_campaign=DP-FB-page,2017-03-10 08:23:00,33,6,4,28,1,1,0,1,2
217722751695604_965689486898923,"As feminists march to protest Trump's global gag rule on abortion, we need to be inclusive of trans people in our work around reproductive justice. Here's how.",6 Tips for Making Your Conversations About Reproductive Rights More Trans Inclusive,link,https://unapologeticfeminism.com/2017/03/6-tips-making-conversations-reproductive-rights-trans-inclusive/,2017-03-08 14:02:07,139,0,16,124,13,1,1,0,0
217722751695604_965659386901933,Because the War on Drugs has never really been about the drugs.,"Jeff Sessions's War on Black Lives: Why his Proposed Marjijuana Crackdown is About Race, not Drugs",link,https://resistmedia.org/2017/03/08/jeff-sessions-potential-crackdown-marijuana-possession-race/,2017-03-08 12:06:53,2050,284,819,670,4,62,13,153,1148
217722751695604_965039200297285,How U.S. Corporate interests killed and are killing resistance leaders in the Global South.,The Assassination of Berta Cáceres and the U.S. Deep State,link,https://resistmedia.org/2017/03/07/assassination-berta-caceres-u-s-deep-state/,2017-03-07 14:07:31,711,9,163,153,4,33,0,146,375
217722751695604_964409520360253,What are we willing to do to protect Black lives?,A Call to Anger: The Lynching of Ben Keita and Our Demand for Justice,link,https://resistmedia.org/2017/03/06/will-justice-ben-keita/,2017-03-06 12:17:43,2611,104,757,675,10,27,0,767,1132
217722751695604_962195433914995,Because our self-love and existence are forms of radical resistance in this world.,Resist Responsibly: 5 Ways We as Black Women Can Heal In These Wounding Times,link,https://unapologeticfeminism.com/2017/03/resist-responsibly-5-ways-black-women-can-heal-wounding-times/,2017-03-03 12:02:42,11,0,5,10,1,0,0,0,0
217722751695604_962179390583266,"The harm from guns isn't only affecting those shot or killed, but also everyone forced to live in fear of their use.",The Invisible Way Guns Keep Women In Abusive Relationships,link,http://www.huffingtonpost.com/entry/guns-domestic-violence_us_58adf010e4b01406012f4f31,2017-03-03 11:24:07,415,13,143,176,2,15,0,99,123
217722751695604_961551673979371,Because liberals so often demonize the oppressed for resisting the oppressor.,Shaming Violent Revolt against Oppression is Victim Blaming,link,https://resistmedia.org/2017/02/27/shaming-violent-revolt-oppression-abuse-apologism/,2017-03-02 10:32:37,312,30,67,213,4,12,1,33,49
217722751695604_961300020671203,"Of course, no mention of this by President Cheetolini.

CW: Islamophobia",Four Mosques Have Burned In Seven Weeks — Leaving Many Muslims and Advocates Stunned,link,https://www.buzzfeed.com/albertsamaha/four-mosques-burn-as-2017-begins?utm_term=.ar1Y5V5JVW#.csvEmwm8wW,2017-03-01 22:45:09,2314,113,1353,500,2,49,4,685,1074
217722751695604_961048454029693,The lack of consequences for this type of behavior is rape culture in action.,"OLES Director Says His Admitted Sexual Harassment of Female Employees Was ""In His Nature""",link,https://unapologeticfeminism.com/2017/03/oles-director-says-admitted-sexual-harassment-female-employees-nature/,2017-03-01 11:19:21,588,27,111,84,2,46,3,22,431
217722751695604_960541804080358,"Let's be real: This was a hit job on Keith Ellison by establishment Dems (led by Obama), who didn't want to endanger the flow of corporate money. 

And they have the shamelessness to then turn around and tell the Left-wing to not be divisive, with the knife wound still fresh in our back.",What Happened to Keith Ellison? | Jacobin,link,https://www.jacobinmag.com/2017/02/what-happened-to-keith-ellison/,2017-02-28 14:27:10,428,360,98,188,8,18,8,58,148
217722751695604_960073304127208,Because being marginalized is not our get out of racism free card,"White LGBTQIA+ People, We Need to Do Better",link,https://unapologeticfeminism.com/2017/02/white-lgbtqia-people-need-better/?utm_source=RESIST-FB-page&utm_campaign=RESIST-FB-page,2017-02-28 08:31:00,190,4,16,180,4,5,0,1,0
217722751695604_959966844137854,"Single payer is absolutely the only cure and it's time we didn't let anyone, including Democrats, get in the way of it!","Amid GOP Attacks on Health Care, the Movement for Single Payer Is Growing",link,http://www.truth-out.org/news/item/39618-amid-gop-attacks-on-health-care-the-movement-for-single-payer-is-growing,2017-02-27 17:34:10,3752,151,1276,3334,331,53,6,7,21
217722751695604_959865350814670,And stop the blatant scapegoating of transgender women.,Transphobic Lawmakers: Stop Using Cisgender Women and Girls as Pawns,link,https://resistmedia.org/2017/02/27/transphobic-lawmakers-stop-using-cisgender-women-girls-pawns/,2017-02-27 13:12:53,253,8,26,209,3,3,0,22,16
217722751695604_959784904156048,"And predictably, they can't stomach it.",Controversial Bill Proposing Spousal Consent for Viagra Gives Anti-Choice Lawmakers a Taste of Their Own Medicine,link,https://resistmedia.org/2017/02/27/controversial-bill-proposing-spousal-consent-viagra-gives-anti-choice-lawmakers-taste-medicine/,2017-02-27 09:30:03,4080,160,911,2471,374,26,1194,6,9
217722751695604_957374091063796,"If we're going to focus on stopping terrorist violence, let's focus on what has always been and still is the primary source of it: white men. 

And as always, the state will almost certainly back up this white cop's violence while prosecuting the innocent 13 year old boy he victimized. 

#sickening",Cellphone Video Captures Off-Duty LAPD Cop Firing Weapon During Confrontation With 13-Year-Old Boy,link,http://www.theroot.com/cellphone-video-captures-off-duty-lapd-cop-firing-weapo-1792669332,2017-02-23 14:29:58,1662,187,493,469,5,69,1,198,920
217722751695604_957201131081092,"No surprise here - and we can be damn sure Russia has even more leverage on Trump. But guess that's not worth Congress investigating either.

Hopefully this is the tip of the iceberg of what hackers are about to reveal to the world.",Paul Manafort targeted for blackmail shortly before Ukraine ties forced him out of Trump campaign,link,http://www.rawstory.com/2017/02/paul-manafort-targeted-for-blackmail-shortly-before-ukraine-ties-forced-him-out-of-trump-campaign/,2017-02-23 09:46:32,1557,74,637,880,12,234,51,17,363
217722751695604_956684987799373,"If Republicans get full control of a few more State Houses, they will have the frightening power to amend the Constitution into their own authoritarian image.",Why We Could Be on the Verge of a Constitutional Apocalypse,link,http://www.alternet.org/activism/verge-constitutional-collapse,2017-02-22 12:38:16,989,51,353,415,8,105,0,51,410
217722751695604_956636341137571,"Law enforcement is laying the groundwork for yet more violence and brutality

#NoDAPL",Law Enforcement is Systematically Dehumanizing Standing Rock Water Protectors to Justify Violence,link,http://nativenewsonline.net/currents/law-enforcement-systematically-dehumanizing-standing-rock-water-protectors-justify-violence/,2017-02-22 10:26:04,2618,115,989,358,2,22,0,447,1789
217722751695604_956038194530719,"We've said in the past that Trump's administration is #NotNormal, but has that refrain kept progressives from truly acknowledging just how normal the mistreatment of immigrants, women, LGBTQ2IA+ people, Muslims, and people of color has been all along?",Why Trump's #NotNormal Administration is All Too Normal,link,https://resistmedia.org/2017/02/21/trumps-notnormal-administration-normal/,2017-02-21 09:54:18,137,15,23,71,1,13,3,11,38
217722751695604_926249317509607,"1) What happened in Chicago has absolutely nothing to do with BLM and 2) unlike countless cases involving Black victims, justice will almost certainly be served to these four people.",KING: Don't use Chicago's white assault case against BLM movement,link,http://www.nydailynews.com/news/national/king-don-chicago-white-assault-case-blm-movement-article-1.2935825,2017-01-05 13:00:58,629,50,225,506,14,7,1,64,37
217722751695604_925845670883305,And what white allies need to learn from those incidents for 2017 (via Unapologetic Feminism),#LeaveItIn2016: 5 Times White People Should've Known Better Last Year,link,https://resistmedia.org/2017/01/04/leaveitin2016-5-times-white-people-shouldve-known-better-last-year/?utm_source=RESIST&utm_campaign=resist-fb-page&utm_medium=fb-page,2017-01-05 08:00:00,41,6,8,32,0,0,1,4,4
217722751695604_925190914282114,Every state should have this as a minimum.,"Alongside Bernie Sanders, NY Governor Announces First-in-Nation Free Tuition Plan",link,https://resistmedia.org/2017/01/alongside-bernie-sanders-ny-governor-announces-first-nation-free-tuition-plan/?utm_source=RESIST&utm_campaign=resist-fb-page&utm_medium=fb-page,2017-01-04 08:02:00,2880,57,615,2479,339,58,3,0,1
217722751695604_924992477635291,Each one of these is already happening and he's not even in office yet,Robert Reich: 15 Signs of Impending Tyranny Under President Trump,link,https://resistmedia.org/2017/01/robert-reich-15-signs-impending-tyranny-president-trump/?utm_source=RESIST&utm_campaign=resist-fb-page&utm_medium=fb-page,2017-01-03 11:48:08,1829,63,1003,1040,8,60,5,227,489
217722751695604_924290027705536,"Because when our government becomes authoritarian, we must become ungovernable (via Fight Fascism)",Here's how we prepare for mass resistance against a neo-fascist Trump regime,link,https://resistmedia.org/2017/01/heres-prepare-mass-resistance-neo-fascist-trump-regime/?utm_source=RESIST&utm_campaign=resist-fb-page&utm_medium=fb-page,2017-01-02 10:23:00,1401,33,385,1260,100,30,1,3,7
217722751695604_923831541084718,"The nation is weary from a hellish campaign and fear of its outcome. But if there was ever a time to wake up, it's now.","As Trump Builds His Oligarchy, America Goes to Sleep",link,http://prospect.org/article/trump-builds-his-oligarchy-america-goes-sleep,2017-01-01 15:21:37,1955,170,986,1121,9,47,4,231,543
217722751695604_923013537833185,Because fighting white supremacy begins at home (via Unapologetic Feminism),The 6-step guide to raising anti-racist white kids as a white parent,link,https://resistmedia.org/2016/12/6-step-guide-raising-antiracist-white-kids/?utm_source=RESIST&utm_campaign=resist-fb-page&utm_medium=fb-page,2016-12-31 12:24:21,258,11,106,234,22,1,1,0,0
217722751695604_922448837889655,This is what non-cooperation with evil looks like,Singer quits Mormon Tabernacle Choir rather than sing for Trump: 'I could never throw roses to Hitler',link,https://resistmedia.org/2016/12/never-throw-roses-to-hitler/?utm_source=RESIST&utm_campaign=resist-fb-page&utm_medium=fb-page,2016-12-30 13:30:00,7225,491,879,6203,887,99,27,4,5
217722751695604_922421264559079,"And you can bet once Trump and Ryan do it, it will somehow *still* be Obama's fault",Paul Krugman Reveals the Real Reason Trump and Ryan Intent on Snatching Healthcare Away From Millions,link,https://resistmedia.org/2016/12/paul-krugman-reveals-real-reason-trump-ryan-intent-snatching-healthcare-away-millions/,2016-12-30 12:27:13,1853,83,923,1150,23,38,6,162,474
217722751695604_922100604591145,"Right now, water protectors are continuing to put their lives on the line in freezing winter conditions to resist the progress of the Dakota Access Pipeline. (via Indigenous Resistance: Crushing Colonialism)",The fight at Standing Rock is far from over,link,https://resistmedia.org/2016/12/fight-standing-rock-far/?utm_source=RESIST&utm_campaign=resist-fb-page&utm_medium=fb-page,2016-12-30 07:45:00,1641,43,1008,697,27,30,0,369,518
217722751695604_922085121259360,,Daily Progressive,photo,https://www.facebook.com/dailyprogressive/photos/a.220056191462260.56348.217722751695604/922085121259360/?type=3,2016-12-29 22:57:25,12,0,0,12,0,0,0,0,0
217722751695604_922084924592713,,Daily Progressive's cover photo,photo,https://www.facebook.com/dailyprogressive/photos/a.220054568129089.56345.217722751695604/922084924592713/?type=3,2016-12-29 22:56:42,4,0,1,4,0,0,0,0,0
217722751695604_920081554793050,And why we need to make sure we get the history right (via Unapologetic Feminism),5 myths about slavery that our society still perpetuates,link,https://resistmedia.org/2016/12/5-lies-slavery-weve-taught/?utm_source=RESIST&utm_campaign=resist-fb-page&utm_medium=fb-page,2016-12-26 13:12:09,766,25,548,505,4,17,1,150,89
217722751695604_919243448210194,The Russians know what's up. Too bad most of America doesn't seem to. (via Fight Fascism),Russia Analyst: People In Moscow Laughing At How Putin Played 'That Fool' Trump,link,https://resistmedia.org/2016/12/russia-analyst-people-moscow-laughing-putin-played-fool-trump/?utm_source=RESIST&utm_campaign=resist-fb-page&utm_medium=fb-page,2016-12-25 09:00:00,2055,125,973,1248,16,96,176,356,163
217722751695604_918931641574708,Say it again for the folks in the back,Timeline Photos,photo,https://www.facebook.com/dailyprogressive/photos/a.817068685094338.1073741825.217722751695604/918931641574708/?type=3,2016-12-24 10:49:02,1427,36,693,1285,126,4,0,0,12
217722751695604_918665744934631,"Because sometimes, self-care means saying ""no"" (via Unapologetic Feminism)","Why it's okay for us as LGBTQIA+ people to avoid bigoted family, even during the holidays",link,https://resistmedia.org/2016/12/okay-us-lgbtqia-people-avoid-bigoted-family-even-holidays/?utm_source=RESIST&utm_campaign=resist-fb-page&utm_medium=fb-page,2016-12-24 09:06:01,156,14,23,134,13,1,0,8,0
217722751695604_918335948300944,"And the U.S. as a whole is following not far behind, especially after a Trump administration",North Carolina is no longer classified as a democracy,link,http://www.newsobserver.com/opinion/op-ed/article122593759.html,2016-12-23 09:24:41,2147,161,1332,887,3,115,17,496,629
217722751695604_917920075009198,"This is absolutely sickening. 

This cop needs to be arrested and prosecuted. But of course he'll probably be cleared after some nice paid vacation at a desk job. 

If any video so clearly showed the true white supremacist purpose of policing in America, it is this one.",Black Woman Reports White Man Choked Her 7-Year-Old Son; Police Assault and Arrest Her Instead,link,http://www.theroot.com/articles/news/2016/12/jacqueline-craig-brea-hymond-fort-worth-pd/,2016-12-22 15:24:41,893,97,433,245,1,19,2,87,539
217722751695604_917891138345425,"Because if you're not fighting white supremacy as a white person, you're supporting it (shared from Unapologetic Feminism)",4 ways you as a white person can reduce your complicity in white supremacy,link,https://resistmedia.org/2016/12/4-ways-white-person-can-reduce-complicity-white-supremacy/?utm_source=RESIST&utm_campaign=resist-fb-page&utm_medium=fb-page,2016-12-22 14:04:04,432,18,213,400,19,4,0,2,7
217722751695604_917266725074533,"Our economic and social struggles are real, so let's stop denying them (via Unapologetic Feminism)",Stop the generational gaslighting: The definitive guide to why millennials aren't whiney and entitled,link,https://resistmedia.org/2016/12/stop-generational-gaslighting-definitive-guide-millennials-arent-whiney-entitled/?utm_source=RESIST&utm_campaign=resist-fb-page&utm_medium=FB-Page,2016-12-21 13:07:30,60,5,19,55,3,1,0,0,1
217722751695604_916801641787708,"No matter how horrific the crime, wealth and whiteness always seem to win",Idaho Teen Football Player Walks Free After Sodomizing Black Mentally Disabled Teammate With Wire Hanger,link,https://resistmedia.org/2016/12/idaho-teen-football-player-walks-free-sodomizing-black-mentally-disabled-teammate-wire-hanger/,2016-12-20 16:12:25,1619,380,596,177,2,30,0,142,1268
217722751695604_916727318461807,How Christians can do better around the holidays--and every other time of the year,'Tis the season for unchecked Christian privilege: How Christians can do better around the holidays,link,https://resistmedia.org/2016/12/happy-holidays-not-slight-christmas-unless-persecution-complex/?utm_source=RESIST&utm_campaign=resist-fb-page&utm_medium=Facebook,2016-12-20 13:32:45,80,15,39,69,1,1,2,0,7
217722751695604_916688178465721,"""People rejected the uglier aspects of Nazism but gave ground in ways that ultimately made it successful. They conceded premises to faulty arguments. They rejected the ""facts"" of propaganda, but not the impressions of it. The new paradigm of authoritarianism was so disorienting that they simply could not see it for what it was, let alone confront it.""",What Those Who Studied Nazis Can Teach Us About The Strange Reaction To Donald Trump,link,http://www.huffingtonpost.com/entry/donald-trump-nazi-propaganda-coordinate_us_58583b6fe4b08debb78a7d5c,2016-12-20 12:09:44,1638,79,1388,975,8,84,8,299,264
217722751695604_916612898473249,Let's stop pretending the Constitution is some sacred document.,The Constitution of the United States has failed,link,https://thinkprogress.org/the-constitution-of-the-united-states-has-failed-797a657eab28#.3xwxili5r,2016-12-20 09:40:26,879,91,366,589,3,14,2,174,97
217722751695604_916177111850161,We still see way too much of this happening (via Unapologetic Feminism),4 common types of shaming that have no place in the Body Positive Movement,link,https://resistmedia.org/2016/12/4-common-types-shaming-no-place-body-positive-movement/?utm_source=RESIST&utm_campaign=resist-fb-page&utm_medium=Facebook,2016-12-19 13:23:38,24,3,5,16,1,0,0,5,2
217722751695604_916154028519136,An appeal to the conscience of Republicans - yeah it's a long shot.,Michael Moore appeals to electors to stop Trump - and promises to pay their fines if they do,link,https://resistmedia.org/2016/12/michael-moore-appeals-electors-stop-trump-promises-pay-fines/?utm_source=RESIST&utm_campaign=resist-fb-page&utm_medium=Facebook,2016-12-19 12:22:00,335,29,48,291,26,7,6,3,2
217722751695604_916087001859172,Robert Reich explains why Trump's rallies aren't just a cesspool of hatred and violence--they're part of a larger strategy that's a direct threat to American democracy.,Robert Reich: The dangerous reason Trump will continue to hold more rallies,link,https://resistmedia.org/2016/12/robert-reich-dangerous-reason-trump-will-continue-hold-rallies/?utm_source=RESIST&utm_campaign=resist-fb-page&utm_medium=Facebook,2016-12-19 09:37:33,1152,196,577,550,3,31,5,121,442
217722751695604_915580635243142,"When calling yourself an intersectional feminist is not enough

(Part of our Beyond White Feminism series)","You say your feminism is intersectional, but is it really?",link,https://resistmedia.org/2016/12/say-feminism-intersectional-really/?utm_source=RESIST&utm_campaign=resist-fb-page&utm_medium=Facebook,2016-12-18 11:43:17,10,4,5,10,0,0,0,0,0
217722751695604_914916268642912,Here's what hypervisibility means for marginalized people--and what separates it from the constructive visibility we need.,The 5 biggest drawbacks of hypervisibility,link,https://resistmedia.org/2016/12/5-biggest-drawbacks-hypervisibility/?utm_source=RESIST&utm_campaign=resist-fb-page&utm_medium=Facebook,2016-12-17 08:27:21,25,0,10,25,0,0,0,0,0
217722751695604_914426698691869,And Trump's buddy Putin orchestrated one of the most horrific cases of this is modern history,Every dictator does it: A terrifying-and likely-prediction for Trump's first 100 days,link,https://resistmedia.org/2016/12/every-dictator-terrifying-likely-prediction-trumps-first-100-days/,2016-12-16 10:57:48,428,33,217,166,3,44,4,18,193
217722751695604_913792218755317,Here's the actual price we'd pay with our lives and health.,"How the Republican attack on Obamacare throws the sick, the elderly, and the rest of us under the bus",link,http://buff.ly/2gNt8vP,2016-12-15 10:38:29,437,38,194,180,0,0,0,69,188
217722751695604_913169748817564,Because you can do much more than blocking.,6 ways for white allies to fight racism on Facebook,link,http://buff.ly/2hmewmb,2016-12-14 14:17:26,35,2,9,34,1,0,0,0,0
217722751695604_913091622158710,"If you can donate to help, please do it today.","If You're Horrified By Events In Aleppo, Here Are 8 Charities That Can Help Syrian People",link,http://www.huffingtonpost.co.uk/entry/how-to-help-aleppo-charities-and-organisations-to-donate-to-including-msf-the-red-cross-and-the-white-helmets_uk_584ff7a8e4b040989fa80770,2016-12-14 11:15:14,550,15,361,425,29,2,0,90,4
217722751695604_913035038831035,"Coming soon under the Trump administration: Flammable water! 

#TrumpWater",EPA Finally Concludes Fracking Pollutes Drinking Water,link,https://resistmedia.org/2016/12/epa-finally-concludes-fracking-pollutes-drinking-water/,2016-12-14 09:36:07,1112,77,741,626,8,26,7,124,321
