status_id,status_message,link_name,status_type,status_link,status_published,num_reactions,num_comments,num_shares,num_likes,num_loves,num_wows,num_hahas,num_sads,num_angrys
217722751695604_860830510718155,"The Blue Code of Silence has to end - but it will need mechanisms for cops to report safely, real penalties for those who do not, and a changed culture from the academy up to the Commissioners.",It's Time For Cops To Break The Blue Code Of Silence | Huffington Post,link,http://www.huffingtonpost.com/earl-ofari-hutchinson/its-time-for-cops-to-brea_b_12173778.html,2016-09-26 08:45:00,1589,92,866,1463,66,8,0,38,14
217722751695604_861036987364174,"""I believe that what we've done, what we've seen, is the last throes of the Civil War,"" Reiner explained. ""We're fighting the last battles, and Donald Trump is leading the way for white nationalism. And it's sad because people are hanging on to this idea of a white America, immigrant-free America. It's scary and sad, but I believe we will win it.""",Rob Reiner: Trump's campaign is 'the last throes of the Civil War' fighting for white nationalism,link,http://www.rawstory.com/2016/09/rob-reiner-trumps-campaign-is-the-last-throes-of-the-civil-war-fighting-for-white-nationalism/,2016-09-26 06:45:00,6257,309,2998,5527,332,224,36,98,40
217722751695604_860774170723789,"On the surface, hugging seems pleasant. But disrespecting your child's bodily autonomy? Not so much. This list might really change your perspective.","Your Child Should Never Be Forced to Hug Anyone (Yes, Including a Relative) – Here Are 7 Reasons Why",link,http://everydayfeminism.com/2015/06/never-force-child-hug-people/?utm_source=DailyProgressive&utm_medium=dp-fb-page,2016-09-25 12:42:00,1029,55,548,940,67,15,1,6,0
217722751695604_860149070786299,"Apparently it's legal so long as the banks do it.

#Banksters",Timeline Photos,photo,https://www.facebook.com/dailyprogressive/photos/a.817068685094338.1073741825.217722751695604/860149070786299/?type=3,2016-09-25 10:45:00,6691,225,8224,4939,65,105,613,104,865
217722751695604_859889780812228,"'The sordid, unethical, greedy, monopolizing and downright criminal histories of both Monsanto and Bayer have been well documented. 

Allowing them to merge into the world's largest seed and pesticide company poses what two former Justice Department officials call ""a five-alarm threat to our food supply and to farmers around the world.""'",'A Five-Alarm Threat to Our Food Supply': Experts Describe Bayer-Monsanto Merger,link,http://www.alternet.org/food/what-bayer-monsanto-merger-means-future-agriculture,2016-09-25 08:45:01,643,21,487,390,0,15,0,42,196
217722751695604_860459264088613,"The Charlotte police finally release their videos - and 1) there's no gun visible, and 2) Keith Lamont Scott was backing away from the police slowly, calmly, with his hands at his sides.

How in the hell could this possibly be viewed as an 'imminent threat' to any police officer?

This was a straight-up murder and the police are trying their hardest to make it seem in any way justified.

Cue the smearing of the victim - he had a blunt in his car, say the police. 

Who the hell cares? Since when was possession of a blunt a capital crime? 

This is why there's an uprising in Charlotte. This is why there are protests across the country. This is why we all need to do our part to bend the arc of this moment right now toward justice.

#BlackLivesMatter #KeithLamontScott #StopKillerCops",Charlotte shooting victim Keith Scott's family says killing makes no sense,link,http://www.rawstory.com/2016/09/charlotte-shooting-victim-keith-scotts-family-says-killing-makes-no-sense/,2016-09-25 06:45:00,1381,170,597,702,6,11,0,310,352
217722751695604_859888400812366,"""Native Hawaiians have not had a formal unified government since the overthrow of the Kingdom of Hawaii in 1893. In 1993, Congress enacted the Apology Resolution which offered an apology to Native Hawaiians on behalf of the United States for its role in the overthrow and committed the Federal government to a process of reconciliation. 

As part of that reconciliation process, in 2000 the Department of the Interior and the Department of Justice jointly issued a report identifying as its lead recommendation the need to foster self-determination for Native Hawaiians under Federal law.""",Interior Department Finalizes Pathway to Reestablish a Formal Government-to-Government Relationship with the Native Hawaiian Community,link,http://nativenewsonline.net/currents/interior-department-finalizes-pathway-reestablish-formal-government-government-relationship-native-hawaiian-community/,2016-09-24 14:46:00,118,1,31,103,6,9,0,0,0
217722751695604_860147257453147,"How many people have stayed sick, gone bankrupt, or even died  because of this? 

Not to mention the costs of care which are even more outrageous.

This is what happens when Congress and the President care more about drug company donations than about the people they serve.

This daylight robbery of the sick and vulnerable is every bit of violent as someone wielding a gun or a knife, but our system protects them as they make off with billions in profits.

#SinglePayerNow",Timeline Photos,photo,https://www.facebook.com/dailyprogressive/photos/a.817068685094338.1073741825.217722751695604/860147257453147/?type=3,2016-09-24 10:45:00,1647,281,2189,959,5,57,0,130,496
217722751695604_859894137478459,"This new treaty shows a new level of coordinated opposition from indigenous peoples to Big Oil, with over 50 tribes in the U.S. and Canada signing on.

'Tribes signed ""this treaty because we needed to, mother earth can't take any more of this pollution,"" Judy Wilson, chief of the Canadian Neskonlith Indian Band, said during the signing ceremony in Vancouver, British Columbia.'",Tribes in Canada and U.S. join forces against tar sands pipeline development,link,https://thinkprogress.org/tribes-join-forces-against-tar-sands-15955ea90f72,2016-09-24 08:44:00,3969,51,1588,3476,441,44,2,4,2
217722751695604_859697110831495,"""You don't just get to say, 'I'm in fear,' and now olly olly oxen free — you get to kill somebody. Someone failing to comply does not require lethal force.""

Say it again for the people in the back!

#StopKillerCops",Ex-cop nails CNN's police apologist: You don't get to kill somebody just because you say you're scared,link,http://www.rawstory.com/2016/09/ex-cop-nails-cnns-police-apologist-you-dont-get-to-kill-somebody-just-because-you-say-youre-scared/,2016-09-23 14:45:00,2961,136,1936,2490,185,47,4,39,196
217722751695604_859717607496112,"The first public video has been released of the police killing of Keith Lamont Scott.

It was recorded by Scott's wife as she was forced to witness his death at the hands of the police.

The video shows the same scene as a supposed witness photo released by NBC that was 'confirmed by police sources'.

The photo shows a black object, allegedly a gun (although there isn't enough detail to be sure), lying near Scott, between the shadow of a post and an unidentified white object.

The exact same scene appears in the video from Reykia Scott, literally moments after Keith Scott was shot, AND THERE IS NO ALLEGED 'GUN' VISIBLE.

The police response to this shooting has stunk to high heaven. 

And this may be the first visible evidence showing their attempt at a cover up.

Needless to say, this case needs a federal investigation ASAP.

No wonder they won't release the police videos until an unspecified future date!

#BlackLivesMatter #KeithLamontScott #StopKillerCops",Timeline Photos,photo,https://www.facebook.com/dailyprogressive/photos/a.817068685094338.1073741825.217722751695604/859717607496112/?type=3,2016-09-23 13:50:12,303,76,236,137,1,19,1,41,104
217722751695604_859412494193290,"'""The United States is at war in Yemen today,"" said Sen. Chris Murphy (D-Conn.) during a Senate debate this morning over a bipartisan resolution seeking to block a $1.15 billion arms deal that would supply Saudi Arabia with Abrams tanks and an assortment other weaponry.

While the resolution was voted down, 71 to 21, it marked the first time that members of Congress have publicly debated the wisdom of the United States' role in a conflict that's left thousands of civilians dead and millions on the verge of starvation. ""There is a US imprint on every civilian death inside Yemen, which is radicalizing the people of Yemen against the United States,"" Murphy said in support of the resolution. ""There really is no way this bombing campaign could happen without United States participation...And this Congress has not debated this engagement.""'","US arms sales to Saudi Arabia will continue, despite war crimes allegations",link,http://www.motherjones.com/politics/2016/09/us-arms-sales-saudi-arabia-senate,2016-09-23 12:45:00,108,19,67,46,0,0,0,16,46
217722751695604_859416027526270,"""Was I consciously choosing to spend a couple of hours a day mesmerized by great acting and high production values, or was I defaulting to an entrenched pattern?  When you're blissed out on pleasure you can't always discern the point at which your act of volition mutates into one of compulsion.""",Has Binge-Watching Hijacked Your Dopamine? - The Establishment,link,http://www.theestablishment.co/2016/09/22/has-binge-watching-hijacked-your-dopamine/,2016-09-23 10:44:00,24,2,9,21,1,1,0,1,0
217722751695604_859410490860157,"What would we do without Elizabeth Warren? 

She's going to be one of the most important progressive bulwarks against a total Clinton slide into the arms of Wall Street.

If she had run for President this year, she could have beaten Hillary hands down. 

Let's hope we can look forward to #Warren2020",Elizabeth Warren Seems To Be Staking Out Her Place In A Clinton Presidency,link,http://www.huffingtonpost.com/entry/elizabeth-warren-clinton-treasury_us_57e41ec5e4b0e80b1ba0dc8c?section,2016-09-23 08:45:00,892,67,124,780,100,9,2,1,0
217722751695604_859411454193394,"You have to see this incredible infographic of all the big banks extending 10 BILLION dollars in financing to make the Dakota Access Pipeline happen.

We're not just fighting Big Oil and the US government, we're fighting Wall Street too.

#NoDAPL #NoDakotaAccess",Standing Rock Is a Two-Front War—Big Oil and Big Banks—But Maybe That's Good News,link,http://www.yesmagazine.org/people-power/standing-rock-is-a-two-front-war-big-oil-and-big-banks-but-maybe-thats-good-news-20160922,2016-09-23 06:45:00,1115,41,589,800,18,56,1,32,208
217722751695604_859251070876099,"BREAKING: Officer Betty Shelby, the cop who shot and killed Terence Crutcher, has just been charged with manslaughter.

This is a breakthrough moment for the movement - and we can be damn sure it wouldn't have happened without the intense pressure for justice around the country from #BlackLivesMatter.

It's also promising because, as Shaun King was reflecting, a manslaughter charge may actually result in a conviction, whereas a murder charge would likely result in an acquittal. 

So the prosecutors are serious.

Could this be a turning point? If this results in a conviction, this could be the day that impunity died for cops across America.

Amen to that.

#BlackLivesMatter #StopKillerCops",Tulsa police officer who killed Terence Crutcher charged with manslaughter,link,http://theweek.com/speedreads/650569/tulsa-police-officer-who-killed-terence-crutcher-charged-manslaughter,2016-09-22 16:12:51,1054,263,267,909,67,42,0,19,17
217722751695604_858740290927177,"Surprise, surprise - another plan from Trump to further expand the police state and target people of color.

Step by step, brick by brick, this is the rise of neo-fascism. 

And it's racist as all hell.

#StopTrumpNow",Stop-and-Frisk: Trump's Bad Idea for Fighting Crime,link,http://www.theatlantic.com/politics/archive/2016/09/trump-stop-and-frisk-ineffective-unconstitutional/501041/?utm_source=feed,2016-09-22 14:45:00,274,73,121,128,1,18,5,11,111
217722751695604_859195084215031,"What a surprise - the police videos don't show Keith Lamont Scott having a gun. 

He was supposedly brandishing it at the officers, refusing to put it down, but it was invisible on camera?

And all the eyewitnesses were wrong when they never saw a gun, only a book?

Aaaand now the police aren't going to release the video to the public?

This, folks, is why you can never believe the cops after a police killing. 

They do *everything* they can to cover their asses.

Make no mistake - a cop should be going to jail for killing this man.

People across the country aren't going to take this lying down for much longer.

#BlackLivesMatter #StopKillerCops","Video Does Not Show 'Definitive, Visual Evidence' That Keith Lamont Scott Had a Gun, Police Chief Says",link,http://www.theroot.com/articles/news/2016/09/video-does-not-show-definitive-visual-evidence-that-keith-lamont-scott-had-a-gun-police-chief-says/,2016-09-22 14:00:14,556,71,353,273,0,19,0,75,189
217722751695604_858737820927424,"""But there are costs that will never be quantified or recovered in court. As the attorney general of Illinois, Lisa Madigan, said in 2012, ""there's an entire generation of wealth in minority communities that's been taken away."" The impact of foreclosed homes isn't limited to the former homeowners. The effects multiply and spread out, depressing property values in entire communities, which make them less attractive to homebuyers, which hurts the quality of schools and other public institutions, which depresses home values further and destroys local economies—in a reinforcing cycle of dysfunction.""",Wells Fargo Shows Exactly How Structural Racism Works,link,http://inthesetimes.com/article/19488/wells-fargo-shows-exactly-how-structural-racism-works/,2016-09-22 12:45:00,181,8,72,81,0,2,1,17,80
217722751695604_858741007593772,"""Step one: Make sure you have a badge and the person you are murdering is black.

Step two: Add drugs.""",How to Get Away With Murder: The Death of Terence Crutcher and the Drug War,link,http://www.alternet.org/drugs/terrence-crutcher-and-drug-war,2016-09-22 10:45:00,143,7,63,81,0,1,1,19,41
217722751695604_858737467594126,"With the rise of Trump and the increasing legitimization of racism, these kind of incidents are becoming more and more common.

This is what it means to be Black or Brown in America today.

There needs to be real-world consequences for the white people who commit these kind of racist harassment.

Lord knows the consequences for people of color are real enough.

Expelled from school. Fired from their jobs. 

These are the kind of consequences that show our values and a meaningful commitment to anti-racism.",'Locked the black b*tch out': North Dakota students' racist Snapchat exposes dorm harassment,link,http://www.rawstory.com/2016/09/locked-the-black-btch-out-north-dakota-students-racist-snapchat-exposes-dorm-harassment/,2016-09-22 08:45:01,995,250,687,283,1,18,1,174,518
217722751695604_859043530896853,"Just in case anyone is more concerned right now about broken shop windows than broken lives.

And for those who call for peaceful protests only - those have been happening across the country for years now. 

When nothing changes, when the killings continue, the onus is not on the Black community to stop the violence, but on the police and the elected officials that hold them accountable.

This is not the time for white folks to decry the violence in these riots, but to utterly condemn the violence by the state that is causing them.

#BlackLivesMatter

--

""But it is not enough for me to stand before you tonight and condemn riots. It would be morally irresponsible for me to do that without, at the same time, condemning the contingent, intolerable conditions that exist in our society. These conditions are the things that cause individuals to feel that they have no other alternative than to engage in violent rebellions to get attention. And I must say tonight that a riot is the language of the unheard. And what is it America has failed to hear?...It has failed to hear that the promises of freedom and justice have not been met. And it has failed to hear that large segments of white society are more concerned about tranquility and the status quo than about justice and humanity.""

- MLK",Timeline Photos,photo,https://www.facebook.com/dailyprogressive/photos/a.817068685094338.1073741825.217722751695604/859043530896853/?type=3,2016-09-22 08:21:53,362,20,211,301,27,2,0,30,2
217722751695604_858742854260254,"If there was any doubt about the close relationship between Trump and white supremacist hate groups, this article removes it.

Read the actual endorsements of all the racist hate groups - none of which Trump has disavowed.","This horde of neo-Nazis, KKK, and other extremist leaders all openly backing Trump is chilling",link,http://www.motherjones.com/politics/2016/09/trump-supporters-neo-nazis-white-nationalists-kkk-militias-racism-hate,2016-09-22 06:24:00,1737,225,1910,788,5,73,8,220,643
217722751695604_858291170972089,,Timeline Photos,photo,https://www.facebook.com/dailyprogressive/photos/a.817068685094338.1073741825.217722751695604/858291170972089/?type=3,2016-09-21 18:45:00,989,33,304,715,9,2,261,2,0
217722751695604_858277557640117,"""New product releases from Apple often are a time for analysis, comparison and celebration. But the arrival of the iPhone 7 has brought unwanted attention to the company's darker side of globalization, oppression and greed.""",The Ugly Truth Behind Apple's iPhones,link,http://www.truthdig.com/eartotheground/item/the_ugly_truth_behind_apples_iphones_20160920/,2016-09-21 14:45:00,56,8,49,32,0,2,0,7,15
217722751695604_858290524305487,"Military veterans are confirming that there are more de-escalation protocols in an active military zone than on the streets of America for Black people.

#BlackLivesMatter #StopKillerCops",Timeline Photos,photo,https://www.facebook.com/dailyprogressive/photos/a.817068685094338.1073741825.217722751695604/858290524305487/?type=3,2016-09-21 12:45:00,1348,67,1084,1094,19,34,0,114,87
217722751695604_858273767640496,"Pushback from the health insurance lobby ""came hours after Sen. Jeff Merkley (D-Ore.) announced he'd recruited 32 co-sponsors for a new bill expressing support for a public option ― a position that both President Barack Obama and Democratic presidential nominee Hillary Clinton have publicly endorsed in the last few weeks.""

We need to keep the pressure on Hillary to actually fight for the public option if she's elected to make sure she doesn't buckle like Obama did in the face of insurance industry donations.

#PublicOptionNow",Health Insurers Fire Volley In New Battle Over The Public Option,link,http://www.huffingtonpost.com/entry/public-option-fight-insurance_us_57e03a66e4b08cb140974781,2016-09-21 10:45:00,368,41,169,297,17,5,2,0,47
217722751695604_858534974281042,"America is so off the charts that too many of us have become numb to this. 

It's time for a new federal law mandating de-escalation requirements for law enforcement.

No more 'I felt afraid' blank checks for murder.

No other profession is allowed to freak out and kill people without cause. Neither should police.

#StopKillerCops",Timeline Photos,photo,https://www.facebook.com/dailyprogressive/photos/a.817068685094338.1073741825.217722751695604/858534974281042/?type=3,2016-09-21 10:02:17,674,60,408,393,5,9,1,129,137
217722751695604_858278924306647,"Warren said: ""You know, here's what really gets me about this Mr. Stumpf. If one of your tellers took a handful of $20 bills out of the cash drawer, they'd probably be looking at criminal charges for theft. They could end up in prison. But you squeezed your employees to the breaking point so they would cheat customers and you could drive up the value of your stock and put hundreds of millions of dollars in your own pocket. And when it all blew up, you kept your job, you kept your multimillion dollar bonuses, and you went on television to blame thousands of $12-an-hour employees who were just trying to meet cross-sell quotas that made you rich. This is about accountability. You should resign. You should give back the money that you took while this scam was going on, and you should be criminally investigated.""

#ElizabethWarrenForPresident",Elizabeth Warren just eviscerated the Wells Fargo CEO,link,http://www.motherjones.com/politics/2016/09/sen-elizabeth-warren-tears-wells-fargo-ceo-john-stumpf,2016-09-21 08:45:00,4301,344,1678,3537,564,94,26,3,77
217722751695604_858292490971957,"The horror of police killings of Black people just doesn't stop.

One day after the murder of Terence Crutcher, Charlotte Police shot and killed a disabled Black man who was holding a goddamn book.

A BOOK.

How is the whole damn country not rioting by now? When is this not going to explode?!?

#BlackLivesMatter #StopKillerCops","Police In North Carolina Fatally Shoot Man Witnesses Say Was Disabled, Unarmed",link,http://www.huffingtonpost.com/entry/charlotte-police-shooting_us_57e1c953e4b0e80b1b9efd69?section,2016-09-21 06:45:00,1378,139,897,500,2,27,1,231,617
217722751695604_857780194356520,"""Policy demands such as decriminalization of certain activities and ending the militarization of law enforcement can go a long way to ending police violence against People of Color.

But I don't believe that we can rely solely on federal and state reforms to end police violence. I believe that it is imperative that police forces put aside their egos and aggression and actually begin to take in what communities are saying.

Communities must have a bigger role in how law enforcement operates in our neighborhoods. We must be active participants in the way we interact with one another and in how the police interact with us.

Here are some solutions that put communities in the forefront of ending police violence.""",9 Simple Ways to Reduce Police Violence Against People of Color in the US,link,http://everydayfeminism.com/2016/09/ways-to-reduce-police-violence/,2016-09-20 12:05:00,96,11,49,89,2,3,0,2,0
217722751695604_857778201023386,"If you think how much CEO's make is disgusting, a new paper shows it's way worse than we ever imagined.

When we wonder what is feeding the incredible inequality in America today and the economically destructive behavior of top executives, here's the answer: 

Such obscene levels of compensation for CEO's that it becomes their overriding driver of behavior, damn the long-term health of the company, damn the economy, damn the workers and inequality, and damn a functioning democracy.

The reality is that this level of money and power corrupts utterly.

And because of insider control over the compensation system, the companies can never be trusted to police themselves.

The answer is a simple one: compensation caps that rein in this out of control system that is destroying not only our economy but our democracy.",Corporate Executives Are Making Way More Money Than Anybody Reports,link,http://www.theatlantic.com/business/archive/2016/09/executives-making-way-more-than-reported/499850/,2016-09-20 10:45:00,458,36,335,245,1,21,0,15,176
217722751695604_857770714357468,"While this is of course a comment on Trump, it is also one on Hillary. 

You can't help but wonder if George Bush Sr. would have cast his vote for Bernie. 

But apparently his worldview and Hillary's have enough overlap that he'll give his vote to her. 

Guess one establishment figure recognizes its own.

Also, read to the bottom of the article to see who Quayle is supporting. 

Hint: Neither of them can probably spell potato.",George H.W. Bush to vote for Hillary,link,http://www.politico.com/story/2016/09/exclusive-george-hw-bush-to-vote-for-hillary-228395,2016-09-20 08:45:00,1303,89,412,1193,69,15,19,0,7
217722751695604_857759027691970,"Could there be a police killing so blatantly uncalled for, so utterly indefensible, that a cop is actually convicted?

The Tulsa police shooting of Terence Crutcher may finally be it. 

Even the Tulsa Police Chief had this to say: ""The video is very disturbing, it's very difficult to watch. We will do the right thing—we will not cover anything up.""

Terence Crutcher (who was of course Black) was driving home from community college classes when his SUV broke down. Then cops rolled up on him.

As confirmed by multiple videos, he had his hands in the air and was walking slowly, making no sudden movements. 

He was unarmed.

Despite this he was shot to death by the police and allowed to bleed out for minutes before any kind of help was provided.

In any sane or just world, the next steps are simple.

The officer who murdered him would be arrested, prosecuted, and convicted for murder. And it would send a message to cops everywhere that the days of total impunity are over.

We'll see if we're moving toward that world in the days and weeks ahead, or if we'll remain in a world where killer cops always go free.

#BlackLivesMatter #TerenceCrutcher",Video Shows an Unarmed Black Man Had His Hands in the Air When Police Fatally Shot Him,link,http://www.theatlantic.com/news/archive/2016/09/fatal-police-shooting-oklahoma/500675/?utm_source=feed,2016-09-20 06:45:00,990,225,529,365,0,13,0,198,414
