status_id,status_message,link_name,status_type,status_link,status_published,num_reactions,num_comments,num_shares,num_likes,num_loves,num_wows,num_hahas,num_sads,num_angrys
229475497245882_353400421520055,"We have a smorgasbord of good reading, from other sites, to recommend today. (Please assume no implication that ideas therein are necessarily endorsed.) GOP leaders should learn from the amnesty […]

The post Daily Roundup, Feb. 27: Scandals, ISIS, …","Daily Roundup, Feb. 27: Scandals, ISIS, and Ineptitude",link,http://quinhillyer.com/daily-roundup-feb-27-scandals-isis-and-ineptitude/,2015-02-27 07:59:57,0,0,0,0,0,0,0,0,0
229475497245882_353098761550221,"Hello, and welcome to the re-launch of QuinHillyer.com! Starting today, this will be a web site with a wide and interesting variety of new content almost every day (at least […]

The post And I'm back, bringing you more and better content appeared …","And I'm back, bringing you more and better content",link,http://quinhillyer.com/and-im-back-bringing-you-more-and-better-content/,2015-02-26 10:45:11,0,0,0,0,0,0,0,0,0
229475497245882_352882161571881,"Hello, and welcome to the re-launch of QuinHillyer.com! Starting today, this will be a web site with a wide and interesting variety of new content almost every day (at least […]

The post I'm back, and better than ever! appeared first on Quin …","I'm back, and better than ever!",link,http://quinhillyer.com/im-back-and-better-than-ever/,2015-02-25 18:27:18,0,0,0,0,0,0,0,0,0
229475497245882_352654041594693,"George Will has been an intellectual guide of mine for 35 years, but I take strong issue with a recent column where he said the world is, comparatively speaking, not […]

The post Islamists, Obamites and (Russian) bears — oh my!! appeared first on …","Islamists, Obamites and (Russian) bears — oh my!!",link,http://quinhillyer.com/islamists-obamites-and-russian-bears-oh-my/,2015-02-24 23:11:07,0,0,0,0,0,0,0,0,0
229475497245882_352649898261774,"For The Advocate, I write about why an illegal power grab by the Environmental Protection Agency would add to a record of the Obama administration harming Louisiana. Follow the red […]

The post EPA oversteps bounds, hurts LA economy appeared first …","EPA oversteps bounds, hurts LA economy",link,http://quinhillyer.com/epa-oversteps-bounds-hurts-la-economy/,2015-02-24 22:41:35,0,0,0,0,0,0,0,0,0
229475497245882_350143808512383,"In one way or another, almost all of my columns (and blog posts) in recent weeks have involved defenses of longstanding traditions of law and culture. As usual, follow the […]

The post Standing up for law, the culture, and tradition appeared first …","Standing up for law, the culture, and tradition",link,http://quinhillyer.com/standing-law-culture-tradition/,2015-02-17 19:32:15,0,0,0,0,0,0,0,0,0
229475497245882_337745106418920,"You just have to watch this 58-second video. You've just gotta love it. It's a great way to celebrate today's 75th birthday of the man who arguably is the greatest […]

The post We do know Jack appeared first on Quin Hillyer.",We do know Jack,link,http://quinhillyer.com/know-jack/,2015-01-21 02:17:03,0,0,0,0,0,0,0,0,0
229475497245882_337242633135834,"Follow the links: The president perniciously spends us into oblivion. We're in a war, specifically against Islamic terrorists, and we must act accordingly. And a great conservative scholar and advocate […]

The post For National Review: War; Busted …",For National Review: War; Busted budgets; and a tribute in eulogy,link,http://quinhillyer.com/national-review-war-busted-budgets-tribute-eulogy/,2015-01-19 16:52:39,0,0,0,0,0,0,0,0,0
229475497245882_337216843138413,"Many of my Louisiana conservative friends are less than happy with me today, after my column advocating greater tax equity, meaning less regressivity, in state and local taxes. Granted, federal […]

The post Louisiana should tax the rich (with a huge …","Louisiana should tax the rich (with a huge caveat, though!)",link,http://quinhillyer.com/louisiana-tax-rich-huge-caveat-though/,2015-01-19 16:15:57,0,0,0,0,0,0,0,0,0
229475497245882_337208779805886,"Alabama faces a budget gap of $265 million. Not good, but not awful, Perhaps manageable, if managerial/legislative flexibility were available. Alas, right now it's not available. But it should be. […]

The post Flexibility for Alabama's Budget …",Flexibility for Alabama's Budget,link,http://quinhillyer.com/flexibility-alabamas-budget/,2015-01-19 15:38:58,0,0,0,0,0,0,0,0,0
229475497245882_332069066986524,"A few weeks ago, I wrote of the amazingly impressive young man, Christopher Thomas, a student leader at the University of South Alabama who suddenly died of natural causes — […]

The post Update on Christopher Thomas Scholarship appeared first on …",Update on Christopher Thomas Scholarship,link,http://quinhillyer.com/update-christopher-thomas-scholarship/,2015-01-06 15:55:12,0,0,0,0,0,0,0,0,0
229475497245882_331667863693311,"The Baseball Hall of Fame, in Cooperstown, will find out Tuesday who its newest inductees will be. There's no time now for a full and thorough discussion of who should […]

The post My Baseball Hall of Fame Ballot appeared first on Quin Hillyer.",My Baseball Hall of Fame Ballot,link,http://quinhillyer.com/baseball-hall-fame-ballot/,2015-01-05 13:41:47,0,0,0,0,0,0,0,0,0
229475497245882_331649510361813,"Happy New Year! Within two weeks, I hope to announce a new, much more regular system of posts here at Quinhillyer.com — interesting, informative, entertaining. In the meantime, here's catching […]

The post New Year, Continuing Stories, New Approach …","New Year, Continuing Stories, New Approach",link,http://quinhillyer.com/new-year-continuing-stories-new-approach/,2015-01-05 12:38:06,1,0,0,1,0,0,0,0,0
