status_id,status_message,link_name,status_type,status_link,status_published,num_reactions,num_comments,num_shares,num_likes,num_loves,num_wows,num_hahas,num_sads,num_angrys
229475497245882_377236049136492,"Daily Roundup, May 1: Marco Rubio right on another policy issue; Japan's prime minister reinforces U.S. friendship; and more… http://ow.ly/2Y5HQy","Daily Roundup, May 1: Marco Rubio right on another policy issue; Japan's...",link,http://ow.ly/2Y5HQy,2015-05-01 00:01:08,0,0,0,0,0,0,0,0,0
229475497245882_377229675803796,Poarch Creek gambling can boost long-term reforms http://ow.ly/2Y5FG1,Poarch Creek gambling can boost long-term reforms ⋆ Quin Hillyer,link,http://ow.ly/2Y5FG1,2015-04-30 23:02:47,0,0,0,0,0,0,0,0,0
229475497245882_376908375835926,"Daily Roundup, April 30: A 2-hour life makes a huge impact; the Supreme Court weighing marriage decision; and more… http://ow.ly/2Y2VWQ","Daily Roundup, April 30: A 2-hour life makes a huge impact; the Supreme...",link,http://ow.ly/2Y2VWQ,2015-04-29 23:02:14,0,0,0,0,0,0,0,0,0
229475497245882_376898739170223,It's a wonderful world http://ow.ly/2Y2SyP,It's a wonderful world ⋆ Quin Hillyer,link,http://ow.ly/2Y2SyP,2015-04-29 22:03:30,0,0,0,0,0,0,0,0,0
229475497245882_376852839174813,Georgetown exemplifies decline in higher education http://ow.ly/2Y2qS1,Georgetown exemplifies decline in higher education ⋆ Quin Hillyer,link,http://ow.ly/2Y2qS1,2015-04-29 18:01:04,0,0,0,0,0,0,0,0,0
229475497245882_376456272547803,Why the Saints should trade down http://ow.ly/2XYTnB,Why the Saints should trade down - Quin Hillyer,link,http://ow.ly/2XYTnB,2015-04-28 12:05:24,0,0,0,0,0,0,0,0,0
229475497245882_376296935897070,Justice Kennedy and Marriage http://ow.ly/2XXki3,Justice Kennedy and Marriage - Quin Hillyer,link,http://ow.ly/2XXki3,2015-04-27 23:01:09,0,0,0,0,0,0,0,0,0
229475497245882_376068652586565,Rand Paul vs. Congressional Transparency http://ow.ly/2XV5Ff,Rand Paul vs. Congressional Transparency - Quin Hillyer,link,http://ow.ly/2XV5Ff,2015-04-27 08:04:08,0,0,0,0,0,0,0,0,0
229475497245882_375402975986466,"Sunday Reflections, April 26 http://ow.ly/2XRkI7","Sunday Reflections, April 26 - Quin Hillyer",link,http://ow.ly/2XRkI7,2015-04-25 12:00:47,0,0,0,0,0,0,0,0,0
229475497245882_375020789358018,"Daily Round-tripper, April 24: Willie Mays' take on A-Rod; Why 2016 is so important; and more… http://ow.ly/2XOEMj","Daily Round-tripper, April 24: Willie Mays' take on A-Rod; Why 2016 is...",link,http://ow.ly/2XOEMj,2015-04-24 08:00:57,0,0,0,0,0,0,0,0,0
229475497245882_374650896061674,State flat tax proposal makes a lot of sense http://ow.ly/2XMDwW,Flat tax proposal makes a lot of sense - Quin Hillyer,link,http://ow.ly/2XMDwW,2015-04-23 13:01:22,1,0,0,1,0,0,0,0,0
229475497245882_374622179397879,"Daily Roundup, April 23: Immigrant numbers hit 8-year high; GOP leadership is anti-conservative;…and more http://ow.ly/2XMqAK","Daily Roundup, April 23: Immigrant numbers hit 8-year high; GOP...",link,http://ow.ly/2XMqAK,2015-04-23 11:04:09,0,0,0,0,0,0,0,0,0
229475497245882_374437792749651,"Saints mock draft, version 2 http://ow.ly/2XKW60","Saints mock draft, version 2 - Quin Hillyer",link,http://ow.ly/2XKW60,2015-04-22 21:04:06,0,0,0,0,0,0,0,0,0
229475497245882_373953736131390,"Daily Roundup, April 21: Government confiscating property; Mike Huckabee on Medicare; and more… http://ow.ly/2XFYyY","Daily Roundup, April 21: - Quin Hillyer",link,http://ow.ly/2XFYyY,2015-04-21 07:03:13,0,0,0,0,0,0,0,0,0
229475497245882_373573582836072,"Saints mock draft, version 1 http://ow.ly/2XDqGs","Saints mock draft, version 1 - Quin Hillyer",link,http://ow.ly/2XDqGs,2015-04-20 10:04:52,0,0,0,0,0,0,0,0,0
229475497245882_373538276172936,State shouldn't collect money for unions in Louisiana http://ow.ly/2XDaaI,State shouldn't collect money for unions in Louisiana - Quin Hillyer,link,http://ow.ly/2XDaaI,2015-04-20 09:03:13,0,0,0,0,0,0,0,0,0
229475497245882_373201849539912,"Sunday Reflections, April 19 http://ow.ly/2XAw3K","Sunday Reflections, April 19 - Quin Hillyer",link,http://ow.ly/2XAw3K,2015-04-19 08:04:23,0,0,0,0,0,0,0,0,0
229475497245882_372357646290999,"Daily Roundup, April 17: Like in 2008, Hillary isn't a done deal; US military Christians face hostility from Obama Admin.; and more… http://ow.ly/2XvWbD","Daily Roundup, April 17: Like in 2008, Hillary isn't a done deal; US...",link,http://ow.ly/2XvWbD,2015-04-17 07:05:15,0,0,0,0,0,0,0,0,0
229475497245882_372026926324071,"Daily Roundup, April 16: DFW media attacks female Hillary critic; ISIS operating in Mexico;…and more http://ow.ly/2Xt7Eh","Daily Roundup, April 16: DFW media attacks female Hillary critic; ISIS...",link,http://ow.ly/2Xt7Eh,2015-04-16 08:05:59,0,0,0,0,0,0,0,0,0
229475497245882_371165639743533,Hillary Clinton offers America nothing but indigestion http://ow.ly/2XmGxY,Hillary Clinton offers America nothing but indigestion - Quin Hillyer,link,http://ow.ly/2XmGxY,2015-04-14 07:02:11,0,0,0,0,0,0,0,0,0
229475497245882_370744156452348,"Daily Roundup, April 13: A frightening Dem. alternative to Hillary; Obama's 20-month Iran deal; and more… http://ow.ly/2XjaMQ","Daily Roundup, April 13: A frightening Dem. alternative to Hillary;...",link,http://quinhillyer.com/daily-roundup-april-13-a-frightening-dem-alternative-to-hillary-obamas-20-month-iran-deal-and-more/,2015-04-13 07:02:00,0,0,0,0,0,0,0,0,0
229475497245882_370731019786995,Louisiana's Religious Freedom bill packs a punch http://ow.ly/2Xj4ZZ,Louisiana's Religious Freedom bill packs a punch - Quin Hillyer,link,http://quinhillyer.com/louisianas-religious-freedom-bill-packs-a-punch/,2015-04-13 06:03:22,0,0,0,0,0,0,0,0,0
229475497245882_370593623134068,"Sunday Reflections, April 12 http://ow.ly/2XhVIr","Sunday Reflections, April 12 - Quin Hillyer",link,http://quinhillyer.com/sunday-reflections-april-12/,2015-04-12 19:04:56,0,0,0,0,0,0,0,0,0
229475497245882_369477189912378,Special-issue Daily Roundup! Lawless prosecutors run amuck (April 10) http://ow.ly/2Xbfmy,Special-issue Daily Roundup! Lawless prosecutors run amuck (April 10) -...,link,http://ow.ly/2Xbfmy,2015-04-09 23:02:52,0,0,0,0,0,0,0,0,0
229475497245882_369255773267853,"Hillary Clinton's Private Server A Foreign Spy Magnet, by J. Michael Waller Mobile's own Alex Pappas scored a great interview with former vice-president Cheney: 'Not Guilty Of Any Crime': Dick […]

The post Daily Roundup, April 9: Hillary's email …","Daily Roundup, April 9: Hillary's email server attracted spies; Scooter Libby's innocence proven? and more…",link,http://quinhillyer.com/daily-roundup-april-9-hillarys-email-server-attracted-spies-scooter-libbys-innocence-proven-and-more/,2015-04-09 06:56:00,0,0,0,0,0,0,0,0,0
229475497245882_368680529992044,"As if more evidence was needed, the recent flap over Indiana's religious freedom law overtly reveals (again) the Political Left owns clear title to the Mainstream Media's soul. A few […]

The post Religious freedom law further reveals Media's …",Religious freedom law further reveals Media's left-wing soul,link,http://quinhillyer.com/religious-freedom-law-further-reveals-medias-left-wing-soul/,2015-04-07 09:12:35,1,0,0,1,0,0,0,0,0
229475497245882_368664873326943,"What Does the Shroud of Turin Prove about Easter?, by Myra Adams Seder Pointers, by Jay D. Homnick Indiana Religious Freedom Act in Accord With Traditional American Toleration, by Michael […]

The post Daily Roundup, April 7; What does the Shroud of …","Daily Roundup, April 7; What does the Shroud of Turin prove? Indiana's RFRA law misrepresented, and more…",link,http://quinhillyer.com/daily-roundup-april-7-what-does-the-shroud-of-turin-prove-indianas-rfra-law-misrepresented-and-more/,2015-04-07 08:31:09,0,0,0,0,0,0,0,0,0
229475497245882_368383756688388,"Easter is a time for celebrating comebacks and resurrections. While New Orleans isn't currently where natives and residents want it, the city certainly is coming back. In the Easter spirit, […]

The post New Orleans' post-Katrina comeback worthy of …",New Orleans' post-Katrina comeback worthy of Easter celebration,link,http://quinhillyer.com/new-orleans-post-katrina-comeback-worthy-of-easter-celebration/,2015-04-06 13:19:08,0,0,0,0,0,0,0,0,0
229475497245882_367879690072128,"I take the reading today not from what is technically an Easter Day reading, but from the Catholic Church's liturgy for the Easter Vigil held on Saturday night. It seems […]

The post Easter Sunday Reflections appeared first on Quin Hillyer.",Easter Sunday Reflections,link,http://quinhillyer.com/easter-sunday-reflections/,2015-04-05 04:07:00,0,0,0,0,0,0,0,0,0
229475497245882_367690030091094,"For the second time in six weeks (the first time was here), I found a Wall Street Journal ""news"" story so biased as to merit focused condemnation. This time, the […]

The post WSJ: Scare quotes for ""religious freedom,"" not for ""gay rights"" appeared …","WSJ: Scare quotes for ""religious freedom,"" not for ""gay rights""",link,http://quinhillyer.com/wsj-scare-quotes-for-religious-freedom-not-for-gay-rights/,2015-04-04 11:49:36,0,0,0,0,0,0,0,0,0
229475497245882_367358493457581,"Crucifixion: It's Not Ancient History Anymore, by Deroy Murdock 'Doc Fix' is good fiscal medicine, by Quin Hillyer We're going to eminent domain you, and then we're going to bar […]

The post Daily Roundup, April 3: ISIS crucifying enemies, …","Daily Roundup, April 3: ISIS crucifying enemies, literally; Sessions/Shelby should help ""Doc fix"", and more…",link,http://quinhillyer.com/daily-roundup-april-3-isis-crucifying-enemies-literally-sessionsshelby-should-help-doc-fix-and-more/,2015-04-03 10:54:46,0,0,0,0,0,0,0,0,0
229475497245882_366956806831083,"First, this cannot be stated strongly enough: The battles over religious liberty, in Indiana and elsewhere, are far more important in principle than the individual issues within each skirmish. If […]

The post Daily Roundup April 2: Religious …","Daily Roundup April 2: Religious Freedom, Jihad Academies; down with Jeb and Hillary….",link,http://quinhillyer.com/daily-roundup-april-2-religious-freedom-jihad-academies-down-with-jeb-and-hillary/,2015-04-02 03:58:52,0,0,0,0,0,0,0,0,0
229475497245882_366731066853657,"Baldwin County school officials sealed the fate of their proposed 8-mill tax hike, along with renewal of another four mills (which really stings), by their high-handed, presumptuous arrogance in using taxpayer dollars […]

The post Baldwin Officials …",Baldwin Officials Earned Citizens' Rejection,link,http://quinhillyer.com/baldwin-officials-earned-citizens-rejection/,2015-04-01 09:03:53,2,0,2,2,0,0,0,0,0
229475497245882_366423996884364,"Conservatives, Please Stop Trashing the Liberal Arts, by Christopher J. Scalia You are probably breaking the law right now, by Glenn Harlan Reynolds Remembrance of Clintons Past, by George Will […]

The post Daily Roundup March 31; Too many laws to …","Daily Roundup March 31; Too many laws to keep track, a review of Clinton trainwrecks, and more…",link,http://quinhillyer.com/daily-roundup-march-31-too-many-laws-to-keep-track-a-review-of-clinton-trainwrecks-and-more/,2015-03-31 10:32:10,0,0,0,0,0,0,0,0,0
229475497245882_366064450253652,"Now that Louisiana Gov. Bobby Jindal is engaging the La. legislature to fight the Common Core educational agenda, Quin Hillyer reminds us why Common Core is so misguided. Don't use […]

The post Don't use Common Core math to count the Core's …",Don't use Common Core math to count the Core's deficiencies,link,http://quinhillyer.com/dont-use-common-core-math-to-count-the-cores-deficiencies/,2015-03-30 07:55:31,0,0,0,0,0,0,0,0,0
229475497245882_365858303607600,"The story of Palm Sunday, and of the Passion (which is Palm Sunday's traditional Gospel reading, is all too familiar. So forgive, if you will, a non-traditional take on it, […]

The post Palm Sunday Reflections appeared first on Quin Hillyer.",Palm Sunday Reflections,link,http://quinhillyer.com/palm-sunday-reflections/,2015-03-29 14:11:26,0,0,0,0,0,0,0,0,0
229475497245882_365081700351927,"Storm relief bill should go down the drain: opinion, by Quin Hillyer

The post Storm relief bill will actually hurt those needing relief appeared first on Quin Hillyer.",Storm relief bill will actually hurt those needing relief,link,http://quinhillyer.com/storm-relief-bill-will-actually-hurt-those-needing-relief/,2015-03-27 09:28:54,0,0,0,0,0,0,0,0,0
229475497245882_364885753704855,"The Supreme Court has made an utter mess of legislative redistricting, for many years. The court can't seem to make up its mind if, or under what circumstances, the racial […]

The post In Bama redistricting case, Supreme Court makes mess appeared …","In Bama redistricting case, Supreme Court makes mess",link,http://quinhillyer.com/in-bama-redistricting-case-supreme-court-makes-mess/,2015-03-26 18:42:04,0,0,0,0,0,0,0,0,0
229475497245882_364719450388152,"I offer some wide-ranging reading today (just click on the red links). As usual, no endorsement of any particular idea is implied. Breaking the budget, by Ed Feulner. David Bossie, […]

The post Daily Roundup, March 26: Jews and Christians, and black …","Daily Roundup, March 26: Jews and Christians, and black armadillos",link,http://quinhillyer.com/daily-roundup-march-26-jews-and-christians-and-black-armadillos/,2015-03-26 07:21:29,0,0,0,0,0,0,0,0,0
229475497245882_364146823778748,"At NRO today, I give kudos to Speaker John Boehner and various committee chiefs who are pushing some really good legislation, in a bipartisan way, that achieves Medicare reforms people […]

The post Congress gets one right! This is good medicine …",Congress gets one right! This is good medicine,link,http://quinhillyer.com/congress-gets-one-right-this-is-good-medicine/,2015-03-24 12:23:20,0,0,0,0,0,0,0,0,0
229475497245882_363962910463806,"Tax reform can't wait another year, by Quin Hillyer

The post Louisiana tax reform needed now appeared first on Quin Hillyer.",Louisiana tax reform needed now,link,http://quinhillyer.com/louisiana-tax-reform-needed-now-2/,2015-03-23 23:34:12,0,0,0,0,0,0,0,0,0
229475497245882_363957127131051,"Obama's Iran Agenda, by Stephen F. Hayes … and… Iranian Vulnerability, by Lee Smith Other good reading: Unhappy birthday, Obamacare: Five years after its signing, the Affordable Care Act is […]

The post Daily Roundup, March 24; Obama's Iran …","Daily Roundup, March 24; Obama's Iran Strategy, Happy Birthday Obamacare, and more….",link,http://quinhillyer.com/daily-roundup-march-24-obamas-iran-strategy-happy-birthday-obamacare-and-more/,2015-03-23 23:04:41,0,0,0,0,0,0,0,0,0
229475497245882_363952553798175,"It seems the GOP leadership is always a step behind, a step slow, or not anticipating their opponent's next (often predictable) move. Whoever is calling the shots, needs a seat […]

The post Message to the GOP: Stop playing checkers, you're behind …","Message to the GOP: Stop playing checkers, you're behind the rest of the class",link,http://quinhillyer.com/message-to-the-gop-stop-playing-checkers-youre-behind-the-rest-of-the-class/,2015-03-23 22:35:08,1,0,0,1,0,0,0,0,0
229475497245882_363705207156243,"Democratic Disarray: No love lost between Obama and his party on Capitol Hill, by Fred Barnes Federal Spending Per Household Has More Than Doubled Since 1962, by Michael Sargent ISIS […]

The post Daily Roundup, March 23; Democratic Dissarray, …","Daily Roundup, March 23; Democratic Dissarray, Exploding federal spending per household, and more….",link,http://quinhillyer.com/daily-roundup-march-23-democratic-dissarray-exploding-federal-spending-per-household-and-more/,2015-03-23 07:24:15,0,0,0,0,0,0,0,0,0
229475497245882_363591130500984,"The first lesson is Jeremiah, 31:31-34. The Psalm is 51:1-13. The epistle is Hebrews 5:5-10. The Gospel is John 12:20-33. There are so many threads in these readings to untie, […]

The post Sunday Roundup, March 22 appeared first on Quin Hillyer.","Sunday Roundup, March 22",link,http://quinhillyer.com/sunday-roundup-march-22/,2015-03-22 22:32:11,0,0,0,0,0,0,0,0,0
229475497245882_362148567311907,"Jeb Bush, Common Core cronie$, Pearson, PARCC, and your kids' privacy, by Michelle Malkin Obama's rude snub of Netanyahu, by Jennifer Rubin Wanted: A budget-cutting president, by Donald Lambro Here […]

The post Daily Roundup, March 19; Michelle …","Daily Roundup, March 19; Michelle Malkin's take on Jeb Bush, Obama's lack of manners, and more….",link,http://quinhillyer.com/daily-roundup-march-19-michelle-malkins-take-on-jeb-bush-obamas-lack-of-manners-and-more/,2015-03-18 23:48:16,1,0,1,1,0,0,0,0,0
229475497245882_361984010661696,"(THIS COLUMN IS AN EXCLUSIVE HERE AT QUINHILLYER.COM) by Quin Hillyer Is Alabama's 80 year-old U.S. Sen. Richard Shelby a ""shakedown"" artist? State House Speaker Mike Hubbard says so. […]

The post Shelby's Shakedown Shuffle appeared first on Quin …",Shelby's Shakedown Shuffle,link,http://quinhillyer.com/shelbys-shakedown-shuffle/,2015-03-18 11:27:51,0,0,0,0,0,0,0,0,0
229475497245882_361946390665458,"As usual, click on the links, in red. Responding to an article about how being nice to women (or, better yet, chivalrous) somehow is a form of sexism, I responded […]

The post Daily Roundup, March 18 appeared first on Quin Hillyer.","Daily Roundup, March 18",link,http://quinhillyer.com/daily-roundup-march-18/,2015-03-18 09:58:56,0,0,0,0,0,0,0,0,0
229475497245882_361210537405710,"With a new U.S. president less than 2 years away, Israeli citizens voting in their own upcoming election should prioritize their national security above Pres. Obama's personal political whims. Quin […]

The post Quin Column: Isrealis should vote for …","Quin Column: Isrealis should vote for their long-term survival, not U.S.'s short-term foreign policy",link,http://quinhillyer.com/quin-column-isrealis-should-vote-for-their-long-term-survival-not-u-s-s-short-term-foreign-policy/,2015-03-16 07:59:40,0,0,0,0,0,0,0,0,0
229475497245882_361204584072972,"The Louisiana state legislature can fix the state's budget problem if it acts like big boys and girls, and exercises its basic Constitutional responsibility. The question is, will it? Quin […]

The post Quin Column: Legislature Need Backbone for …",Quin Column: Legislature Need Backbone for Budget,link,http://quinhillyer.com/quin-column-legislature-need-backbone-for-budget/,2015-03-16 07:29:49,0,0,0,0,0,0,0,0,0
229475497245882_360620517464712,"The first lesson is Numbers 21:4-9. The Psalm is 107: 1-3 and 17-22; the epistle is Ephesians 2:1-10. The Gospel is John 3:14-21. It has often been said, not without […]

The post Sunday Reflections, March 15 appeared first on Quin Hillyer.","Sunday Reflections, March 15",link,http://quinhillyer.com/sunday-reflections-march-15/,2015-03-14 17:30:59,0,0,0,0,0,0,0,0,0
229475497245882_360102147516549,"Hillary Clinton Is Still Violating the Law and the Justice Department Should Take Custody of the Server, by Andrew C. McCarthy Obama Gives Sisi the Netanyahu Treatment, by Jonathan S. […]

The post Daily Roundup, March 13; Hillary still above the …","Daily Roundup, March 13; Hillary still above the law, Obama dissing another Middle East ally, and more…",link,http://quinhillyer.com/daily-roundup-march-13-hillary-still-above-the-law-obama-dissing-another-middle-east-ally-and-more/,2015-03-13 08:47:52,0,0,0,0,0,0,0,0,0
229475497245882_359899700870127,"Anybody who knows the history of the New Orleans Saints might think this statement sounds so like it's not just out of left field, but from outer space. Still, it's […]

The post The best secondary in the NFL? appeared first on Quin Hillyer.",The best secondary in the NFL?,link,http://quinhillyer.com/the-best-secondary-in-the-nfl/,2015-03-12 18:13:55,0,0,0,0,0,0,0,0,0
229475497245882_359801807546583,"Hillary's email explanation is self-contradictory – here's how (#TurnOverTheServer), by William A. Jacobson JINDAL… FOR PRESIDENT? Metastasizing troubles back home make a presidential run a laughable prospect, by Scott McKay […]

The post Daily …","Daily Roundup, March 12; Hillary's weak response, Jindal's sinking prez prospects, and more….",link,http://quinhillyer.com/daily-roundup-march-12-hillarys-weak-response-jindals-sinking-prez-prospects-and-more/,2015-03-12 11:36:18,0,0,0,0,0,0,0,0,0
229475497245882_358266444366786,"Louisiana Gov. Bobby Jindal appears to be reneging on his pledge not to raise taxes,…although he's not calling them 'taxes'. Quin Hillyer chimes in…. Jindal plays semantics on taxes, by […]

The post LA Gov. Bobby Jindal parsing language to sneak in …",LA Gov. Bobby Jindal parsing language to sneak in new taxes,link,http://quinhillyer.com/is-la-gov-bobby-jindal-channeling-al-gov-robert-bentley-with-his-tax-plan/,2015-03-09 15:06:09,0,0,0,0,0,0,0,0,0
229475497245882_358253434368087,"Netanyahu's Churchillian warning, by Charles Krauthammer Servergate Revelations Stick to Hillary, by Deroy Murdock

The post Daily Roundup, March 9; Krauthammer on Bibi's speech, Deroy Murdock on Hillary's 'Servergate', and more… appeared first on …","Daily Roundup, March 9; Krauthammer on Bibi's speech, Deroy Murdock on Hillary's 'Servergate', and more…",link,http://quinhillyer.com/daily-roundup-march-9-krauthammer-on-bibis-speech-deroy-murdock-on-hillarys-servergate-and-more/,2015-03-09 14:05:01,0,0,0,0,0,0,0,0,0
229475497245882_357830421077055,"M. Stanton Evans was not just one of the leading lights of the conservative movement and of conservative journalism; he was a founder of the movement, a lodestar, a definer […]

The post Conservative Movement Giant M. Stanton Evans, in multiple …","Conservative Movement Giant M. Stanton Evans, in multiple tributes",link,http://quinhillyer.com/587/,2015-03-08 19:48:49,0,0,0,0,0,0,0,0,0
229475497245882_357765251083572,"The readings today are: Exodus 20:1-17; Psalm 19; I Corinthians 1:18-25; John 2:13-22. The first reading is the recounting of the Ten Commandments. The Gospel is the famous scene of […]

The post Sunday Reflections, March 8 appeared first on Quin …","Sunday Reflections, March 8",link,http://quinhillyer.com/sunday-reflections-march-8/,2015-03-08 15:14:26,0,0,0,0,0,0,0,0,0
229475497245882_355801611279936,"Obamaites behaving badly by Quin Hillyer

The post Obama appointees violating contracting rules by Quin Hillyer appeared first on Quin Hillyer.",Obama appointees violating contracting rules by Quin Hillyer,link,http://quinhillyer.com/obama-appointees-violating-contracting-rules-by-quin-hillyer/,2015-03-05 15:44:53,0,0,0,0,0,0,0,0,0
229475497245882_355742331285864,"Bibi's grand slam: Boxing in Obama on Iran's nukes by John Podhoretz The Latest Clinton Scandal Is Quintessentially Hillary by Charles C. W. Cook It's an ambush by Bill McMorris […]

The post Daily Roundup, March 5: Bibi's grand slam, Hillary being …","Daily Roundup, March 5: Bibi's grand slam, Hillary being Hillary, and more…",link,http://quinhillyer.com/daily-roundup-march-5-bibis-grand-slam-hillary-being-hillary-and-more/,2015-03-05 11:30:10,0,0,0,0,0,0,0,0,0
229475497245882_355393377987426,"State Rep. Chris Pringle works to clean deadwood from the Alabama Code. Good work. And a rather humorous set of examples, if I do say so myself! It starts like […]

The post Possums, beavers and gars: Oh my! appeared first on Quin Hillyer.","Possums, beavers and gars: Oh my!",link,http://quinhillyer.com/possums-beavers-and-gars-oh-my/,2015-03-04 23:02:55,0,0,0,0,0,0,0,0,0
229475497245882_355352577991506,"For what it's worth, I heartily disagree with the first two major reported moves of the New Orleans Saints off-season: releasing running back Pierre Thomas and shopping inside linebacker Curtis […]

The post Saints off on wrong track appeared first …",Saints off on wrong track,link,http://quinhillyer.com/saints-off-on-wrong-track/,2015-03-04 20:31:26,0,0,0,0,0,0,0,0,0
229475497245882_355228098003954,"M. Stanton Evans, RIP by Steve Hayward This Man is Dangerous by Ben Stein US Military Strength in Jeopardy by Timothy H. Lee Maybe Hillary Clinton Should Retire Her White […]

The post Daily Roundup, March 4: Conservative icon dies, Ben Stein on …","Daily Roundup, March 4: Conservative icon dies, Ben Stein on Obama, and more…",link,http://quinhillyer.com/daily-roundup-march-4-conservative-icon-dies-ben-stein-on-obama-and-more/,2015-03-04 12:40:00,0,0,0,0,0,0,0,0,0
229475497245882_354446141415483,"Here's where I explain why Benjamin Netanyahu's speech on Tuesday could be one of the most important, from any foreign leader, in decades. Upon reflection, although the column doesn't explicitly […]

The post Quin Hillyer's National Review article on …",Quin Hillyer's National Review article on Netanyahu's speech,link,http://quinhillyer.com/quin-hillyers-national-review-article-on-netanyahus-speech/,2015-03-02 10:16:39,1,0,0,1,0,0,0,0,0
229475497245882_354429388083825,"a href=""http://www.realclearpolitics.com/articles/2015/02/27/netanyahus_true_electoral_rival_125721.html"" target=""_blank"".Netahyahu's true electoral rival by Caroline Glick http://www.wsj.com/articles/sorry-jeb-the-race-is-wide-open-1424994157 …","Monday's Roundup – Netanyahu's real challenger, Jeb's wake-up call, and more….",link,http://quinhillyer.com/mondays-roundup-netanyahus-real-challenger-jebs-wake-up-call-and-more/,2015-03-02 09:12:24,0,0,0,0,0,0,0,0,0
229475497245882_354171464776284,"The readings today are: Genesis 17:1-7, 15-16; Psalm 22:22-30; Romans 4:13-25; Mark 8: 31-38. The first three readings all revolve in some way around God's promise to Abraham to make […]

The post Sunday Reflections, March 1 appeared first on Quin …","Sunday Reflections, March 1",link,http://quinhillyer.com/sunday-reflections-march-1/,2015-03-01 14:11:01,0,0,0,0,0,0,0,0,0
