status_id,status_message,link_name,status_type,status_link,status_published,num_reactions,num_comments,num_shares,num_likes,num_loves,num_wows,num_hahas,num_sads,num_angrys
229475497245882_496259633900799,,"Faith: From ""Acts"" until today, religious liberty at risk ⋆ Quin Hillyer",link,http://ow.ly/mBlh5003Nqa,2016-05-09 00:18:21,1,0,0,1,0,0,0,0,0
229475497245882_494331554093607,,Conservatives STILL Against Trump ⋆ Quin Hillyer,link,http://ow.ly/8K4HMS,2016-05-03 21:16:22,2,1,0,1,0,0,0,0,1
229475497245882_493546330838796,,Trump can stumble in Indiana,link,http://ow.ly/8JZeo5,2016-05-01 15:17:31,1,1,0,0,0,0,0,0,1
229475497245882_491565174370245,,Conservatives Against Trump Applauds Cruz-Kasich Accord ⋆ Quin Hillyer,link,http://quinhillyer.com/conservatives-against-trump-applauds-cruz-kasich-accord/,2016-04-25 16:16:12,3,1,0,2,0,0,0,0,1
229475497245882_491317801061649,,U.N. group can't whitewash Israel's history ⋆ Quin Hillyer,link,http://quinhillyer.com/u-n-group-cant-whitewash-israels-history/,2016-04-24 22:16:37,2,0,0,1,0,0,0,0,1
229475497245882_488659311327498,,"Felix Veritas: Let's pay the belly-achers to just leave, now ⋆ Quin Hillyer",link,http://quinhillyer.com/felix-veritas-lets-pay-the-belly-achers-to-just-leave-now/,2016-04-17 21:03:59,2,0,4,2,0,0,0,0,0
229475497245882_486176908242405,,We all can have 'road to Damascus' experiences ⋆ Quin Hillyer,link,http://quinhillyer.com/we-all-can-have-road-to-damascus-experiences/,2016-04-10 22:16:34,0,0,0,0,0,0,0,0,0
229475497245882_486163934910369,,Roundup: News you can use ⋆ Quin Hillyer,link,http://quinhillyer.com/roundup-news-you-can-use/,2016-04-10 21:16:16,0,1,0,0,0,0,0,0,0
229475497245882_485010151692414,,Where were you when Jack charged in 1986? ⋆ Quin Hillyer,link,http://quinhillyer.com/where-were-you-when-jack-charged-in-1986/,2016-04-07 12:16:25,0,0,0,0,0,0,0,0,0
229475497245882_484807955045967,,Donald Trump is a loser ⋆ Quin Hillyer,link,http://quinhillyer.com/donald-trump-is-a-loser/,2016-04-06 22:20:52,3,1,0,2,0,0,0,0,1
229475497245882_477209862472443,,Sunday reflections: cooperation with political evil,link,http://ow.ly/3cJ7Xj,2016-03-22 13:17:52,1,1,0,0,0,0,0,0,1
229475497245882_468064250053671,,GOP candidates failed to defend religious liberty ⋆ Quin Hillyer,link,http://ow.ly/3bPPC3,2016-02-28 00:16:44,1,1,1,0,0,0,1,0,0
229475497245882_468031176723645,,Richard Shelby's outlandishly sleazy campaign ⋆ Quin Hillyer,link,http://ow.ly/3bPGix,2016-02-27 21:16:50,0,1,1,0,0,0,0,0,0
229475497245882_467980653395364,,"Trump's losses hurt others, including Alabamians",link,http://ow.ly/3bPqG6,2016-02-27 18:17:58,1,2,0,0,0,0,0,0,1
229475497245882_466329436893819,,Vote for Jackie Ziegler,link,http://ow.ly/3bCLls,2016-02-22 21:16:09,3,1,1,3,0,0,0,0,0
229475497245882_466320566894706,,On Trump... and Scalia,link,http://ow.ly/3bCGUe,2016-02-22 20:15:52,1,2,0,1,0,0,0,0,0
229475497245882_463846570475439,,"Will Alabama Choose a Marine, or a Senate veteran?",link,http://ow.ly/3bjZyK,2016-02-14 21:16:13,1,1,5,1,0,0,0,0,0
229475497245882_461882344005195,,"Manning's phenomenal record, amplified",link,http://ow.ly/3b5iMs,2016-02-08 15:16:11,1,0,0,1,0,0,0,0,0
229475497245882_461830250677071,,Trump flunks test of New Hampshire's real beliefs,link,http://ow.ly/3b4IXs,2016-02-08 11:17:03,1,0,0,1,0,0,0,0,0
229475497245882_461817284011701,,"Freedom is a central, and unique, concept in the New Testament",link,http://ow.ly/3b4ye7,2016-02-08 10:16:12,1,0,0,1,0,0,0,0,0
229475497245882_460905674102862,,GOP's struggling candidates need attitude adjustments,link,http://ow.ly/3aYbn8,2016-02-05 05:16:55,2,1,0,2,0,0,0,0,0
229475497245882_460828514110578,,Iowa was truly a dead heat,link,http://ow.ly/3aXBD2,2016-02-04 21:16:58,1,0,0,1,0,0,0,0,0
229475497245882_459831060876990,,The Flim-Flam known as Trump University ⋆ Quin Hillyer,link,http://ow.ly/3aOVJz,2016-02-01 15:18:42,1,1,0,1,0,0,0,0,0
229475497245882_459819744211455,,Sunday Reflections: Does Scripture speak to Iowans? ⋆ Quin Hillyer,link,http://ow.ly/3aONKe,2016-02-01 14:17:38,0,0,0,0,0,0,0,0,0
229475497245882_457670457759717,,"Memo to Voters: Yes, Experience Matters ⋆ Quin Hillyer",link,http://ow.ly/3axF3f,2016-01-25 12:16:29,0,1,0,0,0,0,0,0,0
229475497245882_457657191094377,,"Trump, liberal, healthcare, GOP, Voters",link,http://ow.ly/3axvDh,2016-01-25 11:16:58,1,1,0,1,0,0,0,0,0
229475497245882_452177388309024,,Sean Payton's Civics Lesson ⋆ Quin Hillyer,link,http://ow.ly/39Rpio,2016-01-08 09:16:49,1,0,0,1,0,0,0,0,0
229475497245882_452038684989561,,"Roundup: Fond remembrances, and more..... ⋆ Quin Hillyer",link,http://ow.ly/39QtXw,2016-01-07 22:17:02,0,0,0,0,0,0,0,0,0
229475497245882_451961244997305,,Requirements for a Happy 2016 ⋆ Quin Hillyer,link,http://ow.ly/39PHK0,2016-01-07 15:16:22,1,1,0,1,0,0,0,0,0
229475497245882_450938118432951,,"For Republicans, hope should Trump fear ⋆ Quin Hillyer",link,http://ow.ly/39IOmv,2016-01-04 22:16:25,1,1,0,1,0,0,0,0,0
229475497245882_450902525103177,,Trump is lucky Santorum isn't on his stage ⋆ Quin Hillyer,link,http://ow.ly/39ImVS,2016-01-04 18:16:03,2,1,0,2,0,0,0,0,0
229475497245882_443846195808810,,Sunday Reflections: Advent Joy Even Against Hellfire ⋆ Quin Hillyer,link,http://ow.ly/3989hq,2015-12-16 16:16:03,1,0,0,1,0,0,0,0,0
229475497245882_443800265813403,,"Roundup: More FACTS Against Hillary and Trump, + More... ⋆ Quin Hillyer",link,http://ow.ly/397MBA,2015-12-16 13:18:09,1,1,0,1,0,0,0,0,0
229475497245882_441468876046542,,"Trump as The Joker, Trampling the 'Little Guy' ⋆ Quin Hillyer",link,http://ow.ly/38NhyU,2015-12-07 23:16:07,1,1,0,1,0,0,0,0,0
229475497245882_441461562713940,,"The Muslim Elephant, Acknowledged ⋆ Quin Hillyer",link,http://ow.ly/38NcCU,2015-12-07 22:16:26,1,1,0,1,0,0,0,0,0
229475497245882_439220016271428,,Sunday Reflections: Advent ⋆ Quin Hillyer,link,http://ow.ly/38tdAQ,2015-11-29 16:18:06,0,0,0,0,0,0,0,0,0
229475497245882_438445356348894,,Don't Forget to Give Thanks ⋆ Quin Hillyer,link,http://ow.ly/38n7mw,2015-11-26 11:16:02,1,0,0,1,0,0,0,0,0
229475497245882_438026109724152,,Prichard Prep Gains National Attention ⋆ Quin Hillyer,link,http://ow.ly/38jhAm,2015-11-24 21:19:53,2,1,0,2,0,0,0,0,0
229475497245882_436821773177919,,"Media Dog Ben Carson, but Bite Own Tails ⋆ Quin Hillyer",link,http://ow.ly/388I9n,2015-11-20 09:16:58,1,0,0,1,0,0,0,0,0
229475497245882_436157796577650,,Coddled Collegians Need a Spanking ⋆ Quin Hillyer,link,http://ow.ly/380OGt,2015-11-17 12:16:05,4,2,0,4,0,0,0,0,0
229475497245882_435669979959765,,"Sunday Reflections: ""A Goodly Heritage"" ⋆ Quin Hillyer",link,http://ow.ly/37T6FW,2015-11-15 12:16:20,0,0,0,0,0,0,0,0,0
229475497245882_434333426760087,,Race for LA Governor Raises the Undead ⋆ Quin Hillyer,link,http://ow.ly/37pWv8,2015-11-09 22:17:05,1,0,0,1,0,0,0,0,0
229475497245882_434325170094246,,"Roundup, Nov. 10: Lotsa Really Good Stuff! ⋆ Quin Hillyer",link,http://ow.ly/37pQgZ,2015-11-09 21:17:28,0,0,0,0,0,0,0,0,0
229475497245882_434068030119960,,Fire Rob Ryan ⋆ Quin Hillyer,link,http://ow.ly/37jOk7,2015-11-08 23:16:09,0,0,0,0,0,0,0,0,0
229475497245882_432290946964335,,All Saints Day: The Football Version ⋆ Quin Hillyer,link,http://ow.ly/36HiLk,2015-11-01 23:16:41,1,0,0,1,0,0,0,0,0
229475497245882_432284373631659,,Guest column: Why Al Gore Hates Isoprene ⋆ Quin Hillyer,link,http://ow.ly/36Henb,2015-11-01 22:18:07,1,1,0,1,0,0,0,0,0
229475497245882_431668157026614,,How Boehner Got His Groove On ⋆ Quin Hillyer,link,http://ow.ly/36wQpy,2015-10-30 09:17:17,1,0,0,1,0,0,0,0,0
229475497245882_431479577045472,,Tough-on-Crime Law: History Corrected ⋆ Quin Hillyer,link,http://ow.ly/36tlDb,2015-10-29 14:18:10,0,0,0,0,0,0,0,0,0
229475497245882_430087613851335,,"Roundup: Ryan, Biden, Santorum, and More ⋆ Quin Hillyer",link,http://ow.ly/363nIi,2015-10-23 11:18:13,1,0,0,1,0,0,0,0,0
229475497245882_429369713923125,,"Felix Veritas: GOP's winning strategy - Hillary has it right, learn from...",link,http://ow.ly/35PSzR,2015-10-20 08:16:01,1,0,0,1,0,0,0,0,0
229475497245882_429284387264991,,"Sunday Reflections, 10/18/15: Uncanny Prophecy ⋆ Quin Hillyer",link,http://ow.ly/35Oqp0,2015-10-19 22:25:20,1,0,0,1,0,0,0,0,0
229475497245882_428384300688333,,The Webb That Ought to Entangle the Dems ⋆ Quin Hillyer,link,http://ow.ly/35BzIE,2015-10-15 23:18:11,1,1,0,1,0,0,0,0,0
229475497245882_427761124083984,,"The Best Golf Season in Many, Many Years ⋆ Quin Hillyer",link,http://ow.ly/35qLAy,2015-10-12 23:16:51,1,0,0,1,0,0,0,0,0
229475497245882_427753294084767,,"Great Tax Plans by Jindal, Santorum ⋆ Quin Hillyer",link,http://ow.ly/35qFVG,2015-10-12 22:17:04,1,1,1,1,0,0,0,0,0
229475497245882_426766900850073,,The Big Dividing Line: Government Compulsion ⋆ Quin Hillyer,link,http://ow.ly/35hxL7,2015-10-09 11:16:41,0,0,0,0,0,0,0,0,0
229475497245882_425930734267023,,Updated Presidential Preference Rankings ⋆ Quin Hillyer,link,http://ow.ly/3556zj,2015-10-05 17:17:53,0,1,0,0,0,0,0,0,0
229475497245882_425113304348766,,"A Speaker Must, Yes, Communicate ⋆ Quin Hillyer",link,http://ow.ly/34VhWf,2015-10-01 21:16:12,2,2,0,2,0,0,0,0,0
229475497245882_424454071081356,,"Sunday Reflections, Sept. 27: Allies for the Lord ⋆ Quin Hillyer",link,http://ow.ly/34LKbY,2015-09-28 16:16:42,0,0,0,0,0,0,0,0,0
229475497245882_423572184502878,,Ben Carson Speaks Up ⋆ Quin Hillyer,link,http://ow.ly/34C8L3,2015-09-24 17:17:23,1,1,0,1,0,0,0,0,0
229475497245882_422915111235252,,Katie Russell Throws First Pitch at Wrigley Tonight ⋆ Quin Hillyer,link,http://ow.ly/34tFEi,2015-09-21 23:16:08,0,0,0,0,0,0,0,0,0
229475497245882_422677201259043,,Saints Need Massive Shake-Up ⋆ Quin Hillyer,link,http://ow.ly/34slUB,2015-09-21 13:16:58,0,0,0,0,0,0,0,0,0
229475497245882_422407684619328,,"Sunday Reflections, Sept. 20: Delight of the World ⋆ Quin Hillyer",link,http://ow.ly/34pm5g,2015-09-20 12:16:41,0,0,0,0,0,0,0,0,0
229475497245882_421565338036896,,Roundup: Trump is just another lying politician ⋆ Quin Hillyer,link,http://ow.ly/34iobK,2015-09-17 16:17:18,0,2,0,0,0,0,0,0,0
229475497245882_421041634755933,,"Roundup, 9/16: Down with Hillary, Sanders, McConnell, and the RNC ⋆ Quin...",link,http://ow.ly/34cj6S,2015-09-15 21:16:31,0,0,0,0,0,0,0,0,0
229475497245882_420911484768948,,Don't let Hillary change the subject line ⋆ Quin Hillyer,link,http://ow.ly/34aZqQ,2015-09-15 12:16:23,2,0,0,2,0,0,0,0,0
229475497245882_419792541547509,,Trump's Fib-o-rama in Alabama ⋆ Quin Hillyer,link,http://ow.ly/340aEM,2015-09-11 11:17:57,0,0,0,0,0,0,0,0,0
229475497245882_419516751575088,,"Roundup, 9/11: Liberal Failures; Common Core Disasters.... ⋆ Quin Hillyer",link,http://ow.ly/33XLJ0,2015-09-10 16:16:50,0,0,0,0,0,0,0,0,0
229475497245882_419505748242855,,"Jindal Hits Trump, Accurately ⋆ Quin Hillyer",link,http://ow.ly/33XBRs,2015-09-10 15:17:16,0,1,0,0,0,0,0,0,0
229475497245882_418963408297089,,"""The Baron"" enters eternal rest ⋆ Quin Hillyer",link,http://ow.ly/33R5pw,2015-09-08 16:18:30,0,0,0,0,0,0,0,0,0
229475497245882_416518185208278,,"Roundup, Sept. 1: Common Core Sputters; Obama Loses Court Fights.... ⋆...",link,http://ow.ly/33tfay,2015-08-31 17:17:47,1,0,0,1,0,0,0,0,0
229475497245882_416113965248700,,Sunday Reflections: On Katrina... and more ⋆ Quin Hillyer,link,http://ow.ly/33pkAO,2015-08-30 11:16:46,0,0,0,0,0,0,0,0,0
229475497245882_415302211996542,,Roundup: Katrina Trumps Other News ⋆ Quin Hillyer,link,http://ow.ly/33iT2b,2015-08-27 16:16:40,0,0,0,0,0,0,0,0,0
229475497245882_414210495439047,,"Rick Santorum, man of substance ⋆ Quin Hillyer",link,http://ow.ly/33a2cf,2015-08-24 17:16:42,0,1,0,0,0,0,0,0,0
229475497245882_414197542107009,,Gotta Love -- (Davis Love) -- This Year in Sports! ⋆ Quin Hillyer,link,http://ow.ly/339UJV,2015-08-24 16:16:41,0,0,0,0,0,0,0,0,0
229475497245882_414187032108060,,Sunday Reflections: Integrity ⋆ Quin Hillyer,link,http://ow.ly/339MGO,2015-08-24 15:18:15,0,0,0,0,0,0,0,0,0
229475497245882_413000615560035,,Check out this link,link,http://ow.ly/331Ism,2015-08-21 09:16:20,0,1,0,0,0,0,0,0,0
229475497245882_412421698951260,,"Daily Roundup, August 20: Walker up, Hillary down ⋆ Quin Hillyer",link,http://ow.ly/32YcDr,2015-08-20 06:16:39,0,0,0,0,0,0,0,0,0
229475497245882_412000795660017,,Trump Coming to Mobile ⋆ Quin Hillyer,link,http://ow.ly/32WNPE,2015-08-19 17:17:40,1,3,0,1,0,0,0,0,0
229475497245882_411173215742775,,Sunday Reflections: Solomonic Virtue ⋆ Quin Hillyer,link,http://ow.ly/32NojR,2015-08-16 21:16:45,0,0,0,0,0,0,0,0,0
229475497245882_410238192502944,,Who Do I Like for President? ⋆ Quin Hillyer,link,http://ow.ly/32EvYM,2015-08-13 18:17:39,0,1,0,0,0,0,0,0,0
229475497245882_410229402503823,,Roundup ⋆ Quin Hillyer,link,http://ow.ly/32EpoL,2015-08-13 17:16:34,0,0,0,0,0,0,0,0,0
229475497245882_409407285919368,,The True Trump is a Gimpy Vamp ⋆ Quin Hillyer,link,http://ow.ly/32ut9v,2015-08-10 14:16:48,0,1,0,0,0,0,0,0,0
229475497245882_408172806042816,,Felix Veritas - Fiorina scores with truth about Hillary ⋆ Quin Hillyer,link,http://ow.ly/32m6pJ,2015-08-07 11:22:27,1,0,0,1,0,0,0,0,0
229475497245882_406665979526832,,"Sunday Reflections, Aug. 2: Simple Spirit, simple faith ⋆ Quin Hillyer",link,http://ow.ly/327KPM,2015-08-02 17:17:02,0,0,0,0,0,0,0,0,0
229475497245882_405428422983921,,Obama Muzzles Watchdogs ⋆ Quin Hillyer,link,http://ow.ly/321oqp,2015-07-30 12:16:28,1,0,0,1,0,0,0,0,0
229475497245882_404904866369610,,Felix Veritas: The GOP's real opportunity - The Hopeful Poor ⋆ Quin Hillyer,link,http://ow.ly/31WjFR,2015-07-28 13:17:40,0,0,0,0,0,0,0,0,0
229475497245882_404358219757608,,"Sunday Reflections, July 26: Loaves and Fishes ⋆ Quin Hillyer",link,http://ow.ly/31RI5O,2015-07-26 22:16:57,0,0,0,0,0,0,0,0,0
229475497245882_402597396600357,,"Roundup, July 21: Golf Clubs, Pitchforks and Nukes ⋆ Quin Hillyer",link,http://ow.ly/31DTtI,2015-07-20 21:17:01,0,0,0,0,0,0,0,0,0
229475497245882_401652500028180,,Felix Veritas: Trump's traction sends GOP field a message - Grow a...,link,http://ow.ly/31vD2i,2015-07-17 08:17:00,1,0,0,1,0,0,0,0,0
229475497245882_400341983492565,,"Sunday Reflections, July 12: on Psalm 24 ⋆ Quin Hillyer",link,http://ow.ly/31ixGS,2015-07-12 22:16:35,0,0,0,0,0,0,0,0,0
229475497245882_399714940221936,,"Daily Roundup, July 10: Obama's newest dumb ISIS statement; the Supreme...",link,http://ow.ly/31cXsc,2015-07-10 08:16:23,1,0,0,1,0,0,0,0,0
229475497245882_398874216972675,Felix Veritas: Liberals fighting religious freedom's past champion http://ow.ly/313oCR,Felix Veritas: Liberals fighting religious freedom's past champion ⋆...,link,http://ow.ly/313oCR,2015-07-07 07:20:31,1,0,0,1,0,0,0,0,0
229475497245882_398447927015304,"Sunday Reflections, July 5, 2015: The Call to Service http://ow.ly/30XZJk","Sunday Reflections, July 5, 2015: The Call to Service ⋆ Quin Hillyer",link,http://ow.ly/30XZJk,2015-07-05 11:09:41,1,0,0,1,0,0,0,0,0
229475497245882_397884903738273,Felix Veritas: What the American culture needs to survive http://ow.ly/30UcWj,Felix Veritas: What the American culture needs to survive ⋆ Quin Hillyer,link,http://ow.ly/30UcWj,2015-07-03 10:06:04,1,0,0,1,0,0,0,0,0
229475497245882_397862320407198,"Daily Roundup, July 3: Iran already violating nuclear deal; Jindal and The Left's hypocrisy; and more… http://ow.ly/30U6t4","Daily Roundup, July 3: Iran already violating nuclear deal; Jindal and...",link,http://ow.ly/30U6t4,2015-07-03 09:09:52,1,0,0,1,0,0,0,0,0
229475497245882_396945283832235,"Monday Reflections, June 29: Religious Liberty Threatened http://ow.ly/30JTEr","Monday Reflections, June 29: Religious Liberty Threatened ⋆ Quin Hillyer",link,http://ow.ly/30JTEr,2015-06-29 22:06:59,0,0,0,0,0,0,0,0,0
229475497245882_396806927179404,Intellectual Perfidy at the Supreme Court http://ow.ly/30IvQO,Intellectual Perfidy at the Supreme Court ⋆ Quin Hillyer,link,http://ow.ly/30IvQO,2015-06-29 12:10:31,1,0,0,1,0,0,0,0,0
229475497245882_395664763960287,"Daily Roundup, June 26: Roberts altering the Supreme Court's purpose; Obamacare wins, America loses; and more… http://ow.ly/30ABw6","Daily Roundup, June 26: Roberts altering the Supreme Court's purpose;...",link,http://ow.ly/30ABw6,2015-06-26 08:08:31,0,1,0,0,0,0,0,0,0
229475497245882_395466597313437,Chief Justice Roberts is Intellectually Dishonest http://ow.ly/30z5FI,Chief Justice Roberts is Intellectually Dishonest ⋆ Quin Hillyer,link,http://ow.ly/30z5FI,2015-06-25 18:09:40,1,1,0,1,0,0,0,0,0
229475497245882_394483664078397,"Libertarians are Pro-Market, not Pro-Business http://ow.ly/30oSqo","Libertarians are Pro-Market, not Pro-Business ⋆ Quin Hillyer",link,http://ow.ly/30oSqo,2015-06-23 00:07:21,1,0,0,1,0,0,0,0,0
229475497245882_394032754123488,"Sunday Reflections, June 21: Christ amid the storm http://ow.ly/30k6nb","Sunday Reflections, June 21: Christ amid the storm ⋆ Quin Hillyer",link,http://ow.ly/30k6nb,2015-06-21 14:17:55,0,0,0,0,0,0,0,0,0
229475497245882_393992350794195,"Sunday Reflections, June 21: Christ amid the storm http://ow.ly/30jABn","Sunday Reflections, June 21: Christ amid the storm ⋆ Quin Hillyer",link,http://ow.ly/30jABn,2015-06-21 11:06:08,0,0,0,0,0,0,0,0,0
229475497245882_393005667559530,"Roundup, June 19, 2015: Murdock on fire http://ow.ly/30dAVs","Roundup, June 19, 2015: Murdock on fire ⋆ Quin Hillyer",link,http://ow.ly/30dAVs,2015-06-18 22:12:33,0,0,0,0,0,0,0,0,0
229475497245882_392168554309908,"Daily Roundup, June 16: Denny Hastert and the Feds; Bureaucrats targeting Hillsdale College; and more… http://ow.ly/3065FZ","Daily Roundup, June 16: Denny Hastert and the Feds; Bureaucrats...",link,http://ow.ly/3065FZ,2015-06-16 17:09:07,0,0,0,0,0,0,0,0,0
229475497245882_391417717718325,Louisianans should still practice politics http://ow.ly/2ZYcWb,Louisianans should still practice politics ⋆ Quin Hillyer,link,http://ow.ly/2ZYcWb,2015-06-14 19:19:30,1,0,0,1,0,0,0,0,0
229475497245882_390714131122017,"Daily Roundup, June 12: AP history framework shows anti-American bias; Judicial originalism; and more… http://ow.ly/2ZRj69","Daily Roundup, June 12: AP history framework shows anti-American bias;...",link,http://ow.ly/2ZRj69,2015-06-12 07:11:55,0,0,1,0,0,0,0,0,0
229475497245882_389502227909874,"Sunday Reflections, June 7: Paul's themes of hope http://ow.ly/2ZCeMM","Sunday Reflections, June 7: Paul's themes of hope ⋆ Quin Hillyer",link,http://ow.ly/2ZCeMM,2015-06-07 21:10:57,0,0,0,0,0,0,0,0,0
229475497245882_388843091309121,"The US Defense Dept. should ""buy American"", especially from Disabled Vets http://ow.ly/2Zwv7M","The US Defense Dept. should ""buy American"", especially from Disabled...",link,http://ow.ly/2Zwv7M,2015-06-05 08:07:00,1,0,0,1,0,0,0,0,0
229475497245882_388228871370543,"Daily Roundup, June 3: Climate Nonsense; Obamacare replacements, and more http://ow.ly/2ZpOzT","Daily Roundup, June 3: Climate Nonsense; Obamacare replacements, and...",link,http://ow.ly/2ZpOzT,2015-06-03 01:03:46,1,0,0,1,0,0,0,0,0
229475497245882_387845468075550,Why I'm already grumpy about 2016 http://ow.ly/2Zmz0H,Why I'm already grumpy about 2016 ⋆ Quin Hillyer,link,http://ow.ly/2Zmz0H,2015-06-01 22:02:16,0,0,0,0,0,0,0,0,0
229475497245882_387256738134423,"Daily Roundup, June 1: Biden's grief; IRS perfidy; and more http://ow.ly/2Zjaed","Daily Roundup, June 1: Biden's grief; IRS perfidy; and more ⋆ Quin Hillyer",link,http://ow.ly/2Zjaed,2015-05-31 21:04:14,0,0,0,0,0,0,0,0,0
229475497245882_387139984812765,"Sunday Reflections, May 31: Nicodemus http://ow.ly/2ZiSaY","Sunday Reflections, May 31: Nicodemus ⋆ Quin Hillyer",link,http://ow.ly/2ZiSaY,2015-05-31 18:04:09,1,0,1,1,0,0,0,0,0
229475497245882_385878484938915,"Daily Roundup, May 29: Canadian Christians suffering discrimination; Do BlackLivesMatter in Baltimore?; and more… http://ow.ly/2Zec8y","Daily Roundup, May 29: Canadian Christians suffering discrimination; Do...",link,http://ow.ly/2Zec8y,2015-05-29 09:10:58,0,0,0,0,0,0,0,0,0
229475497245882_385576724969091,"Roundup for Thursday, May 28: A genocide of Christians; and more http://ow.ly/2ZbvfI","Roundup for Thursday, May 28: A genocide of Christians; and more ⋆ Quin...",link,http://ow.ly/2ZbvfI,2015-05-28 09:06:50,0,0,0,0,0,0,0,0,0
229475497245882_385074221686008,"Daily Roundup, May 26: Huckabee fostering gov't. cynicism?; Walter Williams on today's black tragedy; and more… http://ow.ly/2Z5ogS","Daily Roundup, May 26: Huckabee fostering gov't. cynicism?; Walter...",link,http://ow.ly/2Z5ogS,2015-05-26 07:08:25,0,0,0,0,0,0,0,0,0
229475497245882_384959345030829,Alienated by Cultural Confusion http://ow.ly/2Z41wH,Alienated by Cultural Confusion ⋆ Quin Hillyer,link,http://ow.ly/2Z41wH,2015-05-25 17:02:55,2,0,0,2,0,0,0,0,0
229475497245882_384690541724376,"Daily Roundup, May 25: Broken windows; broken road funding; and more http://ow.ly/2Z2lO7","Daily Roundup, May 25: Broken windows; broken road funding; and more ⋆...",link,http://ow.ly/2Z2lO7,2015-05-25 02:09:06,0,0,0,0,0,0,0,0,0
229475497245882_384633748396722,"Sunday Reflections, May 24 http://ow.ly/2Z23Jc","Sunday Reflections, May 24 ⋆ Quin Hillyer",link,http://ow.ly/2Z23Jc,2015-05-24 22:07:39,0,0,0,0,0,0,0,0,0
229475497245882_384613425065421,Jindal is wise to focus on religious liberty http://ow.ly/2Z1Nm2,Jindal is wise to focus on religious liberty ⋆ Quin Hillyer,link,http://ow.ly/2Z1Nm2,2015-05-24 19:17:15,0,0,0,0,0,0,0,0,0
229475497245882_383963478463749,"Daily Roundup May 22: Militarizing local police; Obama Admin declares disciplining unruly students ""racist""; and more… http://ow.ly/2YXdei",Daily Roundup May 22: Militarizing local police; Obama Admin declares...,link,http://ow.ly/2YXdei,2015-05-22 09:08:04,0,0,0,0,0,0,0,0,0
229475497245882_383798075146956,"Daily Roundup, May 21: Benghazi facts slowly seeping out; NASA data debunks some global warming claims; and more… http://ow.ly/2YUOUh","Daily Roundup, May 21: Lindsey Graham's questionable statement; NASA...",link,http://ow.ly/2YUOUh,2015-05-21 11:07:08,0,0,0,0,0,0,0,0,0
229475497245882_383131578546939,"Facing the heat, the real Jeb is stepping forward http://ow.ly/2YOvsd","Facing the heat, the real Jeb is stepping forward ⋆ Quin Hillyer",link,http://ow.ly/2YOvsd,2015-05-19 08:05:11,0,0,0,0,0,0,0,0,0
229475497245882_382384431954987,Louisiana legislature's stumbles and fumbles http://ow.ly/2YLVtP,Louisiana legislature's stumbles and fumbles ⋆ Quin Hillyer,link,http://ow.ly/2YLVtP,2015-05-18 11:03:09,0,0,0,0,0,0,0,0,0
229475497245882_381831515343612,"Sunday Reflections, May 17: On Discipleship http://ow.ly/2YJRjL","Sunday Reflections, May 17: On Discipleship ⋆ Quin Hillyer",link,http://ow.ly/2YJRjL,2015-05-17 18:01:30,0,0,0,0,0,0,0,0,0
229475497245882_381103188749778,"Daily Roundup, May 15: Yes, I would have ousted Saddam; Jeb Bush's horrible week; and more… http://ow.ly/2YF7Ij","Daily Roundup, May 15: Yes, I would have ousted Saddam; Jeb Bush's...",link,http://ow.ly/2YF7Ij,2015-05-15 07:07:52,0,0,0,0,0,0,0,0,0
229475497245882_380893388770758,"Daily Roundup, May 14: Tiger Woods reaches out to a young, struggling fan; Louisiana GOP caving at every turn; and more… http://ow.ly/2YCy5X","Daily Roundup, May 14: Tiger Woods reaches out to a young, struggling...",link,http://ow.ly/2YCy5X,2015-05-14 08:02:15,0,0,0,0,0,0,0,0,0
229475497245882_380214248838672,"Daily Roundup, May 12: Liberal gestapo tactics stifle debate; Democrats against Obamacare tax; and more… http://ow.ly/2YwQwo","Daily Roundup, May 12: Liberal gestapo tactics stifle debate; Democrats...",link,http://ow.ly/2YwQwo,2015-05-12 07:13:21,0,0,0,0,0,0,0,0,0
229475497245882_380085718851525,In golf: Game on! http://ow.ly/2YvfrY,In golf: Game on! ⋆ Quin Hillyer,link,http://ow.ly/2YvfrY,2015-05-11 16:05:03,0,0,0,0,0,0,0,0,0
229475497245882_380078138852283,"Sunday Reflections, May 10 (a day late) http://ow.ly/2Yv1VG","Sunday Reflections, May 10 (a day late) ⋆ Quin Hillyer",link,http://ow.ly/2Yv1VG,2015-05-11 15:01:10,0,0,0,0,0,0,0,0,0
229475497245882_379998348860262,"Daily Roundup, May 11: Obama releasing illegal-alien convicts; Improving voter turnout; and more…. http://ow.ly/2YtKv1","Daily Roundup, May 11: Obama releasing illegal-alien convicts; Improving...",link,http://ow.ly/2YtKv1,2015-05-11 08:06:13,0,0,0,0,0,0,0,0,0
229475497245882_379384292255001,Get rid of personnel boards in Mobile and Jefferson counties http://ow.ly/2YnKTP,Get rid of personnel boards in Mobile and Jefferson counties ⋆ Quin Hillyer,link,http://ow.ly/2YnKTP,2015-05-08 09:02:04,0,0,0,0,0,0,0,0,0
229475497245882_379371945589569,"Daily Roundup, May 8: Huckabee's not-so-sterling record; Hispanics ready for the GOP in 2016; and more… http://ow.ly/2YnCfu","Daily Roundup, May 8: Huckabee's not-so-sterling record; Hispanics ready...",link,http://ow.ly/2YnCfu,2015-05-08 08:01:13,0,0,0,0,0,0,0,0,0
229475497245882_378893315637432,"Say, Hey! Happy Birthday! http://ow.ly/2YiCjI","Say, Hey! Happy Birthday! ⋆ Quin Hillyer",link,http://ow.ly/2YiCjI,2015-05-06 11:03:49,1,0,0,1,0,0,0,0,0
229475497245882_378600319000065,Daily Roundup May 5: GOP's weak Senate leadership shows again; Gordon College faces down intolerant leftists; and more…. http://ow.ly/2YfeK7,Daily Roundup May 5: GOP's weak Senate leadership shows again; Gordon...,link,http://ow.ly/2YfeK7,2015-05-05 08:03:12,0,0,0,0,0,0,0,0,0
229475497245882_378354819024615,"Daily Roundup, May 4: Former staffer gives Jeb backhanded compliment; Immigration test changes 'freedom of religion'; and more… http://ow.ly/2YcaBS","Daily Roundup, May 4: Former staffer gives Jeb backhanded compliment;...",link,http://ow.ly/2YcaBS,2015-05-04 08:00:45,0,0,0,0,0,0,0,0,0
229475497245882_378133952380035,"Sunday reflections, May 3 http://ow.ly/2YaViJ","Sunday reflections, May 3 ⋆ Quin Hillyer",link,http://ow.ly/2YaViJ,2015-05-03 18:03:36,0,0,0,0,0,0,0,0,0
