status_id,status_message,link_name,status_type,status_link,status_published,num_reactions,num_comments,num_shares,num_likes,num_loves,num_wows,num_hahas,num_sads,num_angrys
55076937573_10153754155947574,,"One Week to go in Donald Trump, Hillary Clinton Campaign",link,http://bit.ly/2fB8xd7,2016-11-01 11:42:57,0,0,0,0,0,0,0,0,0
55076937573_10153751251412574,,"PANIC! Democrats Dumping Hillary Clinton, Constitutional Crisis!",link,http://bit.ly/2ef7A8g,2016-10-31 11:11:33,0,0,0,0,0,0,0,0,0
55076937573_10153748528142574,,"FBI James Comey Under Attack by Loretta Lynch, Hillary Clinton",link,http://bit.ly/2ebmaxz,2016-10-30 10:18:14,0,0,0,0,0,0,0,0,0
55076937573_10153744151902574,,FBI Reopens Hillary Clinton Email Probe,link,http://bit.ly/2e65HLi,2016-10-28 18:26:55,0,0,0,0,0,0,0,0,0
55076937573_10153743400397574,,AI System Predicts Donald Trump Next President,link,http://bit.ly/2e4TxCi,2016-10-28 11:37:33,0,0,0,0,0,0,0,0,0
55076937573_10153740586792574,,WikiLeaks Exposes ′Bill Clinton Inc′ Memo,link,http://bit.ly/2eV4J1I,2016-10-27 08:17:44,0,0,0,0,0,0,0,0,0
55076937573_10153736362417574,,Two Weeks Till Election Day 2016,link,http://bit.ly/2eroIIF,2016-10-25 11:12:22,0,0,0,0,0,0,0,0,0
55076937573_10153736235052574,,Obamacare Premium Hike By Double Digits,link,http://bit.ly/2eOeW1p,2016-10-25 09:54:24,0,0,0,0,0,0,0,0,0
55076937573_10153733820027574,,"WikiLeaks Confirmed, Media Polls Rigged",link,http://bit.ly/2eygi4i,2016-10-24 11:02:58,0,0,0,0,0,0,0,0,0
55076937573_10153731089627574,,The Walking Dead Season 7 Premiere – Are You Ready?,link,http://bit.ly/2dAj0jk,2016-10-23 10:11:27,0,0,0,0,0,0,0,0,0
55076937573_10153728402292574,,Donald Trump Gettysburg Address,link,http://bit.ly/2eh0zo2,2016-10-22 10:19:15,0,0,0,0,0,0,0,0,0
55076937573_10153728402097574,,Bob Creamer and Scott Foval Resign After Project Veritas Video,link,http://bit.ly/2eEsFYx,2016-10-22 10:19:09,0,0,0,0,0,0,0,0,0
55076937573_10153723355242574,,"Donald Trump on Election Results, Won't Commit During Presidential Debate",link,http://bit.ly/2ewQGzr,2016-10-20 11:52:55,0,0,0,0,0,0,0,0,0
55076937573_10153720609877574,,Viva Las Vegas! Last 2016 Presidential Debate Tonight!,link,http://bit.ly/2eGoJKn,2016-10-19 12:16:33,0,0,0,0,0,0,0,0,0
55076937573_10153717846082574,,"Bombshells! FBI on Hillary Clinton Email Fix, Video Proof Trump Protests Staged",link,http://bit.ly/2eeJ5rq,2016-10-18 11:44:19,0,0,0,0,0,0,0,0,0
55076937573_10153714930902574,,RightPundits Book Review – 'Liberty Violated' by Christopher Green,link,http://bit.ly/2eysL7w,2016-10-17 11:29:18,0,0,0,0,0,0,0,0,0
55076937573_10153714405367574,,Obscenity: Tool of Soft Despotism,link,http://bit.ly/2e15Hi6,2016-10-17 08:35:04,0,0,0,0,0,0,0,0,0
55076937573_10153711867527574,,WikiLeaks #9 – Full Transcripts of Hillary Clinton Speeches to Goldman Sachs,link,http://bit.ly/2dYsR8Z,2016-10-16 11:28:11,0,0,0,0,0,0,0,0,0
55076937573_10153711768967574,,Donald Trump Accusers Debunked,link,http://bit.ly/2eG8sEj,2016-10-16 10:42:37,0,0,0,0,0,0,0,0,0
55076937573_10153708910007574,,"Hillary, Obama Threaten Russia With War",link,http://bit.ly/2e75LsZ,2016-10-15 12:26:47,0,0,0,0,0,0,0,0,0
55076937573_10153705817507574,,Donald Trump vs Globalists,link,http://bit.ly/2dZDsgS,2016-10-14 11:28:54,1,0,0,1,0,0,0,0,0
55076937573_10153700217422574,,More Hillary Clinton WikiLeaks Emails,link,http://bit.ly/2esbmMQ,2016-10-12 11:50:16,0,0,0,0,0,0,0,0,0
55076937573_10153700090742574,,"Donald Trump Free of Paul Ryan, Shackles Are Off!",link,http://bit.ly/2dM4YBr,2016-10-12 10:24:55,0,0,0,0,0,0,0,0,0
55076937573_10153697747217574,,RightPundits Book Review ′Guilty As Sin′ by Edward Klein,link,http://bit.ly/2ec3CiR,2016-10-11 09:44:15,0,0,0,0,0,0,0,0,0
55076937573_10153695441752574,,Donald Trump Beats Hillary Clinton in 2nd Debate,link,http://bit.ly/2dFXGix,2016-10-10 10:42:17,0,0,0,0,0,0,0,0,0
55076937573_10153692656067574,,2nd Presidential Debate Tonight in St. Louis,link,http://bit.ly/2eg3Swy,2016-10-09 09:13:08,0,0,0,0,0,0,0,0,0
55076937573_10153690399332574,,WikiLeaks Releases Excerpts from Hillary Clinton Wall Street Speeches,link,http://bit.ly/2dB2G82,2016-10-08 12:17:21,0,0,0,0,0,0,0,0,0
55076937573_10153690399132574,,Geraldo Rivera Runs Over Bill O′Reilly on Donald Trump Apology for Remarks,link,http://bit.ly/2dUFNa2,2016-10-08 12:17:14,0,0,0,0,0,0,0,0,0
55076937573_10153687883442574,,Obama Justice Department Scandal Brewing,link,http://bit.ly/2dZlZaE,2016-10-07 11:26:52,0,0,0,0,0,0,0,0,0
55076937573_10153687787837574,,"Hillary Clinton Shamed, Bullied Daughter Chelsea",link,http://bit.ly/2dRqAqf,2016-10-07 10:14:30,0,0,0,0,0,0,0,0,0
55076937573_10153685713667574,,Can Glenn Beck Blame Donald Trump?,link,http://bit.ly/2dvnONe,2016-10-06 10:56:00,0,0,0,0,0,0,0,0,0
55076937573_10153685573222574,,Hurricane Matthew 2016 Monster Storm Update,link,http://bit.ly/2dB10HV,2016-10-06 09:38:54,0,0,0,0,0,0,0,0,0
55076937573_10153683403397574,,Bill Clinton – Obamacare 'Craziest Thing In The World',link,http://bit.ly/2dxICQ0,2016-10-05 12:00:41,0,0,0,0,0,0,0,0,0
55076937573_10153683354007574,,Mike Pence Wins VP Debate 2016,link,http://bit.ly/2dsVmsR,2016-10-05 11:25:32,0,0,0,0,0,0,0,0,0
55076937573_10153680735177574,,Vice Presidential Debate Tonight!,link,http://bit.ly/2dXXObG,2016-10-04 08:36:20,0,0,0,0,0,0,0,0,0
55076937573_10153678890237574,,October Surprise – Bill Clinton Love Child!,link,http://bit.ly/2dCxjo5,2016-10-03 12:01:30,0,0,0,0,0,0,0,0,0
55076937573_10153676437187574,,NY Times Smear Job on Donald Trump Taxes,link,http://bit.ly/2dRfIwJ,2016-10-02 11:44:03,0,0,0,0,0,0,0,0,0
55076937573_10153674067657574,,"Hillary Clinton Hates Millennials – 'Baristas', 'Living in Parent's Basements'",link,http://bit.ly/2dwnCaA,2016-10-01 11:30:22,0,0,0,0,0,0,0,0,0
55076937573_10153670190817574,,"Bad Day for Obama – Congress Overrides Veto of 9-11 JASTA Bill, Says Radicals May be Offended",link,http://bit.ly/2dqeCUp,2016-09-29 17:03:27,0,0,0,0,0,0,0,0,0
55076937573_10153670190597574,,Hillary Clinton Supporter Porn Star,link,http://bit.ly/2dqf4lD,2016-09-29 17:03:21,0,0,0,0,0,0,0,0,0
55076937573_10153667363577574,,Super Rich Preppers Ready for the Trump-Apocalypse,link,http://bit.ly/2dzMqjd,2016-09-28 10:46:28,0,0,0,0,0,0,0,0,0
55076937573_10153664596862574,,Donald Trump Wins 1st Debate 2016,link,http://bit.ly/2doOcav,2016-09-27 08:08:34,0,0,0,0,0,0,0,0,0
55076937573_10153662151857574,,"Trump, Clinton Tied in Polls before 1st 2016 Presidential Debate Tonight",link,http://bit.ly/2dkWJv2,2016-09-26 08:51:06,0,0,0,0,0,0,0,0,0
55076937573_10153660204092574,,Obama used Pseudonym in Hillary Clinton Emails,link,http://bit.ly/2dhNYC4,2016-09-25 12:04:59,0,0,0,0,0,0,0,0,0
55076937573_10153660087882574,,"Mind Games – Clinton, Trump to Invite Cuban, Flowers",link,http://bit.ly/2cXEwEC,2016-09-25 11:06:28,0,0,0,0,0,0,0,0,0
55076937573_10153657852417574,,"Ted Cruz Endorses Donald Trump, or did he?",link,http://bit.ly/2cVmPFs,2016-09-24 12:57:12,0,0,0,0,0,0,0,0,0
55076937573_10153655386692574,,Brad Pitt Target of FBI Child Abuse Probe?,link,http://bit.ly/2d3GQEk,2016-09-23 11:23:57,0,0,0,0,0,0,0,0,0
55076937573_10153653172347574,,Hillary Clinton Goes Psycho – 'Why Aren't I 50 Points Ahead?' (Video),link,http://bit.ly/2cU7zWY,2016-09-22 11:46:41,0,0,0,0,0,0,0,0,0
55076937573_10153650877992574,,"Gun Super Owners, The Latest Bugaboo",link,http://bit.ly/2cVgvZb,2016-09-21 11:27:25,0,0,0,0,0,0,0,0,0
55076937573_10153648753867574,,"Obama Insane, Insulted, 'War of Narratives'",link,http://bit.ly/2d2f4Nu,2016-09-20 11:41:30,0,0,0,0,0,0,0,0,0
55076937573_10153646254637574,,Media Dopes Duped Again by Donald Trump,link,http://bit.ly/2cKcXMm,2016-09-19 09:07:59,0,0,0,0,0,0,0,0,0
55076937573_10153646159002574,,Ahmad Khan Rahami ID′d in NYC Bombing by FBI,link,http://bit.ly/2cKD58k,2016-09-19 08:13:48,0,0,0,0,0,0,0,0,0
55076937573_10153643733447574,,"Terror in America – Bombings in NY, NJ, Knife Attack at MN Mall",link,http://bit.ly/2cHEf4t,2016-09-18 07:51:35,0,0,0,0,0,0,0,0,0
55076937573_10153641606017574,,"Donald Trump Leads Polls, Hillary Clinton Panics!",link,http://bit.ly/2cFcprl,2016-09-17 10:32:05,0,0,0,0,0,0,0,0,0
55076937573_10153640480287574,,Website Issues,link,http://bit.ly/2d5bH4N,2016-09-17 00:05:23,0,0,0,0,0,0,0,0,0
55076937573_10153640480302574,,Website Issues,link,http://bit.ly/2cQL8n8,2016-09-17 00:05:23,0,0,0,0,0,0,0,0,0
55076937573_10153634922772574,,Pneumonia – More Hillary Clinton Health Problems,link,http://bit.ly/2cYwSVT,2016-09-14 14:20:39,0,0,0,0,0,0,0,0,0
55076937573_10153634922597574,,Donald Trump Outlines Child Care Plan,link,http://bit.ly/2cxMgY2,2016-09-14 14:20:33,0,0,0,0,0,0,0,0,0
55076937573_10153625131562574,,Hillary Clinton and the ′Basket of Deplorables′,link,http://bit.ly/2cjHFsr,2016-09-10 10:19:10,0,0,0,0,0,0,0,0,0
55076937573_10153620320652574,,Obama in Laos Says ′Americans Are Lazy′,link,http://bit.ly/2ccBTJ1,2016-09-08 11:31:28,0,0,0,0,0,0,0,0,0
55076937573_10153620300907574,,Trump vs Clinton in NBC Commander in Chief Forum,link,http://bit.ly/2c1U49J,2016-09-08 11:23:28,0,0,0,0,0,0,0,0,0
55076937573_10153620294307574,,Star Trek 50th Anniversary Marathon,link,http://bit.ly/2cF7ogg,2016-09-08 11:21:03,0,0,0,0,0,0,0,0,0
55076937573_10153618929937574,,A Referendum on America's Political Intelligence,link,http://bit.ly/2bZO4i2,2016-09-07 22:07:17,0,0,0,0,0,0,0,0,0
55076937573_10153617640772574,,Congress to Demand Hillary Clinton Email Probe Reopened,link,http://bit.ly/2bYf69s,2016-09-07 11:32:20,0,0,0,0,0,0,0,0,0
55076937573_10153617568002574,,"Chaos at Fox News – Gretchen Carlson lawsuit settled for $20 Million, Greta Van Susteren Out!",link,http://bit.ly/2c8bLim,2016-09-07 10:58:49,0,0,0,0,0,0,0,0,0
55076937573_10153615142122574,,"9 Weeks Till Election, Trump and Clinton in Virtual Tie",link,http://bit.ly/2c48kJn,2016-09-06 11:34:00,0,0,0,0,0,0,0,0,0
55076937573_10153615135492574,,Conservative Icon Phyllis Schlafy Dead at 92,link,http://bit.ly/2cy0A3R,2016-09-06 11:29:15,0,0,0,0,0,0,0,0,0
55076937573_10153607204602574,,Hillary Clinton Told FBI ′I Can′t Recall′,link,http://bit.ly/2bTzUcs,2016-09-03 10:45:14,0,0,0,0,0,0,0,0,0
55076937573_10153604659017574,,Ted Cruz Continues To Lose,link,http://bit.ly/2bQ9W9N,2016-09-02 11:15:59,0,0,0,0,0,0,0,0,0
55076937573_10153602524567574,,A Preview of Donaldian Diplomacy,link,http://bit.ly/2bFUAdx,2016-09-01 15:38:27,0,0,0,0,0,0,0,0,0
55076937573_10153601873292574,,"Donald Trump Mexico Trip, Immigration Speech – Presidential",link,http://bit.ly/2bLHV3a,2016-09-01 11:14:19,0,0,0,0,0,0,0,0,0
55076937573_10153599360282574,,"Bill Clinton Wants Obama′s 10,000 Syrian Refugees to Rebuild Detroit",link,http://bit.ly/2bCzOsf,2016-08-31 11:03:17,0,0,0,0,0,0,0,0,0
55076937573_10153599350037574,,FBI Finds 30 Benghazi Emails from Hillary Clinton,link,http://bit.ly/2bGZktx,2016-08-31 10:56:09,0,0,0,0,0,0,0,0,0
55076937573_10153596771947574,,More Trouble for Hillary Clinton as She Slips in Polls,link,http://bit.ly/2by4opE,2016-08-30 10:58:18,0,0,0,0,0,0,0,0,0
55076937573_10153591525532574,,Donald Trump calls for Repeal of Johnson Act,link,http://bit.ly/2brCETT,2016-08-28 11:37:11,0,0,0,0,0,0,0,0,0
55076937573_10153591525337574,,Huma  Abedin Emails Show State Dept Favors for Clinton Foundation Donors,link,http://bit.ly/2brDmk7,2016-08-28 11:37:07,0,0,0,0,0,0,0,0,0
55076937573_10153588830277574,,More WikiLeaks for Hillary Clinton Emails,link,http://bit.ly/2bsXXOw,2016-08-27 10:54:48,0,0,0,0,0,0,0,0,0
55076937573_10153588819277574,,"Hillary Clinton, Dream Builder?",link,http://bit.ly/2brIP9l,2016-08-27 10:47:45,0,0,0,0,0,0,0,0,0
55076937573_10153587776437574,,A Question for the West,link,http://bit.ly/2bXgpAw,2016-08-26 23:49:16,0,0,0,0,0,0,0,0,0
55076937573_10153586671307574,,"Dana Perino, Hillary Clinton Fear Alt-Right",link,http://bit.ly/2bpUXCT,2016-08-26 13:03:30,0,0,0,0,0,0,0,0,0
55076937573_10153586362087574,,Media Wrong on Donald Trump and Illegal Immigration,link,http://bit.ly/2bVo3LO,2016-08-26 10:43:39,0,0,0,0,0,0,0,0,0
55076937573_10153584028972574,,Hillary Clinton ′Pickle Act′ Loses TV Ratings to Rerun of ′Robot Chicken′,link,http://bit.ly/2bljAVW,2016-08-25 11:36:03,0,0,0,0,0,0,0,0,0
55076937573_10153581559207574,,Associated Press Report – Hillary Clinton Met With Paying Donors at State Dept.,link,http://bit.ly/2bNQ3AQ,2016-08-24 11:11:46,0,0,0,0,0,0,0,0,0
55076937573_10153579056777574,,"More Lies – FBI Finds Another 14,900 Hillary Clinton Email Documents",link,http://bit.ly/2c3gBmn,2016-08-23 11:23:17,0,0,0,0,0,0,0,0,0
55076937573_10153576672747574,,"Hillary Clinton Illness Rumors, Parkinson′s Disease Video",link,http://bit.ly/2bH5lqS,2016-08-22 10:42:58,0,0,0,0,0,0,0,0,0
55076937573_10153574090347574,,Donald Trump goes for Black Voters,link,http://bit.ly/2bVuXoN,2016-08-21 10:38:25,0,0,0,0,0,0,0,0,0
55076937573_10153574017767574,,Elitist Hillary Clinton Uses Private Jet to go 20 Miles,link,http://bit.ly/2bVqour,2016-08-21 10:01:09,0,0,0,0,0,0,0,0,0
55076937573_10153571183807574,,"Donald Trump in Louisiana for Flood Victims, Obama Plays Golf",link,http://bit.ly/2bBHrxb,2016-08-20 08:09:18,0,0,0,0,0,0,0,0,0
55076937573_10153569165732574,,Right Pundits Book Review – ′Scorched Earth′ by Dr. Michael Savage,link,http://bit.ly/2bmjoDS,2016-08-19 10:24:24,0,0,0,0,0,0,0,0,0
55076937573_10153569155112574,,Did Donald Trump ′Pivot′?,link,http://bit.ly/2bPpEag,2016-08-19 10:16:13,0,0,0,0,0,0,0,0,0
55076937573_10153566900882574,,Glenn Beck still a Cuck – Open Thread,link,http://bit.ly/2bg3ETI,2016-08-18 11:26:15,0,0,0,0,0,0,0,0,0
55076937573_10153564465337574,,Leaked George Soros Memo On Profiting from Refugee Crisis,link,http://bit.ly/2bsjyYJ,2016-08-17 10:58:09,0,0,0,0,0,0,0,0,0
55076937573_10153564457497574,,"'Issue One', John McLaughlin Dead at 89",link,http://bit.ly/2bshPCL,2016-08-17 10:52:06,0,0,0,0,0,0,0,0,0
55076937573_10153562073442574,,Curfew in Milwaukee Calms Down Riots,link,http://bit.ly/2bCSVEU,2016-08-16 10:19:56,0,0,0,0,0,0,0,0,0
55076937573_10153562053592574,,Battle Plan by Donald Trump on Terrorism,link,http://bit.ly/2aXHiD3,2016-08-16 10:05:18,0,0,0,0,0,0,0,0,0
55076937573_10153559864787574,,′The Walking Dead′ Season 7 Trailer Clue – Did Negan Kill Daryl?,link,http://bit.ly/2byqiZS,2016-08-15 10:45:17,0,0,0,0,0,0,0,0,0
55076937573_10153557642967574,,Obama Scares Allies with No First Use of Nuclear Weapon Protocol,link,http://bit.ly/2aLULCl,2016-08-14 11:46:20,0,0,0,0,0,0,0,0,0
55076937573_10153554984132574,,Clinton Foundation Probe Underway in 3 Cities,link,http://bit.ly/2bo43SU,2016-08-13 08:48:13,0,0,0,0,0,0,0,0,0
55076937573_10153552849752574,,A Good Week for Dr. Michael Savage,link,http://bit.ly/2b2Xtzo,2016-08-12 11:08:01,0,0,0,0,0,0,0,0,0
55076937573_10153550400522574,,Emails Show Clinton Foundation – State Dept ′Pay for Play′,link,http://bit.ly/2bjRfjL,2016-08-11 10:34:30,0,0,0,0,0,0,0,0,0
55076937573_10153550392652574,,Joe Scarborough is an Idiot,link,http://bit.ly/2aVywsk,2016-08-11 10:27:14,0,0,0,0,0,0,0,0,0
55076937573_10153547831482574,,Why Hillary Clinton is Bad for Women,link,http://bit.ly/2aG7y4I,2016-08-10 09:19:22,0,0,0,0,0,0,0,0,0
55076937573_10153547831357574,,Was Murder Victim Seth Rich the DNC Email Source for WikiLeaks?,link,http://bit.ly/2aSbaEe,2016-08-10 09:19:16,0,0,0,0,0,0,0,0,0
55076937573_10153545745297574,,Hillary Clinton Endorsed by Father of Orlando Terrorist,link,http://bit.ly/2bbIk0j,2016-08-09 10:57:06,0,0,0,0,0,0,0,0,0
55076937573_10153543582267574,,"Hillary Clinton Health Issues, Unfit for the White House",link,http://bit.ly/2b8y62V,2016-08-08 10:25:20,0,0,0,0,0,0,0,0,0
55076937573_10153539323607574,,"Donald Trump Endorses Paul Ryan, John McCain, Kelly Ayotte",link,http://bit.ly/2b1xbm4,2016-08-06 11:50:33,0,0,0,0,0,0,0,0,0
55076937573_10153539317727574,,Welcome to the 2016 Zika Olympics in Rio,link,http://bit.ly/2aGAY5Z,2016-08-06 11:46:42,0,0,0,0,0,0,0,0,0
55076937573_10153536875887574,,"Stay Calm – Democrats, Media Can′t Stump Donald Trump",link,http://bit.ly/2aDFLFi,2016-08-05 10:07:29,0,0,0,0,0,0,0,0,0
55076937573_10153534446647574,,"Donald Trump Trounces Hillary Clinton Again, 62-38, in Bravo-TV Poll",link,http://bit.ly/2aQ4B5s,2016-08-04 07:47:26,1,0,0,1,0,0,0,0,0
55076937573_10153532602702574,,Obama Paid $400 Million Secret Ransom to Iran,link,http://bit.ly/2axGQ1A,2016-08-03 09:55:21,0,0,0,0,0,0,0,0,0
55076937573_10153530454392574,,"More WikiLeak Hillary Clinton Emails, Knew of Arms to Syria?",link,http://bit.ly/2aNdazB,2016-08-02 09:20:17,0,0,0,0,0,0,0,0,0
55076937573_10153528482452574,,Hillary Clinton Lies During Fox News Interview,link,http://bit.ly/2aJTUCY,2016-08-01 11:28:20,0,0,0,0,0,0,0,0,0
55076937573_10153526298957574,,Gary Johnson Libertarian Candidate a Socialist?,link,http://bit.ly/2aEKmaH,2016-07-31 12:02:09,0,0,0,0,0,0,0,0,0
55076937573_10153526214257574,,Oh No!  Sharknado – The 4th Awakens Premiers on SyFy Channel,link,http://bit.ly/2aEEG0g,2016-07-31 11:11:00,0,0,0,0,0,0,0,0,0
55076937573_10153526214242574,,Oh No!  Sharknado – The 4th Awakens Premiers on SyFy Channel,link,http://bit.ly/2aEEG0g,2016-07-31 11:11:00,0,0,0,0,0,0,0,0,0
55076937573_10153524000707574,,Will Democrats Pretending to be Patriots Backfire?,link,http://bit.ly/2aGuUcv,2016-07-30 11:34:36,0,0,0,0,0,0,0,0,0
55076937573_10153523995882574,,Paris Hilton Fears ISIS,link,http://bit.ly/2aEwqz2,2016-07-30 11:29:55,0,0,0,0,0,0,0,0,0
55076937573_10153521551122574,,"Hillary Clinton Speech, Boos, Heckled, Bill Falls Asleep!",link,http://bit.ly/2aA4oTD,2016-07-29 09:21:53,0,0,0,0,0,0,0,0,0
55076937573_10153519069977574,,"Donald Trump Leads in Polls, Jokes on Russia DNC Hack of Emails",link,http://bit.ly/2aAhOxD,2016-07-28 07:24:29,0,0,0,0,0,0,0,0,0
55076937573_10153517365617574,,Media Blackout of Bernie Sanders Protests at DNC Convention,link,http://bit.ly/2ahnbTf,2016-07-27 12:25:51,0,0,0,0,0,0,0,0,0
55076937573_10153514894022574,,DNC Protests Over Email Leak At Convention,link,http://bit.ly/2aecZIe,2016-07-26 11:02:17,0,0,0,0,0,0,0,0,0
55076937573_10153512745837574,,TURMOIL & LIES!  DNC Email Leak Scandal Forces Debbie Wasserman Schultz To Resign!,link,http://bit.ly/2aaTyju,2016-07-25 10:35:10,0,0,0,0,0,0,0,0,0
55076937573_10153512720247574,,"More Terror in Germany, Bombing at Ansbach Music Festival",link,http://bit.ly/2aqwqPV,2016-07-25 10:32:20,0,0,0,0,0,0,0,0,0
55076937573_10153510389527574,,CHAOS!  DNC in Disarray from Email Leaks,link,http://bit.ly/2a9HdyX,2016-07-24 09:01:18,0,0,0,0,0,0,0,0,0
55076937573_10153510389372574,,"Obama to Vote for Donald Trump, Malik Obama, That Is…",link,http://bit.ly/2a9Hge6,2016-07-24 09:01:08,0,0,0,0,0,0,0,0,0
55076937573_10153508377522574,,"Wall Street, Banks Cheer as Hillary Clinton Picks Tim Kaine for VP Amid DNC Email Scandal",link,http://bit.ly/29US8Kx,2016-07-23 08:06:19,0,0,0,0,0,0,0,0,0
55076937573_10153508371147574,,"Obama Jokes, Laughs While 9 Dead in Munich Shopping Mall Shooting Rampage",link,http://bit.ly/2a5dlki,2016-07-23 08:00:45,0,0,0,0,0,0,0,0,0
55076937573_10153506655492574,,Donald Trump to America – ′I Am Your Voice!′,link,http://bit.ly/2aiG0nQ,2016-07-22 11:41:21,0,0,0,0,0,0,0,0,0
55076937573_10153504404737574,,"Day 3 of GOP Convention – Pence, Newt, Eric Trump Hit Home Runs, Ted Cruz Gets Boos",link,http://bit.ly/2a26hc8,2016-07-21 09:37:16,0,0,0,0,0,0,0,0,0
55076937573_10153504396887574,,Milo Yiannopoulos Permanently Banned by Twitter,link,http://bit.ly/2ac7rS5,2016-07-21 09:32:45,0,0,0,0,0,0,0,0,0
55076937573_10153502290592574,,"Day 2 of Republican Convention – Trump Officially Nominated, Don Jr Wows Crowd",link,http://bit.ly/2auaL8u,2016-07-20 09:58:48,0,0,0,0,0,0,0,0,0
55076937573_10153500287292574,,Opening of 2016 RNC Convention – Melania Trump Speech vs Last Stand of Never-Trump,link,http://bit.ly/2a95jZo,2016-07-19 10:17:20,0,0,0,0,0,0,0,0,0
55076937573_10153498303687574,,"Baton Rouge Shootings, Another 6 Police Officers Ambushed",link,http://bit.ly/2a2EIyR,2016-07-18 13:54:53,0,0,0,0,0,0,0,0,0
55076937573_10153495633197574,,"Donald Trump Week at 2016 RNC Convention in Cleveland, Ohio",link,http://bit.ly/2akAAYF,2016-07-17 09:03:43,0,0,0,0,0,0,0,0,0
55076937573_10153493819302574,,"Attempted Military Coup in Turkey, What Next?",link,http://bit.ly/29KiQE9,2016-07-16 11:13:54,0,0,0,0,0,0,0,0,0
55076937573_10153493815517574,,Does Mike Pence bring ′Balance′ to Donald Trump Ticket?,link,http://bit.ly/29WZAHQ,2016-07-16 11:10:49,0,0,0,0,0,0,0,0,0
55076937573_10153491677417574,,Death Toll Rises to 84 in Nice Bastille Day Terror Truck Attack,link,http://bit.ly/29YuC0e,2016-07-15 10:19:19,0,0,0,0,0,0,0,0,0
55076937573_10153487042432574,,Will Donald Trump Pick Gov. Mike Pence as VP?,link,http://bit.ly/29HJbr8,2016-07-13 11:57:15,0,0,0,0,0,0,0,0,0
55076937573_10153487038487574,,Loretta Lynch Stonewalls Congress on Clinton Email Scandal,link,http://bit.ly/29S7hNH,2016-07-13 11:54:21,0,0,0,0,0,0,0,0,0
55076937573_10153484775887574,,"Shock Bravo-TV Poll, Trump 65, Clinton 35!",link,http://bit.ly/29MrzeP,2016-07-12 11:49:25,0,0,0,0,0,0,0,0,0
55076937573_10153482710292574,,200 Arrested in BlackLivesMatter Protests,link,http://bit.ly/29HxcJp,2016-07-11 10:45:12,0,0,0,0,0,0,0,0,0
55076937573_10153482614652574,,New Poll – Majority of Americans Disapprove of Hillary Clinton Email Decision,link,http://bit.ly/29BRHrE,2016-07-11 09:42:07,0,0,0,0,0,0,0,0,0
55076937573_10153480754882574,,Obama says We are ′Not As Divided′ – Time for ′The Great Awakening′?,link,http://bit.ly/29Gfm8f,2016-07-10 11:18:31,0,0,0,0,0,0,0,0,0
55076937573_10153478850127574,,Did the Dallas Shooting Suspect 'Red Pill' America with Rush Limbaugh's Help?,link,http://bit.ly/29wZcju,2016-07-09 11:45:40,0,0,0,0,0,0,0,0,0
55076937573_10153476668187574,,Police Ambushed in Dallas Shooting,link,http://bit.ly/29w6ByB,2016-07-08 10:02:50,0,0,0,0,0,0,0,0,0
55076937573_10153476654622574,,FBI Director James Comey Grilled by Congress,link,http://bit.ly/29UV7mt,2016-07-08 09:57:58,0,0,0,0,0,0,0,0,0
55076937573_10153470591672574,,'The Fix' WAS In – FBI Comey says No Charges,link,http://bit.ly/29u3dX6,2016-07-05 11:15:20,0,0,0,0,0,0,0,0,0
55076937573_10153470547262574,,"Week of Terror – Bombings, Murder Across the World",link,http://bit.ly/29hC9Fn,2016-07-05 10:33:55,0,0,0,0,0,0,0,0,0
55076937573_10153470519922574,,RightPundits Book Review – ′The Valentine Constitution′,link,http://bit.ly/29hzKdN,2016-07-05 10:16:24,0,0,0,0,0,0,0,0,0
55076937573_10153466268012574,,Hillary Clinton FBI Interview – Is This The End?,link,http://bit.ly/29iP6ld,2016-07-03 09:52:49,0,0,0,0,0,0,0,0,0
55076937573_10153462282522574,,"Loretta Lynch Will Approve FBI Recommendation, Whatever It Is",link,http://bit.ly/29j84dD,2016-07-01 08:54:12,0,0,0,0,0,0,0,0,0
55076937573_10153460791612574,,Is ′The Fix′ In?  Loretta Lynch Meets With Bill Clinton,link,http://bit.ly/29bcgtA,2016-06-30 11:36:55,0,0,0,0,0,0,0,0,0
55076937573_10153458635067574,,New Quinnipac Poll shows Donald Trump and Hillary Clinton in Virtual Tie,link,http://bit.ly/29p4bzA,2016-06-29 09:55:00,0,0,0,0,0,0,0,0,0
55076937573_10153458634897574,,Terror in Turkey – 41 Dead in Istanbul Ataturk Airport Attack,link,http://bit.ly/29aERQx,2016-06-29 09:54:52,0,0,0,0,0,0,0,0,0
55076937573_10153456369612574,,House GOP Benghazi Report – Scathing Rebuke,link,http://bit.ly/298jsch,2016-06-28 08:52:51,0,0,0,0,0,0,0,0,0
55076937573_10153456316592574,,"Fourth Reich – One Army, One Law, One Bank, EU Superstate",link,http://bit.ly/29kmPZF,2016-06-28 08:17:02,0,0,0,0,0,0,0,0,0
55076937573_10153454337317574,,"Fast and Furious 2, is Obama Arming Terrorists?",link,http://bit.ly/29g3ysj,2016-06-27 08:17:16,0,0,0,0,0,0,0,0,0
55076937573_10153452551892574,,Superman a Gun-Grabber? Great Caesar's Ghost!,link,http://bit.ly/28V9mYk,2016-06-26 12:11:45,0,0,0,0,0,0,0,0,0
55076937573_10153450476877574,,Brexit Contagion – More Fallout From EU Leave Vote,link,http://bit.ly/299gGzs,2016-06-25 12:11:15,0,0,0,0,0,0,0,0,0
55076937573_10153447872552574,,"Leave Wins Bretix Vote Results, David Cameron Resigns",link,http://bit.ly/28UBpts,2016-06-24 09:42:44,0,0,0,0,0,0,0,0,0
55076937573_10153445612082574,,Donald Trump calls Hillary Clinton a 'World-Class Liar',link,http://bit.ly/28UWXWA,2016-06-23 12:00:15,0,0,0,0,0,0,0,0,0
55076937573_10153445508432574,,Democratic Party House Sit In for Gun Grabber Bills,link,http://bit.ly/28SvVPM,2016-06-23 10:55:04,0,0,0,0,0,0,0,0,0
55076937573_10153443280157574,,"Brexit Vote in UK Thursday, Should They Stay or Will They Go? » Right Pundits",link,http://bit.ly/28WlGIT,2016-06-22 08:55:25,0,0,0,0,0,0,0,0,0
55076937573_10153441148852574,,Donald Trump Dismisses Corey Lewandowski » Right Pundits,link,http://bit.ly/28QPZAG,2016-06-21 08:04:21,0,0,0,0,0,0,0,0,0
55076937573_10153441140677574,,Orlando Terrorist Omar Mateen 911 Transcript Released in Full After Censorship Outrage » Right...,link,http://bit.ly/28MgeZO,2016-06-21 07:59:05,0,0,0,0,0,0,0,0,0
55076937573_10153434988432574,,Contrary to Obama – CIA John Brennan says Islamic State More Dangerous Now » Right Pundits,link,http://bit.ly/1ZYuCPL,2016-06-18 09:50:53,0,0,0,0,0,0,0,0,0
55076937573_10153430619722574,,Donald Trump Was Right About Orlando Shooting » Right Pundits,link,http://bit.ly/1ZTHwhZ,2016-06-16 08:05:01,0,0,0,0,0,0,0,0,0
55076937573_10153426774787574,,Did Donald Trump Implicate Obama in Orlando Shooting? » Right Pundits,link,http://bit.ly/1URpo3S,2016-06-14 10:55:29,0,0,0,0,0,0,0,0,0
55076937573_10153425193297574,,Orlando Nightclub Mass Shooting tied to Radical Islamic Terrorism » Right Pundits,link,http://bit.ly/1XSR7Z7,2016-06-13 15:01:56,0,0,0,0,0,0,0,0,0
