status_id,status_message,link_name,status_type,status_link,status_published,num_reactions,num_comments,num_shares,num_likes,num_loves,num_wows,num_hahas,num_sads,num_angrys
55076937573_10153422651732574,,"Nightclub of Terror – 20 Dead, 42 Wounded in Orlando Florida Mass Shooting » Right Pundits",link,http://bit.ly/1Yjqx9Z,2016-06-12 09:21:45,0,0,0,0,0,0,0,0,0
55076937573_10153420795582574,,White House Admits Clinton Under 'Criminal Investigation' » Right Pundits,link,http://bit.ly/1UJHyVe,2016-06-11 11:07:40,0,0,0,0,0,0,0,0,0
55076937573_10153418824807574,,"Hockey Legend Gordie Howe, Dead at 88 » Right Pundits",link,http://bit.ly/25S66DF,2016-06-10 12:53:03,0,0,0,0,0,0,0,0,0
55076937573_10153416157957574,,George Soros Shorts Market during Bilderberger 2016 Meeting » Right Pundits,link,http://bit.ly/1Yc1Dch,2016-06-09 10:09:04,0,1,0,0,0,0,0,0,0
55076937573_10153416071777574,,"ISIS Burns 19 Yazidi Girls Alive in Cage, Where is Obama, Hillary? » Right Pundits",link,http://bit.ly/24CJ4OE,2016-06-09 09:23:44,0,0,0,0,0,0,0,0,0
55076937573_10153414052772574,,Trump Blasts Clinton on 'Politics of Personal Enrichment' » Right Pundits,link,http://bit.ly/25MqlCu,2016-06-08 10:59:24,0,0,0,0,0,0,0,0,0
55076937573_10153412195527574,,Is the Trump U Judge the REAL Racist? » Right Pundits,link,http://bit.ly/1PELudR,2016-06-07 13:43:02,0,0,0,0,0,0,0,0,0
55076937573_10153412192317574,,Bernie Sanders to Fight on after California Primary » Right Pundits,link,http://bit.ly/1Uxm2CU,2016-06-07 13:40:34,0,0,0,0,0,0,0,0,0
55076937573_10153407968802574,,Switzerland Monthly Income Proposal is Defeated » Right Pundits,link,http://bit.ly/24qWOf7,2016-06-05 09:30:17,0,0,0,0,0,0,0,0,0
55076937573_10153406229682574,,May 2016 Jobs Report – DISMAL! » Right Pundits,link,http://bit.ly/25DKwCE,2016-06-04 10:01:48,0,0,0,0,0,0,0,0,0
55076937573_10153404479522574,,Trump Rally in San Jose Attacked by Violent Mob » Right Pundits,link,http://bit.ly/25BPOi1,2016-06-03 11:34:44,0,0,0,0,0,0,0,0,0
55076937573_10153404435672574,,Sterling Archer Dead!!! Oh-No!!! » Right Pundits,link,http://bit.ly/25BLyiA,2016-06-03 10:57:30,0,0,0,0,0,0,0,0,0
55076937573_10153402603532574,,Dalai Lama says 'Too Many' Muslim 'Refugees' in Europe » Right Pundits,link,http://bit.ly/1Uiyx5G,2016-06-02 12:20:21,0,0,0,0,0,0,0,0,0
55076937573_10153400514702574,,Donald Trump Slams Press for Dishonesty » Right Pundits,link,http://bit.ly/1Zd2SGX,2016-06-01 09:09:12,0,0,0,0,0,0,0,0,0
55076937573_10153400434487574,,Glenn Beck Suspended by SiriusXM over Guest Threat on Trump » Right Pundits,link,http://bit.ly/282RsLL,2016-06-01 08:02:09,0,0,0,0,0,0,0,0,0
55076937573_10153398863432574,,"Marco Rubio Apologizes to Donald Trump, Seeking VP Job? » Right Pundits",link,http://bit.ly/1PfP4Lm,2016-05-31 09:36:48,0,0,0,0,0,0,0,0,0
55076937573_10153396946637574,,"Memorial Day 2016 in USA as France, Germany Remember 100th Anniversary of Verdun » Right Pundits",link,http://bit.ly/1XIZrJb,2016-05-30 08:42:23,0,0,0,0,0,0,0,0,0
55076937573_10153396893562574,,Gary Johnson Picked as Libertarian Party Convention Ends in Chaos » Right Pundits,link,http://bit.ly/1X89Boi,2016-05-30 07:54:20,0,0,0,0,0,0,0,0,0
55076937573_10153393640822574,,Libertarian Party Convention 2016 Meets in Orlando to Pick Nominee » Right Pundits,link,http://bit.ly/1OTUR3G,2016-05-28 12:46:39,0,0,0,0,0,0,0,0,0
55076937573_10153389920727574,,State Department Report Slams Hillary Clinton on Emails » Right Pundits,link,http://bit.ly/1P0iVY9,2016-05-26 09:58:08,0,0,0,0,0,0,0,0,0
55076937573_10153388027052574,,Breaking Bad – Police Battle Violent Anti-Trump Protesters in Albuquerque » Right Pundits,link,http://bit.ly/1Rql9dw,2016-05-25 09:03:11,0,0,0,0,0,0,0,0,0
55076937573_10153387989777574,,Hypocrisy – Elizabeth Warren Profits on Foreclosed Homes » Right Pundits,link,http://bit.ly/1RqfUe1,2016-05-25 08:31:07,1,0,1,1,0,0,0,0,0
55076937573_10153386212667574,,Bernie Sanders War with Debbie Wasserman Schultz » Right Pundits,link,http://bit.ly/1RnhywY,2016-05-24 08:52:57,0,0,0,0,0,0,0,0,0
55076937573_10153386209127574,,New Polls Show Trump Defeating Clinton » Right Pundits,link,http://bit.ly/1TwUu0V,2016-05-24 08:50:02,0,0,0,0,0,0,0,0,0
55076937573_10153382570562574,,"Prepare for the Worst – Increases in Militias, Bunkers, and Preppers » Right Pundits",link,http://bit.ly/1TBYErQ,2016-05-22 11:37:53,0,0,0,0,0,0,0,0,0
55076937573_10153380588282574,,NRA Endorses Donald Trump » Right Pundits,link,http://bit.ly/1TqJd29,2016-05-21 10:31:19,0,0,0,0,0,0,0,0,0
55076937573_10153378983107574,,Zuckerberg Out-Cucks Glenn Beck » Right Pundits,link,http://bit.ly/1TjZGe1,2016-05-20 12:31:45,0,0,0,0,0,0,0,0,0
55076937573_10153376973177574,,Wreckage Found of Missing EgyptAir Flight MS804 » Right Pundits,link,http://bit.ly/1OPBGxt,2016-05-19 10:22:28,0,0,0,0,0,0,0,0,0
55076937573_10153375216852574,,"Sanders, Clinton Split Democratic Primary Election Results » Right Pundits",link,http://bit.ly/1OICbsS,2016-05-18 10:45:27,0,0,0,0,0,0,0,0,0
55076937573_10153371588437574,,"Sarah Palin, Newt Gingrich on Donald Trump VP Short List » Right Pundits",link,http://bit.ly/1R4e5Ds,2016-05-16 10:52:38,0,0,0,0,0,0,0,0,0
55076937573_10153371578657574,,Zuckerburg or Cuckerburg? Glenn Beck Leads Anti-Trump Meet with Facebook » Right Pundits,link,http://bit.ly/1YvGloi,2016-05-16 10:45:23,0,0,0,0,0,0,0,0,0
55076937573_10153369833247574,,Democratic Convention in Nevada Turns Violent » Right Pundits,link,http://bit.ly/1seGwtA,2016-05-15 10:50:50,0,0,0,0,0,0,0,0,0
55076937573_10153369775832574,,Students Revolt in Seattle Over ′Whiteness′ » Right Pundits,link,http://bit.ly/22b3bnf,2016-05-15 10:09:56,0,0,0,0,0,0,0,0,0
55076937573_10153367898812574,,States React to Obama Transgender Bathroom Use Rules » Right Pundits,link,http://bit.ly/1WxqozX,2016-05-14 09:56:11,0,0,0,0,0,0,0,0,0
55076937573_10153366203522574,,Did Bill Clinton Give Charity Cash to Alleged Girlfriend? » Right Pundits,link,http://bit.ly/1UYNrmq,2016-05-13 09:53:01,0,0,0,0,0,0,0,0,0
55076937573_10153364724767574,,"Donald Trump Meets With Paul Ryan, GOP Leaders » Right Pundits",link,http://bit.ly/1s1O6rr,2016-05-12 12:37:31,0,0,0,0,0,0,0,0,0
55076937573_10153362802867574,,Is Hillary Rodham Clinton Destroying the Democratic Party? » Right Pundits,link,http://bit.ly/1rVK57Z,2016-05-11 10:10:11,0,0,0,0,0,0,0,0,0
55076937573_10153361135557574,,NY Times Reports – More White House Lies on Iran Deal » Right Pundits,link,http://bit.ly/24KB0AO,2016-05-10 10:47:13,0,0,0,0,0,0,0,0,0
55076937573_10153359401077574,,Is Donald Trump a Conservative? You Betcha! Betsy Says So! » Right Pundits,link,http://bit.ly/1UN18Vi,2016-05-09 10:59:49,0,0,0,0,0,0,0,0,0
55076937573_10153356099272574,,"Alex Jones says Glenn Beck ′Evil′, ′Prancing Demon′ » Right Pundits",link,http://bit.ly/21J4r0I,2016-05-07 18:35:19,0,0,0,0,0,0,0,0,0
55076937573_10153353492832574,,"Rick Perry Endorses Donald Trump, ′Open′ to VP Job » Right Pundits",link,http://bit.ly/1Zn4LQW,2016-05-06 11:17:22,0,0,0,0,0,0,0,0,0
55076937573_10153351666032574,,Sour Grapes – George W. Bush and Daddy Won't Support Donald Trump » Right Pundits,link,http://bit.ly/21ApsL6,2016-05-05 10:45:43,0,0,0,0,0,0,0,0,0
55076937573_10153351556002574,,Romanian Hacker ′Guccifer′ Tells All to Fox News on Hillary Clinton Email Server Hack » Right...,link,http://bit.ly/1ZhUeXi,2016-05-05 09:33:09,0,0,0,0,0,0,0,0,0
55076937573_10153349809852574,,"Glenn Beck, Mark Levin, George Will, What Next? » Right Pundits",link,http://bit.ly/21wQ5QW,2016-05-04 10:05:24,0,0,0,0,0,0,0,0,0
55076937573_10153349656762574,,"Donald Trump, Bernie Sanders Win Indiana Primary, Ted Cruz Quits Race » Right Pundits",link,http://bit.ly/24qrYJ0,2016-05-04 08:19:44,0,0,0,0,0,0,0,0,0
55076937573_10153347971867574,,Ted Cruz Threatens 12-Year Old Boy With Spanking » Right Pundits,link,http://bit.ly/1rhTOFh,2016-05-03 08:54:31,0,0,0,0,0,0,0,0,0
55076937573_10153346120427574,,Donald Trump Leads Ted Cruz in Indiana Primary » Right Pundits,link,http://bit.ly/23iQVQN,2016-05-02 08:33:00,0,0,0,0,0,0,0,0,0
55076937573_10153344637557574,,Barack Obama Flops at his Last White House Correspondents′ Dinner 2016 » Right Pundits,link,http://bit.ly/1NMqWiS,2016-05-01 12:41:52,0,0,0,0,0,0,0,0,0
55076937573_10153340563537574,,John Boehner calls Lyin' Ted Cruz 'Lucifer in the Flesh' » Right Pundits,link,http://bit.ly/1NFzaZS,2016-04-29 07:41:14,0,0,0,0,0,0,0,0,0
55076937573_10153338923517574,,"Donald Trump Foreign Policy Speech – America First, Always » Right Pundits",link,http://bit.ly/1qXWQ16,2016-04-28 09:57:12,0,0,0,0,0,0,0,0,0
55076937573_10153338923322574,,"Hail Carly Fiorina, Full of Desperation, Now in the Hour of Ted Cruz's End » Right Pundits",link,http://bit.ly/1qXWRlS,2016-04-28 09:57:05,0,0,0,0,0,0,0,0,0
55076937573_10153337483857574,,"Donald Trump Sweeps April 26 Primaries, Ted Cruz – You Loose! » Right Pundits",link,http://bit.ly/1pFVK9j,2016-04-27 12:50:00,0,0,0,0,0,0,0,0,0
55076937573_10153333966577574,,Art Imitating Reality – CDC Warnings and 'Containment' » Right Pundits,link,http://bit.ly/1qMgYmX,2016-04-25 10:48:41,0,0,0,0,0,0,0,0,0
55076937573_10153333925897574,,Countdown to Oblivion – Last Day of Ted Cruz Campaign » Right Pundits,link,http://bit.ly/23VqI04,2016-04-25 10:16:01,0,0,0,0,0,0,0,0,0
55076937573_10153332130817574,,Ted Cruz Buying Delegates for $100 » Right Pundits,link,http://bit.ly/1SFzEBr,2016-04-24 10:51:48,0,0,0,0,0,0,0,0,0
55076937573_10153332085432574,,Death of ObamaCare – UnitedHealth to Opt Out » Right Pundits,link,http://bit.ly/1raicZI,2016-04-24 10:17:39,0,0,0,0,0,0,0,0,0
55076937573_10153328432977574,,Millions Mourn Prince on Earth Day 2016 (Open Thread) » Right Pundits,link,http://bit.ly/214arki,2016-04-22 09:27:49,0,0,0,0,0,0,0,0,0
55076937573_10153326652862574,,Ted Cruz Crazy – 'America Has Always Been At Her Best When She's Lying Down' » Right Pundits,link,http://bit.ly/1VmLC3t,2016-04-21 09:24:25,0,0,0,0,0,0,0,0,0
55076937573_10153324967072574,,"Trump, Clinton Win Big in New York Primary » Right Pundits",link,http://bit.ly/1STAuo1,2016-04-20 09:03:42,0,0,0,0,0,0,0,0,0
55076937573_10153322981672574,,New York State Primary Today » Right Pundits,link,http://bit.ly/1VzFFAF,2016-04-19 08:22:37,0,0,0,0,0,0,0,0,0
55076937573_10153321365922574,,"RightPundits Interview with Debbie Dooley, Delegate Candidate in Georgia for Donald Trump »...",link,http://bit.ly/1SNMyay,2016-04-18 09:28:52,0,0,0,0,0,0,0,0,0
55076937573_10153319833762574,,"Ted Cruz Steals More Delegates in Wyoming, Georgia » Right Pundits",link,http://bit.ly/1VbgqEj,2016-04-17 11:31:04,0,0,0,0,0,0,0,0,0
55076937573_10153316133612574,,Donald Trump Campaign Manager Won't Be Prosecuted » Right Pundits,link,http://bit.ly/1W3MTLm,2016-04-15 10:40:54,0,0,0,0,0,0,0,0,0
55076937573_10153316097617574,,Rush Limbaugh Admits Being Wrong on GOP Colorado Non-Vote » Right Pundits,link,http://bit.ly/23KYVw3,2016-04-15 10:07:37,0,0,0,0,0,0,0,0,0
55076937573_10153315948072574,,Hillary Clinton vs Bernie Sanders in Brooklyn Democratic Debate Brawl » Right Pundits,link,http://bit.ly/23KH4oY,2016-04-15 08:28:55,0,0,0,0,0,0,0,0,0
55076937573_10153314457567574,,"'From Caligari to Hitler', Weimar Film Documentary Aired on TCM » Right Pundits",link,http://bit.ly/1SDh2ff,2016-04-14 10:38:59,0,0,0,0,0,0,0,0,0
55076937573_10153314404807574,,Peroxide Pariah Megyn Kelly Meets With Donald Trump » Right Pundits,link,http://bit.ly/23HXVJ0,2016-04-14 09:54:21,0,0,0,0,0,0,0,0,0
55076937573_10153314344297574,,"USS Donald Cook Buzzed by Russian Jet, Again! » Right Pundits",link,http://bit.ly/1V3Pje1,2016-04-14 09:16:45,0,0,0,0,0,0,0,0,0
55076937573_10153312661407574,,Alpha Centauri Plan to Send 'Nanocraft' to Stars » Right Pundits,link,http://bit.ly/1oXGSD3,2016-04-13 10:04:31,0,0,0,0,0,0,0,0,0
55076937573_10153312484032574,,Paul Ryan says ′Count Me Out′ » Right Pundits,link,http://bit.ly/1VURW0B,2016-04-13 08:58:01,0,0,0,0,0,0,0,0,0
55076937573_10153310644332574,,"Michael Savage vs Conservative Inc, More Fallout From Colorado Non-Vote » Right Pundits",link,http://bit.ly/20yCHLK,2016-04-12 11:09:22,0,0,0,0,0,0,0,0,0
55076937573_10153308683132574,,Fear The Walking Dead Season 2 Premiere » Right Pundits,link,http://bit.ly/23oY0Ey,2016-04-11 10:37:35,0,0,0,0,0,0,0,0,0
55076937573_10153308569392574,,"RIGGED! GOP Cancels CO Vote, Bernie Sanders Wins WY, Hillary Clinton Gets More Delegates » Right...",link,http://bit.ly/1qJPH55,2016-04-11 09:36:32,0,0,0,0,0,0,0,0,0
55076937573_10153306623597574,,The Boston Globe Fakes Headline to Attack Donald Trump » Right Pundits,link,http://bit.ly/23uuCcP,2016-04-10 10:44:57,0,0,0,0,0,0,0,0,0
55076937573_10153302592272574,,"Glenn Beck Warns of Temple of Baal in NYC, America Doomed! » Right Pundits",link,http://bit.ly/23oYSWx,2016-04-08 09:44:58,0,0,0,0,0,0,0,0,0
55076937573_10153302497492574,,Bill Clinton Spars with #BlackLivesMatter over 90s Crime Law » Right Pundits,link,http://bit.ly/23oPvpM,2016-04-08 08:53:56,0,0,0,0,0,0,0,0,0
55076937573_10153300776052574,,"Crowd Cheers Donald Trump on Long Island, Ted Cruz gets Boos in the Bronx » Right Pundits",link,http://bit.ly/23l9plx,2016-04-07 10:14:03,0,0,0,0,0,0,0,0,0
55076937573_10153300666822574,,"Loch Ness-Like Creature in Thames River, Video, Pic » Right Pundits",link,http://bit.ly/1SfyNRE,2016-04-07 09:21:49,0,0,0,0,0,0,0,0,0
55076937573_10153298912452574,,Ted Cruz – Trojan Horse or CUCKoo Bird? » Right Pundits,link,http://bit.ly/1Vxhxgb,2016-04-06 12:11:47,0,0,0,0,0,0,0,0,0
55076937573_10153296476482574,,Who Will Win the 2016 Wisconsin Primary? » Right Pundits,link,http://bit.ly/1S7rpaM,2016-04-05 07:47:36,0,0,0,0,0,0,0,0,0
55076937573_10153294625547574,,The Walking Dead Season 6 Finale – Cheated or Satisfied? #WhoIsIt » Right Pundits,link,http://bit.ly/1S3se4r,2016-04-04 11:04:27,0,0,0,0,0,0,0,0,0
55076937573_10153292535207574,,Fox News Lies – I Want My Trump TV! » Right Pundits,link,http://bit.ly/1qgsEPf,2016-04-03 09:59:02,0,0,0,0,0,0,0,0,0
55076937573_10153288404687574,,"Hillary Clinton Admits, 'I Am So Sick'! » Right Pundits",link,http://bit.ly/1UxG9Xa,2016-04-01 10:16:42,0,0,0,0,0,0,0,0,0
55076937573_10153285192992574,,Donald Trump on Abortion and the Media Frenzy » Right Pundits,link,http://bit.ly/1ZNyao8,2016-03-31 10:04:39,0,0,0,0,0,0,0,0,0
55076937573_10153282278907574,,"Donald Trump Stand By His Man, Corey Lewandowski » Right Pundits",link,http://bit.ly/1RJeRtb,2016-03-30 11:24:45,0,0,0,0,0,0,0,0,0
55076937573_10153282129402574,,Why is Ted Cruz Afraid of Michael Savage? » Right Pundits,link,http://bit.ly/1q27PH0,2016-03-30 10:23:30,0,0,0,0,0,0,0,0,0
55076937573_10153278999247574,,"New Polls – Bernie Sanders Closing Gap on Hillary Clinton, Donald Trump Grows to 48% » Right Pundits",link,http://bit.ly/22L8pdu,2016-03-29 10:41:58,0,0,0,0,0,0,0,0,0
55076937573_10153275912077574,,"Bloody Easter Sunday, Christians Targeted by Terrorists » Right Pundits",link,http://bit.ly/1Sr4CKf,2016-03-28 11:03:10,0,0,0,0,0,0,0,0,0
55076937573_10153275733232574,,Will Negan Kill Daryl Dixon in The Walking Dead Season 6 Finale? » Right Pundits,link,http://bit.ly/1RKhY7q,2016-03-28 09:52:46,0,0,0,0,0,0,0,0,0
55076937573_10153272788137574,,Ted Cruz Sex Scandal – 'Cuban Mistress Crisis'? » Right Pundits,link,http://bit.ly/22F9oMm,2016-03-27 11:10:54,0,0,0,0,0,0,0,0,0
55076937573_10153266514982574,,STUPIDITY UNMATCHED!!! Obama Declares 'No Difference Between Communism and Capitalism' » Right...,link,http://bit.ly/1UObHYF,2016-03-25 12:41:27,0,0,0,0,0,0,0,0,0
55076937573_10153259931727574,,Belgium Police ID Suspects in Brussels Terror Attacks » Right Pundits,link,http://bit.ly/1RkHLzv,2016-03-23 11:34:00,0,0,0,0,0,0,0,0,0
55076937573_10153259919297574,,"Donald Trump Wins Arizona Primary, Ted Cruz Wins Utah and Jeb Bush » Right Pundits",link,http://bit.ly/1RkGTuY,2016-03-23 11:29:32,0,0,0,0,0,0,0,0,0
55076937573_10153256166917574,,"Terror in Belgium! Blasts Rip Brussels Airport, Metro Subway » Right Pundits",link,http://bit.ly/1RgzKvH,2016-03-22 08:50:56,0,0,0,0,0,0,0,0,0
55076937573_10153256111697574,,"Obama in Cuba, Disgraced by Castro » Right Pundits",link,http://bit.ly/1RguEiO,2016-03-22 08:26:11,0,0,0,0,0,0,0,0,0
55076937573_10153250606537574,,Rick Grimes for President in 2016? » Right Pundits,link,http://bit.ly/1UujXgh,2016-03-20 11:50:08,0,0,0,0,0,0,0,0,0
55076937573_10153247943752574,,National Review Drafts Enemy List of Trump Supporters » Right Pundits,link,http://bit.ly/22uggZs,2016-03-19 11:16:11,0,0,0,0,0,0,0,0,0
55076937573_10153245339707574,,"2016, The Year Democracy Died, Part 2 – Threats of Riots » Right Pundits",link,http://bit.ly/1Z9xIjT,2016-03-18 10:37:10,0,0,0,0,0,0,0,0,0
55076937573_10153240331757574,,A Super Tuesday For Donald Trump and Hillary Clinton » Right Pundits,link,http://bit.ly/22kaIUL,2016-03-16 09:07:08,0,0,0,0,0,0,0,0,0
55076937573_10153238274902574,,Another Super Tuesday Primary Election Day for 2016 » Right Pundits,link,http://bit.ly/1UwcVGo,2016-03-15 10:12:04,0,0,0,0,0,0,0,0,0
55076937573_10153236002817574,,Alicia Witt Joins Ladie's Night on 'The Walking Dead' » Right Pundits,link,http://bit.ly/1YRlxrL,2016-03-14 09:56:35,0,0,0,0,0,0,0,0,0
55076937573_10153235879612574,,German Voters Tell Angela Merkel No to Immigration » Right Pundits,link,http://bit.ly/1UsOwl6,2016-03-14 09:01:27,0,0,0,0,0,0,0,0,0
55076937573_10153233919392574,,"Attack of the Bernie People on Trump in Dayton, Kansas City » Right Pundits",link,http://bit.ly/1TFJUJJ,2016-03-13 10:45:53,0,0,0,0,0,0,0,0,0
55076937573_10153231162997574,,Donald Trump Chicago Rally Attacked by Violent Marxists » Right Pundits,link,http://bit.ly/1YKaHUs,2016-03-12 10:44:26,0,0,0,0,0,0,0,0,0
55076937573_10153226469427574,,Republican Debate Eclipsed by Ben Carson Endorsement of Donald Trump » Right Pundits,link,http://bit.ly/229jp0E,2016-03-11 13:14:41,0,0,0,0,0,0,0,0,0
55076937573_10153223113147574,,"Little Marco Rubio Campaign Crashing, Tiny Rally at Stadium » Right Pundits",link,http://bit.ly/1QGFFd5,2016-03-10 10:10:02,0,0,0,0,0,0,0,0,0
55076937573_10153221111942574,,Idaho Shooter Lunatic Arrested at White House » Right Pundits,link,http://bit.ly/1TsYq7e,2016-03-09 11:30:37,0,0,0,0,0,0,0,0,0
55076937573_10153220765602574,,"Donald Trump Scores 2016 Michigan, Mississippi and Hawaii Primary Wins » Right Pundits",link,http://bit.ly/1TLlYVp,2016-03-09 10:29:09,0,0,0,0,0,0,0,0,0
55076937573_10153218717152574,,Why I Voted For Donald J. Trump » Right Pundits,link,http://bit.ly/21Wfk2Y,2016-03-08 11:16:48,0,0,0,0,0,0,0,0,0
55076937573_10153216900287574,,"Nancy Reagan, Dead at 94, Heaven Bound » Right Pundits",link,http://bit.ly/21SC9ou,2016-03-07 10:42:37,0,0,0,0,0,0,0,0,0
55076937573_10153215098467574,,2016 Super Saturday Primary Election Results » Right Pundits,link,http://bit.ly/1YiFDed,2016-03-06 10:25:08,0,0,0,0,0,0,0,0,0
55076937573_10153213371907574,,"2016, The Year Democracy Died » Right Pundits",link,http://bit.ly/21Qwagi,2016-03-05 11:44:44,0,0,0,0,0,0,0,0,0
55076937573_10153211469972574,,Who Won the Fox News GOP Debate in Detroit? » Right Pundits,link,http://bit.ly/21KpQdE,2016-03-04 12:13:35,0,0,0,0,0,0,0,0,0
55076937573_10153209334607574,,"Hillary Clinton IT Guy, Byran Pagliano gets Immunity from FBI » Right Pundits",link,http://bit.ly/1TVxWKs,2016-03-03 12:41:09,0,0,0,0,0,0,0,0,0
55076937573_10153209172522574,,"Et Tu, Willard? Mitt Romney to Attack Donald Trump » Right Pundits",link,http://bit.ly/1QnAwXb,2016-03-03 10:42:58,0,0,0,0,0,0,0,0,0
55076937573_10153207375172574,,GOP – Chaos & Confusion? » Right Pundits,link,http://bit.ly/1TnZv0E,2016-03-02 11:01:00,0,0,0,0,0,0,0,0,0
55076937573_10153207289532574,,2016 Super Tuesday Primary Election Results » Right Pundits,link,http://bit.ly/1TS1atz,2016-03-02 10:06:34,0,0,0,0,0,0,0,0,0
55076937573_10153205580017574,,Election 2016 Super Tuesday – Will Donald Trump Win HUGE? » Right Pundits,link,http://bit.ly/1ngq5Kt,2016-03-01 10:41:41,0,0,0,0,0,0,0,0,0
55076937573_10153205476212574,,"State Dept Release Final Batch of Hillary Clinton Emails, What Next? » Right Pundits",link,http://bit.ly/1TkBw2j,2016-03-01 09:32:05,0,0,0,0,0,0,0,0,0
55076937573_10153203657462574,,"Sen. Jeff Sessions Endorses Donald Trump, GOP Elites Meltdown » Right Pundits",link,http://bit.ly/1QgiaaH,2016-02-29 10:48:59,0,0,0,0,0,0,0,0,0
55076937573_10153201843817574,,Ted Cruz and the Wilks Brothers – Misogynists? » Right Pundits,link,http://bit.ly/1Qdk1gm,2016-02-28 10:54:57,0,0,0,0,0,0,0,0,0
55076937573_10153201772447574,,Hillary Rodham Clinton Wins Landslide in South Carolina Primary » Right Pundits,link,http://bit.ly/1n7QSZs,2016-02-28 10:07:37,0,0,0,0,0,0,0,0,0
55076937573_10153199876222574,,Chris Christie Endorses Donald Trump » Right Pundits,link,http://bit.ly/1R9Y2Vb,2016-02-27 09:06:38,0,0,0,0,0,0,0,0,0
55076937573_10153198437507574,,Who Won Republican Debate Last Night? » Right Pundits,link,http://bit.ly/1R7ypo5,2016-02-26 12:00:01,0,0,0,0,0,0,0,0,0
55076937573_10153196690852574,,"Hillary Clinton Heckled – Black Youths 'Super Predators', 'Make Them Heel' » Right Pundits",link,http://bit.ly/1QHXtaK,2016-02-25 12:31:02,0,0,0,0,0,0,0,0,0
55076937573_10153196643427574,,"GOP Debate #10 Tonight on CNN – Can Rubio, Cruz Stop Donald Trump? » Right Pundits",link,http://bit.ly/21jM8Tf,2016-02-25 11:54:26,0,0,0,0,0,0,0,0,0
55076937573_10153194740202574,,Fed Judge Approves Hillary Clinton Aides to be Deposed on Emails » Right Pundits,link,http://bit.ly/1R1it6D,2016-02-24 10:18:38,0,0,0,0,0,0,0,0,0
55076937573_10153194637087574,,JACKPOT! Donald Trump Wins GOP Nevada Caucus – HUGE! » Right Pundits,link,http://bit.ly/1mXrF3G,2016-02-24 09:18:39,0,0,0,0,0,0,0,0,0
55076937573_10153193243267574,,Mark Levin Declares War on Marco Rubio » Right Pundits,link,http://bit.ly/1QAQpwM,2016-02-23 11:53:54,0,0,0,0,0,0,0,0,0
55076937573_10153193123547574,,Ted Cruz Communication Director Rick Tyler Resigns » Right Pundits,link,http://bit.ly/1Q93gka,2016-02-23 10:56:16,0,0,0,0,0,0,0,0,0
55076937573_10153191404642574,,Glenn Beck Fasting for Ted Cruz Today Only » Right Pundits,link,http://bit.ly/1QVjgG7,2016-02-22 10:12:23,0,0,0,0,0,0,0,0,0
55076937573_10153189817307574,,Donald Trump Wins South Carolina Primary! Jeb Bush Quits Race! » Right Pundits,link,http://bit.ly/24kwRkh,2016-02-21 12:52:11,0,0,0,0,0,0,0,0,0
55076937573_10153187941392574,,Voting Begins in 2016 South Carolina Primary and Nevada Caucus » Right Pundits,link,http://bit.ly/21gfzCi,2016-02-20 11:45:59,0,0,0,0,0,0,0,0,0
55076937573_10153186225247574,,Vikings Season 4 Premiere on The History Channel » Right Pundits,link,http://bit.ly/21dUYOX,2016-02-19 11:56:29,0,0,0,0,0,0,0,0,0
55076937573_10153186187737574,,Ted Cruz Lies Again on Marco Rubio Photo with Obama » Right Pundits,link,http://bit.ly/1QOiHxL,2016-02-19 11:21:55,0,0,0,0,0,0,0,0,0
55076937573_10153184584267574,,Glenn Beck Thinks God Wants Ted Cruz Elected » Right Pundits,link,http://bit.ly/1QM03GN,2016-02-18 12:37:30,0,0,0,0,0,0,0,0,0
55076937573_10153184502797574,,Tim Cook to FBI – No Unlocking Back Door for Apple iPhone » Right Pundits,link,http://bit.ly/1ou6qZb,2016-02-18 11:38:49,0,0,0,0,0,0,0,0,0
55076937573_10153182641267574,,Antonin Scalia Conspiracy Theory – Worthy of the 'X-Files'? » Right Pundits,link,http://bit.ly/1RNErin,2016-02-17 13:02:03,0,0,0,0,0,0,0,0,0
55076937573_10153182531612574,,Donald Trump Town Hall on MSNBC Tonight » Right Pundits,link,http://bit.ly/1Syyreb,2016-02-17 11:38:48,0,0,0,0,0,0,0,0,0
55076937573_10153180802372574,,Donald Trump Press Conference – Ted Cruz is a Liar » Right Pundits,link,http://bit.ly/1PCYRI4,2016-02-16 13:10:18,0,0,0,0,0,0,0,0,0
55076937573_10153180760642574,,Can GW Save Jeb Bush in South Carolina? Polls Say No! » Right Pundits,link,http://bit.ly/1onb0bt,2016-02-16 12:34:20,0,0,0,0,0,0,0,0,0
55076937573_10153178793102574,,Be My Bloody Valentine – The Walking Dead Mid-Season 6 Return Episode » Right Pundits,link,http://bit.ly/1PzxrTo,2016-02-15 10:19:38,0,0,0,0,0,0,0,0,0
55076937573_10153177143792574,,"GOP Debate – Thunderdome! 6 Men Enter, No One Leaves » Right Pundits",link,http://bit.ly/1Sq2rcj,2016-02-14 11:00:27,0,0,0,0,0,0,0,0,0
55076937573_10153176940557574,,Supreme Court Justice Antonin Scalia Dead at 79 » Right Pundits,link,http://bit.ly/1ocZP4E,2016-02-14 09:31:59,0,0,0,0,0,0,0,0,0
55076937573_10153175362462574,,Republicans to Battle at GOP Debate on CBS » Right Pundits,link,http://bit.ly/1ozHUpa,2016-02-13 11:45:38,0,0,0,0,0,0,0,0,0
55076937573_10153173661392574,,DisTrusTED – Ted Cruz Spreads More Lies » Right Pundits,link,http://bit.ly/1Prwblc,2016-02-12 11:30:23,0,0,0,0,0,0,0,0,0
55076937573_10153172286217574,,Janet Yellen Warns on Economy » Right Pundits,link,http://bit.ly/1PoYil2,2016-02-11 13:31:49,0,0,0,0,0,0,0,0,0
55076937573_10153172208657574,,"Carly Fiorina, Chris Christie Dropping Out of Presidential Race » Right Pundits",link,http://bit.ly/1SjEdAt,2016-02-11 12:32:00,0,0,0,0,0,0,0,0,0
55076937573_10153170507907574,,"2016 New Hampshire Primary Results – How Trump, Sanders Won » Right Pundits",link,http://bit.ly/1RpPiyN,2016-02-10 11:32:02,0,0,0,0,0,0,0,0,0
55076937573_10153168832242574,,"Donald Trump, Bernie Sanders Lead Polls for New Hampshire Primary 2016 » Right Pundits",link,http://bit.ly/20Is78D,2016-02-09 11:32:13,0,0,0,0,0,0,0,0,0
55076937573_10153168732552574,,FBI Confirms Hillary Clinton Under Investigation » Right Pundits,link,http://bit.ly/1WaTba2,2016-02-09 10:20:38,0,0,0,0,0,0,0,0,0
55076937573_10153167085827574,,Will Young Women 'Go To Hell' If They Vote For Bernie Sanders? » Right Pundits,link,http://bit.ly/20F7bj1,2016-02-08 10:21:03,0,0,0,0,0,0,0,0,0
