status_id,status_message,link_name,status_type,status_link,status_published,num_reactions,num_comments,num_shares,num_likes,num_loves,num_wows,num_hahas,num_sads,num_angrys
55076937573_10153165415037574,,"New Hampshire Republican Debate – Christie Blasts Rubio, Trump Blasts Donor Class » Right Pundits",link,http://bit.ly/1W2FIB7,2016-02-07 11:18:48,0,0,0,0,0,0,0,0,0
55076937573_10153163619297574,,The Big Show – First Nationally Televised 2016 GOP Presidential Debate Tonight on ABC » Right...,link,http://bit.ly/1VYUdWo,2016-02-06 12:01:14,0,0,0,0,0,0,0,0,0
55076937573_10153161988922574,,"Hillary Clinton, Bernie Sanders Battle during MSNBC Democratic Debate » Right Pundits",link,http://bit.ly/1Ra54ha,2016-02-05 11:45:39,0,0,0,0,0,0,0,0,0
55076937573_10153160383157574,,"Dear Donald Trump, Please Focus on New Hampshire! » Right Pundits",link,http://bit.ly/1SL0plt,2016-02-04 12:01:56,0,0,0,0,0,0,0,0,0
55076937573_10153158900297574,,"Rand Paul Out, Trump and Sanders Lead in NH » Right Pundits",link,http://bit.ly/1SHfeFE,2016-02-03 13:30:34,0,0,0,0,0,0,0,0,0
55076937573_10153157214557574,,"2016 Iowa Caucus Results – Lies, Ties and Coin Tosses » Right Pundits",link,http://bit.ly/20mVcq9,2016-02-02 11:50:52,0,0,0,0,0,0,0,0,0
55076937573_10153155639362574,,"Who will Win 2016 Iowa Caucus Today, Monday? » Right Pundits",link,http://bit.ly/1Pa55gb,2016-02-01 11:43:38,0,0,0,0,0,0,0,0,0
55076937573_10153154084212574,,"Ted Cruz′s Wife, Heidi Cruz, Supports CFR Tri-National Plan for ′North American Community′ »...",link,http://bit.ly/1VzotHo,2016-01-31 12:31:41,0,0,0,0,0,0,0,0,0
55076937573_10153152145767574,,"22 Hillary Clinton Emails Top Secret, 'Too Damaging' for Release » Right Pundits",link,http://bit.ly/1KMHVe2,2016-01-30 08:46:38,0,0,0,0,0,0,0,0,0
55076937573_10153150642272574,,Donald Trump Crushes Fox News GOP Debate » Right Pundits,link,http://bit.ly/1QL7t1p,2016-01-29 11:19:42,0,0,0,0,0,0,0,0,0
55076937573_10153148953187574,,"Donald Trump vs Bill O'Reilly, No Deal! Veterans Benefit at Drake U on CNN Opposite Fox Debate »...",link,http://bit.ly/208eG1D,2016-01-28 11:49:42,0,0,0,0,0,0,0,0,0
55076937573_10153147409937574,,"Donald Trump Debate Boycott of Fox News, More Than Just Megyn Kelly » Right Pundits",link,http://bit.ly/1VrNap7,2016-01-27 12:14:21,0,0,0,0,0,0,0,0,0
55076937573_10153147210972574,,"Oregon Militia Standoff Ends in Arrests, 1 Dead » Right Pundits",link,http://bit.ly/1lScLLF,2016-01-27 10:31:04,0,0,0,0,0,0,0,0,0
55076937573_10153146305667574,,WAR! Donald Trump to Skip Fox News Debate! » Right Pundits,link,http://bit.ly/1lQg6Ll,2016-01-26 20:58:22,0,0,0,0,0,0,0,0,0
55076937573_10153143960317574,,"7 Days Till Iowa Caucus, Trump, Sanders Lead Polls » Right Pundits",link,http://bit.ly/1lKBMZf,2016-01-25 10:58:17,0,0,0,0,0,0,0,0,0
55076937573_10153142541377574,,Is Mark Levin Crazy? » Right Pundits,link,http://bit.ly/1WHoyKg,2016-01-24 12:48:03,0,0,0,0,0,0,0,0,0
55076937573_10153140699147574,,Is Ted Cruz Eligible to be Canadian Prime Minister? » Right Pundits,link,http://bit.ly/1lFil3T,2016-01-23 11:40:45,0,0,0,0,0,0,0,0,0
55076937573_10153138999192574,,"National Review Declares War on Donald Trump…, Again! » Right Pundits",link,http://bit.ly/1VdUDbg,2016-01-22 11:07:43,0,0,0,0,0,0,0,0,0
55076937573_10153137549552574,,Will Hillary Clinton be Prosecuted? » Right Pundits,link,http://bit.ly/1lzwsrE,2016-01-21 12:19:32,0,0,0,0,0,0,0,0,0
55076937573_10153136029077574,,Sarah Palin Endorses Donald Trump for President! » Right Pundits,link,http://bit.ly/1ZMH4WQ,2016-01-20 12:23:36,0,0,0,0,0,0,0,0,0
55076937573_10153134568027574,,"Glenn Beck Apologizes to Donald Trump, or Did He? » Right Pundits",link,http://bit.ly/1ZKEwIL,2016-01-19 14:09:36,0,0,0,0,0,0,0,0,0
55076937573_10153134458547574,,Flint Water Crisis – Michigan's Katrina » Right Pundits,link,http://bit.ly/1V5DVuz,2016-01-19 12:34:54,0,0,0,0,0,0,0,0,0
55076937573_10153134458527574,,Flint Water Crisis – Michigan's Katrina » Right Pundits,link,http://bit.ly/1V5DVuz,2016-01-19 12:34:53,0,0,0,0,0,0,0,0,0
55076937573_10153132590877574,,Bernie Sanders Beats Hillary Clinton in 4th Democratic Debate » Right Pundits,link,http://bit.ly/1V1WKPn,2016-01-18 10:55:17,0,0,0,0,0,0,0,0,0
55076937573_10153131131362574,,Hillary Clinton Secret Weapon for Democratic Debate – a Diaper » Right Pundits,link,http://bit.ly/1nbDFzG,2016-01-17 12:13:29,0,0,0,0,0,0,0,0,0
55076937573_10153129454272574,,Donald Trump Right Again! Ted Cruz Citizenship Lawsuit Filed » Right Pundits,link,http://bit.ly/1Whz3Ug,2016-01-16 10:59:55,0,0,0,0,0,0,0,0,0
55076937573_10153127963342574,,Donald Trump Trounces Ted Cruz at Fox – GOP Debate » Right Pundits,link,http://bit.ly/1WeT1yV,2016-01-15 12:22:50,0,0,0,0,0,0,0,0,0
55076937573_10153127893712574,,Donald Trump USA Freedom Kids Song (Video) » Right Pundits,link,http://bit.ly/1RKTwSE,2016-01-15 11:26:10,0,0,0,0,0,0,0,0,0
55076937573_10153126420672574,,Who Will Dare Try to Stump the Trump on FBN-GOP Debate 2Nite? » Right Pundits,link,http://bit.ly/1laCX3J,2016-01-14 12:27:31,0,0,0,0,0,0,0,0,0
55076937573_10153124791097574,,Nikki Haley Commits Political Suicide in GOP SOTU Response » Right Pundits,link,http://bit.ly/1RMEQAI,2016-01-13 12:27:22,1,1,0,1,0,0,0,0,0
55076937573_10153124749422574,,Powerball Drawing Time Nears as Jackpot Payout Hits $1.5 Billion Dollars! » Right Pundits,link,http://bit.ly/1l6ijlp,2016-01-13 11:53:10,0,0,0,0,0,0,0,0,0
55076937573_10153123015272574,,State of the Union Address 2016 – Obama's Last SOTU Speech » Right Pundits,link,http://bit.ly/1RAdPly,2016-01-12 12:10:24,0,0,0,0,0,0,0,0,0
55076937573_10153120857687574,,Latest Gallup Poll – Democrats Down to New Low of 29% » Right Pundits,link,http://bit.ly/1mQknQo,2016-01-11 10:02:15,0,0,0,0,0,0,0,0,0
55076937573_10153119038587574,,"′In Lieu of Flowers′, Vote For Donald Trump » Right Pundits",link,http://bit.ly/1VWkrcM,2016-01-10 08:52:17,0,0,0,0,0,0,0,0,0
55076937573_10153117659267574,,Hillary Clinton Email Instructed Staff How to Send Classified Material » Right Pundits,link,http://bit.ly/1Rs3RTj,2016-01-09 11:59:22,0,0,0,0,0,0,0,0,0
55076937573_10153117590602574,,Philly Cop Shooter Confesses – 'In The Name of Islam' » Right Pundits,link,http://bit.ly/1Ziy7UR,2016-01-09 10:56:18,0,0,0,0,0,0,0,0,0
55076937573_10153116071427574,,"NRA, Taya Kyle Stand Up To Obama-CNN Gun Control Town Hall » Right Pundits",link,http://bit.ly/1kSAZVu,2016-01-08 11:18:36,0,0,0,0,0,0,0,0,0
55076937573_10153116021252574,,Muslim Men Gang Rape of Europe » Right Pundits,link,http://bit.ly/1UCjSDQ,2016-01-08 10:43:00,0,0,0,0,0,0,0,0,0
55076937573_10153114505647574,,John McCain goes Birther on Ted Cruz » Right Pundits,link,http://bit.ly/1kPmxxL,2016-01-07 11:31:50,0,0,0,0,0,0,0,0,0
55076937573_10153114383922574,,"PANIC! China Stock Markets Sell-Off, Close in 29 Minutes » Right Pundits",link,http://bit.ly/1VMsAka,2016-01-07 10:08:16,0,0,0,0,0,0,0,0,0
55076937573_10153112817997574,,Donald Trump Leads in First Polls of 2016 » Right Pundits,link,http://bit.ly/1OOdLI5,2016-01-06 11:35:22,0,0,0,0,0,0,0,0,0
55076937573_10153112729157574,,North Korea H-Bomb Test – Real or Fake? » Right Pundits,link,http://bit.ly/1Uwming,2016-01-06 10:30:37,0,0,0,0,0,0,0,0,0
55076937573_10153111432017574,,Saudi Arabia or Iran – Whose Side is Obama on? » Right Pundits,link,http://bit.ly/1RpugPL,2016-01-05 12:54:49,0,0,0,0,0,0,0,0,0
55076937573_10153111377387574,,Militia in Oregon Asked to Leave by Sheriff » Right Pundits,link,http://bit.ly/1mzaGWh,2016-01-05 12:12:30,0,0,0,0,0,0,0,0,0
55076937573_10153109354242574,,First Donald Trump TV Ad Hits Airways » Right Pundits,link,http://bit.ly/1Rm26Fp,2016-01-04 11:51:02,0,0,0,0,0,0,0,0,0
55076937573_10153109268462574,,Hillary Clinton Heckler Brings Up Bill's Rape Allegations » Right Pundits,link,http://bit.ly/1VBJBNI,2016-01-04 10:51:41,0,0,0,0,0,0,0,0,0
55076937573_10153107686742574,,Jeb Bush to Woo Lindsey Graham in Iowa Plan » Right Pundits,link,http://bit.ly/1R8RJXf,2016-01-03 10:26:32,0,0,0,0,0,0,0,0,0
55076937573_10153106151502574,,The Five Stages of Donald Trump » Right Pundits,link,http://bit.ly/1RgDU7f,2016-01-02 12:36:24,0,0,0,0,0,0,0,0,0
55076937573_10153106136322574,,Barack Obama Gun Control Executive Orders Expected » Right Pundits,link,http://bit.ly/1OAaJaf,2016-01-02 12:29:53,0,0,0,0,0,0,0,0,0
55076937573_10153104305877574,,Happy New Year 2016 Psychic Predictions » Right Pundits,link,http://bit.ly/1P5H0q5,2016-01-01 12:04:06,0,0,0,0,0,0,0,0,0
55076937573_10153102165797574,,Jeb Bush Cancels Iowa TV Ads » Right Pundits,link,http://bit.ly/1NUu8FJ,2015-12-31 11:21:34,0,0,0,0,0,0,0,0,0
55076937573_10153102064862574,,"NASA Deep Space Habitat, $55 Million Home Away from Earth » Right Pundits",link,http://bit.ly/1NUojI9,2015-12-31 10:30:08,0,0,0,0,0,0,0,0,0
55076937573_10153100140522574,,"Donald Trump Best of 2015, Obama Worst of 2015 » Right Pundits",link,http://bit.ly/1NQQ847,2015-12-30 09:16:12,0,0,0,0,0,0,0,0,0
55076937573_10153096801982574,,MN Courts to Decide are Airguns Firearms? » Right Pundits,link,http://bit.ly/1OU16Ub,2015-12-28 10:22:34,0,0,0,0,0,0,0,0,0
55076937573_10153095035572574,,"Donald Trump Warns Hillary and Bill Clinton on Sexism, 'Be Careful' » Right Pundits",link,http://bit.ly/1QPJEXk,2015-12-27 09:50:45,0,0,0,0,0,0,0,0,0
55076937573_10153085994552574,,Doctor Who Christmas Marathon on BBC America » Right Pundits,link,http://bit.ly/1YuGQmy,2015-12-22 12:31:45,0,0,0,0,0,0,0,0,0
55076937573_10153085920562574,,More War on Christmas – Maine School Bans Hello Kitty Christmas Tree » Right Pundits,link,http://bit.ly/1S8uzzh,2015-12-22 11:27:40,0,0,0,0,0,0,0,0,0
55076937573_10153085805267574,,"Donald Trump – Hillary Clinton Lied, 'Got Schlonged' » Right Pundits",link,http://bit.ly/1QEP7jC,2015-12-22 10:38:49,0,0,0,0,0,0,0,0,0
55076937573_10153083862172574,,"45 Days till Iowa Caucus, Donald Trump still Leads » Right Pundits",link,http://bit.ly/1YwfB5Q,2015-12-21 11:11:38,0,0,0,0,0,0,0,0,0
55076937573_10153081677032574,,"Democratic Debate Results – Bernie Apologizes, Hillary MIA » Right Pundits",link,http://bit.ly/1US3NKZ,2015-12-20 11:37:56,0,0,0,0,0,0,0,0,0
55076937573_10153077516702574,,Scientists Say Zombie Apocalypse Real » Right Pundits,link,http://bit.ly/1UK0yVW,2015-12-18 13:11:48,0,0,0,0,0,0,0,0,0
55076937573_10153077433542574,,"Star Wars – The Force Awakens, Episode VII, The Saga Continues! » Right Pundits",link,http://bit.ly/1UJHxmp,2015-12-18 12:02:56,0,0,0,0,0,0,0,0,0
55076937573_10153075618557574,,War on Christmas 2016 – Silent Night Replaced with Whip Nae Nae » Right Pundits,link,http://bit.ly/1Ynn2fv,2015-12-17 11:03:40,0,0,0,0,0,0,0,0,0
55076937573_10153074254957574,,Did Anyone 'Win' 5th GOP Debate on CNN? » Right Pundits,link,http://bit.ly/1UzSVkK,2015-12-16 12:13:02,0,0,0,0,0,0,0,0,0
55076937573_10153074254902574,,Rand Paul Surprise Win at GOP Debate » Right Pundits,link,http://bit.ly/1QqBaFT,2015-12-16 12:12:56,0,0,0,0,0,0,0,0,0
55076937573_10153072720222574,,"5th GOP Debate on CNN Tonight, Will Donald Trump Win? » Right Pundits",link,http://bit.ly/1UuFNNI,2015-12-15 12:24:27,0,0,0,0,0,0,0,0,0
55076937573_10153072631227574,,"FAA Drone Registration – Grinch Obama Levees Fees, Fines » Right Pundits",link,http://bit.ly/1YdzwvC,2015-12-15 11:32:56,0,0,0,0,0,0,0,0,0
55076937573_10153071096122574,,"Donald Trump vs Ted Cruz, Here We Go Again… » Right Pundits",link,http://bit.ly/1Up48oh,2015-12-14 11:20:45,0,0,0,0,0,0,0,0,0
55076937573_10153071095992574,,Keep Muslims; Outlaw Sharia » Right Pundits,link,http://bit.ly/1Up48oa,2015-12-14 11:20:37,0,0,0,0,0,0,0,0,0
55076937573_10153069508717574,,Julius Caesar Dutch Battle Site Discovered – Open Thread » Right Pundits,link,http://bit.ly/1lG1kHM,2015-12-13 09:53:05,0,0,0,0,0,0,0,0,0
55076937573_10153068056982574,,ACLU Board Member Resigns After ′Kill Supporters of Trump′ Post on Facebook » Right Pundits,link,http://bit.ly/1YaOM71,2015-12-12 10:39:49,0,0,0,0,0,0,0,0,0
55076937573_10153066754997574,,Enough Already! GOP vs Donald Trump? » Right Pundits,link,http://bit.ly/1UdoctJ,2015-12-11 12:25:00,0,0,0,0,0,0,0,0,0
55076937573_10153064759867574,,New Email – Troops Were Ready to Save Benghazi Staff » Right Pundits,link,http://bit.ly/1U7M4if,2015-12-10 10:07:41,0,0,0,0,0,0,0,0,0
55076937573_10153063561082574,,"More Attacks Launched on You-Know-Who…, Donald Trump! » Right Pundits",link,http://bit.ly/1U3WBLk,2015-12-09 12:28:12,0,0,0,0,0,0,0,0,0
55076937573_10153061992077574,,Donald Trump Under Fire For Muslim Ban » Right Pundits,link,http://bit.ly/1TYn8tp,2015-12-08 10:50:55,0,0,0,0,0,0,0,0,0
55076937573_10153060664357574,,Patronizer-in-Chief Speaks from the Oval Office » Right Pundits,link,http://bit.ly/1TTnIsp,2015-12-07 10:53:43,0,0,0,0,0,0,0,0,0
55076937573_10153060662297574,,"Michael Savage vs Bill O'Reilly, Media Reaction to San Bernardino Shootings » Right Pundits",link,http://bit.ly/1PQnwvx,2015-12-07 10:51:32,0,0,0,0,0,0,0,0,0
55076937573_10153060110437574,,Obama is Punishing America » Right Pundits,link,http://bit.ly/1TRmEFw,2015-12-07 01:37:23,0,0,0,0,0,0,0,0,0
55076937573_10153059195072574,,"Obama to Address Nation on Terrorism, Will He Apologize? Resign? » Right Pundits",link,http://bit.ly/1TORT43,2015-12-06 11:21:04,0,0,0,0,0,0,0,0,0
55076937573_10153056333777574,,"Donald Trump Leads New Poll by 20 Points, Jeb Bush at 3% » Right Pundits",link,http://bit.ly/1PEUZZE,2015-12-04 11:46:18,0,0,0,0,0,0,0,0,0
55076937573_10153056281802574,,San Bernardino Shooters Tied to Terrorism » Right Pundits,link,http://bit.ly/1XNKjah,2015-12-04 11:09:31,0,0,0,0,0,0,0,0,0
55076937573_10153054832422574,,San Bernardino Shooting – Terror or Workplace Violence? » Right Pundits,link,http://bit.ly/1PAfEyb,2015-12-03 11:45:02,0,0,0,0,0,0,0,0,0
55076937573_10153053353882574,,"DoD, Ashton Carter Contradicts Obama on ISIS Threat » Right Pundits",link,http://bit.ly/1RmV97l,2015-12-02 11:56:24,0,0,0,0,0,0,0,0,0
55076937573_10153052068967574,,"Hillary Clinton Emails, 999 Classified and Counting » Right Pundits",link,http://bit.ly/1HE25Lb,2015-12-01 13:24:56,0,0,0,0,0,0,0,0,0
55076937573_10153050680067574,,Media Attacks Donald Trump on Muslims-9/11 Remarks » Right Pundits,link,http://bit.ly/1Po1XlQ,2015-11-30 11:21:12,0,0,0,0,0,0,0,0,0
55076937573_10153050591887574,,The Walking Dead Mid-Season 6 Finale – 'Start To Finish' » Right Pundits,link,http://bit.ly/1RgLDm4,2015-11-30 10:22:00,0,0,0,0,0,0,0,0,0
55076937573_10153049160482574,,"GOP Warns World Leaders, Don't Trust Obama » Right Pundits",link,http://bit.ly/1HxAFqt,2015-11-29 10:11:28,0,0,0,0,0,0,0,0,0
55076937573_10153043353942574,,Obama Threatens ISIS with Climate Change » Right Pundits,link,http://bit.ly/1P9BKai,2015-11-25 12:10:42,0,0,0,0,0,0,0,0,0
55076937573_10153041924607574,,Turkey Shoots Down Russian Warplane Near Syria Border » Right Pundits,link,http://bit.ly/1IdLN6n,2015-11-24 10:46:52,0,0,0,0,0,0,0,0,0
55076937573_10153041922802574,,Obama Lied – Admin Cooked the Books on ISIS Threat » Right Pundits,link,http://bit.ly/1P6d82q,2015-11-24 10:45:10,0,0,0,0,0,0,0,0,0
55076937573_10153041917107574,,"Glenn Lives! The Walking Dead – 'Heads Up' Recap, #GlennIsAlive » Right Pundits",link,http://bit.ly/1R49sNR,2015-11-24 10:40:15,0,0,0,0,0,0,0,0,0
55076937573_10153041797117574,,bit.ly,link,http://bit.ly/1SZGDRg,2015-11-24 08:47:57,0,0,0,0,0,0,0,0,0
55076937573_10153041797062574,,bit.ly,link,http://bit.ly/1R3Jb2k,2015-11-24 08:47:53,0,0,0,0,0,0,0,0,0
55076937573_10153041797007574,,bit.ly,link,http://bit.ly/1SZGFIN,2015-11-24 08:47:48,0,0,0,0,0,0,0,0,0
55076937573_10153041796917574,,bit.ly,link,http://bit.ly/1SZGFsv,2015-11-24 08:47:43,0,0,0,0,0,0,0,0,0
55076937573_10153041796832574,,bit.ly,link,http://bit.ly/1R3Jdr1,2015-11-24 08:47:37,0,0,0,0,0,0,0,0,0
55076937573_10152981556022574,,International Red Cross Report – Natural Disasters Down to 65-Year Lows » Right Pundits,link,http://bit.ly/1Zrol0c,2015-10-11 08:39:36,0,0,0,0,0,0,0,0,0
55076937573_10152980001392574,,Obama Failure on US Training Syrian Rebel Troops » Right Pundits,link,http://bit.ly/1P6pdDW,2015-10-10 10:09:58,0,0,0,0,0,0,0,0,0
55076937573_10152978626247574,,GQ Magazine Goes Ghetto on Ben Carson » Right Pundits,link,http://bit.ly/1LtndyK,2015-10-09 10:41:28,0,0,0,0,0,0,0,0,0
55076937573_10152978581552574,,Kevin McCarthy Drops Out of Speaker of the House Race » Right Pundits,link,http://bit.ly/1jTbLGR,2015-10-09 09:56:46,0,0,0,0,0,0,0,0,0
55076937573_10152976117087574,,"Donald Trump – 'I'm In It To Win It', Gains in New Polls » Right Pundits",link,http://bit.ly/1j8cZx4,2015-10-07 10:52:53,0,0,0,0,0,0,0,0,0
55076937573_10152974799597574,,Hillary Clinton Gun Control Plan – More Left-Wing Lunacy » Right Pundits,link,http://bit.ly/1NjupUJ,2015-10-06 10:03:40,0,0,0,0,0,0,0,0,0
55076937573_10152973567217574,,How I Survived 'Celebrity Bowling' – Open Thread » Right Pundits,link,http://bit.ly/1LbDbxl,2015-10-05 10:38:54,0,0,0,0,0,0,0,0,0
55076937573_10152972091927574,,RightPundits Book Review – 'Government Zero' by Dr. Michael Savage » Right Pundits,link,http://bit.ly/1L8glGR,2015-10-04 11:20:04,0,0,0,0,0,0,0,0,0
55076937573_10152972086277574,,'Fear' and 'The Walking Dead' Marathon Week on AMC-TV » Right Pundits,link,http://bit.ly/1M3FpnN,2015-10-04 11:15:11,0,0,0,0,0,0,0,0,0
55076937573_10152969281412574,,Oregon Shooting Gunman Targeted Christians » Right Pundits,link,http://bit.ly/1LXtHef,2015-10-02 10:36:51,0,0,0,0,0,0,0,0,0
55076937573_10152968067557574,,"Donald Trump to Syrian Refugees – If I Win, You're Going Home! » Right Pundits",link,http://bit.ly/1iOzmYi,2015-10-01 11:27:56,0,0,0,0,0,0,0,0,0
55076937573_10152968005487574,,"Vladimir Putin Outfoxes Obama, Russia Launches Airstrikes in Syria Civil War » Right Pundits",link,http://bit.ly/1LTdoz7,2015-10-01 10:44:23,0,0,0,0,0,0,0,0,0
55076937573_10152966558357574,,Cecile Richards of Planned Parenthood Grilled by Congress » Right Pundits,link,http://bit.ly/1KRU1kH,2015-09-30 10:32:24,0,0,0,0,0,0,0,0,0
55076937573_10152965124337574,,Donald Trump Tax Reform Plan » Right Pundits,link,http://bit.ly/1juQpzl,2015-09-29 11:45:45,0,0,0,0,0,0,0,0,0
55076937573_10152963765842574,,NASA Mars Announcement News – Flowing Liquid Water! » Right Pundits,link,http://bit.ly/1KKyCKm,2015-09-28 11:07:29,0,0,0,0,0,0,0,0,0
55076937573_10152962442457574,,Pope Francis Visit to America Ends Today » Right Pundits,link,http://bit.ly/1LHEida,2015-09-27 11:41:03,0,0,0,0,0,0,0,0,0
55076937573_10152960977347574,,Tears for Beers – John Boehner Out! Will Resign as Speaker of the House! » Right Pundits,link,http://bit.ly/1PFAcS3,2015-09-26 10:24:39,0,0,0,0,0,0,0,0,0
55076937573_10152957102107574,,Survivor Cambodia – Second Chances Premiere » Right Pundits,link,http://bit.ly/1R37ICR,2015-09-24 11:36:53,0,0,0,0,0,0,0,0,0
55076937573_10152957022492574,,"Donald Trump vs Fox News, Round 2 » Right Pundits",link,http://bit.ly/1Pxq91a,2015-09-24 10:20:12,0,0,0,0,0,0,0,0,0
55076937573_10152949362502574,,"Pope Francis in USA Week, 2015. Open Thread » Right Pundits",link,http://bit.ly/1PkZyUY,2015-09-21 14:30:46,0,0,0,0,0,0,0,0,0
55076937573_10152946143712574,,William Kristol Pushes for Dick Cheney in 2016 » Right Pundits,link,http://bit.ly/1gDlL4J,2015-09-20 08:58:22,0,0,0,0,0,0,0,0,0
55076937573_10152937227602574,,"Who Won, Lost CNN 2nd GOP Debate in 2015? » Right Pundits",link,http://bit.ly/1LjeoMx,2015-09-17 09:12:13,0,0,0,0,0,0,0,0,0
55076937573_10152929368417574,,"Survey Says on Gov't, Politicians – Dysfunctional, Untrustworthy » Right Pundits",link,http://bit.ly/1Oq8cU1,2015-09-14 09:39:21,0,0,0,0,0,0,0,0,0
55076937573_10152926741642574,,Pirate Treasure of the Knights Templar » Right Pundits,link,http://bit.ly/1UNndo2,2015-09-13 13:21:35,0,0,0,0,0,0,0,0,0
55076937573_10152926652902574,,WashPo – Hillary Clinton Private Email Server May NOT Have Been Wiped » Right Pundits,link,http://bit.ly/1Y00Haq,2015-09-13 12:07:26,0,0,0,0,0,0,0,0,0
55076937573_10152921590472574,,"Sore Loser – Rick Perry Quits 2016 Race, Blames 'Nativists' » Right Pundits",link,http://bit.ly/1UKuhll,2015-09-12 10:15:47,0,0,0,0,0,0,0,0,0
55076937573_10152918797457574,,Remembering 9/11 as New Obama Intel Scandal Unfolds » Right Pundits,link,http://bit.ly/1J32hNI,2015-09-11 11:04:30,0,0,0,0,0,0,0,0,0
55076937573_10152908536272574,,Hillary Clinton feels the 'BERN'! Bernie Sanders leads in New Poll » Right Pundits,link,http://bit.ly/1JMXyBb,2015-09-07 09:34:18,0,0,0,0,0,0,0,0,0
55076937573_10152908424277574,,Right Book Review – 'Fracture' by Joy-Ann Reid » Right Pundits,link,http://bit.ly/1JMLG2j,2015-09-07 08:38:58,0,0,0,0,0,0,0,0,0
55076937573_10152903995402574,,"Hillary Clinton on Emails, 'I'm Sorry' You're so Dumb » Right Pundits",link,http://bit.ly/1XuiI0u,2015-09-05 10:35:59,0,0,0,0,0,0,0,0,0
55076937573_10152903901677574,,"Why David Bunning is Right . . . and Why Kim Davis, Ted Cruz and Others are Wrong » Right Pundits",link,http://bit.ly/1Xu3kBj,2015-09-05 09:16:57,0,0,0,0,0,0,0,0,0
55076937573_10152902454467574,,Obama Recovery – New Record High 94 Million Out of Work » Right Pundits,link,http://bit.ly/1KPBdaG,2015-09-04 11:35:52,0,0,0,0,0,0,0,0,0
55076937573_10152902377492574,,Donald Trump Signs GOP Loyalty Pledge » Right Pundits,link,http://bit.ly/1Xqhovq,2015-09-04 10:44:10,0,0,0,0,0,0,0,0,0
55076937573_10152899437387574,,Fox News Anchor Harris Faulkner Sues Hasbro for $5 Million Over Doll Name » Right Pundits,link,http://bit.ly/1JNFrdB,2015-09-02 11:41:24,0,0,0,0,0,0,0,0,0
55076937573_10152899323252574,,"Hillary Clinton Wrote, Sent 6 Classified Emails » Right Pundits",link,http://bit.ly/1KHYOtB,2015-09-02 09:57:12,0,0,0,0,0,0,0,0,0
55076937573_10152897904832574,,School Bans Wonder Woman Lunchbox » Right Pundits,link,http://bit.ly/1KDRwad,2015-09-01 11:51:10,0,0,0,0,0,0,0,0,0
55076937573_10152895609407574,,Memo to CNN – Let Carly Fiorina Debate! » Right Pundits,link,http://bit.ly/1X5atHO,2015-08-31 08:22:37,0,0,0,0,0,0,0,0,0
55076937573_10152893691567574,,Is the GOP Tent Big Enough for Donald Trump? » Right Pundits,link,http://bit.ly/1X2eAEA,2015-08-30 11:42:29,0,0,0,0,0,0,0,0,0
55076937573_10152891522212574,,"Feds, Conservationists Seek to Ban Guns at National Parks » Right Pundits",link,http://bit.ly/1VlpqDZ,2015-08-29 10:07:00,0,0,0,0,0,0,0,0,0
55076937573_10152889654467574,,Hillary Clinton compares GOP Candidates to Terrorists » Right Pundits,link,http://bit.ly/1KeuMPA,2015-08-28 08:53:21,0,0,0,0,0,0,0,0,0
55076937573_10152887963187574,,"New Poll Word Cloud on Hillary Clinton, Survey Says 'LIAR'! » Right Pundits",link,http://bit.ly/1IkgXHW,2015-08-27 08:58:36,0,0,0,0,0,0,0,0,0
55076937573_10152886470237574,,Donald Trump battles rude Univision Anchor Jorge Ramos in Iowa » Right Pundits,link,http://bit.ly/1K2wBPE,2015-08-26 10:49:20,0,0,0,0,0,0,0,0,0
55076937573_10152884455512574,,"Joe Biden Meets With Liz Warren, Obama on 2016 Run » Right Pundits",link,http://bit.ly/1KKeg46,2015-08-25 10:10:45,0,0,0,0,0,0,0,0,0
55076937573_10152882528397574,,"Black Monday – DOW Opens Down 1,000 Points! » Right Pundits",link,http://bit.ly/1I8Emfb,2015-08-24 10:44:42,0,0,0,0,0,0,0,0,0
55076937573_10152882475367574,,Fear The Walking Dead Premiere – Pilot Episode Review » Right Pundits,link,http://bit.ly/1JOJ3SP,2015-08-24 10:14:42,0,0,0,0,0,0,0,0,0
55076937573_10152878853512574,,"Donald Trump Wows Crowd of 30,000 in Mobile, Alabama » Right Pundits",link,http://bit.ly/1JCVyRh,2015-08-22 12:46:34,0,0,0,0,0,0,0,0,0
55076937573_10152878760247574,,"NASA Asteroid September 24, 2015 – Are You Ready for the Sixth Seal? » Right Pundits",link,http://bit.ly/1JCBT41,2015-08-22 11:39:05,0,0,0,0,0,0,0,0,0
55076937573_10152876877657574,,'SHOCK POLL' – Donald Trump Likely GOP Nominee at 57% » Right Pundits,link,http://bit.ly/1U5513m,2015-08-21 11:31:00,0,0,0,0,0,0,0,0,0
55076937573_10152875019262574,,Meghan McCain joins Fox News – #RIPFNC » Right Pundits,link,http://bit.ly/1U01D9W,2015-08-20 11:19:50,0,0,0,0,0,0,0,0,0
55076937573_10152874983327574,,Michael Savage Callers Ask – How Did Hillary Clinton Get Classified Info? » Right Pundits,link,http://bit.ly/1MG5ie5,2015-08-20 10:53:23,0,0,0,0,0,0,0,0,0
55076937573_10152873413337574,,Scott Walker Unveils Health Care Plan » Right Pundits,link,http://bit.ly/1J43fwB,2015-08-19 11:01:09,0,0,0,0,0,0,0,0,0
55076937573_10152871712297574,,More Classified Hillary Clinton Emails Found » Right Pundits,link,http://bit.ly/1JfKO9p,2015-08-18 11:31:40,0,0,0,0,0,0,0,0,0
55076937573_10152869572412574,,Donald Trump Outlines Immigration Policy » Right Pundits,link,http://bit.ly/1gQuC3y,2015-08-17 09:35:54,0,0,0,0,0,0,0,0,0
55076937573_10152867617482574,,Ride of the Valkyries! Trump Buzzes Hillary in Iowa » Right Pundits,link,http://bit.ly/1TK2yAG,2015-08-16 09:27:38,0,0,0,0,0,0,0,0,0
55076937573_10152865948902574,,The Summer of Trump lands at Iowa State Fair » Right Pundits,link,http://bit.ly/1DSUbMe,2015-08-15 10:28:01,0,0,0,0,0,0,0,0,0
55076937573_10152863955852574,,Al Gore Considers 2016 White House Run » Right Pundits,link,http://bit.ly/1gGxtMl,2015-08-14 08:23:45,0,0,0,0,0,0,0,0,0
55076937573_10152861971912574,,FBI Takes Hillary Clinton Email Server » Right Pundits,link,http://bit.ly/1TxExHL,2015-08-13 10:40:55,0,0,0,0,0,0,0,0,0
55076937573_10152860024977574,,Harvard Law Prof Lawrence Lessig Considers White House Run » Right Pundits,link,http://bit.ly/1Tq4XjK,2015-08-12 09:18:26,0,0,0,0,0,0,0,0,0
55076937573_10152859842857574,,"Donald Trump Still Leads Polls, Hillary Clinton Troubled » Right Pundits",link,http://bit.ly/1gzAhuK,2015-08-12 08:31:57,0,0,0,0,0,0,0,0,0
