status_id,status_message,link_name,status_type,status_link,status_published,num_reactions,num_comments,num_shares,num_likes,num_loves,num_wows,num_hahas,num_sads,num_angrys
55076937573_10152853826082574,,Schumer vs Obama on Iran Nuke Deal – Open Thread » Right Pundits,link,http://bit.ly/1gt6tQc,2015-08-10 10:00:14,0,0,0,0,0,0,0,0,0
55076937573_10152853772167574,,Right Book Review – 'The Storm of the Century' by Al Roaker » Right Pundits,link,http://bit.ly/1TfhxCw,2015-08-10 09:21:58,0,0,0,0,0,0,0,0,0
55076937573_10152852212197574,,#BlackLivesMatter Hijack Bernie Sanders Rally in Seattle » Right Pundits,link,http://bit.ly/1T9DKlr,2015-08-09 10:03:21,0,0,0,0,0,0,0,0,0
55076937573_10152850536122574,,Damsel in Distress! Megyn Kelly vs Donald Trump – Red State Caves In » Right Pundits,link,http://bit.ly/1gmt5BQ,2015-08-08 11:08:50,0,0,0,0,0,0,0,0,0
55076937573_10152846699732574,,Will Donald Trump Win 1st 2016 GOP Presidential Debate? » Right Pundits,link,http://bit.ly/1Dtoade,2015-08-06 11:59:31,0,0,0,0,0,0,0,0,0
55076937573_10152844853152574,,FBI Investigates Hillary Clinton Email Server » Right Pundits,link,http://bit.ly/1IkZ8Mc,2015-08-05 10:19:20,0,0,0,0,0,0,0,0,0
55076937573_10152842729517574,,Chris Christie – 'Am I Washed Up?' » Right Pundits,link,http://bit.ly/1g4Wf8C,2015-08-04 10:34:29,0,0,0,0,0,0,0,0,0
55076937573_10152840827992574,,Pat Buchanan and the 'Benedict Option' » Right Pundits,link,http://bit.ly/1SC8P0I,2015-08-03 10:43:28,0,0,0,0,0,0,0,0,0
55076937573_10152840737847574,,bit.ly,link,http://bit.ly/1gEipzf,2015-08-03 09:27:54,0,0,0,0,0,0,0,0,0
55076937573_10152838755567574,,Joe Biden for President? Will He Run? » Right Pundits,link,http://bit.ly/1SwiRk2,2015-08-02 09:19:15,0,0,0,0,0,0,0,0,0
55076937573_10152836875747574,,"Mark Levin Attacks Donald Trump, Michael Savage » Right Pundits",link,http://bit.ly/1HewEje,2015-08-01 10:17:41,0,1,0,0,0,0,0,0,0
55076937573_10152836769227574,,Mitt Romney Slams Ted Cruz for Obama Comment » Right Pundits,link,http://bit.ly/1gxxv9Q,2015-08-01 09:05:53,0,1,0,0,0,0,0,0,0
55076937573_10152834525232574,,#CecilTheLion – Good or Bad? Open Thread » Right Pundits,link,http://bit.ly/1gtsdMx,2015-07-31 09:17:40,0,0,0,0,0,0,0,0,0
55076937573_10152832951412574,,Bye Bye Boehner: Saying Goodbye to the Champion We Never Knew » Right Pundits,link,http://bit.ly/1SkCiw8,2015-07-30 12:23:48,0,0,0,0,0,0,0,0,0
55076937573_10152832758042574,,"New Polls – Donald Trump Leads in FLA, Hispanics Nationwide » Right Pundits",link,http://bit.ly/1gq0OLo,2015-07-30 09:40:13,0,0,0,0,0,0,0,0,0
55076937573_10152830770367574,,Third Planned Parenthood Video Details More on the Selling of Aborted Baby Body Parts » Right...,link,http://bit.ly/1H2o5bh,2015-07-29 09:20:45,0,0,0,0,0,0,0,0,0
55076937573_10152826774312574,,Donald Trump Leads Polls – Takes GOP to the 'Danger Zone' » Right Pundits,link,http://bit.ly/1fAawd0,2015-07-27 10:45:49,0,0,0,0,0,0,0,0,0
55076937573_10152825304657574,,"Crooks, Kooks and 'Cuckservatives', Whom to Vote For? » Right Pundits",link,http://bit.ly/1DHb5aY,2015-07-26 13:18:06,0,0,0,0,0,0,0,0,0
55076937573_10152821521657574,,Hillary Clinton Email Scandal – DOJ Criminal Probe Called For » Right Pundits,link,http://bit.ly/1GKszmx,2015-07-24 09:16:05,0,0,0,0,0,0,0,0,0
55076937573_10152821478497574,,"Donald Trump Visits Border Patrol, Tells Press 'You're Finished' » Right Pundits",link,http://bit.ly/1GKjquj,2015-07-24 08:39:25,0,0,0,0,0,0,0,0,0
55076937573_10152817831527574,,Video 2 – Planned Parenthood Doctor Quotes Prices for Aborted Baby Body Parts » Right Pundits,link,http://bit.ly/1Vv9lN0,2015-07-22 12:05:44,0,0,0,0,0,0,0,0,0
55076937573_10152814728477574,,Tomi Lahern Calls Obama 'Half-Baked' in Viral Video Rant » Right Pundits,link,http://bit.ly/1VphkLo,2015-07-21 09:43:28,0,1,0,0,0,0,0,0,0
55076937573_10152812521597574,,Donald Trump to John McCain – No Apology! » Right Pundits,link,http://bit.ly/1IeHnRW,2015-07-20 08:34:00,0,0,0,0,0,0,0,0,0
55076937573_10152810080142574,,Martin O'Malley Apologizes to Netroots Nation – #WhiteLivesDontMatter » Right Pundits,link,http://bit.ly/1I2BYa2,2015-07-19 11:17:37,0,0,0,0,0,0,0,0,0
55076937573_10152808106742574,,Chattanooga Shootings – Islamic Terrorism? » Right Pundits,link,http://bit.ly/1LtWHcv,2015-07-18 10:44:17,0,1,0,0,0,0,0,0,0
55076937573_10152804494237574,,Donald Trump – the ′$10 BILLION DOLLAR′ Man » Right Pundits,link,http://bit.ly/1V78Poh,2015-07-16 09:08:06,0,0,0,0,0,0,0,0,0
55076937573_10152804441592574,,Is Planned Parenthood Selling Body Parts from Aborted Babies? » Right Pundits,link,http://bit.ly/1f79x3S,2015-07-16 08:24:10,0,0,0,0,0,0,0,0,0
55076937573_10152802952602574,,"Obama Iran Nuke Deal, will Veto any Block by GOP » Right Pundits",link,http://bit.ly/1HMJWEc,2015-07-15 10:01:28,0,0,0,0,0,0,0,0,0
55076937573_10152802906822574,,"NASA Mission to Pluto, New Horizon Probe a Success! » Right Pundits",link,http://bit.ly/1HxqgoB,2015-07-15 09:26:44,0,0,0,0,0,0,0,0,0
55076937573_10152799623092574,,"Scott Walker Announcement Today, Joins 2016 White House Race » Right Pundits",link,http://bit.ly/1fCIdeF,2015-07-13 09:36:07,0,0,0,0,0,0,0,0,0
55076937573_10152799589652574,,#AGreekment – Greece Debt Crisis Deal Reached » Right Pundits,link,http://bit.ly/1UUugsr,2015-07-13 09:07:17,0,0,0,0,0,0,0,0,0
55076937573_10152797985652574,,"Obama Fairness in Housing Scheme, Diversity at Gunpoint » Right Pundits",link,http://bit.ly/1L8o0cf,2015-07-12 09:31:22,0,0,0,0,0,0,0,0,0
55076937573_10152796356527574,,"Donald Trump Leads Polls, Big Illegal Immigration Speech in Phoenix, Arizona » Right Pundits",link,http://bit.ly/1Hu2pVQ,2015-07-11 09:36:31,0,0,0,0,0,0,0,0,0
55076937573_10152792625277574,,"China Stock Market in Crisis, NYSE Closes – Glitch or Hack? » Right Pundits",link,http://bit.ly/1Hl2FGB,2015-07-09 09:44:31,0,0,0,0,0,0,0,0,0
55076937573_10152786902667574,,"Greeks Vote 'No' in #Greferendum, What Next? » Right Pundits",link,http://bit.ly/1H54gAq,2015-07-06 08:46:26,0,0,0,0,0,0,0,0,0
55076937573_10152786702027574,,Right Book Review – ′The Selfie Vote′ by Kristen Soltis Anderson » Right Pundits,link,http://bit.ly/1UrzTOK,2015-07-06 07:49:38,0,0,0,0,0,0,0,0,0
55076937573_10152783996682574,,"SF Murder Proves Donald Trump Right, GOP and Latino Groups Wrong » Right Pundits",link,http://bit.ly/1H0Zrbh,2015-07-05 11:22:24,0,0,0,0,0,0,0,0,0
55076937573_10152783897877574,,Happy X-Day 2015 from the Church of the Sub-Genius » Right Pundits,link,http://bit.ly/1evmUul,2015-07-05 10:26:49,0,0,0,0,0,0,0,0,0
55076937573_10152779403552574,,4th of July Terror Alert on High in US » Right Pundits,link,http://bit.ly/1f8jL4L,2015-07-03 08:44:45,0,0,0,0,0,0,0,0,0
55076937573_10152777685517574,,"Bernie Sanders draws 10,000, Hillary Clinton in Trouble » Right Pundits",link,http://bit.ly/1JANY6p,2015-07-02 08:27:58,0,0,0,0,0,0,0,0,0
55076937573_10152777630597574,,TV Land Cancels Dukes of Hazzard » Right Pundits,link,http://bit.ly/1UceEAc,2015-07-02 07:39:38,0,0,0,0,0,0,0,0,0
55076937573_10152775078722574,,Michael Savage bemoans End of the West » Right Pundits,link,http://bit.ly/1T6ApQF,2015-07-01 12:47:11,0,0,0,0,0,0,0,0,0
55076937573_10152775027407574,,Donald Trump Sues Univision for $500 Million » Right Pundits,link,http://bit.ly/1KrNiS1,2015-07-01 12:06:24,0,0,0,0,0,0,0,0,0
55076937573_10152772593272574,,Greece to Default on Debt Payment » Right Pundits,link,http://bit.ly/1Jot8XD,2015-06-30 08:46:36,0,0,0,0,0,0,0,0,0
55076937573_10152770995122574,,"Banks Closed in Greece, Limits on ATMs » Right Pundits",link,http://bit.ly/1JjSpT1,2015-06-29 10:34:07,0,0,0,0,0,0,0,0,0
55076937573_10152768961622574,,Supreme Court Ruling on Same-Sex Marriage » Right Pundits,link,http://bit.ly/1fYtnz8,2015-06-28 09:19:33,0,0,0,0,0,0,0,0,0
55076937573_10152765197337574,,"More Email Trouble for Hillary Clinton, IRS » Right Pundits",link,http://bit.ly/1fJBBLo,2015-06-26 09:54:40,0,0,0,0,0,0,0,0,0
55076937573_10152765138067574,,Supreme Court upholds Obamacare Subsidies » Right Pundits,link,http://bit.ly/1Khs5f7,2015-06-26 09:08:40,0,0,0,0,0,0,0,0,0
55076937573_10152765106692574,,"Terror Attacks in France, Tunisia, Kuwait » Right Pundits",link,http://bit.ly/1RCKwdk,2015-06-26 08:35:15,0,0,0,0,0,0,0,0,0
55076937573_10152763482842574,,Confederate Symbols Under Fire – Limbaugh Says US Flag Next » Right Pundits,link,http://bit.ly/1Rz7iCK,2015-06-25 08:48:08,0,0,0,0,0,0,0,0,0
55076937573_10152753182727574,,Happy Fathers Day 2015 – Open Thread » Right Pundits,link,http://bit.ly/1RlKGFJ,2015-06-21 09:30:48,0,0,0,0,0,0,0,0,0
55076937573_10152750698007574,,Greece Debt Talks – Panic in Athens » Right Pundits,link,http://bit.ly/1GcuOjL,2015-06-20 09:34:45,0,0,0,0,0,0,0,0,0
55076937573_10152748633657574,,Dylann Storm Roof Charged with 9 Counts of Murder » Right Pundits,link,http://bit.ly/1RgBB0Y,2015-06-19 11:23:09,0,0,0,0,0,0,0,0,0
55076937573_10152746458447574,,Fox News Civil War – Dana Perino vs Eric Bolling over Trump » Right Pundits,link,http://bit.ly/1RcyxD6,2015-06-18 09:41:22,0,0,0,0,0,0,0,0,0
55076937573_10152744470862574,,Bernie Sanders Closes Gap on Hillary Clinton in NH » Right Pundits,link,http://bit.ly/1KZkSiU,2015-06-17 09:23:47,0,0,0,0,0,0,0,0,0
55076937573_10152744382092574,,"Michelle Obama tells Muslim Girls, 'Your Story is My Story' » Right Pundits",link,http://bit.ly/1enlfrh,2015-06-17 08:34:14,0,0,0,0,0,0,0,0,0
55076937573_10152742194847574,,Donald Trump Joins 2016 White House Race » Right Pundits,link,http://bit.ly/1TqdsJ8,2015-06-16 08:24:30,0,0,0,0,0,0,0,0,0
55076937573_10152740232992574,,Jeb Bush 2016 Joins Campaign Race » Right Pundits,link,http://bit.ly/1R0GLxR,2015-06-15 10:21:24,0,0,0,0,0,0,0,0,0
55076937573_10152740029912574,,CNN Fredricka Whitfield – Liberal Loon Lady » Right Pundits,link,http://bit.ly/1R0u71X,2015-06-15 09:15:55,0,0,0,0,0,0,0,0,0
55076937573_10152732768957574,,Michael Savage Declares War on Liberal Bullies » Right Pundits,link,http://bit.ly/1TgnM6k,2015-06-12 08:33:39,0,0,0,0,0,0,0,0,0
55076937573_10152729587377574,,Meet Your Masters at #Bilderberg2015 » Right Pundits,link,http://bit.ly/1GdZOSy,2015-06-10 09:20:30,0,0,0,0,0,0,0,0,0
55076937573_10152727802607574,,Obama War on Police – Texas Cop Pool Party Video Protest » Right Pundits,link,http://bit.ly/1MkYbnr,2015-06-09 08:44:35,0,0,0,0,0,0,0,0,0
55076937573_10152727754722574,,Obama Admits No 'Complete Strategy' For Fighting ISIS » Right Pundits,link,http://bit.ly/1S1dmWU,2015-06-09 08:07:20,0,0,0,0,0,0,0,0,0
55076937573_10152726141777574,,Obama targets Gun Talk on Internet » Right Pundits,link,http://bit.ly/1Mi1dsH,2015-06-08 08:28:05,0,0,0,0,0,0,0,0,0
55076937573_10152723293552574,,T-Rex Autopsy tops NatGeo Dino-Thon Weekend » Right Pundits,link,http://bit.ly/1Hc93Vv,2015-06-06 10:53:09,0,0,0,0,0,0,0,0,0
55076937573_10152721599542574,,Liberal Schools Out of Control on Sex Education » Right Pundits,link,http://bit.ly/1H8DhIK,2015-06-05 09:49:23,0,0,0,0,0,0,0,0,0
55076937573_10152721554972574,,EPA – Fracking Safe for Ground Water » Right Pundits,link,http://bit.ly/1RPuFtT,2015-06-05 09:09:22,0,0,0,0,0,0,0,0,0
55076937573_10152720340437574,,Boston Terror Suspect Planned Beheading Pamela Geller » Right Pundits,link,http://bit.ly/1JoBwsJ,2015-06-04 11:35:11,0,0,0,0,0,0,0,0,0
55076937573_10152718789122574,,Now Obama Says He Is Jewish! What Next? » Right Pundits,link,http://bit.ly/1IcxKzx,2015-06-03 08:38:43,0,0,0,0,0,0,0,0,0
55076937573_10152717418882574,,"American Genius – Jobs vs Gates, Wright vs Curtiss » Right Pundits",link,http://bit.ly/1JmSvtS,2015-06-02 09:14:02,0,0,0,0,0,0,0,0,0
55076937573_10152715876662574,,Delayed till Tuesday – Senate NSA Spying Vote » Right Pundits,link,http://bit.ly/1GRLnWh,2015-06-01 09:54:25,0,0,0,0,0,0,0,0,0
55076937573_10152715840107574,,Right Review – Premiere of The Greg Gutfeld Show on Fox News » Right Pundits,link,http://bit.ly/1JjJWjs,2015-06-01 09:16:04,0,0,0,0,0,0,0,0,0
55076937573_10152712962267574,,"Rand Paul 'Sunday, Sunday, Sunday' Video » Right Pundits",link,http://bit.ly/1GLUBTN,2015-05-30 09:18:49,0,0,0,0,0,0,0,0,0
55076937573_10152711620712574,,Obama War on Police – Baltimore Murder Capitol » Right Pundits,link,http://bit.ly/1EEtvrD,2015-05-29 10:49:23,0,0,0,0,0,0,0,0,0
55076937573_10152711210187574,,Obama Economy Stinks as 1Q GDP Shrinks » Right Pundits,link,http://bit.ly/1RuIQEx,2015-05-29 09:06:05,0,0,0,0,0,0,0,0,0
55076937573_10152703250957574,,Kenyan Lawyer Offers 50 Cows to Marry Obama Daughter » Right Pundits,link,http://bit.ly/1G2F9UC,2015-05-28 08:40:57,0,0,0,0,0,0,0,0,0
55076937573_10152699646912574,,Court Rules Against Obama Immigration Reform » Right Pundits,link,http://bit.ly/1J1k4dF,2015-05-27 09:43:29,0,0,0,0,0,0,0,0,0
55076937573_10152690146037574,,Happy Memorial Day 2015! Book Review – ′The Quiet Man′ by John Sununu » Right Pundits,link,http://bit.ly/1LBxA60,2015-05-25 07:26:23,0,0,0,0,0,0,0,0,0
55076937573_10152687976752574,,"Kate Middleton and Nude Pantyhose, Open Thread » Right Pundits",link,http://bit.ly/1RevbRW,2015-05-24 09:00:22,0,0,0,0,0,0,0,0,0
55076937573_10152686082452574,,GOP Senators Cave on Obama Secret Trade Deal » Right Pundits,link,http://bit.ly/1Kcdr5o,2015-05-23 10:34:50,0,0,0,0,0,0,0,0,0
55076937573_10152686021677574,,State Department releases 296 Hillary Clinton Emails » Right Pundits,link,http://bit.ly/1FKrZLE,2015-05-23 09:29:47,0,0,0,0,0,0,0,0,0
55076937573_10152684009937574,,"ISIS takes Palmyra, Obama warns of Climate Change » Right Pundits",link,http://bit.ly/1Soo4rr,2015-05-22 11:28:03,0,0,0,0,0,0,0,0,0
55076937573_10152681692267574,,Is Glenn Beck Hearing Trumpets from the Sky? » Right Pundits,link,http://bit.ly/1FExr2L,2015-05-21 09:45:26,0,0,0,0,0,0,0,0,0
55076937573_10152679775582574,,Obama White House – ISIS Capture of Ramadi a 'Success' » Right Pundits,link,http://bit.ly/1R37gog,2015-05-20 08:05:10,0,0,1,0,0,0,0,0,0
55076937573_10152678113797574,,Hillary Clinton Emails Release Maybe January » Right Pundits,link,http://bit.ly/1R0x3gP,2015-05-19 11:12:50,0,0,0,0,0,0,0,0,0
55076937573_10152668340637574,,Iranian Boats Fire Shots as Obama Holds Gulf Summit » Right Pundits,link,http://bit.ly/1RKc8QA,2015-05-14 11:33:01,0,0,0,0,0,0,0,0,0
55076937573_10152666663247574,,Harriet Tubman on the $20 Bill? » Right Pundits,link,http://bit.ly/1zZJvJv,2015-05-13 09:21:49,0,0,0,0,0,0,0,0,0
55076937573_10152665235257574,,Saudi King Salman Snubs White House » Right Pundits,link,http://bit.ly/1zVMt1w,2015-05-12 07:19:43,0,0,0,0,0,0,0,0,0
55076937573_10152663403332574,,Not Tough Enough – Tufts Students End Hunger Strike » Right Pundits,link,http://bit.ly/1KAyxuf,2015-05-11 08:33:49,0,0,0,0,0,0,0,0,0
55076937573_10152660293617574,,ISIS Threat Raises US Bases Alert Status » Right Pundits,link,http://bit.ly/1ciyuYO,2015-05-09 07:50:28,0,0,0,0,0,0,0,0,0
55076937573_10152659104692574,,Michelle Obama Feels Uncomfortable in Museums » Right Pundits,link,http://bit.ly/1RkZpDC,2015-05-08 11:20:47,0,0,0,0,0,0,0,0,0
55076937573_10152654717857574,,ISIS Claims Credit for Texas Shooting Attack » Right Pundits,link,http://bit.ly/1c0yegW,2015-05-05 07:54:50,0,0,0,0,0,0,0,0,0
55076937573_10152653327632574,,Dr. Ben Carson and Carly Fiorina Launch GOP President Campaigns » Right Pundits,link,http://bit.ly/1E9IwSi,2015-05-04 09:08:04,0,0,0,0,0,0,0,0,0
55076937573_10152651742657574,,Book Review – 'Clinton Cash' by Peter Schweizer » Right Pundits,link,http://bit.ly/1IBVnmx,2015-05-03 07:19:26,0,0,0,0,0,0,0,0,0
55076937573_10152650448052574,,Royal Baby – It's a Girl! Duchess Kate Gives Birth! Open Thread » Right Pundits,link,http://bit.ly/1EH2KGA,2015-05-02 10:27:25,0,0,0,0,0,0,0,0,0
55076937573_10152649027022574,,"May Day 2015, MSNBC Alex Wagner – Obama Too White? » Right Pundits",link,http://bit.ly/1EANZoI,2015-05-01 10:30:42,0,0,0,0,0,0,0,0,0
55076937573_10152643306147574,,"Baltimore Riots 2015, City Burns, Mayor Blamed » Right Pundits",link,http://bit.ly/1EiMzPs,2015-04-28 08:11:11,0,0,0,0,0,0,0,0,0
55076937573_10152641224462574,,Death Toll Rises from Nepal Earthquake » Right Pundits,link,http://bit.ly/1djViYR,2015-04-27 07:22:52,0,0,0,0,0,0,0,0,0
55076937573_10152639784062574,,Kim Kardashian Begs Obama to Recognize Armenian Genocide » Right Pundits,link,http://bit.ly/1Dzm6e0,2015-04-26 12:44:54,0,0,0,0,0,0,0,0,0
55076937573_10152634915682574,,Vikings Season 3 Finale – 'The Dead' » Right Pundits,link,http://bit.ly/1DXYrX9,2015-04-24 08:01:43,0,0,0,0,0,0,0,0,0
55076937573_10152633061962574,,From Russia With Love – More Bill and Hillary 'Clinton Cash' Trouble » Right Pundits,link,http://bit.ly/1DmKShp,2015-04-23 09:42:38,0,0,0,0,0,0,0,0,0
55076937573_10152631205757574,,Earth Day 2015 – Obama Still Pitching Climate Change Lie » Right Pundits,link,http://bit.ly/1d0ulcE,2015-04-22 12:26:05,0,0,0,0,0,0,0,0,0
55076937573_10152629412257574,,"Don't Be Fooled, Michigan! Vote NO on Proposal 1 » Right Pundits",link,http://bit.ly/1Pcioyc,2015-04-21 13:41:50,0,0,0,0,0,0,0,0,0
55076937573_10152626962772574,,PBS tried to hide Slaver Background of Ben Affleck in 'Finding Your Roots' » Right Pundits,link,http://bit.ly/1DtjugS,2015-04-20 09:15:42,0,0,0,0,0,0,0,0,0
55076937573_10152626418892574,,Roger Jewell For President 2016 » Right Pundits,link,http://bit.ly/1D4NFeT,2015-04-20 01:37:44,0,0,0,0,0,0,0,0,0
55076937573_10152620990112574,,Hillary Clinton to CEOs – You Earn Too Much » Right Pundits,link,http://bit.ly/1Dra6gH,2015-04-17 09:37:50,0,0,0,0,0,0,0,0,0
55076937573_10152617049232574,,Hillary Clinton 'Scooby-Doo' Van causes Iowa College Lockdown » Right Pundits,link,http://bit.ly/1DipqMK,2015-04-15 08:36:45,0,0,0,0,0,0,0,0,0
55076937573_10152615146672574,,"Marco Rubio Announces 2016 Presidential Campaign, Fresh Face for White House Race! » Right Pundits",link,http://bit.ly/1NCzeJn,2015-04-14 08:40:09,0,0,0,0,0,0,0,0,0
55076937573_10152611244357574,,'Game of Thrones' Season 5 Premiere on HBO » Right Pundits,link,http://bit.ly/1PAyEdH,2015-04-12 09:26:43,0,0,0,0,0,0,0,0,0
55076937573_10152610844467574,,Hillary Clinton Announces Presidential Campaign on Social Media » Right Pundits,link,http://bit.ly/1NtU8dB,2015-04-12 04:12:03,0,0,0,0,0,0,0,0,0
55076937573_10152609354657574,,"Obama Solar Panels, $8 Million and Never Turned On for 2 Years » Right Pundits",link,http://bit.ly/1NqKMiB,2015-04-11 11:31:28,0,0,0,0,0,0,0,0,0
55076937573_10152603641442574,,Marijuana Legalization May Be Key to 2016 Swing States » Right Pundits,link,http://bit.ly/1PjvCdD,2015-04-08 08:49:49,0,0,0,0,0,0,0,0,0
55076937573_10152602049432574,,Rand Paul announces 2016 Presidential Campaign Bid » Right Pundits,link,http://bit.ly/1FbybLX,2015-04-07 10:37:14,0,0,0,0,0,0,0,0,0
55076937573_10152602022812574,,"Duke, Romney beat Wisconsin, Obama in NCAA Tournament » Right Pundits",link,http://bit.ly/1CivVeI,2015-04-07 10:18:23,0,0,0,0,0,0,0,0,0
55076937573_10152599859987574,,"Return of 'Mad Men', Is That All There Is? » Right Pundits",link,http://bit.ly/1aaPQFX,2015-04-06 08:56:37,0,0,0,0,0,0,0,0,0
55076937573_10152595213377574,,"Recession Part 2, 3? March Jobs Lame, GDP Forecast 0% » Right Pundits",link,http://bit.ly/1EVKvjj,2015-04-04 07:33:28,0,0,0,0,0,0,0,0,0
55076937573_10152593600567574,,147 Dead at Massacre at Kenya University » Right Pundits,link,http://bit.ly/1DFysoB,2015-04-03 11:53:20,0,0,0,0,0,0,0,0,0
55076937573_10152589536087574,,"No Deal, Yet – Iran Nuclear Deadline Passes » Right Pundits",link,http://bit.ly/1OZoTFu,2015-04-01 11:06:06,0,0,0,0,0,0,0,0,0
55076937573_10152585878272574,,"The Walking Dead Season 5 Finale – Rick Kills Pete, Morgan a Jedi » Right Pundits",link,http://bit.ly/1OQhsk3,2015-03-30 10:23:42,0,0,0,0,0,0,0,0,0
55076937573_10152583805522574,,"Report – Hillary Clinton Wiped Server, Emails Deleted » Right Pundits",link,http://bit.ly/1I9RXVx,2015-03-29 09:27:35,0,0,0,0,0,0,0,0,0
55076937573_10152579533702574,,"Obama Betrays Israel, then takes a Golf Vacation » Right Pundits",link,http://bit.ly/1ByUiW9,2015-03-27 08:59:34,0,0,0,0,0,0,0,0,0
55076937573_10152573906342574,,First Lady Michelle Obama Bald on Jeopardy » Right Pundits,link,http://bit.ly/1LXDXo9,2015-03-25 09:35:41,0,0,0,0,0,0,0,0,0
55076937573_10152573876937574,,Glenn Beck explains leaving GOP » Right Pundits,link,http://bit.ly/1GUiEx4,2015-03-25 09:12:57,0,0,0,0,0,0,0,0,0
55076937573_10152569669777574,,Ted Cruz First To Run for White House in 2016 » Right Pundits,link,http://bit.ly/1HpENDA,2015-03-23 08:40:32,0,0,0,0,0,0,0,0,0
55076937573_10152569535202574,,The Walking Dead Episode 'Try' – Paradise with Holes » Right Pundits,link,http://bit.ly/1HponuN,2015-03-23 07:52:21,0,0,0,0,0,0,0,0,0
55076937573_10152567429232574,,Did Obama wish Benjamin Netanyahu a Happy Nowruk Mubarack? » Right Pundits,link,http://bit.ly/1LJmVtM,2015-03-22 08:58:07,0,0,0,0,0,0,0,0,0
55076937573_10152565186227574,,Strength Through Joy – Hillary Clinton 'Fun Deficit' Adult Camps » Right Pundits,link,http://bit.ly/1CGE7KB,2015-03-21 07:45:23,0,0,0,0,0,0,0,0,0
55076937573_10152563179557574,,Obama wants Mandatory Voting just like North Korea » Right Pundits,link,http://bit.ly/1DFe73F,2015-03-20 09:15:23,0,0,0,0,0,0,0,0,0
55076937573_10152561100257574,,"Raven Symone agrees, Michelle Obama from 'Planet of the Apes' » Right Pundits",link,http://bit.ly/18KU4DB,2015-03-19 08:57:32,0,0,0,0,0,0,0,0,0
55076937573_10152559113187574,,"Israel Election Results – Netanyahu Wins, Obama Loses » Right Pundits",link,http://bit.ly/1BPp6Ej,2015-03-18 08:10:49,0,0,0,0,0,0,0,0,0
55076937573_10152557033077574,,Happy St. Patrick's Day 2015 Myths and History » Right Pundits,link,http://bit.ly/1ATsFWx,2015-03-17 09:40:42,0,0,0,0,0,0,0,0,0
55076937573_10152552222787574,,Barack and Michelle Obama Fly Separately to California on Your Dime » Right Pundits,link,http://bit.ly/1ArsFOa,2015-03-15 10:55:29,0,0,0,0,0,0,0,0,0
55076937573_10152552068622574,,Is Obama behind Hillary Clinton Email Scandal? » Right Pundits,link,http://bit.ly/1ArdPr1,2015-03-15 09:49:08,0,0,0,0,0,0,0,0,0
55076937573_10152547265447574,,Who's Crazier? Hillary Clinton or Carol from 'The Walking Dead'? » Right Pundits,link,http://bit.ly/1HRUe8g,2015-03-13 09:08:29,0,0,0,0,0,0,0,0,0
55076937573_10152540343307574,,"ATF Reverses Ammo Ban, Claims 'Publishing Mistake' » Right Pundits",link,http://bit.ly/1Hv9RlO,2015-03-10 11:04:37,0,0,0,0,0,0,0,0,0
55076937573_10152540248362574,,"White House Changes Story, Obama Knew About Hillary Clinton Emails » Right Pundits",link,http://bit.ly/1HuZWwF,2015-03-10 10:37:48,0,0,0,0,0,0,0,0,0
55076937573_10152538123027574,,Obama Lied about Al Qaeda » Right Pundits,link,http://bit.ly/1A8Jc8A,2015-03-09 09:39:19,0,0,0,0,0,0,0,0,0
55076937573_10152531727667574,,"Hillary-dot-Net, More Clinton Email Trouble » Right Pundits",link,http://bit.ly/1H6DVUM,2015-03-06 10:35:02,0,0,0,0,0,0,0,0,0
55076937573_10152527683632574,,Obama Executive Order to Raise Taxes » Right Pundits,link,http://bit.ly/1Elq5Ow,2015-03-04 11:42:49,1,1,0,1,0,0,0,0,0
55076937573_10152525859042574,,Hillary Clinton used private email account as Secretary of State » Right Pundits,link,http://bit.ly/1EefWTy,2015-03-03 10:09:06,0,0,0,0,0,0,0,0,0
55076937573_10152525810062574,,Benjamin Netanyahu Congress Speech on Obama Iran Nuke Talks » Right Pundits,link,http://bit.ly/1Ee5vQ0,2015-03-03 09:35:12,0,0,0,0,0,0,0,0,0
55076937573_10152522555717574,,"Phil Robertson at CPAC, Rand Paul Wins Straw Poll » Right Pundits",link,http://bit.ly/1zveBSi,2015-03-01 11:34:15,0,0,0,0,0,0,0,0,0
55076937573_10152522486077574,,"Leonard Nimoy, Live Long and Prosper, Spock » Right Pundits",link,http://bit.ly/1CduCTT,2015-03-01 10:41:40,0,0,0,0,0,0,0,0,0
55076937573_10152520612872574,,"House, Senate passes DHS bill, funds for 1 week » Right Pundits",link,http://bit.ly/1LVQ9T0,2015-02-28 08:59:02,0,0,0,0,0,0,0,0,0
55076937573_10152519377492574,,Dogfight! John Kerry vs James Clapper on Are We Safe? » Right Pundits,link,http://bit.ly/1wrJUx6,2015-02-27 13:38:23,0,0,0,0,0,0,0,0,0
55076937573_10152515593427574,,CPAC 2015 Begins (Open Thread) » Right Pundits,link,http://bit.ly/1Btp200,2015-02-25 10:30:00,0,0,0,0,0,0,0,0,0
55076937573_10152515561262574,,Obama Silent as ISIS Kidnaps 150 Christians in Syria » Right Pundits,link,http://bit.ly/1LH1uWP,2015-02-25 10:00:19,0,0,0,0,0,0,0,0,0
55076937573_10152515522832574,,Eddie Ray Routh Guilty in American Sniper Trial » Right Pundits,link,http://bit.ly/1LGSnpa,2015-02-25 09:27:01,0,0,0,0,0,0,0,0,0
55076937573_10152515522762574,,Is Obama a Christian? » Right Pundits,link,http://bit.ly/1ajioxg,2015-02-25 09:26:59,0,0,0,0,0,0,0,0,0
55076937573_10152515522692574,,Obama DHS – Right-wing Terror Threat worse than ISIS » Right Pundits,link,http://bit.ly/1ajiogW,2015-02-25 09:26:57,0,0,0,0,0,0,0,0,0
55076937573_10152515522637574,,Rudy Giuliani says Obama Doesn't Love America » Right Pundits,link,http://bit.ly/1ajiogR,2015-02-25 09:26:54,0,0,0,0,0,0,0,0,0
55076937573_10152515522577574,,Vikings Season 3 Premiere on History Channel » Right Pundits,link,http://bit.ly/1ajiogN,2015-02-25 09:26:52,0,0,0,0,0,0,0,0,0
55076937573_10152479215392574,,King Abdullah of Jordan May Fly Combat Mission Against ISIS » Right Pundits,link,http://bit.ly/18RyrSn,2015-02-05 13:03:28,0,0,0,0,0,0,0,0,0
55076937573_10152477628347574,,Gallup CEO – Unemployment Numbers a Lie » Right Pundits,link,http://bit.ly/16oDNTr,2015-02-04 13:52:46,0,0,0,0,0,0,0,0,0
55076937573_10152477582842574,,Response to Islamic State executing Jordanian Pilot » Right Pundits,link,http://bit.ly/1I2fUCm,2015-02-04 13:23:47,0,0,0,0,0,0,0,0,0
55076937573_10152472058182574,,Super Bowl XLIX 2015 or Zombie Bowl? » Right Pundits,link,http://bit.ly/1wRaSgL,2015-02-01 09:22:19,0,0,0,0,0,0,0,0,0
