status_id,status_message,link_name,status_type,status_link,status_published,num_reactions,num_comments,num_shares,num_likes,num_loves,num_wows,num_hahas,num_sads,num_angrys
553923781318329_1154630957914272,Were you calling this weekend?,SANDERS CAMPAIGN SMASHES HISTORIC CALL GOALS - Young Progressive Voices,link,http://www.youngprogressivevoices.com/2016/04/17/sanders-campaign-smashes-historic-call-goals/,2016-04-17 22:34:19,90,10,87,70,19,1,0,0,0
553923781318329_1154328034611231,Holy shit.,Bernie Sanders Surprises at Coachella - Young Progressive Voices,link,http://www.youngprogressivevoices.com/2016/04/17/bernie-sanders-surprises-at-coachella/,2016-04-17 10:55:45,149,4,28,137,10,0,2,0,0
553923781318329_1153966527980715,Breaking News:,BERNIE SANDERS PICKS UP TWO MORE DELEGATES IN COLORADO - Young Progressive Voices,link,http://www.youngprogressivevoices.com/2016/04/16/breaking-news-bernie-picks-two-delegates-colorado-2/,2016-04-16 22:53:37,134,1,38,123,11,0,0,0,0
553923781318329_1153748978002470,"Take a break, have a laugh.",SNL Really Hates HRC - Young Progressive Voices,link,http://www.youngprogressivevoices.com/2016/04/16/2snl-really-hates-hrc/,2016-04-16 16:00:00,24,1,5,19,0,0,5,0,0
553923781318329_1153424051368296,An op-ed from a young progressive voice.,"Ted Cruz, Demagogue - Young Progressive Voices",link,http://www.youngprogressivevoices.com/2016/04/16/ted-cruz-demagogue/,2016-04-16 14:00:00,1,0,3,1,0,0,0,0,0
553923781318329_1153419181368783,Here are some of the Berniecrats up for election this year.,Meet the Progressive Candidates who Stand with Bernie Sanders! - Part 2 - Young Progressive Voices,link,http://www.youngprogressivevoices.com/2016/04/15/meet-progressive-candidates-stand-bernie-sanders-part-2/,2016-04-16 11:00:00,17,3,35,17,0,0,0,0,0
553923781318329_1153196878057680,Remember this?,"That Time Colbert ""Battled"" Elizabeth Warren Over Wall Street",link,http://www.youngprogressivevoices.com/2016/01/18/that-time-colbert-battled-elizabeth-warren-over-wall-street/,2016-04-15 18:30:00,5,2,3,4,1,0,0,0,0
553923781318329_1153193421391359,If you're following Bernie Sanders' trip to The Vatican today.,OP-ED: Bernie Sanders and the Catholic Vote - Young Progressive Voices,link,http://www.youngprogressivevoices.com/2016/04/12/bernie-sanders-and-the-catholic-vote/,2016-04-15 16:59:52,1,0,19,1,0,0,0,0,0
553923781318329_1151685888208779,Any Catholics for Bernie out there? Comment below.,OP-ED: Bernie Sanders and the Catholic Vote - Young Progressive Voices,link,http://www.youngprogressivevoices.com/2016/04/12/bernie-sanders-and-the-catholic-vote/,2016-04-13 11:59:08,9,5,19,9,0,0,0,0,0
553923781318329_1151114254932609,"Interested in contributing op-eds or news on Young Progressive Voices?

Let us know:

http://www.youngprogressivevoices.com/contact/",Contact - Young Progressive Voices,link,http://www.youngprogressivevoices.com/contact/,2016-04-12 14:43:43,2,4,1,2,0,0,0,0,0
553923781318329_1132000400177328,The strongest neoconservative in the 2016 race is Hillary Clinton.,POLITICO,video,https://www.facebook.com/politico/videos/10153410593036680/,2016-03-21 12:43:44,51,23,0,37,2,0,0,0,12
553923781318329_1124395054271196,Awesome!,Shaun King,photo,https://www.facebook.com/shaunking/photos/a.799605230078397.1073741828.799539910084929/1006523766053208/?type=3,2016-03-11 18:14:34,238,5,0,220,15,2,1,0,0
553923781318329_1122750524435649,"Wow, tonight should be known as the #MichiganMiracle.",Timeline Photos,photo,https://www.facebook.com/youngprogressivevoices/photos/a.554612581249449.1073741828.553923781318329/1122750524435649/?type=3,2016-03-09 00:52:35,35,3,11,29,1,0,5,0,0
553923781318329_1107225635988138,Take away what you will. Henry Kissinger is no progressive. We must stamp out the hawkishness on the left.,Veterans for Bernie Sanders,photo,https://www.facebook.com/Vets4Sanders/photos/a.485233071627396.1073741829.471628832987820/574753766008659/?type=3,2016-02-12 12:20:01,59,6,0,59,0,0,0,0,0
553923781318329_1106871279356907,We cried a little. #BlackLivesMatter,Bernie Sanders,video,https://www.facebook.com/berniesanders/videos/978803415507996/,2016-02-11 18:31:04,72,2,0,72,0,0,0,0,0
553923781318329_1105933182784050,"If only the U.S. Government wasn't flooded with lobbyists from these companies, perhaps we could also enact some change.",France Passes Law Banning Supermarket Food Waste,link,http://www.youngprogressivevoices.com/2016/02/08/france-passes-law-banning-supermarket-food-waste/,2016-02-10 18:30:00,20,1,2,20,0,0,0,0,0
553923781318329_1106290236081678,Do you agree with Coates's reasoning? Could Bernie be stronger on minority issues? #feeltheBern,Ta-Nehisi Coates Reluctantly Endorses Sanders For President,link,http://www.youngprogressivevoices.com/2016/02/10/ta-nehisi-coates-reluctantly-endorses-sanders-for-president/,2016-02-10 15:55:03,19,6,0,19,0,0,0,0,0
553923781318329_1105932786117423,A respectful move from the former-Secretary. #feeltheBern,"Hillary Clinton Applauds Sanders, Renews Political Campaign",link,http://www.youngprogressivevoices.com/2016/02/09/hillary-clinton-applauds-sanders-renews-political-campaign/,2016-02-10 15:00:30,10,11,1,10,0,0,0,0,0
553923781318329_1105932656117436,What does this say about the future of U.S. politics? #feeltheBern,Sanders And Trump Emerge As New Hampshire Victors,link,http://www.youngprogressivevoices.com/2016/02/09/sanders-trump-emerge-new-hampshire-victors/,2016-02-10 12:30:00,7,4,0,7,0,0,0,0,0
553923781318329_1105932526117449,"Oh Bill, why?",Bill Clinton Blames Sanders For Inspiring Sexism Against Hillary,link,http://www.youngprogressivevoices.com/2016/02/08/bill-clinton-blames-sanders-for-inspiring-sexism-against-hillary/,2016-02-10 10:01:49,32,39,46,32,0,0,0,0,0
553923781318329_1105932356117466,Do you #feeltheBern?,The Case For The Political Revolution,link,http://www.youngprogressivevoices.com/2016/02/08/case-political-revolution/,2016-02-10 08:00:00,32,6,2,32,0,0,0,0,0
553923781318329_1103446193032749,The Sanders campaign may have found it's next big talking point.,"Former Walmart Board Member Gets $353,000 Campaign Donation From Waltons",link,http://www.youngprogressivevoices.com/2016/02/05/clinton-received-300k-rich-conservative-family/,2016-02-05 13:32:22,50,5,26,50,0,0,0,0,0
553923781318329_1101455636565138,Let's keep fighting the good fight everyone! #feeltheBern!,Iowa Caucus Update: Sanders Surging To Tie With Clinton,link,http://www.youngprogressivevoices.com/2016/02/01/iowa-caucus-update-sanders-surging-tie-clinton/,2016-02-01 23:12:02,171,12,36,171,0,0,0,0,0
553923781318329_1101277986582903,"While Facebook isn't a good indication of Iowa, this is reassuring news for any Sanders fans out there.",Sanders dominating pre-caucus Facebook conversation in Iowa,link,http://www.politico.com/blogs/iowa-caucus-2016-live-updates/2016/02/bernie-sanders-facebook-iowa-218540?cmpid=sf,2016-02-01 15:04:27,86,6,5,86,0,0,0,0,0
553923781318329_1100983133279055,An interesting (and hilarious) look into Senator Warren's mindset against Wall Street.,"That Time Colbert ""Battled"" Elizabeth Warren Over Wall Street",link,http://www.youngprogressivevoices.com/2016/01/18/that-time-colbert-battled-elizabeth-warren-over-wall-street/,2016-02-01 13:00:00,4,0,1,4,0,0,0,0,0
553923781318329_1100984323278936,Let's rally up and support the political revolution! #feeltheBern,Why The #MarchForBernie Is Important For The Political Revolution,link,http://www.youngprogressivevoices.com/2016/01/30/marchforbernie-important-political-revolution/,2016-02-01 10:30:00,47,5,5,47,0,0,0,0,0
553923781318329_1100983013279067,Do you agree with the Vice President?,Joe Biden Praises GOP Primary For Helping Democrats,link,http://www.youngprogressivevoices.com/2016/01/31/joe-biden-praises-gop-primary-helping-democrats/,2016-02-01 08:00:00,22,4,2,22,0,0,0,0,0
553923781318329_1098946456816056,Perhaps not the right message the Secretary was looking to send....,"Hillary Clinton Says ""No We Can't""",link,http://www.youngprogressivevoices.com/2016/01/29/hillary-claims-sanders/,2016-01-29 13:32:24,371,54,5149,371,0,0,0,0,0
553923781318329_1093688724008496,We definitely didn't cry a little...,Bernie Sanders,video,https://www.facebook.com/berniesanders/videos/965594373495567/,2016-01-21 14:12:11,94,4,0,94,0,0,0,0,0
553923781318329_1092336484143720,We understand times can get tough and hope you all had a good Blue Monday!,The Most Depressing Day Of The Year Is This Monday,link,http://www.youngprogressivevoices.com/2016/01/18/depressing-day-year-monday/,2016-01-19 20:30:00,3,1,0,3,0,0,0,0,0
553923781318329_1092336340810401,A truly sad list to comply of (mostly) great actors.,8 Actors That Went Insane (Politically),link,http://www.youngprogressivevoices.com/2015/10/12/8-actors-went-insane-politically/,2016-01-19 18:30:01,5,2,6,5,0,0,0,0,0
553923781318329_1092336840810351,Cyberwarfare is quickly becoming a very real threat to global security.,Russian Cyberterrorists Attack Ukraine Airport,link,http://www.youngprogressivevoices.com/2016/01/18/russian-cyberterrorists-attack-ukraine-airport/,2016-01-19 16:30:00,1,0,0,1,0,0,0,0,0
553923781318329_1092336114143757,"From attacking universal healthcare to petty insults against Sanders to a failure to disassociate herself from Wall Street, Hillary Clinton has revealed the inherent flaws of her presidential campaign. #feeltheBern",The Beginning Of The End of Hillary Clinton's Campaign,link,http://www.youngprogressivevoices.com/2016/01/18/beginning-of-end-hillary-clintons-campaign/,2016-01-19 14:00:01,98,11,174,98,0,0,0,0,0
553923781318329_1092335317477170,The relationship between being pro-life and anti-environment revealed.,Psychological Difference Between Liberals and Conservatives,link,http://www.youngprogressivevoices.com/2015/05/13/whats-psychological-difference-liberals-conservatives/,2016-01-19 12:00:01,26,0,10,26,0,0,0,0,0
553923781318329_1092334687477233,"No, we're not joking. If these clowns can't take a few tough questions from moderators, how in the world are they qualified for the office of President of the United States?","RNC Severs Ties With NBC Over ""Mean-Spirited"" Questions",link,http://www.youngprogressivevoices.com/2016/01/18/rnc-severs-ties-nbc-mean-spirited-questions/,2016-01-19 10:00:01,48,8,104,48,0,0,0,0,0
553923781318329_1092334107477291,"""Bobody should be allowed to steal your purse on Main Street, or be able to steal your pension on Wall Street."" - Elizabeth Warren

We truly do miss the old Colbert.","That Time Colbert ""Battled"" Elizabeth Warren Over Wall Street",link,http://www.youngprogressivevoices.com/2016/01/18/that-time-colbert-battled-elizabeth-warren-over-wall-street/,2016-01-19 08:00:01,4,0,0,4,0,0,0,0,0
553923781318329_1092079234169445,Top economists from all sides of the spectrum are saying Bernie Sanders's plans are economically feasible. #feelthebern,Economic Experts Support Bernie Sanders Policies,link,http://www.youngprogressivevoices.com/2016/01/17/economic-experts-support-bernie-sanders-policies/,2016-01-18 18:00:00,198,4,349,198,0,0,0,0,0
553923781318329_1092078324169536,Do you think the Iran deal is ultimately good or bad?,Iran President Says Nuclear Deal Will Help The Country,link,http://www.youngprogressivevoices.com/2016/01/18/iran-president-says-nuclear-deal-will-help-country/,2016-01-18 16:00:01,10,3,0,10,0,0,0,0,0
553923781318329_1092077914169577,The Korean War continues to get stranger and stranger.,North Korea Responds To South Korean Music With Balloons,link,http://www.youngprogressivevoices.com/2016/01/18/north-korea-responds-south-korean-music-balloons/,2016-01-18 14:00:34,7,2,0,7,0,0,0,0,0
553923781318329_1091870097523692,"""Bernie is speaking to a yearning that is deep and real. And he has credibility on it.""
-Vice President Joe Biden #feelthebern",Joe Biden Gave A Subtle Endorsement For Bernie Sanders,link,http://www.youngprogressivevoices.com/2016/01/16/joe-biden-subtle-endorsement-bernie-sanders/,2016-01-18 12:00:00,58,0,3,58,0,0,0,0,0
553923781318329_1091869694190399,Worthless trash ruining the reputation of responsible gun owners.,Redneck Scum Form An Army Over Oregon Occupation,link,http://www.youngprogressivevoices.com/2016/01/16/redneck-scum-form-army-oregon-occupation/,2016-01-18 10:00:01,18,1,4,18,0,0,0,0,0
553923781318329_1091869517523750,Isn't it great when Fox News reporters actually act like journalists every once in a while?,That Time Chris Wallace Grilled Dick Cheney Over Iran Failures,link,http://www.youngprogressivevoices.com/2015/10/14/time-chris-wallace-grilled-dick-cheney-iran-failures/,2016-01-18 08:00:00,14,0,0,14,0,0,0,0,0
553923781318329_1089509877759714,Disgusting.,Hillary Clinton's Single-Payer Pivot Greased By Millions in Industry Speech Fees,link,https://theintercept.com/2016/01/13/hillary-clinton-single-payer/,2016-01-13 14:52:21,39,5,14,39,0,0,0,0,0
553923781318329_1089264207784281,A great victory for Sanders supporters everywhere! #feeltheBern,Sanders Leads Hillary And Trump In Iowa/New Hampshire Polls,link,http://www.youngprogressivevoices.com/2016/01/13/sanders-leads-hillary-trump-iowanew-hampshire-polls/,2016-01-13 12:30:00,112,4,20,112,0,0,0,0,0
553923781318329_1089262297784472,"For the first time in over a hundred years, the women's health organization has endorsed a candidate for President!",Planned Parenthood Endorses Hillary For President,link,http://www.youngprogressivevoices.com/2016/01/13/planned-parenthood-endorses-hillary-president/,2016-01-13 10:30:00,6,7,3,6,0,0,0,0,0
553923781318329_1089262041117831,David Bowie was a great human being on and off the stage. Rest in Peace sir!,That Time David Bowie Humiliated MTV For Excluding Black Artists,link,http://www.youngprogressivevoices.com/2016/01/13/time-david-bowie-humiliated-mtv-excluding-black-artists/,2016-01-13 08:00:00,21,2,6,21,0,0,0,0,0
553923781318329_1088984904478878,"If you truly want to help the Bernie Sanders campaign effort, we've researched several new technologies you can use to make a real difference. #feeltheBern",The Techno Sanders Campaign Is INCREDIBLE!,link,http://www.youngprogressivevoices.com/2016/01/12/techno-sanders-campaign-incredible/,2016-01-12 18:00:00,30,2,139,30,0,0,0,0,0
553923781318329_1088760191168016,Do you agree with Ms. Fulton's reasoning? #blacklivesMatter #ReadyforHillary,Trayvon Martin's Mom Endorses Hillary Clinton For President,link,http://www.youngprogressivevoices.com/2016/01/12/trayvon-martins-mom-endorses-hillary-clinton-president/,2016-01-12 16:00:00,5,2,2,5,0,0,0,0,0
553923781318329_1088759934501375,"Republicans have their moments, though sadly microscopic in number. Still, perhaps Ryan can use his short tenure to move the GOP towards a more reasonable platform (assuming he has genuinely changed).","Paul Ryan (Surprisingly) Apologizes For Calling The Poor ""Takers""",link,http://www.youngprogressivevoices.com/2016/01/12/paul-ryan-surprisingly-apologizes-calling-poor-takers/,2016-01-12 14:00:01,7,1,1,7,0,0,0,0,0
553923781318329_1088759557834746,"For over four years, these lunatics continue to fight genuine progress in the healthcare industry. And now this idiot thinks he can single-handedly destroy the healthcare market in his state?",Moronic Kentucky Governor Will Fight Obamacare,link,http://www.youngprogressivevoices.com/2016/01/12/moronic-kentucky-governor-will-fight-obamacare/,2016-01-12 12:00:00,2,0,0,2,0,0,0,0,0
553923781318329_1088759201168115,These talks could be the first step in creating a period of peace the Middle East desperately needs.,Afghanistan Peace Talks Resume For Ending The Taliban,link,http://www.youngprogressivevoices.com/2016/01/12/afghanistan-peace-talks-resume-ending-taliban/,2016-01-12 10:00:00,7,0,2,7,0,0,0,0,0
553923781318329_1088758894501479,Do you believe the former President deserved to be impeached?,That Time Bill Maher And Joe Scarborough Clashed Over Impeaching Bush,link,http://www.youngprogressivevoices.com/2015/12/22/time-bill-maher-joe-scarborough-clashed-impeaching-bush/,2016-01-12 08:00:00,2,1,0,2,0,0,0,0,0
553923781318329_1088158807894821,"Remember, we can always improve our society, even in small ways like this.",Japan Keeps This Defunct Train Station Running for Just One Passenger,link,http://www.citylab.com/commute/2016/01/japan-keeps-this-defunct-train-station-running-for-just-one-passenger/423273/?utm_source=atlfb,2016-01-12 00:00:01,35,1,5,35,0,0,0,0,0
553923781318329_1088157687894933,These horrible war crimes are never unpredictable- there is always a root cause.,5 Things You Need To Know About Genocide,link,http://www.youngprogressivevoices.com/2015/05/10/5-facts-need-know-genocide/,2016-01-11 22:00:01,12,1,2,12,0,0,0,0,0
553923781318329_1088158061228229,The great thing about being a progressive is embracing the enthusiasm of futurism!,Tesla CEO Predicts Driverless Cars By 2018,link,http://www.youngprogressivevoices.com/2016/01/11/tesla-ceo-predicts-driverless-cars-2018/,2016-01-11 20:00:01,3,0,1,3,0,0,0,0,0
553923781318329_1088156397895062,"It's long overdue, but we're glad it's finally happened.",FBI Now Lists Animal Abuse As A Class-A Felony,link,http://www.youngprogressivevoices.com/2016/01/11/fbi-now-lists-animal-abuse-class-felony/,2016-01-11 18:00:00,23,1,5,23,0,0,0,0,0
553923781318329_1088156854561683,"Jones is right- it's not that Trump is a racist (although he is), it's that he attracts racists.",Van Jones Criticizes Trump For Inspiring Racism,link,http://www.youngprogressivevoices.com/2016/01/11/van-jones-criticizes-trump-inspiring-racism/,2016-01-11 16:00:00,19,0,3,19,0,0,0,0,0
553923781318329_1088155891228446,Beautiful things are emerging in Afghanistan.,Afghanistan's Plans For A Former NATO Camp Are Inspiring,link,http://www.youngprogressivevoices.com/2016/01/11/afghanistans-plans-former-nato-camp-inspiring/,2016-01-11 14:00:00,10,0,3,10,0,0,0,0,0
553923781318329_1088155067895195,Is this a good or bad decision on the President's part?,President Obama Won't Back Candidate During The Primary,link,http://www.youngprogressivevoices.com/2016/01/11/president-obama-wont-back-candidate-primary/,2016-01-11 12:00:00,11,9,0,11,0,0,0,0,0
553923781318329_1088155444561824,We swear we're not exaggerating.,That Time Ann Coulter Turned A Room Full Of Libertarians Into Liberals,link,http://www.youngprogressivevoices.com/2015/10/18/time-ann-coulter-turned-room-full-libertarians-liberals/,2016-01-11 10:00:00,10,2,1,10,0,0,0,0,0
553923781318329_1088154417895260,Isn't it great when Ted Cruz finally realizes that he is an immigrant?,"Ted Cruz Criticizes Trump's Immigrant ""Deportation Force""",link,http://www.youngprogressivevoices.com/2016/01/11/ted-cruz-criticizes-trumps-immigrant-deportation-force/,2016-01-11 08:00:00,7,0,1,7,0,0,0,0,0
553923781318329_1087497937960908,It's truly great when O'Reilly gets owned on his own show.,That Time Phil Donahue Stood Up To O'Reilly's Bullying,link,http://www.youngprogressivevoices.com/2015/10/11/that-time-phil-donahue-stood-up-to-oreilly-bullying/,2016-01-10 23:00:00,11,4,3,11,0,0,0,0,0
553923781318329_1087496074627761,It's important that we as progressives don't just support the environment- we understand it.,Google's Mountain Of The Butterflies Logo Explained,link,http://www.youngprogressivevoices.com/2016/01/10/googles-mountain-butterflies-logo-explained/,2016-01-10 21:00:00,5,0,0,5,0,0,0,0,0
553923781318329_1087495697961132,Some silver lining to our previous article published earlier. What can we say? Even a broken clock is right twice a day.,Charles Koch Criticizes Trump And Cruz's Foreign Policy,link,http://www.youngprogressivevoices.com/2016/01/10/charles-koch-criticizes-trump-cruzs-foreign-policy/,2016-01-10 18:30:00,5,1,1,5,0,0,0,0,0
553923781318329_1087495187961183,"It's nice to see some logical input into this discussion, even if Ms. Mogahed falls into a True Scotsman near the end.",Muslim Scholar Explains Roots Of Islamic Terrorism On Daily Show,link,http://www.youngprogressivevoices.com/2016/01/10/muslim-scholar-explains-roots-islamic-terrorism-daily-show/,2016-01-10 16:30:01,7,1,2,7,0,0,0,0,0
553923781318329_1087494491294586,"The political revolution has begun, and we can't think of a better leader than Bernie Sanders! #feeltheBern",#MarchForBernie! Why Everyone Should Support Bernie Sanders,link,http://www.youngprogressivevoices.com/2016/01/10/marchforbernie-everyone-support-bernie-sanders/,2016-01-10 14:00:00,15,0,4,15,0,0,0,0,0
553923781318329_1087493571294678,Isn't it nice when NRA members finally stand up to the disgusting gun lobby of Wayne LaPierre and co.?,NRA War Hero Supports Background Checks,link,http://www.youngprogressivevoices.com/2016/01/10/nra-war-hero-supports-background-checks/,2016-01-10 12:00:01,49,0,11,49,0,0,0,0,0
553923781318329_1087492491294786,"The evolution of warfare continues. In all seriousness though, we sincerely hope this new development helps achieve the breakthrough North Korean citizens need.",South Korea Fights North Korea....With Music?,link,http://www.youngprogressivevoices.com/2016/01/10/south-korea-fights-north-korea-music/,2016-01-10 10:00:00,7,0,3,7,0,0,0,0,0
553923781318329_1087491091294926,Someone please get this loon's head examined.,Koch Brother Complains He Doesn't Have Enough Say In Politics,link,http://www.youngprogressivevoices.com/2016/01/09/koch-brother-complains-doesnt-enough-say-politics/,2016-01-10 08:00:00,8,5,7,8,0,0,0,0,0
553923781318329_1086309001413135,This is beyond belief.,The Six Corporations That Own 90 Percent Of The American Media,link,http://www.youngprogressivevoices.com/2015/11/05/six-corporations-90-percent-american-media/,2016-01-08 21:00:00,16,1,11,16,0,0,0,0,0
553923781318329_1086308804746488,True story- Reagan's ghost haunts the RNC.,That Time Bill Maher Explained Why Reagan Is A Tea Party Hero,link,http://www.youngprogressivevoices.com/2015/11/07/time-bill-maher-explained-reagan-tea-party-hero/,2016-01-08 19:00:00,3,0,0,3,0,0,0,0,0
553923781318329_1086308574746511,"""What harm comes from supplying people with birth control, condoms, Pap smears, and cancer screenings?""
-Jennifer Lawrence",Jennifer Lawrence Lends Strong Support For Planned Parenthood,link,http://www.youngprogressivevoices.com/2016/01/08/jennifer-lawrence-lends-strong-support-planned-parenthood/,2016-01-08 17:00:00,88,3,20,88,0,0,0,0,0
553923781318329_1086308068079895,DWS is ruining the DNC's reputation with her corrupt practices.,"Democrats- Get Rid Of Debbie Wasserman Schultz, NOW!",link,http://www.youngprogressivevoices.com/2016/01/08/democrats-get-rid-debbie-wasserman-schultz-now/,2016-01-08 14:30:01,112,10,13,112,0,0,0,0,0
553923781318329_1086307831413252,Rednecks are migrating all across the country into all sorts of political offices- be wary.,"Maine Governor Thinks Drugs Dealers Are Black, Impregnate White Girls",link,http://www.youngprogressivevoices.com/2016/01/08/maine-governor-thinks-drugs-dealers-black-impregnate-white-girls/,2016-01-08 12:30:00,6,2,0,6,0,0,0,0,0
553923781318329_1086307611413274,These monsters will stop at nothing to destroy our environment.,TransCanada Is Suing Obama For Rejecting The Keystone Pipeline,link,http://www.youngprogressivevoices.com/2016/01/08/transcanada-suing-obama-rejecting-keystone-pipeline/,2016-01-08 10:00:00,7,1,8,7,0,0,0,0,0
553923781318329_1086307381413297,Stricter sanctions need to be implemented if we are ever going to get North Korea to yield.,Kerry Criticizes China For Supporting North Korea,link,http://www.youngprogressivevoices.com/2016/01/08/kerry-criticizes-china-supporting-north-korea/,2016-01-08 08:00:00,5,1,2,5,0,0,0,0,0
553923781318329_1085780338132668,"Trump may have finally found his match, and the American people a savior.",Donald Trump Started A Hilarious Fight With Samuel L. Jackson,link,http://www.youngprogressivevoices.com/2016/01/07/donald-trump-started-hilarious-fight-samuel-l-jackson/,2016-01-07 21:00:00,53,6,3,53,0,0,0,0,0
553923781318329_1085780071466028,How many protests and dead kids will it take for the government to do something? #blacklivesmatter,#BlackXmas2: Minnesota Rises Up For Jamar Clark,link,http://www.youngprogressivevoices.com/2016/01/07/blackxmas2-minnesota-rises-jamar-clark/,2016-01-07 19:00:00,1,0,1,1,0,0,0,0,0
553923781318329_1085779681466067,These people are a literal threat to this country's progress.,The F*cking Republicans Have Finally Done It,link,http://www.youngprogressivevoices.com/2016/01/07/fcking-republicans-finally-done/,2016-01-07 16:30:00,61,9,39,61,0,0,0,0,0
553923781318329_1086032691440766,Today is voting day for MoveOn.org! Vote for your favorite candidate!,Millennials For Revolution,link,http://act.moveon.org/survey/2016_presidential_endorsement-vote?akid=s2249..2RxnL-,2016-01-07 14:44:50,15,1,0,15,0,0,0,0,0
553923781318329_1085779338132768,"""Or maybe even 'Jeb semicolon'. It's perfect for Jeb because you know it's smart, but you're not sure what it does or where it belongs.""",Colbert Mocks Jeb Bush's Campaign,link,http://www.youngprogressivevoices.com/2016/01/07/colbert-mocks-jeb-bushs-campaign/,2016-01-07 14:30:00,7,0,0,7,0,0,0,0,0
553923781318329_1085778918132810,Business certainly has a way of outdoing political differences. #feeltheBern,Remember When The Owner Of Fox News Supported Hillary?,link,http://www.youngprogressivevoices.com/2016/01/07/remember-owner-fox-news-supported-hillary/,2016-01-07 12:00:00,2,0,1,2,0,0,0,0,0
553923781318329_1085778194799549,We are all the same in the most important ways.,Scientists Find Strong Similarities Between Animal And Human Consciousness,link,http://www.youngprogressivevoices.com/2016/01/07/scientists-find-strong-similarities-animal-human-consciousness/,2016-01-07 10:00:00,8,4,1,8,0,0,0,0,0
