status_id,status_message,link_name,status_type,status_link,status_published,num_reactions,num_comments,num_shares,num_likes,num_loves,num_wows,num_hahas,num_sads,num_angrys
553923781318329_1439278466116185,"Knock Every Door—formed in January by a group of Sanders campaign alums and led by his organizing guru Becky Bond—is an oddity among the hundreds of liberal groups that have popped up in the wake of Trump's election. The name gives away its mission; the group is focused on reaching two groups of voters: people who voted for Obama in 2012 and then flipped to Trump four years later, and the people who simply didn't vote at all.",These Bernie alums think they've found the secret to reaching Trump voters,link,http://www.motherjones.com/politics/2017/02/these-democrats-are-going-door-door-asking-trump-voters-simple-question,2017-03-03 21:20:00,28,2,7,25,3,0,0,0,0
553923781318329_1432464866797545,"The American people agree with Bernie's agenda.

If you believe that to be true-- these folks are onto something.",NowThis Politics,video,https://www.facebook.com/NowThisPolitics/videos/1461040963927389/,2017-02-21 12:55:03,11,3,0,10,1,0,0,0,0
553923781318329_1397412013636164,"What do you think? 

We agree with Knock Every Door.",Knock Every Door,note,https://www.facebook.com/notes/knock-every-door/why-democrats-lost/1840198072888462/,2017-01-18 13:35:46,3,1,0,2,0,0,0,1,0
553923781318329_1376980675679298,Tis the season to be scared.,What Obama And Trump Did For Christmas Tell Us EVERYTHING We Need To Know About What's To Come,link,http://reverbpress.com/politics/obama-trump-christmas-tell-us-everything-need-know-whats-come/,2016-12-26 23:23:25,3,0,1,3,0,0,0,0,0
553923781318329_1375957912448241,What is the Trump Administration hiding?,Trouble In Trumpland? Trump Advisor Deletes Twitter Account After Hints Of Sex Scandal,link,http://reverbpress.com/news/trouble-trumpland-trump-advisor-deletes-twitter-account-hints-sex-scandal/,2016-12-25 18:35:00,6,1,2,1,0,1,1,0,3
553923781318329_1375957779114921,All hail the Orange King!,"The GOP Issues Statement Heralding 'New King,' Social Media Explodes With Rage",link,http://reverbpress.com/news/gop-issues-statement-heralding-new-king-social-media-explodes-rage/,2016-12-25 17:23:50,18,8,8,9,0,2,0,3,4
553923781318329_1374929189217780,Trump attracts all sorts of hateful vermin.,Trump Campaign Official With Racist History Defends Death Threats Towards The Obamas,link,http://reverbpress.com/politics/trump-campaign-official-racist-history-defends-death-threats-towards-obamas/,2016-12-24 14:13:30,10,2,1,0,0,0,0,2,8
553923781318329_1374139369296762,Winter is coming faster than we think.,"Trump Shows Off Christmas Letter From Putin, Says Russian Dictator's Thinking Is 'So Correct'",link,http://162.144.96.58/news/trump-shows-off-christmas-letter-putin-says-russian-dictators-thinking-correct/,2016-12-23 15:29:15,9,1,2,2,0,0,0,3,4
553923781318329_1373207229389976,Oh my!,George Takei Destroys Trump's Pathological Lying With This Hilarious Joke,link,http://reverbpress.com/politics/george-takei-destroys-trumps-pathological-lying-with-this-hilarious-joke/,2016-12-22 16:00:00,13,0,1,11,1,0,1,0,0
553923781318329_1373182396059126,Thanks Obama!,Obama Sabotages Trump's Muslim Registry Plan On His Way Out Of Office,link,http://reverbpress.com/news/obama-sabotages-trumps-muslim-registry-plan-way-office/,2016-12-22 15:15:20,61,2,6,47,14,0,0,0,0
553923781318329_1370466032997429,Disgusting sociopaths.,REPORT: Trump Fundraiser Charging Astronomical Price For A Chance To Go Hunting With Eric and Trump Jr.,link,http://reverbpress.com/news/report-trump-fundraiser-charging-astronomical-price-chance-go-hunting-eric-trump-jr/,2016-12-19 20:13:03,21,4,8,3,0,0,0,2,16
553923781318329_1365699780140721,The White House is officially behind it!,BREAKING: White House Statement Could Be Final Nail In Coffin For Trump/Russia Connection (VIDEO),link,http://reverbpress.com/politics/breaking-white-house-statement-could-be-final-nail-in-coffin-for-trumprussia-connection/,2016-12-14 18:13:00,43,2,15,32,6,3,0,0,2
553923781318329_1364065286970837,We're amazed too.,"Mitch McConnell Turns On Republican Party, Supports Russian Investigations (VIDEO)",link,http://reverbpress.com/politics/mitch-mcconnell-turns-trump-supports-russian-investigations/,2016-12-13 11:32:14,8,5,2,7,0,0,1,0,0
553923781318329_1364059756971390,How crazy are you when the Tea Party is morally superior?,"Trump Is A Traitor, Says Tea Party Ex-Senator Who Threatened Armed Revolt If Clinton Won (VIDEO)",link,http://reverbpress.com/politics/trump-traitor-says-tea-party-ex-senator-threatened-armed-revolt-clinton-won-video/,2016-12-13 10:00:13,7,0,3,6,1,0,0,0,0
553923781318329_1362457720464927,Drumpf will destroy the stability of this country within his first 100 days.,RED LINE: Israeli Warmonger Netanyahu Eager To Work With Trump To End Peace With Iran,link,http://reverbpress.com/news/red-line-israeli-prime-minister-netanyahu-eager-to-work-with-trump-to-end-peace-with-iran/,2016-12-12 09:30:02,12,6,1,5,0,0,0,0,7
553923781318329_1362018210508878,"Maybe Trump is getting his intelligence briefings from Russia's spies, instead of our own...","WARNING: Donald Trump 'Is Not A Loyal American', Says Famed Ex-CIA Agent",link,http://reverbpress.com/news/famous-ex-cia-agent-issues-dire-warning-donald-trump-not-loyal-american/,2016-12-11 18:13:37,53,4,19,48,0,2,0,0,3
553923781318329_1361952173848815,"The two sides are NOT equal, period.",The NY Times Promotes A Dangerous False Equivalency Between Trump Supporters And Hate Crime Victims,link,http://reverbpress.com/news/ny-times-promotes-a-dangerous-false-equivalency-between-trump-and-hate-crime-victims/,2016-12-11 16:59:09,2,3,0,2,0,0,0,0,0
553923781318329_1361791860531513,Putin may have just helped Clinton!,"Russia's Meddling Means Supreme Court Could Drain Trump's Swamp, Appoint Clinton",link,http://reverbpress.com/politics/russias-meddling-might-mean-courts-could-drain-trumps-swamp-appoint-clinton/,2016-12-11 14:11:48,61,11,14,41,13,4,2,1,0
553923781318329_1360704387306927,Bigotry has no place in this country.,Citizens Rally to Kick White Supremacists Out of Town: This Is How You Deal With Nazis (VIDEO),link,http://reverbpress.com/news/citizens-rally-to-kick-white-supremacists-out-of-town-this-is-how-you-deal-with-nazis-video/,2016-12-10 17:03:48,28,4,11,22,4,2,0,0,0
553923781318329_1359553194088713,"One man fought for the working class, the other to destroy it. We're siding with the former.",A Union Leader Is Taking On Trump And Making Him Look Like A Petulant Child,link,http://reverbpress.com/news/union-leader-taking-trump-making-look-like-petulant-child/,2016-12-09 16:47:50,29,3,3,23,4,1,1,0,0
553923781318329_1232498853460815,Do you think there should be more women in politics?,That Time Matalin And Granholm Clashed Over Women In Politics,link,http://www.youngprogressivevoices.com/2016/08/13/time-mary-matalin-jennifer-granholm-clashed-women-politics/,2016-08-14 05:00:00,2,6,0,2,0,0,0,0,0
553923781318329_1232501163460584,It's nice when celebrities showcase some relatable traits.,Twitter Hashtag Reveals Jobs Celebrities Had,link,http://www.youngprogressivevoices.com/2016/08/13/twitter-hashtag-reveals-jobs-celebrities/,2016-08-14 01:00:00,0,3,0,0,0,0,0,0,0
553923781318329_1232500163460684,The joys of the Internet!,The Internet Is Making Fun Of Trump In Two Ways,link,http://www.youngprogressivevoices.com/2016/08/13/internet-making-fun-trump-two-ways/,2016-08-13 23:00:00,1,0,1,1,0,0,0,0,0
553923781318329_1232498426794191,A Reagan worshiper has bailed on Trump. Will the GOP split after this election?,Yet Another Conservative Writer Bails On Trump,link,http://www.youngprogressivevoices.com/2016/08/13/yet-another-conservative-writer-bails-trump/,2016-08-13 21:00:00,1,0,3,0,1,0,0,0,0
553923781318329_1232498566794177,,Timeline Photos,photo,https://www.facebook.com/youngprogressivevoices/photos/a.554612581249449.1073741828.553923781318329/1232498566794177/?type=3,2016-08-13 19:00:00,13,1,12,11,0,0,0,0,2
553923781318329_1232498150127552,Lemon does a good job grilling this deluded Trump supporter. #NeverTrump,Don Lemon's Heated Debate With A Republican Over Trump's Comments,link,http://www.youngprogressivevoices.com/2016/08/13/don-lemon-argues-ex-secret-service-agent-trumps-comments/,2016-08-13 17:00:00,1,1,0,0,1,0,0,0,0
553923781318329_1232497966794237,Let's hope this scumbag gets voted out of office.,Darrell Issa's Popularity Is Down Among Californians,link,http://www.youngprogressivevoices.com/2016/08/13/darrell-issas-popularity/,2016-08-13 15:00:00,3,0,7,3,0,0,0,0,0
553923781318329_1232494046794629,"Once an idiot, always an idiot.",Rick Santorum Fumbles To Defend Trump,link,http://www.youngprogressivevoices.com/2016/08/13/rick-santorum-fumbles-defend-trump/,2016-08-13 13:00:00,4,0,0,2,0,0,1,1,0
553923781318329_1232493416794692,Bernie is working to change the system from the inside. #feeltheBern,"Bernie Sanders Is Not A Traitor, He's A Pragmatic Rockefeller",link,http://www.youngprogressivevoices.com/2016/08/13/bernie-sanders-not-traitor-hes-pragmatic-rockefeller/,2016-08-13 11:00:01,13,3,3,11,2,0,0,0,0
553923781318329_1232492880128079,Did you think Trump would win the Republican nomination back in 2015?,That Time Bill Maher Predicted Trump Would Win The GOP Primary,link,http://www.youngprogressivevoices.com/2016/08/13/time-bill-maher-predicted-donald-trumps-win-gop-primary/,2016-08-13 09:00:01,0,1,0,0,0,0,0,0,0
553923781318329_1232492296794804,Nobody ever wanted a Purple Heart. #NeverTrump,Marine Destroys Trump's Optimism Over Receiving Purple Heart,link,http://www.youngprogressivevoices.com/2016/08/13/marine-destroys-trumps-optimism-receiving-purple-heart/,2016-08-13 07:00:00,3,0,0,2,0,1,0,0,0
553923781318329_1232492096794824,Why is a man as liberal as Clint Eastwood supporting Trump?,The Strange Political Case Of Clint Eastwood,link,http://www.youngprogressivevoices.com/2016/08/13/strange-case-clint-eastwood/,2016-08-13 05:00:00,0,3,0,0,0,0,0,0,0
553923781318329_1232487733461927,Some facts can't be denied.,Even The Wall Street Journal Admits Red States Take More From The Government,link,http://www.youngprogressivevoices.com/2015/11/01/even-wall-street-journal-admits-red-states-take-government/,2016-08-13 03:00:00,19,0,6,16,0,2,0,1,0
553923781318329_1231560106888023,It's welcome when big corporations fight bigotry.,Google Supports Trans People With This Hauntingly Beautiful Video,link,http://www.youngprogressivevoices.com/2015/07/16/google-supports-transsexuals-hauntingly-beautiful-video/,2016-08-13 01:00:00,2,0,0,1,1,0,0,0,0
553923781318329_1231559393554761,PBS is working to educate the American public about the minimum wage!,PBS Endorses A $15 Minimum Wage For Workers,link,http://www.youngprogressivevoices.com/2016/08/11/pbs-endorses-15-minimum-wage/,2016-08-12 23:00:00,7,0,1,6,1,0,0,0,0
553923781318329_1231559210221446,We were happy to see O'Donnell wipe the smirk off this congressman's face.,That Time Lawrence O'Donnell Humiliated Steve King,link,http://www.youngprogressivevoices.com/2016/08/11/time-lawrence-odonnell-humiliated-steve-king/,2016-08-12 21:00:00,1,0,0,1,0,0,0,0,0
553923781318329_1231558010221566,,Timeline Photos,photo,https://www.facebook.com/youngprogressivevoices/photos/a.554612581249449.1073741828.553923781318329/1231558010221566/?type=3,2016-08-12 19:00:00,15,0,5,10,0,1,0,3,1
553923781318329_1231558436888190,A Republican strategy in the Drug War that just might work!,Maryland Launches Surprisingly Smart Anti-Heroin Initiative,link,http://www.youngprogressivevoices.com/2016/08/11/maryland-launches-surprisingly-smart-anti-heroin-initiative/,2016-08-12 17:00:00,1,0,0,0,1,0,0,0,0
553923781318329_1231557860221581,"In a world where it's hard to find logic at times, the President has penned a grounded essay.",President Obama Writes Essay Supporting Feminism - Young Progressive Voices,link,http://www.youngprogressivevoices.com/2016/08/11/president-obama-writes-essay-supporting-feminism/,2016-08-12 15:00:00,0,0,0,0,0,0,0,0,0
553923781318329_1231557640221603,The conspiracies have officially begun!,Crazy Conservatives Blame Clinton For Racist Writer's Suicide,link,http://www.youngprogressivevoices.com/2016/08/11/crazy-conservatives-blame-clinton-racist-writers-suicide/,2016-08-12 13:00:00,0,0,0,0,0,0,0,0,0
553923781318329_1231551403555560,"Yes, the Trump campaign is this backwards. #NeverTrump",Trump Campaigner Claims Obama Is A Muslim,link,http://www.youngprogressivevoices.com/2016/08/11/trump-campaigner-claims-obama-muslim/,2016-08-12 11:00:00,3,1,1,2,0,0,0,0,1
553923781318329_1231549970222370,Could Assange have had ulterior motives with the DNC hack?,"Bill Maher Debates Julian Assange Over DNC Leaks, Snowden",link,http://www.youngprogressivevoices.com/2016/08/11/bill-maher-debates-julian-assange-dnc-leaks-snowden/,2016-08-12 09:00:00,2,1,0,2,0,0,0,0,0
553923781318329_1231236410253726,The political revolution lives on in more ways than one! #feeltheBern,Bernie Details The Future Of His Political Revolution,link,http://www.youngprogressivevoices.com/2016/08/06/bernie-details-future-political-revolution/,2016-08-12 07:00:00,7,0,4,6,1,0,0,0,0
553923781318329_1231547240222643,This is what happens when you let an idiot run his mouth non-stop. #NeverTrump,Trump Unintentionally Insults Bush Administration,link,http://www.youngprogressivevoices.com/2016/08/11/trump-unintentionally-insults-bush/,2016-08-12 05:00:00,3,0,0,1,0,1,1,0,0
553923781318329_1231249460252421,This is what happens when a car salesman takes on a scientist in a scientific field.,That Time Neil DeGrasse Tyson Schooled Bob Lutz On Global Warming,link,http://www.youngprogressivevoices.com/2015/10/20/neil-degrasse-tyson-schooled-bob-lutz-global-warming/,2016-08-12 03:00:00,15,1,2,13,2,0,0,0,0
553923781318329_1231246110252756,Kick back and relax with these pictures!,These Pictures Of Nature Will Bring You At Peace,link,http://www.youngprogressivevoices.com/2015/10/30/pictures-nature-will-bring-peace/,2016-08-12 01:00:00,5,1,2,4,1,0,0,0,0
553923781318329_1231234296920604,Should treason be grounds for the death penalty?,Iran Executes Nuclear Scientist Who Committed Treason To US - Young Progressive Voices,link,http://www.youngprogressivevoices.com/2016/08/10/iran-executes-nuclear-scientist-committed-treason-us/,2016-08-11 23:00:00,2,0,0,0,0,0,0,1,1
553923781318329_1230778213632879,Having more ignorance thrown into the mix isn't helping the situation at all.,Ringo Starr's Idiotic Reason For Supporting BREXIT,link,http://www.youngprogressivevoices.com/2016/08/11/ringo-starrs-idiotic-reason-supporting-brexit/,2016-08-11 21:00:00,1,1,0,0,0,0,1,0,0
553923781318329_1230776023633098,,Timeline Photos,photo,https://www.facebook.com/youngprogressivevoices/photos/a.554612581249449.1073741828.553923781318329/1230776023633098/?type=3,2016-08-11 19:00:00,7,0,1,7,0,0,0,0,0
553923781318329_1230776006966433,The GOP is crumbling while the Democratic Party is getting stronger. #ReadyForHillary,Clinton Gains Three More Big Endorsements,link,http://www.youngprogressivevoices.com/2016/08/11/clinton-gains-three-big-endorsements/,2016-08-11 17:00:00,2,0,0,2,0,0,0,0,0
553923781318329_1230775566966477,"This week in right-wing craziness, the awaited return of David Duke!",David Duke Asserts That Trump Isn't Racist,link,http://www.youngprogressivevoices.com/2016/08/11/david-duke-asserts-trump-isnt-racist/,2016-08-11 15:00:00,2,1,1,0,0,1,1,0,0
553923781318329_1230775430299824,"The President has done a good deed, even if it is relatively small in the grand scheme of things.",Obama Commutes 214 Non-Violent Drug Convictions,link,http://www.youngprogressivevoices.com/2016/08/11/obama-commutes-214-non-violent-drug-convictions/,2016-08-11 13:00:00,2,0,0,2,0,0,0,0,0
553923781318329_1230772526966781,"Believe it or not, there's a psychological reason for why Trump supporters act so ignorant, and it involves fear. #NeverTrump",Washington Post Editor Reveals Why Trump Supporters Ignore Facts,link,http://www.youngprogressivevoices.com/2016/08/11/washington-post-editor-reveals-trump-supporters-ignore-facts/,2016-08-11 11:00:00,11,1,2,9,0,1,1,0,0
553923781318329_1230771456966888,Do you agree with Bill Maher that Americans deliberately misinform themselves?,"That Time Bill Maher Defended Calling Americans ""Stupid""",link,http://www.youngprogressivevoices.com/2016/08/11/time-bill-maher-defended-calling-americans-stupid/,2016-08-11 09:00:00,6,0,1,6,0,0,0,0,0
553923781318329_1230771270300240,"If there was ever one article/image we wanted our readers to share, it is this. Get the word out that a Trump victory is very much possible! #NeverTrump",A Realistic Election Map Of A Trump Victory,link,http://www.youngprogressivevoices.com/2016/08/11/realistic-election-map-trump-victory/,2016-08-11 07:00:00,2,1,3,2,0,0,0,0,0
553923781318329_1230770646966969,Republicans are desperate for a second Reagan.,Conservatives Attacked Bradley Cooper For Attending The DNC,link,http://www.youngprogressivevoices.com/2016/08/11/conservatives-attacked-bradley-cooper-attending-dnc/,2016-08-11 05:00:00,0,0,0,0,0,0,0,0,0
553923781318329_1229933410384026,One of the scariest images of the mainstream media.,The Six Corporations That Own 90 Percent Of The American Media,link,http://www.youngprogressivevoices.com/2015/11/05/six-corporations-90-percent-american-media/,2016-08-11 03:00:00,1,0,0,1,0,0,0,0,0
553923781318329_1229933243717376,Does the media have to something to do with the lack of female politicians in the United States?,Mainstream Media Disenfranchises Future Women Politicians - Young Progressive Voices,link,http://www.youngprogressivevoices.com/2016/04/18/mainstream-media-disenfranchises-future-women-politicians/,2016-08-11 01:00:00,1,0,0,0,0,0,0,0,1
553923781318329_1229932557050778,Could private companies be the future of space exploration?,First Ever Private Company Moon Expedition Set For 2017,link,http://www.youngprogressivevoices.com/2016/08/10/first-ever-private-company-moon-expedition-set-2017/,2016-08-10 23:00:00,0,0,0,0,0,0,0,0,0
553923781318329_1229932320384135,We highly recommend these news sources for all things political!,The Three News Sources We Trust Most,link,http://www.youngprogressivevoices.com/2016/08/10/three-news-sources-trust/,2016-08-10 21:00:00,1,0,0,1,0,0,0,0,0
553923781318329_1229930627050971,,Timeline Photos,photo,https://www.facebook.com/youngprogressivevoices/photos/a.554612581249449.1073741828.553923781318329/1229930627050971/?type=3,2016-08-10 19:00:00,5,0,2,5,0,0,0,0,0
553923781318329_1229930340384333,We are speechless.,NFL Player Claims Planned Parenthood Exterminates Blacks,link,http://www.youngprogressivevoices.com/2016/08/10/nfl-player-claims-planned-parenthood-exterminates-blacks/,2016-08-10 17:00:00,1,1,0,0,0,0,0,0,1
553923781318329_1229929250384442,Do you also feel neither party is representative of your beliefs?,Most Young Americans Don't Identify With Either Political Party,link,http://www.youngprogressivevoices.com/2016/08/10/americans-dont-identify-either-political-party/,2016-08-10 15:00:00,4,1,1,3,0,0,1,0,0
553923781318329_1229928923717808,So much for Trump being a good businessman.,"Yet Another Billionaire Thinks Trump Is A Fool, Supports Clinton",link,http://www.youngprogressivevoices.com/2016/08/10/yet-another-billionaire-thinks-trump-fool-supports-clinton/,2016-08-10 13:00:00,4,0,2,2,2,0,0,0,0
553923781318329_1229927167051317,Why is the Republican Party against the US being the leader in global peace?,Obama Goes To The UN To Ban Nuclear Testing,link,http://www.youngprogressivevoices.com/2016/08/10/obama-goes-un-ban-nuclear-testing/,2016-08-10 11:00:00,5,0,4,5,0,0,0,0,0
553923781318329_1229924877051546,A disturbing start to the Olympics.,Sex Abuse Cases Arise In US Gymnastics Team,link,http://www.youngprogressivevoices.com/2016/08/10/sex-abuse-cases-arise-in-us-gymnastics-team/,2016-08-10 09:00:00,0,0,0,0,0,0,0,0,0
553923781318329_1229924060384961,Never forget that one of these lunatic birthers is now running for President of the United States. #NeverTrump #ImWitHer,That Time Lawrence O'Donnell Destroyed Birther Orly Taitz,link,http://www.youngprogressivevoices.com/2016/08/10/time-lawrence-odonnell-destroyed-birther/,2016-08-10 07:00:00,5,1,1,2,2,0,1,0,0
553923781318329_1224464910930876,,Timeline Photos,photo,https://www.facebook.com/youngprogressivevoices/photos/a.554612581249449.1073741828.553923781318329/1224464910930876/?type=3,2016-08-06 19:30:00,13,0,7,12,1,0,0,0,0
553923781318329_1224463154264385,The burden will fall on the shoulders of future generations unless we act now!,Why Young Americans Should Care About Income Inequality - Young Progressive Voices,link,http://www.youngprogressivevoices.com/2016/04/18/americas-youth-care-income-inequality/,2016-08-06 17:30:00,3,0,0,3,0,0,0,0,0
553923781318329_1224456834265017,These continue to be a blight on the American educational system.,10 Reasons For-Profit Schools Are Horrible Scams (Part 1),link,http://www.youngprogressivevoices.com/2015/09/08/10-reasons-avoid-for-profit-schools/,2016-08-06 15:30:00,2,0,0,2,0,0,0,0,0
553923781318329_1225002404210460,Many more should follow suit. #ReadyForHillary,Three Republicans Defect From Trump To Hillary,link,http://www.youngprogressivevoices.com/2016/08/02/republicans-trump-to-hillary/,2016-08-06 13:30:00,0,0,0,0,0,0,0,0,0
553923781318329_1224455847598449,A sign that we will have some trouble in the future.,Ezra Klein Brilliant Explains Why The 2016 RNC Was Absurd,link,http://www.youngprogressivevoices.com/2016/08/02/ezra-klein-explains-2016-rnc-absurd/,2016-08-06 11:00:00,4,0,1,4,0,0,0,0,0
553923781318329_1224456387598395,One of our writers details his experiences with Islamic culture.,What I Learned At The Center For Islam,link,http://www.youngprogressivevoices.com/2016/08/02/what-i-learned-at-the-center-for-islam/,2016-08-06 09:00:00,0,0,1,0,0,0,0,0,0
553923781318329_1224456040931763,"Worth listening to, even if you disagree.",That Time Bill Maher Explained Racial Tensions In America,link,http://www.youngprogressivevoices.com/2016/08/02/time-bill-maher-explained-racial-tensions-america/,2016-08-06 07:00:00,0,0,1,0,0,0,0,0,0
553923781318329_1224453470932020,,Timeline Photos,photo,https://www.facebook.com/youngprogressivevoices/photos/a.554612581249449.1073741828.553923781318329/1224453470932020/?type=3,2016-08-05 19:30:00,6,0,0,5,1,0,0,0,0
553923781318329_1224453304265370,We need to prepare future generations of thinkers and entrepreneurs by removing the burden of high student debt.,Study Reveals The Horrifying Reality Of Student Debt,link,http://www.youngprogressivevoices.com/2015/05/13/study-horrifying-reality-student-debt/,2016-08-05 17:30:00,1,0,1,1,0,0,0,0,0
553923781318329_1224452867598747,A well-deserved memorial for the great Harvey Milk!,Navy Ship To Be Named After Famous Gay Rights Activist,link,http://www.youngprogressivevoices.com/2016/08/02/navy-ship-named-famous-gay-rights-activist/,2016-08-05 15:30:00,3,0,0,3,0,0,0,0,0
553923781318329_1224452547598779,We need to come together as a nation if we want to heal and move forward.,"Police, Black Lives Matter, And Healing",link,http://www.youngprogressivevoices.com/2016/08/02/police-black-lives-matter-and-healing/,2016-08-05 13:30:00,1,0,0,1,0,0,0,0,0
553923781318329_1224451994265501,"Once a coward, always a coward. #ReadyforHillary",There Is A Good Chance Trump Will Avoid The Presidential Debates,link,http://www.youngprogressivevoices.com/2016/08/02/good-chance-trump-will-avoid-presidential-debates/,2016-08-05 11:00:00,10,3,3,6,0,0,3,0,1
553923781318329_1224451574265543,Hollywood liberals are finally starting to feel the nervousness of a potential Trump presidency.,DiCaprio Quietly Hosts Fundraiser For Clinton,link,http://www.youngprogressivevoices.com/2016/08/02/dicaprio-quietly-hosts-fundraiser-clinton/,2016-08-05 09:00:00,6,1,0,5,0,0,0,1,0
553923781318329_1224451417598892,Hannity is nothing more than a conservative fool.,That Time Michael Moore Battled Sean Hannity Over Capitalism,link,http://www.youngprogressivevoices.com/2016/08/02/time-michael-moore-battled-sean-hannity-us-healthcare/,2016-08-05 07:00:00,1,0,0,0,0,0,0,0,1
553923781318329_1224450927598941,,Timeline Photos,photo,https://www.facebook.com/youngprogressivevoices/photos/a.554612581249449.1073741828.553923781318329/1224450927598941/?type=3,2016-08-04 19:30:00,18,1,2,16,2,0,0,0,0
553923781318329_1224450680932299,There are a lot of pros and cons when it comes to Common Core.,I'm a Math Teacher—Here's What I Think About Common Core - Young Progressive Voices,link,http://www.youngprogressivevoices.com/2015/08/19/im-a-math-teacher-heres-what-i-think-about-common-core/,2016-08-04 17:30:00,1,0,0,1,0,0,0,0,0
553923781318329_1224450540932313,"From the most unlikely of places, hope springs eternal.",Ukraine Plans To Convert Chernobyl Into A Solar Farm,link,http://www.youngprogressivevoices.com/2016/08/02/ukraine-plans-change-chernobyl-solar-farm/,2016-08-04 15:30:00,5,0,2,5,0,0,0,0,0
553923781318329_1224449840932383,"Income inequality and isolationism are related, whether we like it or not.",Stephen Hawking Suggests Wealth Inequality Led To BREXIT Decision,link,http://www.youngprogressivevoices.com/2016/08/02/stephen-hawking-suggests-wealth-inequality-led-brexit-decision/,2016-08-04 13:30:00,4,0,0,2,1,0,0,1,0
553923781318329_1224448797599154,One of the few 1 percenters that we agree with!,Warren Buffett Challenges Trump To Release His Tax Returns,link,http://www.youngprogressivevoices.com/2016/08/02/warren-buffett-challenges-trump-release-tax-returns/,2016-08-04 11:00:00,4,0,0,2,2,0,0,0,0
