status_id,status_message,link_name,status_type,status_link,status_published,num_reactions,num_comments,num_shares,num_likes,num_loves,num_wows,num_hahas,num_sads,num_angrys
553923781318329_1007071192670250,We must never forget that violence against the homeless is every bit as grim and tragic as other hate crimes.,"Severed Torso, Arms, And Legs Found In New Haven",link,http://www.youngprogressivevoices.com/2015/08/05/severed-torso-arms-found-new-haven/,2015-08-05 13:30:01,8,0,4,8,0,0,0,0,0
553923781318329_1007068779337158,"Don't get tricked by the incentives the media has to write pro-Bernie articles. Bernie still has a long way to go, and Hillary isn't giving up without a fight.","Despite Sanders' Surge, Clinton Maintains Strong Lead",link,http://www.youngprogressivevoices.com/2015/08/05/despite-sanders-surge-clinton-strong-lead/,2015-08-05 11:00:01,46,35,6,46,0,0,0,0,0
553923781318329_1007068522670517,"Aspiring journalists, take a look at these top tips from YPV!",The Rules Of Reporting,link,http://www.youngprogressivevoices.com/2015/08/04/the-rules-of-reporting/,2015-08-05 09:00:31,4,0,0,4,0,0,0,0,0
553923781318329_1006552962722073,Yet Republicans will continue to deny these facts.,Study Shows 95 Percent Of Women Don't Regret Their Abortions,link,http://www.youngprogressivevoices.com/2015/07/25/study-95-percent-women-abortions/,2015-08-04 18:30:01,28,5,4,28,0,0,0,0,0
553923781318329_1006552412722128,Huffington Post contributor Julia Darling has given us some juicy tips for constructing viral tweets!,Tweeting For Change 101,link,http://www.youngprogressivevoices.com/2015/08/04/tweeting-change-101/,2015-08-04 16:30:00,3,0,3,3,0,0,0,0,0
553923781318329_1006551996055503,"Fred Phelps may be gone, but we're still stuck with Pat Robertson....","According To Pat Robertson, Porn Causes Demonic Possession (Video)",link,http://www.youngprogressivevoices.com/2015/08/04/pat-robertson-porn-demonic-possession/,2015-08-04 13:30:01,3,4,7,3,0,0,0,0,0
553923781318329_1006551786055524,"The Clean Power Plan is a complicated piece of legislation from the Obama Administration. Luckily, we've broken it down to help you understand its importance!",Everything You Need to Know About The EPA's Clean Power Plan,link,http://www.youngprogressivevoices.com/2015/08/04/everything-epas-clean-power-plan/,2015-08-04 11:00:01,7,0,1,7,0,0,0,0,0
553923781318329_1006551269388909,Courage comes in all types of forms. We must never forget that as we support the LGBT community.,"Caitlyn Jenner Is Not In The Army, And That's Okay",link,http://www.youngprogressivevoices.com/2015/07/18/caitlyn-jenner-army-thats-okay/,2015-08-04 08:00:00,11,0,1,11,0,0,0,0,0
553923781318329_1005452189498817,This case suddenly became much more visceral.,"Tensing Pleads Not Guilty, Other Officers on Leave",link,http://www.youngprogressivevoices.com/2015/07/31/tensing-pleads-not-guilty-officers-leave/,2015-08-02 11:00:01,1,0,0,1,0,0,0,0,0
553923781318329_1005337629510273,"Someone had to do it... #TrumpBump #Trump2016

h/t BuzzFeed",,video,https://www.facebook.com/youngprogressivevoices/videos/1005337629510273/,2015-08-01 20:05:20,33,6,43,33,0,0,0,0,0
553923781318329_1001307343246635,"Obamacare isn't perfect-- but its a helluva lot better than anything the Republicans will EVER propose. 

Via Young Progressive Voices",Timeline Photos,photo,https://www.facebook.com/youngprogressivevoices/photos/a.554612581249449.1073741828.553923781318329/1001307343246635/?type=3,2015-08-01 14:00:05,18,2,5,18,0,0,0,0,0
553923781318329_1004829496227753,Mike Huckabee wants to use the National Guard to stop women from controlling their own bodies. We couldn't make this shit up if we tried.,Huckabee: Use National Guard To Stop Abortions - Young Progressive Voices,link,http://www.youngprogressivevoices.com/2015/07/31/huckabee-use-national-guard-to-stop-abortions/,2015-07-31 19:26:00,23,15,8,23,0,0,0,0,0
553923781318329_1004835272893842,"Did you see Hillary Clinton trash Jeb Bush over his slogan ""Right to Rise,"" in his home state of Florida yesterday? We enjoyed it very much.",,video,https://www.facebook.com/youngprogressivevoices/videos/1004835272893842/,2015-07-31 18:45:01,8,4,1,8,0,0,0,0,0
553923781318329_1004543442923025,Prepare your telescopes for tonight!,Tonight's Blue Moon Will Not Be Blue,link,http://www.youngprogressivevoices.com/2015/07/30/tonights-blue-moon-not-blue/,2015-07-31 17:00:00,2,0,1,2,0,0,0,0,0
553923781318329_1004542329589803,The #BlackLivesMatter movement reignited the conversation at #NN15 anf has only grown more powerful since.,State of Emergency: A Movement Grows In Cleveland,link,http://www.youngprogressivevoices.com/2015/07/30/state-emergency-movement-grows-cleveland-2/,2015-07-31 14:00:01,5,0,1,5,0,0,0,0,0
553923781318329_1004542016256501,"According to Rubio, caring for endangered species is wrong and Planned Parenthood is a black market for organs. #anothertypicaldayintherepublicanprimaries",Marco Rubio's Ignorant Tweets On Lions And Planned Parenthood,link,http://www.youngprogressivevoices.com/2015/07/30/marco-rubios-ignorant-tweets-lions-planned-parenthood/,2015-07-31 11:00:01,11,2,2,11,0,0,0,0,0
553923781318329_1001306749913361,"Don't believe the conservative myths-- sustainable energy is possible. 

Via Young Progressive Voices.",Timeline Photos,photo,https://www.facebook.com/youngprogressivevoices/photos/a.554612581249449.1073741828.553923781318329/1001306749913361/?type=3,2015-07-30 19:00:01,34,1,7,34,0,0,0,0,0
553923781318329_1004379289606107,"Help us spread our petition! Use the hashtag 
#RepublicanDebateSong","FOX News: Make The First Republican Debate Theme Song The ""Thomas And Friends Theme""",link,https://www.change.org/p/fox-news-make-the-first-republican-debate-theme-song-the-thomas-and-friends-theme?recruiter=353057216&utm_source=share_petition&utm_medium=copylink&rp_sharecordion_checklist=control,2015-07-30 15:50:52,8,1,22,8,0,0,0,0,0
553923781318329_1001299903247379,"The fact there are 'working poor' shows class warfare is real, and that the rich elite are winning.

Via Young Progressive Voices.",Timeline Photos,photo,https://www.facebook.com/youngprogressivevoices/photos/a.554612581249449.1073741828.553923781318329/1001299903247379/?type=3,2015-07-30 14:00:01,30,0,11,30,0,0,0,0,0
553923781318329_1004073096303393,"Republicans are so dense, they think anything President Obama does is against the greater good.","Jack Black, Morgan Freeman, And Others Explain The Iran Deal (VIDEO)",link,http://www.youngprogressivevoices.com/2015/07/30/jack-black-morgan-freeman-iran-deal-video/,2015-07-30 14:00:00,24,0,4,24,0,0,0,0,0
553923781318329_1004072722970097,"We dig deeper into the real ""scandal"" behind Hillary- her silence on the Keystone Pipeline.",Hillary's Keystone XL Problem,link,http://www.youngprogressivevoices.com/2015/07/30/hillarys-keystone-xl-problem/,2015-07-30 11:00:02,8,8,9,8,0,0,0,0,0
553923781318329_1001306263246743,"What's so terrifying about a clean environment? 

Via Young Progressive Voices.",Timeline Photos,photo,https://www.facebook.com/youngprogressivevoices/photos/a.554612581249449.1073741828.553923781318329/1001306263246743/?type=3,2015-07-29 14:00:01,99,2,28,99,0,0,0,0,0
553923781318329_1001299503247419,"Willful blindness: the cause of conservative faith in big oil, and the enemy of sustainable energy progress. How else do you explain the fear of clean air, earth and water?

Via Young Progressive Voices.",Timeline Photos,photo,https://www.facebook.com/youngprogressivevoices/photos/a.554612581249449.1073741828.553923781318329/1001299503247419/?type=3,2015-07-28 16:00:00,19,0,4,19,0,0,0,0,0
553923781318329_1003303159713720,"For those of you wondering who stands where on the environment, we've compiled a list to help you (and yes, all the Republican candidates suck).",Renewable Energy And Climate Change: Where Do The 2016 Presidential Candidates Stand?,link,http://www.youngprogressivevoices.com/2015/07/28/renewable-energy-climate-change-2016-candidates/,2015-07-28 13:30:00,4,2,2,4,0,0,0,0,0
553923781318329_1003036406407062,Even we're surprised!,Ted Cruz Attacks Mitch McConnell On Senate Floor,link,http://www.youngprogressivevoices.com/2015/07/28/ted-cruz-attacks-mitch-mcconnell/,2015-07-28 11:00:00,4,0,0,4,0,0,0,0,0
553923781318329_1002454746465228,Nature and man can create so many great things.,This Beautiful Hybrid Tree Grows 40 Different Types Of Fruit,link,http://www.youngprogressivevoices.com/2015/07/27/beautiful-hybrid-tree-grows-40-fruit/,2015-07-27 17:00:01,5,0,2,5,0,0,0,0,0
553923781318329_1001300243247345,"Environmentalism or just common-sense? What do you think?

Via Young Progressive Voices.",Timeline Photos,photo,https://www.facebook.com/youngprogressivevoices/photos/a.554612581249449.1073741828.553923781318329/1001300243247345/?type=3,2015-07-27 16:00:01,14,1,7,14,0,0,0,0,0
553923781318329_1002454329798603,"Believe it or not, there's a scientific reason as to why conservatives hate the poor.",Psychological Difference Between Liberals and Conservatives,link,http://www.youngprogressivevoices.com/2015/05/13/whats-psychological-difference-liberals-conservatives/,2015-07-27 14:00:00,48,5,21,48,0,0,0,0,0
553923781318329_1002454153131954,"""Those people on the other side, they will answer any question about climate change by saying, 'I'm not a scientist.' Well, I'm not a scientist either. I'm just a grandmother with two eyes and a brain.""
           -Hillary Clinton",Hillary Clinton Announces Major Climate Change Initiative,link,http://www.youngprogressivevoices.com/2015/07/27/hillary-clinton-major-climate-change-initiative/,2015-07-27 11:00:02,8,4,0,8,0,0,0,0,0
553923781318329_1002266969817339,Joe Arpaio is a punk.,Embattled Joe Arpaio Confronted by Hundreds of Protestors - Young Progressive Voices,link,http://www.youngprogressivevoices.com/2015/07/26/embattled-joe-arpaio-confronted-by-hundreds-of-protestors/,2015-07-26 20:00:01,8,0,0,8,0,0,0,0,0
553923781318329_1002247433152626,Ready for tonight's season 2 premiere??,Top 10 Rick And Morty Moments,link,http://www.youngprogressivevoices.com/2015/07/26/top-10-rick-morty-moments/,2015-07-26 18:30:01,1,0,0,1,0,0,0,0,0
553923781318329_1002222759821760,"Donald J. Trump is pulling away from the rest of the Republican field. 

What are your thoughts? Are you feeling the #TrumpBump?",Donald Trump Leading Republican Field - Young Progressive Voices,link,http://www.youngprogressivevoices.com/2015/07/26/donald-trump-leading-republican-field/,2015-07-26 16:29:22,5,7,23,5,0,0,0,0,0
553923781318329_1002187316491971,"This is an absolutely disgusting attack on the first lady that would NEVER have been written were she not a woman of color.

Even when you click the article, it's about her cursing when she was young.That's it. It's literally about her being a normal young person, and yet they say she's trashy today because of it.

Fuck them.",Timeline Photos,photo,https://www.facebook.com/youngprogressivevoices/photos/a.554612581249449.1073741828.553923781318329/1002187316491971/?type=3,2015-07-26 15:30:01,21,8,2,21,0,0,0,0,0
553923781318329_1001299003247469,"""Clearly, we need more incentives to quickly increase the use of wind and solar power; they will cut costs, increase our energy independence and our national security and reduce the consequences of global warming."" - Hillary Clinton. 

Via Young Progressive Voices.",Timeline Photos,photo,https://www.facebook.com/youngprogressivevoices/photos/a.554612581249449.1073741828.553923781318329/1001299003247469/?type=3,2015-07-26 14:00:02,10,0,4,10,0,0,0,0,0
553923781318329_1001983113179058,Let's remember that every story has a grey area.,"Former Daily Show Writer Claims Jon Stewart Told Him To ""Fuck Off""",link,http://www.youngprogressivevoices.com/2015/07/26/daily-show-jon-stewart-fuck-off/,2015-07-26 11:00:01,0,5,0,0,0,0,0,0,0
553923781318329_1001298689914167,"Do you think raising the minimum wage is common sense?

Via Young Progressive Voices.",Timeline Photos,photo,https://www.facebook.com/youngprogressivevoices/photos/a.554612581249449.1073741828.553923781318329/1001298689914167/?type=3,2015-07-25 17:30:02,38,2,4,38,0,0,0,0,0
553923781318329_1001740746536628,Have you seen Bernie Sanders new video outlining a progressive agenda for America? Comment your thoughts below! #FeelTheBern,,video,https://www.facebook.com/youngprogressivevoices/videos/1001740746536628/,2015-07-25 15:04:06,130,22,688,130,0,0,0,0,0
553923781318329_1001708673206502,"Not only are southerners finally giving in, but relations with Cuba seem to be getting better!",This Month In Flags,link,http://www.youngprogressivevoices.com/2015/07/25/this-month-in-flags/,2015-07-25 14:00:04,16,1,2,16,0,0,0,0,0
553923781318329_1001501609893875,"The abortion debate is a complex one, however the lies spread by the anti-choice movement certainly don't help their side.",Study Shows 95 Percent Of Women Don't Regret Their Abortions,link,http://www.youngprogressivevoices.com/2015/07/25/study-95-percent-women-abortions/,2015-07-25 11:00:01,26,1,0,26,0,0,0,0,0
553923781318329_1001411909902845,"Shout out to our favorite congressman  Mark Takano, who is from our home area of Riverside, CA. Give it a like!",Congressman Mark Takano,video,https://www.facebook.com/RepMarkTakano/videos/703333249795748/,2015-07-24 22:39:22,8,0,0,8,0,0,0,0,0
553923781318329_1001387333238636,"In case you haven't seen this yet, we thought it was important that you checked it out. It's okay to #FeelTheBern

(The description wrongfully says former senator. It is corrected in the article.)",In Response To Barney Frank's Attack On Sanders,link,http://www.youngprogressivevoices.com/2015/07/24/rebuttal-barney-franks-attack-sanders/,2015-07-24 20:51:43,21,3,5,21,0,0,0,0,0
553923781318329_1001296243247745,"""The truth is that the people taking in cash from dirty energy aren't going to be around long enough to experience the damage caused, and they're too selfish to care about anything but profit.""

 Via Young Progressive Voices.",Timeline Photos,photo,https://www.facebook.com/youngprogressivevoices/photos/a.554612581249449.1073741828.553923781318329/1001296243247745/?type=3,2015-07-24 16:10:29,25,2,50,25,0,0,0,0,0
553923781318329_1001005336610169,"Republicans have just passed the DARK Act, giving Monsanto free reign.",Congress Just Betrayed Us For Monsanto,link,http://www.youngprogressivevoices.com/2015/07/24/congress-just-betrayed-us-monsanto/,2015-07-24 14:00:00,4,2,7,4,0,0,0,0,0
553923781318329_1001002059943830,Barney Frank betrayed Bernie through a terribly written article about why progressives should support Hillary in 2016. We let him #FeelTheBern,In Response To Barney Frank's Attack On Sanders,link,http://www.youngprogressivevoices.com/2015/07/24/rebuttal-barney-franks-attack-sanders/,2015-07-24 11:00:01,37,5,262,37,0,0,0,0,0
553923781318329_1000806543296715,"Demonizing either side is wrong, especially for a network television channel.","ABC's ""What Would You Do?"" Attacks Atheists",link,http://www.youngprogressivevoices.com/2015/07/23/abcs-attacks-atheists/,2015-07-23 16:50:46,12,1,3,12,0,0,0,0,0
553923781318329_1000699696640733,We're going to miss Jon Stewart sincerely.,Obama Issues Executive Order For Jon Stewart To Stay,link,http://www.youngprogressivevoices.com/2015/07/23/obama-issues-executive-order-jon-stewart/,2015-07-23 11:51:40,12,2,2,12,0,0,0,0,0
553923781318329_1000400080004028,"The shady American Legislative Exchange Council, also known as ALEC, has drawn thousands of demonstrators to its annual convention in San Diego. Yet none of the local media is reporting on it. This is why independent, online outlets such as Young Progressive Voices are critical in spreading the truth, labeled too subversive by corporate owner media outlets. #PowerToThePeople #StopALECFest",Mobile Uploads,photo,https://www.facebook.com/youngprogressivevoices/photos/a.953924814651555.1073741831.553923781318329/1000400080004028/?type=3,2015-07-22 21:51:06,13,2,14,13,0,0,0,0,0
553923781318329_1000281026682600,Just when you thought the Graham-Trump feud couldn't get anymore ridiculous....,Lindsey Graham Just Won The Internet,link,http://www.youngprogressivevoices.com/2015/07/22/lindsey-graham-just-won-internet/,2015-07-22 16:30:00,16,1,3,16,0,0,0,0,0
553923781318329_1000230510020985,No one should be forced to pray in public schools.,Church Fights School Board In Battle Of Los Angeles,link,http://www.youngprogressivevoices.com/2015/07/22/church-fights-school-board-battle-los-angeles/,2015-07-22 14:00:00,7,0,1,7,0,0,0,0,0
553923781318329_999972483380121,"If you're the type of person who wants to have every dank Bernie meme, check this out.

#FeelTheBern #Bernie2016",We Found All The Funny #Bernie2016 Memes For You - Young Progressive Voices,link,http://www.youngprogressivevoices.com/2015/07/21/we-found-all-the-funny-bernie2016-memes-for-you/,2015-07-22 11:00:01,9,1,82,9,0,0,0,0,0
553923781318329_608000975910609,,Young Progressive Voices's cover photo,photo,https://www.facebook.com/youngprogressivevoices/photos/a.554152007962173.1073741827.553923781318329/608000975910609/?type=3,2015-07-21 23:02:47,89,5,60,89,0,0,0,0,0
553923781318329_999444920099544,What once began with promise for Republican businessmen has thankfully crashed and burned.,"Rot In Pieces, Donald Trump's Presidential Ambitions",link,http://www.youngprogressivevoices.com/2015/07/20/rot-donald-trump-presidential-ambitions/,2015-07-21 16:30:01,11,1,4,11,0,0,0,0,0
553923781318329_999774413399928,This gave us a good laugh!,Millennials For Revolution,photo,https://www.facebook.com/bernlennials/photos/a.741349402630646.1073741829.738694752896111/771827159582870/?type=3,2015-07-21 15:01:42,211,1,0,211,0,0,0,0,0
553923781318329_999720023405367,*mumble*mumble*mumble* states rights! *mumble*mumble*mumble*,Mobile Uploads,photo,https://www.facebook.com/youngprogressivevoices/photos/a.953924814651555.1073741831.553923781318329/999720023405367/?type=3,2015-07-21 13:16:21,117,8,44,117,0,0,0,0,0
553923781318329_999448210099215,"The opposite of Progressivism is Regressivism, which is what Trump and the Republicans want to do with this country.",Donald Trump's Comments Reveal Startling Facts About Conservatives,link,http://www.youngprogressivevoices.com/2015/07/20/donald-trump-reveal-startling-facts-conservative-attitudes/,2015-07-21 11:00:00,5,0,1,5,0,0,0,0,0
553923781318329_998967453480624,Even something as small as a selfie can make a generational impact! #slacktivism,How Your Selfies Can Help An Impoverished Community,link,http://www.youngprogressivevoices.com/2015/07/20/selfies-can-help-impoverished-community/,2015-07-20 14:00:00,4,0,1,4,0,0,0,0,0
553923781318329_998964360147600,"Class warfare is inevitable under GOP leadership, and like always, us liberals are going to have to clean up their mess.",Scott Walker And the GOP's Destructive Economic Strategy,link,http://www.youngprogressivevoices.com/2015/07/20/scott-walker-gops-destructive-economic-strategy/,2015-07-20 11:00:01,10,0,18,10,0,0,0,0,0
553923781318329_998838793493490,This is gold.,Mobile Uploads,photo,https://www.facebook.com/youngprogressivevoices/photos/a.953924814651555.1073741831.553923781318329/998838793493490/?type=3,2015-07-19 20:37:02,137,1,36,137,0,0,0,0,0
553923781318329_998369773540392,Tonight we had the honor of attending Bernie Sanders' massive rally in Phoenix. Bernie drew the largest crowd of any candidate thus far and in a RED state because his message resonates with Americans who are standing up and saying that enough is enough.,Mobile Uploads,photo,https://www.facebook.com/youngprogressivevoices/photos/a.953924814651555.1073741831.553923781318329/998369773540392/?type=3,2015-07-18 23:23:22,54,3,5,54,0,0,0,0,0
553923781318329_997940936916609,"Ah yes, back in the days when Spongebob was actually good.",Remember That Time Spongebob Tackled Global Warming?,link,http://www.youngprogressivevoices.com/2015/07/17/remember-time-spongebob-tackled-global-warming/,2015-07-18 16:30:01,6,1,0,6,0,0,0,0,0
553923781318329_998133993563970,The debate of the century!,Check Out Sanders And O'Malley Debating (LIVE),link,http://www.youngprogressivevoices.com/2015/07/18/sanders-omalley-debating-live/,2015-07-18 12:41:05,9,0,3,9,0,0,0,0,0
553923781318329_997949146915788,"Caitlyn's speech touched on many aspects of the human condition, and what it means to be courageous. #equality","Caitlyn Jenner Is Not In The Army, And That's Okay",link,http://www.youngprogressivevoices.com/2015/07/18/caitlyn-jenner-army-thats-okay/,2015-07-18 11:00:01,21,0,2,21,0,0,0,0,0
553923781318329_997696486941054,"Arrest Arpaio, not the people!

#NN15",,status,,2015-07-17 13:59:07,1,0,0,1,0,0,0,0,0
553923781318329_997678100276226,Elizabeth Warren live at Netroots! #Netrootsupdates,,video,https://www.facebook.com/youngprogressivevoices/videos/997678100276226/,2015-07-17 13:07:15,9,3,0,9,0,0,0,0,0
553923781318329_997481073629262,Citizenfour is a must-see for any progressive!,Citizenfour Movie Review,link,http://www.youngprogressivevoices.com/2015/07/17/citizenfour-movie-review/,2015-07-17 11:00:01,6,0,0,6,0,0,0,0,0
553923781318329_997608380283198,😎,Mobile Uploads,photo,https://www.facebook.com/youngprogressivevoices/photos/a.953924814651555.1073741831.553923781318329/997608380283198/?type=3,2015-07-17 10:12:19,138,5,17,138,0,0,0,0,0
553923781318329_996876130356423,There is a much larger problem here than the story leads itself to be.,SeaWorld Employee Infiltrated PETA,link,http://www.youngprogressivevoices.com/2015/07/16/seaworld-employee-infiltrated-peta/,2015-07-16 14:00:01,2,0,1,2,0,0,0,0,0
553923781318329_996875627023140,It's great to see major corporations like Google taking a stand against transphobia!,Google Supports Transsexuals With This Hauntingly Beautiful Video,link,http://www.youngprogressivevoices.com/2015/07/16/google-supports-transsexuals-hauntingly-beautiful-video/,2015-07-16 11:00:02,1,0,0,1,0,0,0,0,0
553923781318329_996319240412112,"The U.S. is officially the first country to ""explore"" every planet in our Solar System! But what does this entail for the nation?",NASA Celebrates New Horizons' Pluto Flyby,link,http://www.youngprogressivevoices.com/2015/07/15/nasa-celebrates-new-horizons-pluto-flyby/,2015-07-15 19:00:01,0,0,0,0,0,0,0,0,0
553923781318329_996189947091708,Speaker John Boehner: #ThanksObama,John Boehner: California Drought is Obama's Fault - Young Progressive Voices,link,http://www.youngprogressivevoices.com/2015/07/14/john-boehner-california-drought-is-obamas-fault/,2015-07-15 16:30:00,0,0,3,0,0,0,0,0,0
553923781318329_996307970413239,Bernie had some harsh words to say about Hilary's environmental record. Find out what they were!,Sanders Attacks Hilary Over Keystone Pipeline,link,http://www.youngprogressivevoices.com/2015/07/15/sanders-attacks-hilary-keystone-pipeline/,2015-07-15 14:00:00,12,2,4,12,0,0,0,0,0
553923781318329_996318913745478,"To our fellow progressives living blue in a red county, you have our sincerest condolences. Check out if any of these scumbags were from your state.",These 45 Scumbag Republican Senators Want Gay Youths Bullied To Suicide,link,http://www.youngprogressivevoices.com/2015/07/15/republican-senators-gay-youths-bullied-suicide/,2015-07-15 11:00:00,7,0,4,7,0,0,0,0,0
553923781318329_996218747088828,Will the film be worth watching? Check out our analysis of the final trailer!,Fantastic Four Trailer Review/Analysis,link,http://www.youngprogressivevoices.com/2015/07/14/fantastic-four-trailer-review-analysis/,2015-07-14 20:57:17,0,0,0,0,0,0,0,0,0
553923781318329_996106953766674,"We need to let Netanyahu, the Republicans, and war hawk Democrats know that we don't want war! Share it far and wide!",Timeline Photos,photo,https://www.facebook.com/youngprogressivevoices/photos/a.554612581249449.1073741828.553923781318329/996106953766674/?type=3,2015-07-14 15:06:29,78,1,60,78,0,0,0,0,0
553923781318329_995849643792405,Voter apathy + Republican gerrymandering = a big problem for Democrats come 2016.,Study Finds Low Latino Turnout In California,link,http://www.youngprogressivevoices.com/2015/07/14/study-low-latino-turnout-california/,2015-07-14 14:00:00,4,0,0,4,0,0,0,0,0
553923781318329_995854310458605,Success! Though the real question is whether the Republican-controlled Congress will accept it or not.,Obama Successfully Reaches Nuclear Deal With Iran,link,http://www.youngprogressivevoices.com/2015/07/14/obama-successfully-reaches-nuclear-deal-iran/,2015-07-14 11:00:01,21,0,1,21,0,0,0,0,0
553923781318329_995622230481813,"We thought for a while about the best way to sum up our feelings about Scott Walker declaring his bid for the Presidency. 

Here goes nothing: FUCK Scott Walker.",Timeline Photos,photo,https://www.facebook.com/youngprogressivevoices/photos/a.554612581249449.1073741828.553923781318329/995622230481813/?type=3,2015-07-13 14:12:03,34,5,12,34,0,0,0,0,0
553923781318329_994901863887183,Science has some harsh things to say about conservative parenthood!,Psychological Difference Between Liberals and Conservatives,link,http://www.youngprogressivevoices.com/2015/05/13/whats-psychological-difference-liberals-conservatives/,2015-07-12 14:00:01,19,2,11,19,0,0,0,0,0
553923781318329_994792620564774,AHAHAHA!,Donald Trump Pinata Cosplay Gets Owned At Comic-Con - Young Progressive Voices,link,http://www.youngprogressivevoices.com/2015/07/11/donald-trump-pinata-cosplay-gets-owned-at-comic-con/,2015-07-12 11:00:00,5,0,2,5,0,0,0,0,0
553923781318329_994685747242128,"The 1st sitting President about to visit a Prison, multiple major Presidential candidates talking about it: are we on the verge of a major Prison-Industrial reform? We hope so.",Bernie Sanders,photo,https://www.facebook.com/berniesanders/photos/a.324119347643076.89553.124955570892789/865207546867584/?type=3,2015-07-11 16:52:16,33,0,0,33,0,0,0,0,0
