status_id,status_message,link_name,status_type,status_link,status_published,num_reactions,num_comments,num_shares,num_likes,num_loves,num_wows,num_hahas,num_sads,num_angrys
553923781318329_1051754951535207,"Reagonomics, deregulation, and the spreading of the Welfare Queen movement ensured the destruction of the middle class.",Timeline Photos,photo,https://www.facebook.com/youngprogressivevoices/photos/a.554612581249449.1073741828.553923781318329/1051754951535207/?type=3,2015-11-03 16:00:00,131,5,81,131,0,0,0,0,0
553923781318329_1052055921505110,That's some perspective for when Republicans talk about priorities.,Bernie Sanders Democrats,photo,https://www.facebook.com/BernieDemocrats/photos/a.314883911968600.1073741828.314344212022570/316976425092682/?type=3,2015-11-03 15:00:01,187,4,0,187,0,0,0,0,0
553923781318329_1051754811535221,Bush didn't know the difference between Shias and Sunnis and Condoleezza Rice didn't even know who al-Qaeda was. The Iraq War was beyond a disaster in the making.,When Family Guy Perfectly Described The Bush Administration's Iraq Strategy,link,http://www.youngprogressivevoices.com/2015/10/05/family-guy-perfectly-described-bush-administrations-iraq-strategy/,2015-11-03 14:00:00,18,0,7,18,0,0,0,0,0
553923781318329_1051754211535281,"Remember, remember, the 5th of November....Republicans.","Anonymous Bumps Up Schedule, Says They Will Release 1,000 KKK Identities This Week (SCREENSHOTS)",link,http://www.addictinginfo.org/2015/11/02/anonymous-bumps-up-schedule-says-they-will-release-1000-kkk-identities-this-week-screenshots/,2015-11-03 12:00:00,13,1,4,13,0,0,0,0,0
553923781318329_1051753844868651,"No one is saying we should make the United States socialist, but the amount of unregulated capitalism in this country is absolutely ridiculous.",Timeline Photos,photo,https://www.facebook.com/youngprogressivevoices/photos/a.554612581249449.1073741828.553923781318329/1051753844868651/?type=3,2015-11-03 10:00:01,16,0,8,16,0,0,0,0,0
553923781318329_1051753694868666,This is what Bernie is trying to tell us. The amount of wealth the Top 1% own of this country is beyond ridiculous. #feeltheBern,Just 100 CEOs have more in retirement savings than 41 percent of Americans combined,link,http://www.motherjones.com/politics/2015/10/top-100-ceos-retirement-savings-racial-inequality,2015-11-03 08:00:00,7,0,5,7,0,0,0,0,0
553923781318329_1051752781535424,Chicago Tribune columnist Rex Huppke has gone to war with Cruz. Glad to see someone from the left actually standing up for the press.,'Liberal Media' Columnist Officially Declares War On Ted Cruz – And It's Hilarious,link,http://www.ifyouonlynews.com/politics/liberal-media-columnist-officially-declares-war-on-ted-cruz-and-its-hilarious/,2015-11-03 06:00:01,30,2,3,30,0,0,0,0,0
553923781318329_1051752374868798,Glad to see the President a lot more loose now that he doesn't have a second term to worry about.,Obama Clowns GOP For Whining About CNBC Debate Moderators (VIDEO),link,http://www.addictinginfo.org/2015/11/02/obama-clowns-gop-for-whining-about-cnbc-debate-moderators-video/,2015-11-03 04:00:01,43,2,5,43,0,0,0,0,0
553923781318329_1051560741554628,John Oliver has really started to build a name for himself!,John Oliver: Tuesday's Election Will Determine If GOP Hypocrisy Wins Or People Literally Die (VIDEO),link,http://www.addictinginfo.org/2015/11/02/john-oliver-tuesdays-election-will-determine-if-gop-hypocrisy-wins-or-people-literally-die-video/,2015-11-03 02:00:01,21,0,5,21,0,0,0,0,0
553923781318329_1051541881556514,We very dearly miss this man.,That Time Robin Williams Hilariously Joked About Gannongate,link,http://www.youngprogressivevoices.com/2015/11/02/time-robin-williams-hilariously-joked-gannongate/,2015-11-03 00:00:01,7,0,1,7,0,0,0,0,0
553923781318329_1051543804889655,Conservative nostalgia requires a lot of imagination to believe.,Timeline Photos,photo,https://www.facebook.com/youngprogressivevoices/photos/a.554612581249449.1073741828.553923781318329/1051543804889655/?type=3,2015-11-02 22:00:01,152,1,64,152,0,0,0,0,0
553923781318329_1051552984888737,"That's three Democrats out. Still, will Lessig run as a third-party candidate?",Lawrence Lessig Drops Out Of The Race,link,http://www.youngprogressivevoices.com/2015/11/02/lawrence-lessig-drops-race/,2015-11-02 20:00:01,3,1,0,3,0,0,0,0,0
553923781318329_1051542388223130,"If you can't handle a few tough questions, how in the world are you fit to be President of the United States?",Here's The Embarrassing List Of Debate Demands Republicans Just Sent To Networks,link,http://www.addictinginfo.org/2015/11/02/heres-the-embarrassing-list-of-debate-demands-republicans-just-sent-to-networks/,2015-11-02 18:00:00,45,8,18,45,0,0,0,0,0
553923781318329_1051301811580521,"We know, we know, there have been a lot of Paul Ryan posts lately. But when someone this moronic is impeding American progress, we have no choice but to spread the word on this maniac.",And So It Begins - Speaker Paul Ryan Refuses To Work With President Obama On Immigration (VIDEO),link,http://www.ifyouonlynews.com/politics/and-so-it-begins-speaker-paul-ryan-refuses-to-work-with-president-obama-on-immigration-video/,2015-11-02 16:00:00,5,4,1,5,0,0,0,0,0
553923781318329_1051302634913772,It's disgusting that many Republican congressmen actually believe this.,Timeline Photos,photo,https://www.facebook.com/youngprogressivevoices/photos/a.554612581249449.1073741828.553923781318329/1051302634913772/?type=3,2015-11-02 14:00:01,61,1,21,61,0,0,0,0,0
553923781318329_1051300388247330,"Back when Jon Stewart was on, there used to be an old saying: ""I go to Fox News for my comedy, and Comedy Central for my news.""",The Problem With The Mainstream Media,link,http://www.youngprogressivevoices.com/2015/07/09/problem-mainstream-media-op-ed/,2015-11-02 12:00:00,21,0,0,21,0,0,0,0,0
553923781318329_1051301191580583,"Believe us, we're not lying when we tell you it makes it much MUCH easier to understand what those clowns are talking about.",Republican Translator: Your Go-To Guide For Understanding GOP Catchphrases,link,http://www.addictinginfo.org/2015/11/01/republican-translator-your-go-to-guide-for-understanding-gop-catchphrases/,2015-11-02 10:00:01,13,2,6,13,0,0,0,0,0
553923781318329_1051300278247341,Gun violence can be avoided. All it takes is a bit of common sense and progressive will.,The Myth Of Senseless Tragedy: American Gun Violence,link,http://www.youngprogressivevoices.com/2015/09/06/myth-senseless-tragedy-american-gun-violence/,2015-11-02 08:00:01,2,0,0,2,0,0,0,0,0
553923781318329_1051299468247422,Nothing like a good ole' partisan brawl between intellectuals (Leftists) and morons (Right-wingers)!,Battle Royale: Bill Maher And Ben Affleck Vs Ann Coulter And Darrell Issa,link,http://www.youngprogressivevoices.com/2015/11/02/battle-royale-bill-maher-ben-affleck-vs-ann-coulter-darrell-issa/,2015-11-02 06:00:01,7,1,2,7,0,0,0,0,0
553923781318329_1051288631581839,"What a surprise, that's for sure!",Even The Wall Street Journal Admits Red States Take More From The Government,link,http://www.youngprogressivevoices.com/2015/11/01/even-wall-street-journal-admits-red-states-take-government/,2015-11-02 04:00:00,9,2,9,9,0,0,0,0,0
553923781318329_1051276414916394,At least Republicans have entertainment value!,Rick Harrison's Reason For Backing Marco Rubio Will Have You Laughing Out Loud,link,http://www.youngprogressivevoices.com/2015/11/01/pawn-stars-rick-harrisons-reason-backing-marco-rubio-will-laughing/,2015-11-02 02:02:27,4,2,0,4,0,0,0,0,0
553923781318329_1051163154927720,Enough is enough.,Millennials Against Wall St.,photo,https://www.facebook.com/millennialsagainstwallst/photos/a.1639751242960296.1073741826.1639725246296229/1640654322869988/?type=3,2015-11-02 00:00:00,45,0,0,45,0,0,0,0,0
553923781318329_1051145094929526,We...don't even know what to say.,Paul Ryan Tells Fox News That Only He Is Entitled To Have Paid Family Time (VIDEO),link,http://www.addictinginfo.org/2015/11/01/paul-ryan-tells-fox-news-that-only-he-is-entitled-to-have-paid-family-time-video/,2015-11-01 22:00:01,22,3,7,22,0,0,0,0,0
553923781318329_1051118024932233,The American Taliban.,"Huckabee, Cruz, and Jindal scheduled to speak at rally hosted by pastor who wants gays executed",link,http://deadstate.org/huckabee-cruz-and-jindal-scheduled-to-speak-at-rally-hosted-by-pastor-who-wants-gays-executed/,2015-11-01 20:00:01,27,2,14,27,0,0,0,0,0
553923781318329_1051101741600528,"So do we Bernie, let's make college tuition a thing of the past! #FeelTheBern",Bernie Sanders Democrats,photo,https://www.facebook.com/BernieDemocrats/photos/a.314883911968600.1073741828.314344212022570/316633025127022/?type=3,2015-11-01 17:42:46,58,0,0,58,0,0,0,0,0
553923781318329_1051051838272185,"Common sense gun control is supported by the NRA, yet Wayne LaPierre acts like the NRA is the only institution standing against government tyranny. We need to stop these senseless tragedies.",A Case For Gun Control In America,link,http://www.youngprogressivevoices.com/2015/10/01/case-gun-control-america/,2015-11-01 15:07:14,8,0,1,8,0,0,0,0,0
553923781318329_1050840538293315,This is how desperate Republicans have become to win elections- they've rigged the system.,Timeline Photos,photo,https://www.facebook.com/youngprogressivevoices/photos/a.554612581249449.1073741828.553923781318329/1050840538293315/?type=3,2015-11-01 13:00:02,85,2,242,85,0,0,0,0,0
553923781318329_1050840298293339,"""They talk about this Great Recession as if it fell out of the sky, like, 'Oh, my goodness, where did it come from?' It came from this man voting to put two wars on a credit card, to at the same time put a prescription drug benefit on the credit card, a trillion-dollar tax cut for the very wealthy. I was there. I voted against them. I said no, we can't afford that. And now, all of a sudden, these guys are so seized with the concern about the debt that they created.""",That Time Joe Biden Handed Paul Ryan's Ass To Him,link,http://www.youngprogressivevoices.com/2015/11/01/time-joe-biden-handed-paul-ryans-ass/,2015-11-01 11:00:00,125,3,31,125,0,0,0,0,0
553923781318329_1050839871626715,"We warn our progressive audience to be wary of Lessig. If he runs as a third-party candidate, he could potentially steal a good number of votes from Bernie's campaign. #FeelTheBern",Why Bernie Supporters Should Watch Out For Lawrence Lessig,link,http://www.youngprogressivevoices.com/2015/11/01/bernie-supporters-watch-out-lawrence-lessig/,2015-11-01 08:30:01,3,2,1,3,0,0,0,0,0
553923781318329_1050835101627192,"He's supposed to be the smart Bush, right?",Jeb Bush Gets SCHOOLED For Saying 'Psych Majors Will All Work At Chick-fil-A' (IMAGES),link,http://www.addictinginfo.org/2015/10/31/jeb-bush-gets-schooled-for-saying-psych-majors-will-all-work-at-chick-fil-a-images/,2015-11-01 06:30:00,40,3,9,40,0,0,0,0,0
553923781318329_1050827274961308,Sometimes you just have to stop and smell the roses.,Timeline Photos,photo,https://www.facebook.com/youngprogressivevoices/photos/a.554612581249449.1073741828.553923781318329/1050827274961308/?type=3,2015-11-01 04:30:00,39,2,12,39,0,0,0,0,0
553923781318329_1050751091635593,A very interesting discussion between two very interesting men.,That Time Bill Maher And Penn Jillette Debated Humanity's Capacity For Evil,link,http://www.youngprogressivevoices.com/2015/10/31/time-bill-maher-penn-jillette-debated-humanitys-capacity-evil/,2015-11-01 02:30:01,6,1,1,6,0,0,0,0,0
553923781318329_1050750851635617,A step in the right direction or playground politics? We're either way glad to see the statement redacted.,Netanyahu Retracts Claim About Palestinians Causing The Holocaust,link,http://www.youngprogressivevoices.com/2015/10/31/netanyahu-retracts-claim-palestinians-causing-holocaust/,2015-11-01 00:30:00,6,3,3,6,0,0,0,0,0
553923781318329_1050710114973024,Let them #feelthebern!,"18 CEOs Called Out By Bernie Sanders For Taking Trillions In Bailouts, Evading Taxes, and...",link,http://www.trueactivist.com/18-ceos-called-out-by-bernie-sanders-for-taking-trillions-in-bailouts-evading-taxes-and-outsourcing-jobs/,2015-10-31 21:41:53,132,4,116,132,0,0,0,0,0
553923781318329_1050647951645907,"Remember, no matter how stupid the Republicans seem, don't think they can't get stupider.",RNC Ends Relationship With CNBC Over Unfair Questions,link,http://www.youngprogressivevoices.com/2015/10/31/rnc-ends-relationship-cnbc-unfair-questions/,2015-10-31 19:04:00,6,1,0,6,0,0,0,0,0
553923781318329_1050358151674887,"The apologists for this incident are especially ridiculous. Her not putting away her phone would be a justifiable excuse if her punishment was being suspended, NOT assaulted by an officer.","Violence Disguised As ""Discipline"": How Far Will It Go?",link,http://www.youngprogressivevoices.com/2015/10/31/violence-disguised-discipline-far-will-go/,2015-10-31 17:00:00,17,2,5,17,0,0,0,0,0
553923781318329_1050357895008246,Could Bernie be getting a secret endorsement from Biden? #FeelTheBern,Biden's Secret Meeting With Bernie,link,http://www.youngprogressivevoices.com/2015/10/30/bidens-secret-meeting-bernie/,2015-10-31 15:00:01,41,5,32,41,0,0,0,0,0
553923781318329_1049925771718125,"Wait, Donald Trump lied? Who would've guessed!",The Many Lies Of Donald Trump,link,http://www.youngprogressivevoices.com/2015/10/30/many-lies-donald-trump/,2015-10-31 13:00:01,8,1,1,8,0,0,0,0,0
553923781318329_1049925445051491,"For such a gifted neurosurgeon, Carson sure is a complete moron.",The Damn Hypocrisy Of Ben Carson,link,http://www.youngprogressivevoices.com/2015/10/30/damn-hypocrisy-ben-carson/,2015-10-31 11:00:01,12,1,1,12,0,0,0,0,0
553923781318329_1049923941718308,"Someone needed to say it, and we're glad it's Noam Chomsky!",Noam Chomsky Says GOP Isn't A Real Political Party,link,http://www.youngprogressivevoices.com/2015/10/30/noam-chomsky-says-gop-isnt-real-political-party/,2015-10-31 09:00:00,64,0,18,64,0,0,0,0,0
553923781318329_1049924875051548,"While it is true that the GOP is keeping Fiorina around to not appear sexist, she's still just as idiotic as her fellow candidates.",How many facts can Carly Fiorina get wrong in one speech?,link,http://www.motherjones.com/politics/2015/10/carly-fiorina-fact-free-stump-speech,2015-10-31 06:30:01,6,1,6,6,0,0,0,0,0
553923781318329_1049924605051575,"""And the fact that this story played out last week during a Papal visit exposed just how little these so called Christians of the far right believe in what Jesus actually said. How could they? There is not a tent in the world big enough to fit under it both Jesus and Ayn Rand.""",Bill Maher Explains Why Republicans Worship Martin Shkreli Over Jesus,link,http://www.youngprogressivevoices.com/2015/10/30/bill-maher-explains-republicans-worship-martin-shkreli-jesus/,2015-10-31 04:00:01,34,0,6,34,0,0,0,0,0
553923781318329_1049924221718280,"We took a look at the 5th main entry in the Assassin's Creed franchise, and found it very flawed.",Great Games That Actually Suck- Assassin's Creed III (Part 1),link,http://www.youngprogressivevoices.com/2015/10/30/great-games-actually-suck-assassins-creed-iii-part-1/,2015-10-31 01:30:00,0,0,0,0,0,0,0,0,0
553923781318329_1049925175051518,A great movie with deep themes! #whowatchesthewatchmen,Politics In Movies- Watchmen,link,http://www.youngprogressivevoices.com/2015/10/30/politics-movies-watchmen/,2015-10-30 23:00:01,3,0,0,3,0,0,0,0,0
553923781318329_1049923715051664,"After a long day at work, here're a few relaxing nature pictures to bring your mind at peace.",These Pictures Of Nature Will Bring You At Peace,link,http://www.youngprogressivevoices.com/2015/10/30/pictures-nature-will-bring-peace/,2015-10-30 20:30:00,2,0,0,2,0,0,0,0,0
553923781318329_1049923098385059,How many much more proof does the government need to realize it's a harmless drug that should be legalized.,Study Reveals Marijuana Helps ADHD Patients,link,http://www.youngprogressivevoices.com/2015/10/30/study-reveals-marijuana-helps-adhd-patients/,2015-10-30 18:20:00,21,1,2,21,0,0,0,0,0
553923781318329_1049922905051745,Here's our recap of the protests. Police brutality needs to end in this country.,#RiseUpOctober: Three Days of Action To End Police Terror,link,http://www.youngprogressivevoices.com/2015/10/30/riseupoctober-three-days-action-end-police-terror/,2015-10-30 16:00:01,6,0,1,6,0,0,0,0,0
553923781318329_1049923315051704,A disgusting excuse for a human being.,Scalia Reveals He Doesn't Understand How The Supreme Court Works,link,http://www.youngprogressivevoices.com/2015/10/30/scalia-reveals-doesnt-understand-supreme-court-works/,2015-10-30 14:00:00,20,2,13,20,0,0,0,0,0
553923781318329_1049922521718450,Why is every single blonde conservative woman so misinformed about everything?,That Time Michael Moore Clashed With Elisabeth Hasselbeck Over Bin Laden's Death,link,http://www.youngprogressivevoices.com/2015/10/30/time-michael-moore-clashed-elisabeth-hasselbeck-bin-ladens-death/,2015-10-30 12:00:01,13,1,0,13,0,0,0,0,0
553923781318329_1049921798385189,"We understand politicians can change their viewpoints over time, but this is ridiculous.",Hillary Clinton Flip-Flopped Again -- Here's Why That's Not Surprising,link,http://www.youngprogressivevoices.com/2015/10/29/hillary-clinton-flip-flopped-heres-thats-not-surprising/,2015-10-30 09:30:00,31,6,17,31,0,0,0,0,0
553923781318329_1049921601718542,"Now, if only the U.S. could follow suit. #CitizenFour",EU Advocates Asylum For Snowden,link,http://www.youngprogressivevoices.com/2015/10/30/eu-advocates-asylum-snowden/,2015-10-30 07:30:00,5,0,1,5,0,0,0,0,0
553923781318329_1049598781750824,This is utterly disgusting.,How American Health Care Killed My Father,link,http://www.theatlantic.com/magazine/archive/2009/09/how-american-health-care-killed-my-father/307617/?curator=MediaREDEF,2015-10-29 16:00:01,5,0,4,5,0,0,0,0,0
553923781318329_1049675115076524,"YPV is looking for volunteer youth writers!

If you want to have your voice amplified across the Young Progressive Voices network, please contact us here:

http://www.youngprogressivevoices.com/contact/",Contact - Young Progressive Voices,link,http://www.youngprogressivevoices.com/contact/,2015-10-29 14:47:49,0,0,0,0,0,0,0,0,0
553923781318329_1049597965084239,"If we taxed the rich, what would your spending priorities be?",Occupy Wall St.,photo,https://www.facebook.com/OccupyWallSt/photos/a.187967227937716.47329.184749301592842/1018286028239161/?type=3,2015-10-29 11:19:04,38,3,0,38,0,0,0,0,0
553923781318329_1049415765102459,Not that this should come as a surprise.,Bush Admin. Secretly Warned Republicans To Sell Stocks A Week Before 08' Crash,link,http://www.occupydemocrats.com/bush-admin-secretly-warned-republicans-to-sell-stocks-a-week-before-08-crash/,2015-10-29 07:30:01,43,6,34,43,0,0,0,0,0
553923781318329_1049412808436088,"""What you are saying here tonight is that you love your country, and you are going to fight as hard as you can to make this the country we know it can be!""

Check out Bernie Sanders's Town Hall speech and Q&A from yesterday! #feelthebern

https://www.youtube.com/watch?v=Up46s_gb7PY",Students for Bernie National Town Hall,link,https://www.youtube.com/watch?v=Up46s_gb7PY,2015-10-29 03:16:23,7,0,2,7,0,0,0,0,0
553923781318329_1049133751797327,Picture from the voting rights discussion room at tonight's #GOPDebate location.,Timeline Photos,photo,https://www.facebook.com/youngprogressivevoices/photos/a.554612581249449.1073741828.553923781318329/1049133751797327/?type=3,2015-10-28 13:36:19,14,2,13,14,0,0,0,0,0
553923781318329_1048857035158332,Cute!,Millennials For Revolution,photo,https://www.facebook.com/bernlennials/photos/a.741349402630646.1073741829.738694752896111/812653178833601/?type=3,2015-10-27 23:20:50,42,0,0,42,0,0,0,0,0
553923781318329_1048423488535020,"With Secretary of State John Kerry meeting with the Presidents of Israel and Palestine, we thought we'd ask our fans what your thoughts were on the Gaza conflict. Do you support Israel or Palestine, or think both have lost moral authority?",,status,,2015-10-27 14:00:00,0,1,0,0,0,0,0,0,0
553923781318329_1048421881868514,"Conservatives like to say that the reason they oppose universal healthcare is that they don't want to pay for someone else's hospital bills. Little do they realize they're doing exactly that, only worse, under the capitalist system in place.",Timeline Photos,photo,https://www.facebook.com/youngprogressivevoices/photos/a.554612581249449.1073741828.553923781318329/1048421881868514/?type=3,2015-10-27 11:30:01,68,3,302,68,0,0,0,0,0
553923781318329_1048421561868546,As great a political thinker as a writer!,"Stephen King Doesn't Want To Be 'Afraid' of 'Christians'--Oh, And Ben Carson Is Crazy",link,http://www.ifyouonlynews.com/miscellaneous/stephen-king-doesnt-want-to-be-afraid-of-christians-oh-and-ben-carson-is-crazy/,2015-10-27 09:30:01,16,1,5,16,0,0,0,0,0
553923781318329_1048420975201938,Did Politifact really have to analyze something as painfully obvious as Sean Hannity's stupidity?,"Sean Hannity falls for hoax website on claim that U.S. is taking in 250,000 Syrian refugees",link,http://www.politifact.com/punditfact/statements/2015/oct/26/sean-hannity/250000-syrian-refugees-us-fact-check-trump-hannity/,2015-10-27 07:30:00,9,1,5,9,0,0,0,0,0
553923781318329_1047961565247879,Which is why it's integral that we elect a candidate with strong morals in 2016.,Timeline Photos,photo,https://www.facebook.com/youngprogressivevoices/photos/a.554612581249449.1073741828.553923781318329/1047961565247879/?type=3,2015-10-26 17:30:01,18,1,3,18,0,0,0,0,0
553923781318329_1047960941914608,"Out of all the dumb insults conservatives have come up with, this is by far the most ridiculous. #bleedingheartliberalandproud!","Someone Tell Jeopardy That ""Bleeding Heart"" Isn't An Insult",link,http://www.youngprogressivevoices.com/2015/10/26/someone-tell-jeopardy-bleeding-heart-isnt-insult/,2015-10-26 15:30:00,11,1,2,11,0,0,0,0,0
553923781318329_1047960491914653,It's always great to see Tarantino active and conservative crying!,"Tarantino Marches In Police Brutality Rally, Angering Conservatives",link,http://www.youngprogressivevoices.com/2015/10/26/tarantino-marches-police-brutality-rally-angering-conservatives/,2015-10-26 13:00:00,49,4,5,49,0,0,0,0,0
553923781318329_1047960238581345,"""It's just a collection [of] a lot of people who know so much about so little, that-that helped to drive us into the War in Iraq. The American Enterprise Institute was one of the major forces behind this war.""
-Jeremy Scahill",That Time Jeremy Scahill and Ayaan Hirsi Ali Clashed Over The American Enterprise Institute,link,http://www.youngprogressivevoices.com/2015/10/26/time-jeremy-scahill-ayaan-hirsi-ali-clashed-american-enterprise-institute/,2015-10-26 10:30:00,1,0,1,1,0,0,0,0,0
553923781318329_1047960101914692,Sanders is the only candidate talking about these important issues to young people. #FeeltheBern,"Bernie Sanders Talks Marijuana, College, And Electability On Jimmy Kimmel",link,http://www.youngprogressivevoices.com/2015/10/26/bernie-sanders-talks-marijuana-college-electability-jimmy-kimmel/,2015-10-26 07:30:01,16,1,2,16,0,0,0,0,0
553923781318329_1047735835270452,,Timeline Photos,photo,https://www.facebook.com/youngprogressivevoices/photos/a.554612581249449.1073741828.553923781318329/1047735835270452/?type=3,2015-10-25 15:14:51,45,1,7,45,0,0,0,0,0
553923781318329_1047292355314800,Small victories.,"Obama's SEC Nomination Is A Loss For Wall Street, A Win For The Rest Of Us",link,http://reverbpress.com/politics/obamas-sec-nomination-loss-wall-street-win-rest-us/,2015-10-24 16:45:00,10,2,4,10,0,0,0,0,0
553923781318329_1047042482006454,One of the many reasons we love Noam Chomsky!,Timeline Photos,photo,https://www.facebook.com/youngprogressivevoices/photos/a.554612581249449.1073741828.553923781318329/1047042482006454/?type=3,2015-10-24 15:00:03,110,3,47,110,0,0,0,0,0
553923781318329_1047042058673163,"Productivity is up, wages are down, and people are dying. How did this happen? #MillionStudentMarch",Why You Should Join The #MillionStudentMarch: Cost Of Living,link,http://www.youngprogressivevoices.com/2015/10/24/join-millionstudentmarch-cost-living/,2015-10-24 12:30:01,11,3,6,11,0,0,0,0,0
553923781318329_1047042342006468,"Amazing work from Los Angeles! Now, if only Republicans could stop obstructing similar initiatives in the House.",Los Angeles Is Set To End Homelessness,link,http://www.youngprogressivevoices.com/2015/10/24/los-angeles-set-end-homelessness/,2015-10-24 10:00:01,13,0,6,13,0,0,0,0,0
553923781318329_1047041788673190,"Sanders literally only accepts donations from labor unions and working class Americans, so why would the AFSCME believe Mrs. Clinton to be the better representative? #FeeltheBern",Five Reasons Why AFSCME Should Have Endorsed Bernie Instead Of Hillary,link,http://www.youngprogressivevoices.com/2015/10/24/five-reasons-afscme-endorsed-bernie-instead-hillary/,2015-10-24 07:30:00,92,18,37,92,0,0,0,0,0
553923781318329_1046849152025787,"""Majority of WI Voters don't approve of Scott Walker or the direction Wisconsin is heading in.""",Poll finds new high-water mark for voter dissatisfaction with direction of state,link,http://m.host.madison.com/news/local/govt-and-politics/poll-finds-new-high-water-mark-for-voter-dissatisfaction-with/article_b72c24a9-c26e-5535-a09c-f9da8f5d8fe5.html,2015-10-23 15:53:08,14,2,2,14,0,0,0,0,0
553923781318329_1045671272143575,It's already so hard to tell the difference!,Timeline Photos,photo,https://www.facebook.com/youngprogressivevoices/photos/a.554612581249449.1073741828.553923781318329/1045671272143575/?type=3,2015-10-22 18:30:01,18,0,3,18,0,0,0,0,0
