status_id,status_message,link_name,status_type,status_link,status_published,num_reactions,num_comments,num_shares,num_likes,num_loves,num_wows,num_hahas,num_sads,num_angrys
799007653446065_1424243277589163,ICYMI:,Gluten Sensitivity Doesn't Exist - Liberty Viral,link,http://libertyviral.com/gluten-sensitivity-doesnt-exist/#axzz4HtNJ5EvU,2016-08-31 10:03:20,27,5,43,23,0,0,4,0,0
799007653446065_1424230124257145,Flashback trolling by Liberty Laura.,Weird Sh*t I Saw When I Infiltrated A Donald Trump Group - Liberty Viral,link,http://libertyviral.com/weird-sht-i-saw-when-i-infiltrated-a-donald-trump-group/#axzz4HtNJ5EvU,2016-08-31 09:43:07,13,0,0,11,0,0,2,0,0
799007653446065_1424227494257408,ICYMI:,"Modern Feminist Hypocrisy In One Weird, Sexist Photo",link,http://libertyviral.com/irony-cosmo/#axzz4HtNJ5EvU,2016-08-31 09:41:47,9,1,11,8,0,0,1,0,0
799007653446065_1424211300925694,Free love and free markets <3,5 Reasons Why Millennials Should Support Free Markets,link,http://libertyviral.com/5-reasons-millennials-support-free-markets/#axzz4HtNJ5EvU,2016-08-31 09:13:03,34,1,46,34,0,0,0,0,0
799007653446065_1424159127597578,Canada may need a wall to block celebs out after this.,#Trumpxit: 10 Celebrities Who Claim They Will Leave US if Trump Becomes President,link,http://bit.ly/2bQJDRj,2016-08-31 07:49:55,4,2,6,3,0,0,1,0,0
799007653446065_1423770080969816,Oh snap!,"Dear Iraq and Afghanistan Veterans of America, Support The Troops",link,http://libertyviral.com/dear-iraq-afghanistan-veterans-america-support-troops/#axzz4HtNJ5EvU,2016-08-30 20:50:54,11,2,14,11,0,0,0,0,0
799007653446065_1423723350974489,BREAKING from Florida. Rubio's late entry into senate race didn't keep him from taking the primary.,BREAKING: Marco Rubio Will Win Florida GOP Primary,link,http://bit.ly/2bzmTKL,2016-08-30 19:45:13,8,5,3,8,0,0,0,0,0
799007653446065_1423667847646706,ICYMI:,This Pro Life Olympic Meme Is Pissing Everyone Off…,link,http://libertyviral.com/savage-pro-life-meme-pissing-everyone-off/#axzz4HtNJ5EvU,2016-08-30 18:49:07,11,2,6,8,2,1,0,0,0
799007653446065_1423649027648588,ICYMI:,Voting For Donald Trump Doesn't Make You A Patriot,link,http://libertyviral.com/voting-for-donald-trump-doesnt-make-you-a-patriot/#axzz4HtNJ5EvU,2016-08-30 18:25:15,98,3,70,95,3,0,0,0,0
799007653446065_1423553667658124,What a response!,Comedian Ryan Davis Calls Out Tomi Lahren Over Colin Kaepernick Rant! [Video],link,http://bit.ly/2bGYajh,2016-08-30 16:32:59,21,6,36,17,3,0,1,0,0
799007653446065_1423446071002217,,KMBC 9 News Kansas City,video,https://www.facebook.com/kmbc9/videos/10154342810401221/,2016-08-30 14:46:00,8,3,0,6,0,0,2,0,0
799007653446065_1423414047672086,Read more: http://bit.ly/2bMzFmq,Timeline Photos,photo,https://www.facebook.com/libertyviral/photos/a.868419443171552.1073741828.799007653446065/1423414047672086/?type=3,2016-08-30 13:47:54,76,5,381,60,0,0,0,0,16
799007653446065_1423393224340835,ICYMI,"Whoops! Hillary Clinton, 'We Are Going To Raise Taxes On The Middle Class' [VIDEO]",link,http://libertyviral.com/hillary-clinton-going-raise-taxes-middle-class-video/#axzz4HtNJ5EvU,2016-08-30 13:11:26,9,0,3,6,0,0,2,0,1
799007653446065_1423391804340977,,"Facebook Categorizes You Politically, Wanna See What They Say? - Liberty Viral",link,http://libertyviral.com/facebook-categorizes-politically-wanna-see-say/#axzz4HtNJ5EvU,2016-08-30 13:09:32,1,1,23,1,0,0,0,0,0
799007653446065_1423359221010902,And in the name of equality... Flashback article!,20 Of The Hottest Libertarian Men Alive - Liberty Viral,link,http://libertyviral.com/20-of-the-hottest-libertarian-men-alive/#axzz4HtNJ5EvU,2016-08-30 12:25:47,2,0,0,2,0,0,0,0,0
799007653446065_1423347637678727,Back by popular reader demand! Flashback article:,20 Of The Hottest Libertarian Women Alive - Liberty Viral,link,http://libertyviral.com/20-of-the-hottest-libertarian-women-alive/#axzz4HtNJ5EvU,2016-08-30 12:12:20,9,1,7,8,0,0,1,0,0
799007653446065_1423342621012562,"Oh, Hillary...",5 Reasons Why Hillary Clinton Is Avoiding Press Conferences,link,http://bit.ly/2c5Qvuj,2016-08-30 12:04:54,7,1,22,7,0,0,0,0,0
799007653446065_1423307231016101,What do you say?,POLL: Should the NFL Require Players to Stand for the National Anthem?,link,http://libertyviral.com/poll-nfl-require-players-stand-national-anthem/#axzz4HtNJ5EvU,2016-08-30 11:10:34,10,24,14,9,0,0,0,0,1
799007653446065_1423291591017665,ICYMI:,Punk'd: Gary Johnson's Pickle Attempt [VIDEO],link,http://libertyviral.com/punkd-gary-johnsons-pickle-attempt-video/#axzz4HtNJ5EvU,2016-08-30 10:49:46,7,0,0,6,0,0,1,0,0
799007653446065_1423238151023009,"Show us what your mama gave ya, Governor.",Rick Perry to Appear on Dancing With The Stars,link,http://libertyviral.com/rick-perry-appear-dancing-stars/#axzz4HtNJ5EvU,2016-08-30 09:43:55,7,1,16,7,0,0,0,0,0
799007653446065_1423229371023887,*sips tea*,Ron Paul Institute Slams the Libertarian Ticket,link,http://libertyviral.com/ron-paul-institute-slams-the-libertarian-ticket/#axzz4HtNJ5EvU,2016-08-30 09:29:42,82,10,397,68,7,2,3,1,1
799007653446065_1423149081031916,FTW Brexit looks like a better and better decision each day.,EU Orders Apple to Pay Back 14.6 Billion Euros to Ireland,link,http://bit.ly/2bSXqIW,2016-08-30 08:07:25,15,1,6,14,0,0,0,0,1
799007653446065_1422552014424956,Pizza Delivery Now Available by Drone... [VIDEO],Pizza Delivery Now Available by Drone... [VIDEO] - Liberty Viral,link,http://bit.ly/2bN9n3L,2016-08-29 17:32:07,10,0,12,8,1,0,0,1,0
799007653446065_1422550571091767,Turn up!,"Gary Johnson Throws Down: ""Kumbaya is Over!"" [VIDEO]",link,http://libertyviral.com/gary-johnson-turns-kumbaya-video/#axzz4HtNJ5EvU,2016-08-29 17:28:59,179,11,197,147,21,1,9,1,0
799007653446065_1422535294426628,Trigger warning.,6 Survival Tips for Libertarian College Students,link,http://libertyviral.com/6-tips-for-surviving-college-as-a-libertarian/#axzz4HtNJ5EvU,2016-08-29 17:03:06,18,0,30,16,2,0,0,0,0
799007653446065_1422511044429053,,The Libertarian Republic,link,http://bit.ly/2bRy1iI,2016-08-29 16:30:34,7,1,0,3,0,0,0,0,4
799007653446065_1422482854431872,"Wow, Donald. I thought what you and Rudy Giuliani had was special...",Trump Used to Love Weiner,link,http://bit.ly/2bvrygE,2016-08-29 15:43:57,16,0,10,8,0,0,8,0,0
799007653446065_1422469824433175,#WhyYouthVotesMatter,Gary Johnson Polls Near 21% in National Yik Yak Poll,link,http://libertyviral.com/gary-johnson-polls-near-21-national-yik-yak-poll/#axzz4HtNJ5EvU,2016-08-29 15:21:59,152,1,126,147,4,0,1,0,0
799007653446065_1422469107766580,Minority Trump supporters really embrace his taco bowl outreach.,"""Operation Taco Bowl"" Latinos Rally for Trump (VIDEO)",link,http://bit.ly/2bwh916,2016-08-29 15:20:44,8,0,1,5,0,0,3,0,0
799007653446065_1422410537772437,Lovely.,FBI: Election Databases Compromised by Foreign Hackers,link,http://libertyviral.com/election-databases-compromised-by-foreign-hackers-fbi-says/#axzz4HtNJ5EvU,2016-08-29 14:05:21,6,1,8,4,0,1,1,0,0
799007653446065_1422373817776109,"Yeah, that's sort of not cool.","Libertarian Party Open Letter to Veteran Group: ""Where is Gary?""",link,http://libertyviral.com/libertarian-party-pens-open-letters-to-veteran-group/#axzz4HtNJ5EvU,2016-08-29 13:16:36,58,3,58,57,0,0,0,0,1
799007653446065_1422369837776507,ICYMI:,Poll: Active Troops Support Libertarian Johnson Over Trump And Clinton,link,http://libertyviral.com/poll-active-troops-support-libertarian-johnson-over-trump-and-clinton/#axzz4HtNJ5EvU,2016-08-29 13:11:08,87,1,13,86,1,0,0,0,0
799007653446065_1422357311111093,Beer pong is of the patriarchy.,New MTV Video: If Frats Were Feminist [VIDEO],link,http://libertyviral.com/new-mtv-video-frats-feminist-video/#axzz4HtNJ5EvU,2016-08-29 13:02:48,5,0,1,5,0,0,0,0,0
799007653446065_1422331581113666,"Good job, TSA.","LAX ""Active Shooter"": Loud Noises, A Hero, and Some Guys With Guns",link,http://bit.ly/2cmpwPY,2016-08-29 12:18:28,3,0,0,2,0,0,1,0,0
799007653446065_1422314661115358,"We'd like to formally introduce our new intern, Grant M. Deltz, who will be acting as Liberty Viral's Associate Editor!",,status,,2016-08-29 11:53:05,10,0,3,8,2,0,0,0,0
799007653446065_1422275511119273,"You've been a bad boy, Mr. Weiner.",BREAKING: Huma Abedin Has Had Enough Weiner,link,http://libertyviral.com/breaking-huma-abedin-enough-weiner/#axzz4HtNJ5EvU,2016-08-29 10:52:36,39,5,59,23,0,0,16,0,0
799007653446065_1422240117789479,Old post that's being shared again:,Charles Barkley: Blacks Aren't Successful Because Of Other Blacks - Liberty Viral,link,http://libertyviral.com/charles-barkley-blacks-arent-successful-because-of-other-blacks/#axzz4HtNJ5EvU,2016-08-29 09:50:10,6,0,0,6,0,0,0,0,0
799007653446065_1422230624457095,It's lit.,"Plane Struck by Lightning, Caught on Camera!",link,http://libertyviral.com/plane-struck-by-lightning-caught-on-camera/#axzz4HtNJ5EvU,2016-08-29 09:38:10,5,0,0,4,0,1,0,0,0
799007653446065_1422226124457545,Overdosed on the wall.,Trump's Doctor: Healthiest President Ever Written in 5 Minutes,link,http://libertyviral.com/trumps-doctor-healthiest-president-ever-written-in-5-minutes/#axzz4HtNJ5EvU,2016-08-29 09:30:13,5,1,7,2,0,0,3,0,0
799007653446065_1422197547793736,Rebekah Johansen Bydlak knows how to freedom.,"Meet the Young, Liberty-Minded Candidate Justin Amash Campaigns For",link,http://libertyviral.com/meet-the-youngest-liberty-candidate-justin-amash-campaigns-for/#axzz4HtNJ5EvU,2016-08-29 08:53:34,37,3,10,37,0,0,0,0,0
799007653446065_1422177911129033,"So there you have it, folks.",Science! New Study Proves Students Learn More From Hot Teachers,link,http://libertyviral.com/science-new-study-students-learn-more-from-hot-teachers/#axzz4HtNJ5EvU,2016-08-29 08:37:30,39,10,74,28,0,1,10,0,0
799007653446065_1422160577797433,It's gettin' hot in here.,Gary Johnson Gives Fox News a Lesson in Non-Interventionism [VIDEO],link,http://libertyviral.com/johnson-spells-passion-defending-non-interventionism/#axzz4HtNJ5EvU,2016-08-29 08:15:34,221,12,390,198,23,0,0,0,0
799007653446065_1422132221133602,Read more: http://bit.ly/2bu4zCz,Laura Meyers,photo,https://www.facebook.com/libertylauraofficial/photos/a.1616237698658889.1073741829.1610844859198173/1776932965922694/?type=3,2016-08-29 07:40:41,128,3,0,103,9,0,16,0,0
799007653446065_1422120747801416,#VotesOutForHarambe,Jill Stein Becomes First Candidate To Honor Harambe,link,http://libertyviral.com/jill-stein-becomes-first-candidate-to-honor-harambe/#axzz4IfGiw0XW,2016-08-29 07:19:56,45,7,31,24,2,1,18,0,0
799007653446065_1421617567851734,Shots fired!,Shots Fired: Bill Maher Trolls Donald Trump Outside His Private Jet,link,http://bit.ly/2bPEkmP,2016-08-28 16:52:32,18,3,15,16,0,0,2,0,0
799007653446065_1421525074527650,Take our poll! Link: http://bit.ly/2bEuCo3,Timeline Photos,photo,https://www.facebook.com/libertyviral/photos/a.868419443171552.1073741828.799007653446065/1421525074527650/?type=3,2016-08-28 14:11:07,13,1,17,13,0,0,0,0,0
799007653446065_1421489991197825,"She can open a jar of pickles, but can she climb Mount Everest?","Alex Jones vs. Jimmy Kimmel Over Hillary Clinton Pickle ""Can-spiracy""",link,http://libertyviral.com/alex-jones-vs-jimmy-kimmel-over-pickle-can-spiracy/#axzz4HtNJ5EvU,2016-08-28 13:09:20,6,1,10,4,0,0,2,0,0
799007653446065_1421480567865434,,Timeline Photos,photo,https://www.facebook.com/libertyviral/photos/a.868419443171552.1073741828.799007653446065/1421480567865434/?type=3,2016-08-28 12:56:43,12,0,3,11,1,0,0,0,0
799007653446065_1421478404532317,ICYMI,"Andrea Tanteros: Fox News is ""Like a Sex-Fueled, Playboy Mansion-like Cult And Misogyny"" - Liberty Viral",link,http://libertyviral.com/andrea-tanteros-fox-news-like-sex-fueled-playboy-mansion-like-cult-misogyny/#axzz4HtNJ5EvU,2016-08-28 12:53:47,8,2,6,6,0,0,1,1,0
799007653446065_1421355907877900,Story of the year.,"""Overweight Transsexual Man"" Protests Naked Trump Statue... Naked [NSFW]",link,http://libertyviral.com/overweight-transsexual-man-protests-naked-donald-trump-statue-naked/#axzz4HtNJ5EvU,2016-08-28 10:49:27,19,2,20,16,1,1,1,0,0
799007653446065_1420812024598955,Make sure you follow @babesofliberty on Twitter and Instagram for updated pics and hotties!,Babes for Liberty Respond to Trump Girls With Sexy Comeback,link,http://libertyviral.com/babes-for-liberty-respond-to-trump-girls-with-sexy-comeback/#axzz4HtNJ5EvU,2016-08-27 20:05:22,18,1,9,18,0,0,0,0,0
799007653446065_1420807227932768,And check out Part 2 here: http://bit.ly/2bMae3h,The Clinton Body Count: Part 1 - Liberty Viral,link,http://libertyviral.com/the-clinton-body-count-part-1/#axzz4HtNJ5EvU,2016-08-27 19:59:07,5,0,2,4,0,0,0,1,0
799007653446065_1420806041266220,Tell us what you think!,POLL: Should Vaccines Be Mandatory?,link,http://libertyviral.com/poll-vaccines-mandatory/#axzz4HtNJ5EvU,2016-08-27 19:57:42,0,1,0,0,0,0,0,0,0
799007653446065_1420572037956287,ICYMI,"Federal Reserve Joins Facebook, Immediately Regrets Decision [PHOTOS] - Liberty Viral",link,http://libertyviral.com/fed-joins-facebook/#axzz4HtNJ5EvU,2016-08-27 16:30:00,11,0,3,9,1,0,1,0,0
799007653446065_1420571837956307,ICYMI,"Texas Students for Concealed Carry Troll ""Cocks Not Glocks"" Campaign",link,http://libertyviral.com/students-conceal-carry-troll-cocks-not-glocks-campaign-hard/#axzz4HtNJ5EvU,2016-08-27 15:00:00,13,1,2,9,0,0,4,0,0
799007653446065_1420570377956453,Alternative voter outreach.,Gary Johnson's Altruism: Helps Random Couple Before Rally,link,http://libertyviral.com/gary-johnsons-altruism-helps-random-couple-rally/#axzz4HtNJ5EvU,2016-08-27 13:12:00,92,1,417,81,10,0,1,0,0
799007653446065_1420551824624975,Go Gary.,Punk'd: Gary Johnson's Pickle Attempt [VIDEO],link,http://libertyviral.com/punkd-gary-johnsons-pickle-attempt-video/#axzz4HtNJ5EvU,2016-08-27 12:34:26,116,6,138,86,5,0,25,0,0
799007653446065_1420549101291914,,The Libertarian Republic,link,http://bit.ly/2bVnxxF,2016-08-27 12:30:28,17,4,0,9,2,0,5,1,0
799007653446065_1419827824697375,,Austin Petersen,video,https://www.facebook.com/ProducerPetersen/videos/1169700903088888/,2016-08-26 17:23:29,9,8,0,9,0,0,0,0,0
799007653446065_1419821451364679,,The Libertarian Republic,link,http://thelibertarianrepublic.com/gary-johnson-safe-spaces/,2016-08-26 17:20:16,40,0,0,38,2,0,0,0,0
799007653446065_1419801901366634,Read more: http://bit.ly/2bMEBqY,POLL: Should Vaccines Be Mandatory?,link,http://libertyviral.com/poll-vaccines-mandatory/#axzz4HtNJ5EvU,2016-08-26 16:39:25,8,20,45,5,0,0,0,0,3
799007653446065_1419767741370050,o dam,Twitter Throws Shade on Hillary Clinton about Killer Reputation,link,http://libertyviral.com/twitter-throws-shade-hillary-clinton-clinton-body-count/#axzz4HtNJ5EvU,2016-08-26 15:34:30,20,4,12,14,2,0,4,0,0
799007653446065_1419763031370521,Savage.,5 Reasons Why Hillary Clinton Is Bad For Women - Liberty Viral,link,http://libertyviral.com/5-reasons-why-hillary-clinton-is-bad-for-women/#axzz4HtNJ5EvU,2016-08-26 15:25:04,9,0,3,9,0,0,0,0,0
799007653446065_1419757511371073,,Laura Meyers,link,https://www.facebook.com/libertylauraofficial/posts/1775807949368529,2016-08-26 15:13:18,98,4,0,93,5,0,0,0,0
799007653446065_1419710928042398,,Turning Point News,video,https://www.facebook.com/TurningPointNews/videos/681954455292985/,2016-08-26 13:56:05,18,5,0,14,0,0,4,0,0
799007653446065_1419690848044406,Just a little throwback in case anyone forgot.,KKK Grand Dragon Supports Hillary Clinton [VIDEO],link,http://libertyviral.com/kkk-grand-dragon-supports-hillary-clinton-video/#axzz4HtNJ5EvU,2016-08-26 13:31:41,58,6,31,46,0,4,8,0,0
799007653446065_1419672111379613,f i r e,BREAKING: Eric July's New Music Video is Released on Metal Injection! [VIDEO],link,http://libertyviral.com/eric-julys-new-music-video-released-metal-injection-video/#axzz4HtNJ5EvU,2016-08-26 13:07:01,3,0,5,3,0,0,0,0,0
799007653446065_1419642058049285,,The Libertarian Republic,link,http://bit.ly/2cfclQy,2016-08-26 12:15:37,173,1,0,160,13,0,0,0,0
799007653446065_1419641074716050,New attack ad hits where it hurts.,"Hillary Campaign: If Trump Wins, The KKK Could Be Running the Country [VIDEO]",link,http://libertyviral.com/hillary-clinton-campaign-trump-wins-kkk-running-country-video/#axzz4HtNJ5EvU,2016-08-26 12:13:18,6,6,11,4,0,0,2,0,0
799007653446065_1419586511388173,,Balanced Rebellion,video,https://www.facebook.com/BalancedRebellion/videos/1771513536422109/,2016-08-26 10:53:18,80,6,0,69,7,1,3,0,0
799007653446065_1419577564722401,That's what I'm talking about.,"Lawyer on High EpiPen Prices: Blames Government, Promotes Competition [VIDEO]",link,http://libertyviral.com/8453-2/#axzz4HtNJ5EvU,2016-08-26 10:37:26,160,5,184,153,7,0,0,0,0
799007653446065_1419132654766892,"Interview here! Eric July drops some breaking news on where to find his new single ""Be Great"" by BackWordz that's released TOMORROW. Check it.","Eric July: Hype, Haters and Liberty",video,https://www.youtube.com/watch?v=QzQHINE_r90,2016-08-25 21:18:29,6,1,2,6,0,0,0,0,0
799007653446065_1419082688105222,We'll be like in 5-10 minutes! Check us out here: http://youtu.be/QzQHINE_r90,Liberty Viral,photo,https://www.facebook.com/libertyviral/photos/a.868419443171552.1073741828.799007653446065/1418109568202534/?type=3,2016-08-25 19:56:03,6,0,0,6,0,0,0,0,0
799007653446065_1418981481448676,Welp.,"Trump Calls Former Miss Universe an ""Eating Machine,"" She Endorses Hillary",link,http://libertyviral.com/trump-calls-former-miss-universe-eating-machine-endorses-hillary/#axzz4HtNJ5EvU,2016-08-25 17:13:00,3,1,4,3,0,0,0,0,0
799007653446065_1418968544783303,Interesting...,"Actresses Model in Untouched Lingerie Shoot to Promote ""Body Positivity"" [PHOTOS]",link,http://libertyviral.com/actresses-model-untouched-lingerie-shoot-fight-female-sexual-objectification/#axzz4HtNJ5EvU,2016-08-25 16:48:27,4,4,4,4,0,0,0,0,0
799007653446065_1418941291452695,Freedom FTW.,"University of Chicago Rejects ""Safe Spaces,"" Embraces Free Speech",link,http://libertyviral.com/university-chicago-rejects-safe-spaces-embraces-free-speech/#axzz4HtNJ5EvU,2016-08-25 16:01:22,38,0,22,35,3,0,0,0,0
799007653446065_1418801671466657,Liberty Onion strikes again.,"Despite Hallmarks, ISIS yet to take credit for Italy Quake.",link,http://libertyviral.com/isis-yet-to-claim-responsibility-for-italy-earthquake/#axzz4HtNJ5EvU,2016-08-25 12:43:01,11,0,3,8,0,0,3,0,0
799007653446065_1418785978134893,Aw snap!,"Samuel Jackson: If Trump is President, ""I'm Moving My Black *ss to South Africa"" [VIDEO]",link,http://libertyviral.com/im-sick-and-tired-of-this-mother-fin-trump-in-this-mother-fin-race/#axzz4HtNJ5EvU,2016-08-25 12:14:58,26,24,29,20,1,1,4,0,0
799007653446065_1418740918139399,Do you see something wrong here?,Burkini Ban: Woman Forced to Remove Clothing on Beach [PHOTOS],link,http://libertyviral.com/burkini-ban-woman-forced-remove-clothing-beach-photos/#axzz4HtNJ5EvU,2016-08-25 11:05:36,45,9,67,23,0,2,0,2,18
799007653446065_1418613718152119,Damn it feels good to be a gangster.,No Homework Curriculum! Teacher's Letter to Parents Goes Viral - Liberty Viral,link,http://libertyviral.com/no-homework-curriculum-teachers-letter-to-parents-goes-viral/#axzz4HtNJ5EvU,2016-08-25 08:51:38,12,0,7,11,1,0,0,0,0
799007653446065_1418598334820324,Fam.,"Libertarian at Trump Rally: Trump is Child Molester, Bashes Gary [VIDEO]",link,http://libertyviral.com/libertarian-at-trump-rally-trump-is-child-molester-bashes-gary-video/#axzz4HtNJ5EvU,2016-08-25 08:36:26,15,6,27,11,0,1,1,1,1
799007653446065_1418594831487341,This sucks.,Young Syrian Girl's Singing Interrupted by Violent Airstrike [VIDEO] - Liberty Viral,link,http://libertyviral.com/young-syrian-girls-singing-interrupted-violent-airstrike-video/#axzz4HtNJ5EvU,2016-08-25 08:31:07,8,0,9,1,0,2,0,5,0
799007653446065_1418580424822115,It's going down on the Twitter feed.,Twitter Battle: Tom Woods vs. Gary Johnson Account,link,http://libertyviral.com/how-tom-woods-won-the-internet/#axzz4HtNJ5EvU,2016-08-25 08:16:57,39,2,30,30,4,1,3,1,0
799007653446065_1418564831490341,A comparison of what is and what could have been.,Mike Pence and Rand Paul Walk into a Barber Shop... [VIDEO],link,http://bit.ly/2bDH7Sw,2016-08-25 07:49:25,7,0,18,6,1,0,0,0,0
799007653446065_1418109568202534,Join us tomorrow for a live interview by Liberty Laura feat. Eric July!,Timeline Photos,photo,https://www.facebook.com/libertyviral/photos/a.868419443171552.1073741828.799007653446065/1418109568202534/?type=3,2016-08-24 21:30:16,13,1,19,13,0,0,0,0,0
799007653446065_1417999308213560,"Get him, Gary.","Gary Johnson: Donald Trump is Fascist, ""Where's the Constitution?""",link,http://libertyviral.com/gary-johnson-donald-trump-fascist-wheres-constitution/#axzz4HtNJ5EvU,2016-08-24 18:26:23,42,8,28,40,1,1,0,0,0
799007653446065_1417962724883885,,Gary Johnson,video,https://www.facebook.com/govgaryjohnson/videos/10153295311294364/,2016-08-24 17:24:55,25,1,0,23,2,0,0,0,0
799007653446065_1417957828217708,,Rush Limbaugh: Federally Funded 'Lesbian Farmers' Invading Your Town - Liberty Viral,link,http://libertyviral.com/rush-limbaugh-federally-funded-lesbian-farmers-invading-your-town/#axzz4HtNJ5EvU,2016-08-24 17:16:27,7,1,56,5,0,0,2,0,0
799007653446065_1417896174890540,"Texas Students for Concealed Carry Troll ""Cocks Not Glocks"" Campaign. Read here: http://bit.ly/2bGN0NC",The Dallas Morning News,video,https://www.facebook.com/dallasmorningnews/videos/10154079609223800/,2016-08-24 15:52:58,31,29,0,8,0,1,22,0,0
799007653446065_1417877374892420,Omg...,"Texas Students for Concealed Carry Troll ""Cocks Not Glocks"" Campaign - Liberty Viral",link,http://libertyviral.com/students-conceal-carry-troll-cocks-not-glocks-campaign-hard/#axzz4HtNJ5EvU,2016-08-24 15:22:08,84,6,172,56,4,0,24,0,0
799007653446065_1417849251561899,Rekt.,"D'Souza SLAMS Liberal Professor on Political Party ""Big Switch"" [VIDEO] - Liberty Viral",link,http://libertyviral.com/dsouza-put-smack-liberal-professor-political-party-switch-video/#axzz4HtNJ5EvU,2016-08-24 14:39:58,10,0,5,9,1,0,0,0,0
799007653446065_1417839924896165,Well that's new!,Gary Johnson on TPP: I Have A Sense It Is Laden With Crony Capitalism [VIDEO] - Liberty Viral,link,http://libertyviral.com/gary-johnson-softens-his-stance-on-trans-pacific-partnership/#axzz4HtNJ5EvU,2016-08-24 14:20:19,40,4,65,40,0,0,0,0,0
799007653446065_1417813068232184,Shots fired.,Is This the Best Anti-Hillary Clinton Shirt Ever? - Liberty Viral,link,http://libertyviral.com/is-this-the-best-anti-hillary-shirt-ever/#axzz4HtNJ5EvU,2016-08-24 13:44:35,17,4,6,11,0,0,6,0,0
799007653446065_1417791031567721,,9 Struggles of a Libertarian Military Servicemember - Liberty Viral,link,http://libertyviral.com/10-struggles-of-a-libertarian-servicemember/#axzz4HtNJ5EvU,2016-08-24 13:18:21,15,1,107,12,3,0,0,0,0
799007653446065_1417584618255029,"There you have it, folks.",Women Arrested after Posting Facebook Video Smoking Pot with Toddler [VIDEO] - Liberty Viral,link,http://libertyviral.com/women-arrested-posting-facebook-video-smoking-pot-toddler-video/#axzz4HtNJ5EvU,2016-08-24 09:34:36,12,2,15,4,0,1,2,0,5
799007653446065_1417563418257149,Better put some pants on.,The 98 Things Facebook Knows About You - Liberty Viral,link,http://libertyviral.com/98-things-facebook-knows/#axzz4HtNJ5EvU,2016-08-24 09:00:30,4,0,28,4,0,0,0,0,0
799007653446065_1417546291592195,"Awesome interview, Glenn Beck.",Glenn Beck: Progressives Exist in Both Parties [VIDEO],link,http://libertyviral.com/glenn-beck-progressive-statists-exist-parties/#axzz4HtNJ5EvU,2016-08-24 08:42:47,23,0,19,21,2,0,0,0,0
799007653446065_1417539234926234,Read more: http://bit.ly/2bBxm7A,Timeline Photos,photo,https://www.facebook.com/libertyviral/photos/a.868419443171552.1073741828.799007653446065/1417539234926234/?type=3,2016-08-24 08:30:15,648,20,1492,562,36,0,49,0,1
799007653446065_1417538081593016,It's true.,"The Realist Clinton Video You'll See All Day: Hillary, Queen of Pandering - Liberty Viral",link,http://libertyviral.com/the-realist-clinton-video-youll-see-all-day-hillary-queen-of-pandering/#axzz4HtNJ5EvU,2016-08-24 08:27:25,9,0,1,7,0,0,2,0,0
799007653446065_1417516688261822,"I got ""very conservative."" -LL","Facebook Categorizes You Politically, Wanna See What They Say? - Liberty Viral",link,http://libertyviral.com/facebook-categorizes-politically-wanna-see-say/#axzz4HtNJ5EvU,2016-08-24 07:59:06,17,15,99,16,1,0,0,0,0
799007653446065_1417152401631584,,Laura Meyers,photo,https://www.facebook.com/libertylauraofficial/photos/a.1616237698658889.1073741829.1610844859198173/1774472786168712/?type=3,2016-08-23 22:11:17,204,5,0,165,15,0,23,1,0
799007653446065_1417127734967384,Ohhh boy.,"Army Training Slide Lists Hillary Clinton as ""Insider Threat"" - Liberty Viral",link,http://libertyviral.com/army-training-slide-lists-hillary-clinton-insider-threat/#axzz4HtNJ5EvU,2016-08-23 21:38:05,24,0,12,17,0,0,7,0,0
799007653446065_1417009038312587,Tell us what you think!,"Gary Johnson on The Five, Defends Black Lives Matter and Government [VIDEO] - Liberty Viral",link,http://libertyviral.com/gary-johnson-five-fox-news/#axzz4HtNJ5EvU,2016-08-23 18:40:00,48,11,54,26,5,0,2,1,14
799007653446065_1416916264988531,Lauren Southern is a rockstar.,"Lauren Southern: ""Victim Culture,"" An Embarrassment for Left AND Right [VIDEO] - Liberty Viral",link,http://libertyviral.com/lauren-southern-victim-culture-embarrassment-left-right-video/#axzz4HtNJ5EvU,2016-08-23 16:19:52,9,0,31,7,2,0,0,0,0
799007653446065_1416900664990091,#WheresGary?,"Jill Stein Doesn't Earn Free Hugs Project Endorsement Just Yet, Where's Gary? - Liberty Viral",link,http://libertyviral.com/free-hugs-project-endorsement/#axzz4HtNJ5EvU,2016-08-23 16:05:01,8,2,4,8,0,0,0,0,0
799007653446065_1416891868324304,Oops.,"Andrea Tanteros: Fox News is ""Like a Sex-Fueled, Playboy Mansion-like Cult And Misogyny"" - Liberty Viral",link,http://libertyviral.com/andrea-tanteros-fox-news-like-sex-fueled-playboy-mansion-like-cult-misogyny/#axzz4HtNJ5EvU,2016-08-23 15:48:08,25,2,34,17,0,4,2,1,1
