status_id,status_message,link_name,status_type,status_link,status_published,num_reactions,num_comments,num_shares,num_likes,num_loves,num_wows,num_hahas,num_sads,num_angrys
799007653446065_1662181647128657,:-/ :-/ :-/,Is Respect Vanishing from Society?,link,http://libertyviral.com/respect/,2017-03-31 15:34:53,18,6,42,7,0,1,1,8,1
799007653446065_1661839563829532,Do you take your children to nice restaurants?,Fine Dining: 4 Reasons Your Children Should Not Be In This Environment,link,https://libertyviral.com/fine-dining-4-reasons-your-children-should-not-be-in-this-environment/,2017-03-31 08:49:47,11,9,8,11,0,0,0,0,0
799007653446065_1661789647167857,What are your thoughts?,Has Children's Clothing Become Too Sexualized?,link,https://libertyviral.com/childrens-clothing-become-sexualized/,2017-03-31 07:43:22,15,11,23,15,0,0,0,0,0
799007653446065_1661536453859843,"The Future of The Libertarian Movement an Interview with Larry Sharpe, Libertarian",The Future of The Libertarian Movement an Interview with Larry Sharpe - Liberty Viral,link,https://libertyviral.com/future-of-the-libertarian-movement/,2017-03-31 06:45:56,7,0,4,7,0,0,0,0,0
799007653446065_1661160260564129,One man bought a three bedroom home after being misled.,Website Helps Women Trick Men Into Believing They're Pregnant [VIDEO],link,https://libertyviral.com/website-helps-women-trick-men-into-believing-theyre-pregnant/,2017-03-30 16:40:11,7,2,6,4,0,0,1,0,2
799007653446065_1660950847251737,😂😂😂,Timeline Photos,photo,https://www.facebook.com/libertyviral/photos/a.868419443171552.1073741828.799007653446065/1660950847251737/?type=3,2017-03-30 11:41:04,32,0,7,14,0,0,18,0,0
799007653446065_1660938790586276,Keep laughing at muh tin foil hat.,The CIA and Other Nefarious Groups Can Take Over Virtually Every Smart Device You Own,link,https://libertyviral.com/the-cia-and-other-nefarious-groups-can-take-over-virtually-every-smart-device-you-own/,2017-03-30 11:26:11,19,2,33,16,0,1,0,0,2
799007653446065_1660915053921983,The latest from contributor Alyce Auman!,A Libertarian Twist on Women's Issues,link,https://libertyviral.com/a-libertarian-view-of-womens-issues/,2017-03-30 10:50:44,4,0,9,4,0,0,0,0,0
799007653446065_1660897210590434,lololol,"Bush on Trump Inauguration: ""Weird Sh*t!"" - Liberty Viral",link,https://libertyviral.com/bush-trump-inaug-weird-sht/,2017-03-30 10:24:56,9,0,3,7,0,0,2,0,0
799007653446065_1660544193959069,"Attorney General Becerra, A Planned Parenthood Donation Recipient, Charges Journalists With 15 felonies.","Attorney General, A Planned Parenthood Donation Recipient, Charges Journalists With 15 felonies - Liberty Viral",link,https://libertyviral.com/attorney-general-a-planned-parenthood-donation-recipient-charges-journalists-with-15-felonies/,2017-03-30 07:07:00,42,4,44,21,1,3,2,0,15
799007653446065_1660161733997315,"Liberty Viral would like to wish a very happy birthday to one of our Associate Editors, Grant M. Deltz! Thank you for all of your hard work and enjoy your day!",Timeline Photos,photo,https://www.facebook.com/libertyviral/photos/a.868419443171552.1073741828.799007653446065/1660161733997315/?type=3,2017-03-29 16:39:46,30,4,1,28,2,0,0,0,0
799007653446065_1660034384010050,,Timeline Photos,photo,https://www.facebook.com/libertyviral/photos/a.868419443171552.1073741828.799007653446065/1660034384010050/?type=3,2017-03-29 13:36:15,207,17,51,149,0,2,55,0,1
799007653446065_1659936837353138,Hmmm... Thoughts?,Feminist Author: Women Need to Stop Playing the Victim,link,https://libertyviral.com/you-are-here-feminist-author-women-need-to-stop-playing-the-victim/,2017-03-29 11:08:55,12,0,15,12,0,0,0,0,0
799007653446065_1659904797356342,This is so sad...,Girl Killed in Car Accident Receives Bill to Repair the Roadway [VIDEO],link,http://libertyviral.com/ten/,2017-03-29 10:33:30,34,3,83,10,0,5,1,0,18
799007653446065_1659824987364323,ICYMI,The Fall of the Constitution and the Republic,link,https://libertyviral.com/the-fall-of-the-constitution-and-the-republic/,2017-03-29 08:56:27,5,0,1,5,0,0,0,0,0
799007653446065_1659258374087651,I HAVE THE BEST WORDS,President Trump on Never Making Mistakes,video,https://www.facebook.com/libertyviral/videos/1659258374087651/,2017-03-28 21:13:02,26,1,23,13,1,1,11,0,0
799007653446065_1659192274094261,Do you agree?,Milton Friedman on 'the Major Fault of the Collectivist Philosophy',link,https://libertyviral.com/milton-friedman-on-the-major-fault-of-the-collectivist-philosophy/,2017-03-28 19:34:30,32,6,45,26,2,0,4,0,0
799007653446065_1659124667434355,Like and share if you agree!,Trump Administration is Every Bit as Transparent as Obama's Ad...,video,https://www.facebook.com/libertyviral/videos/1659124667434355/,2017-03-28 18:50:25,6,2,7,6,0,0,0,0,0
799007653446065_1659084327438389,Oh snap.,SD Lawmaker asks 'If it pleases the crown' on the House floor,link,https://libertyviral.com/sd-lawmaker-asks-if-it-pleases-the-crown-on-the-house-floor/,2017-03-28 16:28:35,477,14,1068,313,44,3,117,0,0
799007653446065_1659036544109834,Warning: viewer discretion advised.,Police Runs Over and Kills Gun Wieldng 'Most Wanted' Fugitive [VIDEO] - Liberty Viral,link,https://libertyviral.com/police-runs-kills-gun-wieldng-wanted-fugitive-video2/,2017-03-28 15:24:41,28,18,24,18,0,2,8,0,0
799007653446065_1658972007449621,That seems a bit harsh...,Preschooler Gets Week-long Suspension for Picking Up Shell Casing,link,https://libertyviral.com/preschooler-gets-week-long-suspension-for-picking-up-shell-casing/,2017-03-28 14:02:14,7,3,7,1,0,1,1,1,3
799007653446065_1658914227455399,How do you feel about this?,"Florida Homeowner Informed to Remove ""Racist"" Blue Lives Matter flag. - Liberty Viral",link,https://libertyviral.com/florida-homeowner-informed-remove-racist-blue-lives-matter-flag/,2017-03-28 12:41:00,21,22,8,6,0,0,4,2,9
799007653446065_1658784047468417,No comment.,BREAKING: Liberty Viral is Fake News - Liberty Viral,link,https://libertyviral.com/breaking-liberty-viral-is-fake-news/,2017-03-28 10:52:19,40,2,4,19,0,0,21,0,0
799007653446065_1658245880855567,Spotlight on a Libertarian: Rachel Maisonet,Spotlight on a Libertarian: Rachel Maisonet - Liberty Viral,link,https://libertyviral.com/spotlight-on-a-libertarian-rachel-maisonet/,2017-03-28 08:35:00,6,1,2,3,3,0,0,0,0
799007653446065_1658274587519363,Johnny Depp to Play John Mcafee in New Hollywood Film!,Johnny Depp to Play John McAfee in New Film,link,https://libertyviral.com/johnny-depp-to-play-john-mcafee-in-new-hollywood-film/,2017-03-27 22:14:15,238,15,44,210,12,9,7,0,0
799007653446065_1658067624206726,Which part of wanting literate teachers seems unreasonable?,New York to Nix Literacy Tests for Teachers Because Too Many Minorities Are Failing,link,https://libertyviral.com/new-york-nix-literacy-tests-teachers-many-minorities-failing/,2017-03-27 17:18:20,65,6,210,30,0,9,8,3,15
799007653446065_1658050354208453,THE OUTRAGE.,Why People Are Freaking Out Over United Airlines' Dress Code,link,https://libertyviral.com/people-freaking-united-airlines-dress-code/,2017-03-27 16:48:46,24,12,45,19,0,0,5,0,0
799007653446065_1658014710878684,H/T to The Mad Statist! Head on over and give 'em a Like! 👍,Timeline Photos,photo,https://www.facebook.com/libertyviral/photos/a.868419443171552.1073741828.799007653446065/1658014710878684/?type=3,2017-03-27 15:49:06,227,7,35,166,21,0,40,0,0
799007653446065_1657931634220325,MUH ENDANGERED SPECIES!,Porn Turned Philanthropy? Help Save the Pandas! [VIDEO NSFW],link,https://libertyviral.com/porn-turned-philanthropy-help-save-pandas/,2017-03-27 13:55:12,2,0,7,2,0,0,0,0,0
799007653446065_1657736017573220,LOVE COFFEE.,Hottie Latte? Sex-presso? Bikini Baristas Brewing Up More Than Coffee,link,https://libertyviral.com/hottie-latte-sex-presso-bikini-baristas-brewing-up-more-than-coffee/,2017-03-27 09:33:02,4,0,1,3,1,0,0,0,0
799007653446065_1657709260909229,Uhhh woah...,To Save Entitlements We Should Kill The Elderly,link,https://libertyviral.com/to-save-entitlements-we-should-kill-the-elderly/,2017-03-27 08:58:40,13,1,44,8,1,3,1,0,0
799007653446065_1657670250913130,hmmm...,Gluten Sensitivity Doesn't Exist,link,https://libertyviral.com/gluten-sensitivity-doesnt-exist/,2017-03-27 08:08:20,139,20,46,110,4,5,18,0,2
799007653446065_1656864884327000,,Timeline Photos,photo,https://www.facebook.com/libertyviral/photos/a.868419443171552.1073741828.799007653446065/1656864884327000/?type=3,2017-03-26 16:45:19,80,2,29,39,0,0,41,0,0
799007653446065_1656864574327031,,Timeline Photos,photo,https://www.facebook.com/libertyviral/photos/a.868419443171552.1073741828.799007653446065/1656864574327031/?type=3,2017-03-26 16:15:55,138,5,43,91,4,1,41,0,1
799007653446065_1656864204327068,,Timeline Photos,photo,https://www.facebook.com/libertyviral/photos/a.868419443171552.1073741828.799007653446065/1656864204327068/?type=3,2017-03-26 15:55:31,225,0,82,198,10,0,16,1,0
799007653446065_1656863927660429,,Timeline Photos,photo,https://www.facebook.com/libertyviral/photos/a.868419443171552.1073741828.799007653446065/1656863927660429/?type=3,2017-03-26 15:25:08,152,14,102,98,0,5,49,0,0
799007653446065_1656863070993848,,Timeline Photos,photo,https://www.facebook.com/libertyviral/photos/a.868419443171552.1073741828.799007653446065/1656863070993848/?type=3,2017-03-26 13:45:49,306,18,210,283,14,1,8,0,0
799007653446065_1656861424327346,,Timeline Photos,photo,https://www.facebook.com/libertyviral/photos/a.868419443171552.1073741828.799007653446065/1656861424327346/?type=3,2017-03-26 13:03:07,237,9,68,223,3,1,0,9,1
799007653446065_1656714144342074,,Timeline Photos,photo,https://www.facebook.com/libertyviral/photos/a.868419443171552.1073741828.799007653446065/1656714144342074/?type=3,2017-03-26 11:30:42,112,2,20,71,2,1,38,0,0
799007653446065_1656687804344708,,Timeline Photos,photo,https://www.facebook.com/libertyviral/photos/a.868419443171552.1073741828.799007653446065/1656687804344708/?type=3,2017-03-26 10:30:48,218,40,124,174,0,4,26,2,12
799007653446065_1656687467678075,"IQYMI.... she was the ""Queen Bee."" 🐝😬",Pennsylvania Man Kills Pregnant Wife With Sword; Cites 'Hybrid Human Threat',link,https://libertyviral.com/pennsylvania-man-kills-pregnant-wife-sword-cites-hybrid-human-threat/,2017-03-26 09:35:31,7,5,0,3,0,2,0,2,0
799007653446065_1655475834465905,,5 Rabidly Insane Quotes From Elected Representatives - Liberty Viral,link,https://libertyviral.com/rabidly-insane-quotes/,2017-03-25 12:25:51,11,3,0,7,0,1,3,0,0
799007653446065_1655475367799285,,The Top Ten Libertarian Bumper Sticker Quotes - Liberty Viral,link,https://libertyviral.com/top-ten-libertarian-bumper-sticker-quotes/,2017-03-25 11:24:55,14,4,2,12,1,0,1,0,0
799007653446065_1655474324466056,,The Top 5 Reasons Why FDR Sucked As President - Liberty Viral,link,https://www.google.com/amp/s/libertyviral.com/the-top-5-reasons-why-fdr-sucked-as-president/amp/,2017-03-25 10:23:43,127,8,17,117,6,1,3,0,0
799007653446065_1655473801132775,🤤ICYMI🤤,Chelsea Clinton Earns Lifetime Achievement Award,link,https://libertyviral.com/chelsea-clinton-earns-lifetime-achievement-award/,2017-03-25 09:22:38,25,9,2,6,0,0,18,0,1
799007653446065_1655472841132871,ICYMI. #notmycountrystory #justiceforbradswife #nojusticenopeace,Cracker Barrel Fires Brad's Wife; Devastates All of Humanity,link,https://libertyviral.com/cracker-barrel-fires-brads-wife-devastates-all-of-humanity/,2017-03-25 08:10:33,35,3,7,23,0,0,12,0,0
799007653446065_1654871144526374,,Jennifer Giorgi,link,https://tuttletwins.com/?ap_id=jjgiorgi,2017-03-24 19:01:26,5,0,0,5,0,0,0,0,0
799007653446065_1654775011202654,Does the government ignore the Constitution?,The Fall of the Constitution and the Republic,link,https://libertyviral.com/the-fall-of-the-constitution-and-the-republic/,2017-03-24 17:15:34,28,2,40,19,1,1,0,7,0
799007653446065_1654590017887820,This doesn't seem okay...,Stonegait Institute,link,http://stonegaitinstitute.org/2017/03/24/officials-want-family-to-bulldoze-900k-house-over-faulty-sewage-system-officials-initially-approved/,2017-03-24 13:10:58,20,0,0,5,0,1,0,2,12
799007653446065_1654540591226096,😂😂😂,Timeline Photos,photo,https://www.facebook.com/libertyviral/photos/a.868419443171552.1073741828.799007653446065/1654540591226096/?type=3,2017-03-24 12:04:06,525,18,119,326,34,0,165,0,0
799007653446065_1654526587894163,Sounds biased to us.,Why You Should Vote For Gaby Borromeo on NBC's The Voice,link,https://libertyviral.com/why-you-should-vote-for-gaby-borromeo-on-nbcs-the-voice/,2017-03-24 11:42:08,1,0,3,1,0,0,0,0,0
799007653446065_1654508007896021,Have you made it out to one of Adam Kokesh's book tour events?,The Power of Persuasion: An Adam Kokesh Story - Liberty Viral,link,https://libertyviral.com/power-persuasion-adam-kokesh-story/,2017-03-24 11:29:23,5,0,3,5,0,0,0,0,0
799007653446065_1654253584588130,,Timeline Photos,photo,https://www.facebook.com/libertyviral/photos/a.868419443171552.1073741828.799007653446065/1654253584588130/?type=3,2017-03-24 07:04:46,211,0,85,120,0,1,89,0,1
799007653446065_1653645361315619,,Timeline Photos,photo,https://www.facebook.com/libertyviral/photos/a.868419443171552.1073741828.799007653446065/1653645361315619/?type=3,2017-03-23 17:42:57,121,5,28,68,5,0,48,0,0
799007653446065_1653456914667797,,Timeline Photos,photo,https://www.facebook.com/libertyviral/photos/a.868419443171552.1073741828.799007653446065/1653456914667797/?type=3,2017-03-23 14:08:13,62,1,21,39,5,0,18,0,0
799007653446065_1653343494679139,1 like = 1 prayer #justiceforbradswife,Cracker Barrel Fires Brad's Wife; Devastates All of Humanity,link,https://libertyviral.com/cracker-barrel-fires-brads-wife-devastates-all-of-humanity/,2017-03-23 12:00:01,64,7,93,41,1,1,20,0,1
799007653446065_1653245311355624,...WUT?,Chelsea Clinton Earns Lifetime Achievement Award,link,https://libertyviral.com/chelsea-clinton-earns-lifetime-achievement-award/,2017-03-23 10:01:40,37,15,49,9,0,4,23,0,1
799007653446065_1652366144776874,#sassiemassie,Timeline Photos,photo,https://www.facebook.com/libertyviral/photos/a.868419443171552.1073741828.799007653446065/1652366144776874/?type=3,2017-03-22 16:25:19,189,1,23,140,22,0,27,0,0
799007653446065_1652194798127342,"Well, this is interesting.",Gorsuch: Roe v. Wade is the Law of the Land,link,https://libertyviral.com/gorsuch-roe-v-wade-law-land/,2017-03-22 13:57:22,28,3,16,20,0,0,3,1,4
799007653446065_1652088334804655,Umm.... thanks?,Pennsylvania Man Kills Pregnant Wife With Sword; Cites 'Hybrid Human Threat',link,https://libertyviral.com/pennsylvania-man-kills-pregnant-wife-sword-cites-hybrid-human-threat/,2017-03-22 11:39:00,1,1,3,1,0,0,0,0,0
799007653446065_1652043221475833,Lol,Liberal Meme of the Week: Now Honesty Matters,link,https://libertyviral.com/liberal-meme-of-the-week-now-honesty-matters/,2017-03-22 10:43:52,96,2,105,71,3,0,22,0,0
799007653446065_1652011834812305,Oh Shaq...,Timeline Photos,photo,https://www.facebook.com/libertyviral/photos/a.868419443171552.1073741828.799007653446065/1652011834812305/?type=3,2017-03-22 10:06:14,327,16,129,218,5,0,104,0,0
799007653446065_1651390261541129,I don't think Nicholas Sarwark likes us very much. #SAD,Chairman of the LP: Everyone I Don't Like is a Clickbait Troll!,link,http://bit.ly/2n5cjMQ,2017-03-21 19:39:20,19,6,9,7,1,0,11,0,0
799007653446065_1651122841567871,SHAQ NOOOO,Shaquille O'Neal is a Flat Earther [AUDIO],link,http://libertyviral.com/shaquille-oneal-is-a-flat-earther/,2017-03-21 13:28:36,10,2,27,3,0,0,6,0,1
799007653446065_1651043041575851,,Timeline Photos,photo,https://www.facebook.com/libertyviral/photos/a.868419443171552.1073741828.799007653446065/1651043041575851/?type=3,2017-03-21 11:47:14,120,4,17,62,3,0,55,0,0
799007653446065_1650956878251134,Where will he end up next?,5 Judge Napolitano Quotes to Supercharge your Libertarianism,link,https://libertyviral.com/5-judge-napolitano-quotes-supercharge-libertarianism-2/,2017-03-21 09:51:50,10,3,18,10,0,0,0,0,0
799007653446065_1650433334970155,,Austin Petersen,link,https://twitter.com/RLibertyCaucus/status/843988273936715776,2017-03-20 20:05:50,4,0,0,4,0,0,0,0,0
799007653446065_1650387204974768,"""The 'fake news' can just be so brutal to him"" - Sean Spicer",Trump Extends Secret Service Detail to Protect His Emotions,link,https://libertyviral.com/trump-extends-secret-service-detail-protect-emotions/,2017-03-20 19:25:27,14,2,14,2,0,0,12,0,0
799007653446065_1650192338327588,Do you agree with Squiggly Line Guy?,Should Patriotic Americans Support or Oppose Trump's Wall?,link,https://libertyviral.com/should-patriots-support-or-oppose-trumps-wall/,2017-03-20 14:34:19,5,1,6,3,2,0,0,0,0
799007653446065_1650004695013019,Or your liberty bromance. 🗽,Timeline Photos,photo,https://www.facebook.com/libertyviral/photos/a.868419443171552.1073741828.799007653446065/1650004695013019/?type=3,2017-03-20 09:51:00,125,128,42,76,23,0,25,1,0
799007653446065_1649982378348584,,Timeline Photos,photo,https://www.facebook.com/libertyviral/photos/a.868419443171552.1073741828.799007653446065/1649982378348584/?type=3,2017-03-20 09:19:30,30,0,4,17,1,0,12,0,0
799007653446065_1649955605017928,Check out the latest from contributor Ian Tartt!,Thoughts about Abortion from a Pro-life Radical Libertarian,link,https://libertyviral.com/thoughts-about-abortion-from-a-pro-life-radical-libertarian/,2017-03-20 08:47:20,29,4,42,23,5,0,1,0,0
799007653446065_1649379798408842,Worth reposting.,DUI Checkpoints are Unconstitutional,link,https://libertyviral.com/dui-checkpoints-are-unconstitutional/,2017-03-19 19:18:24,202,9,43,192,7,0,3,0,0
799007653446065_1649346871745468,,Timeline Photos,photo,https://www.facebook.com/libertyviral/photos/a.868419443171552.1073741828.799007653446065/1649346871745468/?type=3,2017-03-19 18:28:18,199,4,77,128,0,0,68,3,0
799007653446065_1649160338430788,,Timeline Photos,photo,https://www.facebook.com/libertyviral/photos/a.868419443171552.1073741828.799007653446065/1649160338430788/?type=3,2017-03-19 14:44:37,22,0,4,17,0,0,5,0,0
799007653446065_1649044728442349,,Timeline Photos,photo,https://www.facebook.com/libertyviral/photos/a.868419443171552.1073741828.799007653446065/1649044728442349/?type=3,2017-03-19 11:55:15,63,0,3,47,2,0,12,2,0
799007653446065_1648956745117814,H. All of the above.,Timeline Photos,photo,https://www.facebook.com/libertyviral/photos/a.868419443171552.1073741828.799007653446065/1648956745117814/?type=3,2017-03-19 09:55:14,31,11,2,31,0,0,0,0,0
799007653446065_1648911315122357,,Timeline Photos,photo,https://www.facebook.com/libertyviral/photos/a.868419443171552.1073741828.799007653446065/1648911315122357/?type=3,2017-03-19 08:57:55,605,19,666,383,17,3,200,0,2
799007653446065_1648744891805666,DEVELOPING:,BREAKING: Bomb Threat at White House Marks Third Security Scare in Just Over A Week,link,https://libertyviral.com/breaking-bomb-threat-white-house-marks-third-security-scare-just-week/,2017-03-19 04:29:43,4,1,20,4,0,0,0,0,0
799007653446065_1648080515205437,You heard it here first.,Breaking News: White House Vicinity Evacuated,link,https://libertyviral.com/breaking-news-white-house-south-lawn-evacuated/,2017-03-18 13:14:46,7,4,16,6,0,1,0,0,0
799007653446065_1648033438543478,,,video,https://www.facebook.com/libertyviral/videos/1648033438543478/,2017-03-18 12:11:11,9,0,3,9,0,0,0,0,0
799007653446065_1648023978544424,Active armed patrols blocking access to the White House sidewalks. -Jenn,Timeline Photos,photo,https://www.facebook.com/libertyviral/photos/a.868419443171552.1073741828.799007653446065/1648023978544424/?type=3,2017-03-18 11:58:57,8,6,3,7,0,1,0,0,0
799007653446065_1648017375211751,,,video,https://www.facebook.com/libertyviral/videos/1648017375211751/,2017-03-18 11:51:05,12,0,2,9,2,1,0,0,0
799007653446065_1647971365216352,ICYMI,McDonald's Drive Thu Worker Jumps Through Window to Save Off Duty Cop and Her Family [VIDEO],link,http://bit.ly/2mKl52o,2017-03-18 10:45:03,8,0,2,8,0,0,0,0,0
799007653446065_1647787278568094,STOP APPROPRIATING MUH CULTURE. 🍀🍻,The Scarcely Told Story of the St. Patrick's Day March on Washington,link,https://libertyviral.com/irish-appropriation/,2017-03-18 07:05:11,14,0,9,7,0,0,7,0,0
799007653446065_1647057248641097,Dangerous!,Timeline Photos,photo,https://www.facebook.com/libertyviral/photos/a.868419443171552.1073741828.799007653446065/1647057248641097/?type=3,2017-03-17 13:23:42,277,4,125,187,4,0,86,0,0
799007653446065_1646886085324880,Sometimes life stinks.... but it doesn't have to with V.I.Poo! ... Do your civic doody! ... ahh. The jokes are endless!,"Free Market Innovation: V.I.Poo, the Pre-poo Toilet Spray [VIDEO]",link,http://bit.ly/2nvgl3X,2017-03-17 09:53:09,1,1,3,1,0,0,0,0,0
799007653446065_1646860461994109,Not even satire...,Red Power Ranger Goes Rogue; Pleads Guilty to Killing Roommate with Sword,link,http://bit.ly/2nvfuAr,2017-03-17 09:19:37,24,7,40,12,0,7,3,1,1
799007653446065_1646782925335196,So sad. :(,Baby Dies as Sitter's 911 Call Goes Unanswered,link,http://bit.ly/2nz6MOi,2017-03-17 08:00:38,14,0,11,4,0,2,0,6,2
799007653446065_1646238738722948,,Spotlight on a Libertarian: Derek Ryan,link,https://libertyviral.com/spotlight-on-a-libertarian-derek-ryan/,2017-03-16 17:19:52,8,0,6,7,1,0,0,0,0
799007653446065_1645917075421781,"His hands ARE kinda small, tbh",McDonald's Blasts Trump on Twitter; Wants Obama Back,link,https://libertyviral.com/mcdonalds-blasts-trump-twitter-wants-obama-back/,2017-03-16 10:48:20,16,8,4,9,0,1,6,0,0
799007653446065_1644990368847785,,Timeline Photos,photo,https://www.facebook.com/libertyviral/photos/a.868419443171552.1073741828.799007653446065/1644990368847785/?type=3,2017-03-15 16:35:35,88,1,46,52,2,0,34,0,0
799007653446065_1644950668851755,Awesome!,McDonald's Drive Thu Worker Jumps Through Window to Save Off Duty Cop and Her Family [VIDEO],link,http://bit.ly/2mKl52o,2017-03-15 15:38:39,35,0,5,32,2,1,0,0,0
799007653446065_1644801942199961,That's an interesting display...,Feminist Performance Actors Abort Jesus in the Streets [PHOTO],link,http://bit.ly/2nFbcCj,2017-03-15 12:18:48,30,11,67,3,1,2,3,4,17
799007653446065_1644801942199961,That's an interesting display...,Feminist Performance Actors Abort Jesus in the Streets [PHOTO],link,http://bit.ly/2nFbcCj,2017-03-15 12:18:48,30,11,67,3,1,2,3,4,17
799007653446065_1644710658875756,The latest from contributor Alyce Auman!,Fathers Do Not Have Equal Rights - Liberty Viral,link,http://bit.ly/2mZUGzU,2017-03-15 10:27:23,39,6,162,31,3,0,0,5,0
799007653446065_1644693272210828,Good Doggo <3,Timeline Photos,photo,https://www.facebook.com/libertyviral/photos/a.868419443171552.1073741828.799007653446065/1644693272210828/?type=3,2017-03-15 10:02:39,89,1,19,61,3,1,24,0,0
799007653446065_1644163975597091,,The Libertarian Republic,link,http://thelibertarianrepublic.com/white-house-releases-trump-2005-tax-info-msnbc/,2017-03-14 20:07:30,55,7,0,39,0,4,11,0,1
799007653446065_1644143015599187,,The Libertarian Republic,link,http://thelibertarianrepublic.com/rachel-maddow-says-will-reveal-trumps-tax-returns/,2017-03-14 19:41:51,14,3,0,8,2,1,3,0,0
799007653446065_1644039328942889,Spot on!,4 Ways Political Parties Can be Harmful,link,http://bit.ly/2mXjmJm,2017-03-14 18:15:00,12,1,3,11,0,1,0,0,0
799007653446065_1644029688943853,Crime or free speech?,Rapper Appears to Shoot Trump in New Video [WATCH],link,http://bit.ly/2mXovks,2017-03-14 17:45:33,10,21,12,7,0,2,0,0,1
799007653446065_1643969728949849,,Timeline Photos,photo,https://www.facebook.com/libertyviral/photos/a.868419443171552.1073741828.799007653446065/1643969728949849/?type=3,2017-03-14 15:41:23,994,35,5618,746,25,1,215,4,3
799007653446065_1643864898960332,"Check your appliances, friends. Stay safe out there.",Timeline Photos,photo,https://www.facebook.com/libertyviral/photos/a.868419443171552.1073741828.799007653446065/1643864898960332/?type=3,2017-03-14 13:15:05,80,3,18,49,2,0,29,0,0
799007653446065_1643826348964187,Sad reax only. :(,Timeline Photos,photo,https://www.facebook.com/libertyviral/photos/a.868419443171552.1073741828.799007653446065/1643826348964187/?type=3,2017-03-14 12:21:00,190,5,31,103,1,0,54,30,2
799007653446065_1643781015635387,No... It isn't code for anything.,PornHub Offers to Plow Boston and New Jersey During the Latest Winter Storm,link,https://libertyviral.com/pornhub-offers-plow-boston-residents-latest-winter-storm/,2017-03-14 11:48:56,75,2,247,48,2,1,23,0,1
799007653446065_1643766078970214,They are so bad...,Occupy Democrats Meme of the Week: You're a Bad Person,link,http://bit.ly/2mopfeq,2017-03-14 11:30:07,129,3,351,105,6,0,17,0,1
799007653446065_1643726565640832,"Donald J. Trump Unleashes Drone Warfare and Central Intelligence Agency (CIA) Capabilities. 

Antiwar.com",Trump Administration Unleashes Drone Warfare and CIA Capabilities,link,https://libertyviral.com/trump-expands-drone-warfare-cia-capabilities/,2017-03-14 10:40:47,6,0,11,5,0,0,0,0,1
799007653446065_1643140675699421,An interesting read...,"Leadership, Strategy, and Headaches: Does The Libertarian Party Have Cancer?",link,http://bit.ly/2nhkTuz,2017-03-13 19:47:27,6,0,3,5,0,0,0,1,0
799007653446065_1643124232367732,lol,Timeline Photos,photo,https://www.facebook.com/libertyviral/photos/a.868419443171552.1073741828.799007653446065/1643124232367732/?type=3,2017-03-13 19:26:01,70,2,17,40,1,1,28,0,0
799007653446065_1642964392383716,,Timeline Photos,photo,https://www.facebook.com/libertyviral/photos/a.868419443171552.1073741828.799007653446065/1642964392383716/?type=3,2017-03-13 15:46:07,74,10,30,37,2,2,33,0,0
799007653446065_1642947355718753,#mancrushmonday,Sen. Rand Paul Demands to See 'Secret' Obamacare Replacement [VIDEO],link,https://libertyviral.com/sen-rand-paul-demands-to-see-obamacare-replacement-video/,2017-03-13 15:23:27,19,0,2,17,2,0,0,0,0
799007653446065_1642937755719713,Woah...,Steve King Excoriated for Nationalism; Wins David Duke's Heart,link,http://bit.ly/2mkk7Jn,2017-03-13 15:08:01,3,0,6,1,2,0,0,0,0
