status_id,status_message,link_name,status_type,status_link,status_published,num_reactions,num_comments,num_shares,num_likes,num_loves,num_wows,num_hahas,num_sads,num_angrys
799007653446065_1498426156837541,Check it out!,What's The Real Meaning of The Word 'Liberal?',link,http://libertyviral.com/whats-real-meaning-word-liberal-video/#axzz4Q020q800,2016-11-14 17:37:45,21,0,19,17,4,0,0,0,0
799007653446065_1498416513505172,How will he use his power?,Why Trump Will be the Most Powerful President Ever,link,http://libertyviral.com/trump-will-powerful-president-since-fdr/#axzz4Q1N80clo,2016-11-14 17:20:34,8,3,0,8,0,0,0,0,0
799007653446065_1498316176848539,,Laura Meyers,photo,https://www.facebook.com/libertylauraofficial/photos/a.1616237698658889.1073741829.1610844859198173/1816969981918992/?type=3,2016-11-14 15:02:18,101,0,0,98,3,0,0,0,0
799007653446065_1498288993517924,True love <3,Top 10 Joe Biden and President Obama Memes,link,http://libertyviral.com/5-illegal-things-legal/#axzz4Q020q800,2016-11-14 14:15:15,36,2,54,28,1,0,7,0,0
799007653446065_1498255653521258,Interesting...,George Soros Helped Nazis Confiscate Jewish Property as a Child [VIDEO],link,http://libertyviral.com/george-soros-helped-nazis-confiscate-jewish-property-child/#axzz4Q020q800,2016-11-14 13:42:03,47,1,169,33,0,5,1,0,8
799007653446065_1497054086974748,ICYMI,Justin Amash:,link,http://libertyviral.com/justin-amash-putting-band-back-together/#axzz4Pv8oT1ii,2016-11-13 16:16:03,20,0,1,17,3,0,0,0,0
799007653446065_1496963753650448,ICYMI,10 Prepper Tips to Survive the 2016 Election Results,link,http://libertyviral.com/10preps/,2016-11-13 14:58:22,1,0,0,1,0,0,0,0,0
799007653446065_1495867473760076,ICYMI,Post Election Blues? Here Are 10 Ways to Act on Your Libertarian Leanings,link,http://libertyviral.com/10-ways-to-act-on-your-libertarian-leanings/#axzz4PoYX56h9,2016-11-12 14:02:42,13,0,17,13,0,0,0,0,0
799007653446065_1495789153767908,ICYMI,Donald Trump Releases Plan to Privatize Roads and Bridges,link,http://libertyviral.com/donald-trump-releases-plan-to-privatize-roads-bridges/#axzz4PoYX56h9,2016-11-12 12:12:19,117,17,249,104,6,0,6,1,0
799007653446065_1495057773841046,,Laura Meyers,video,https://www.facebook.com/libertylauraofficial/videos/1815570885392235/,2016-11-11 18:55:01,78,3,0,60,5,1,12,0,0
799007653446065_1494917557188401,What now?,Dear Liberals: Welcome Back to The Resistance [VIDEO],link,http://libertyviral.com/dear-liberals-welcome-back-resistance-video/#axzz4PKeamzke,2016-11-11 15:22:35,81,5,179,71,8,0,2,0,0
799007653446065_1494897673857056,So there's that.,KKK to Host a Parade to Celebrate Trump's Victory,link,http://libertyviral.com/kkk-host-parade-celebrate-trumps-victory/#axzz4PKeamzke,2016-11-11 14:57:48,31,14,20,11,0,3,13,0,4
799007653446065_1494866397193517,The man has spoken.,"Ron Paul: ""NATO Has To Go"" [VIDEO]",link,http://libertyviral.com/ron-paul-nato-go-video/#axzz4PKeamzke,2016-11-11 14:14:00,155,1,48,143,11,0,1,0,0
799007653446065_1494856273861196,Helpful!,Do You Understand the Electoral College? [VIDEO],link,http://libertyviral.com/understand-electoral-college-video/#axzz4PKeamzke,2016-11-11 13:58:25,96,3,494,93,3,0,0,0,0
799007653446065_1494779337202223,'Murica af.,Bald Eagle Protects Another Until Help Arrives [VIDEO],link,http://libertyviral.com/bald-eagle-protects-another-help-arrives/#axzz4PKeamzke,2016-11-11 12:00:31,24,3,9,20,4,0,0,0,0
799007653446065_1494767473870076,<3 <3 <3,Reality Check and Colbert's Heart-to-Heart [VIDEO],link,http://libertyviral.com/reality-check-colbert-election/#axzz4PKeamzke,2016-11-11 11:44:16,28,1,28,20,6,0,2,0,0
799007653446065_1494093240604166,Why do liberals care about small government all of a sudden?,Laura Meyers,video,https://youtu.be/VnFPxToWdYI,2016-11-10 19:06:33,114,6,0,94,7,0,13,0,0
799007653446065_1493926677287489,🔥🔥🔥,"Donald Trump Singing ""All I Do is Win"" [VIDEO]",link,http://libertyviral.com/donald-trump-singing-win-video/#axzz4PKeamzke,2016-11-10 14:41:55,26,2,44,12,1,0,12,0,1
799007653446065_1493821443964679,There we go!,"Nick Sarwark to Upset Democrats: ""Stop Shaming Me, Fix Your Party""",link,http://libertyviral.com/lp-chair-republicans-democrats-stop-shaming-fix-parties/#axzz4PKeamzke,2016-11-10 12:46:14,122,2,130,111,8,0,3,0,0
799007653446065_1493667063980117,What do you think?,"Miley Cyrus Cries After Hillary Loss; ""I Accept Donald Trump"" [VIDEO]",link,http://libertyviral.com/miley-cyrus-breaks-hillary-loss-accept-donald-video/#axzz4PKeamzke,2016-11-10 10:54:16,34,26,20,17,0,0,17,0,0
799007653446065_1493210510692439,,Austin Petersen,video,https://www.facebook.com/ProducerPetersen/videos/1244099755649002/,2016-11-09 23:07:40,6,1,0,6,0,0,0,0,0
799007653446065_1493017244045099,Awesome!,Students for Liberty Wisconsin Regional Conference a Success!,link,http://libertyviral.com/the-revolution-begins-nov-9-sfl-futureoffreedom-wisconsin-regional-conference-a-success/#axzz4PKeamzke,2016-11-09 18:07:41,8,0,6,7,1,0,0,0,0
799007653446065_1493006987379458,I wonder...?,George W. and Laura Bush Did Not Vote Trump or Hillary,link,http://libertyviral.com/who-did-george-w-bush-vote-for/#axzz4PKeamzke,2016-11-09 17:52:32,47,6,26,38,5,1,2,0,1
799007653446065_1492955947384562,,Laura Meyers,link,https://www.facebook.com/libertylauraofficial/posts/1814376182178372,2016-11-09 16:37:46,421,12,0,334,17,1,69,0,0
799007653446065_1492936484053175,We know it's tough.,Post Election Blues? Here Are 10 Ways to Act on Your Libertarian Leanings,link,http://libertyviral.com/10-ways-to-act-on-your-libertarian-leanings/#axzz4PN6eCqIQ,2016-11-09 16:11:07,30,1,15,27,3,0,0,0,0
799007653446065_1492928527387304,,OH Henri,video,https://www.facebook.com/ohhenri/videos/1726003197725327/,2016-11-09 15:58:02,187,17,0,105,9,0,65,8,0
799007653446065_1492721777407979,🔥🔥🔥,"Justin Amash: ""We're putting the band back together""",link,http://libertyviral.com/justin-amash-putting-band-back-together/#axzz4PKeamzke,2016-11-09 11:27:35,252,9,297,216,34,0,2,0,0
799007653446065_1492706894076134,,Timeline Photos,photo,https://www.facebook.com/libertyviral/photos/a.868419443171552.1073741828.799007653446065/1492706894076134/?type=3,2016-11-09 11:11:21,1464,21,408,1249,116,1,94,2,2
799007653446065_1492258224121001,BREAKING:,BREAKING: Presidential Race Called for Donald Trump,link,http://libertyviral.com/breaking-presidential-race-called-for-donald-trump/,2016-11-09 02:44:25,10,1,0,8,0,1,0,0,1
799007653446065_1492004747479682,"You see, a libertarian would just leave the poor girl alone.",Did Taylor Swift Vote for Donald Trump?,link,http://libertyviral.com/did-taylor-swift-vote-for-donald-trump/#axzz4PKeamzke,2016-11-08 19:01:25,22,2,9,21,1,0,0,0,0
799007653446065_1491940107486146,This is where you can watch later this evening to see if Gary Johnson polls at 5% in each state!,Watch Live: Gary Johnson Election Results by State!,link,http://libertyviral.com/watch-live-gary-johnson-vote-percentages-state-link/#axzz4PKeamzke,2016-11-08 17:37:09,34,7,26,32,2,0,0,0,0
799007653446065_1491847287495428,"Best ""Thug Life"" video of the day!",Gary Johnson Voter SLAMS Hillary Voter in Debate [VIDEO],link,http://libertyviral.com/thug-life-gary-johnson-voter-slams-hillary-voter-debate-video/#axzz4PKeamzke,2016-11-08 15:03:00,69,4,98,56,8,1,4,0,0
799007653446065_1491830910830399,Well now.,Donald Trump Booed As He Arrives at Polling Place [VIDEO],link,http://libertyviral.com/donald-trump-booed-as-he-arrives-at-his-polling-place-video/#axzz4PKeamzke,2016-11-08 14:32:39,11,2,9,5,0,0,6,0,0
799007653446065_1491750054171818,"Ah, a simpler time.",Election Throwback: Huckabee Parodies Adele's,link,http://libertyviral.com/election-throwback-huckabee-parodies-adeles-hello-day-before-iowa-caucus/#axzz4PN6eCqIQ,2016-11-08 12:42:15,6,0,1,5,0,0,1,0,0
799007653446065_1491740277506129,That's dedication!,Woman in Labor Stops at Polling Place En Route to the Hospital [PHOTOS],link,http://libertyviral.com/woman-in-labor-stops-at-polling-place-en-route-to-the-hospital-photos/#axzz4PN6eCqIQ,2016-11-08 12:28:47,18,1,3,16,1,1,0,0,0
799007653446065_1491692440844246,Why did you vote?,Timeline Photos,photo,https://www.facebook.com/libertyviral/photos/a.868419443171552.1073741828.799007653446065/1491692440844246/?type=3,2016-11-08 11:23:47,5,13,2,5,0,0,0,0,0
799007653446065_1491680394178784,Oh snap.,Topless Protestors Show up to Donald Trump's Polling Place,link,http://libertyviral.com/topless-protestors-show-up-to-donald-trumps-polling-place/#axzz4PN6eCqIQ,2016-11-08 11:07:42,32,12,38,13,0,0,18,0,1
799007653446065_1491671234179700,Election Day is upon us!,Election FAQ: Where is my Polling Place and When Does it Close?,link,http://libertyviral.com/election-faq-where-is-my-polling-place-and-when-does-it-close/#axzz4PN6eCqIQ,2016-11-08 10:55:30,5,0,1,4,1,0,0,0,0
799007653446065_1491619330851557,Carey Wedler slays.,"""America Will Get the President it Deserves"" Rap [VIDEO]",link,http://libertyviral.com/america-will-get-president-deserves-rap-video/#axzz4PKeamzke,2016-11-08 09:43:43,23,0,14,22,0,1,0,0,0
799007653446065_1491615307518626,Submit your ideas!,"CONTEST: Alternative ""I Voted"" Stickers!",link,http://libertyviral.com/contest-i-voted-sticker/#axzz4PKeamzke,2016-11-08 09:37:12,1,26,3,1,0,0,0,0,0
799007653446065_1491582644188559,,Laura Meyers,photo,https://www.facebook.com/libertylauraofficial/photos/a.1616237698658889.1073741829.1610844859198173/1813510058931651/?type=3,2016-11-08 08:48:45,410,5,0,325,1,9,38,11,26
799007653446065_1491241507556006,,Austin Petersen,note,https://www.facebook.com/notes/austin-petersen/a-message-to-voters-from-a-former-presidential-candidate/1241495585909419/,2016-11-07 22:18:04,40,2,0,38,2,0,0,0,0
799007653446065_1491155427564614,,Laura Meyers,photo,https://www.facebook.com/libertylauraofficial/photos/a.1616237698658889.1073741829.1610844859198173/1813424038940253/?type=3,2016-11-07 20:20:42,115,4,0,111,0,0,4,0,0
799007653446065_1491122120901278,Here's your horoscopes for tomorrow:,Election Week Horoscopes,link,http://libertyviral.com/hor/#axzz4PN6eCqIQ,2016-11-07 19:25:04,3,1,3,3,0,0,0,0,0
799007653446065_1491115330901957,Muh roads?,Donald Trump Releases Plan to Privatize Roads and Bridges,link,http://libertyviral.com/donald-trump-releases-plan-to-privatize-roads-bridges/#axzz4PN6eCqIQ,2016-11-07 19:16:29,177,16,191,145,14,11,6,0,1
799007653446065_1490744854272338,"Ha! Gotcha, Hillary Clinton.",College Student Escorted Off Stage for Trolling Introduction of Hillary [VIDEO],link,http://libertyviral.com/college-student-escorted-off-stage-trolling-introduction-hillary/#axzz4PKeamzke,2016-11-07 09:46:06,74,4,122,52,5,0,16,0,1
799007653446065_1490719087608248,Are you ready?,10 Prepper Tips to Survive the 2016 Election Results,link,http://libertyviral.com/10preps/#axzz4PKeamzke,2016-11-07 09:11:43,22,0,50,19,0,0,3,0,0
799007653446065_1489419874404836,ICYMI,"White Woman Holds ""Blacks for Trump"" Sign",link,http://libertyviral.com/white-woman-holds-blacks-trump-sign/#axzz4P6RV7Op2,2016-11-06 10:00:25,25,9,1,6,0,0,19,0,0
799007653446065_1489121091101381,,Austin Petersen,link,https://www.facebook.com/ProducerPetersen/posts/1238483806210597,2016-11-05 17:05:26,133,5,0,124,3,1,5,0,0
799007653446065_1489107777769379,ICYMI,Did This Girl Deserve This Bodyslam? [VIDEO],link,http://libertyviral.com/girl-deserve-bodyslam-video/,2016-11-05 17:00:17,6,7,0,1,0,0,5,0,0
799007653446065_1489016091111881,ICYMI,Top 10 Greatest Malik Obama Tweets,link,http://libertyviral.com/top-10-greatest-malik-obama-tweets/,2016-11-05 15:00:47,4,1,0,4,0,0,0,0,0
799007653446065_1488386391174851,ICYMI,BREAKING: CNN Cuts Ties With Donna Brazile,link,http://libertyviral.com/breaking-cnn-cuts-ties-with-donna-brazile/#axzz4P6RV7Op2,2016-11-05 13:00:57,7,1,0,5,1,1,0,0,0
799007653446065_1488385501174940,ICYMI,People on Street Praise Obamacare's High Premiums [VIDEO],link,http://libertyviral.com/people-street-praise-obamacares-high-premiums-video/#axzz4P6RV7Op2,2016-11-05 11:00:16,14,1,10,5,0,2,5,1,1
799007653446065_1488384177841739,ICYMI,Man Rages on Cops After They Tased His Wife [VIDEO],link,http://libertyviral.com/man-rages-cops-tased-wife-video/#axzz4P6RV7Op2,2016-11-05 09:00:40,4,1,4,2,0,1,0,0,1
799007653446065_1488357124511111,,Lokipac,video,https://www.facebook.com/lokipac/videos/233936450356746/,2016-11-04 21:56:22,16,2,0,14,2,0,0,0,0
799007653446065_1488184151195075,,Timeline Photos,photo,https://www.facebook.com/libertyviral/photos/a.868419443171552.1073741828.799007653446065/1488184151195075/?type=3,2016-11-04 17:35:50,136,3,30,111,7,0,18,0,0
799007653446065_1487985447881612,Remember when?,Babes for Liberty Respond to Trump Girls With Sexy Comeback,link,http://libertyviral.com/babes-for-liberty-respond-to-trump-girls-with-sexy-comeback/#axzz4OaYzngmG,2016-11-04 12:35:28,6,1,6,6,0,0,0,0,0
799007653446065_1487981907881966,ICYMI:,People on Street Praise Obamacare's High Premiums [VIDEO],link,http://libertyviral.com/people-street-praise-obamacares-high-premiums-video/#axzz4OaYzngmG,2016-11-04 12:31:51,24,3,18,9,0,4,11,0,0
799007653446065_1487980924548731,Flashback Friday!,NRA Facebook Responds to Mob of Gary Johnson Supporters,link,http://libertyviral.com/nra-facebook-responds-to-mob-of-gary-johnson-supporters/#axzz4OaYzngmG,2016-11-04 12:30:07,22,4,21,17,0,0,5,0,0
799007653446065_1487781761235314,,Timeline Photos,photo,https://www.facebook.com/libertyviral/photos/a.868419443171552.1073741828.799007653446065/1487781761235314/?type=3,2016-11-04 08:50:14,56,64,93,37,0,0,19,0,0
799007653446065_1487756381237852,BREAKING:,"Gary Johnson: Libertarians Upset about Weld Need to ""Take a Chill Pill"" [VIDEO]",link,http://libertyviral.com/gary-johnson-libertarians-mad-weld-need-take-chill-pill/#axzz4OaYzngmG,2016-11-04 08:19:04,69,25,58,47,6,2,5,0,9
799007653446065_1487346624612161,,Timeline Photos,photo,https://www.facebook.com/libertyviral/photos/a.868419443171552.1073741828.799007653446065/1487346624612161/?type=3,2016-11-03 21:16:42,773,51,45,17,116,5,527,32,76
799007653446065_1487316551281835,UPDATE:,UPDATE: Johnson Campaign Cancels Weld Event After Party Withdrawl,link,http://libertyviral.com/update-johnson-campaign-cancels-weld-event-after-party-withdrawl/#axzz4OzsriW53,2016-11-03 20:38:23,120,19,92,73,3,9,29,6,0
799007653446065_1487176894629134,What do you think?,Gary Johnson: Libertarian Party Should Accept Matching Funds,link,http://libertyviral.com/gary-johnson-libertarian-party-accept-matching-funds/#axzz4OaYzngmG,2016-11-03 17:03:56,15,9,17,14,1,0,0,0,0
799007653446065_1487109457969211,"BREAKING: Hillary Clinton's campaign manager revealed to have encouraged ""grounding Bernie Sanders to a pulp"" during the primaries.","Podesta Email: ""Ground Bernie Sanders to a Pulp""",link,http://libertyviral.com/wikileak-podesta-email-ground-bernie-sanders-pulp/#axzz4OaYzngmG,2016-11-03 15:29:42,15,0,8,12,0,0,3,0,0
799007653446065_1486983574648466,BREAKING:,Libertarian Party of Rhode Island Withdraws from Weld Rally,link,http://libertyviral.com/libertarian-party-rhode-island-withdraws-weld-rally/#axzz4OaYzngmG,2016-11-03 12:37:23,74,8,41,55,6,2,11,0,0
799007653446065_1486847034662120,That's not good. What do you think?,"Man Calls Out Bill Weld at Rally, ""Screw You!"" [VIDEO]",link,http://libertyviral.com/man-calls-bill-weld-qa-rally-screw-video/#axzz4OaYzngmG,2016-11-03 09:46:08,43,11,33,30,5,1,6,0,1
799007653446065_1486833954663428,Wtf?,"Mother Injects Children With Heroin, Calls It ""Sleepy Juice""",link,http://libertyviral.com/mother-injects-her-three-children-heroin-calls-it-feel-good-medicine-and-sleepy-juice/#axzz4OaYzngmG,2016-11-03 09:28:00,17,1,10,4,0,0,0,2,11
799007653446065_1486032138076943,Uh oh! What do you think of the petition to recall Bill Weld?,Petition to Recall Vice Presidential Candidate Bill Weld,link,http://libertyviral.com/petition-recall-vice-presidential-candidate-bill-weld/#axzz4OaYzngmG,2016-11-02 16:14:42,245,50,83,205,15,1,23,1,0
799007653446065_1485812951432195,Ohh snap! #DraftOurDaughters,Chilling New #DraftOurDaughters Anti-Hillary Ad [VIDEO],link,http://libertyviral.com/chilling-draftourdaughters-anti-hillary-ad-video/#axzz4OaYzngmG,2016-11-02 10:45:20,22,0,32,16,0,0,4,2,0
799007653446065_1485802861433204,That's not good.,Bill Weld on Wikipedia: 'Destroyer of Libertarian Party',link,http://libertyviral.com/bill-weld-wikipedia-destroyer-libertarian-party/#axzz4OaYzngmG,2016-11-02 10:27:29,122,11,27,73,4,0,37,3,5
799007653446065_1485792131434277,"Well now that does make sense, right?","""Sell Drugz"" Rapper Charged with Selling Drugs",link,http://libertyviral.com/sell-drugz-rapper-charged-with-selling-drugs/#axzz4OaYzngmG,2016-11-02 10:09:20,11,1,4,3,0,0,8,0,0
799007653446065_1485777181435772,Liberty Viral cannot officially comment on the recent events that have led to our employee strike. All we can request is that Hillary Clinton pay what we are owed.,Liberty Viral Writers Strike Over Back Pay from Hillary Clinton,link,http://libertyviral.com/lv-writers-strike-over-back-wages-from-hrc/#axzz4OaYzngmG,2016-11-02 09:51:25,23,2,9,7,0,0,16,0,0
799007653446065_1485446118135545,Oh snap! Check out the videos.,"Kennedy BLASTS Gary Johnson on Bill Weld, He's Left Speechless",link,http://libertyviral.com/host-of-kennedy-blasts-gary-johnson-on-bill-weld-to-his-face/#axzz4OaYzngmG,2016-11-02 00:33:32,49,12,42,40,2,2,3,1,1
799007653446065_1485323701481120,Soooo.... yeah.,Bill Weld: I'm Here Vouching for Hillary Clinton [VIDEO],link,http://libertyviral.com/bill-weld-im-vouching-hillary-clinton-video/#axzz4OaYzngmG,2016-11-01 21:39:30,87,40,244,25,1,5,11,2,43
799007653446065_1485100261503464,Hmm... tell us what you think!,Arnold Schwarzenegger: Pollution Kills More People than War [VIDEO],link,http://libertyviral.com/arnold-schwarzenegger-pollution-kills-people-war-video/#axzz4OaYzngmG,2016-11-01 15:55:40,4,6,1,4,0,0,0,0,0
799007653446065_1485064738173683,Oops.,Republicans Are The New Social Justice Warriors,link,http://libertyviral.com/republicans-new-social-justice-warriors/#axzz4OaYzngmG,2016-11-01 14:56:08,139,19,43,102,2,0,34,0,1
799007653446065_1485061548174002,Wait a minute...,5 Lies Your Teacher Told You About The Great Depression,link,http://libertyviral.com/5-lies-your-teacher-told-you-about-the-great-depression/#axzz4OaYzngmG,2016-11-01 14:50:04,50,0,203,49,1,0,0,0,0
799007653446065_1484930804853743,Hmm.. what do you think? Check it out!,A Powerful Video for Christians to Not Vote Trump [VIDEO],link,http://libertyviral.com/powerful-video-christians-not-vote-trump-video/#axzz4OaYzngmG,2016-11-01 12:04:45,27,7,19,22,5,0,0,0,0
799007653446065_1484920081521482,"And today, Rand Paul responded. Check it out!","Jim Gray says Rand Paul Has ""Wild Ass Philosophies""",link,http://libertyviral.com/jim-gray-says-rand-paul-wild-ass-philosophies-debate/#axzz4OaYzngmG,2016-11-01 11:47:45,57,5,111,50,1,0,6,0,0
799007653446065_1484888628191294,Guess it right and win an ad-free year with The Libertarian Republic!,The Libertarian Republic,link,http://bit.ly/2ejtWFL,2016-11-01 11:06:40,4,1,0,3,1,0,0,0,0
799007653446065_1484881958191961,Ha!,"Sarwark: No One is Giving ""Expensive and Good"" Edibles to Your Kids",link,http://libertyviral.com/sarwark-no-one-giving-expensive-good-marijuana-edibles-kids/#axzz4OaYzngmG,2016-11-01 11:00:05,5,0,6,5,0,0,0,0,0
799007653446065_1484875038192653,"Rustlin' jimmies there, Governor.","John Kasich Ditches Donald, Writes In McCain Instead",link,http://libertyviral.com/kasich-skips-the-donald-votes-mccain/#axzz4OaYzngmG,2016-11-01 10:48:52,29,8,28,17,3,0,7,0,2
799007653446065_1484196064927217,No step on snek!,NO STEP: Loki PAC Releases First Ad Touting Path To Presidency for Gov. Gary Johnson,link,http://libertyviral.com/no-step-loki-pac-releases-first-ad-touting-path-presidency-gov-gary-johnson/?utm_source=facebook&utm_medium=social&utm_campaign=SocialWarfare,2016-10-31 17:43:06,71,4,35,65,4,0,2,0,0
799007653446065_1484023301611160,,Laura Meyers,photo,https://www.facebook.com/libertylauraofficial/photos/a.1616237698658889.1073741829.1610844859198173/1809627805986543/?type=3,2016-10-31 13:57:17,36,3,0,29,6,1,0,0,0
799007653446065_1484007788279378,,Lokipac,video,https://www.facebook.com/lokipac/videos/233936450356746/,2016-10-31 13:32:08,21,0,0,21,0,0,0,0,0
799007653446065_1483977788282378,"Haha! Smooth move, Google.","Google Shows Hillary Clinton for ""Pathological Lying"" Search Results",link,http://libertyviral.com/google-shows-hillary-clinton-pathological-lying-search-results/#axzz4OaYzngmG,2016-10-31 12:49:26,62,2,47,49,0,2,10,1,0
799007653446065_1483939448286212,BREAKING!,BREAKING: CNN Cuts Ties With Donna Brazile,link,http://libertyviral.com/breaking-cnn-cuts-ties-with-donna-brazile/#axzz4ObLXR2Fs,2016-10-31 12:10:05,72,4,119,56,1,4,11,0,0
799007653446065_1482932631720227,"Oh, brother...",Top 10 Greatest Malik Obama Tweets,link,http://libertyviral.com/top-10-greatest-malik-obama-tweets/,2016-10-30 15:13:59,25,2,30,22,1,0,2,0,0
799007653446065_1482836895063134,🔥🔥🔥🔥🔥🔥🔥,Evan McMullin Tweets Serious Fire at Donald Trump,link,http://libertyviral.com/evan-mcmullin-calls-trump-authoritarian-life-long-liberal/#axzz4OaYzngmG,2016-10-30 13:21:23,23,6,16,19,0,1,3,0,0
799007653446065_1482817315065092,Oops!,Photo Shows Media Hypocrisy about James Comey,link,http://libertyviral.com/photo-shows-irony-republican-support-james-comey/#axzz4OaYzngmG,2016-10-30 12:55:02,6,1,16,6,0,0,0,0,0
799007653446065_1482778768402280,Woah.,Man Rages on Cops After They Tased His Wife [VIDEO],link,http://libertyviral.com/man-rages-cops-tased-wife-video/#axzz4OaYzngmG,2016-10-30 12:07:28,25,0,24,17,4,3,1,0,0
799007653446065_1481995965147227,"ICYMI, who still hears these today?",Top 7 Stupid Feminist Quotes Of 2014 - Liberty Viral,link,http://libertyviral.com/top-7-stupid-feminist-quotes-of-2014/#axzz4OPyU7HEq,2016-10-29 18:47:11,11,0,4,7,1,2,0,0,1
799007653446065_1481142625232561,TBT - Who do you think should be included on the list?,20 Of The Hottest Libertarian Women Alive - Liberty Viral,link,http://libertyviral.com/20-of-the-hottest-libertarian-women-alive/#axzz4OPyU7HEq,2016-10-29 09:05:54,46,26,13,40,4,0,0,0,2
799007653446065_1480853531928137,Karma?,Trump Supporter Sets Trap for People Destroying Yard Signs,link,http://libertyviral.com/trump-supporter-set-trap-people-destroying-signs/#axzz4NwjqZj43,2016-10-28 16:34:06,28,4,19,20,0,0,8,0,0
799007653446065_1480843125262511,ICYMI:,"This Meme Destroys the ""But the Supreme Court"" Argument",link,http://libertyviral.com/meme-destroys-supreme-court-argument/#axzz4NwjqZj43,2016-10-28 16:23:45,16,1,37,14,0,0,0,1,1
799007653446065_1480831538597003,I wonder how that works.,"White Woman Holds ""Blacks for Trump"" Sign",link,http://libertyviral.com/white-woman-holds-blacks-trump-sign/#axzz4NwjqZj43,2016-10-28 16:20:24,13,7,9,5,0,0,8,0,0
799007653446065_1480815901931900,ICYMI:,This is The Tomi Lahren Starter Pack,link,http://libertyviral.com/tomi-lahren-starter-pack/#axzz4NwjqZj43,2016-10-28 16:03:13,26,3,7,18,0,0,8,0,0
799007653446065_1480809368599220,ICYMI:,"""Go F**k Yourself You Communist Turd"" Senator Says to Anti-Free Speech Democrat",link,http://libertyviral.com/go-fk-yourself-you-communist-turd-senator-says-to-anti-free-speech-democrat/#axzz4NwjqZj43,2016-10-28 15:59:01,225,10,508,162,25,5,33,0,0
799007653446065_1480807305266093,Throwback!,Trump Supporters Threaten to Kill Utah RNC #NeverTrump Delegate,link,http://libertyviral.com/trump-supporters-threaten-kill-utah-rnc-delegate/#axzz4NwjqZj43,2016-10-28 15:55:44,25,0,5,14,0,0,1,4,6
799007653446065_1480784751935015,We must demand answers.,"Gary Johnson: ""Why Did They Have to Kill Harambe?"" [VIDEO]",link,http://libertyviral.com/gary-johnson-kill-harambe-video/#axzz4NwjqZj43,2016-10-28 15:26:07,49,11,245,40,2,0,7,0,0
799007653446065_1480778231935667,Gotcha!,2006: Hillary Clinton Proposes Rigging Palestinian Election [AUDIO],link,http://libertyviral.com/2006-hillary-clinton-proposes-rigging-palestinian-election/#axzz4NwjqZj43,2016-10-28 15:17:14,16,1,11,12,0,0,0,0,4
799007653446065_1480758381937652,An op-ed by Liberty Laura. What are your thoughts?,I'm a Woman and I Don't Need Hillary Clinton,link,http://libertyviral.com/im-woman-dont-support-hillary-clinton/#axzz4NwjqZj43,2016-10-28 14:38:41,67,1,83,59,8,0,0,0,0
799007653446065_1480723615274462,Do you laugh or do you cry?,Hillary Clinton #DraftOurDaughters Campaign for Endless War,link,http://libertyviral.com/hillary-clinton-draftourdaughters-campaign-endless-war/#axzz4NwjqZj43,2016-10-28 13:39:37,45,0,494,37,0,2,5,0,1
799007653446065_1480623235284500,,Testimony: Why Adam Kokesh is a Total Fraud,link,http://libertyviral.com/11885-2/#axzz4NwjqZj43,2016-10-28 11:10:25,42,9,73,30,0,9,2,1,0
799007653446065_1480616365285187,Niiiiiiice.,Obama's Golf Trip with Tiger Woods Cost Taxpayers $3.6 Million,link,http://libertyviral.com/obamas-golf-trip-with-tiger-woods-cost-more-than-3-million-to-taxpayers/#axzz4NwjqZj43,2016-10-28 10:58:35,44,2,19,18,0,5,3,3,15
799007653446065_1479904518689705,"In a recent WikiLeak email drop, messages from Hillary's Campaign Vice Chairwoman blames Hillary for her own scandals.","Huma Abedin on Hillary's Fraud: ""She Created This Mess, She Knows it""",link,http://libertyviral.com/huma-abedin-fraud-knows-it/#axzz4NwjqZj43,2016-10-27 17:18:55,36,2,69,30,1,1,2,0,2
799007653446065_1479735872039903,"This video has gone viral, raising questions as to why the officer's actions would be justifiable.",Police Officer Stomps on Face of Compliant Citizen [VIDEO],link,http://libertyviral.com/police-officer-stomps-face-compliant-citizen-video/#axzz4NwjqZj43,2016-10-27 13:10:27,25,5,17,14,0,1,0,0,10
799007653446065_1479705895376234,Wut.,Trump Speaks Hindi in New Commercial [VIDEO],link,http://libertyviral.com/trump-speaks-hindu-in-new-commercial-video/#axzz4NwjqZj43,2016-10-27 12:14:27,0,0,2,0,0,0,0,0,0
