status_id,status_message,link_name,status_type,status_link,status_published,num_reactions,num_comments,num_shares,num_likes,num_loves,num_wows,num_hahas,num_sads,num_angrys
825897147516847_985139124925981,Dark days are about to come: U.S. after election,Dark days are about to come: U.S. after election,link,http://www.usviewer.com/index.jsp?fkeyid&siteid=21034&pageid=32105&newsview=32127,2016-11-13 16:47:48,0,0,0,0,0,0,0,0,0
825897147516847_985138148259412,Unease at Texas/Mexico border following Trump?s presidency,Unease at Texas/Mexico border following Trump?s presidency,link,http://www.usviewer.com/index.jsp?fkeyid&siteid=21034&pageid=32105&newsview=32142,2016-11-13 16:47:10,0,0,0,0,0,0,0,0,0
825897147516847_985137868259440,"Hillary finally takes a stand, blames FBI for Trump's presidency","Hillary finally takes a stand, blames FBI for Trump's presidency",link,http://www.usviewer.com/index.jsp?fkeyid&siteid=21034&pageid=32105&newsview=32120,2016-11-13 16:46:15,0,0,0,0,0,0,0,0,0
825897147516847_983832751723285,Trump presidency protesters are here to stay,Trump presidency protesters are here to stay,link,http://www.usviewer.com/index.jsp?fkeyid&siteid=21034&pageid=32105&newsview=32065,2016-11-12 10:48:14,0,0,5,0,0,0,0,0,0
825897147516847_983832361723324,Trump?s prospective cabinet: Facts or wild guesses?,Trump?s prospective cabinet: Facts or wild guesses?,link,http://www.usviewer.com/index.jsp?fkeyid&siteid=21034&pageid=32105&newsview=32070,2016-11-12 10:47:43,0,0,0,0,0,0,0,0,0
825897147516847_983832141723346,Story of 3 days of anti-Trump protests,Story of 3 days of anti-Trump protests,link,http://www.usviewer.com/index.jsp?fkeyid&siteid=21034&pageid=32105&newsview=32069,2016-11-12 10:47:24,0,0,0,0,0,0,0,0,0
825897147516847_983831525056741,Donald Trump to shatter the image of U.S.-led world,Donald Trump to shatter the image of U.S.-led world,link,http://www.usviewer.com/index.jsp?fkeyid&siteid=21034&pageid=32105&newsview=32067,2016-11-12 10:46:56,0,0,0,0,0,0,0,0,0
825897147516847_981030305336863,Wolf of wall street defeated by celebrity millionaire: Trump violates expectations,Wolf of wall street defeated by celebrity millionaire: Trump violates expectations,link,http://www.usviewer.com/index.jsp?fkeyid&siteid=21034&pageid=32105&newsview=31932,2016-11-09 10:02:29,0,0,0,0,0,0,0,0,0
825897147516847_977894872317073,November 8 election: Apocalyptic or not?,November 8 election: Apocalyptic or not?,link,http://www.usviewer.com/index.jsp?fkeyid&siteid=21034&pageid=32105&newsview=31735,2016-11-06 09:18:14,0,0,34,0,0,0,0,0,0
825897147516847_977894598983767,Mexican immigrants? need of dollars might make them go Clinton,Mexican immigrants? need of dollars might make them go Clinton,link,http://www.usviewer.com/index.jsp?fkeyid&siteid=21034&pageid=32105&newsview=31737,2016-11-06 09:17:49,0,0,0,0,0,0,0,0,0
825897147516847_977894138983813,Trump hustled away from stage following shooting false alarm,Trump hustled away from stage following shooting false alarm,link,http://www.usviewer.com/index.jsp?fkeyid&siteid=21034&pageid=32105&newsview=31738,2016-11-06 09:17:24,0,0,0,0,0,0,0,0,0
825897147516847_977893342317226,"What is going to happen to ""On-Pause"" immigrants after November 8",What is going to happen to,link,http://www.usviewer.com/index.jsp?fkeyid&siteid=21034&pageid=32105&newsview=31666,2016-11-06 09:16:25,0,0,0,0,0,0,0,0,0
825897147516847_977889568984270,Three dead in horrendous New Jersey stabbing incident,Three dead in horrendous New Jersey stabbing incident,link,http://www.usviewer.com/index.jsp?fkeyid&siteid=21034&pageid=32105&newsview=31744,2016-11-06 09:12:02,0,0,0,0,0,0,0,0,0
825897147516847_977222812384279,Republicans' cry for fair election: From myth to reality,Republicans' cry for fair election: From myth to reality,link,http://www.usviewer.com/index.jsp?fkeyid&siteid=21034&pageid=32105&newsview=31667,2016-11-05 17:03:56,0,0,0,0,0,0,0,0,0
825897147516847_977222629050964,Al Qaeda imminent attack on election day: U.S. officials,Al Qaeda imminent attack on election day: U.S. officials,link,http://www.usviewer.com/index.jsp?fkeyid&siteid=21034&pageid=32105&newsview=31661,2016-11-05 17:03:25,0,0,0,0,0,0,0,0,0
825897147516847_974430292663531,How to get away with Email scandal? Clinton?s aide takes the stage,How to get away with Email scandal? Clinton?s aide takes the stage,link,http://www.usviewer.com/index.jsp?fkeyid&siteid=21034&pageid=32105&newsview=31527,2016-11-02 16:27:58,0,0,19,0,0,0,0,0,0
825897147516847_974429795996914,FBI directors have never been as much important as James Comey,FBI directors have never been as much important as James Comey,link,http://www.usviewer.com/index.jsp?fkeyid&siteid=21034&pageid=32105&newsview=31532,2016-11-02 16:27:20,0,0,0,0,0,0,0,0,0
825897147516847_974429419330285,Benghazi warlord woes to defeat ISIS: Clinton?s recent claim,Benghazi warlord woes to defeat ISIS: Clinton?s recent claim,link,http://www.usviewer.com/index.jsp?fkeyid&siteid=21034&pageid=32105&newsview=31531,2016-11-02 16:26:40,0,0,0,0,0,0,0,0,0
825897147516847_974428285997065,Hillary Clinton and Wall Street: Friends or foes?,Hillary Clinton and Wall Street: Friends or foes?,link,http://www.usviewer.com/index.jsp?fkeyid&siteid=21034&pageid=32105&newsview=31528,2016-11-02 16:24:38,0,0,0,0,0,0,0,0,0
825897147516847_972530012853559,No smoke without a fire: Suspicious fire near N. Dakota pipeline,No smoke without a fire: Suspicious fire near N. Dakota pipeline,link,http://www.usviewer.com/index.jsp?fkeyid&siteid=21034&pageid=32105&newsview=31381,2016-10-31 16:14:54,0,0,0,0,0,0,0,0,0
825897147516847_972528529520374,Will FBI unravel Clinton Emails' mystery before election day?,Will FBI unravel Clinton Emails' mystery before election day?,link,http://www.usviewer.com/index.jsp?fkeyid&siteid=21034&pageid=32105&newsview=31372,2016-10-31 16:13:45,0,0,0,0,0,0,0,0,0
825897147516847_971419092964651,Plight of trump and Paul Ryan?s predicament,Plight of trump and Paul Ryan?s predicament,link,http://www.usviewer.com/index.jsp?fkeyid&siteid=21034&pageid=32105&newsview=31314,2016-10-30 11:14:36,0,0,16,0,0,0,0,0,0
825897147516847_971418486298045,Democrats urge FBI director James Comey to lay off investigating Clinton's Emails,Democrats urge FBI director James Comey to lay off investigating Clinton's Emails,link,http://www.usviewer.com/index.jsp?fkeyid&siteid=21034&pageid=32105&newsview=31307,2016-10-30 11:13:52,0,0,0,0,0,0,0,0,0
825897147516847_971418116298082,Trump makes the most of Clinton Email controversy in Arizona rally,Trump makes the most of Clinton Email controversy in Arizona rally,link,http://www.usviewer.com/index.jsp?fkeyid&siteid=21034&pageid=32105&newsview=31300,2016-10-30 11:13:23,0,0,0,0,0,0,0,0,0
825897147516847_969687089804518,Is it that hard to say who the victor is? Pollsters on Nov. 8 probable results,Is it that hard to say who the victor is? Pollsters on Nov. 8 probable results,link,http://www.usviewer.com/index.jsp?fkeyid&siteid=21034&pageid=32105&newsview=31193,2016-10-28 12:26:49,0,0,0,0,0,0,0,0,0
825897147516847_969686349804592,What is U.S. political unpredictability doing to world leaders?,What is U.S. political unpredictability doing to world leaders?,link,http://www.usviewer.com/index.jsp?fkeyid&siteid=21034&pageid=32105&newsview=31197,2016-10-28 12:26:00,0,0,0,0,0,0,0,0,0
825897147516847_969685959804631,U.S. economic growth hits 2-year high in summer 2016,U.S. economic growth hits 2-year high in summer 2016,link,http://www.usviewer.com/index.jsp?fkeyid&siteid=21034&pageid=32105&newsview=31196,2016-10-28 12:25:31,0,0,0,0,0,0,0,0,0
825897147516847_969685666471327,98 lucky prisoners: Obama?s last commutations before leaving office,98 lucky prisoners: Obama?s last commutations before leaving office,link,http://www.usviewer.com/index.jsp?fkeyid&siteid=21034&pageid=32105&newsview=31195,2016-10-28 12:25:09,0,0,0,0,0,0,0,0,0
825897147516847_969685056471388,The Republican?s last resort: Trump slams Hillary?s trade policies,The Republican?s last resort: Trump slams Hillary?s trade policies,link,http://www.usviewer.com/index.jsp?fkeyid&siteid=21034&pageid=32105&newsview=31194,2016-10-28 12:24:18,0,0,0,0,0,0,0,0,0
825897147516847_969684746471419,Brzezinski's plan newly implemented by Hillary Clinton to change the Russian system and to remove Putin,Brzezinski's plan newly implemented by Hillary Clinton to change the Russian system and to remove Putin,link,http://www.usviewer.com/index.jsp?fkeyid&siteid=21034&pageid=32105&newsview=31125,2016-10-28 12:23:46,0,0,0,0,0,0,0,0,0
825897147516847_968259569947270,Trump worried about Clinton's Syria plan: Harbinger of WW3,Trump worried about Clinton's Syria plan: Harbinger of WW3,link,http://www.usviewer.com/index.jsp?fkeyid&siteid=21034&pageid=32105&newsview=31118,2016-10-26 14:45:45,0,0,0,0,0,0,0,0,0
825897147516847_966780893428471,Clinton thinks Trump refuse to accept defeat,Clinton thinks Trump refuse to accept defeat,link,http://www.usviewer.com/index.jsp?fkeyid&siteid=21034&pageid=32105&newsview=31013,2016-10-24 14:42:30,1,0,0,1,0,0,0,0,0
825897147516847_966780473428513,Where does U.S. stand on Philippine separation issue?: U.S. diplomat emergency travel,Where does U.S. stand on Philippine separation issue?: U.S. diplomat emergency travel,link,http://www.usviewer.com/index.jsp?fkeyid&siteid=21034&pageid=32105&newsview=31019,2016-10-24 14:42:04,0,0,0,0,0,0,0,0,0
825897147516847_966780203428540,Obama talks about senate race and Hillary Clinton in Nevada,Obama talks about senate race and Hillary Clinton in Nevada,link,http://www.usviewer.com/index.jsp?fkeyid&siteid=21034&pageid=32105&newsview=31014,2016-10-24 14:41:39,0,0,0,0,0,0,0,0,0
825897147516847_966779926761901,Totally unprepared: What if an earthquake hits Washington?,Totally unprepared: What if an earthquake hits Washington?,link,http://www.usviewer.com/news/internal/31018/Totally+unprepared:+What+if+an+earthquake+hits+Washington?+,2016-10-24 14:41:14,0,0,0,0,0,0,0,0,0
825897147516847_966779673428593,N. Dakota pipeline rallies go on in L.A.,N. Dakota pipeline rallies go on in L.A.,link,http://www.usviewer.com/news/internal/31017/N.+Dakota+pipeline+rallies+go+on+in+L.A.+,2016-10-24 14:40:48,1,0,1,0,1,0,0,0,0
825897147516847_966779436761950,High casualty rate for a disastrous bus crash in California,High casualty rate for a disastrous bus crash in California,link,http://www.usviewer.com/news/internal/31015/High+casualty+rate+for+a+disastrous+bus+crash+in+California,2016-10-24 14:40:23,0,0,0,0,0,0,0,0,0
825897147516847_965314766908417,Wikileaks' sword of Damocles hung over U.S. candidates' heads,Wikileaks' sword of Damocles hung over U.S. candidates' heads,link,http://www.usviewer.com/index.jsp?fkeyid&siteid=21034&pageid=32105&newsview=30851,2016-10-22 14:56:43,0,0,0,0,0,0,0,0,0
825897147516847_965312736908620,Who cares about the winner of final debate?,Who cares about the winner of final debate?,link,http://www.usviewer.com/index.jsp?fkeyid&siteid=21034&pageid=32105&newsview=30862,2016-10-22 14:52:54,0,0,0,0,0,0,0,0,0
825897147516847_965312150242012,Democratic campaign headquarters evacuated after detection of suspicious substance,Democratic campaign headquarters evacuated after detection of suspicious substance,link,http://www.usviewer.com/index.jsp?fkeyid&siteid=21034&pageid=32105&newsview=30843,2016-10-22 14:51:17,0,0,0,0,0,0,0,0,0
825897147516847_965311756908718,Republican outcast gains momentum again,Republican outcast gains momentum again,link,http://www.usviewer.com/index.jsp?fkeyid&siteid=21034&pageid=32105&newsview=30829,2016-10-22 14:50:46,0,0,0,0,0,0,0,0,0
825897147516847_962588493847711,Julian Assange too intimidating for U.S. election to have access to internet,Julian Assange too intimidating for U.S. election to have access to internet,link,http://www.usviewer.com/index.jsp?fkeyid&siteid=21034&pageid=32105&newsview=30686,2016-10-19 15:25:51,0,0,0,0,0,0,0,0,0
825897147516847_962588100514417,"People are listening to Donald Trump's ""Rigged Election"" claim",People are listening to Donald Trump's,link,http://www.usviewer.com/index.jsp?fkeyid&siteid=21034&pageid=32105&newsview=30682,2016-10-19 15:25:31,0,0,0,0,0,0,0,0,0
825897147516847_962585827181311,Baqghdad demands Washington to entrap ISIS militants in Mosul,Baqghdad demands Washington to entrap ISIS militants in Mosul,link,http://www.usviewer.com/index.jsp?fkeyid&siteid=21034&pageid=32105&newsview=30679,2016-10-19 15:24:55,0,0,0,0,0,0,0,0,0
825897147516847_962585403848020,Ny officer shoots old woman to kill off-duty,Ny officer shoots old woman to kill off-duty,link,http://www.usviewer.com/index.jsp?fkeyid&siteid=21034&pageid=32105&newsview=30675,2016-10-19 15:24:39,0,0,0,0,0,0,0,0,0
825897147516847_962585173848043,Denouncement begins at home: Ivanka Trump on her dad's sexism,Denouncement begins at home: Ivanka Trump on her dad's sexism,link,http://www.usviewer.com/news/internal/30683/Denouncement+begins+at+home:+Ivanka+Trump+on+her+dad's+sexism,2016-10-19 15:24:16,0,0,0,0,0,0,0,0,0
825897147516847_962584647181429,Baqghdad demands Washington to entrap ISIS militants in Mosul,Baqghdad demands Washington to entrap ISIS militants in Mosul,link,http://www.usviewer.com/news/internal/30679/Baqghdad+demands+Washington+to+entrap+ISIS+militants+in+Mosul+,2016-10-19 15:23:04,0,0,0,0,0,0,0,0,0
825897147516847_962584180514809,Washington concerned about Yemen missile maneuver,Washington concerned about Yemen missile maneuver,link,http://www.usviewer.com/news/internal/30622/Washington+concerned+about+Yemen+missile+maneuver,2016-10-18 03:30:00,0,0,0,0,0,0,0,0,0
825897147516847_960326984073862,North Korea new missile test under pentagon?s radar,North Korea new missile test under pentagon?s radar,link,http://www.usviewer.com/index.jsp?fkeyid&siteid=21034&pageid=32105&newsview=30444,2016-10-16 17:56:41,0,0,0,0,0,0,0,0,0
825897147516847_960326710740556,Trump reiterates his ?Clinton-imprisonment? statement,Trump reiterates his ?Clinton-imprisonment? statement,link,http://www.usviewer.com/index.jsp?fkeyid&siteid=21034&pageid=32105&newsview=30477,2016-10-16 17:56:09,0,0,0,0,0,0,0,0,0
825897147516847_960326457407248,Not welcome even among his fellow republicans: Trump slammed by Ohio GOP chairman,Not welcome even among his fellow republicans: Trump slammed by Ohio GOP chairman,link,http://www.usviewer.com/index.jsp?fkeyid&siteid=21034&pageid=32105&newsview=30446,2016-10-16 17:55:32,0,0,0,0,0,0,0,0,0
825897147516847_952043488235545,Kaine vs Pence: Presidential debates goes on in VP level,Kaine vs Pence: Presidential debates goes on in VP level,link,http://www.usviewer.com/index.jsp?fkeyid&siteid=21034&pageid=32105&newsview=29887,2016-10-05 16:45:17,0,0,21,0,0,0,0,0,0
825897147516847_952038381569389,"New cyber security scandal: FBI, NSA and Yahoo","New cyber security scandal: FBI, NSA and Yahoo",link,http://www.usviewer.com/index.jsp?fkeyid&siteid=21034&pageid=32105&newsview=29865,2016-10-05 16:29:50,0,0,0,0,0,0,0,0,0
825897147516847_950411311732096,To vote or not to vote? Is it an ethical duty to vote in 2016 elections?,To vote or not to vote? Is it an ethical duty to vote in 2016 elections?,link,http://www.usviewer.com/index.jsp?fkeyid&siteid=21034&pageid=32105&newsview=29752,2016-10-03 09:55:17,0,0,0,0,0,0,0,0,0
825897147516847_950410671732160,Trump's advisers proud of his tax evasions,Trump's advisers proud of his tax evasions,link,http://www.usviewer.com/index.jsp?fkeyid&siteid=21034&pageid=32105&newsview=29741,2016-10-03 09:54:17,0,0,11,0,0,0,0,0,0
825897147516847_949712368468657,Presidential race still not over: Trump hits back,Presidential race still not over: Trump hits back,link,http://www.usviewer.com/index.jsp?fkeyid&siteid=21034&pageid=32105&newsview=29654,2016-10-02 11:36:23,0,0,0,0,0,0,0,0,0
825897147516847_949711375135423,Protests against police violence do not stop at Golden State,Protests against police violence do not stop at Golden State,link,http://www.usviewer.com/index.jsp?fkeyid&siteid=21034&pageid=32105&newsview=29656,2016-10-02 11:34:09,0,0,0,0,0,0,0,0,0
825897147516847_949711018468792,Immigrants votes? predicament,Immigrants votes? predicament,link,http://www.usviewer.com/index.jsp?fkeyid&siteid=21034&pageid=32105&newsview=29661,2016-10-02 11:33:29,0,0,15,0,0,0,0,0,0
825897147516847_946736458766248,Aftermath of presidential debate: Clinton goes on beating Trump,Aftermath of presidential debate: Clinton goes on beating Trump,link,http://www.usviewer.com/index.jsp?fkeyid&siteid=21034&pageid=32105&newsview=29439,2016-09-28 16:52:19,0,0,7,0,0,0,0,0,0
825897147516847_945840645522496,Charlotte rallies go on: Mayor must be ousted,Charlotte rallies go on: Mayor must be ousted,link,http://www.usviewer.com/index.jsp?fkeyid&siteid=21034&pageid=32105&newsview=29363,2016-09-27 11:53:45,1,0,2,1,0,0,0,0,0
825897147516847_945840308855863,Texan lawyer shot dead by police after killing 9 civilians,Texan lawyer shot dead by police after killing 9 civilians,link,http://www.usviewer.com/index.jsp?fkeyid&siteid=21034&pageid=32105&newsview=29364,2016-09-27 11:53:08,1,1,1,0,0,1,0,0,0
825897147516847_945839788855915,"U.S. presidential election: Bombastic performances, fiery debate","U.S. presidential election: Bombastic performances, fiery debate",link,http://www.usviewer.com/index.jsp?fkeyid&siteid=21034&pageid=32105&newsview=29360,2016-09-27 11:52:24,0,0,11,0,0,0,0,0,0
825897147516847_945122988927595,Trump vs. Clinton: who is going down in first presidential debate?,Trump vs. Clinton: who is going down in first presidential debate?,link,http://www.usviewer.com/index.jsp?fkeyid&siteid=21034&pageid=32105&newsview=29290,2016-09-26 09:43:53,0,0,24,0,0,0,0,0,0
825897147516847_945122798927614,U.S. supreme court reluctant to interfere in transgender rights,U.S. supreme court reluctant to interfere in transgender rights,link,http://www.usviewer.com/index.jsp?fkeyid&siteid=21034&pageid=32105&newsview=29286,2016-09-26 09:43:22,0,0,1,0,0,0,0,0,0
825897147516847_945122585594302,U.S. crime rate takes a hike in some states: FBI report,U.S. crime rate takes a hike in some states: FBI report,link,http://www.usviewer.com/index.jsp?fkeyid&siteid=21034&pageid=32105&newsview=29289,2016-09-26 09:42:46,0,0,0,0,0,0,0,0,0
825897147516847_943692602403967,Charlotte officials are not going to get away with black murder,Charlotte officials are not going to get away with black murder,link,http://www.usviewer.com/index.jsp?fkeyid&siteid=21034&pageid=32105&newsview=29153,2016-09-24 10:02:02,0,1,19,0,0,0,0,0,0
825897147516847_943692292403998,U.S. presidential debates vs. campaigns' propaganda,U.S. presidential debates vs. campaigns' propaganda,link,http://www.usviewer.com/index.jsp?fkeyid&siteid=21034&pageid=32105&newsview=29152,2016-09-24 10:01:34,0,0,4,0,0,0,0,0,0
825897147516847_943692009070693,Are aid attacks on Syria a plausible action?: U.S. dilemma,Are aid attacks on Syria a plausible action?: U.S. dilemma,link,http://www.usviewer.com/index.jsp?fkeyid&siteid=21034&pageid=32105&newsview=29148,2016-09-24 10:01:11,0,0,0,0,0,0,0,0,0
825897147516847_943691519070742,Fatal shootings at a Washington shopping center,Fatal shootings at a Washington shopping center,link,http://www.usviewer.com/index.jsp?fkeyid&siteid=21034&pageid=32105&newsview=29140,2016-09-24 10:00:41,0,0,0,0,0,0,0,0,0
825897147516847_938779296228631,Killers of two california girls arrested after almost half a century,Killers of two california girls arrested after almost half a century,link,http://www.usviewer.com/news/California/28755/Killers+of+two+california+girls+arrested+after+almost+half+a+century,2016-09-17 03:39:21,0,0,0,0,0,0,0,0,0
825897147516847_938779029561991,Sexual offenders only expelled in Tennessee,Sexual offenders only expelled in Tennessee,link,http://www.usviewer.com/index.jsp?fkeyid&siteid=21034&pageid=32105&newsview=28763,2016-09-17 03:38:41,0,0,19,0,0,0,0,0,0
825897147516847_938778056228755,Fatal shootings at Colorado cinema causes chaos,Fatal shootings at Colorado cinema causes chaos,link,http://www.usviewer.com/index.jsp?fkeyid&siteid=21034&pageid=32105&newsview=28761,2016-09-17 03:34:50,0,0,0,0,0,0,0,0,0
825897147516847_938777892895438,Killer of three Americans in Boston still alive,Facebook - Log In or Sign Up,link,https://www.facebook.com/?stype=lo&jlou=AfemPGc4EPAIne_5tfdMLemaIxr00UUsU6WOEt11DQw_DUMkS_CFqQzAQZ2oy6z3ICvzUX4g6c6E9rkWYaQT8VQFtX1W5yeOrwQN_7aUrCpNHw&smuh=5451&lh=Ac9UT6HweNReVuAf,2016-09-17 03:34:15,0,0,0,0,0,0,0,0,0
825897147516847_919364461503448,"Inhumane conditions for migrants in U.S. detention facilities raises complaints
Usviewer.com
Facebook: Us viewer",Inhumane conditions for migrants in U.S. detention facilities raises complaints,link,http://www.usviewer.com/index.jsp?fkeyid&siteid=21034&pageid=32105&newsview=26888,2016-08-20 14:30:00,1,1,1,0,0,0,0,0,1
825897147516847_919364874836740,"Army's financial accounts' balance cost U.S. trillions
Usviewer.com
Facebook: Us viewer",Army's financial accounts' balance cost U.S. trillions,link,http://www.usviewer.com/index.jsp?fkeyid&siteid=21034&pageid=32105&newsview=26870,2016-08-20 14:30:00,0,0,0,0,0,0,0,0,0
825897147516847_919365478170013,"Arizona sheriff accused of racial profiling
Usviewer.com
Facebook: Us viewer",Arizona sheriff accused of racial profiling,link,http://www.usviewer.com/index.jsp?fkeyid&siteid=21034&pageid=32105&newsview=26893,2016-08-20 14:30:00,0,0,1,0,0,0,0,0,0
825897147516847_919365251503369,"No progress for California firemen before destruction of 100 homes
Usviewer.com
Facebook: Us viewer",No progress for California firemen before destruction of 100 homes,link,http://www.usviewer.com/index.jsp?fkeyid&siteid=21034&pageid=32105&newsview=26878,2016-08-20 14:30:00,0,0,1,0,0,0,0,0,0
825897147516847_916532218453339,"Trump calls Clinton a ""bigot"", promising to protect minorities' rights
Usviewer.com
Facebook: Us viewer",Trump calls Clinton a,link,http://www.usviewer.com/index.jsp?fkeyid&siteid=21034&pageid=32105&newsview=26715,2016-08-17 10:44:32,1,0,24,1,0,0,0,0,0
825897147516847_916531981786696,"Lots of folks have lost their ""everything"" in Louisiana flood
Usviewer.com
Facebook: Us viewer",Lots of folks have lost their,link,http://www.usviewer.com/index.jsp?fkeyid&siteid=21034&pageid=32105&newsview=26729,2016-08-17 10:44:04,0,0,1,0,0,0,0,0,0
825897147516847_916531711786723,"Brush fire in Golden State forces evacuations
Usviewer.com
Facebook: Us viewer",Brush fire in Golden State forces evacuations,link,http://www.usviewer.com/index.jsp?fkeyid&siteid=21034&pageid=32105&newsview=26726,2016-08-17 10:43:32,0,0,0,0,0,0,0,0,0
825897147516847_916531435120084,"Berkeley chancellor to leave office
Usviewer.com
Facebook: Us viewer",Berkeley chancellor to leave office,link,http://www.usviewer.com/index.jsp?fkeyid&siteid=21034&pageid=32105&newsview=26717,2016-08-17 10:43:08,0,0,0,0,0,0,0,0,0
825897147516847_916531151786779,"Slayer of the New York Muslim cleric goes to trial
Usviewer.com
Facebook: Us viewer",Slayer of the New York Muslim cleric goes to trial,link,http://www.usviewer.com/index.jsp?fkeyid&siteid=21034&pageid=32105&newsview=26714,2016-08-17 10:42:35,0,0,1,0,0,0,0,0,0
825897147516847_915726811867213,"Slayer of Muslim cleric caught in New York
Usviewer.com
Facebook: Us viewer",Slayer of Muslim cleric caught in New York,link,http://www.usviewer.com/index.jsp?fkeyid&siteid=21034&pageid=32105&newsview=26617,2016-08-16 08:47:59,0,0,12,0,0,0,0,0,0
825897147516847_915726615200566,"Transgender lockers not welcome in Illinois
Usviewer.com
Facebook: Us viewer",Transgender lockers not welcome in Illinois,link,http://www.usviewer.com/index.jsp?fkeyid&siteid=21034&pageid=32105&newsview=26640,2016-08-16 08:47:25,0,0,0,0,0,0,0,0,0
825897147516847_915726218533939,"Colorado decides on Euthanasia in November
Usviewer.com
Facebook: Us viewer",Colorado decides on Euthanasia in November,link,http://www.usviewer.com/index.jsp?fkeyid&siteid=21034&pageid=32105&newsview=26634,2016-08-16 08:46:41,0,0,1,0,0,0,0,0,0
825897147516847_915725965200631,"""Hollywood arsonist"" first hearing held in LA
Usviewer.com
Facebook: Us viewer","""Hollywood arsonist"" first hearing held in LA | US VIEWER",link,http://www.usviewer.com/index.jsp?fkeyid&siteid=21034&pageid=32105&newsview=26628,2016-08-16 08:45:58,0,0,0,0,0,0,0,0,0
825897147516847_915106745262553,"Milwaukee protests end in violence
Usviewer.com
Facebook: Us viewer",Milwaukee protests end in violence,link,http://www.usviewer.com/index.jsp?fkeyid&siteid=21034&pageid=32105&newsview=26524,2016-08-15 10:06:35,0,0,8,0,0,0,0,0,0
825897147516847_915106488595912,"Bangladeshi and U.S. officials to meet over the American cyber theft
Usviewer.com
Facebook: Us viewer",Bangladeshi and U.S. officials to meet over the American cyber theft,link,http://www.usviewer.com/index.jsp?fkeyid&siteid=21034&pageid=32105&newsview=26564,2016-08-15 10:05:47,0,0,0,0,0,0,0,0,0
825897147516847_915106241929270,"Washington Monument closed for second time due to elecator technical glitch
Usviewer.com
Facebook: Us viewer",Washington Monument closed for second time due to elecator technical glitch,link,http://www.usviewer.com/index.jsp?fkeyid&siteid=21034&pageid=32105&newsview=26532,2016-08-15 10:05:12,0,0,1,0,0,0,0,0,0
825897147516847_914281125345115,"Fatal shooting of a Muslim cleric and his associate in Queens , New York
Usviewer.com
Facebook: Us viewer","Fatal shooting of a Muslim cleric and his associate in Queens , New York",link,http://www.usviewer.com/index.jsp?fkeyid&siteid=21034&pageid=32105&newsview=26462,2016-08-14 03:45:47,0,0,9,0,0,0,0,0,0
825897147516847_914280888678472,"Hoopla in a North Carolina mall following gunshots
Usviewer.com
Facebook: Us viewer",Hoopla in a North Carolina mall following gunshots,link,http://www.usviewer.com/index.jsp?fkeyid&siteid=21034&pageid=32105&newsview=26466,2016-08-14 03:44:51,0,0,1,0,0,0,0,0,0
